title,description,published date,url,publisher.href,publisher.title,full_article,images,translated
"India, Nepal Launch Cross-Border Remittance Mechanism; Links UPI, NPI - ETV Bharat","India, Nepal Launch Cross-Border Remittance Mechanism; Links UPI, NPI  ETV Bharat",2026-06-11 14:47:02,https://news.google.com/rss/articles/CBMizAFBVV95cUxNc3lGRk5LRGJpQ0lyZG9kVGpFVEs0Q2stcjUtUkpWSERuT1EwWXBnbkpzdWpFeXlZM0F5eW1OcXh4NXdwTUU5a05oTEd5VGdnb0tlclBwVHZudmdONmxMcWJrWTQtLXRSUmZnNVFvRXJIdWcyUVo0THZucTNCTWpEalJvbUFoYUNoeUdxcWNldDBYUmo4UnlpVTQ5NW5BNGJETmIxSHhpeDlLTVM4SU81dEM4dGtNRWR4ZHRCV3d6ZE1IdWNRaWZfNXVpRV_SAdIBQVVfeXFMTXltaE5XdXN6VU5jS0NjZVNlanRSc2hyMDFtZUNQSF84RXB4Z0dsYllyVnpfdHp4aml0SDJpNUFyUFNGNXh4dWRLSUNBUzVuS0NhQUxVMnFiMmd0aFpBS0t4aUQ4MjRmdEl0NHR5eEZmdXlZODlLRWcyU3Q4QWRCcVhocjhrRVBYTEs5RTA2Y24tWlM2Qjc3WVRLQTJHNEFnUER3YkRBQnNOQmdITnNid2hRVWtZSmpRSkNUc3lrTU5YeFZPc01tTXFCMGNzTEZ0SEhR?oc=5&hl=en-US&gl=US&ceid=US:en,https://www.etvbharat.com,ETV Bharat,"New Delhi: India and Nepal have launched a peer-to-peer (P2P) cross-border remittance mechanism on June 6 to enhance convenience for travellers and businesses across both countries, the finance ministry said on Thursday.

The newly operationalised system establishes a direct link between India's Unified Payments Interface (UPI) and Nepal's National Payments Interface (NPI), and enables citizens of both nations to make real-time money transfers directly via mobile banking applications and digital wallets.

""The UPI-NPI linkage represents a major advancement in financial inclusion, fostering stronger economic and digital ties between India and Nepal. This aligns perfectly with regional goals for accessible, safe, and affordable cross-border payments, reinforcing longstanding social and economic bonds,"" the ministry said in a statement.

The technical integration was executed via collaboration between NPCI International Payments Limited (NIPL), the international arm of the National Payments Corporation of India, and the Nepal Clearing House Limited (NCHL).","{'https://imgs.etvbharat.com/assets/images/logo.webp', 'https://sb.scorecardresearch.com/p?c1=2&c2=20416623&cv=4.4.0&cj=1', 'https://imgs.etvbharat.com/etvbharat/prod-images/11-06-2026/1200-675-26899688-269-26899688-1781189113849.jpg', 'https://imgs.etvbharat.com/assets/svg-image/LANGUAGE ICON.svg', 'https://imgs.etvbharat.com/assets/google_trusted.png', 'https://imgs.etvbharat.com/etvbharat/prod-images/authors/english-1716535036.jpeg'}","नई दिल्ली, मिथिला मिरर: भारत आ नेपाल दुनू देश मे यात्री आ व्यवसायी के सुविधा बढ़ाबय लेल 6 जून सं पीयर-टू-पीयर (पी टू पी) सीमा पार सं प्रेषण तंत्र शुरू केलक अछि.

नव संचालित प्रणाली भारत कें एकीकृत भुगतान इंटरफेस (यूपीआई) आ नेपाल कें राष्ट्रीय भुगतान इंटरफेस (एनपीआई) कें बीच सीधा संबंध स्थापित करयत छै, आ दूनू राष्ट्रक कें नागरिकक कें मोबाइल बैंकिंग एप्लीकेशन आ डिजिटल वॉलेट कें माध्यम सं सीधा वास्तविक समय मे मनी ट्रांसफर करय मे सक्षम बनायत छै.

मंत्रालय नँ एक बयान मँ कहलकै, ""यूपीआई-एनपीआई संबंध वित्तीय समावेश मँ एगो बड़ौ प्रगति के प्रतिनिधित्व करै छै, जेकरा सँ भारत आरू नेपाल के बीच मजबूत आर्थिक आरू डिजिटल संबंध क बढ़ावा मिलै छै। ई सुलभ, सुरक्षित, आरू सस्ती सीमा पार स॑ भुगतान लेली क्षेत्रीय लक्ष्य के साथ एकदम सही ढंग स॑ मिलै छै, जेकरा स॑ लंबा समय स॑ चलै वाला सामाजिक आरू आर्थिक बंधन क॑ मजबूत करलऽ जाय छै।""

भारतीय राष्ट्रीय भुगतान निगम केरऽ अंतर्राष्ट्रीय शाखा एनपीसीआई इंटरनेशनल पेमेंट्स लिमिटेड (एनआईपीएल) आरू नेपाल क्लियरिंग हाउस लिमिटेड (एनसीएचएल) के बीच सहयोग के माध्यम स॑ तकनीकी एकीकरण क॑ निष्पादित करलऽ गेलऽ छेलै ।"
Govt aware to ensure fertilizer supply: Minister Chaudhary - Nepalnews.com,Govt aware to ensure fertilizer supply: Minister Chaudhary  Nepalnews.com,2026-06-11 14:49:46,https://news.google.com/rss/articles/CBMingFBVV95cUxPdG1uNlVuY2RFTG5tQ0lfdkdyN1lQU2JDcGltN1RoaDZLMVgwUVBiZk1NT2ZCbTN2ZXJiSDE4TENUZG85SDktc2ZzT0tsMDUxYnZIeGhldWlTV2lpWFBUeG80RmtMQ0lyNl9VdXB3M2toRGJ0OF9UOHF6Sl92MUhfb1hLOHlzeFdxQmdMUl84SU1qRkVvV2JtakhlNjZtQQ?oc=5&hl=en-US&gl=US&ceid=US:en,https://english.nepalnews.com,Nepalnews.com,,,
UPI and NPI launch India-Nepal cross-border remittances mechanism - Trade Finance Global,UPI and NPI launch India-Nepal cross-border remittances mechanism  Trade Finance Global,2026-06-11 14:50:21,https://news.google.com/rss/articles/CBMiqwFBVV95cUxQai05OVFsUGlxcVhRODNlcTMyX2lRNVRSNkhWNXNMUWtuRUp4alhhN3JZZHlqTlIybkhhak91aldfcDRwai1VakdIalpmYlVmODI3WjhHYWN5ZFUzclFMOU9oRG4xWDdqWm5WSEkwdVAyVW1PeDNmemJpUmZhdXdGRVluMlpkc1NWLTVKaGtKSWFRVG52Z2FZSkhxYWxJLVo1N290T1c3Zzl5ZW8?oc=5&hl=en-US&gl=US&ceid=US:en,https://www.tradefinanceglobal.com,Trade Finance Global,,,
22 killed as army helicopter crashes in Pakistan - Nepalnews.com,22 killed as army helicopter crashes in Pakistan  Nepalnews.com,2026-06-11 15:14:46,https://news.google.com/rss/articles/CBMilwFBVV95cUxQMjFSbWZLNUVqdEVqODZoQTFFTHM3UkZTNTBWMTFiYTNOY3hIb0RUX2N3RXNVZ3FmRmd1R0RaRWNTWWU1dHhxX2YwcHVhQngxU2Vwd09FNmdoTThHbkxRVEUtR2V0MERVMUdnU3dISl9KZHFrbVU1QThac29iTDZwQmFPMnpPSS1oVkRoRDRGdndRT3NoX0tR?oc=5&hl=en-US&gl=US&ceid=US:en,https://english.nepalnews.com,Nepalnews.com,,,
Number of forcibly displaced people dips to 118 million: UN - Nepalnews.com,Number of forcibly displaced people dips to 118 million: UN  Nepalnews.com,2026-06-11 15:39:46,https://news.google.com/rss/articles/CBMiqAFBVV95cUxOUGd1V3pfRU14MkpjV0xLWjQ3RWtQdzJTdEV3cTc1a2FkVHcwYVI2YVQ2eVFtb3lWaFJ0bkNQbzJ4bFlsX3pqX1lOdTZuWE51S3hwaVFBSUlTX1p4bjcyaVpsbnRwX0pBeHNPcThEblZBYVVvMURvci1wNU5iMWRfdmhnXzd0WTR3cW1fS1dQUEZfMndLaWRpdHNENzhnMlh2ak12SmxiV2c?oc=5&hl=en-US&gl=US&ceid=US:en,https://english.nepalnews.com,Nepalnews.com,,,
