title,description,published date,url,publisher.href,publisher.title,full_article,images,translated
Nepal ornithologists confirm first breeding of black-necked cranes - kathmandupost.com,Nepal ornithologists confirm first breeding of black-necked cranes  kathmandupost.com,2025-12-09 01:03:28,https://news.google.com/rss/articles/CBMisgFBVV95cUxNN2h2dGVMdUVsdHFMcWNsQ243a19yaF9UdEFZN3dvVW1DRUhrSjBJaGpYVEFJWHQ4a0ExQWl4MzB1bi1YeXNnTEpPVjdpcTVLUGdLZWt0TFFvYnYwNm5naWEyT1g1ZnpMUU5IS0hBMGtnSTQ0M0hZM3lTMVlKRHpNZENXSUptV2xGcy1TMG5yUzBFeEhVSXU3OFVXUGhKZ3BGMFZyNjlyUHZva3ViWUVxXzln?oc=5&hl=en-US&gl=US&ceid=US:en,https://kathmandupost.com,kathmandupost.com,,{'https://lh3.googleusercontent.com/J6_coFbogxhRI9iM864NL_liGXvsQp2AupsKei7z0cNNfDvGUmWUy20nuUhkREQyrpY4bEeIBuc=s0-w300'},
Nepal government must ensure accountability for unlawful killing during Gen Z protests: Amnesty International - Asia News Network,Nepal government must ensure accountability for unlawful killing during Gen Z protests: Amnesty International  Asia News Network,2025-12-09 01:09:50,https://news.google.com/rss/articles/CBMizwFBVV95cUxQSlctaWwtZWpaMTVsY1RWbGYxMVYyd3hGOE1PbTVWdElTaS1GMFJkdXRHNVNWWkVzaDlvWmxtSGVnTWxITW1PbUhKR3NTTDdQdWtYRHpPVWhjTmFha3N2Y2xEVnBjVy0tY3o1Y0R2Z1VjWkhpbTVIUmJYQ2NScVVZckVQNU1waTlNN0k3NDdxUjVlQkhFYWJ4N0tTNG5TTXlaOHFSR21rNWhETkM0WVkzNjJSbGc1VE1SRXZ3UjBuQ0tKYXJ6b1ZjTzZOa0gwRXM?oc=5&hl=en-US&gl=US&ceid=US:en,https://asianews.network,Asia News Network,,{'https://lh3.googleusercontent.com/J6_coFbogxhRI9iM864NL_liGXvsQp2AupsKei7z0cNNfDvGUmWUy20nuUhkREQyrpY4bEeIBuc=s0-w300'},
"Nepal’s Home Minister Aryal seeks cooperation to conduct free, fair elections - Daily Pioneer","Nepal’s Home Minister Aryal seeks cooperation to conduct free, fair elections  Daily Pioneer",2025-12-09 01:14:22,https://news.google.com/rss/articles/CBMivgFBVV95cUxPcWhsVmtsQnpSRzJJczBEYXlMdDFxTmQ1ZnM2cFJpVC1VZGxyVnlIWnc0QWlxWlVBcTlJUVI3YkNOak9Kc09idktKbHRvMGQ1Z3JIeFV6cnkwaEZQbE1vOW9ZbWJNcm9ua3YweDBydzlKTDF1ODRvd0ZLOFBzRk9WQWVla3FFVlQ5bEhKM1VoMHIwNUs3YzFTakJqOW1GZGkxbDhEdG1qTTd5ZHE1MkZqY1l0aVFERVB1MFh0YVhR?oc=5&hl=en-US&gl=US&ceid=US:en,https://www.dailypioneer.com,Daily Pioneer,,{'https://lh3.googleusercontent.com/J6_coFbogxhRI9iM864NL_liGXvsQp2AupsKei7z0cNNfDvGUmWUy20nuUhkREQyrpY4bEeIBuc=s0-w300'},
Opinion | Nepal’s liquidity paradox - kathmandupost.com,Opinion | Nepal’s liquidity paradox  kathmandupost.com,2025-12-09 01:23:51,https://news.google.com/rss/articles/CBMiekFVX3lxTE9BSDcxM3VSSUxYbzdLclFMcFl3MmhiV0VKaWhWajZmYW5xTXpIclNMRy1RVWIzblg1MUFPeWtwSGNQTHVUVnAtOGJIcGQzcHJFTlMybFVkV2FvRDdUWXRFZDdlZXdkdUJlak53VFNvaTlSQVR3Q0wyY0R3?oc=5&hl=en-US&gl=US&ceid=US:en,https://kathmandupost.com,kathmandupost.com,,{'https://lh3.googleusercontent.com/J6_coFbogxhRI9iM864NL_liGXvsQp2AupsKei7z0cNNfDvGUmWUy20nuUhkREQyrpY4bEeIBuc=s0-w300'},
Punish PIA Scammers - The Rising Nepal,Punish PIA Scammers  The Rising Nepal,2025-12-09 01:39:32,https://news.google.com/rss/articles/CBMiUEFVX3lxTE1XcHlMcnZXZ3k2VVV6WndoUk5xdVRBeC1lX1NDS1dLUkFDM0xMcnBjcHlKZWdqNkllOHhQcFJfb1NHVjBaMm50ZGxybGtwUDRO?oc=5&hl=en-US&gl=US&ceid=US:en,https://risingnepaldaily.com,The Rising Nepal,,{'https://lh3.googleusercontent.com/J6_coFbogxhRI9iM864NL_liGXvsQp2AupsKei7z0cNNfDvGUmWUy20nuUhkREQyrpY4bEeIBuc=s0-w300'},
Dilemma Over LDC Graduation - The Rising Nepal,Dilemma Over LDC Graduation  The Rising Nepal,2025-12-09 02:10:16,https://news.google.com/rss/articles/CBMiUEFVX3lxTE92Q3gzTjJPT1NnenFZQWgwRkNhRDBhYlNkMDRfWEtnbVpNaUVWUEhaaUszTmF3Tk52S3Zsc04tRjBiMXlhRkVOYmp0WERhMXhF?oc=5&hl=en-US&gl=US&ceid=US:en,https://risingnepaldaily.com,The Rising Nepal,,{'https://lh3.googleusercontent.com/J6_coFbogxhRI9iM864NL_liGXvsQp2AupsKei7z0cNNfDvGUmWUy20nuUhkREQyrpY4bEeIBuc=s0-w300'},
HoR election- 86 days to go: EC opens Office of Election Officer for PR system - Nepalnews.com,HoR election- 86 days to go: EC opens Office of Election Officer for PR system  Nepalnews.com,2025-12-09 02:17:13,https://news.google.com/rss/articles/CBMiugFBVV95cUxOblNiUWo1bk1DWFN0SUJhVmk0Q2NKRzBEdmlGS2pYTEczUHZOSzVOZXUzZjFJMnVyeFhTZUxBZU01RmFPZ1p5VFZ4bEZUaDNiVVU2d0s0RmdVSnV0dFVLbmhnRWJ6NEMtLU1nOG9NUGFJWTBURVBxV1NoZEJVNTNxbmFhM2cxZmtiN1EyOGtKai1rbEw2RG9pR3JnX0MxQkJUV1dpNG9YM2Q0dWdXTUhubHJEcFhrQ19qRnc?oc=5&hl=en-US&gl=US&ceid=US:en,https://english.nepalnews.com,Nepalnews.com,,{'https://lh3.googleusercontent.com/J6_coFbogxhRI9iM864NL_liGXvsQp2AupsKei7z0cNNfDvGUmWUy20nuUhkREQyrpY4bEeIBuc=s0-w300'},
Economic Digest: Nepal’s Business News in a Snap - Khabarhub,Economic Digest: Nepal’s Business News in a Snap  Khabarhub,2025-12-09 02:20:02,https://news.google.com/rss/articles/CBMiWEFVX3lxTE5ZbS1TdEEtN1RwUlpOYVMwUl9kNU1RbEpycjlnZURlWVVTbUlxNlE4YklxZE9RcV9JanJ6N2E0dy13WjJmRGNobHcxbEdSSEJ6NmpWOURHNW8?oc=5&hl=en-US&gl=US&ceid=US:en,https://english.khabarhub.com,Khabarhub,,{'https://lh3.googleusercontent.com/J6_coFbogxhRI9iM864NL_liGXvsQp2AupsKei7z0cNNfDvGUmWUy20nuUhkREQyrpY4bEeIBuc=s0-w300'},
NRB publishes foreign exchange rates for today - Nepalnews.com,NRB publishes foreign exchange rates for today  Nepalnews.com,2025-12-09 03:42:16,https://news.google.com/rss/articles/CBMilAFBVV95cUxQNzdwV0JfNklXbkVLUjhQNnN3cEFWbWdpVzZ3UEZqSVlJazdqOVg4UU5OU1BMT19hVHBXWEVkY2dPRTJ3RFhXXzl0VHJjUEwwN2dZS0pVNjBjYWp6dmRYX3dPOGh5LWZwOGRWRktZeVJESjRXbnhTa1FwVFRSeGtUeXdIdy0yaHhFZlZuQi1CUW1OOFc1?oc=5&hl=en-US&gl=US&ceid=US:en,https://english.nepalnews.com,Nepalnews.com,,{'https://lh3.googleusercontent.com/J6_coFbogxhRI9iM864NL_liGXvsQp2AupsKei7z0cNNfDvGUmWUy20nuUhkREQyrpY4bEeIBuc=s0-w300'},
Nepal registers deficit with 113 of 142 trading partners - The Rising Nepal,Nepal registers deficit with 113 of 142 trading partners  The Rising Nepal,2025-12-09 03:46:56,https://news.google.com/rss/articles/CBMiUEFVX3lxTE8tWWg0WnByNDNEcmM2aEstclVmeERtWS04d01KaUxGMjRwZVgzMXhKcnpuWlZNczZ5VTQ5NU1FMWs5YnQ4M2g5RWVpUTRfNjd5?oc=5&hl=en-US&gl=US&ceid=US:en,https://risingnepaldaily.com,The Rising Nepal,,{'https://lh3.googleusercontent.com/J6_coFbogxhRI9iM864NL_liGXvsQp2AupsKei7z0cNNfDvGUmWUy20nuUhkREQyrpY4bEeIBuc=s0-w300'},
Nepal’s Yomari festival celebrates Newar culinary heritage in Tansen municipality - Asia News Network,Nepal’s Yomari festival celebrates Newar culinary heritage in Tansen municipality  Asia News Network,2025-12-09 03:55:22,https://news.google.com/rss/articles/CBMiqgFBVV95cUxOclpITXM4aVg3WFV1bHdmcmEwNmZkeWRWX3l5VmtUa1ZBdm9oZGVVZ2pyZW9STURaemdFbnozQTlZUkJTbDB6LUV3cWtwQ0I5OXVDSWltLVZfS3FzWW9DUjAwNUJURGwtckIyQklIMldoaG1tZi1YYnpkeFp5MnZEbUNWdG5DeGFGd0NyZTNwRU44NjFQdVBtNThqTHB6TXZPRlYyd1VGZHZ5UQ?oc=5&hl=en-US&gl=US&ceid=US:en,https://asianews.network,Asia News Network,,{'https://lh3.googleusercontent.com/J6_coFbogxhRI9iM864NL_liGXvsQp2AupsKei7z0cNNfDvGUmWUy20nuUhkREQyrpY4bEeIBuc=s0-w300'},
New Dhaulagiri–Annapurna Trekking Route Introduced to Offer Off-Road Adventure in Nepal - Travel And Tour World,New Dhaulagiri–Annapurna Trekking Route Introduced to Offer Off-Road Adventure in Nepal  Travel And Tour World,2025-12-09 04:30:43,https://news.google.com/rss/articles/CBMi0gFBVV95cUxQN1JLVjhDaHVFWFZIRHBpajJVUF9lTUhHTHBCUTZtN0w1cXRnWWgxZHkwRjgyUkRZT2h5QUNxdzVEY2szNnc2Y2dIUGxGQ0ZKWC0tZ1g4NG40U21nUU4zeDl6RmhVSXBRX1JrZklxc01MOGhmWThRS0Nqcnp2RjB4Z2lqX2VMd3VXd0R6MGlMZWpuTnU2UjJ3TjFmOHlsaHliUXhxeVdmRWE1WnlETE5TWUZXRVBsdmM1TXZwaEEyTVpkbzBEa2s3aFFhRHdVUnpjSlE?oc=5&hl=en-US&gl=US&ceid=US:en,https://www.travelandtourworld.com,Travel And Tour World,,{'https://lh3.googleusercontent.com/J6_coFbogxhRI9iM864NL_liGXvsQp2AupsKei7z0cNNfDvGUmWUy20nuUhkREQyrpY4bEeIBuc=s0-w300'},
Rising challenges of Parkinson's disease in Nepal and the road ahead - The Himalayan Times,Rising challenges of Parkinson's disease in Nepal and the road ahead  The Himalayan Times,2025-12-09 04:41:15,https://news.google.com/rss/articles/CBMiqAFBVV95cUxNRDZkeGRScXpWQ2hVLTFBQU5Va2lGaGNudGtHbFZ4R3RDT3ZLQ19wVFp1N3N5UWxzNkYzQlVaXzU0amVJWVhGMUp1VXpsNEZzNWVlbW1yWW05a0dNbTRCLVVab2FHY0EzeWdwTDVXVHBVSldjeTlldWd0UGY3N09wajlGTi1SSU5xQnFPa3hvellrLXNUMkZxb3A2RmtBd3RWRnRsRGRpSXU?oc=5&hl=en-US&gl=US&ceid=US:en,https://thehimalayantimes.com,The Himalayan Times,,{'https://lh3.googleusercontent.com/J6_coFbogxhRI9iM864NL_liGXvsQp2AupsKei7z0cNNfDvGUmWUy20nuUhkREQyrpY4bEeIBuc=s0-w300'},
Yamaha Nepal launches week-long 'Yamaha BLUE CAMP' service initiative - The Himalayan Times,Yamaha Nepal launches week-long 'Yamaha BLUE CAMP' service initiative  The Himalayan Times,2025-12-09 04:45:38,https://news.google.com/rss/articles/CBMiqgFBVV95cUxPS3hnUXJrdktKdlFReGFtRHlCNjJ5TWk3QTJmRVZOUF9GQWZtQklTcDhaT3EyV25qd2FpUGdnMHR1eGV5OGY0Wmt2TGdhZzRpamRjSWhKN0ExdTNhX2ZoN2o3cjdYTmJGUTFNSEZHN3BwZllrckl4bUlBT05od2hXNlQxeF9Eai1FMkJ5RTlsTHRfeDkzVGZJZllKVVN4dkdIYkV1dGEzTU96QQ?oc=5&hl=en-US&gl=US&ceid=US:en,https://thehimalayantimes.com,The Himalayan Times,,{'https://lh3.googleusercontent.com/J6_coFbogxhRI9iM864NL_liGXvsQp2AupsKei7z0cNNfDvGUmWUy20nuUhkREQyrpY4bEeIBuc=s0-w300'},
The fading promise of biogas in Nepal: Prioritise sustainability over installation - The Himalayan Times,The fading promise of biogas in Nepal: Prioritise sustainability over installation  The Himalayan Times,2025-12-09 05:27:56,https://news.google.com/rss/articles/CBMiuwFBVV95cUxPblZtY0RydTd6YWQyOXZoNm9PS1RCSWJKSGJ4enJKbEVNTW5LaXd1Q1J1a3VRZ1l0Y004dlFhVFRrbkcwRGkxWEU3WGRtWW11c0FHY0pzQkRrdV9Td3p2ZUxKeUNuSHdnaUZPc0lEQWVISDJTSjVaaGc2WlRfZmJsNXc5Y3hSWk13Y3lVWXE0NEVuUkNoa3FhbWh6M19aMHV1QlEyemZ1U3g0VGRaNFBQcDVTMFZZQ1QzOGE0?oc=5&hl=en-US&gl=US&ceid=US:en,https://thehimalayantimes.com,The Himalayan Times,,{'https://lh3.googleusercontent.com/J6_coFbogxhRI9iM864NL_liGXvsQp2AupsKei7z0cNNfDvGUmWUy20nuUhkREQyrpY4bEeIBuc=s0-w300'},
Third India-Nepal cultural festival held in Lumbini - kathmandupost.com,Third India-Nepal cultural festival held in Lumbini  kathmandupost.com,2025-12-09 05:28:13,https://news.google.com/rss/articles/CBMingFBVV95cUxQUDVsWUJUVk9VNTk1VkZrcU9IM0x0b0xkN3RMamRscEktTVBwQ0sxdE5mTTFlSDhBcnZNYllqbFg1cE9UREluV2Vzc3VIZ3ZDb1NoR3FOc2F3VzQ5c0N1aDF3Q21aWHdWMW05VkgtOFljN0xnRk92WEp0bC1YUWd3dlJFaXBNRGhITDA4Z01SblY3dTZFYVZpYUUxUUNaUQ?oc=5&hl=en-US&gl=US&ceid=US:en,https://kathmandupost.com,kathmandupost.com,,{'https://lh3.googleusercontent.com/J6_coFbogxhRI9iM864NL_liGXvsQp2AupsKei7z0cNNfDvGUmWUy20nuUhkREQyrpY4bEeIBuc=s0-w300'},
Nepal unveils the new Dhaulagiri–Annapurna trail for an off-road Himalayan adventure — all you need to... - Moneycontrol,Nepal unveils the new Dhaulagiri–Annapurna trail for an off-road Himalayan adventure — all you need to...  Moneycontrol,2025-12-09 05:32:02,https://news.google.com/rss/articles/CBMi9gFBVV95cUxPNk1fejcwbzBLX1R0Z0VQdmk1VG9MRk5hVlNjRGt0WnNsMnU1SVU4UXZvcTJVYmhSWXZHZ2lZdW5oaDNJQW1kdWZDTEZZSDhsenEyOWlxN09MczF2cjdjZEo2ZDN6R3NVY2I1Y1llMUZCYjZxV1NUcUpvX1NoREExMHBxQzdEVXl4Nktfd25EUXJhWkdNSzVEZkRGbTZJWFpNaXkwY0xPQkl0ektOVEdDY3d4NVNIOTNXZE5JTGM3ZjRvcjJ3clFxY0h4N3Z0N05yZEZfZ3k0dUdpZW94YWlkdkxacG9fNURNX3hLRExuazJ1MzRURHfSAfsBQVVfeXFMT3VIdlRpaGV0dDdlSE9zemxmM18yLTFKN0ljV3VrZ2FUQ2dlS3hWT2sySC1hS1J4Wmc5VllpY1BESXdCN1NxOUFIZ1N4ZndDZEs1ZTUwODlRMTRLQ3JoTG1EcFgzalBfMUxYc0VPbE9FNFZ5R0tvTmh0THAyeUVXNC1uT3ZGRmtnNFd1YUotbTFoYlJYcTRxWlV1c3E5cFNYalJzS0Q0TEt6SGhiTW55ZmlfLXU1cDI3TnFFQjdZNXdGYjFLd1RpcUdiMTRFVkFjNk9tYy00dDNFVVdjR19FNmVZa2NEamxHSF9lUG55VDNGSkZnbkhaVnNZUm8?oc=5&hl=en-US&gl=US&ceid=US:en,https://www.moneycontrol.com,Moneycontrol,,{'https://lh3.googleusercontent.com/J6_coFbogxhRI9iM864NL_liGXvsQp2AupsKei7z0cNNfDvGUmWUy20nuUhkREQyrpY4bEeIBuc=s0-w300'},
Gold prices decline slightly in the local market - Nepalnews.com,Gold prices decline slightly in the local market  Nepalnews.com,2025-12-09 05:52:16,https://news.google.com/rss/articles/CBMilwFBVV95cUxNUlZWYk9XUkR6UVdMTWI3TjFIRmU3dzNLUDRCaXpyQTYwcUdEeW8tSjllbExpZjNDWjBKY1dUejVVZzJqaURHVExHSEtxSlBVZTU0d1c4WlpuYVJTUWhvNE1QWUh6aDVaVFZvNGdEMnBhcUNEUm5TRElXbHJDMzM0NWJxanZUMUU5LUE1TkNDRl9GNlZjVkVR?oc=5&hl=en-US&gl=US&ceid=US:en,https://english.nepalnews.com,Nepalnews.com,,{'https://lh3.googleusercontent.com/J6_coFbogxhRI9iM864NL_liGXvsQp2AupsKei7z0cNNfDvGUmWUy20nuUhkREQyrpY4bEeIBuc=s0-w300'},
Nepal's antigraft body faults China-funded airport after Gen Z protest - Nikkei Asia,Nepal's antigraft body faults China-funded airport after Gen Z protest  Nikkei Asia,2025-12-09 06:17:00,https://news.google.com/rss/articles/CBMiugFBVV95cUxNZ2lKSzJrSnJSVHJBWUY3dlFGaGtkZVNzUVN2Qm1IVGIxdHJXOXpZSC1VYlNHR2tzcFZFSUE1YkQtUnRNTVJRNF92U0xBemZLN25neDRWR3dJVldROUZHM01wZkthb1g3WFBoU2kzTVFHallhZ3RzNkJpb0hnVm5IeUZUMFM4TjVpbDdUM2Nwb1BCS1RocEdma0pJSGN0SlZOQi1KdWdtMzU1U0Nfek9sM1g0M3JKYVEzYnc?oc=5&hl=en-US&gl=US&ceid=US:en,https://asia.nikkei.com,Nikkei Asia,,{'https://lh3.googleusercontent.com/J6_coFbogxhRI9iM864NL_liGXvsQp2AupsKei7z0cNNfDvGUmWUy20nuUhkREQyrpY4bEeIBuc=s0-w300'},
Undocumented Nepalis face exploitation in Greece’s strawberry fields - kathmandupost.com,Undocumented Nepalis face exploitation in Greece’s strawberry fields  kathmandupost.com,2025-12-09 06:24:52,https://news.google.com/rss/articles/CBMitAFBVV95cUxOa3d2clk0R1NlMlp1cmNOeWZRTHZjbVppT1pPendCZjBlSkJIU0M1SG15SldfdUozYXdXcHhqN3poX3lGVS03djhMNzZCYnAzcG1BVXhqMGU2c2tfOFQwU21vNWVham8tcWZMSG9sUUxKQU5mQzlQR1ZYa3FhSmxCUVBGd2hZOWJoYnZGZDd1Ql8ySUtrWDV2MG1wR0pOM3NrX0VaaldEenRLeWowMzdHN283dDE?oc=5&hl=en-US&gl=US&ceid=US:en,https://kathmandupost.com,kathmandupost.com,,{'https://lh3.googleusercontent.com/J6_coFbogxhRI9iM864NL_liGXvsQp2AupsKei7z0cNNfDvGUmWUy20nuUhkREQyrpY4bEeIBuc=s0-w300'},
