title,description,published date,url,publisher.href,publisher.title,full_article,images,translated
"RBI permits AD banks in Bhutan, Nepal, Sri Lanka to lend in rupees; NRI rules eased - The Economic Times","RBI permits AD banks in Bhutan, Nepal, Sri Lanka to lend in rupees; NRI rules eased  The Economic Times",2025-10-01 07:09:25,https://news.google.com/rss/articles/CBMi3gFBVV95cUxOUldSay12MHIzR1ZRM0NDcXZkcG1QMDF6M0lxS2ltcHFLZ2RtSmZEV043a3NLTkphaXg0c0Q2Q3Q1ZHNQLWozNzZkT1lmWk94Mm5tWU1qMXBLb0R2RGlKajdnZ2lSR0pJTm83Wmc4RmZiUW5zTXY5R2RBMlRwQWFXRVBZcnB2WkppLVZpVk9FVEdianlBYjRyY1JlNDhyaTlNS0ZmeEg3TzhQa0FFd2lEbDJ4R2RQZkdHQkVnVnBTZmx1cHdfWFU2cGhHd1VaNnlTVzl2TDg3MXdHM2dZaGfSAeMBQVVfeXFMUFB1ZlVQcVd5d2NoY0h4NnliVXpGLVpVX0huSnRuU0g2d2FKaUNROWpqTE15RjhRd0hVMFg2eEVSTWNmRURkRzJQc1d5ZUpRdm10c2lhYlJ4S00xdkhIZHdkU0psUGFwYUNQSTNyallUYkRmNjQ0NnBGQTlaZDB4cmZmVElSbkkxNzJjQ2pRWGNydDRjZ1NPdkt6SzhLN3pBRXVLNVNTOWgyM3FXZnJNVk1pUlVUWUt6Z0dreVZFZkxiT3lfZ3N4YnJOdnFPVEMwQi16cVkwbTZqbUZiTGxQMDMxcDg?oc=5&hl=en-US&gl=US&ceid=US:en,https://m.economictimes.com,The Economic Times,,{'https://lh3.googleusercontent.com/J6_coFbogxhRI9iM864NL_liGXvsQp2AupsKei7z0cNNfDvGUmWUy20nuUhkREQyrpY4bEeIBuc=s0-w300'},
Uprising in Nepal: The City of Wood Is Burning - The Amherst Student,Uprising in Nepal: The City of Wood Is Burning  The Amherst Student,2025-10-01 07:34:55,https://news.google.com/rss/articles/CBMiiAFBVV95cUxPUEprT1JNZTFtYjJXN1o2dVV0bWY4R0tiaThGVjZNTll5SUtUMXVfS2tXV3JOTkRLak1PZ3d6TjJoai1YOEEyel9sZGtKMDQwLWxLQ1I2SVdVSUNKWkN0eTdtQmVSbF9UQndrdXlBZVV6V1o0N0lDTktZdWZzLTc3OVZjVUZ6UTY5?oc=5&hl=en-US&gl=US&ceid=US:en,https://amherststudent.com,The Amherst Student,,{'https://lh3.googleusercontent.com/J6_coFbogxhRI9iM864NL_liGXvsQp2AupsKei7z0cNNfDvGUmWUy20nuUhkREQyrpY4bEeIBuc=s0-w300'},
"Meet Nepal’s Youngest Goddess Aryatara Shakya, Just 2 Years And 8 Months Old, Crowned As The Kumari Amidst Das - Times Now","Meet Nepal’s Youngest Goddess Aryatara Shakya, Just 2 Years And 8 Months Old, Crowned As The Kumari Amidst Das  Times Now",2025-10-01 08:29:12,https://news.google.com/rss/articles/CBMiqAJBVV95cUxOUFRIM0FKeTFJdk9OX090VFd2WWRaeXRweXNfOExQUFNaYjNpcTZnUU5PNmRuSnZCa0p1bGJ2U21uQ1V1OERzWk5ESlFXWVBwbFMtTFFycGVuOWRERTJGVjRFX3g0V1hjbXpROTFSRllBMGFvcWxNT0lHZDdNMmdRLVZJRllPZ1kxXzBqRlNQS1Z5RU9GNTNPV1FMeWp3UElDblJvSXNQOFBuOG9lbXFTSFRPQ0NVdGtDVTdHb1hZY1Z1YXQ2bjhrR241NnRpeTBRanlnMVg4aGpiYi10RTh1aUoxQ25MMXRwZUdWQXZxc2ZzOFUtWlhTa2hZMUV1aUY2TEc5ZUJTR3RycjFiclNNWXViYVJGZmpPOVRmS3RQV0FBbGlTRWhxNNIBrgJBVV95cUxPMXFPUFdYenJlN09JOVpETlZSNVVCUFdiSklKYjBScDZ6bTZJYzZnbFFPdFdBWjJVR1llelRvaXNucFc0MHdxR3Y2d2hiWnZqekg3c0h1N0k1eVgwclotcTBiM04tLUo4TVE0U0ViU3pFUlJzUjRxNUdSRm10aExmSmliRUpEekg0WHRiRXgzbElCYXFudjlwanV5ay1HRERmWUExNTVfdGFpUk5wbGs3d1A4X2ItSHpXWFdCRW9rb3NKMURkdDNReHBxdUhodFFINm03VVM4WTlfRnlMeWVDZ1g3Qmwzc19SSUZsXzVtczU4NUVaSVVmWEZ0WUM3NFhSbEI0bWFtQ1A0ck8tNHhjeDJ6YWdpakhLb1hKVC03cDAwWHkwaGRZZnFGWWJhUQ?oc=5&hl=en-US&gl=US&ceid=US:en,https://www.timesnownews.com,Times Now,,{'https://lh3.googleusercontent.com/J6_coFbogxhRI9iM864NL_liGXvsQp2AupsKei7z0cNNfDvGUmWUy20nuUhkREQyrpY4bEeIBuc=s0-w300'},
Nepal’s triumph over West Indies opens new avenues - kathmandupost.com,Nepal’s triumph over West Indies opens new avenues  kathmandupost.com,2025-10-01 08:55:24,https://news.google.com/rss/articles/CBMingFBVV95cUxNRmQyYTNXMEFmYmZsNWlWbnF6UG5HT1hzMDBoNTNXWExkb2paQWFLWFluNHpPVl9zV2R1VGIzSlMtY2FJd0hxZG1sV3BFZzlaZFVTanNORTQwVV9ZUThVbk9TQWZRaGNRV1ExYUp1NGxHVnFxRGdYd0lFbVEta0FNbWI2NTgwN2c2eExHeWVtWEZxLXRjTVQ1dWotT2w0QQ?oc=5&hl=en-US&gl=US&ceid=US:en,https://kathmandupost.com,kathmandupost.com,,{'https://lh3.googleusercontent.com/J6_coFbogxhRI9iM864NL_liGXvsQp2AupsKei7z0cNNfDvGUmWUy20nuUhkREQyrpY4bEeIBuc=s0-w300'},
Nepal’s youth lead change as India and China watch closely - ThinkChina,Nepal’s youth lead change as India and China watch closely  ThinkChina,2025-10-01 09:07:26,https://news.google.com/rss/articles/CBMipAFBVV95cUxNbmdMeVRXY3Bhcjh3MVRQdjN3cUpFR2FHUnFDZWc5RkJYZ0t4RGRkWEVFMmhBUXp0eFNNck0wdkp5UEtfTHlpTVR1Zm82SEN2aXV5RWFrZGgyS0N6Q0wwWnBURE13UERSRG9nU2s4c1JmM052aTNjSm8tZTU2bERoT0hKTUNJTlF0TXVvRVhqVXVGUEZLWFFWOFpoeENSVWlZLXVzSw?oc=5&hl=en-US&gl=US&ceid=US:en,https://www.thinkchina.sg,ThinkChina,,{'https://lh3.googleusercontent.com/J6_coFbogxhRI9iM864NL_liGXvsQp2AupsKei7z0cNNfDvGUmWUy20nuUhkREQyrpY4bEeIBuc=s0-w300'},
Nepal and the Wider Problem of National Security as a Cover for Censorship - Tech Policy Press,Nepal and the Wider Problem of National Security as a Cover for Censorship  Tech Policy Press,2025-10-01 09:23:03,https://news.google.com/rss/articles/CBMipwFBVV95cUxOMFU3dnZfOG5DZmlYbUFSZnVlRzRfc2ZOU050bS1SLUhtVEhyQXAyNnZCOEowR1VyVWlwb3ZlR2hxNkpPbW56a2xjMk5PYlJBRFdtZy1rU2NJdFJqY0RBcE52ZmdOdVZ4em1RNGwwdWxZb1hwNm1CTFdybmdQY21YRUJWQ19La1c1U1k3WDdDZXR6MmMxREkxTTVSUk1zdGJVYWZnT25taw?oc=5&hl=en-US&gl=US&ceid=US:en,https://www.techpolicy.press,Tech Policy Press,,{'https://lh3.googleusercontent.com/J6_coFbogxhRI9iM864NL_liGXvsQp2AupsKei7z0cNNfDvGUmWUy20nuUhkREQyrpY4bEeIBuc=s0-w300'},
"Nepal's Kumari, Aryatara Shakya: Living Goddess, Isolated Childhood, Criticism From Child Activists - BollywoodShaadis","Nepal's Kumari, Aryatara Shakya: Living Goddess, Isolated Childhood, Criticism From Child Activists  BollywoodShaadis",2025-10-01 10:14:38,https://news.google.com/rss/articles/CBMi1AFBVV95cUxPM3RsQ09TVXUyTGZLMzJ6TUY5Q29YQzBMWGlvVkNPaXlidTdnVW10U3EyTC1MMHRoWlpoNEZoY3N4c2lOOEdtWnFOUklwWVJQRVlCNXlXTWJjTi11c2tidnlxZEV6SG02bzFxZ0Jnb2J6N2tPVDVYY2dLT0dXYm1QdHVrSkZMWTNISFhpcVVGV0ktTU8tdUNRSXBGZHlGbE5XNVBmUHdOWXFvTndSRWI5TGtneW1PdVpxRVZZcDZRTjF5bGJGRnZiaGduNVRDWW0wQ2RJRg?oc=5&hl=en-US&gl=US&ceid=US:en,https://www.bollywoodshaadis.com,BollywoodShaadis,,{'https://lh3.googleusercontent.com/J6_coFbogxhRI9iM864NL_liGXvsQp2AupsKei7z0cNNfDvGUmWUy20nuUhkREQyrpY4bEeIBuc=s0-w300'},
"New design fashion peacock feather ethnic necklace,Nepal jewelry handmade sandalwood long sweater vintage jewelry necklace - The San Joaquin Valley Sun","New design fashion peacock feather ethnic necklace,Nepal jewelry handmade sandalwood long sweater vintage jewelry necklace  The San Joaquin Valley Sun",2025-10-01 11:54:16,https://news.google.com/rss/articles/CBMi8gFBVV95cUxPMEctdFZ2VnpkSFROZVZ2d3FsamNvVlkzODAyajVqQll6SVF6V2hYS3NlMk9VOTBJSkVSZm9CZXdXWVkyT0N5UmpsWF82WE5RMUpmdENOVzJTdmIzMUZkMVVWRmxCX3Q2eDlzZUI1WGRmclFQZ2NvQ1lYcGE5bHZ4WG5vdHZXSFFhNUpDX29NOTBHVS1WU24zTVRUNDQwMGc4dXplVFI5cF9sa2llVWM3MGh4WWh1OXR6TF9fazJob1ZQdlRnSmpReFk1YTR6Szh6ZXA0bHhKUzVPZHE2VDR1Ym1PaTRzTF9iYkp2Tlc1c1RKUQ?oc=5&hl=en-US&gl=US&ceid=US:en,https://sjvsun.com,The San Joaquin Valley Sun,,{'https://lh3.googleusercontent.com/J6_coFbogxhRI9iM864NL_liGXvsQp2AupsKei7z0cNNfDvGUmWUy20nuUhkREQyrpY4bEeIBuc=s0-w300'},
Nepal Between Giants: India–China Rivalry in the Himalayas - Geopolitical Monitor,Nepal Between Giants: India–China Rivalry in the Himalayas  Geopolitical Monitor,2025-10-01 12:42:43,https://news.google.com/rss/articles/CBMimgFBVV95cUxOS3VlOHdGMlZCYjJycW9scUVEMnhWUGFMNUZlTl96YU54dW9aMUo0a0hRVDVIdGg4cWF3b3o0ZlprMUZ1QlZwQnNsbmFfeGpsa2lXVFBPREhIQ1g3OTM2ZVlYOGVKRFJRZ1gtUFNRSE9jSnRZSEFHX2lESTNSSEZzaHVuUGRjTEZWTGRoM2FWcnJHR1BjRk1ubkxR?oc=5&hl=en-US&gl=US&ceid=US:en,https://www.geopoliticalmonitor.com,Geopolitical Monitor,,{'https://lh3.googleusercontent.com/J6_coFbogxhRI9iM864NL_liGXvsQp2AupsKei7z0cNNfDvGUmWUy20nuUhkREQyrpY4bEeIBuc=s0-w300'},
"Inspired by Nepal, Madagascar’s Gen Z protest to topple corrupt system and demand president’s exit - Malay Mail","Inspired by Nepal, Madagascar’s Gen Z protest to topple corrupt system and demand president’s exit  Malay Mail",2025-10-01 13:04:31,https://news.google.com/rss/articles/CBMi5AFBVV95cUxPTnBoc0JxaUVYMnUwaDRWTnI1T3JZR1BKbE40SUwzcXJuXy1qYnhhOHdpc0tvaTJLUzlGbkxZQ0RsSzdWeE1WTDgzNGsySWV2NEh1QzZjUHptSlRMWGM2anBFTjhjMUFQc19wODMxVkNURzlfb0RvbTd3c09neUd3a2ZNZkdzWnpSd1VKVWRRR3JQb3VFSXdnRnFLcnoxX1VndVZLdHVyV3MteFB2dmhlYmFJUDdFeFVmZW51OFNiVGZ0UHFKY2pVbXFiYmZnNEFSYkdoMERyVDJsQjdZZFBBM1NabWrSAeoBQVVfeXFMTzMtVU56d0czdFRURWtiYmdZRGJ5Q0g3djVPVGk3aUhvM3ZZdWxYLUxMOXMwY3N2Z1BUdXBpZHJCeXpSSUdkQWRVVHVhWWhyN1FodVE2alBlVG1tcHM1Q3BlYXdZYWNsclV6XzVoUG9FWjZJTzdPYkhmSThaajhhbnI1QnVCQ0hqaU5BOWdWMG85ZFlBYVFtdlpYMWxPUzZJVHJPMFVMVE5iYk5rLVBWRHF0NVdac2lGMDZiRXRzTXVQUVg2S0l0RVUtNUE1VjJ6YXR0RXNfd2hNNjgwUFV3NER0a0VWcmNzSDd3?oc=5&hl=en-US&gl=US&ceid=US:en,https://www.malaymail.com,Malay Mail,,{'https://lh3.googleusercontent.com/J6_coFbogxhRI9iM864NL_liGXvsQp2AupsKei7z0cNNfDvGUmWUy20nuUhkREQyrpY4bEeIBuc=s0-w300'},
Mudslide in southern Nepal claims 4 lives - The Hindu,Mudslide in southern Nepal claims 4 lives  The Hindu,2025-10-01 13:15:00,https://news.google.com/rss/articles/CBMiqAFBVV95cUxOOFVIV3ZQZ2RBTV9zdzlXMzBLSlFIcmxpRTNCTWRqbzhMNDR1em94V1FvWjFsX2JvZUxLUWg3QXJWeU81STllWUliVDRVTVhCNUxUVVkyOU5lRXdqS0NSTlFhV2U1TEl4ZEtLTWZla2hvOEIycnNiNWdnVE00d1d6TWZVQThpdVZlSXZXTDlaUkw1NlJiRU44VnNDRmRKS01TMnZxSS1MRmnSAa8BQVVfeXFMTmNncjFHY2dySkFONFRETGpVaTR5RkRWVzdIaTU2T3F2djhXZ2pwaUxjZ2sxRGVKMzMyakNjYnBhVEswTUV4NThkSE9ZZ3hXd3dNWFVyWWdVNFJRLW40eS1pVHJSSGZVT3p0dVVUZmg3UjM1SFNweDlPdGN6TFozenAzRWNVUGlraWhUdHVQUF9CdHYxZFdFR3lpSjk0RUNpX0pOUU54ZllZc2VUcTA5Zw?oc=5&hl=en-US&gl=US&ceid=US:en,https://www.thehindu.com,The Hindu,,{'https://lh3.googleusercontent.com/J6_coFbogxhRI9iM864NL_liGXvsQp2AupsKei7z0cNNfDvGUmWUy20nuUhkREQyrpY4bEeIBuc=s0-w300'},
Hoeft embarks on eighth trip to Nepal - apg-wi.com,Hoeft embarks on eighth trip to Nepal  apg-wi.com,2025-10-01 13:43:00,https://news.google.com/rss/articles/CBMi0gFBVV95cUxPLXd0ZDB6aWVTb1p2N1RuOEZSSExZcl9VeWh2cVdRc2FtZjlXSjdVX0p2N1Nsd1g1bzhJX0lPREpVa1ZfWHY0ZkE4RElGYllNTGw5ZnJfSzZpX2w1Vk1DVTMwcXlaelVyWFU1cGVoTUdhamJQcDIzTTM1Q0t4Y2V5MkJoUGxMMmFaeTd4TkFUVnNDR0pzWlAwSXk3SlRkR3JHUGRtS1dzRGsxUlpTbnlFaTR0NFRBV0pESFc2U2kzLUpRa21kVUd5TmxFQi1hWWc2emc?oc=5&hl=en-US&gl=US&ceid=US:en,https://www.apg-wi.com,apg-wi.com,,{'https://lh3.googleusercontent.com/J6_coFbogxhRI9iM864NL_liGXvsQp2AupsKei7z0cNNfDvGUmWUy20nuUhkREQyrpY4bEeIBuc=s0-w300'},
"The overlapping factors behind Nepal, Bangladesh and Sri Lanka’s uprisings - Himal Southasian","The overlapping factors behind Nepal, Bangladesh and Sri Lanka’s uprisings  Himal Southasian",2025-10-01 13:47:23,https://news.google.com/rss/articles/CBMiigFBVV95cUxPOUtaNFpMZlV1a0ZUM2RacThaNlMyeFJPdDhYVmZGNnJKdkROTDRfSjNlN3JtOVJSUENhVnU0aDEwVmFiN0RDRU5hUzFoR2JjQUZRY3BCSUVPRHh3SWd1bG9mVFMyZi01djk1dERQV2lFZmJiQ1RBWm51UHh6OGxpN252RVJiQVJvMmc?oc=5&hl=en-US&gl=US&ceid=US:en,https://www.himalmag.com,Himal Southasian,,{'https://lh3.googleusercontent.com/J6_coFbogxhRI9iM864NL_liGXvsQp2AupsKei7z0cNNfDvGUmWUy20nuUhkREQyrpY4bEeIBuc=s0-w300'},
A two-year-old girl is chosen as Nepal’s new living goddess - MSN,A two-year-old girl is chosen as Nepal’s new living goddess  MSN,2025-10-01 14:04:26,https://news.google.com/rss/articles/CBMihgJBVV95cUxQajdUU1dtb3dJdm1sYWozdWtnZW00eGJFX2Z0alQxZURsSUNnWlNtc2Y0amFCZDA5U0FoOWtJdjc3aEdHU20wRzJtMC1vYlZpcGxhVHprZlFtZEQtSHhBNGRsQV9leTNRbzl5ZmtoUDlUZUs5Ync1V2lWNXg3VHQtS2JhQ2MyLVE3RHRIV1JWdDQtT0NqS0o5a2pxNk5NR2FHblhqSGV5Nl94eTNfU3F0dTBSUmN2RmRiNE1vYUU0MWVYTW5hMGxhMDA5TlJIeXV0Q19nbUtVcGZVUS1YZ1lkUnhiWi1zRmNITmlVNGNSOWRBN3N3UTgyOUNMcVR2endVUUhVYWlR?oc=5&hl=en-US&gl=US&ceid=US:en,https://www.msn.com,MSN,,{'https://lh3.googleusercontent.com/J6_coFbogxhRI9iM864NL_liGXvsQp2AupsKei7z0cNNfDvGUmWUy20nuUhkREQyrpY4bEeIBuc=s0-w300'},
Nepal's Sandeep Lamichhane suspended from two T20Is against West Indies - ESPNcricinfo,Nepal's Sandeep Lamichhane suspended from two T20Is against West Indies  ESPNcricinfo,2025-10-01 14:38:42,https://news.google.com/rss/articles/CBMitAFBVV95cUxOX2JBWkxNUUM3RVoxRTJEWmZTdThhMzJTQkVwOUUxcFBCUlN3TXFRd0FuNHM3dGNWU3dVM29aRVFNaUpJc0Q2cU9nRmNQWE1SQXJ6bDVXNDVYTUhDUndiVWZGbWZPS1ExZmhwcnFERDgtSUxRSVRuVF9SZFY0eWxmajhkbUtjUVhqVzBuTjlLXzZjZU8wTWVrcEVYaXBGeUM3NF9aR3VMVll5NlRUQkdleFVCd2I?oc=5&hl=en-US&gl=US&ceid=US:en,https://www.espncricinfo.com,ESPNcricinfo,,{'https://lh3.googleusercontent.com/J6_coFbogxhRI9iM864NL_liGXvsQp2AupsKei7z0cNNfDvGUmWUy20nuUhkREQyrpY4bEeIBuc=s0-w300'},
Kilian Bron Takes On The Mountains Of Nepal - Unofficial Networks,Kilian Bron Takes On The Mountains Of Nepal  Unofficial Networks,2025-10-01 16:22:24,https://news.google.com/rss/articles/CBMid0FVX3lxTE9YSzQyMnl5R3ZEYUFrVWk3dUNEOTZoMlZGNTZ0NFBsR2o0UHQyWmdSRDRvdXpXbll6VmsyZlRiRHd3Um1KY1B4TTZ5czA4bUJpMHRSZi1vRXBkcTFlT05NTVlkZ0FDZS01ZHNjQ0F4ZkV6SHh3WVZn?oc=5&hl=en-US&gl=US&ceid=US:en,https://unofficialnetworks.com,Unofficial Networks,,{'https://lh3.googleusercontent.com/J6_coFbogxhRI9iM864NL_liGXvsQp2AupsKei7z0cNNfDvGUmWUy20nuUhkREQyrpY4bEeIBuc=s0-w300'},
Sanjal.com Launches: A Bold Knowledge Sharing Platform Born from Nepal’s Social Media Ban - The Globe and Mail,Sanjal.com Launches: A Bold Knowledge Sharing Platform Born from Nepal’s Social Media Ban  The Globe and Mail,2025-10-01 16:58:35,https://news.google.com/rss/articles/CBMi_AFBVV95cUxPY1FScHF6NDVTTGg3N2wya2RrU196cFQwMjFjWVZkSzVCeU9XUG1YUGNvaXNWbnJPM3BBeE5HajVrMDdPX1pYZE9kNGdBZXZTNkYtcjFyUDZ1NmZSRi02cUxKTHdHUTJVNUdZVTRqeTFkMjlGVW5ueW5EaGdHQzJDRG1oYXh4OEVuMnFib0FQVEVQc1dGQUpqcWU5TXg4dld2VkVaNTVDLTRLSnc0MHM3dnJwUFNPU21hSGNmR1JyV2dhdzROdS05WnRaTnZFaFVNOENzQUQzQ2FraDhEbFkzMVV5R0tmejJsWGFZa1ppUlZNaUY4akhwR2pzRjA?oc=5&hl=en-US&gl=US&ceid=US:en,https://www.theglobeandmail.com,The Globe and Mail,,{'https://lh3.googleusercontent.com/J6_coFbogxhRI9iM864NL_liGXvsQp2AupsKei7z0cNNfDvGUmWUy20nuUhkREQyrpY4bEeIBuc=s0-w300'},
Nepal: New Two-Year-old Girl Chosen as Living Goddess - WION,Nepal: New Two-Year-old Girl Chosen as Living Goddess  WION,2025-10-01 17:21:00,https://news.google.com/rss/articles/CBMingFBVV95cUxNdHBWOURTU1hFNDd6SVQyU3EwZng0eElfOUxtMFVqLTVYUG5xS2poQWZMSXVXOWJ2N3hsbUp3M202LTloSWhPR25WY09TeGllSzdJXzVXUWE0dmd4eTFQeU5qbHk3RGFoamJpSG1rWG9FRkdXOUZVNWxNQnFHakVlR1JKbTlJNy1FTnd2WU54TDU4MW9iWkFEVTcyNWNod9IBowFBVV95cUxPNHFqNTAxUlp6VktRd0VJVUFHSWZocXJENU9ENDRyQzRkdDR6eVJLNEszc09SeWNDNHRpckZYNnFVRFJUY0hkamdxd0FTb2M5OXFVc3VkTXoxVjhlQWNrOXVOYXp3UXNSUXJCVG9QbmZ5ZHFVT2FxelVhRi10aXNOd2dkdE00Yk1FNmw0WEZxSHpqQ2ppVTRvcnFRZl9vVndWY0dF?oc=5&hl=en-US&gl=US&ceid=US:en,https://www.wionews.com,WION,,{'https://lh3.googleusercontent.com/J6_coFbogxhRI9iM864NL_liGXvsQp2AupsKei7z0cNNfDvGUmWUy20nuUhkREQyrpY4bEeIBuc=s0-w300'},
India's hand behind Nepal's historic feat in Sharjah - The New Indian Express,India's hand behind Nepal's historic feat in Sharjah  The New Indian Express,2025-10-01 18:00:00,https://news.google.com/rss/articles/CBMiowFBVV95cUxPaXlGVWY2aS1oTzV5MzM2bWRKTnlETzduM0FHNjQwakh3NW1Da2NJSjBaRjZ6X3J5TzdYN0VDVXZXS3lBQlRDeHEtbmwySkg2R0wtaWpqVjk0bFpqTGpiYlVoZjBXWWhMYmNrT0dybWV2YmJwM0EyRFdaZE0xVTctemJsLUFacnNEakctMzhTZnRRS2w3bFR6LWVmMDA1TEJ4dTBj0gGwAUFVX3lxTE95WkZJY1Bkc0w5Y2pReXZ1QjdIc1FCT1RPQ0txTHAzbXE3RjhlQW4yRHZFZGU1ejdQZ0M5WFpSeEtobU9rc2k3cVRRcmJDN2MxZ1hZdE5rTUY0X1Frci05clVTblRIZ2RCWVhCMGV6TnRiOEIyOXVrWmYxY09Da3NkNzRJaENaVDhGekk1RVBfbmttWXZmWGZ1ajN4UkV6R2pPSWJGUGtteW9LV3FRRzJm?oc=5&hl=en-US&gl=US&ceid=US:en,https://www.newindianexpress.com,The New Indian Express,,{'https://lh3.googleusercontent.com/J6_coFbogxhRI9iM864NL_liGXvsQp2AupsKei7z0cNNfDvGUmWUy20nuUhkREQyrpY4bEeIBuc=s0-w300'},
Series win for every Nepali who stood behind us in difficult times: Nepal captain - The New Indian Express,Series win for every Nepali who stood behind us in difficult times: Nepal captain  The New Indian Express,2025-10-01 18:00:00,https://news.google.com/rss/articles/CBMiywFBVV95cUxNTDlVUE5Ob0UyeUs1N01LZWpaRkdybmw4YVdsSzNVRUJHT2Z3czFTOTAzZmkzOXFJVENURWhsWjM4VFFxYjNPOXE1bUpQSFBNNGo4TmFmQ0c5Tm9Pd05KWldRUlNZeTM5eGxhNDN3ZGdqSHU4RXJyMW02UnNpZlRYUGJZTFRuTERWaDlsamxuaHNaaVIyRGpuYmwyQ1JXcGpzVTA1WVlLbFNJWXlBMVlfVTFKOEVEeGFZRGVQbmZlajVWcmRFSVNBWE1hTdIB2AFBVV95cUxPSjhtMFBpSThJdFhVYWg4YnIxRVBCd192N01ZNXJVdmQzcHJIUWw5R2UxQUNOM0lveHFDdEYzMnBMaFAzWGlxTGtaQ3V0ZWdVQ3JFbTFWeElZbkRHSElOMGRPb2c0ZmpaTXFqRDJVX2tidGJMRVJuU0hmNlpTVTdZTVVkcURJZEhMY3YwT3VieW5rb3ZQYlIzeEZmN25QMG1HY2tQMUp1Zklnal9fSGVXSGt2clZKVDNSOU9OeHdPbV9XVVVZdFZyeHVoTi1aN0NfUWF4OUpDMHg?oc=5&hl=en-US&gl=US&ceid=US:en,https://www.newindianexpress.com,The New Indian Express,,{'https://lh3.googleusercontent.com/J6_coFbogxhRI9iM864NL_liGXvsQp2AupsKei7z0cNNfDvGUmWUy20nuUhkREQyrpY4bEeIBuc=s0-w300'},
