title,description,published date,url,publisher.href,publisher.title,full_article,images,translated
RSP’s Statute Makes Rabi Lamichhane the Party’s Undisputed Power Centre: Everything You Need to Know - Nepalnews.com,RSP’s Statute Makes Rabi Lamichhane the Party’s Undisputed Power Centre: Everything You Need to Know  Nepalnews.com,2026-07-07 08:45:55,https://news.google.com/rss/articles/CBMi2AFBVV95cUxQWDJaX2xQMmFDSjE4MU10Q3BqNEVWYjVTQnFBRmMtNkJxU21lTDR0M1dBeTNPODkyYi1VTE9OelhkNFhDS0NWcWwwNGJXMEpsdXhTOHhLS1VhcU50R0l3ZGVMaTh4YUd3YUtBR3B0Tmw2eXpkVVpCWkM0TVBSdnJyaDFRNmcxdHBUVkZ1Z09QblBHN3JNdmpwZkxPODdnX2ZJNUhZXzBfYmQyX08tVTlablRjSlptVlZVUzM3Sk5SZ1F1UkpNMDFMNm1RUVVRSDgyOHJrNFhBVHY?oc=5&hl=en-US&gl=US&ceid=US:en,https://english.nepalnews.com,Nepalnews.com,,,
Precipitation below expectation in Madhesh and Lumbini Provinces: DHM - Nepalnews.com,Precipitation below expectation in Madhesh and Lumbini Provinces: DHM  Nepalnews.com,2026-07-07 08:45:55,https://news.google.com/rss/articles/CBMirgFBVV95cUxNQzlrVlJlTUJYUDczQkpJY29xZGplWGNBNktoOVIzSi1ObTJVb01tdU90U0J2Y0lBLTVsb1lJSWJXdmNuSGpUTm1YUHR3RmlFeWR2RWF1ME1wZWpiQ0xNM2NRNFdlTWp0d2lpa25PbEh2clpXS1YyUUJLTkN1U29jVmtuUGFZNTV2T3BsMzFkdi04RW00a0w3R0dDMzRCdHpWZW01Z0g4dVk2azRENkE?oc=5&hl=en-US&gl=US&ceid=US:en,https://english.nepalnews.com,Nepalnews.com,,,
The long shadow of caste: How Nepal’s Muslims were pushed to the margins - Nepalnews.com,The long shadow of caste: How Nepal’s Muslims were pushed to the margins  Nepalnews.com,2026-07-07 09:01:25,https://news.google.com/rss/articles/CBMisAFBVV95cUxNbUtBWjBXYWJpeW9SWkEwbjdMRTdMakdwOVJDTXFCZmRxdkJ4SC10VnFfMzFoaEtObG9qMjAwZk1Id3FaeEVrRklRZGhGU0J6YkhGSUNoRVhueG1TcEx1emplYjBkMUdFbWY2QzU4cHFlOWhScUxRR2NNQ1pwYjhRVngwTl9vREkxazBQT1o1ellpQzYzWDRyYlE1WlFfN0JLTHRnU2pQNWhiRzNkUVNEeg?oc=5&hl=en-US&gl=US&ceid=US:en,https://english.nepalnews.com,Nepalnews.com,,,
Organic sales center opens in Chitwan to connect farmers with consumers - Nepalnews.com,Organic sales center opens in Chitwan to connect farmers with consumers  Nepalnews.com,2026-07-07 09:11:30,https://news.google.com/rss/articles/CBMiswFBVV95cUxNNHA2MVB2dERnLXpKZEdYXzNBU0lWdHBaUHk2ajhQcWNxeVdXX0ZCS2x0NGJCWUZmZ1psUXY4eERCbDRRSlJSbHczYmVEek5tUkVva2l3Qzc1Y2NGRkt0ZVRDeVJPUVB5V0paYmxkVTN4T0ZmSTVDWlk4Mzg5WFhyUTgyVHNoOWpFOHNOcll1Slk2Qm5fbkkxZGJ2YS1EbnRNZnlwaXk4cGktSXpvOERsNThTRQ?oc=5&hl=en-US&gl=US&ceid=US:en,https://english.nepalnews.com,Nepalnews.com,,,
UAE govt grants royal pardon to 111 Nepali nationals - The Rising Nepal,UAE govt grants royal pardon to 111 Nepali nationals  The Rising Nepal,2026-07-07 09:11:53,https://news.google.com/rss/articles/CBMiUEFVX3lxTE8ycFRIeTZSSXFKT1UzQzEwWVhpS0hyRWt6VjBWSVY3WTYtU0QtdnNJYjM2QkxTcHBFeE9NdHY1VWNpZUdoeHZxcldYZ2pYR3hr?oc=5&hl=en-US&gl=US&ceid=US:en,https://risingnepaldaily.com,The Rising Nepal,"Kathmandu, July 7: The government of Nepal has expressed its gratitude and appreciation to the government of the United Arab Emirates (UAE) for granting a royal pardon to 111 Nepali inmates on the occasion of Eid al-Adha this year.

Issuing a statement today, the Ministry of Foreign Affairs, Nepal, acknowledged the gesture of pardon as a manifestation of the deepening friendship and cordiality between Nepal and the UAE.

According to the Ministry, the UAE government took the decision of the pardon in response to the requests made by the Nepali Embassy in Abu Dhabi as per the Ministry's instructions.

The Ministry said that the pardoned Nepali nationals will be allowed to return to Nepal after completing the required legal and administrative procedures under the UAE law, provided they have no other pending legal cases and travel restrictions. (RSS)","{'https://risingnepaldaily.com/commons/rising-logo.png', 'https://risingnepaldaily.com/storage/media/105644/conversions/news-cover-original-thumb.jpg', 'https://risingnepaldaily.com/storage/media/105651/conversions/ADM-chief-with-PM-Shah-original-thumb.jpg', 'https://risingnepaldaily.com/storage/media/105645/conversions/dhm-square-thumb.jpg', 'https://risingnepaldaily.com/storage/media/105649/conversions/Gauri-Kumari-square-thumb.jpg', 'https://risingnepaldaily.com/storage/media/105648/mofa.jfif', 'https://risingnepaldaily.com/storage/media/105647/conversions/RSS--6F8A9719-square-thumb.jpg', 'https://risingnepaldaily.com/storage/media/105649/conversions/Gauri-Kumari-original-thumb.jpg', 'https://risingnepaldaily.com/storage/media/105642/conversions/Untitled-22-original-thumb.jpg', 'https://risingnepaldaily.com/storage/media/105645/conversions/dhm-original-thumb.jpg', 'https://risingnepaldaily.com/storage/media/886/conversions/logo-thumb-thumb-thumb.jpg', 'https://risingnepaldaily.com/storage/media/105642/conversions/Untitled-22-square-thumb.jpg', 'https://risingnepaldaily.com/storage/media/105641/conversions/Untitled-1-(3)-original-thumb.jpg', 'https://risingnepaldaily.com/storage/media/105647/conversions/RSS--6F8A9719-original-thumb.jpg', 'https://risingnepaldaily.com/storage/media/105646/conversions/Untitled-5-original-thumb.jpg'}","काठमांडू, 7 जुलाई : नेपाल सरकार संयुक्त अरब अमीरात (यूएई) सरकार के प्रति आभार आ प्रशंसा व्यक्त केलक अछि जे एहि साल ईद अल-अधा के अवसर पर 111 नेपाली कैदी के शाही माफी देलक अछि।

आइ विज्ञप्ति जारी करैत नेपालक विदेश मन्त्रालय नेपाल आ यूएईक बीच गहींर होइत मित्रता आ सौहार्दपूर्णताक प्रकटीकरण माफीक इशारा स्वीकार केलक अछि ।

मन्त्रालयके अनुसार अबुधाबीमे रहल नेपाली दूतावासके आग्रहके उत्तरमे यूएई सरकार मन्त्रालयके निर्देशानुसार माफीके निर्णय लेलक ।

मन्त्रालय जनौलक अछि जे माफी पाएल नेपाली नागरिकके यूएई कानून अन्तर्गत आवश्यक कानूनी आ प्रशासनिक प्रक्रिया पूरा कए नेपाल घुरबाक अनुमति देल जाएत, बशर्ते हुनका सब लग अन्य कोनो लंबित कानूनी मामला आ यात्रा पर रोक नहि अछि । (आर एस एस) २."
ADB pledges $2.4 billion support for Nepal’s economic transformation - Khabarhub,ADB pledges $2.4 billion support for Nepal’s economic transformation  Khabarhub,2026-07-07 09:24:54,https://news.google.com/rss/articles/CBMiWEFVX3lxTE50bE1CU2RVSml6NlJkVFhtemlUT0E4R0QtQWUtNWlVNFMtMEZoTVBKeUo1aTVqaXFPZzB4M2JlSFZOWlpLZUsydlNaZjFHSW80dEVEMHFRVHo?oc=5&hl=en-US&gl=US&ceid=US:en,https://english.khabarhub.com,Khabarhub,"KATHMANDU: The Asian Development Bank (ADB) has announced plans to provide around $2.4 billion in financial support to Nepal over the coming years, focusing on economic transformation, job creation and investment promotion.

ADB President Masato Kanda made the announcement during his meeting with Prime Minister Balendra Shah in Kathmandu.

During the meeting, Kanda congratulated Prime Minister Shah on his strong mandate and expressed ADB’s commitment to further supporting Nepal’s development plans.

ADB and Nepal have maintained a six-decade partnership, with the development bank contributing to improvements in sectors including education, energy, infrastructure and employment opportunities.

The ADB said its future support would focus on accelerating Nepal’s economic growth and achieving sustainable development through closer cooperation with the government.

The assistance package will also support reforms aimed at increasing investment and creating employment opportunities in the coming years.

Prime Minister Shah welcomed ADB’s continued support and said the government would utilise the assistance to advance Nepal’s development and prosperity.","{'https://english.khabarhub.com/wp-content/themes/Khabarhubenglish/img/icons/appstore.svg', 'https://english.khabarhub.com/wp-content/themes/Khabarhubenglish/img/logos.png', 'https://english.khabarhub.com/wp-content/themes/Khabarhubenglish/img/logo-white-sm.png', 'https://english.khabarhub.com/wp-content/uploads/2026/07/Sanga-underpass-150x100.jpg', 'https://english.khabarhub.com/wp-content/uploads/2026/07/Roshan-Pokharel-150x100.jpg', 'https://english.khabarhub.com/wp-content/uploads/2026/07/Masato-Kanda-and-Balen-Shah-150x100.jpg', 'https://english.khabarhub.com/wp-content/uploads/2022/04/Nepal-_-UAE-350x250.jpg', 'https://english.khabarhub.com/wp-content/uploads/2019/01/logo-300x300-1-150x150.png', 'https://english.khabarhub.com/wp-content/themes/Khabarhubenglish/img/icons/linked-in.svg', 'https://english.khabarhub.com/wp-content/themes/Khabarhubenglish/img/icons/instagram.svg', 'https://english.khabarhub.com/wp-content/themes/Khabarhubenglish/img/icons/viber.svg', 'data:image/gif;base64,R0lGODdhAQABAPAAAMPDwwAAACwAAAAAAQABAAACAkQBADs=', 'https://english.khabarhub.com/wp-content/uploads/2026/07/Masato-Kanda-and-Balen-Shah.jpg', 'https://english.khabarhub.com/wp-content/uploads/2026/07/khagendra-khusbu-mahendra-150x100.jpg', 'https://english.khabarhub.com/wp-content/themes/Khabarhubenglish/img/icons/playstore.svg', 'https://english.khabarhub.com/wp-content/themes/Khabarhubenglish/img/icons/youtube.svg'}","काठमाण्डु : एशियाई विकास बैंक आर्थिक परिवर्तन, रोजगार सृजन आ निवेश संवर्धन पर केन्द्रित आगामी वर्ष मे नेपाल केँ लगभग २.४ अरब डॉलर आर्थिक सहयोग देबाक योजना घोषणा केलक अछि ।

एडीबी के अध्यक्ष मसातो कांडा काठमांडूमे प्रधानमन्त्री बलेन्द्र शाहसँग बैसारके क्रममे ई घोषणा केने छथि ।

बैसार के दौरान कांडा प्रधानमंत्री शाह के मजबूत जनादेश के लेल बधाई दैत नेपाल के विकास योजना के आओर समर्थन देबय के लेल एडीबी के प्रतिबद्धता व्यक्त केलखिन्ह.

एडीबी आ नेपाल छह दशक के साझेदारी कायम रखने अछि, जाहि मे विकास बैंक शिक्षा, ऊर्जा, बुनियादी ढांचा आ रोजगार के अवसर सहित क्षेत्र मे सुधार मे योगदान देलक अछि।

एडीबी कहलनि जे, ओकर भविष्य मे सहयोग सरकार के संग घनिष्ठ सहयोग के माध्यम सं नेपाल के आर्थिक विकास मे तेजी आ सतत विकास प्राप्त करय पर केन्द्रित होयत।

सहायता पैकेज स॑ आबै वाला सालऽ म॑ निवेश बढ़ाबै आरू रोजगार के अवसर पैदा करै के उद्देश्य स॑ सुधारऽ म॑ भी सहायता मिलतै ।

प्रधानमंत्री शाह एडीबी के निरंतर सहयोग के स्वागत करैत कहलनि जे सरकार नेपाल के विकास आ समृद्धि के आगू बढ़ेबा लेल एहि सहयोग के उपयोग करत।"
"Government active in boosting production, productivity, and employment: Industry Minister - Nepalnews.com","Government active in boosting production, productivity, and employment: Industry Minister  Nepalnews.com",2026-07-07 09:31:25,https://news.google.com/rss/articles/CBMixAFBVV95cUxPMnJJY1cyRFhaTXk2WEsyc1Z1Z2NfNy0tQlc2R29odEhJSWZ0dC1KejctYWI1LXJEYWZNNlZQUDB3YTN2OTVZSTlIczNiNXM3X3p4cEk2OXJWcGhSWkotUTdsazJzRVg2WkdqNU0tTGtYLWRDNDVsU0NwOC13M2U0Y0Q0X1llblZOX1Y1TkJ5Z1pyVUR4U3FLVy1PbEU1SXYzQThyWjNSR0FUVDFOLTQyU1NpbXdncTJRejlSaWFFNVNmTlpr?oc=5&hl=en-US&gl=US&ceid=US:en,https://english.nepalnews.com,Nepalnews.com,,,
