title,description,published date,url,publisher.href,publisher.title,full_article,images,translated
Foreign Secretary Misri gifts six vehicles to NA - The Rising Nepal,Foreign Secretary Misri gifts six vehicles to NA  The Rising Nepal,2025-08-19 01:45:52,https://news.google.com/rss/articles/CBMiUEFVX3lxTE8tc0owdDZ6M05Ma1dicFJuV1hYbV80OUV1blB1OHlJSXViSVd1TUk2M1hIcVdfdEo4dG81OS1iTFdyai1aWjJVd29wZ3ZaRGJE?oc=5&hl=en-US&gl=US&ceid=US:en,https://risingnepaldaily.com,The Rising Nepal,,{'https://lh3.googleusercontent.com/J6_coFbogxhRI9iM864NL_liGXvsQp2AupsKei7z0cNNfDvGUmWUy20nuUhkREQyrpY4bEeIBuc=s0-w300'},
Nepal suffer third straight defeat in Top End T20 Series - The Rising Nepal,Nepal suffer third straight defeat in Top End T20 Series  The Rising Nepal,2025-08-19 01:51:15,https://news.google.com/rss/articles/CBMiUEFVX3lxTFAwb1Z2YU9BeHVERnJlRS15RlVoR3ZZZmtBeVozOWNkNHZEaU9rMTlrVERSZlM4MC1vemNFbzZicWVfLWNFLWtqUWVUYU01MHBh?oc=5&hl=en-US&gl=US&ceid=US:en,https://risingnepaldaily.com,The Rising Nepal,,{'https://lh3.googleusercontent.com/J6_coFbogxhRI9iM864NL_liGXvsQp2AupsKei7z0cNNfDvGUmWUy20nuUhkREQyrpY4bEeIBuc=s0-w300'},
Economic Digest: Nepal’s Business News in a Snap - Khabarhub,Economic Digest: Nepal’s Business News in a Snap  Khabarhub,2025-08-19 02:16:04,https://news.google.com/rss/articles/CBMiWEFVX3lxTFA4VmE2RW5WMHgtbFlXZVZFYlJjV3hvMEttUjhrZ0RUalBONzlqeEFQYWhvM2h2ejZWSGF6Z25CMk5fSlhsTXQtd2RxZlVwNlR5WlNLX1V1YUM?oc=5&hl=en-US&gl=US&ceid=US:en,https://english.khabarhub.com,Khabarhub,,{'https://lh3.googleusercontent.com/J6_coFbogxhRI9iM864NL_liGXvsQp2AupsKei7z0cNNfDvGUmWUy20nuUhkREQyrpY4bEeIBuc=s0-w300'},
Oli’s upcoming India visit shows the trust gap is narrowing. Nepal’s China card has limits - ThePrint,Oli’s upcoming India visit shows the trust gap is narrowing. Nepal’s China card has limits  ThePrint,2025-08-19 02:49:58,https://news.google.com/rss/articles/CBMiwgFBVV95cUxOSHpVcWhSel9hMEVxRUticnBRbkplOHUwOEV0YVBXODJzVnBuMjFPa0tFMFNuVXRSdTk3aU42dm5jTFVadDUxYXpHdDVId0RqMVRSZExFMXNFSEFWTEszRUgtMTRkT2R1bjg5NmZGNm1CZF9sNnQ3S29qakNmekdtZFU3eXlSNDJ3UTdqZXVhV0lKR1dkY0JlckhKLXdNRURSS1BYWERWV1dUWVFRckZ3VzZLRW9qSklCWjBwQVpSRmZLQdIBxwFBVV95cUxOeEhVYi1KNmRsMmZXVlZyaGZiMkJqLWdQQ2FabDFqWmdJTDdwUzQ0SHV3dGdKZmxnaWtrdEd0MEhZbVRaQ0V5cWExdklkclVwbXFhU3ZRQzQtSE9UM0JfdmdGS29mSENtd09CbVpzSkdyb3MtcnJ3Q1hqdER3QmhmVWhoTk1Dd0lKUGZIRzNiM0lob2NEN3RpWFJ6aXZCM0d0V2VONjNLTEplQ19xV1JlNDN6NEhmY19fWlEtcGVPZTZ2WDZDcVVZ?oc=5&hl=en-US&gl=US&ceid=US:en,https://theprint.in,ThePrint,,{'https://lh3.googleusercontent.com/J6_coFbogxhRI9iM864NL_liGXvsQp2AupsKei7z0cNNfDvGUmWUy20nuUhkREQyrpY4bEeIBuc=s0-w300'},
"Nepal eliminates rubella, highly contagious viral disease: WHO - Asia News Network","Nepal eliminates rubella, highly contagious viral disease: WHO  Asia News Network",2025-08-19 02:50:58,https://news.google.com/rss/articles/CBMijwFBVV95cUxQS2NBamhJOXcwYXdJSHA4RlVRdkt0UUlvaTMyUEJ6ZXJuOG9aaTg3T1pYWHlHaGVpTGtrUF8ySU9SSnJGRDZLNXZrMzBhZ0FPRmhfM2ZaS3dvNzM4aHRlWDA3NGk1NkE1TzRBdkM0NDdRRERvRnpDQmhiTm1uNnpnX2hVQkVLZEVPanFlN2d1Yw?oc=5&hl=en-US&gl=US&ceid=US:en,https://asianews.network,Asia News Network,,{'https://lh3.googleusercontent.com/J6_coFbogxhRI9iM864NL_liGXvsQp2AupsKei7z0cNNfDvGUmWUy20nuUhkREQyrpY4bEeIBuc=s0-w300'},
Nepal’s transgender sex workers face violence and exploitation in legal vacuum - Asia News Network,Nepal’s transgender sex workers face violence and exploitation in legal vacuum  Asia News Network,2025-08-19 03:00:35,https://news.google.com/rss/articles/CBMipgFBVV95cUxOUVpZaWdUbnZ5S3Z6eEVUYWdvOG1BbnJfOGF4aUZVbkg3RjNadEdhNVBhdy1RcmgwMnl2SExYTFJzSmdtTGlNQVphSmY4WnQxNjFIb01FX1J1ZzVEUHJmelFfVzhNeTU0N005VHhEVTdKbGNRWktGSVJOYm1iQXRlUldaOFpLXzBMbTNvVXR2dzQ5NnZMQjFIUlYtaGR0V2ZiRTlzeG93?oc=5&hl=en-US&gl=US&ceid=US:en,https://asianews.network,Asia News Network,,{'https://lh3.googleusercontent.com/J6_coFbogxhRI9iM864NL_liGXvsQp2AupsKei7z0cNNfDvGUmWUy20nuUhkREQyrpY4bEeIBuc=s0-w300'},
"Nepal eliminates rubella, earns WHO recognition - Khabarhub","Nepal eliminates rubella, earns WHO recognition  Khabarhub",2025-08-19 03:47:21,https://news.google.com/rss/articles/CBMiWEFVX3lxTE9qRkdyOXBpQ2FVOXZZOVI4ZHBrSy1KZXYtZGpia2dJSG4tRVo1ZzBlWWY4cFgxMy1ERHdYel9oVjl3eXpUZ1JHY1Exa3FZdzR4TmluUjk3LUk?oc=5&hl=en-US&gl=US&ceid=US:en,https://english.khabarhub.com,Khabarhub,,{'https://lh3.googleusercontent.com/J6_coFbogxhRI9iM864NL_liGXvsQp2AupsKei7z0cNNfDvGUmWUy20nuUhkREQyrpY4bEeIBuc=s0-w300'},
Rubella Eliminated As A Public Health Issue In Nepal: Where India Stands - NDTV,Rubella Eliminated As A Public Health Issue In Nepal: Where India Stands  NDTV,2025-08-19 03:48:54,https://news.google.com/rss/articles/CBMisgFBVV95cUxOS2d1dFZKOTNpNlQxLUtXSUxBdzdCejVQMDJtRDI3WGtiVUlOb01ZRXdLTVRHYUhGbzFyOTgzcDNiNElhNTFBc2hqMHFWSkVzMllhMWF3WmtGcTdCWFZsNFZuVFFFV1lYRjNTQ1FxTF9BMXJpU3JGTmVKeFBmU3J2WXBkb04xakQtNzNQdkcyS1Npa1Y5ODk5ZHVOSGJQVGZfVVZIUER4S0RCdnZpZWd1OTBR0gG6AUFVX3lxTE5lSnd0QkpLemQ0a0htV05JZHFTR2RZanZ4MkF3bVZibGFIOUpCcnZaV2hQRWRqSFNReGIzY1g4bDA4Uzdwdzd3QW1KNDlLMFJZbHRnVHF5SEQ1TEFxbGhxcXR0aEdGejk5TGg3b1c4SDdwSGdvUGJEdVNFTjQyakw3RUowUjhId0gxcFlhRlpZX3VnUjlIMDJVTUptalhxMl82YVpnR05RTDdvNjBlb1BfTXZOb09sZS1ZUQ?oc=5&hl=en-US&gl=US&ceid=US:en,https://www.ndtv.com,NDTV,,{'https://lh3.googleusercontent.com/J6_coFbogxhRI9iM864NL_liGXvsQp2AupsKei7z0cNNfDvGUmWUy20nuUhkREQyrpY4bEeIBuc=s0-w300'},
Reimagining the Nepali diaspora - Asia News Network,Reimagining the Nepali diaspora  Asia News Network,2025-08-19 03:55:04,https://news.google.com/rss/articles/CBMiaEFVX3lxTE5QaHZOalNZQkNia1Y3RmhMWC1XTExqc0wyd2UxRXo1OTlVUFR2ZXVBRVREbTNFLUlsakdzMXVTYlFpX2dicmhFX1o4Uk1raGpXSGZFeElZd3EwVF9rUVhGLXlSYzB0cHZn?oc=5&hl=en-US&gl=US&ceid=US:en,https://asianews.network,Asia News Network,,{'https://lh3.googleusercontent.com/J6_coFbogxhRI9iM864NL_liGXvsQp2AupsKei7z0cNNfDvGUmWUy20nuUhkREQyrpY4bEeIBuc=s0-w300'},
Raising the bar: Nepal’s emerging cocktail culture - Lifestyle.INQ,Raising the bar: Nepal’s emerging cocktail culture  Lifestyle.INQ,2025-08-19 04:00:00,https://news.google.com/rss/articles/CBMikAFBVV95cUxQSm10RlFJbC1TUHJIbEVKLTlIMGx0a0x3aUNsNldCWmhRVlN6bDF3eDdBWnZzaW9ZWWRkOTZHOWctNzhtRmREbnFsYXhfTzJBeVo1YnV3UEhhN2wtcW9UN21IcHY4YlB1RUV4MEQ4aVVFNUV2N2JfekJXR3RmX1Y2aUhnVFlBVW9NM1hBRWdPSmzSAZYBQVVfeXFMTTA5cGJPWUtYdGZ1ZmZ5dkRvMG1wd201aWc2WnpyTXdiYzdJbURpRGdsWFdjZ2FSOE5fYXRldld3V08zMkhzbG1ybFE0VnVzVzBGTjNxS2pCVXc4U2wtTUV0djFITWxxZTRzb3RuNE1qY1d1d2JDbFlCRFBrN25tY3FweHltV0JDcXJ6UkI3V0xNck9mMmlR?oc=5&hl=en-US&gl=US&ceid=US:en,https://lifestyle.inquirer.net,Lifestyle.INQ,,{'https://lh3.googleusercontent.com/J6_coFbogxhRI9iM864NL_liGXvsQp2AupsKei7z0cNNfDvGUmWUy20nuUhkREQyrpY4bEeIBuc=s0-w300'},
Nepal Verified for Rubella Elimination: WHO South-East Asia Region Achieves Major Milestone - World Health Organization (WHO),Nepal Verified for Rubella Elimination: WHO South-East Asia Region Achieves Major Milestone  World Health Organization (WHO),2025-08-19 04:09:11,https://news.google.com/rss/articles/CBMi4gFBVV95cUxQdWdoRURkdWd1Z295ZkVNRFg3U01FYXBLdXZkV2xOWXF6cjV6Sjd5bGJwSUhuUHp3RmY2b1ctazZXZHM2NnowUlFiQTBTN1JoSVlTWk1wanlSbW4wN3VsZHdCMjJkNEs3X09Mdk5DVUFJRXBBdXdneVF2V2pYU2FHdGdUT092OGgtYTBGa2hjRzFmWXBaenQ5ZnZrQ3Ntc0I0NGhnbm5udDd6X01PWENheDZWN3BMNnE1UzUzQzdtaFhXUHR5ZUltZDU5SWdfbjZRWFE0SGRMaE9ZYTFMQ3YyZmN3?oc=5&hl=en-US&gl=US&ceid=US:en,https://www.who.int,World Health Organization (WHO),,{'https://lh3.googleusercontent.com/J6_coFbogxhRI9iM864NL_liGXvsQp2AupsKei7z0cNNfDvGUmWUy20nuUhkREQyrpY4bEeIBuc=s0-w300'},
China Foundation for Rural Development marks 10th anniversary in Nepal - The Rising Nepal,China Foundation for Rural Development marks 10th anniversary in Nepal  The Rising Nepal,2025-08-19 04:22:55,https://news.google.com/rss/articles/CBMiUEFVX3lxTFA1M2g2bjFoNmtxVVRCeDR6ZVpkMjBCenVDOUIzV1BGckljMkxWODVRTm8zQk0xLVZ0anBBNlFoM3NoV0FNb2NFa2VaUHVrZ3E4?oc=5&hl=en-US&gl=US&ceid=US:en,https://risingnepaldaily.com,The Rising Nepal,,{'https://lh3.googleusercontent.com/J6_coFbogxhRI9iM864NL_liGXvsQp2AupsKei7z0cNNfDvGUmWUy20nuUhkREQyrpY4bEeIBuc=s0-w300'},
"From Tel Aviv’s ‘Hostages Square’, family pleads for Bipin Joshi’s release - The Kathmandu Post","From Tel Aviv’s ‘Hostages Square’, family pleads for Bipin Joshi’s release  The Kathmandu Post",2025-08-19 04:55:53,https://news.google.com/rss/articles/CBMiwgFBVV95cUxOOU1jMEFCNUFGT05pb0hJTE1DUW5aZ2daVDFJcEljdHBVNEVObWZLUzRObWR3UDNrYkJWVDlDYVlsNXJYUDBoVWdaeDRGMkw2RDhrZ3ktaWpqVENIeVNFTG9ZOExLdE5sbGZpX1dFUFNIRlNMRExvVzJuajZpSzhkOEJqcVExWnJ2aHhuRGxYbk1sTUViUjJzZ1RjQ01BLW1mTjlfaUlrbGdlYlUyOG1VQ01UbWNUMlpGOVVYY0wxVzEtQQ?oc=5&hl=en-US&gl=US&ceid=US:en,https://kathmandupost.com,The Kathmandu Post,,{'https://lh3.googleusercontent.com/J6_coFbogxhRI9iM864NL_liGXvsQp2AupsKei7z0cNNfDvGUmWUy20nuUhkREQyrpY4bEeIBuc=s0-w300'},
Nepal eliminates highly contagious viral disease rubella: WHO - MSN,Nepal eliminates highly contagious viral disease rubella: WHO  MSN,2025-08-19 05:08:52,https://news.google.com/rss/articles/CBMirgFBVV95cUxQYjluZTlTYUphb3NGN3g2QldReUZZX2dVeG1mMHhQTUp0MF9WOFNuRTBLbGd1aE9raGg4am5Db2ZUbzJVbXVlUzlra2FVX1ZQYjZ0aGpTUHNJYk9hcnhDZlA2YnhadFBwVVlnVTRaS29UUkRzMGJKMEpqbDlmNTFxOWVTWGJncEZrWmtWZVZFNTZoRE05UzBSR3FqOGFuSlA3TVo5cEFaQUVlWEJGQXc?oc=5&hl=en-US&gl=US&ceid=US:en,https://www.msn.com,MSN,,{'https://lh3.googleusercontent.com/J6_coFbogxhRI9iM864NL_liGXvsQp2AupsKei7z0cNNfDvGUmWUy20nuUhkREQyrpY4bEeIBuc=s0-w300'},
Top 10 Wealthiest Nepali Cricketers in 2025 Earning Big from Cricket - Vocal,Top 10 Wealthiest Nepali Cricketers in 2025 Earning Big from Cricket  Vocal,2025-08-19 05:24:49,https://news.google.com/rss/articles/CBMimwFBVV95cUxOYXRJeDIzLW80dFZPdnhnc09pbEdIZGVuWVdtRnAtdzBOZXE5NWhxd0NQRXVqYUJ5Y09LdE5qUkVYb19TUFFpV0l6cV9OUkZQVHlYeXF5VTU0RVJiWXdwM3Y3aVVfbWhMRDZzM1RzMDJxWEJId2l1OTFlc1lrQzV1ei10b2RFRGtBcXZaWC1kcTdFajktQzdXOE9KSQ?oc=5&hl=en-US&gl=US&ceid=US:en,https://vocal.media,Vocal,,{'https://lh3.googleusercontent.com/J6_coFbogxhRI9iM864NL_liGXvsQp2AupsKei7z0cNNfDvGUmWUy20nuUhkREQyrpY4bEeIBuc=s0-w300'},
"Nepal Eliminates Rubella, Earns WHO Praise; India Strives To Meet 2026 Target - Outlook India","Nepal Eliminates Rubella, Earns WHO Praise; India Strives To Meet 2026 Target  Outlook India",2025-08-19 05:30:49,https://news.google.com/rss/articles/CBMiwwFBVV95cUxPTFNwZnAwVTZIYUJQbjM5bkNKYXdidEN4MXNoTXZxaDk3LUdWR3o4bUpfc2Fnb29uXzFnY18tbU00U2paWTVSWUszRnBsUkQtUUFuLVNxc3A4c1B4OU9zMW1vLXJfX2lvNi1lUlJTMFZneGRMcWpQWTlhR2NjUUtyVXBTaDJKZzhfNEFiaUpsWUtWNm54eGdfT0lRODNzeUhTUE1hNEMtdG9VYlB2LWVtbUIwX01HaGRKbjZfcGowVjRnMWM?oc=5&hl=en-US&gl=US&ceid=US:en,https://www.outlookindia.com,Outlook India,,{'https://lh3.googleusercontent.com/J6_coFbogxhRI9iM864NL_liGXvsQp2AupsKei7z0cNNfDvGUmWUy20nuUhkREQyrpY4bEeIBuc=s0-w300'},
Nepal Foreign Minister Arzu Rana Deuba to visit India ahead of PM Oli’s trip - WION,Nepal Foreign Minister Arzu Rana Deuba to visit India ahead of PM Oli’s trip  WION,2025-08-19 05:50:00,https://news.google.com/rss/articles/CBMivAFBVV95cUxOV1NhT3JfRDJxQld6dGZaV2k0b2c5dFRqd3dmQmZuN3pUZmUxM3NfS3A5ek1HRG1HSGdIY2NBWkhCZG1zZFBjVE5tR2ZoeHdnYXFvMjl6QVNHOExqQ01adUVWd0VoS1Q0UjdadW8ydVNaU1E0VVduM0F1VnBULWJkdHhHYkxrdThEN25Ga2JlbHJCM0tTMTRjQU1JVURNN2VRVGh6eTVCMlhmVGpvSTUyaUNPenhiSEVObWY2bNIBwgFBVV95cUxOaldoVUZDckp0U0lZdU56d1Vqa0pmUm9OMXpBLVlIeWgwSjJieml0UEdFQzRTWFpaNXVQWEFqSFFIeXZNQmRSY1Z5bHJ4Q0xxQURLQ3BuWV9nRTlLcDF1X0pnZkw3cDNkX3d3NEdvMko3d2NxMXVnTHh3dFp3M1lqM2lWNWwxRThBdGRFV3hPTEZ3eFBnaFRTcDVsNVpmNl90VWFFM0RXT2diUjVrVTNPblF2UDBydkxsbkNUMVRYN1RWUQ?oc=5&hl=en-US&gl=US&ceid=US:en,https://www.wionews.com,WION,,{'https://lh3.googleusercontent.com/J6_coFbogxhRI9iM864NL_liGXvsQp2AupsKei7z0cNNfDvGUmWUy20nuUhkREQyrpY4bEeIBuc=s0-w300'},
WHO announces elliamnation of rubella in Nepal - The Rising Nepal,WHO announces elliamnation of rubella in Nepal  The Rising Nepal,2025-08-19 05:56:40,https://news.google.com/rss/articles/CBMiUEFVX3lxTFBzWUlJMGdVTEN0MTJGSERLUF9yVnBvWFlrcC1NUDh6eGNMbkFlUC1GZXUycUJYdGJjX3JsaTFVeUg4TlRFLUszaUdlaGxKdjdq?oc=5&hl=en-US&gl=US&ceid=US:en,https://risingnepaldaily.com,The Rising Nepal,,{'https://lh3.googleusercontent.com/J6_coFbogxhRI9iM864NL_liGXvsQp2AupsKei7z0cNNfDvGUmWUy20nuUhkREQyrpY4bEeIBuc=s0-w300'},
"Debt, despair and uncertainty plague Nepal’s Bhairahawa airport - Asia News Network","Debt, despair and uncertainty plague Nepal’s Bhairahawa airport  Asia News Network",2025-08-19 06:21:24,https://news.google.com/rss/articles/CBMikAFBVV95cUxOWlBvSWJPbkxrd1JWcWJCNERwUEJyWFVnRk9EYmEzS0FHanVJNjVoYjYzMFlxX203WkhSTGgzek5BZV85eDBQemdONHFfdTBYQTVxbWNFWU8xcTNQRjYyQWtGSmZjTGdUNGpiRWlOSE53U0lrY1lZQkgyekNGSXFnYmhTcHZnbjBzZDA1Q24zUVg?oc=5&hl=en-US&gl=US&ceid=US:en,https://asianews.network,Asia News Network,,{'https://lh3.googleusercontent.com/J6_coFbogxhRI9iM864NL_liGXvsQp2AupsKei7z0cNNfDvGUmWUy20nuUhkREQyrpY4bEeIBuc=s0-w300'},
Nepal eliminates rubella; India inches closer to milestone - Daijiworld,Nepal eliminates rubella; India inches closer to milestone  Daijiworld,2025-08-19 06:24:24,https://news.google.com/rss/articles/CBMiakFVX3lxTE9HYjFvTDdla1RYR18yOW5fOVJZYW9lZEZ6X1IzclB2WE0zc0RTZXZsSE1ST0hiVVE1V0g4VnJwVi1aWFByTngzVEx5WWNOS09SZmpmMW1UVldrczNnaDdNYjVFalZlNmV0MHc?oc=5&hl=en-US&gl=US&ceid=US:en,https://www.daijiworld.com,Daijiworld,,{'https://lh3.googleusercontent.com/J6_coFbogxhRI9iM864NL_liGXvsQp2AupsKei7z0cNNfDvGUmWUy20nuUhkREQyrpY4bEeIBuc=s0-w300'},
