title,description,published date,url,publisher.href,publisher.title,full_article,images,translated
Nepal thrashes Hong Kong by 9 wickets to set up decider against Afghanistan in U-19 Qualifiers - Asia News Network,Nepal thrashes Hong Kong by 9 wickets to set up decider against Afghanistan in U-19 Qualifiers  Asia News Network,2025-04-17 03:27:22,https://news.google.com/rss/articles/CBMivAFBVV95cUxNc1JUeWdSSl95SzBJcFVCTERISzRxOWV4a3N1MmtIalhaLWFMam5PRmNCLXY4ODd1YXBmNWNCTllTUDhnZHVncUZ3YjdXU0FGeU82NXVvaHlQSzRETHlUOGdjLTJsR3lucHhieGFOaVppeHE0dnhxMnZxRDNWZW4yYUVaSVVja2VLRlQtMlNyOWs5WnlWNGI2VjBvWHlfUjJuTFRCaWN0QzBnRVdEYUJCMldmSkhYR2RmOHdlcA?oc=5&hl=en-US&gl=US&ceid=US:en,https://asianews.network,Asia News Network,,{'https://lh3.googleusercontent.com/J6_coFbogxhRI9iM864NL_liGXvsQp2AupsKei7z0cNNfDvGUmWUy20nuUhkREQyrpY4bEeIBuc=s0-w300'},
Nepal’s Sindoor Jatra festival celebrated with colour and chariot processions - Asia News Network,Nepal’s Sindoor Jatra festival celebrated with colour and chariot processions  Asia News Network,2025-04-17 03:41:40,https://news.google.com/rss/articles/CBMipAFBVV95cUxOWXZKbVBKY185cUJKRVBqcGpMNEtCWmktdFZaZVdBd3B2ZVhZbzhxdnI0SlE0RXFkTHBpV0lsYTUyMU4yR0pRWnFRaTl6OUFDOGhsejZORG02cGU3eTdacDZHNTU2ZV9WS1hPWDF3Y2N5dUJfSF82NVl0M29oZ01xeG9FcjVHTVZ3N3ptNkdkd0tXNFJ4NGpLSVBfNVZzakJkUDhkYQ?oc=5&hl=en-US&gl=US&ceid=US:en,https://asianews.network,Asia News Network,,{'https://lh3.googleusercontent.com/J6_coFbogxhRI9iM864NL_liGXvsQp2AupsKei7z0cNNfDvGUmWUy20nuUhkREQyrpY4bEeIBuc=s0-w300'},
"Meet Nepal’s only billionaire, ‘The Noodle King,’ who transformed a simple idea from Thailand into a glob - Times of India","Meet Nepal’s only billionaire, ‘The Noodle King,’ who transformed a simple idea from Thailand into a glob  Times of India",2025-04-17 04:30:00,https://news.google.com/rss/articles/CBMilgJBVV95cUxOWjhxMWowdWFrOTRPYnB4UWpleFNrem5nVXcyeDc4N1RKNi1UVHlLeTByVm55a0hsNGZjMnF6MTFjVmp4eTVOdGJqTGg2RXNLTVF1bXpxXzhsVlZwWk9CTGN2cGFrdVNjdzRYVWlqbUpCYzE2ZWkweGxVd0tNNmhlN1FwbnVrMmM4d0NGcXB2NVNUQWxuRjM0MHVibDFVLUxwNGYzS3c2ZkVsclctMUdCbnhMRm9CT2l4N0d5S3dsTXM0d1BTdEV1LU1jdjB5anZJMjJuNFlUd0FSSERGMVAxMUl5aXFjT0NyWV9hVzNkZEFXZ2YyUmRBaU5pcVZsNWhwNy1KTDkxZmFZNWM1Z0VXTmdlLUlVd9IBmwJBVV95cUxPWW10UUJTdGZHbTBFdnBueGpaOFZPQUhqOWxfUG9pX1dLbUJnOU83azlTYzQyUERQOU5RNlB6WEFxYTFyRDVjYmRudXlDRldkSkpYeGtMQlc2aEFKU2pRUjdMUzFzNl9WRDdwWU9VQ24wMTNlYng2US1TdHkxLVI3QU0wT05OTFVXcmI2dmM3blUzc1Ywa3JaR2xBNmdNVkhnaXcxeTZ1OFAyeGp0dFJ4bDc3eWxJem9HN1RaXzhjMjlIRmc1ZjZUVUhMQm9EOS1KZkJwMmhjV2UtRm95RVZOTmdpNlVKRGxBLVpjYVNSRFNtMThrMUlHbnpKeGpySXIxY0toNUdnTzRFaVY0ZFlGT0hvTnEzRzRhTUw0?oc=5&hl=en-US&gl=US&ceid=US:en,https://timesofindia.indiatimes.com,Times of India,,{'https://lh3.googleusercontent.com/J6_coFbogxhRI9iM864NL_liGXvsQp2AupsKei7z0cNNfDvGUmWUy20nuUhkREQyrpY4bEeIBuc=s0-w300'},
Nepal pushes Meta to register amid tougher social media rules - The Kathmandu Post,Nepal pushes Meta to register amid tougher social media rules  The Kathmandu Post,2025-04-17 05:31:34,https://news.google.com/rss/articles/CBMiqwFBVV95cUxNWDNqeThJdnFBckZ3bEJFWGlhYXJwVi1BVlBpQlljWTB5SGdid280dWt2U0JmNTdzMDVaRHh0Y2drWGlCaHp3SEM0dTFlZW1nQXBYVHdYOFVLMjM2NWd3T2hnbHlkb0xlbFZGT3J5djgtLU5telViRmlkeGVQRE5Md3lDREUtLWVBd013NkhtNFJQSWZwRWU5aE10ck5MYlZHd0F3Z1VWbnJOOW8?oc=5&hl=en-US&gl=US&ceid=US:en,https://kathmandupost.com,The Kathmandu Post,,{'https://lh3.googleusercontent.com/J6_coFbogxhRI9iM864NL_liGXvsQp2AupsKei7z0cNNfDvGUmWUy20nuUhkREQyrpY4bEeIBuc=s0-w300'},
Challenges to Nepal’s Republican Structure from Monarchists and Why? - Tricontinental: Institute for Social Research,Challenges to Nepal’s Republican Structure from Monarchists and Why?  Tricontinental: Institute for Social Research,2025-04-17 06:13:52,https://news.google.com/rss/articles/CBMic0FVX3lxTE9NXzBzak1IQVlYZXhGUHpERnBaejdVNFpCVEZjU09qaUJHclkxODVZNFlNbzZNclhKYV9idENOZ3BlNTItbUlPbUNnSFh2NlA0cXZmMkJWLWRrR3hUSUhsWWM5RXJheTZZeXlscWF3M3B0R3c?oc=5&hl=en-US&gl=US&ceid=US:en,https://thetricontinental.org,Tricontinental: Institute for Social Research,,{'https://lh3.googleusercontent.com/J6_coFbogxhRI9iM864NL_liGXvsQp2AupsKei7z0cNNfDvGUmWUy20nuUhkREQyrpY4bEeIBuc=s0-w300'},
Toastmasters: Building Communication Giants in Nepal's Corporate World - The Himalayan Times,Toastmasters: Building Communication Giants in Nepal's Corporate World  The Himalayan Times,2025-04-17 07:19:13,https://news.google.com/rss/articles/CBMipwFBVV95cUxQSTFyMzJ2dFNuMHcwTXhmMTlIc3ptUF9BUVZsSmdBdG1YQTRBM19XcjhwQTNfZEhtQWFoUEhZeFNjRHF4Wnc2YXJQazh2NkQ4Uk1ZcWFMY0lKdTBva005RTdrZDRtX1Q1anUwTzhteVA1bnM0UU9sR2lxNG9LbG9ROUxrd211bXRhNUY2NDMtalN4d1BTVkRVc0ZOeWREbFFtWVV1czJ0MNIBXEFVX3lxTFA1bFdZMTRPU3dUakw3YTU1Nll1RWlfaENJUk9wZHJ4aXRNb0hkTnlnX0lKSjVpel8yM2VYMUpYZFplMS13eEtfNEpyeU5PSTB3VkxPVGpaWWJhaVBP?oc=5&hl=en-US&gl=US&ceid=US:en,https://thehimalayantimes.com,The Himalayan Times,,{'https://lh3.googleusercontent.com/J6_coFbogxhRI9iM864NL_liGXvsQp2AupsKei7z0cNNfDvGUmWUy20nuUhkREQyrpY4bEeIBuc=s0-w300'},
Royal Enfield Launches This Cruiser Bike In Nepal; Comes With ABS As Standard Feature - Times Now,Royal Enfield Launches This Cruiser Bike In Nepal; Comes With ABS As Standard Feature  Times Now,2025-04-17 09:33:50,https://news.google.com/rss/articles/CBMitgFBVV95cUxPRy1sRkwyNnlzQVptOEd5XzkxX290V0piM0FYeUx3MkRwRTlxSlFpSzVkZ2NxNHZKaUlWVjllSTBaQkJPSUdZVzFCeGZBNVZNNkM4NHY5cElNZF8yLTRNOXNqUHdhTElnSDJrSXpjbWljenQ2X2JTTHVnMU1PSGVQOVQyU0NIckdydW5LanV6LTdEc2RvTkJJZkgxaTQyQzJEenFtckNsVmdJaGtRUUppdnhELVFFQdIBuwFBVV95cUxPWExzQ2pYa2pJc1NVNkRmbjJWY2FaQzRxSE5UVmhZczlwRl8yLVlpdUo3ZDdfZmxfZnRQYzJfT3Q3NXhNdTZiYVdGSGdZTGh0MU9BZzVJYzdGZGhZMlMxUmxUWFdZNXBfNldIckJMc3FHdjNBRlJnUWUyVmZxVUo0R3d0UVA0QlRRbnNobm1GdGZJaWNSUTZobWtVcDNEN3o2VVVtMm9Ia3gydE1KSmtBY1dpWW5lRW9adGtV?oc=5&hl=en-US&gl=US&ceid=US:en,https://www.timesnownews.com,Times Now,,{'https://lh3.googleusercontent.com/J6_coFbogxhRI9iM864NL_liGXvsQp2AupsKei7z0cNNfDvGUmWUy20nuUhkREQyrpY4bEeIBuc=s0-w300'},
"India Powers Nepal Through the Night, Extends 600 MW Lifeline Amid Crisis - Republic World","India Powers Nepal Through the Night, Extends 600 MW Lifeline Amid Crisis  Republic World",2025-04-17 09:58:38,https://news.google.com/rss/articles/CBMirwFBVV95cUxNWDkweDVBXy15Y2NKaGJfaEJ2VjY5U1JETklzRl9CelJUVDJpM3NRY1FVTE1BSXVxZlhFdENWdTdWRnhNMVM2dUN5djVaei0taTJ4RVZjcXpDUW9QNFl0WnJ6Q0duZXVpTnRaQW9IeGRINkl2Wkt1SjBwQXJPN0Vhc1ZlZXJZdGc2aXU3R1dzX085Q05SQ3F2V2wwUHFhbEd5cFZVWHJFVm85LWJoeDJj0gG0AUFVX3lxTFA3OHJjMzZMX2RiVWZ4d2ZmSTY3d09DRVIteFAxemVZbVBMRU92NkJDUFRiblUwblFabDUwUTc0U0NsOUpaNUpHUnM2dUhzdHVRN21jTW9MNHNrWl9FSjFCbHBFNzN1dktTMV9jSkx5ZjJJcDFfbnpyRUY4aWYwVXRremctS3l3WG5Pck04QVJRbGl4N25RWWg4Y3JjZElXeXh4NklVUXd2OFBRbG9TeHl2ZHo3UQ?oc=5&hl=en-US&gl=US&ceid=US:en,https://www.republicworld.com,Republic World,,{'https://lh3.googleusercontent.com/J6_coFbogxhRI9iM864NL_liGXvsQp2AupsKei7z0cNNfDvGUmWUy20nuUhkREQyrpY4bEeIBuc=s0-w300'},
Royal Enfield launches new Classic 350 in Nepal - Business Standard,Royal Enfield launches new Classic 350 in Nepal  Business Standard,2025-04-17 10:47:00,https://news.google.com/rss/articles/CBMiyAFBVV95cUxQZEZObW5PTVdoV2dNajNVWWlobXVVY08tN3ZiZ0k4ZVFXd0xEcmcwdHhha0pOMHIxSHluRWhVLTIwb254OENNa2xTdldjM3V1RXlxT214X0VsTFEwek1NSWN5NkZNTE41cU9RMHJpVk1Pd1hfVVlsUXotck9tcFNlVjZfWHQyTUhnZDVvQjNCeS0xQ3VaalV0R1d1UURJNXFYMVF1Wm41aE9mUTc4azMzenVOb25LS0FzbmZsdG5rWVN2a0xDQWJmN9IBzgFBVV95cUxPeFBaYl9Rd3Qxa0FiMGp2T21MQ0stamZpbTZmY3dxQkVrRW13VmxTMzh2U0d3bFFSbkhkMzJVQXZnUDBoZEdQcVFOSjJHdkFxazA0MWFNMzlPN1RzZG1KTVpDRm5XR2hBOVlYYUQ0Q3FIaFlkNk1WNHJnamJacDhBamRicFRoTklLdS1kSHFKRDBhTTJ1dkJLS3NVLVFNM0J3MWNqcVNscE5vYWVFa2FVSS11UjFhZUFEVlMtY2lWWXVqZ09wb1NwVWFmOVRDZw?oc=5&hl=en-US&gl=US&ceid=US:en,https://www.business-standard.com,Business Standard,,{'https://lh3.googleusercontent.com/J6_coFbogxhRI9iM864NL_liGXvsQp2AupsKei7z0cNNfDvGUmWUy20nuUhkREQyrpY4bEeIBuc=s0-w300'},
"Pragya Jaiswal Enjoys A Peaceful Getaway In Kathmandu, Nepal - Filmibeat","Pragya Jaiswal Enjoys A Peaceful Getaway In Kathmandu, Nepal  Filmibeat",2025-04-17 11:08:38,https://news.google.com/rss/articles/CBMisAFBVV95cUxORVFveDlVSFJNenZFUUVMU3FiUHkwaGgwdmpSVzVLY2ZaZlZ4bHZITUgwNGtPeXo2MzZ6VmNoOWRLR0RCSk9yOU5sTGU5SjhKQWlDUlBhTlRsb2t2NEhRZFo2UTkyblBMVjhNMVhEdU8yc29aaWx3cmRWZUxwSmIzeXdGLUdyTUk3SWpfYTN3YllLVGY0YTZlTHd2SHI3TW9oeFVWZlQwaUg5bDdxOV9aYQ?oc=5&hl=en-US&gl=US&ceid=US:en,https://www.filmibeat.com,Filmibeat,,{'https://lh3.googleusercontent.com/J6_coFbogxhRI9iM864NL_liGXvsQp2AupsKei7z0cNNfDvGUmWUy20nuUhkREQyrpY4bEeIBuc=s0-w300'},
704 climbers permitted to climb Nepal peaks this spring - UNITED NEWS OF INDIA,704 climbers permitted to climb Nepal peaks this spring  UNITED NEWS OF INDIA,2025-04-17 11:11:00,https://news.google.com/rss/articles/CBMipwFBVV95cUxNTlN3aDFRQlBMZzQzcFBJQW91X2JHNEhwNTZDUEJ0MUdVSE1TODM2ZVM0eHlrMms1Njg5RHN2SXlxUVdpOHBwZzNDQ3ZuWVozejlMeVB2eF9fRHBtVXRjc2VZRWdzX1o2cmF4WktXZEJhZEpPcmwyRTdRSFlKOEV0clpxVFRhNXdGcng1MFI4eHdZdTNhczR1TGswZlRzREVuSzZwU1N6OA?oc=5&hl=en-US&gl=US&ceid=US:en,https://www.uniindia.com,UNITED NEWS OF INDIA,,{'https://lh3.googleusercontent.com/J6_coFbogxhRI9iM864NL_liGXvsQp2AupsKei7z0cNNfDvGUmWUy20nuUhkREQyrpY4bEeIBuc=s0-w300'},
Women's kabaddi team leave for Nepal Saturday - Bangladesh Sangbad Sangstha (BSS),Women's kabaddi team leave for Nepal Saturday  Bangladesh Sangbad Sangstha (BSS),2025-04-17 12:22:11,https://news.google.com/rss/articles/CBMiTkFVX3lxTE9VV3lid190S0U4WFREMnhIRWRNeHNfOEhBVk0zZHZHRDF0WC1CM2xmbjVfTG51amdqQUh2aFNkQTREcUw3U3dDTzBmR1FBQQ?oc=5&hl=en-US&gl=US&ceid=US:en,https://www.bssnews.net,Bangladesh Sangbad Sangstha (BSS),,{'https://lh3.googleusercontent.com/J6_coFbogxhRI9iM864NL_liGXvsQp2AupsKei7z0cNNfDvGUmWUy20nuUhkREQyrpY4bEeIBuc=s0-w300'},
Women's Kabaddi team off to Nepal on Saturday - - Daily Observer,Women's Kabaddi team off to Nepal on Saturday -  Daily Observer,2025-04-17 13:25:00,https://news.google.com/rss/articles/CBMiT0FVX3lxTFAzTUJocmxXcDJ0ZTduNy16Wm1sLTF3aEhqTFhYTGZXZWFxT1p4Qy1Bbkd4YnZjMmtYTXZnZmx2Y09vdE51U3JnQ0J6NzdKYlU?oc=5&hl=en-US&gl=US&ceid=US:en,https://www.observerbd.com,Daily Observer,,{'https://lh3.googleusercontent.com/J6_coFbogxhRI9iM864NL_liGXvsQp2AupsKei7z0cNNfDvGUmWUy20nuUhkREQyrpY4bEeIBuc=s0-w300'},
Royal Enfield Classic 350 Launched In Nepal - ACKO Drive,Royal Enfield Classic 350 Launched In Nepal  ACKO Drive,2025-04-17 14:08:01,https://news.google.com/rss/articles/CBMie0FVX3lxTE1hc2lnLTVoS01kZ0JtLUx1THZjUFcwLWlpV1RBSjhYdmJ5LXRkcEJDXzVNLW9EOWtiLU5GOEJCMlJXY3VZYTF1Wi0wSGw4TlQyaGU3UjhvN2hpQktRMlpUZVhqUWNTLVktaktVZHFfLWQ5LTRNcnp3NkswRQ?oc=5&hl=en-US&gl=US&ceid=US:en,https://ackodrive.com,ACKO Drive,,{'https://lh3.googleusercontent.com/J6_coFbogxhRI9iM864NL_liGXvsQp2AupsKei7z0cNNfDvGUmWUy20nuUhkREQyrpY4bEeIBuc=s0-w300'},
No amnesty for heinous crimes committed during Maoist conflict: Nepal PM - Business Standard,No amnesty for heinous crimes committed during Maoist conflict: Nepal PM  Business Standard,2025-04-17 14:59:06,https://news.google.com/rss/articles/CBMi9wFBVV95cUxOdXRqQi1RaVlNQm1sbGdRa2h0b2ZxRkVvb19oMHJmaU5FaVEya1BHdVVmeHBSOF8xdkI3R3E4ZXRzbV8yWjladmhIQWtPS25tWFhiekhid1RMTFJQQ0dVQWxiMEFmTXkwZE9mLV9FdDhRQk0tOXg3cWhsdDhYODFlX1JIcE1ldFdxbkNOSlhUbXJsNnF5RFU2ZVZod2FJbDdqOTJhYlpXWVBaY1Y0X2dtVGxhZGJRdXRfQ21KbVkyXzZGQ2h0M2IybVNwX00wMWNraEZHU2Q4ODRmQV94Qkx3bTRxeTlGR1d1amQ0RVU2QU9xakxKblNN0gH8AUFVX3lxTE81QWJMYWU5dGVPMFdpOXJFcUVDcWFqNmVZQTVwcE5ybU16ckNZM0ZEY2VYZW9UbTF5b1ZBM3lXT0NnbDJrcWFjd21uNU5lZ1piZ1dZX01Pa1lBZHRHYW1rYkliWWo4SEt4cV9JQnJzcnN2VDdMQVJMaUFXV1F0QjFIeFE5azlvU3NROUN6b3gzaDVwUUxmVHlZOGoyaks2ckVQRENFQzk4bkZJY19wUjFzSzhPWGpFRjY3RjlOYnVhUGhQd2JkMzA2eUc3bTFnODNDVlVGZEUteVFuY2FDR0RjbXRvWHlPX3dfUkFBNWlQdEhONDV6Y0dFQzVfcg?oc=5&hl=en-US&gl=US&ceid=US:en,https://www.business-standard.com,Business Standard,,{'https://lh3.googleusercontent.com/J6_coFbogxhRI9iM864NL_liGXvsQp2AupsKei7z0cNNfDvGUmWUy20nuUhkREQyrpY4bEeIBuc=s0-w300'},
Supreme Court stays deportation of four Bhutanese refugees from Nepal - The Kathmandu Post,Supreme Court stays deportation of four Bhutanese refugees from Nepal  The Kathmandu Post,2025-04-17 15:55:09,https://news.google.com/rss/articles/CBMitgFBVV95cUxNMFc0X1daM2ZsYjUtN0pHT0VjTTFXdk1nT1VNMlRxaVlNRlVndjBNU24ycnNpa2hqY1JYa1k4cTlJOEZidGZBY05Lci1pOXNUNzI3NkJSMjd4RVRkSFJFUDJKYThINHdjUm45b0JuMzBCLThFRzBMeURSMU9uTzh0Z2Q5X29hdmJIQ1FaMkZTZ1VvbGhQM1BSeDE2QmpXMnRzZmpwYnNkcDVLM3NUNl9RZ3FYWkEwQQ?oc=5&hl=en-US&gl=US&ceid=US:en,https://kathmandupost.com,The Kathmandu Post,,{'https://lh3.googleusercontent.com/J6_coFbogxhRI9iM864NL_liGXvsQp2AupsKei7z0cNNfDvGUmWUy20nuUhkREQyrpY4bEeIBuc=s0-w300'},
Security intensified along India-Nepal border in Madhubani ahead of PM visit - Times of India,Security intensified along India-Nepal border in Madhubani ahead of PM visit  Times of India,2025-04-17 16:37:00,https://news.google.com/rss/articles/CBMi4wFBVV95cUxQLVBlVHMwb0RDQzNQenhNWmYyYVRRM2otYUdTa0dFcDhBVEw0aEI5VEsxaW5CRnZyakVlOHhTS0VWY2lhUm5CRnVWUmF4U3RkVHpMWVVXV1FSMEJ3WTh5U0Jwb0V1c0Fpc3o5eVJ3ZnpFWlZmRTdLQVdxbENfZ2ZMQ01kYlI0WnhWSzl1cjAzdUhmRVJsWl83dEF6ZXI4WXRMaS00NWc0WnFWWUI3aHB4UlJ3NkdHTENPRXJxdzdhRENldUtMN1hudnJpMWZkX2k4Y2g3QktzRjF0SHBmUjExclRxWdIB6AFBVV95cUxPdFNKWElFV0RxWS1feGh4N2VlbUg3VVhIdlhTYlNLd3FWSk5DVWpfdy1UNTU4Yk5RdW1sNFVGb3lKSm5iZFlrZTZCcERlaFl4XzJIOWF2ZVNCeFNNMGVZVFdfZmg4RV82N0w1NVdpR1EyUjdSb2JuZnJUREc4M29jMDgtNVdSZnhkZmhQRDQ0cnE4VHVGcE96Z2lINTQ3TTBiNGpWTUgyTFFFWXpPR1lSR3RlbHpYTk5qMXRiNmFvWl9OYXhoR2FpV010X3dwZFpYOXpWSzIweTdqaUIwWGNmam9uQTlDWW9T?oc=5&hl=en-US&gl=US&ceid=US:en,https://timesofindia.indiatimes.com,Times of India,,{'https://lh3.googleusercontent.com/J6_coFbogxhRI9iM864NL_liGXvsQp2AupsKei7z0cNNfDvGUmWUy20nuUhkREQyrpY4bEeIBuc=s0-w300'},
Misleading publicity is worrying: Minister Dr Rana - The Rising Nepal,Misleading publicity is worrying: Minister Dr Rana  The Rising Nepal,2025-04-17 17:56:06,https://news.google.com/rss/articles/CBMiUEFVX3lxTE1PTko2OGdzVWNCaHFmRlZ1WWpvNi1vWExrdms5RnlDYWlhZlRDWF9PZ1g0SS1Tc3ZLS1o1ZEZLSE1GTmhNX2Q4SFdHOWZpSWRm?oc=5&hl=en-US&gl=US&ceid=US:en,https://risingnepaldaily.com,The Rising Nepal,,{'https://lh3.googleusercontent.com/J6_coFbogxhRI9iM864NL_liGXvsQp2AupsKei7z0cNNfDvGUmWUy20nuUhkREQyrpY4bEeIBuc=s0-w300'},
Nepal’s Plan to License Tobacco Faces Pushback - Tobacco Reporter,Nepal’s Plan to License Tobacco Faces Pushback  Tobacco Reporter,2025-04-17 18:04:28,https://news.google.com/rss/articles/CBMijgFBVV95cUxOSm5faURJRXN5bHl4YlVZZ2w0cVhXSWlvRkNfV3BmUE8wVUtiMTBaVHk3N0pkdEVlM1JqaWlWck5NSF9zQmNJc0FOQ0RSUzZ0elZqaG1xbWFnODBxTG4yczluSEV6di0tU2J0QzM3M2V1UDNiM3JlTzk1WmRnNHJTLXBfSTFRV0psc2tzSDN3?oc=5&hl=en-US&gl=US&ceid=US:en,https://tobaccoreporter.com,Tobacco Reporter,,{'https://lh3.googleusercontent.com/J6_coFbogxhRI9iM864NL_liGXvsQp2AupsKei7z0cNNfDvGUmWUy20nuUhkREQyrpY4bEeIBuc=s0-w300'},
Cimex introduces industry-leading Extended Warranty on BYD Electric Vehicles in Nepal - Technology Khabar,Cimex introduces industry-leading Extended Warranty on BYD Electric Vehicles in Nepal  Technology Khabar,2025-04-17 18:17:41,https://news.google.com/rss/articles/CBMiW0FVX3lxTE9rS0d1WTdIdjl1UFZLOEs3T1RRMldPWC1SU004WHhLVWpheDFZTDdUY2pDN0s5c18zZHJKWkFqVXhQanMyTi1lSHFvUW5SMGRUWThWSW9JVHkwNE0?oc=5&hl=en-US&gl=US&ceid=US:en,https://technologykhabar.com,Technology Khabar,,{'https://lh3.googleusercontent.com/J6_coFbogxhRI9iM864NL_liGXvsQp2AupsKei7z0cNNfDvGUmWUy20nuUhkREQyrpY4bEeIBuc=s0-w300'},
