title,description,published date,url,publisher.href,publisher.title,full_article,images,translated
Reminiscing last week: Political realignment in Nepal - Khabarhub,Reminiscing last week: Political realignment in Nepal  Khabarhub,2025-12-29 02:46:26,https://news.google.com/rss/articles/CBMiWEFVX3lxTE5nX1JndndubXZVN0tiZTh0QmNyZ3pfSkVJSnVVZENvXzE3SFFlamtyYzZCOEhVN3VTVW5RbnROSkRTTU1SbW83RDFmNVhSMl94NHhvTF9FZ2U?oc=5&hl=en-US&gl=US&ceid=US:en,https://english.khabarhub.com,Khabarhub,,{'https://lh3.googleusercontent.com/J6_coFbogxhRI9iM864NL_liGXvsQp2AupsKei7z0cNNfDvGUmWUy20nuUhkREQyrpY4bEeIBuc=s0-w300'},
"Kyrgyzstan Joins Nepal, Indonesia, India, Malaysian Borneo, Thailand, and the Philippines as Asia’s Most Thrilling Adventure Travel Destinations for a Power-Packed 2026 - Travel And Tour World","Kyrgyzstan Joins Nepal, Indonesia, India, Malaysian Borneo, Thailand, and the Philippines as Asia’s Most Thrilling Adventure Travel Destinations for a Power-Packed 2026  Travel And Tour World",2025-12-29 02:51:29,https://news.google.com/rss/articles/CBMitgJBVV95cUxNblRUX2ZncTl6OEd1YWREdlpZTVJvb0ZlWklRUWRCNVVlX3hjQTdBUEZGRTJZUTFfNldlSkFtYUpwMFRpRng3Z1JlcG5zb2RYQVJqYTB1S0tySHBNbEVOSGsteWFGZkw5LVVVbzRNRTB1VGN2dmtJLWNoZ3MwQjlUOGJZUzdWOXRiY3AzSTNqR1N4UE1ULXcwYXVSN2ZJSUtuNkNVc3JDTmRmUVhSb094SEowUnpjbGlBXzg5Sm1pd2V3LTAydWx0eExYRDBUaWtDVEtmUkxyY1A5RV9wQlh3eVlmcXBNbUQ1Sm1US3FsZ1BpRzhXS1hUdVFvWk5kVzU2MkV2R2pqbG1GUGd2WXdVQWRLWV9QYzkzWkNRbzk4azdkazBMYzM5dGNITWYtel9CTHZpWFpR?oc=5&hl=en-US&gl=US&ceid=US:en,https://www.travelandtourworld.com,Travel And Tour World,,{'https://lh3.googleusercontent.com/J6_coFbogxhRI9iM864NL_liGXvsQp2AupsKei7z0cNNfDvGUmWUy20nuUhkREQyrpY4bEeIBuc=s0-w300'},
Former rapper to run for Nepal PM in key election after Gen Z-led protests - The Straits Times,Former rapper to run for Nepal PM in key election after Gen Z-led protests  The Straits Times,2025-12-29 02:55:00,https://news.google.com/rss/articles/CBMisgFBVV95cUxOU09pVGxZN3J6c21kb3JhdkJXeXFrY3p4akhjLVg1UFplaTNlaDhwQkJQTEgzOGVLdDh2QVdJc3JfTkpSeUZVWGFCRVZ2cUJYdUQ5TzYwMU0tZEVzd01lc2x1ZkVBTnk1VGdMa2Y2R0ZxTWdUdHdlU3ZrcEhTUVpVWVJtLUVYUmJCTmtvRnhhanFqTU1WVzByVkk4UkQ3d2N2enhxbXBha3Rzd1N5WFlpMU9n?oc=5&hl=en-US&gl=US&ceid=US:en,https://www.straitstimes.com,The Straits Times,,{'https://lh3.googleusercontent.com/J6_coFbogxhRI9iM864NL_liGXvsQp2AupsKei7z0cNNfDvGUmWUy20nuUhkREQyrpY4bEeIBuc=s0-w300'},
Tony Hagen Park in Hetauda emerges as new scenic escape - The Rising Nepal,Tony Hagen Park in Hetauda emerges as new scenic escape  The Rising Nepal,2025-12-29 03:13:26,https://news.google.com/rss/articles/CBMiUEFVX3lxTE4teE94SVBaZGt3VjRwSmZISXE3ZG1zRFpPVmtNX0lwb2luQ3hZY0xNX21zMldNTmpzb29SS19xX3AwMHJfTzg1TVE3dzAtMVVT?oc=5&hl=en-US&gl=US&ceid=US:en,https://risingnepaldaily.com,The Rising Nepal,,{'https://lh3.googleusercontent.com/J6_coFbogxhRI9iM864NL_liGXvsQp2AupsKei7z0cNNfDvGUmWUy20nuUhkREQyrpY4bEeIBuc=s0-w300'},
RSP central committee approves unification deal with Mayor Balendra Shah - Nepalnews.com,RSP central committee approves unification deal with Mayor Balendra Shah  Nepalnews.com,2025-12-29 03:20:07,https://news.google.com/rss/articles/CBMitAFBVV95cUxPbWlLZl85cUVQalE4ZE80TVdlbVdiSE04aks0NzVfZEZ4RGYySnRkSDNTX0RNMzZWdUp6ZUVtU21uRWZfX2lmU0hUM05HVnFZTzNJRS1qZjhTYXEwb1RLWUtJV1gzb0FBQTM2S2Zsb1gxZHF6elBFR2N0WWV6Slh6MGFoU25iTDg4ZFQ1QXNRdDRFb2g0dnRsckpwZmlXX01Salo5aE1aclhWemZRNXdWZ19oZXI?oc=5&hl=en-US&gl=US&ceid=US:en,https://english.nepalnews.com,Nepalnews.com,,{'https://lh3.googleusercontent.com/J6_coFbogxhRI9iM864NL_liGXvsQp2AupsKei7z0cNNfDvGUmWUy20nuUhkREQyrpY4bEeIBuc=s0-w300'},
"India and South Africa become world champions, Netherlands and Nepal sizzle, Sri Lanka fizzle - MSN","India and South Africa become world champions, Netherlands and Nepal sizzle, Sri Lanka fizzle  MSN",2025-12-29 03:42:31,https://news.google.com/rss/articles/CBMi2gFBVV95cUxORUZOWk1tUXM2OXZJSEtiaVlWTzJEQ3FpMUllYXZPbjlFUUZuWkhSZ1o3RWljVEYtRUhGVmtLSGthejJBNE9BYjFsMmpCWXFnNVJZYXpRbFpUa3kzeFlnRExKVjFhNnJsSHVBSDJ6OVYxV0NROFdlbmx6MTVQYjdVd1hXZEliaDR3MFd2czlaZ3E4ZnQ3ckRPM3pPSmF4S2tiVmV4ckp5Q01vbUxkYzl1UWxxUEFmZl9oOHpvb21DN0FJVFREQXlmdWNVN1BLcWFhdWk2MURMbEdTUQ?oc=5&hl=en-US&gl=US&ceid=US:en,https://www.msn.com,MSN,,{'https://lh3.googleusercontent.com/J6_coFbogxhRI9iM864NL_liGXvsQp2AupsKei7z0cNNfDvGUmWUy20nuUhkREQyrpY4bEeIBuc=s0-w300'},
Former rapper to run for Nepal PM in key vote after Gen Z protests - The Japan Times,Former rapper to run for Nepal PM in key vote after Gen Z protests  The Japan Times,2025-12-29 03:54:00,https://news.google.com/rss/articles/CBMiiAFBVV95cUxQclVZR0xaZFZ0T1JxR21tX3ZZRWJyem9UWTJNYTNFVTBIM2FDYjhHWDdvMUMxa2ozcmpfeUVuem5PLWpST3FzdGZ3TzVuTUJYUnktSXI2NTVJZm1za1RkZ1UzbmFsX3FodHZ2d2toYUtLZk16ZXRBaGdHVkc5RW9ZcHpMVnIwcFlu?oc=5&hl=en-US&gl=US&ceid=US:en,https://www.japantimes.co.jp,The Japan Times,,{'https://lh3.googleusercontent.com/J6_coFbogxhRI9iM864NL_liGXvsQp2AupsKei7z0cNNfDvGUmWUy20nuUhkREQyrpY4bEeIBuc=s0-w300'},
RSP–Balen alliance emerges as a new challenge for Nepal’s traditional parties - Onlinekhabar English,RSP–Balen alliance emerges as a new challenge for Nepal’s traditional parties  Onlinekhabar English,2025-12-29 04:10:48,https://news.google.com/rss/articles/CBMiZ0FVX3lxTE9qUmJMS0ZBMTVSSHBia2JpdU9oYmJDMHpDY0p0ZEtWZ0I4SkZVZk1OZU1lWUZvUXMwVXFkdDlzX2VhV25nRDBHN0FaM3JmcmV6ekU3TjJwSFh6ZldZa1JFamFrZG5QMjQ?oc=5&hl=en-US&gl=US&ceid=US:en,https://english.onlinekhabar.com,Onlinekhabar English,,{'https://lh3.googleusercontent.com/J6_coFbogxhRI9iM864NL_liGXvsQp2AupsKei7z0cNNfDvGUmWUy20nuUhkREQyrpY4bEeIBuc=s0-w300'},
Toddler drowns in a water - Nepalnews.com,Toddler drowns in a water  Nepalnews.com,2025-12-29 04:15:26,https://news.google.com/rss/articles/CBMidEFVX3lxTE1FdnN5SkN3NTRlNEFyNmp1aDdXRW10dEI0S3pvUnJ0U0FSdEU5SDJQRnFPc2haN3pEckExbl9iQWt5cXhRSHNWeE9mNlE1VVI5WENaUjI0R19VaHhiN1Z4T3p0SUdLekxqWEl6aWhqcVMtTE1s?oc=5&hl=en-US&gl=US&ceid=US:en,https://english.nepalnews.com,Nepalnews.com,,{'https://lh3.googleusercontent.com/J6_coFbogxhRI9iM864NL_liGXvsQp2AupsKei7z0cNNfDvGUmWUy20nuUhkREQyrpY4bEeIBuc=s0-w300'},
"Himalayan Hideaway Resort Pokhara: Now, Centara’s First Resort in Nepal to Elevate Tourism Experience - Travel And Tour World","Himalayan Hideaway Resort Pokhara: Now, Centara’s First Resort in Nepal to Elevate Tourism Experience  Travel And Tour World",2025-12-29 04:18:45,https://news.google.com/rss/articles/CBMi4AFBVV95cUxQVllDMkVqa25mZmdtNlB0eVRmRFNqeGFmZUVWTkNCdGNoMTkyMjE0c0FRUTRUbFBSbEZhVmNYOXJ0SC1veE53RDNtWG40ZzZIZXN1TjdNNjZQRGVGSFVKbmxKQWVhQmV0cS1fNlFBdk51U1NGWUNxdVRCRzlkSFkwLWhKWWRLM1p6X25UcHNNYVVFQU9YVVVJOHB0WWxOTDlsTFExOWdrNVlxZHN2bU5IcnRXZjFleW1jdGhtVURPRlNELVR3MEt3c0RMNFQ4VVd6UV9qdWJqU24yYmFHemZNcA?oc=5&hl=en-US&gl=US&ceid=US:en,https://www.travelandtourworld.com,Travel And Tour World,,{'https://lh3.googleusercontent.com/J6_coFbogxhRI9iM864NL_liGXvsQp2AupsKei7z0cNNfDvGUmWUy20nuUhkREQyrpY4bEeIBuc=s0-w300'},
Nepal probes illegal matchmaking as China cautions citizens over ‘bride buying’ - South China Morning Post,Nepal probes illegal matchmaking as China cautions citizens over ‘bride buying’  South China Morning Post,2025-12-29 04:25:42,https://news.google.com/rss/articles/CBMixwFBVV95cUxQaWlMU3JvZU9EQ2xOcU5nZUh5Y3JGZkhTWWhldkIwVFQ2a3JEQU1oVmYweHRjMEdBV3Zyajc0VWJKc2ExY3NTbjBiMTJEU3JJekkxWXpydWpfT0dNMERNR29aTWhLME02R2dPVVFRbVdrd2dnVE9DRVBUWHhUVHgyUGxqY0RwNXNpSjIxbUFCUk4tRVE2Z1NOMUVVR3NDUndfRWRKemZadEhKbWR0T0I4RjAzVU1lU3piX1cyaklXZ2xQaXppQ1A40gHHAUFVX3lxTE5jY204UEhSM2l2cllVdGRSZjR5TXlzc2w5SkpSeDZaLWQ1VWlDN1Q0b1pEdzRxMm9ZTFRCVUpZX1R4NHdublV0Ny1KbHJZa1lLb3BOd2J2a2JJUlFSbk5rRGI2QTRRUk9WR1hBR3NJcjRfYVZWS3Z2a25KNmRCU2tyd21kNVJnVEVqY21fdWdyOFdRQmxrdEVwaV9VOXVTeDUwTEs2aVYxUmRSdGxEaWdlT01sT1JZU3JiZElRNjVFY1VGbVNQdVU?oc=5&hl=en-US&gl=US&ceid=US:en,https://www.scmp.com,South China Morning Post,,{'https://lh3.googleusercontent.com/J6_coFbogxhRI9iM864NL_liGXvsQp2AupsKei7z0cNNfDvGUmWUy20nuUhkREQyrpY4bEeIBuc=s0-w300'},
From rapper to power centre: How Balen Shah is redrawing Nepal’s political map - CNBC TV18,From rapper to power centre: How Balen Shah is redrawing Nepal’s political map  CNBC TV18,2025-12-29 04:27:07,https://news.google.com/rss/articles/CBMi5gFBVV95cUxNb3U2SEhjMzdZcEZhNW5OMThlcllJa3lPSFdqY2FtMjI3V1hwVDY1OUttTjdJNWJ4V2Vpd0ktdzhqYmZ3LVBDR0NzejdIWGh5bF81clN3M0Yyak9YcDZqZzlrOEdVdHdXS3V6WW41aU5ZZVBIaXhZc0t5djB4ZVpyZVVxQ2FLSFZ6Wi04dWJrZHdRTTRrYjY1SlE1V19PR3lvZEJaZVBMb01vRHdxSkhHVWdETmEwVkFsMEpZTGhxZ1hlX28zeVRuQjVTQkVwUlBoMFgtbVREbWM0NXJCbFdGZFE5UEsyQdIB6wFBVV95cUxQV2hGWko1c1VTaUN4YnB5SzdDcGlzZ1djTDBjUWdUQTNVc0xzcWxHUkVlQjZEOXJJdzI0ZmlfeThnYXVHb2hVS0NnUTYyanRXMjB0Z1MxVkJ5dHhOaFlhMHRPcXZKdk9ZWnJHQnFkTkNJdWZGRlE3NFZDZHNSRGZSWWRsYjd1Wjkza05ldlpiRWotTVFyd2FiaTh6R1ZZMzRnckxsNEJWWDU3YkN2cEtSNVhCeVZXY0pYV2gweFJSNjZpbzhmYXNSZmNSbGtUQk1XempLV0lmMlJGMjZUMlBYdjYyUVQzWnlzU3BZ?oc=5&hl=en-US&gl=US&ceid=US:en,https://www.cnbctv18.com,CNBC TV18,,{'https://lh3.googleusercontent.com/J6_coFbogxhRI9iM864NL_liGXvsQp2AupsKei7z0cNNfDvGUmWUy20nuUhkREQyrpY4bEeIBuc=s0-w300'},
Nepal's former rapper to run for PM in key vote after Gen Z protests - Reuters,Nepal's former rapper to run for PM in key vote after Gen Z protests  Reuters,2025-12-29 04:36:00,https://news.google.com/rss/articles/CBMisgFBVV95cUxOQjJCUHNKLU8xR2FzREcwem9sUlF2UUp1VDJTeGtaa3F5TTM2RDAxNFJiVEltbV9Eb2doQkdOT1VxeUhyc1FHVlB3WnU4WGpUdkd3MGQ0U0NHa3F6dGhhOHlKREdHN3FBcTZSUnUzeTVJYWVhSnJYaTRZMXpUZXNoTURIcUJmN0J5TC1zWGh6NWFCRFFqOUpvVTg3Sy1lWjhTb0tlZzN0Y1JPNjFBeWs2bUVn?oc=5&hl=en-US&gl=US&ceid=US:en,https://www.reuters.com,Reuters,,{'https://lh3.googleusercontent.com/J6_coFbogxhRI9iM864NL_liGXvsQp2AupsKei7z0cNNfDvGUmWUy20nuUhkREQyrpY4bEeIBuc=s0-w300'},
"Nepalese man at Nagahama ramen shop dreams of serving as bridge between Japan, homeland - 毎日新聞","Nepalese man at Nagahama ramen shop dreams of serving as bridge between Japan, homeland  毎日新聞",2025-12-29 05:24:14,https://news.google.com/rss/articles/CBMic0FVX3lxTE5wMXlockRBTUlGRmdVQmFlTFRNR3czZ0VfRGFPOERKQTREYUltMk9Wck8xZkRyNUVDY2dDVXJGNUFvREd2TzR6emVGZFo1LXhTMUJjN0h6RE1vZWItd1cwWDdBN0VNek93d25SeEhUbld3Tm8?oc=5&hl=en-US&gl=US&ceid=US:en,https://mainichi.jp,毎日新聞,,{'https://lh3.googleusercontent.com/J6_coFbogxhRI9iM864NL_liGXvsQp2AupsKei7z0cNNfDvGUmWUy20nuUhkREQyrpY4bEeIBuc=s0-w300'},
"Nepal’s rapper-turned mayor enters PM race, shaking up March elections - TRT World","Nepal’s rapper-turned mayor enters PM race, shaking up March elections  TRT World",2025-12-29 05:42:48,https://news.google.com/rss/articles/CBMiWEFVX3lxTE90MmZzODdibGFjLTVNaFNXNVd0cDRIVVdiUmlBbVJrRlNuTmZBYXE5UkwxX256ODE4TDlpbVc4WDhTQ0M3aEsxUldtZHFTRnpudm9hUk1LaGvSAV5BVV95cUxNdXM4YlFQZ09neHNiakRIWHZhSS1YMmRHZFpaVGRUbHd0clREUERyb2pFSXh4TnowQnNBTDNVeWVUMjdVdU9TeHFzcTZFNkN1UkpRZDFWSmdCanZRU0xB?oc=5&hl=en-US&gl=US&ceid=US:en,https://www.trtworld.com,TRT World,,{'https://lh3.googleusercontent.com/J6_coFbogxhRI9iM864NL_liGXvsQp2AupsKei7z0cNNfDvGUmWUy20nuUhkREQyrpY4bEeIBuc=s0-w300'},
Nepali guides receive Korea's Golden Ice Axe for Mera Peak recovery - The Himalayan Times,Nepali guides receive Korea's Golden Ice Axe for Mera Peak recovery  The Himalayan Times,2025-12-29 05:48:45,https://news.google.com/rss/articles/CBMipAFBVV95cUxOV1g3NHJBZl80Q0Y3R1pOLWhZejZzSG1XazA0dWh2RGVZNnloNVhaLXdtMUM3cll5Uy1paU1LVWx0UndJbVNIclo4eTdTdXFKVHk0VExSaHAwSlU4RzByZDVOeEFVRTB5d0pPODQ2TkY5eFREY2RJWnRRa3lsb3FsU2MxSDhJRWM2Wi1GampjZm16N1NVQ0ZFR1JyOTBqd0YtcVJlRw?oc=5&hl=en-US&gl=US&ceid=US:en,https://thehimalayantimes.com,The Himalayan Times,,{'https://lh3.googleusercontent.com/J6_coFbogxhRI9iM864NL_liGXvsQp2AupsKei7z0cNNfDvGUmWUy20nuUhkREQyrpY4bEeIBuc=s0-w300'},
Former rapper and Kathmandu Mayor Balen to run for Nepal PM - Latest news from Azerbaijan,Former rapper and Kathmandu Mayor Balen to run for Nepal PM  Latest news from Azerbaijan,2025-12-29 05:56:08,https://news.google.com/rss/articles/CBMihwFBVV95cUxONklKM0hYMVN0UGdoaWZ3RmlFd2N3V091QnFTOVpCR09YTjhvZ3FFNVBEb1VpTUNpNm1VUDFHdUV6X2ZNZTQxcUhoZzRqaUNlUlJDUzRBNHcwUFZGdjl2SmpIY2FyYlV3dVBabXF1R1R4T3VxUXdSZm13UWxBdTN1LXpSOGlLMzA?oc=5&hl=en-US&gl=US&ceid=US:en,https://news.az,Latest news from Azerbaijan,,{'https://lh3.googleusercontent.com/J6_coFbogxhRI9iM864NL_liGXvsQp2AupsKei7z0cNNfDvGUmWUy20nuUhkREQyrpY4bEeIBuc=s0-w300'},
"Gold price declines, silver climbs on Monday - Nepalnews.com","Gold price declines, silver climbs on Monday  Nepalnews.com",2025-12-29 06:00:30,https://news.google.com/rss/articles/CBMijgFBVV95cUxPamNpaUJGdlYzU2pwUlJFdjdUSDdNcm1hbmNvVDJvY0VOSlJaU0ltSDF2cElEY2Q3VG5kOUlZMGtHblNFYlNCUFZnb3Bac25razRreTFVNHg5TU9aalltOHVtcGtFYmdpVlVrUTJkRnJzOEw2QkhXbUlVZ2hVYVRvdmVRdGVlX2c0dHZjWVp3?oc=5&hl=en-US&gl=US&ceid=US:en,https://english.nepalnews.com,Nepalnews.com,,{'https://lh3.googleusercontent.com/J6_coFbogxhRI9iM864NL_liGXvsQp2AupsKei7z0cNNfDvGUmWUy20nuUhkREQyrpY4bEeIBuc=s0-w300'},
Fate vs negligence: Why Nepali families accept migrant deaths - The Himalayan Times,Fate vs negligence: Why Nepali families accept migrant deaths  The Himalayan Times,2025-12-29 06:11:15,https://news.google.com/rss/articles/CBMinwFBVV95cUxQVUo5SmdjUGxwbXdyajNDT3hjT3VSNERBYzB3Z2xkM3JKUFNDNm9fWklVTEJSSXJQY1RpSTVDTFNadUs4RDdyRDNpU2lvWTNvODd4eW05STRoMkkzTVFlS2dOVnJmeTRIMmp1eTh3aFFqTUpWdVpsZlhwV1BYZXVhUThoSTVEMEpJTVhVU28ybkhNNEg5LVA3bG9CU0RiTGs?oc=5&hl=en-US&gl=US&ceid=US:en,https://thehimalayantimes.com,The Himalayan Times,,{'https://lh3.googleusercontent.com/J6_coFbogxhRI9iM864NL_liGXvsQp2AupsKei7z0cNNfDvGUmWUy20nuUhkREQyrpY4bEeIBuc=s0-w300'},
Nepal rapper-turned mayor Balen Shah forms alliance with RSP to run for PM - theweek.in,Nepal rapper-turned mayor Balen Shah forms alliance with RSP to run for PM  theweek.in,2025-12-29 06:13:00,https://news.google.com/rss/articles/CBMiwgFBVV95cUxNeHJOdllWZnNqOXM2Zm1IVnBEaHZvVFRyTUJsRi13OTNjUkZad3R1MWlDQS0zVGtzSlpBLWxQTjB4bUJpS3hjWWEtWFpIOGNPakI1ZEduX1FxcnRSSHlaQjNHMVJXUWxhS0pSM2FuQTNPODJ4Z3pRdjRzMHctYkhhd3VGUkRMZ2Z1S25Sbl9yQ1RXTklTcDU5eV90Vml5Z2RvVkZiVWFCS3R3aEFFMWtEYU5RMS16ODhFVTNXR1JFeUM1Z9IBxwFBVV95cUxOTWZ6dS1TbUs0YkR0SDNqQjR0azFSOXA2dFo4MmtvZUt0MXZFeDVocE1Camw1b2haWUxPUDZCVmIyamRnN240MGZSaF90T21md1Y4d2taU0hPRzlEZ2pNczJhODNWckVQZy1UdlNMS1RzUTV0Rm5nLXduQWNOSG0yNXZaQkMwdzNRYmY2ZkpKMzEwM0tOSFRlUV9CU0ZhUGIzSF9sRzZVRzNsZXZPSmpvRHE2MGZRTlRHYW4yb0FLWE13WXhaN080?oc=5&hl=en-US&gl=US&ceid=US:en,https://www.theweek.in,theweek.in,,{'https://lh3.googleusercontent.com/J6_coFbogxhRI9iM864NL_liGXvsQp2AupsKei7z0cNNfDvGUmWUy20nuUhkREQyrpY4bEeIBuc=s0-w300'},
