title,description,published date,url,publisher.href,publisher.title,full_article,images,translated
Cabinet orders immediate relief for loan shark victims - Nepalnews.com,Cabinet orders immediate relief for loan shark victims  Nepalnews.com,2026-07-14 13:05:36,https://news.google.com/rss/articles/CBMinAFBVV95cUxOOUZhenJLRTN0QlQ1MTdtVW5NOEdNUkhYNGhuZmxfUDV2NEZrTVZsZjJYc21ZSWFCZDFqYkxIbDRZcFFlYXhEVUFnalB1c3B5RV9LNjFVOW4zdlVuMkRkUDJSeFA5WXJLNlVTNzJYbTZ5OXV4UlB5WkkzbkVJQVhIMjQ3YXBQWkNuU21pZVBuQUE3d01iNzhQX3ppUk0?oc=5&hl=en-US&gl=US&ceid=US:en,https://english.nepalnews.com,Nepalnews.com,,,
UNFPA's new Nepal representative presents credentials to Foreign Minister Khanal - The Himalayan Times,UNFPA's new Nepal representative presents credentials to Foreign Minister Khanal  The Himalayan Times,2026-07-14 13:29:52,https://news.google.com/rss/articles/CBMiuwFBVV95cUxPTU9yY3pCVUlNSzFvazF5d0Y1azRFRUlXUzA0NWVmSmtYOG1KR0lvVTFHNUdiaXYyYUUyYmNraGl3MHVGZXE4V0VXeUgxTWxURllzT0ZTX0hQeW9JSXl2ZHBUUkFOLW5fR3h1UmJBN0lEUWhlTEhpakw0UF9NeC1EVTE1VnVsNllENVhrelBlT3FLTVBnNFZieHZCQVdUM0RKT2F1b0Q2RzJSeHFNdnlDX3pJR1NSTTN1b2Rv?oc=5&hl=en-US&gl=US&ceid=US:en,https://thehimalayantimes.com,The Himalayan Times,"KATHMANDU, JULY 14

Sriram Haridass, the newly appointed United Nations Population Fund (UNFPA) Representative for Nepal, presented his letter of credentials to Foreign Minister Shishir Khanal on Tuesday.

Related Articles Foreign Minister Khanal set to embark on China visit tomorrow Foreign Minister Khanal to visit China from June 14-17

During the meeting at the Ministry of Foreign Affairs, Minister Khanal and Haridass reaffirmed the longstanding partnership between the Government of Nepal and UNFPA in promoting population and development, sexual and reproductive health and rights, gender equality, and evidence-based policymaking.

The two also discussed Nepal's changing demographic landscape and the need to strengthen demographic data and analysis to support inclusive and sustainable development.

googletag.cmd.push(function() { googletag.display('div-gpt-ad-1686127029429-0'); }); googletag.cmd.push(function() { googletag.display('div-gpt-ad-1686127067910-0'); }); googletag.cmd.push(function() { googletag.display('div-gpt-ad-1686127112906-0'); });

Minister Khanal said Nepal values its long-standing cooperation with UNFPA in advancing population and development priorities and strengthening the country's health system. He stressed the importance of integrating demographic trends into national development planning.

Haridass reaffirmed UNFPA's commitment to supporting Nepal's development priorities and the Programme of Action of the International Conference on Population and Development (ICPD). He said the agency would continue working closely with the government and development partners to strengthen national systems and enhance demographic resilience.

UNFPA has been working with the Government of Nepal since 1971, supporting programmes on sexual and reproductive health, gender equality, youth empowerment and population data systems.

A Sri Lankan national, Haridass assumed office as UNFPA Representative for Nepal in July 2026 after serving as the agency's representative ad interim for a year. He has more than 23 years of experience in programme management, policy engagement and humanitarian response across Asia and Africa.","{'https://thehimalayantimes.com/theme_himalayantimes/images/layout/icon_youtube.png', 'https://cdnx.premiumread.com/?url=https://thehimalayantimes.com/thehimalayantimes/uploads/images/2026/07/14/49612.jpg&w=800&q=100&f=webp', 'https://cdnx.premiumread.com/?url=https://thehimalayantimes.com/thehimalayantimes/uploads/images/2026/07/14/49589.jpg&w=30&q=100&f=webp', 'https://thehimalayantimes.com/theme_himalayantimes/images/layout/icon_pinterest.png', 'https://thehimalayantimes.com/theme_himalayantimes/images/layout/icon-Instagram-colored.png', 'https://cdnx.premiumread.com/?url=https://thehimalayantimes.com/thehimalayantimes/uploads/images/2026/06/13/48756.jpg&w=30&q=100&f=webp', 'https://thehimalayantimes.com/theme_himalayantimes/images/layout/icon_facebook.png', 'https://thehimalayantimes.com/theme_himalayantimes/images/logo-100.png', 'https://cdnx.premiumread.com/?url=https://thehimalayantimes.com/thehimalayantimes/uploads/images/2026/07/14/49599.jpg&w=30&q=100&f=webp', 'https://thehimalayantimes.com/theme_himalayantimes/images/layout/icon_x.png', 'https://cdnx.premiumread.com/?url=https://thehimalayantimes.com/thehimalayantimes/uploads/images/2026/07/14/49591.jpg&w=30&q=100&f=webp', 'https://thehimalayantimes.com/theme_himalayantimes/images/layout/icon_messenger.png', 'https://cdnx.premiumread.com/?url=https://thehimalayantimes.com/thehimalayantimes/uploads/images/2026/07/14/49579.jpg&w=30&q=100&f=webp', 'https://thehimalayantimes.com/theme_himalayantimes/images/layout/icon_viber.png', 'https://thehimalayantimes.com/thehimalayantimes/uploads/images/2026/07/14/49612.jpg', 'https://thehimalayantimes.com/theme_himalayantimes/images/layout/icon_whatsapp.png', 'https://cdnx.premiumread.com/?url=https://thehimalayantimes.com/thehimalayantimes/uploads/images/2026/06/12/48754.jpg&w=30&q=100&f=webp', 'https://thehimalayantimes.com/theme_himalayantimes/images/layout/icon-tiktok.png', 'https://thehimalayantimes.com/theme_himalayantimes/images/layout/icon_telegram.png', 'https://thehimalayantimes.com/theme_himalayantimes/images/layout/icon_linkedin.png'}","काठमाण्डू, १४ जुलाई

नेपाल के लेल संयुक्त राष्ट्र जनसंख्या कोष के नवनियुक्त प्रतिनिधि श्रीराम हरिदास मंगलदिन विदेश मंत्री शिशिर खनाल के अपन साख पत्र भेंट केलनि।

संबंधित लेख विदेश मंत्री खनाल काल्हि चीन यात्रा पर निकलय वाला छथिन्ह विदेश मंत्री खनाल 14-17 जून सं चीन के दौरा करय वाला छथिन्ह

विदेश मन्त्रालयमे भेल बैसारमे मन्त्री खनाल आ हरिदास जनसंख्या आ विकास, यौन आ प्रजनन स्वास्थ्य आ अधिकार, लैङ्गिक समानता, आ साक्ष्य आधारित नीति निर्माणमे नेपाल सरकार आ यूएनएफपीएके बीच दीर्घकालीन साझेदारीके दोबारा पुष्टि केलथि ।

दुनू गोटे नेपालक बदलैत जनसांख्यिकीय परिदृश्य आ समावेशी आ सतत विकासक समर्थन करबाक लेल जनसांख्यिकीय आंकड़ा आ विश्लेषण केँ मजबूत करबाक आवश्यकता पर सेहो चर्चा कयल गेल।

गूगलटैग.सीएमडी.पुश (फंक्शन () { गूगलटैग.प्रदर्शन ('डिव-जीपीटी-विज्ञापन-1686127029429-0'); }); गूगलटैग.सीएमडी.पुश (फंक्शन () { गूगलटैग.प्रदर्शन ('डिव-जीपीटी-विज्ञापन-1686127067910-0'); }); गूगलटैग.सीएमडी.पुश (फंक्शन () { गूगलटैग.प्रदर्शन ('डिव-जीपीटी-विज्ञापन-1686127112906-0'); });

मन्त्री खनाल जनसङ्ख्या आ विकास प्राथमिकताके आगाँ बढ़ेबा आ देशके स्वास्थ्य व्यवस्था सुदृढीकरणमे यूएनएफपीएके साथ दीर्घकालीन सहयोगके नेपाल महत्व दैत बतौलनि । ओ जनसांख्यिकीय प्रवृत्ति कए राष्ट्रीय विकास योजना मे एकीकृत करबाक महत्व पर जोर देलथि।

हरिदास नेपालके विकास प्राथमिकता आ जनसंख्या तथा विकास अन्तर्राष्ट्रिय सम्मेलन (आईसीपीडी)के कार्य कार्यक्रमके सहयोगके लेल यूएनएफपीएके प्रतिबद्धताके दोबारा पुष्टि केलै । हुनी कहलकै कि एजेंसी सरकार आरू विकास भागीदारौ के साथ मिल क राष्ट्रीय प्रणाली क मजबूत करै आरू जनसांख्यिकीय लचीलापन बढ़ाबै के काम जारी रखतै ।

यूएनएफपीए नेपाल सरकार के साथ 1971 स॑ काम करी रहलऽ छै, जेकरा म॑ यौन आरू प्रजनन स्वास्थ्य, लैंगिक समानता, युवा सशक्तिकरण आरू जनसंख्या डाटा प्रणाली के कार्यक्रम के समर्थन करलऽ जाय रहलऽ छै ।

श्रीलंका केरऽ नागरिक हरिदास न॑ एक साल तलक एजेंसी केरऽ प्रतिनिधि विज्ञापन अंतरिम के रूप म॑ काम करला के बाद जुलाई २०२६ म॑ नेपाल लेली यूएनएफपीए प्रतिनिधि के रूप म॑ पदभार ग्रहण करलकै । हुनका पूरा एशिया आरू अफ्रीका म॑ कार्यक्रम प्रबंधन, नीतिगत जुड़ाव आरू मानवीय प्रतिक्रिया म॑ २३ साल स॑ भी अधिक के अनुभव छै ।"
"Nepal News Evening Economic Brief – July 14, 2026 - Nepalnews.com","Nepal News Evening Economic Brief – July 14, 2026  Nepalnews.com",2026-07-14 13:53:12,https://news.google.com/rss/articles/CBMikgFBVV95cUxQN1dWSG5TSVdzZnY2QnlrNHBnMTh2RWg4THNyejFiWEdsdzB4TWM4NEI2X0kzWktJalJhcng3dkE2VnVWY3ZET2hkWjJCdEJadWhIdHZoZ09ScXZ2UDAtdHdZSjkzb0diVTdreWRuYm9RYWg1WFdoMGVKVmI0M3RfT09OZFpZbUFMaXY4Z2RqOHVtZw?oc=5&hl=en-US&gl=US&ceid=US:en,https://english.nepalnews.com,Nepalnews.com,,,
US man arrested near Nepal border without passport - Diya TV,US man arrested near Nepal border without passport  Diya TV,2026-07-14 14:22:27,https://news.google.com/rss/articles/CBMi_AFBVV95cUxOM0xibWNfSU5iWUhMdF9EY2pCa2I2UTRQRmtmaEFKMGx5RmVoVTdfME9PN1NsM0tjcmt4Ry1EcUgzWEcxSFFnQnYwVmsyUk1xLVZmMW4xbTFfU1h1X0JjWHphTUZQcDhyR3MzZDUwbWJSTVBNVzZNQXRuQjk1Nkh4elFPV0RENmZaUGRNX0Q1cExMUFpYNVBBcEZqQWRzazNrV2J1MkpESXJhc21zM1FDaFoyQlFPdHJhMVdtMzNJWlI1NXVveGZaT2hzQlVWMG45NlUxSWhpYUlrUGJUZWoyd0lUWWNfcjE0WTJVSV9FWnptYzhKZVBPQk0xVFQ?oc=5&hl=en-US&gl=US&ceid=US:en,https://diyatvusa.com,Diya TV,,,
"Nepal News Evening Briefing | Tuesday, July 14, 2026 - Nepalnews.com","Nepal News Evening Briefing | Tuesday, July 14, 2026  Nepalnews.com",2026-07-14 14:30:36,https://news.google.com/rss/articles/CBMilgFBVV95cUxOR3JjUmQ3MEVkNjNERTFtWlpydGxaVklMSkxtRFpiVlpWcy1COEJoVjgwbVdrTkhGLVVsQUE3NTdseXdBekh0WUJOVW1oQXMtdy1id1BDM3RuT3lNS2ZfVHgyWFlmZFV4dENVWEdOdVB0X3FheGhtd3NRQy16WHpOQWdpQWJZaVd4RXlCZkVCQURNdk12TXc?oc=5&hl=en-US&gl=US&ceid=US:en,https://english.nepalnews.com,Nepalnews.com,,,
From wealth probe to Supreme Court showdown: Everything you need to know about Nepal’s Property Inquiry Commission - Nepalnews.com,From wealth probe to Supreme Court showdown: Everything you need to know about Nepal’s Property Inquiry Commission  Nepalnews.com,2026-07-14 14:35:38,https://news.google.com/rss/articles/CBMi7AFBVV95cUxQU1N2cWptUk41NzE0UEIxNE9qSGlJSVJHdzV1eElyc2k1OFl3RHJmMWJ6VHA4SFczemZCb2hEc0x5OTEwRk8wdHNXbHNTMU5lTU8tN3Zjd3pBcWs5MlNZOV8wWG8ycE5KQTB0OTBMaUZBY1JCWmRVWFRjY2sxOE0zcndjZnJhV041RFFaZ3BOc3U3Uk8tc3ZXb0stMlNPTWQ5eWhid0ZTQmpwR0RlVU9oS2t2OTNxWFYzZ2RaeGZ3S2wzQ1FwaHVWbjF6YmpndmJIY3B4TkZibXlOcUNHZ2pZY0RIdnFMRUwzNF9GYQ?oc=5&hl=en-US&gl=US&ceid=US:en,https://english.nepalnews.com,Nepalnews.com,,,
US Citizen Held Near Nepal Border: Security Agencies Probe Alleged Military Links | The Right Stand - News18,US Citizen Held Near Nepal Border: Security Agencies Probe Alleged Military Links | The Right Stand  News18,2026-07-14 14:57:00,https://news.google.com/rss/articles/CBMi6gFBVV95cUxPMmVDUzRvbzUtLVMxMmRxb2J5N2sxQ2pFTVlQU00tLUhPLUo3Q2wyRWFnMnNUR1JnX3dWc2Vkek1zNHhmMEk3aHZmcEJUUTFUb25YZkRSdXcydjVIdThaUUp6TWgwSVdYZnNQaWZQZFhJeV9MMThqcFB4ZDhiWkRtWEdVVGhhNkVudFNmSFJuYzA4NXI1ekU5dGNJcGpOZ0UyVVc2d0hORllIM3Z4TVMzdE5ET2dvYkpKckpWRlJZZko1OGlZQUcxR2p2MWx5bUhNUFFBdDl6c2pCT01TVFJKaGRoczV1OFlRdmfSAe8BQVVfeXFMUGJjOTRzWWVnRWxKLW9mendOeGxYY2FzbDM5eE1jU2RKQzhhMlFjS2Z2WVN3NVdHSzRMUEVTR1dQUjVBLTFabFd1LWlRcHcwc3hfTE1kM0JwWGhvaWF0TEEtWWxfaE13Z09yTkExcFFpV3RSYkhLMllhVExxMUNxSjl6RnBVUmZ0bDJZZFpXbF9YNzlZbV9vZjFnNGNKVDJNakpFd3d6N21zWTVWVk9SX2p6NUtnYjlycDIwdUM2SHk1NmNsY08ySkdTcHlKeGhlTzZYMmZRdGpoODZfU3ZJZmNObUJwV2J0TTRoS0RCYzA?oc=5&hl=en-US&gl=US&ceid=US:en,https://www.news18.com,News18,"A major security investigation is underway after American citizen Jordan Brown was arrested near the India-Nepal border. Authorities are examining his claims of a military background while probing his movements and activities in the sensitive border region.Investigators are also looking into possible links to missionary groups operating in Northeast India, as well as other aspects of the case to determine whether there are any wider security implications. The arrest has drawn attention due to the strategic importance of the India-Nepal border and ongoing concerns over cross-border activities. Officials have not publicly confirmed any broader security threat or any wrongdoing beyond the matters currently under investigation. n18oc_the_right_standn18oc_Indian18oc_breaking-newsNews18 Mobile App - https://onelink.to/desc-youtube","{'https://images.news18.com/ibnlive/uploads/2026/07/1784042368_10c1fb91-a9b0-4737-8f70-3618dc6ef0dc-1200x675.jpeg', 'https://images.news18.com/dlxczavtqcctuei/news18/static/images/english/ask-search-icon.svg', 'https://sb.scorecardresearch.com/p?c1=2&c2=6683813&cv=3.9.1&cj=1', 'https://images.news18.com/dlxczavtqcctuei/news18/static/images/english/dwn.svg', 'https://images.news18.com/dlxczavtqcctuei/news18/static/images/english/zdcicon.png', 'data:image/gif;base64,R0lGODlhAQABAAAAACH5BAEKAAEALAAAAAABAAEAAAICTAEAOw==', 'https://images.news18.com/dlxczavtqcctuei/news18/static/images/english/rapid-read-icon-trans.png', 'https://images.news18.com/static_news18/pix/ibnhome/news18/images/default-218x145.jpg'}",भारत-नेपाल सीमा के समीप अमेरिकी नागरिक जॉर्डन ब्राउन के गिरफ्तार करला के बाद सुरक्षा के पैघ जांच चलि रहल अछि। अधिकारियऽ न॑ संवेदनशील सीमा क्षेत्र म॑ हुनकऽ आवाजाही आरू गतिविधि के जांच करतें हुअ॑ सैन्य पृष्ठभूमि के हुनकऽ दावा के जांच करी रहलऽ छै ।जांचकर्ता पूर्वोत्तर भारत म॑ संचालित मिशनरी समूहऽ स॑ संभावित संबंध के साथ-साथ ई मामला केरऽ अन्य पहलू के भी जांच करी रहलऽ छै ताकि ई तय करलऽ जाय सक॑ कि एकरऽ सुरक्षा केरऽ कोनो व्यापक प्रभाव छै कि नै । भारत-नेपाल सीमा के सामरिक महत्व आ सीमा पार के गतिविधि पर जारी चिंता के कारण गिरफ्तारी के ध्यान आकर्षित केलक अछि। अधिकारी सब सार्वजनिक रूप स कोनो व्यापक सुरक्षा खतरा या कोनो गलत काज क पुष्टि नहि केलथि अछि जे एखन जांच चलि रहल मामला स आगू अछि। n18oc_the_right_standn18oc_Indian18oc_breaking-newsNews18 मोबाइल ऐप - https://onelink.to/desc-youtube...
Court determines final prison sentences and fines for individuals convicted in fake Bhutanese refugee scam - Nepalnews.com,Court determines final prison sentences and fines for individuals convicted in fake Bhutanese refugee scam  Nepalnews.com,2026-07-14 15:05:40,https://news.google.com/rss/articles/CBMi5AFBVV95cUxNNmY5TGVsZXcza29ITTJxdUJueUtlSXQ1M3hSNlN6S295R0d0ejdpUHNmUWxVTVJRUWstZVROODBNTG9jTzkxaWpRTV9DNDJxQkpQLVhqeFBiVC13WTM0WUp4cXRmYS11WTdTTmlGRHllVXFOQklnQ0dhZ2VtN3hFQ0lQaG9Ta3F5RmluZTVpdGxBRUlBcEFxOTNndkVqWldVOUlyRkZRYTJISHBESXBtLVQ1TWlySU5TWmVCak01U1FKeDFtMFR0Z3dwM2ZSTjZWWjAzTFBZMTlaYzgxTjQzQ3RDdzU?oc=5&hl=en-US&gl=US&ceid=US:en,https://english.nepalnews.com,Nepalnews.com,,,
No special allowance or benefits for traffic police from traffic fines: Nepal Police - myRepublica,No special allowance or benefits for traffic police from traffic fines: Nepal Police  myRepublica,2026-07-14 15:25:13,https://news.google.com/rss/articles/CBMiygFBVV95cUxQSGhkZHNZUWJMX3VMRE9yZUNYcFVBYlQ0T3dtRmRNRW1DdUxPT1o0Tm9lTUhYYU1vR2ZwNV9FQ1VTOUhpYTdqX3Bfemp6UnR1TTlXSHdnR2MxdVVycnhhcjJyRGwxZ3Z6MWhrWVh2VkRIMFF3M0xyQjZPSDFic3c3bWxBbmYySUxpMEVyai04NFFzaldvYm9TeUM4Um9Dd1ZBaGZLb3FFQXZzSzZKTWN1WnRoMF9DQ2pIbUoxYUg2eXZPc2E2NkNHUzV3?oc=5&hl=en-US&gl=US&ceid=US:en,https://myrepublica.nagariknetwork.com,myRepublica,"KATHMANDU, July 14: The Nepal Police has said there is no legal provision making the traffic police eligible to receive special allowance or benefits for charging fines for traffic violation.

(adsbygoogle = window.adsbygoogle || []).push({});

Issuing a press statement on Tuesday, the Nepal Police has made it clear that the entire revenue from the traffic fines is directly deposited in the government's account.

Related story Traffic Police introduce system to pay fines using machine

The police stated that news reports lacking facts and official verification negatively affect the image of public institutions, erode public trust in such organisations and make administrative processes unnecessarily controversial.

“There is no legal provision for traffic police to be entitled to any additional benefits for collecting fines from the violations of traffic rules,"" the statement reads.

The police have urged media and social sites users to verify any information through official channels before disseminating it from the respective media or from the social platforms.","{'https://republicajscss.nagariknewscdn.com//img/logo-mobile.svg', 'https://republicajscss.nagariknewscdn.com//img/logo.svg', 'https://republicajscss.nagariknewscdn.com//img/nrm-logo-with-tagline-english.png', 'https://republicajscss.nagariknewscdn.com//img/sukrabar-logo.png', 'https://republicajscss.nagariknewscdn.com//img/nagarik-logo.png', 'https://republicajscss.nagariknewscdn.com//img/radio-nagarik-logo.png', 'https://republicaimg.nagariknewscdn.com/shared/web/uploads/media/traffic-checking-jan1917.jpg', 'https://republicajscss.nagariknewscdn.com//img/side-bar-logo.svg', 'https://republicajscss.nagariknewscdn.com//img/default_image.png'}","काठमाण्डू, १४ जुलै : नेपाल प्रहरी यातायात उल्लंघन के लेल जुर्माना लेला पर यातायात प्रहरी के विशेष भत्ता या लाभ लेबय योग्य कोनो कानूनी प्रावधान नै रहल बतौलक अछि ।

(adsbygoogle = विंडो.adsbygoogle || []).पुश ({});

मंगलदिन प्रेस विज्ञप्ति जारी करैत नेपाल प्रहरी स्पष्ट कएने अछि जे यातायात जुर्माना सँ प्राप्त सम्पूर्ण राजस्व सोझे सरकारक खाता मे जमा होइत अछि ।

संबंधित कहानी ट्रैफिक पुलिस मशीन के उपयोग क जुर्माना चुकाबय के व्यवस्था शुरू केलक

पुलिस के कहनाय छनि जे तथ्य आओर आधिकारिक सत्यापन के कमी वाला न्यूज रिपोर्ट सार्वजनिक संस्थान के छवि के नकारात्मक रूप सं प्रभावित करैत अछि, एहन संगठन पर जन विश्वास के क्षीण करैत अछि आओर प्रशासनिक प्रक्रिया के अनावश्यक विवादित बना दैत अछि.

बयान मे कहल गेल अछि जे, ट्रैफिक नियम क उल्लंघन स जुर्माना वसूली क लेल ट्रैफिक पुलिस कए कोनो अतिरिक्त लाभ क हकदार हेबाक कोनो कानूनी प्रावधान नहि अछि।

पुलिस मीडिया आ सोशल साइट यूजर स आग्रह केलक अछि जे कोनो जानकारी के संबंधित मीडिया स या सोशल प्लेटफॉर्म स प्रसारित करबा स पहिने आधिकारिक चैनल के माध्यम स सत्यापन करथि।"
"Chinese passport, religious books, AI device found on US national arrested near Nepal border | India News - Hindustan Times","Chinese passport, religious books, AI device found on US national arrested near Nepal border | India News  Hindustan Times",2026-07-14 15:34:45,https://news.google.com/rss/articles/CBMi5AFBVV95cUxPR1RpWm0tR2RHVzBac0JCajJrX2s1a1BGN1FUSHhvWHFoYXJfeWdrNTdIeGRSZlJXVEgwVFJiem00eXNDdWh0T0VkXzhfeU1YRjBMS1RBSlgzSnh2SU5acmxHVGRSc0xpeDYwX3FtaU1jRENJd3loV3ZQWnRDWWgxV2F6TmhIWF96UnJFbkhtamh5b1ZJNmttWGw4ZThMS241YmF5WDVuS3lWN3VFeGxQclY2N0xzWHhEYmctdDRsOWZtcHN6enAwYnJQd3UwNlo4N0NTeTFiTGNRNTBEUVhXeFZpTTXSAeoBQVVfeXFMT3FuVDJCSXM0MzlEdDVJOUQ0RjViOGpRN01DY2Z3NlNBYTEycVBGM0JqeFVfYzFqS29lclE4MVpNa0ZQYnFUb3lDb3NHTTBTaHdIcmJSX0dkTnZtQkFCV1h3WUEwcEcxMmNTU1J5b2lvcW5INlVYdHRCMG9ZeXZYcDBLZmdPRWMtQnZXOERYekh4d3dXQ3dOZ1RqUC1EYjkweDVwQW1DdXBGLXk0TXpMTEEtbVBEbnZLUlBKR3B4ekpDRVVwRGc1RkVKZFI2ektQOENEX2pWUjFXd0JPN1MtbDBUdXVSQ3E2MTJR?oc=5&hl=en-US&gl=US&ceid=US:en,https://www.hindustantimes.com,Hindustan Times,,,
Nepal PM attends House session after 43 days - ANI News,Nepal PM attends House session after 43 days  ANI News,2026-07-14 15:48:00,https://news.google.com/rss/articles/CBMingFBVV95cUxPWVlBS1BPNkdPNVJQMTRwdUVjbHd6THpwMVJ4blZSdjU3SVZRTkdlb1FOMHpUMG9oQ0dJc3g2S2xReG0waXZyVVotU2h0SUIwNnQ5NU1sSnUweWVMdDh4ZnpHcF9NZDlhT0I3Ry1OdG5WbEpxbzUyMHR6cVdjcXMzNThTeG5KUTROeTF2bVF0M0VFMlpJeXBoQlBZamtMdw?oc=5&hl=en-US&gl=US&ceid=US:en,https://www.aninews.in,ANI News,,,
Political instability leaves Madhesh Province Assembly lagging on lawmaking - Nepalnews.com,Political instability leaves Madhesh Province Assembly lagging on lawmaking  Nepalnews.com,2026-07-14 15:50:42,https://news.google.com/rss/articles/CBMiuAFBVV95cUxPR2t1a0xqYmVnN3o5bk9NMUpMOWttMldyY05FcXhnX1FacWl4UlUwWUlUY1g1YS1pMGZXTWF0NWxMMjJaWGEzTG1FX3V4UFhuM0Etbmp1Nzl0U0g3c00zYzJpTkR5UEVLaWNjNWFtYTZwZURWTW1UQjdsdEgtVFlZb0tJMlJjV2t2bFFVSTNhRTR6YWNucEVPeUpHQjB4b1ZmN19TUkdrQUVQeDdMMF9zcG03Zzc3OC1F?oc=5&hl=en-US&gl=US&ceid=US:en,https://english.nepalnews.com,Nepalnews.com,,,
