title,description,published date,url,publisher.href,publisher.title,full_article,images,translated
PM Shah and ADB President Kanda discuss development partnership - Nepalnews.com,PM Shah and ADB President Kanda discuss development partnership  Nepalnews.com,2026-07-07 06:31:21,https://news.google.com/rss/articles/CBMipgFBVV95cUxQNldxSFgtR0RHeld4b2NmVzdlNk9mZzBqZndmUmRRUDBPVzUwRzRUY1JSY2tDUlNWSU5aeW9aQXJ6ZlFWX05DbjJBeGpUZ2dBV0hDa0UyQ3lWcUlUM2ktRnVjd1M1eGEzTTktOFpfZDhPM0JxLXVKSEF4cWdxLUZwelpXU0k1dnBiWGtFSXdTMV9sV0p5anhtdm5SaWhBMnZFTy1BMkRR?oc=5&hl=en-US&gl=US&ceid=US:en,https://english.nepalnews.com,Nepalnews.com,,,
English-medium shift makes Gaushala community schools parents’ first choice - Nepalnews.com,English-medium shift makes Gaushala community schools parents’ first choice  Nepalnews.com,2026-07-07 06:41:22,https://news.google.com/rss/articles/CBMitAFBVV95cUxQS25rZmtMcThUY3Z6Sy1qYTduWk8zdjVRX0dLaDlORkJHbG53WlZJeVpvT0pESHVCVW5NN3NpYUI5enl1WDNwZWlIaFd5YTdnXzZJbGhoYlpvSm5fcERPUS1pcWo5WENEUVFNdC0tUVcteWRRaDVXak9ad21xNWZndGNOVk1yaXROWGxINkdDOGdYTmdPYmVCdmphVDByR3Fac0VyTTlkWWE1dWw4cDdnQnYzNmI?oc=5&hl=en-US&gl=US&ceid=US:en,https://english.nepalnews.com,Nepalnews.com,,,
Jitu Nepal to Judge Comedy Champion Season 4 - Ratopati,Jitu Nepal to Judge Comedy Champion Season 4  Ratopati,2026-07-07 06:43:22,https://news.google.com/rss/articles/CBMiiAFBVV95cUxONWR1aHEzc3pNa3Z5Z2xZZ0ZmcE9BdG54Qzhlb2RKN01BdnUyeWtwaFVjcW85dnVuZVFKOEZ5S19uSWZKQmxvTnZiUXQzb2ZYLUhQMXpaN2NZZl8tcTJzVzZveGZHU1VYLUxBWXpRcUwtVGlRV0xOd05zejNXRGNlUTFBMEo5QzBX?oc=5&hl=en-US&gl=US&ceid=US:en,https://english.ratopati.com,Ratopati,"Kathmandu. Actor and comedian Jitu Nepal will be seen in the fourth season of the reality show 'Comedy Champion'. He is going to be seen in the role of judge of the show. The organizer is yet to announce this.

Actor Nepal has accepted that he is going to be seen in the role of judge in the show. 'I have been in comedy for a long time. I am suitable to be a judge of the show,' Jitu said.

Miss Nepal Namrata Shrestha has entered as the presenter of the fourth season, which is preparing to be broadcast on Himalaya Television from the first week of Shrawan. After actress and model Rima Bishwakarma, who conducted three consecutive seasons, was elected as a member of the House of Representatives, Namrata has entered in her place.

Bishal Bhandari will direct the program this time as well. Although there was a 4-member judging panel in the previous seasons, the organizer has not yet revealed how many judges will be there in the fourth season.

Jitu Nepal is an established artist in Nepali comedy acting. After gaining popularity in comedy in television, stage, and films, Nepal has been appearing in films as an actor.

Even before that, Jitu Nepal's potential entry has significantly increased the audience's curiosity towards the program.","{'https://npcdn.ratopati.com/media/news/sunil-lamsal-2_shbI1TxUIR.jpg', 'https://npcdn.ratopati.com/media/news/royalti_Yj2UBS5lsu.jpg', 'https://npcdn.ratopati.com/media/news/bal_Xo3P40hUyG.jpg', 'https://npcdn.ratopati.com/media/news/raphael-claus_MxjsRb5WSg.webp', 'https://npcdn.ratopati.com/media/news/jitu-nepal1_nhj7sqlrwf_RgLBcFOga8.jpg', 'https://npcdn.ratopati.com/media/news/NvHbtiKCX8.jpg', 'https://npcdn.ratopati.com/media/authors/ratopati_science_RGmmSpmAnu.jpg', 'https://npcdn.ratopati.com/media/news/h_wfiuTgCUGx.jpg', 'https://english.ratopati.com/build/img/logo-rp.png', 'https://npcdn.ratopati.com/media/news/rabi-balen_cbrvjcdhdw_Z67lKG2y5C.jpg', 'https://npcdn.ratopati.com/media/news/stale_HTw52P8At8.jpg', 'https://npcdn.ratopati.com/media/news/film-haru_9w750cjmX1.jpg', 'https://npcdn.ratopati.com/media/news/1000136989_Ei1HK4GdxN.png', 'https://npcdn.ratopati.com/media/news/1000136536_3261oYpuhE.jpg', 'https://npcdn.ratopati.com/media/news/karyadal_FmdvkDy15q.jpg', 'https://npcdn.ratopati.com/media/news/unnamed_pMGf3LBRBV.jpg', 'https://npcdn.ratopati.com/media/news/samsad_UcWUpzVe0a.jpg'}","काठमांडू। रियलिटी शो ‘कॉमेडी चैम्पियन’ के चारिम सीजन में अभिनेता आ हास्य कलाकार जीतू नेपाल देखल जेताह । हुनका शो के जज के भूमिका मे देखय लेल मिलय वाला छथिन्ह. आयोजक एखन धरि एहि बातक घोषणा नहि केलक अछि।

अभिनेता नेपाल स्वीकार कएने छथि जे हुनका एहि शो मे जज क भूमिका मे देखबा लेल जा रहल अछि। 'हम बहुत दिनसँ हास्य मे छी ।' हम शो के जज बनय लेल उपयुक्त छी,' जीतू कहलनि।

श्रावण के पहिल सप्ताह स हिमालय टेलिभिजन पर प्रसारित होबय बला चारिम सीजन के प्रस्तोता के रूप में मिस नेपाल नम्रता श्रेष्ठ प्रवेश केने छथि । लगातार तीन सीजन के संचालन करय वाली अभिनेत्री आ मॉडल रीमा विश्वकर्मा के प्रतिनिधि सभा के सदस्य चुनला के बाद हुनकर जगह पर नम्रता के प्रवेश भ गेल अछि.

एहि बेर सेहो विशाल भण्डारी कार्यक्रमक निर्देशन करताह। हालांकि पिछला सीजन मे 4 सदस्यीय निर्णायक मंडल छल, मुदा आयोजक एखन धरि इ खुलासा नहि केलथि अछि जे चारिम सीजन मे कतेक निर्णायक हेताह।

जीतू नेपाल नेपाली हास्य अभिनय मे स्थापित कलाकार छी । टेलीविजन, मंच, आ फिल्म मे हास्य मे लोकप्रियता प्राप्त केलाक बाद नेपाल अभिनेताक रूप मे फिल्म मे अभिनय करैत आबि रहल अछि ।

ताहि सँ पहिने सेहो जीतू नेपालक संभावित प्रवेश सँ कार्यक्रमक प्रति दर्शकक जिज्ञासा काफी बढ़ि गेल अछि ।"
Nepal Rastra Bank calls for bidding on Rs 25 billion bond - Nepalnews.com,Nepal Rastra Bank calls for bidding on Rs 25 billion bond  Nepalnews.com,2026-07-07 06:51:22,https://news.google.com/rss/articles/CBMioAFBVV95cUxPSkJSX2M1UUltRW14TWp4VzI5OXRfRlp0eEd6Z2VGbGxNVnpKbXpjbEJ2Zndzc3pESzlVRWFMZ1ZvSk9Nc05ibXZ5ZHVFTmlobEY1QUJPSF81d2FPcGdwbWdIcENQM1RRNjBILXRNTEZ4V1lpWTFUSjJCLXRwLVFfa0p1a3RsRUY4QVYyUXZhTzc3VzJMV0tLbHJHcWdGUE82?oc=5&hl=en-US&gl=US&ceid=US:en,https://english.nepalnews.com,Nepalnews.com,,,
