title,description,published date,url,publisher.href,publisher.title,full_article,images,translated
"Sri Lanka Stands with Maldives, India and Regional Tourism Destinations as Nepal’s Langtang National Park Battles a Major Visitor Decline Crisis With Falling Tourist Arrivals, Reduced Revenue and Growing Pressure on Himalayan Mountain Tourism Econo - Travel And Tour World","Sri Lanka Stands with Maldives, India and Regional Tourism Destinations as Nepal’s Langtang National Park Battles a Major Visitor Decline Crisis With Falling Tourist Arrivals, Reduced Revenue and Growing Pressure on Himalayan Mountain Tourism Econo  Travel And Tour World",2026-07-07 07:20:26,https://news.google.com/rss/articles/CBMibkFVX3lxTFBwRXNHTy1mdmVHYUpZMDdKMGdXdzZHcGczcDJ5WmhZV2g3cGFVbUlaN1BRdVhLbURiMjF4MERScnZWWERodUg0c2xqZmQ4Qm1CUDRZVzRfUmdqMmt0d3ppblN3RDFPbUhSOFZGcEdn?oc=5&hl=en-US&gl=US&ceid=US:en,https://www.travelandtourworld.com,Travel And Tour World,"Home » TRAVEL ALERT » Sri Lanka Stands with Maldives, India and Regional Tourism Destinations as Nepal’s Langtang National Park Battles a Major Visitor Decline Crisis With Falling Tourist Arrivals, Reduced Revenue and Growing Pressure on Himalayan Mountain Tourism Economy

Sri Lanka Stands with Maldives, India and Regional Tourism Destinations as Nepal’s Langtang National Park Battles a Major Visitor Decline Crisis With Falling Tourist Arrivals, Reduced Revenue and Growing Pressure on Himalayan Mountain Tourism Economy

Published on July 7, 2026

Image generated with Ai

Sri Lanka stands with Maldives, India and regional tourism destinations as Nepal’s Langtang National Park faces a major visitor decline crisis, with tourist arrivals falling from previous levels and tourism revenue dropping significantly. The slowdown has created growing pressure on the Himalayan mountain tourism economy, as fewer visitors impact conservation funding, local livelihoods and destination management efforts. The decline highlights the wider challenges faced by nature-based tourism destinations across South Asia, where maintaining strong visitor flows, sustainable tourism practices and regional connectivity remain crucial for economic growth.

Nepal’s Langtang National Park Faces Tourism Pressure as Visitor Numbers Fall Across a Key Himalayan Destination

Sri Lanka stands with Maldives, India and regional tourism destinations as Nepal’s Langtang National Park faces a significant tourism challenge caused by declining visitor arrivals and reduced revenue generation. The Himalayan protected area, which remains one of Nepal’s most recognised adventure and nature tourism destinations, has recorded fewer tourists during the current fiscal year compared with the previous period. The decline has created pressure on tourism income, conservation funding and local economic activities connected with mountain travel.

Advertisement (adsbygoogle = window.adsbygoogle || []).push({});

Langtang National Park is an important destination within Nepal’s Himalayan tourism network. It attracts trekkers, nature lovers, cultural travellers and pilgrims through its combination of mountain landscapes, biodiversity, traditional communities and spiritual attractions. However, the recent reduction in visitor numbers highlights changing tourism patterns affecting destinations that depend heavily on international and domestic travel flows.

The park welcomed nearly 56,000 tourists in the previous fiscal year. However, visitor numbers during the current fiscal year have reached 50,360 arrivals so far, showing a decline compared with the previous period.

Advertisement Advertisement

The latest visitor figures include:

39,011 domestic tourists

788 visitors from SAARC countries

10,561 tourists from other international markets

The decline has affected not only visitor volume but also the financial contribution generated through tourism activities. Revenue collected from tourists has reduced compared with the previous fiscal year, creating additional challenges for maintaining conservation programmes and supporting communities surrounding the protected area.

Advertisement (adsbygoogle = window.adsbygoogle || []).push({}); Advertisement

Langtang National Park Tourism Decline Creates Revenue Challenges for Conservation and Local Communities

Tourism revenue plays a vital role in the management of Langtang National Park. Funds generated through visitor activities support multiple areas, including wildlife protection, biodiversity conservation, ecosystem management and community-based initiatives.

During the previous fiscal year, tourism-related revenue reached approximately Rs 57.7 million. In the current fiscal year, collections have so far declined to around Rs 42.8 million.

Advertisement (adsbygoogle = window.adsbygoogle || []).push({}); Advertisement

The fall in revenue reflects the direct connection between tourist arrivals and the financial sustainability of protected destinations. Fewer visitors mean reduced income for conservation operations and fewer economic opportunities for businesses and communities that depend on tourism.

The Langtang region has traditionally benefited from trekking tourism. Local accommodation providers, guides, transport operators, small businesses and communities have developed economic activities around travellers exploring the Himalayan landscape.

A sustained decline in arrivals could influence the wider tourism economy of the region, particularly for communities located near trekking routes and cultural attractions.

Nepal’s Langtang Region Remains a Global Adventure Tourism Destination Despite Current Challenges

Despite the decline in tourist numbers, Langtang National Park continues to hold strong importance within Nepal’s tourism sector. Established as Nepal’s first Himalayan national park, the protected area covers a diverse landscape featuring forests, mountain ecosystems, glaciers and rare wildlife species.

Advertisement (adsbygoogle = window.adsbygoogle || []).push({}); Advertisement

The destination attracts visitors seeking:

Himalayan trekking experiences

Mountain scenery and photography opportunities

Wildlife exploration

Cultural interaction with local communities

Religious tourism experiences

One of the major attractions within the wider Langtang region is Gosaikunda, a famous high-altitude lake area with deep religious significance. The destination attracts both domestic pilgrims and international travellers who visit for spiritual experiences, trekking adventures and natural beauty.

The combination of adventure tourism and cultural tourism has made Langtang an important contributor to Nepal’s mountain tourism economy.

Regional Tourism Connections From Sri Lanka, Maldives and India Highlight South Asian Travel Networks

The headline connects Nepal’s tourism situation with wider regional destinations, including Sri Lanka, Maldives and India, because South Asian tourism markets are increasingly interconnected through regional travel demand, air connectivity and visitor movement.

The countries linked with the regional tourism landscape include:

Sri Lanka

Sri Lanka remains one of South Asia’s important tourism destinations, known for beaches, heritage sites, wildlife experiences and cultural attractions. The country’s tourism economy depends significantly on international arrivals and regional connectivity.

Advertisement (adsbygoogle = window.adsbygoogle || []).push({}); Advertisement

Sri Lanka’s tourism growth has been supported by demand from Asian markets, including neighbouring countries. Like Nepal, Sri Lanka relies on strong visitor flows to support local businesses, employment and destination development.

Maldives

The Maldives represents one of the world’s most recognised island tourism destinations. Its economy is closely connected with international tourism, particularly through luxury resorts, marine experiences and leisure travel.

The destination highlights the importance of maintaining visitor confidence, international connectivity and sustainable tourism management.

India

India remains one of the largest tourism markets in South Asia and plays a significant role in regional travel movements. Indian travellers contribute to tourism demand across neighbouring destinations, including Nepal.

Due to geographical proximity, cultural connections and easier travel access, India is an important source market for Nepal’s tourism sector.

Bangladesh

Bangladesh is another SAARC country connected with regional tourism movements. Growing outbound travel from Bangladesh has created opportunities for destinations across South Asia.

Advertisement (adsbygoogle = window.adsbygoogle || []).push({}); Advertisement

Bhutan

Bhutan shares Himalayan tourism characteristics with Nepal. Both destinations focus on mountain landscapes, cultural heritage and nature-based travel experiences.

Pakistan

Pakistan is another Himalayan and mountain tourism destination within the SAARC region. Its northern areas attract adventure travellers seeking landscapes, trekking and cultural experiences.

Afghanistan

Afghanistan is part of the SAARC region and represents another South Asian destination with historic and natural attractions, although tourism activity remains limited compared with other regional markets.

Myanmar

Although not a SAARC member, Myanmar is part of the wider Asian tourism environment connected through regional travel trends and international visitor movements.

Falling Visitor Arrivals Highlight the Need for Stronger Himalayan Tourism Strategies

The decline at Langtang National Park reflects broader challenges faced by mountain destinations. Himalayan tourism depends on multiple factors, including international travel demand, economic conditions, connectivity, seasonal patterns and traveller preferences.

Protected areas must balance tourism development with environmental protection. While visitor spending supports local communities, conservation authorities must also manage natural resources carefully to protect fragile ecosystems.

Advertisement (adsbygoogle = window.adsbygoogle || []).push({}); Advertisement

Increasing tourism promotion, improving accessibility and strengthening sustainable travel initiatives could help destinations such as Langtang attract more visitors in the future.

Potential growth opportunities include:

Promoting lesser-known trekking routes

Expanding international tourism campaigns

Improving visitor facilities

Strengthening regional connectivity

Encouraging sustainable adventure tourism

Langtang National Park Remains Vital for Nepal’s Future Himalayan Tourism Growth

Although Langtang National Park has experienced a decline in tourist arrivals and revenue during the current fiscal year, the destination continues to represent one of Nepal’s most valuable tourism assets.

The park’s natural beauty, cultural importance and adventure experiences continue to attract travellers from Nepal, South Asia and international markets. The current slowdown highlights the need for stronger tourism recovery strategies and sustainable destination management.

Sri Lanka stands with Maldives, India and regional tourism destinations as Nepal’s Langtang National Park faces a major Himalayan tourism setback, with falling tourist arrivals and reduced revenue creating pressure on conservation, local livelihoods and the mountain tourism economy.

As Sri Lanka, Maldives, India and other regional tourism destinations continue developing their travel sectors, Nepal’s Himalayan destinations remain central to South Asia’s tourism identity. Langtang National Park’s future growth will depend on rebuilding visitor confidence, strengthening tourism infrastructure and protecting the unique natural environment that makes the region globally significant.

Advertisement (adsbygoogle = window.adsbygoogle || []).push({});

Share On:

document.addEventListener(""DOMContentLoaded"", function(){ let visitorID = localStorage.getItem(""ttw_visitor_id""); if (!visitorID) { visitorID = ""ttw_"" + Math.random().toString(36).substr(2,9); localStorage.setItem(""ttw_visitor_id"", visitorID); } var watermark = document.createElement(""span""); watermark.style.opacity = ""0.01""; watermark.style.position = ""absolute""; watermark.style.left = ""-9999px""; watermark.innerHTML = ""Source: https://www.travelandtourworld.com/ | Page: "" + window.location.href + "" | VisitorID: "" + visitorID; document.body.appendChild(watermark); });

Tags: Himalayan mountain tourism, Langtang National Park tourism, nepal tourism, South Asia travel industry, sustainable adventure tourism

Advertisement (adsbygoogle = window.adsbygoogle || []).push({}); Advertisement

This content is protected under the Copyright Act. Unauthorized scraping, AI extraction, reproduction, or republication is strictly prohibited. Read our Copyright Policy.

Follow Travel And Tour World in Google News","{'https://www.travelandtourworld.com/wp-content/uploads/2026/07/European-Tourism-130x130.jpg', 'https://www.travelandtourworld.com/wp-content/uploads/2026/05/ITE_HCMC.jpg', 'https://www.travelandtourworld.com/wp-content/uploads/2026/07/visit-grand-canyon-logo1-130x130.jpg', 'https://www.travelandtourworld.com/wp-content/themes/TTW.v3.0/images/ttw_logo.png', 'https://www.travelandtourworld.com/wp-content/uploads/2026/07/july_ttw2026.jpg', 'https://www.travelandtourworld.com/wp-content/uploads/2026/05/ITCMA-CTWAPAC-Combined-2026_300x250.jpg', 'https://www.travelandtourworld.com/wp-content/uploads/2026/03/ATM26_Web-Banner.png', 'https://www.travelandtourworld.com/wp-content/uploads/2026/07/XGnX7O0uWHKcD4xregLX5g2k-130x130.jpg', 'https://www.travelandtourworld.com/wp-content/uploads/2026/01/COITM.jpg', 'https://www.travelandtourworld.com/wp-content/uploads/2026/07/indigo_lite_fare_collage_1200x675-130x130.jpg', 'https://www.travelandtourworld.com/wp-content/uploads/2026/07/ChatGPT-Image-Jul-7-2026-10_38_27-AM-130x130.jpg', 'https://www.travelandtourworld.com/wp-content/themes/TTW.v3.0/images/TTW-Logo.svg', 'https://www.travelandtourworld.com/wp-content/uploads/2026/07/waii-130x130.jpg', 'https://www.travelandtourworld.com/wp-content/uploads/2026/07/Nepals-Langtang-National-Park-Battles-a-Major-Visitor-Decline-Crisis-With-Falling-Tourist-Arrivals-4.jpg', 'https://www.travelandtourworld.com/wp-content/uploads/2026/07/rop-130x130.jpg', 'https://www.travelandtourworld.com/wp-content/uploads/2024/06/leaderboard-app-design24.jpg', 'https://www.travelandtourworld.com/wp-content/uploads/2026/05/ITF-1.jpg', 'https://www.travelandtourworld.com/wp-content/uploads/2026/07/Nepals-Langtang-National-Park-Battles-a-Major-Visitor-Decline-Crisis-With-Falling-Tourist-Arrivals-4-130x130.jpg', 'https://www.travelandtourworld.com/wp-content/uploads/2026/06/PTM-2026-KV-300-x-250-px.jpg'}","Home » TRAVEL ALERT » श्रीलंका मालदीव, भारत आरू क्षेत्रीय पर्यटन स्थल के साथ खड़ा छै, कैन्हेंकि नेपाल केरऽ लंगटांग राष्ट्रीय उद्यान न॑ पर्यटकऽ के आगमन म॑ गिरावट, राजस्व म॑ कमी आरू हिमालय केरऽ पर्वत पर्यटन अर्थव्यवस्था प॑ बढ़तऽ दबाव के साथ आगंतुकऽ के बड़ऽ गिरावट के संकट स॑ लड़ै छै

श्रीलंका मालदीव, भारत आरू क्षेत्रीय पर्यटन स्थल के साथ खड़ा छै, कैन्हेंकि नेपाल केरऽ लंगटांग राष्ट्रीय उद्यान पर्यटकऽ के आगमन म॑ गिरावट, राजस्व म॑ कमी आरू हिमालयी पर्वत पर्यटन अर्थव्यवस्था प॑ बढ़तऽ दबाव के साथ आगंतुकऽ के प्रमुख गिरावट के संकट स॑ लड़ै छै

7 जुलाई, 2026 को प्रकाशित

ऐ के साथ उत्पन्न छवि

श्रीलंका मालदीव, भारत आरू क्षेत्रीय पर्यटन स्थल के साथ खड़ा छै, कैन्हेंकि नेपाल केरऽ लंगटांग राष्ट्रीय उद्यान म॑ आगंतुकऽ के गिरावट के बड़ऽ संकट के सामना करना पड़॑ छै, जेकरा म॑ पर्यटकऽ के आगमन पिछला स्तर स॑ गिरी गेलऽ छै आरू पर्यटन राजस्व म॑ काफी गिरावट आबी गेलऽ छै । मंदी के कारण हिमालय केरऽ पहाड़ी पर्यटन अर्थव्यवस्था प॑ बढ़तऽ दबाव पैदा होय गेलऽ छै, कैन्हेंकि कम आगंतुक संरक्षण केरऽ फंडिंग, स्थानीय आजीविका आरू गंतव्य प्रबंधन केरऽ प्रयास प॑ प्रभाव डालै छै । ई गिरावट पूरा दक्षिण एशिया म॑ प्रकृति आधारित पर्यटन स्थलऽ के सामने आबै वाला व्यापक चुनौतियऽ प॑ प्रकाश डालै छै, जहां आर्थिक विकास लेली मजबूत आगंतुक प्रवाह, टिकाऊ पर्यटन प्रथा आरू क्षेत्रीय कनेक्टिविटी क॑ कायम रखना बहुत महत्वपूर्ण बनलऽ छै ।

नेपाल केरऽ लंगटांग राष्ट्रीय उद्यान प॑ पर्यटन केरऽ दबाव के सामना करना पड़॑ छै, कैन्हेंकि हिमालय केरऽ एगो प्रमुख गंतव्य के पार आगंतुकऽ के संख्या गिरी रहलऽ छै

श्रीलंका मालदीव, भारत आरू क्षेत्रीय पर्यटन स्थल के साथ खड़ा छै, कैन्हेंकि नेपाल केरऽ लंगटांग राष्ट्रीय उद्यान म॑ आगंतुकऽ के आगमन म॑ कमी आरू राजस्व पैदा करै म॑ कमी के कारण पर्यटन केरऽ एगो महत्वपूर्ण चुनौती के सामना करना पड़॑ छै । नेपाल केरऽ सबसें मान्यता प्राप्त रोमांच आरू प्रकृति पर्यटन स्थलऽ म॑ स॑ एक बनलऽ हिमालयन संरक्षित क्षेत्र म॑ चालू वित्तीय वर्ष म॑ पिछला अवधि के तुलना म॑ कम पर्यटक दर्ज करलऽ गेलऽ छै । गिरावट के कारण पर्यटन के आय, संरक्षण के फंडिंग आओर पहाड़ी यात्रा सं जुड़ल स्थानीय आर्थिक गतिविधि पर दबाव बनल अछि.

विज्ञापन (adsbygoogle = विंडो.adsbygoogle || []).पुश ({});

नेपाल केरऽ हिमालयी पर्यटन नेटवर्क के भीतर लंगटांग राष्ट्रिय उद्यान एगो महत्वपूर्ण गंतव्य छेकै । ई पहाड़ी परिदृश्य, जैव विविधता, पारंपरिक समुदाय आरू आध्यात्मिक आकर्षण के संयोजन के माध्यम स॑ ट्रेकर्स, प्रकृति प्रेमी, सांस्कृतिक यात्री आरू तीर्थयात्री क॑ आकर्षित करै छै । लेकिन हाल म॑ आगंतुकऽ के संख्या म॑ कमी ​​पर्यटन केरऽ बदलतऽ पैटर्न प॑ प्रकाश डालै छै जे गंतव्यऽ क॑ प्रभावित करै छै जे अंतरराष्ट्रीय आरू घरेलू यात्रा केरऽ प्रवाह प॑ बहुत निर्भर छै ।

एहि पार्क मे पिछला वित्तीय वर्ष मे करीब 56 हजार पर्यटक क स्वागत भेल छल। हालांकि चालू वित्तीय वर्ष मे आगंतुक क संख्या एखन धरि 50,360 पहुंच गेल अछि, जे पिछला अवधि क मुकाबले गिरावट देखा रहल अछि।

विज्ञापन विज्ञापन

नवीनतम आगंतुक आंकड़ा मे शामिल अछि:

39,011 घरेलू पर्यटक

सार्क देश स 788 आगंतुक

अन्य अंतरराष्ट्रीय बाजार स 10,561 पर्यटक

एहि गिरावट क असर केवल आगंतुक क मात्रा मे नहि, पर्यटन गतिविधि क माध्यम स उत्पन्न आर्थिक योगदान पर सेहो पड़ल अछि। पर्यटकऽ स॑ एकत्रित राजस्व म॑ पिछला वित्तीय वर्ष के तुलना म॑ कमी ​​आबी गेलऽ छै, जेकरा स॑ संरक्षण कार्यक्रम क॑ कायम रखै आरू संरक्षित क्षेत्र के आसपास के समुदायऽ क॑ सहायता दै लेली अतिरिक्त चुनौती पैदा होय गेलऽ छै ।

विज्ञापन (adsbygoogle = विंडो.adsbygoogle || []).पुश ({}); विज्ञापन

लैंगटांग राष्ट्रीय उद्यान पर्यटन में गिरावट संरक्षण आ स्थानीय समुदाय के लेल राजस्व के चुनौती पैदा करैत अछि |

लंगटांग नेशनल पार्क के प्रबंधन में पर्यटन राजस्व के अहम भूमिका छै. आगंतुक गतिविधियक कें माध्यम सं उत्पन्न धनराशि अनेक क्षेत्रक कें समर्थन करएयत छै, जइ मे वन्यजीव संरक्षण, जैव विविधता संरक्षण, पारिस्थितिकी तंत्र प्रबंधन आ समुदाय आधारित पहल शामिल छै.

पिछला वित्तीय वर्ष क दौरान पर्यटन स संबंधित राजस्व लगभग 5.77 करोड़ टका तक पहुंच गेल। चालू वित्तीय वर्ष मे एखन धरि संग्रह घटि कए करीब 4.28 करोड़ टका भ गेल अछि।

विज्ञापन (adsbygoogle = विंडो.adsbygoogle || []).पुश ({}); विज्ञापन

राजस्व म॑ गिरावट पर्यटकऽ के आगमन आरू संरक्षित गंतव्यऽ के वित्तीय स्थायित्व के बीच सीधा संबंध क॑ दर्शाबै छै । कम आगंतुकक कें मतलब छै संरक्षण संचालन कें लेल आय मे कमी आ पर्यटन पर निर्भर व्यवसाय आ समुदायक कें लेल आर्थिक अवसर कम.

लंगटांग क्षेत्र क॑ परंपरागत रूप स॑ ट्रेकिंग पर्यटन स॑ फायदा मिललऽ छै । स्थानीय आवास प्रदाता, गाइड, परिवहन संचालक, छोट व्यवसाय आ समुदाय हिमालयी परिदृश्य कें खोज करय वाला यात्रीक कें आसपास आर्थिक गतिविधियक कें विकास करलक छै.

आगमन म॑ लगातार गिरावट क्षेत्र केरऽ व्यापक पर्यटन अर्थव्यवस्था क॑ प्रभावित करी सकै छै, खास करी क॑ ट्रेकिंग मार्ग आरू सांस्कृतिक आकर्षण के पास स्थित समुदाय लेली ।

नेपाल के लंगटांग क्षेत्र वर्तमान चुनौती के बावजूद वैश्विक साहसिक पर्यटन स्थल बनल अछि |

पर्यटक संख्या मे कमी के बावजूद नेपाल के पर्यटन क्षेत्र के भीतर लंगटांग राष्ट्रीय उद्यान के मजबूत महत्व जारी अछि. नेपाल केरऽ पहिलऽ हिमालयन राष्ट्रीय उद्यान के रूप म॑ स्थापित ई संरक्षित क्षेत्र म॑ जंगल, पहाड़ी पारिस्थितिकी तंत्र, ग्लेशियर आरू दुर्लभ वन्यजीव प्रजाति केरऽ विविधता वाला परिदृश्य छै ।

विज्ञापन (adsbygoogle = विंडो.adsbygoogle || []).पुश ({}); विज्ञापन

गंतव्य आगंतुक के आकर्षित करैत अछि जे:

हिमालयन ट्रेकिंग के अनुभव

पहाड़क दृश्य आ फोटोग्राफीक अवसर

वन्यजीव अन्वेषण

स्थानीय समुदाय के साथ सांस्कृतिक बातचीत

धार्मिक पर्यटन के अनुभव

व्यापक लंगटांग क्षेत्र के भीतर एक प्रमुख आकर्षण गोसाईकुंडा छै, जे एक प्रसिद्ध उच्च ऊंचाई वाला झील क्षेत्र छै जेकरऽ धार्मिक महत्व गहरा छै । ई गंतव्य घरेलू तीर्थयात्री आरू अंतर्राष्ट्रीय यात्री दोनों क॑ आकर्षित करै छै जे आध्यात्मिक अनुभव, ट्रेकिंग रोमांच आरू प्राकृतिक सौंदर्य लेली आबै छै ।

साहसिक पर्यटन आरू सांस्कृतिक पर्यटन के संयोजन न॑ नेपाल केरऽ पहाड़ी पर्यटन अर्थव्यवस्था म॑ लंगटांग क॑ एगो महत्वपूर्ण योगदान देल॑ छै ।

श्रीलंका, मालदीव आरू भारत स॑ क्षेत्रीय पर्यटन कनेक्शन दक्षिण एशियाई यात्रा नेटवर्क प॑ प्रकाश डालै छै

हेडलाइन नेपाल केरऽ पर्यटन केरऽ स्थिति क॑ श्रीलंका, मालदीव आरू भारत सहित व्यापक क्षेत्रीय गंतव्यऽ स॑ जोड़ै छै, कैन्हेंकि दक्षिण एशिया केरऽ पर्यटन बाजार क्षेत्रीय यात्रा केरऽ मांग, हवाई संपर्क आरू आगंतुकऽ के आवाजाही के माध्यम स॑ तेजी स॑ एक दोसरा स॑ जुड़लऽ छै ।

क्षेत्रीय पर्यटन परिदृश्य स॑ जुड़लऽ देशऽ म॑ शामिल छै : १.

श्रीलंका

श्रीलंका दक्षिण एशिया केरऽ महत्वपूर्ण पर्यटन स्थलऽ म॑ स॑ एक बनलऽ छै, जे समुद्र तट, धरोहर स्थल, वन्यजीवऽ के अनुभव आरू सांस्कृतिक आकर्षण लेली जानलऽ जाय छै । देश केरऽ पर्यटन अर्थव्यवस्था अंतरराष्ट्रीय आगमन आरू क्षेत्रीय संपर्क प॑ काफी निर्भर छै ।

विज्ञापन (adsbygoogle = विंडो.adsbygoogle || []).पुश ({}); विज्ञापन

श्रीलंका केरऽ पर्यटन विकास क॑ पड़ोसी देशऽ सहित एशियाई बाजारऽ के मांग स॑ समर्थन मिललऽ छै । नेपाल के तरह श्रीलंका स्थानीय व्यवसाय, रोजगार आ गंतव्य विकास के सहयोग के लेल मजबूत आगंतुक प्रवाह पर निर्भर अछि.

मालदीव

मालदीव दुनिया केरऽ सबसें मान्यता प्राप्त द्वीप पर्यटन स्थलऽ म॑ स॑ एक के प्रतिनिधित्व करै छै । एकरऽ अर्थव्यवस्था अंतरराष्ट्रीय पर्यटन स॑ गहराई स॑ जुड़लऽ छै, खास करी क॑ लग्जरी रिसॉर्ट, समुद्री अनुभव आरू अवकाश यात्रा के माध्यम स॑ ।

ई गंतव्य आगंतुकऽ के विश्वास, अंतरराष्ट्रीय संपर्क आरू टिकाऊ पर्यटन प्रबंधन क॑ कायम रखै के महत्व प॑ प्रकाश डालै छै ।

भारत

भारत दक्षिण एशिया केरऽ सबस॑ बड़ऽ पर्यटन बाजारऽ म॑ स॑ एक बनलऽ छै आरू क्षेत्रीय यात्रा आंदोलन म॑ एकरऽ महत्वपूर्ण भूमिका छै । भारतीय यात्री नेपाल सहित पड़ोसी गंतव्य सब में पर्यटन के मांग में योगदान दैत छैथ।

भौगोलिक निकटता, सांस्कृतिक संपर्क आरू यात्रा केरऽ आसान पहुँच के कारण भारत नेपाल केरऽ पर्यटन क्षेत्र लेली एगो महत्वपूर्ण स्रोत बाजार छै ।

बंगलादेश

बांग्लादेश क्षेत्रीय पर्यटन आंदोलन स॑ जुड़लऽ एगो आरू सार्क देश छेकै । बांग्लादेश स॑ बढ़त॑ जाय रहलऽ आउटबाउंड यात्रा स॑ पूरा दक्षिण एशिया केरऽ गंतव्यऽ लेली अवसर पैदा होय गेलऽ छै ।

विज्ञापन (adsbygoogle = विंडो.adsbygoogle || []).पुश ({}); विज्ञापन

भूटान

भूटान नेपालक संग हिमालयी पर्यटनक विशेषता साझा करैत अछि । दुनू गंतव्य पहाड़ी परिदृश्य, सांस्कृतिक धरोहर आ प्रकृति आधारित यात्रा अनुभव पर केंद्रित अछि ।

पाकिस्तान

पाकिस्तान सार्क क्षेत्र के भीतर हिमालयी आरू पहाड़ी पर्यटन के एगो आरू स्थल छेकै । एकरऽ उत्तरी क्षेत्र परिदृश्य, ट्रेकिंग आरू सांस्कृतिक अनुभव के तलाश करै वाला रोमांचकारी यात्री सिनी क॑ आकर्षित करै छै ।

अफगानिस्तान

अफगानिस्तान सार्क क्षेत्र के हिस्सा छै आरू ऐतिहासिक आरू प्राकृतिक आकर्षण के साथ दक्षिण एशियाई एगो आरू गंतव्य के प्रतिनिधित्व करै छै, हालांकि अन्य क्षेत्रीय बाजारऽ के तुलना म॑ पर्यटन गतिविधि सीमित छै ।

म्यांमार

हालांकि सार्क के सदस्य नै छै, लेकिन म्यांमार क्षेत्रीय यात्रा प्रवृत्ति आरू अंतर्राष्ट्रीय आगंतुकऽ के आवाजाही के माध्यम स॑ जुड़लऽ व्यापक एशियाई पर्यटन वातावरण के हिस्सा छै ।

गिरैत आगंतुकक आगमन हिमालयी पर्यटन रणनीतिक मजबूत आवश्यकता पर प्रकाश दैत अछि

लैंगटांग नेशनल पार्क म॑ ई गिरावट पहाड़ी गंतव्यऽ के सामने आबै वाला व्यापक चुनौती के दर्शाबै छै । हिमालयी पर्यटन अनेक कारक पर निर्भर करै छै, जेकरा म॑ अंतरराष्ट्रीय यात्रा केरऽ मांग, आर्थिक स्थिति, कनेक्टिविटी, मौसमी पैटर्न आरू यात्री पसंद शामिल छै ।

संरक्षित क्षेत्रक कें पर्यटन विकास आ पर्यावरण संरक्षण कें बीच संतुलन बनानाय आवश्यक छै. जखन कि आगंतुकक कें खर्च स्थानीय समुदायक कें सहायता करएयत छै, संरक्षण प्राधिकारीक कें नाजुक पारिस्थितिकी तंत्र कें सुरक्षा कें लेल प्राकृतिक संसाधनक कें सावधानी सं प्रबंधन सेहो करनाय आवश्यक छै.

विज्ञापन (adsbygoogle = विंडो.adsbygoogle || []).पुश ({}); विज्ञापन

पर्यटन प्रचार बढ़ाबै, सुलभता मँ सुधार आरू टिकाऊ यात्रा पहल क मजबूत करला स॑ भविष्य मँ लैंगटांग जैसनऽ गंतव्य क॑ अधिक आगंतुकऽ क॑ आकर्षित करै म॑ मदद मिल॑ सकै छै ।

संभावित विकास कें अवसरक मे शामिल छै:

कम ज्ञात ट्रेकिंग मार्ग के बढ़ावा देब

अंतर्राष्ट्रीय पर्यटन अभियान के विस्तार

आगंतुक सुविधा मे सुधार

क्षेत्रीय संपर्क के मजबूत करब

टिकाऊ साहसिक पर्यटन के प्रोत्साहित करब

नेपाल के भविष्य के हिमालयन पर्यटन विकास के लेल लंगटांग राष्ट्रीय उद्यान महत्वपूर्ण बनल अछि |

हालांकि चालू वित्तीय वर्ष के दौरान लंगटांग राष्ट्रीय उद्यान में पर्यटक के आगमन आ राजस्व में गिरावट आयल अछि, मुदा ई गंतव्य नेपाल के सबस मूल्यवान पर्यटन संपत्ति में सं एक के प्रतिनिधित्व जारी अछि.

पार्क केरऽ प्राकृतिक सौंदर्य, सांस्कृतिक महत्व आरू रोमांच के अनुभव नेपाल, दक्षिण एशिया आरू अंतर्राष्ट्रीय बाजारऽ स॑ यात्री क॑ आकर्षित करी रहलऽ छै । वर्तमान मंदी पर्यटन वसूली केरऽ मजबूत रणनीति आरू टिकाऊ गंतव्य प्रबंधन के जरूरत प॑ प्रकाश डालै छै ।

श्रीलंका मालदीव, भारत आरू क्षेत्रीय पर्यटन स्थल के साथ खड़ा छै, कैन्हेंकि नेपाल केरऽ लंगतांग राष्ट्रीय उद्यान म॑ हिमालयी पर्यटन केरऽ एगो बड़ऽ झटका लगै छै, जेकरा म॑ पर्यटकऽ के आगमन म॑ गिरावट आरू राजस्व म॑ कमी ​​के वजह स॑ संरक्षण, स्थानीय आजीविका आरू पहाड़ी पर्यटन अर्थव्यवस्था प॑ दबाव पैदा होय रहलऽ छै ।

जेना-जेना श्रीलंका, मालदीव, भारत आरू अन्य क्षेत्रीय पर्यटन स्थल अपनऽ यात्रा क्षेत्र के विकास जारी रखै छै, नेपाल केरऽ हिमालयी गंतव्य दक्षिण एशिया केरऽ पर्यटन पहचान के केंद्र म॑ बनलऽ छै । लैंगटांग नेशनल पार्क केरऽ भविष्य केरऽ विकास आगंतुकऽ के आत्मविश्वास के पुनर्निर्माण, पर्यटन बुनियादी ढाँचा क॑ मजबूत करै आरू अद्वितीय प्राकृतिक वातावरण के सुरक्षा प॑ निर्भर करतै जे ई क्षेत्र क॑ वैश्विक स्तर प॑ महत्वपूर्ण बनाबै छै ।

विज्ञापन (adsbygoogle = विंडो.adsbygoogle || []).पुश ({});

शेयर पर:

document.addEventListener (""DOMContentLoaded"", function (){ let visitorID = localStorage.getItem (""ttw_visitor_id""); if (! visitorID) { visitorID = ""ttw_"" + Math.random ().toString (36). substr (2,9); localStorage.setItem (""ttw_visitor_id"", आगंतुक आईडी); } var watermark = document.createElement (""span""); वॉटरमार्क.शैली.पोजीशन = ""निरपेक्ष""; दस्तावेज़.शरीर.appendChild (जलचिह्न });

Tags: हिमालयन पर्वत पर्यटन, लंगटांग राष्ट्रिय उद्यान पर्यटन, नेपाल पर्यटन, दक्षिण एशिया यात्रा उद्योग, टिकाऊ साहसिक पर्यटन

विज्ञापन (adsbygoogle = विंडो.adsbygoogle || []).पुश ({}); विज्ञापन

ई सामग्री कॉपीराइट अधिनियम कें तहत सुरक्षित छै. अनधिकृत खुरचना, एआई निष्कर्षण, प्रजनन, या पुनर्प्रकाशन पर सख्ती सं रोक छै. हमर कॉपीराइट नीति पढ़ू।

गूगल न्यूज में ट्रैवल एंड टूर वर्ल्ड के फॉलो करू"
