title,description,published date,url,publisher.href,publisher.title,full_article,images,translated
Nepal doctor’s licence suspended after abortion-related death - The Kathmandu Post,Nepal doctor’s licence suspended after abortion-related death  The Kathmandu Post,2026-04-27 01:07:20,https://news.google.com/rss/articles/CBMiqAFBVV95cUxOVVF5eEhENkk0TmhfRWtiakxkN21YamJURTNqU0dHQTFVeXFVRHl6eHpHeXhnVFlvYmtYNWc1TGd3X21hdVZ3ZWI4X3l3em1xMTJnMnZqOWhwN1NjY1Ztbzh1bHJfLVo1RDVQUngtTVpIZ1pTNGdhakc0d25QTDJHSEgwR1JURGQ5c0l2ZVpEWnlUckdleG5YUjhORTg4OGNYQ0ZGLW1acU8?oc=5&hl=en-US&gl=US&ceid=US:en,https://kathmandupost.com,The Kathmandu Post,"Nepal Medical Council, which formed a six-member team to investigate the death of a woman earlier this month following an abortion, suspended the licence of Dr Satish Rupakheti, who carried out the procedure. The council also recommended sealing of the clinic and pharmacy with immediate effect.

A member of the team dispatched to Butwal for the investigation said that abortion was not carried out in accordance with standard treatment protocols. The clinic, where the abortion was carried out, and the pharmacy that sold medicines were not registered, and treatment records were not maintained properly.

“The clinic, which has been running illegally, poses a serious threat to the safety of other patients as well,” said council registrar Dr Satis Kumar Deo, who is also a member of the probe team and was on his way to Kathmandu from Bhairahawa. “So we have suspended the doctor’s licence and recommended sealing of the clinic.”

A virtual meeting of the Council’s office bearers and officials was held on Saturday following the preliminary probe report. The meeting decided to suspend the doctor’s licence and take action against two health facilities—Zonal Pharmacy and Indulekha Health Clinic.

A 29-year-old woman from ward 2 of Bagnaskali Rural Municipality in Palpa died on April 19 while undergoing an abortion procedure at around 14 weeks of pregnancy. Her family, however, has claimed that the pregnancy was 12 weeks.

The probe report indicates that the gestation period exceeded 13 weeks.

The investigation found that Zonal Pharmacy had supplied abortion medication, and that Indulekha Health Clinic was involved in the procedure despite not having official approval to provide such services.

According to Deo, the probe team has also recommended actions against health workers involved in the case. He said that the decision to suspend the doctor's licence was in line with the Medical Code of Ethics 2017 and will remain in place until the final report is prepared.

The Butwal case has once again renewed concerns among doctors and public health experts to the unsafe use of medical abortion kits and gaps in abortion services in Nepal, despite the procedure being legal for over two decades.

Doctors say hundreds of women across the country suffer from serious side effects, or even die, after using medical abortion kits or seeking abortion services at under-equipped health facilities. Even so-called “safe abortion” is never completely risk-free and abortions carried out by use of over-the-counter medicines are unsafe, which must be stopped immediately, according to doctors.

Abortion was legalised in Nepal in 2002, a milestone for women’s reproductive rights, their empowerment, and their right to bodily autonomy. With legalisation, persecution and jail terms for women who terminated unwanted pregnancies ended and unsafe abortions fell markedly.

According to the latest census report six percent of maternal deaths are linked to abortion or miscarriage.

Every year, around 100,000 women undergo abortions at legally-authorised clinics and health facilities in Nepal. Gynaecologists, however, say the actual number could be much higher, as many abortions, especially the medical abortions, go unreported.

According to a recent UNFPA report on the “neglected crisis of unintended pregnancy”, half of the 1.2 million pregnancies in Nepal in 2017 were unintended and nearly 359,000 were terminated.

The report further stated that “the toll of these pregnancies is—and has long been—unseen”.

Doctors suspect that ‘medical abortion kits’—designed to terminate pregnancy within nine weeks—are being misused as a contraception tool.

Between 1996 and 2016, the maternal mortality rate in Nepal fell from 539 to 239 per 100,000 births, with the country achieving the Millennium Development Goal—a feat for which the legalisation of abortions played a significant role, doctors say.

Nepal has reduced maternal deaths by over 70 percent since 2000, according to a WHO report.

The UN health body’s report says that 142 Nepali women currently die from maternity-related complications per 100,000 live births.

Under the UN’s Sustainable Development Goals, the target is to reduce the maternal mortality rate to 75 per 100,000 live births by 2030.

Doctors say it will be difficult to further reduce maternal deaths unless deaths caused by abortion and unsafe abortion are prevented.

Section 4 (15) of the Safe Motherhood and Reproductive Health Rights Act allows abortions as late as 28 weeks in cases of rape, incest, serious health risks to the mother or if the fetus is found to have genetic defects. General abortions can be conducted at up to 12 weeks, according to the Act.","{'https://jcss-cdn.kathmandupost.com/assets/images/logo-sticky-bar-tkp-weekender-1.png', 'https://jcss-cdn.kathmandupost.com/assets/images/lazy.png', 'https://assets-cdn.kathmandupost.com/uploads/source/news/2026/third-party/thumb3-1777252011.jpg', 'https://openweathermap.org/img/w/50d.png', 'https://jcss-cdn.kathmandupost.com/assets/images/logos/thekathmandupost-logo.png', 'https://jcss-cdn.kathmandupost.com/assets/images/tkp-logo-weekender.png', 'https://jcss-cdn.kathmandupost.com/assets/images/logos/thekathmandupost-logo-white.png'}","गर्भपात के बाद एहि मासक शुरुआत मे एकटा महिला के मौत के जांच के लेल छह सदस्यीय टीम बनाबय वाला नेपाल मेडिकल काउंसिल एहि प्रक्रिया के अंजाम देबय वाला डॉ. सतीश रूपखेती के लाइसेंस निलंबित क देलक अछि. परिषद तत्काल प्रभाव स क्लिनिक आ फार्मेसी कए सील करबाक सिफारिश सेहो केलक अछि।

जांच के लेल बुटवल भेजल गेल टीम के एकटा सदस्य के कहनाय छनि जे मानक उपचार प्रोटोकॉल के अनुसार गर्भपात नहि भेल अछि. क्लिनिक, जतय गर्भपात भेल छल, आ दवाई बेचय बला दवाई दोकान के पंजीकृत नहिं छल, आ इलाज के रिकॉर्ड ठीक सं नहिं राखल गेल छल.

भैरहवा सँ काठमांडू जा रहल परिषद् के रजिस्ट्रार डा. सतीस कुमार देव कहलनि जे, अवैध तरीका सँ चलि रहल क्लिनिक अन्य मरीज के सुरक्षा के लेल सेहो गंभीर खतरा अछि। “त’ हम डाक्टर’क लाइसेंस निलंबित क’ क’ क्लिनिक केँ सील करबाक सिफारिश केने छी.”

प्रारंभिक जांच रिपोर्ट के बाद शनिदिन परिषद के पदाधिकारी आओर अधिकारी के वर्चुअल मीटिंग भेल. बैसार मे डॉक्टर के लाइसेंस निलंबित क’ दू टा स्वास्थ्य सुविधा-जोनल फार्मेसी आ इंदुलेखा हेल्थ क्लिनिक पर कार्रवाई करबाक निर्णय लेल गेल.

पाल्पा के बगनास्कली ग्रामीण नगरपालिका के वार्ड 2 के 29 वर्षीय महिला के गर्भावस्था के करीब 14 सप्ताह में गर्भपात प्रक्रिया के दौरान 19 अप्रैल के मौत भ गेल छल। मुदा हुनकर परिवार के दावा अछि जे गर्भ 12 सप्ताह के छल।

जांच रिपोर्ट संकेत करएयत छै कि गर्भधारण कें अवधि 13 सप्ताह सं बेसि भ गेल छै.

जांच म॑ पता चललै कि जोनल फार्मेसी न॑ गर्भपात केरऽ दवाई के आपूर्ति करलकै, आरू इंदुलेखा हेल्थ क्लिनिक न॑ ऐसनऽ सेवा दै लेली आधिकारिक मंजूरी नै मिलला के बावजूद ई प्रक्रिया म॑ शामिल छेलै ।

देव के अनुसार जांच टीम एहि मामला मे शामिल स्वास्थ्यकर्मी के खिलाफ कार्रवाई के सिफारिश सेहो केने अछि. ओ कहलनि जे, डॉक्टर के लाइसेंस निलंबित करबाक फैसला मेडिकल कोड ऑफ एथिक्स 2017 के अनुरूप अछि आ अंतिम रिपोर्ट तैयार हेबा तक कायम रहत।

बुटवाल मामला मे एक बेर फेर चिकित्सक आ जनस्वास्थ्य विशेषज्ञक बीच मेडिकल गर्भपात किट के असुरक्षित उपयोग आ नेपाल मे गर्भपात सेवा मे अंतराल के चिंता नव भ गेल अछि, बावजूद ई प्रक्रिया दू दशक सं बेसी सं कानूनी रहल अछि.

डॉक्टरऽ के कहना छै कि देश भर म॑ सैकड़ों महिला मेडिकल गर्भपात किट के इस्तेमाल या कम सुसज्जित स्वास्थ्य सुविधा म॑ गर्भपात सेवा के मांग करला के बाद गंभीर दुष्प्रभाव स॑ पीड़ित छै, या मौत भी होय जाय छै । तथाकथित “सुरक्षित गर्भपात” भी कहियो पूर्ण रूप स॑ जोखिम मुक्त नै होय छै आरू ओवर-द-काउंटर दवाई के प्रयोग स॑ करलऽ जाय वाला गर्भपात असुरक्षित होय छै, जेकरा तुरंत बंद करना जरूरी छै, डॉक्टरऽ के अनुसार ।

नेपाल मे गर्भपात के वैध बना देल गेल छल जे महिला के प्रजनन अधिकार, हुनकर सशक्तिकरण, आ हुनकर शारीरिक स्वायत्तता के अधिकार के लेल एकटा मील के पत्थर छल. वैधीकरण के साथ अवांछित गर्भ समाप्त करय वाला महिला सब के उत्पीड़न आ जेल के सजा समाप्त भ गेल आ असुरक्षित गर्भपात में काफी गिरावट आयल।

ताजा जनगणना रिपोर्ट के अनुसार मातृ मृत्यु के छह प्रतिशत गर्भपात या गर्भपात सं जुड़ल अछि.

नेपाल मे हर साल लगभग एक लाख महिला कानूनी रूप स अधिकृत क्लिनिक आ स्वास्थ्य सुविधा मे गर्भपात कराबैत छथि। लेकिन स्त्री रोग विशेषज्ञऽ के कहना छै कि वास्तविक संख्या बहुत अधिक होय सकै छै, कैन्हेंकि बहुत सारा गर्भपात, खास करी क॑ मेडिकल गर्भपात केरऽ रिपोर्ट नै होय जाय छै ।

“अनचाहा गर्भधारण केरऽ उपेक्षित संकट” प॑ यूएनएफपीए केरऽ हाल केरऽ रिपोर्ट के अनुसार २०१७ म॑ नेपाल म॑ १२ लाख गर्भधारणऽ म॑ स॑ आधा अनचाहा छेलै आरू लगभग ३५९,००० गर्भ समाप्त होय गेलऽ छेलै ।

रिपोर्ट म॑ आगू कहलऽ गेलऽ छै कि “ई गर्भ केरऽ टोल छै-आरू बहुत दिन स॑ ही-अनदेखलऽ गेलऽ छै” ।

डॉक्टरक कें शक छै कि ‘मेडिकल एबॉर्शन किट’-जे नौ सप्ताह कें भीतर गर्भ समाप्त करय कें लेल डिजाइन कैल गेल छै-गर्भनिरोधक उपकरण कें रूप मे गलत उपयोग कैल जा रहल छै.

डॉक्टरऽ के कहना छै कि १९९६ आरू २०१६ के बीच नेपाल म॑ मातृ मृत्यु दर ५३९ स॑ घटी क॑ २३९ होय गेलै, जेकरा म॑ देश न॑ सहस्राब्दी विकास लक्ष्य हासिल करलकै-एक ऐसनऽ कारनामा जेकरा लेली गर्भपात क॑ वैध बनाबै के अहम भूमिका छेलै, डॉक्टरऽ के कहना छै ।

नेपाल मे २००० सँ मातृ मृत्यु मे ७० प्रतिशत सँ बेसी कमी आयल अछि, डब्ल्यूएचओके रिपोर्ट अनुसार ।

संयुक्त राष्ट्र स्वास्थ्य निकाय केरऽ रिपोर्ट म॑ कहलऽ गेलऽ छै कि वर्तमान म॑ प्रति एक लाख जीवित जन्म म॑ १४२ नेपाली महिला केरऽ मौत प्रसूति संबंधी जटिलता स॑ होय छै ।

संयुक्त राष्ट्र कें सतत विकास लक्ष्य कें तहत 2030 तइक मातृ मृत्यु दर कें घटा क 75 प्रति 100,000 जीवित जन्मक कें लक्ष्य छै.

डॉक्टर के कहनाय छनि जे जा धरि गर्भपात आओर असुरक्षित गर्भपात सं होए वाला मौत के रोकल नहि जाएत ता धरि मातृ मृत्यु के आओर कम करब मुश्किल होएत.

सुरक्षित मातृत्व आ प्रजनन स्वास्थ्य अधिकार अधिनियम कें धारा 4 (15) बलात्कार, अनाचार, मां कें लेल गंभीर स्वास्थ्य जोखिम या यदि भ्रूण मे आनुवंशिक दोष पाएल गेल छै त 28 सप्ताह तइक गर्भपात कें अनुमति देयत छै. अधिनियम कें अनुसार 12 सप्ताह तइक सामान्य गर्भपात कैल जा सकएय छै."
This common plant could clean microplastics from your drinking water: Study - Nepalnews.com,This common plant could clean microplastics from your drinking water: Study  Nepalnews.com,2026-04-27 01:07:46,https://news.google.com/rss/articles/CBMitAFBVV95cUxPN1JpQlZBMmhYYTNoYkFCbWRuLV9nR2ZZYW42WTNXSkNzRFgyZlJyVHd5RUpVMC0wbmJSLWF1M1Z3T1c4TE81aTUxanVkZ05weXVzSXVLMFZVem9FV09jVVZCdGtkbUd5THF1dnZyZGFVTGMtc0xkM3hPMGZXNS1wQm03cjhDMWs2UkpaaWEtQkJxeExyMmxWckowMWxaNVE4Tm5xM1NHa0lYdjBzZDN0VmlKNGk?oc=5&hl=en-US&gl=US&ceid=US:en,https://english.nepalnews.com,Nepalnews.com,,,
