title,description,published date,url,publisher.href,publisher.title,full_article,images,translated
Fake documents used to secure student visas for ten foreigners in Nepal - The Kathmandu Post,Fake documents used to secure student visas for ten foreigners in Nepal  The Kathmandu Post,2026-06-11 13:02:29,https://news.google.com/rss/articles/CBMiuAFBVV95cUxORzJISEx2dkdFV3huU0RWTVh0NUVlOXJvVENYaXh3TFFXNWltRlpYVExHRjZiU1VVWDNDM2RqSzRwVkVUb0ktNXQ4ajIzNlpFWWxKMk5JVHNPM1lLMDFiQzVZa3F0QUZVU3hFRFJhN1FxZDZWVW1xWmN2LXBPZ0hQQW91V0lJcDc2OU1SRjB0Y3ZwdUJmcUZUZG9LdEtHVnQ2bkJUOE51dHZPbncxSWduSjE4SEJUVHB4?oc=5&hl=en-US&gl=US&ceid=US:en,https://kathmandupost.com,The Kathmandu Post,"As many as ten foreign nationals who entered Nepal on tourist visas were later granted student visas using forged documents purportedly issued by a Sanskrit studies institution in Kathmandu, exposing apparent weaknesses in the government’s visa verification process.

The fraud came to light only after Nepal’s Department of Immigration launched an investigation into the activities of the visa holders, which officials described as suspicious. The inquiry found that the Ministry of Education and Sports had recommended student visas for eight Chinese nationals, one Russian and one South Korean based on forged recommendation letters bearing the letterhead of Balmiki Campus, an academic institution located in Kathmandu’s Exhibition Road area.

Ram Chandra Tiwari, director general of the Department of Immigration, acknowledged that the department had issued one-year student visas after receiving a recommendation from the ministry. He said subsequent checks revealed that none of the individuals had arrived at the institution for study purposes.

“A group involved in document forgery prepared fake papers and sent a recommendation to the ministry in the name of the institution, seeking student visas for ten foreigners,” Tiwari said. “We approved the visas based on the ministry’s request. We conducted the investigation to discover that the letter purportedly issued by the institution was forged. Further investigations are underway, and those involved will be brought to justice.”

According to documents obtained during the investigation, a letter dated May 20 was sent to the ministry’s Volunteer Mobilisation and Visa Recommendation Section under the name Balmiki Campus. The letter, purportedly signed on behalf of principal Achyut Prasad Lamichhane, requested one-year academic study visas for ten foreign students.

The letter claimed that the students had passed an entrance examination conducted by the Department of Sanskrit Literature at Nepal Sanskrit University and had been formally enrolled in the first year of a two-year master’s programme in Sanskrit Literature beginning in March 2026.

Supporting documents submitted to the ministry also claimed that each student had paid tuition fees of Rs70,840. A separate receipt indicated that a total of Rs708,400 had been deposited on May 15.

Based on these documents, ministry officer Bishnu Prasad Acharya prepared a recommendation on June 3, concluding that the applicants were eligible for student visas.

Nepal’s Immigration Regulations allow foreign nationals and their family members to obtain student visas if they have government approval to study, teach or conduct research at recognised educational institutions in the country.

Citing those provisions, Under Secretary at the Education Ministry Lok Bahadur Lopchan forwarded the proposal to Joint Secretary Rudra Prasad Adhikari on June 4. The same day, Adhikari approved a recommendation to the Department of Immigration for the issuance of one-year student visas. The visas were subsequently granted.

The scheme unravelled after immigration officials grew suspicious and sought additional information from Balmiki Campus on Wednesday regarding the foreign nationals who had received visas.

In response, acting principal and professor Umesh Prasad Ghimire informed the department that none of the individuals were studying at the institution. He also said that the campus had never issued the recommendation letter and was not running any master’s-level classes for foreign students at the time. None of the visa recipients had ever been enrolled there.

That response prompted immigration authorities to intensify their investigation.

Officials have since arrested Subodh Shukla, accused of preparing and submitting the forged documents to the ministry, and a Chinese national, Wang Jinkao, who allegedly obtained a student visa using the fake paperwork.

Shukla is a resident of ward 9 in Birgunj Metropolitan City, Parsa district.

The Department of Immigration said the remaining nine foreign nationals are currently being traced.

Immigration Director Teeka Ram Dhakal said visas for nine of the individuals had already been issued and collected several days earlier. One Chinese applicant, however, had not yet received the visa because officials had retained the passport after becoming suspicious.

“We called the individual to the office on Thursday under the pretext that the visa had been approved and was ready for collection,” Dhakal said. “The person was then taken into custody from within the department’s premises.”

According to Dhakal, Shukla was first summoned by telephone and later arrived at the immigration office accompanied by the Chinese national.

During preliminary questioning, Shukla reportedly admitted creating the forged documents on his own computer and using them to secure recommendations for student visas. Authorities are continuing their investigation into the wider network involved in the scheme.","{'https://openweathermap.org/img/w/03n.png', 'https://jcss-cdn.kathmandupost.com/assets/images/tkp-logo-weekender.png', 'https://jcss-cdn.kathmandupost.com/assets/images/lazy.png', 'https://jcss-cdn.kathmandupost.com/assets/images/logos/thekathmandupost-logo-white.png', 'https://jcss-cdn.kathmandupost.com/assets/images/logos/thekathmandupost-logo.png', 'https://jcss-cdn.kathmandupost.com/assets/images/logo-sticky-bar-tkp-weekender-1.png', 'https://assets-cdn.kathmandupost.com/uploads/source/news/2026/third-party/thumb-1781182720.png'}","बाद म॑ पर्यटन वीजा स॑ नेपाल म॑ प्रवेश करलऽ दस विदेशी नागरिक क॑ काठमांडू केरऽ एगो संस्कृत अध्ययन संस्थान द्वारा कथित तौर प॑ जारी करलऽ गेलऽ जाली दस्तावेज के इस्तेमाल करी क॑ छात्र वीजा देलऽ गेलै, जेकरा स॑ सरकार केरऽ वीजा सत्यापन प्रक्रिया म॑ स्पष्ट कमजोरी के खुलासा होय गेलै ।

नेपाल केरऽ आप्रवासन विभाग न॑ वीजा धारकऽ के गतिविधि के जांच शुरू करला के बाद ही धोखाधड़ी सामने ऐलै, जेकरा अधिकारी न॑ संदिग्ध बतैलकै । जांच म॑ पता चललै कि शिक्षा आरू खेल मंत्रालय न॑ काठमांडू केरऽ एक्जीबिशन रोड क्षेत्र म॑ स्थित शैक्षणिक संस्थान बाल्मीकी कैंपस केरऽ लेटरहेड वाला जाली सिफारिश पत्र के आधार प॑ चीन केरऽ आठ नागरिक, एक रूसी आरू एक दक्षिण कोरियाई लेली छात्र वीजा के सिफारिश करलकै ।

आप्रवासन विभागक महानिदेशक रामचन्द्र तिवारी मन्त्रालयसँ अनुशंसा भेटलाक बाद विभाग एक वर्षक छात्र वीजा जारी कएने स्वीकार कएलनि अछि । ओ कहला जे बाद मे जांच मे पता चलल जे कोनो व्यक्ति अध्ययन क उद्देश्य स संस्थान मे नहि पहुंचल अछि।

तिवारी कहलनि जे, दस्तावेज जालसाजी मे शामिल एकटा समूह फर्जी कागज तैयार केलक आ संस्थान के नाम पर मंत्रालय के सिफारिश पठेलक, जाहि मे दस विदेशी के स्टूडेंट वीजा मांगल गेल। “हम मंत्रालय केरऽ आग्रह के आधार प॑ वीजा क॑ मंजूरी द॑ देल॑ छेलियै । हम्मं॑ जांच करला के बाद पता चललै कि कथित तौर प॑ संस्था द्वारा जारी करलऽ गेलऽ पत्र जाली छेलै । आगू के जांच चलैलऽ जाय रहलऽ छै, आरू एकरा म॑ शामिल लोगऽ क॑ कानून केरऽ दायरा म॑ लानलऽ जैतै ।”

जांच के दौरान प्राप्त दस्तावेज के अनुसार 20 मई के पत्र मंत्रालय के स्वयंसेवी जुटान आ वीजा सिफारिश अनुभाग के बाल्मीकी कैंपस नाम सं भेजल गेल छल. कथित तौर पर प्रधानाध्यापक अच्युत प्रसाद लामिछाने के तरफ सं हस्ताक्षरित एहि पत्र मे दस विदेशी छात्र के एक साल के शैक्षणिक अध्ययन वीजा के आग्रह कएल गेल छल.

पत्रमे नेपाल संस्कृत विश्वविद्यालयमे संस्कृत साहित्य विभाग द्वारा आयोजित प्रवेश परीक्षामे उत्तीर्ण भेल आ मार्च २०२६सँ संस्कृत साहित्यमे दू वर्षक स्नातकोत्तर कार्यक्रमक पहिल वर्षमे औपचारिक रूपसँ नामांकन कएल गेल दाबी कएल गेल अछि ।

मंत्रालय कए देल गेल सहायक दस्तावेज मे सेहो दावा कैल गेल अछि जे प्रत्येक छात्र 70,840 टका क ट्यूशन फीस देलक अछि। अलग रसीद मे 15 मई कए कुल 708,400 टका जमा भ गेल अछि।

एहि दस्तावेज क आधार पर मंत्रालय क अधिकारी बिष्णु प्रसाद आचार्य 3 जून कए एकटा सिफारिश तैयार केलथि, जाहि मे इ निष्कर्ष निकालल गेल जे आवेदक छात्र वीजा क पात्र छथि।

नेपाल केरऽ आप्रवासन नियमावली म॑ विदेशी नागरिक आरू ओकरऽ परिवार केरऽ सदस्यऽ क॑ देश केरऽ मान्यता प्राप्त शैक्षणिक संस्थानऽ म॑ पढ़ै, पढ़ै या शोध करै लेली सरकारी मंजूरी मिलला प॑ छात्र वीजा लेबै के अनुमति छै ।

ओहि प्रावधान क हवाला दैत शिक्षा मंत्रालय क अवर सचिव लोकबहादुर लोपचन एहि प्रस्ताव कए 4 जून कए संयुक्त सचिव रुद्र प्रसाद अधिकारी कए पठा देलथि।ओही दिन अधिकारी एक साल क छात्र वीजा जारी करबा लेल आप्रवासन विभाग कए सिफारिश कए मंजूरी द देलथि। एकर बाद वीजा भेट गेल।

आप्रवासन अधिकारी कए शंका बढ़लाक बाद आ बुधदिन बाल्मीकी कैंपस स वीजा भेटल विदेशी नागरिक क संबंध मे अतिरिक्त जानकारी मंगलाक बाद एहि योजना क खुलासा भेल।

जवाब मे कार्यवाहक प्राचार्य आ प्रोफेसर उमेश प्रसाद घिमिरे विभाग कए जानकारी देलथि जे एहि मे स कोनो व्यक्ति संस्थान मे पढ़ाई नहि करि रहल छथि। ओ इहो कहलनि जे कैंपस कहियो सिफारिश पत्र जारी नहि केलक अछि आओर ओहि समय विदेशी छात्र के लेल कोनो मास्टर लेवल के क्लास नहि चला रहल छल. वीजा प्राप्त करय वाला मे सं कियो ओतय कहियो नामांकन नहि भेल छल.

ओहि प्रतिक्रिया स आप्रवासन अधिकारी कए अपन जांच तेज करबा लेल प्रेरित कैल गेल।

एकरऽ बाद अधिकारी न॑ जाली दस्तावेज तैयार करै आरू मंत्रालय क॑ जमा करै के आरोप म॑ सुबोध शुक्ला आरू चीनी नागरिक वांग जिनकाओ क॑ गिरफ्तार करी लेल॑ छै, जेकरा न॑ कथित तौर प॑ फर्जी कागजी काम के इस्तेमाल करी क॑ छात्र वीजा लेन॑ छेलै ।

शुक्ला पर्सा जिला के वीरगंज महानगरपालिका वडा ९ के निवासी छैथ ।

आप्रवासन विभाग के कहनाय अछि जे फिलहाल शेष नौ विदेशी नागरिक के पता लगाओल जा रहल अछि.

आप्रवासन निदेशक टीका राम ढकाल कहलनि जे, एहि मे सं नौ गोटे के वीजा कई दिन पहिने जारी आ संकलन भ चुकल अछि। हालांकि एकटा चीनी आवेदक कए एखन धरि वीजा नहि भेटल छल, किया कि अधिकारी कए शक भेला क बाद पासपोर्ट कए बरकरार रखने छल।

धकाल कहलनि जे, हम गुरुवार के वीजा मंजूर भ गेल अछि आ संग्रहण लेल तैयार अछि, एहि बहाने व्यक्ति के कार्यालय मे फोन केलहुं। “तखन विभागक परिसरक भीतर सँ व्यक्ति केँ हिरासत मे लेल गेल।”

ढकल के अनुसार शुक्ला के पहिने टेलीफोन सं बजाओल गेल छल आ बाद मे चीनी नागरिक के संग आप्रवासन कार्यालय पहुंचल छल.

खबर अछि जे प्रारंभिक पूछताछ के दौरान शुक्ला अपन कंप्यूटर पर जाली दस्तावेज बना क छात्र वीजा के सिफारिश सुरक्षित करय लेल ओकर उपयोग करय के बात स्वीकार केलखिन्ह. अधिकारी एहि योजना मे शामिल व्यापक नेटवर्क क जांच जारी रखने छथि।"
DeerHack returns for 4th edition with focus on youth innovation - Nepalnews.com,DeerHack returns for 4th edition with focus on youth innovation  Nepalnews.com,2026-06-11 13:04:45,https://news.google.com/rss/articles/CBMitgFBVV95cUxPVGVGdHNWMnNLcEJ3VW5sVUpTVkFSOE03Z0JaMnl1bElsak5Mai1tdFZLUGtfMUdBZlFEclBhVjJLc3lIUFdGR29HbUZnOENtSExTQU1wQmhwZkVFRXctU2FuNFdncVRtMzhrU0lfendsNkU3YWl4ZWJ0cDYtalN1RGtFMzRoR1Fqazh6dWo2M25HaWVHTUdtOUU0WTdLUXo5NWhucjJZUlA4ZkRnMm1pTm9FNjdVQQ?oc=5&hl=en-US&gl=US&ceid=US:en,https://english.nepalnews.com,Nepalnews.com,,,
"Nepal News Evening Economic Brief – June 11, 2026 - Nepalnews.com","Nepal News Evening Economic Brief – June 11, 2026  Nepalnews.com",2026-06-11 13:19:45,https://news.google.com/rss/articles/CBMikgFBVV95cUxQTko0dFRLWWZsaXdNNXZGYjlwcEJBSjR4M2NfMkp5MjhUV3ViMGhHU29sQVN1czBTSmFOSEVpcldOS2Y4dFJCeUMzWlM5WmUzSlF0amxLS1BNWTNFWUVTc3J6UTRZRUlmUDFQb1FHdU5EUTMyUU5jUWhPaDlFMXlMcWRiekZURUFkYVZZLVd5Q2ljZw?oc=5&hl=en-US&gl=US&ceid=US:en,https://english.nepalnews.com,Nepalnews.com,,,
Fake Bhutanese Refugee Scam Enters Final Stretch: Everything You Need to Know - Nepalnews.com,Fake Bhutanese Refugee Scam Enters Final Stretch: Everything You Need to Know  Nepalnews.com,2026-06-11 13:25:44,https://news.google.com/rss/articles/CBMivAFBVV95cUxPNzdOOEYtd0gybTlEV0kta3RVLXJyZFNfd0VnaFNCS281Zmx5bkdYTkhpYTliQnhHczZ5VmY5cDBhX0FvQXF4N25EYWxFejhPZ0dQdk0zMk5iSmFCQWFSdXpCWkhMVTlERzFnODRldjJIQlgya3ZUaFdxMWk0aEhweDFQRjNOa2xhRno1LWI0T21GOXNjUE8wMkd2N2NzUG0tV2N5NEVIRUJtX2h6clhMZmhiWnhkTFYzanhhcQ?oc=5&hl=en-US&gl=US&ceid=US:en,https://english.nepalnews.com,Nepalnews.com,,,
NA Members demand clarification on PM's remarks on border - The Rising Nepal,NA Members demand clarification on PM's remarks on border  The Rising Nepal,2026-06-11 13:40:39,https://news.google.com/rss/articles/CBMiUEFVX3lxTE1CUkRrMUZ1MnZ6Vmo2UDhGT3Z6S0pPSU5hRnNxQzRPaW5Ndzhrak42Y1BuTXpsR29NWHdJNTctcWp0R3dqdjR6MEdGaEsxSklC?oc=5&hl=en-US&gl=US&ceid=US:en,https://risingnepaldaily.com,The Rising Nepal,"Kathmandu June 11: In the meeting of the National Assembly today, lawmakers voiced concerns over Prime Minister Balendra Shah's remarks relating to border made in the House of Representatives' meeting on May 31.

NA member from the Nepali Congress, Kamala Devi Pant, urged the government that it clarified on the PM's statements in order to clear obstruction in the parliamentary proceeding and regard border issues with much significance and seriousness.

Jhakku Prasad Subedi from the Nepal Communist Party warned that the PM's comments could lead to increased foreign interference and called for prompt clarification. Prem Prasad Dangal from the CPN (UML) also observed the PM's statements could affect Nepal's foreign policy and underscored the relations between border issues and national identity.

Mahanth Thakur of the Janata Samajwadi Party demanded a collective focus on safeguarding nationality and sovereignty, while Tul Prasad Bishwakarma from Rastriya Janamorcha demanded removal of the PM's remarks from the parliament records in view of the sensitivity of the issue.

Earlier on Thursday itself, the parliamentary deadlock was cleared after Foreign Minister Shisir Khanal furnished clarifications in the PM's statement on border issues.(RSS)","{'https://risingnepaldaily.com/storage/media/104050/conversions/Untitled-1-(1)-(2)-original-thumb.jpg', 'https://risingnepaldaily.com/storage/media/104059/conversions/expo-original-thumb.jpg', 'https://risingnepaldaily.com/storage/media/104047/conversions/202606111010-28f31ac9-c67a-455a-af65-228dc5c54b99_medium-square-thumb.jpg', 'https://risingnepaldaily.com/storage/media/104048/conversions/Gita-Chaudhary-Mantri-Ban-square-thumb.jpg', 'https://risingnepaldaily.com/storage/media/104057/Untitled-1.jpg', 'https://risingnepaldaily.com/storage/media/104048/conversions/Gita-Chaudhary-Mantri-Ban-original-thumb.jpg', 'https://risingnepaldaily.com/commons/rising-logo.png', 'https://risingnepaldaily.com/storage/media/104049/conversions/GD_KTM_DG_0702-original-thumb.jpg', 'https://risingnepaldaily.com/storage/media/104050/conversions/Untitled-1-(1)-(2)-square-thumb.jpg', 'https://risingnepaldaily.com/storage/media/104056/conversions/Constitution-amendment-taskforce-square-thumb.jpg', 'https://risingnepaldaily.com/storage/media/104056/conversions/Constitution-amendment-taskforce-original-thumb.jpg', 'https://risingnepaldaily.com/storage/media/104052/conversions/JUN-original-thumb.jpg', 'https://risingnepaldaily.com/storage/media/104054/conversions/77-original-thumb.jpg', 'https://risingnepaldaily.com/storage/media/104058/conversions/FM-wagle-original-thumb.jpg', 'https://risingnepaldaily.com/storage/media/886/conversions/logo-thumb-thumb-thumb.jpg'}","काठमांडू ११ जून : राष्ट्रिय सभाके आई बैसारमे ३१ मईके प्रतिनिधिसभाके बैसारमे प्रधानमन्त्री बलेन्द्र शाहके सीमासंबन्धित टिप्पणीके प्रति विधायकसब चिन्ता व्यक्त कएलक ।

नेपाली कांग्रेस सँ एनए सदस्य कमला देवी पंत संसदीय कार्यवाही मे बाधा दूर करबाक लेल आ सीमा मुद्दा केँ बहुत महत्व आ गंभीरता सँ देखबाक लेल पीएम केर बयान पर स्पष्टीकरण केने सरकार सँ आग्रह केलनि।

नेपाल कम्युनिस्ट पार्टीक झक्कू प्रसाद सुबेदी पीएमक एहि टिप्पणीसँ विदेशी हस्तक्षेप बढि सकैत अछि चेतबैत शीघ्र स्पष्टीकरण करबाक आह्वान कएलनि । नेकपा के प्रेम प्रसाद दंगल सेहो पीएम के बयान स नेपाल के विदेश नीति प्रभावित भ सकैत अछि से देखलनि आ सीमा मुद्दा आ राष्ट्रीय पहचान के बीच संबंध के रेखांकित केलनि।

जनता समाजवादी पार्टी के महंथ ठाकुर राष्ट्रीयता आ संप्रभुता के रक्षा पर सामूहिक ध्यान देबाक मांग केलनि, जखन कि राष्ट्रीय जनमोर्चा सं तुल प्रसाद विश्वकर्मा एहि मुद्दा के संवेदनशीलता के देखैत पीएम के टिप्पणी संसद के रिकॉर्ड सं हटाबय के मांग केलनि.

एहि सं पहिने गुरुदिन स्वयं विदेश मंत्री शिसिर खनाल के सीमा मुद्दा पर पीएम के बयान मे स्पष्टीकरण देला के बाद संसदीय गतिरोध साफ भ गेल छल.(आरएसएस)"
"India, Nepal launch cross-border UPI-NPI remittance linkage for instant digital payments - The Statesman","India, Nepal launch cross-border UPI-NPI remittance linkage for instant digital payments  The Statesman",2026-06-11 13:49:00,https://news.google.com/rss/articles/CBMi2AFBVV95cUxPdHBKdHZOTW5jdF9weGJwNUJTTjNQS1B0ZlJtRXVlYmVrNkl0ZzZBRUhMeXBLNzBaOFU4Rl80NWhNWkNSRGZqekZvVG5URlU0a3ZHbHFHbXJYSlJvUEJHMzdwUVFVOEVUaGlQRU1acU9BOFhsSmpqcWt3UXNBT2k3V2RiZ0lrdGJmVDJMZFk4MUt6bFQxUjFPY1lCVWR6aUdrXzdvLUd1U29DeUZHUTVyNE1TYmNZQXYtZHlqTVdFQzZ2MjM0MThYTWM2N0lYVjJmVHo5bmNVY3jSAd4BQVVfeXFMUEQwMDhPeW5RYnZTcHhhZkFhNFBCN05kbjVUTkU1X3JyMkNYcFV1eGJiSl9xZXRidmRKQkZxdnhnWGpGa3ZVVlZWSnhQajF1YXNxYlBteDlrNVRTb3loT25aMjBoa2JndGhoYWVCOEtYS2F2TkVBbVZtRDhyM0N2TFV4dDdSWFF6dzVaVEZSZnYxWjAxU0NCWE5KMW1Bdmk3YjRpeWUxMnVobHNhZHNsN2dXT1p1eGR3VjBHU2RlOVhPaVc3a3N2NElBZ3VEeXFzeU9CQTBGTHNwSEwxVURB?oc=5&hl=en-US&gl=US&ceid=US:en,https://www.thestatesman.com,The Statesman,,,
