title,description,published date,url,publisher.href,publisher.title,full_article,images,translated
Agnipath and Nepal: Time to reset a trusted Gorkha partnership - The Himalayan Times,Agnipath and Nepal: Time to reset a trusted Gorkha partnership  The Himalayan Times,2026-07-14 16:51:53,https://news.google.com/rss/articles/CBMioAFBVV95cUxQdzVxd01Xa0dWWFo0Y3RqQVd4aEx2bkR6M3Y1N2pFb294c0hEVG9pWWRER0VfcTFiT3d1QTJ5UjkxYWxrdzkteGtPcjY1TXRiYjZ1WXdYaTVyM0w0OVBXdS1POTQyXzlpS2Y5LWozaTRYVTFmV0ZIRkNYakNmZUFkUk5ZMVVlMzJVT0NwRXhMclJCTmlYMVVlNkNRTE9LLVdl?oc=5&hl=en-US&gl=US&ceid=US:en,https://thehimalayantimes.com,The Himalayan Times,"India's Agnipath military recruitment reform, launched in 2022, was designed to create a younger, leaner and more technologically agile armed force while reducing the long-term pension burden on the exchequer. From New Delhi's perspective, it was a necessary response to changing military requirements and the evolving nature of warfare. Yet a reform intended for domestic purposes has produced consequences far beyond India's borders, bringing uncertainty to one of South Asia's oldest and most successful military relationships-the recruitment of Nepali citizens into the Indian Army's Gorkha regiments.

What confronts India and Nepal today is therefore not merely a disagreement over recruitment policy. It is a test of whether two close neighbours can adapt a historic partnership to new realities without undermining the trust that has sustained it for more than two centuries.

Related Articles No reform without a motivated civil service: Implementation depends on capacity, morale, and commitment Village Tourism Mart opens in Bandipur; next edition to move to Gorkha

The Gorkha connection has long been a unique pillar of India-Nepal relations. It has never been just about military service. For Nepal, recruitment into the Indian Army has provided generations of young men with stable employment, professional training, social mobility and long-term financial security. Salaries and pensions have supported thousands of families, particularly in rural districts where economic opportunities remain limited. For India, Gorkha soldiers have contributed immensely to national security, earning a formidable reputation for courage, discipline and battlefield effectiveness.

The arrangement has thus delivered benefits far beyond the military sphere. It has strengthened people-to-people ties, fostered goodwill and created a rare security partnership built as much on trust as on formal agreements.

googletag.cmd.push(function() { googletag.display('div-gpt-ad-1686127029429-0'); }); googletag.cmd.push(function() { googletag.display('div-gpt-ad-1686127067910-0'); }); googletag.cmd.push(function() { googletag.display('div-gpt-ad-1686127112906-0'); });

Agnipath has changed the terms of that partnership. Under the new system, recruits serve for four years, after which only a proportion are retained for regular service. While the model fits India's broader military objectives, it inevitably alters the expectations that traditionally attracted Nepali youth to the Gorkha regiments-a career that offered not only honour and service but also long-term economic security.

Kathmandu's decision to suspend Gorkha recruitment under Agnipath therefore stems from understandable concerns. Nepali policymakers have argued that the scheme departs from the spirit of the 1947 Tripartite Agreement governing Gorkha recruitment, particularly regarding conditions of service and post-retirement benefits.

Yet there is another reality that Nepal must acknowledge. India cannot realistically operate two separate recruitment systems within the same army-one for Indian citizens and another for Nepali citizens-while maintaining parity in rank, pay, allowances, pensions and career progression.

Encouragingly, there are signs that Kathmandu may be moving towards a more pragmatic position. During a visit to New Delhi in June, Nepal's Foreign Minister, responding informally to media questions on the issue, indicated that Nepal would be willing to discuss the matter whenever India considered it necessary. No official policy shift has been announced, but the comments suggested that the door to dialogue remains open.

At the heart of Nepal's concerns lies a fundamental question: what happens after four years of service?

This concern is both legitimate and important. Under the traditional recruitment model, military service offered a pathway to stable employment, pension benefits and long-term economic advancement. Agnipath changes that equation. Although recruits leave service with valuable training, work experience and a substantial savings package, most will return to civilian life at a relatively young age.

For Nepal, where employment generation remains a persistent challenge, the prospect of thousands of trained veterans re-entering the job market raises understandable concerns. The issue is not whether Agniveers receive adequate compensation during service; it is whether they can secure meaningful opportunities afterwards.

India has attempted to address this challenge. Agniveers receive a progressively increasing salary and a tax-free Seva Nidhi package upon completion of service. In addition, the Indian government has been working to create employment pathways for former Agniveers in the Central Armed Police Forces and other sectors. India is also reviewing the 25 per cent retention ceiling for Agniveers, with the services reportedly favouring higher retention in specialised roles where experience and continuity matter most.

However, higher retention alone is unlikely to resolve Nepal's concerns. Even if retention rates increase, the majority of recruits will still leave military service after four years. For future Gorkha recruitment, therefore, the central issue remains unchanged: the absence of the long-term career security and pension-backed future that traditionally made military service so attractive.

This is precisely why the debate must move beyond criticism towards practical solutions.

Too often, the discussion in Nepal assumes that it is India's responsibility alone to address the post-service future of Agniveers. That view is neither realistic nor productive. If Nepal wishes to preserve the historic Gorkha connection, Kathmandu must become an active stakeholder in shaping its future.

The Nepal government should complement India's efforts by creating reintegration pathways for returning Agniveers. Former recruits could be prioritised for positions in Nepal's security forces, disaster-management agencies, border management organisations and public-service institutions. Their military training, discipline and leadership skills would be valuable assets for the country. Nepal could also encourage entrepreneurship through targeted credit schemes, vocational training and business-development programmes, enabling veterans to use their savings and experience to build sustainable livelihoods.

A cooperative approach would transform Agnipath from a perceived problem into a shared opportunity.

Political leadership is therefore crucial. Continuing to suspend recruitment indefinitely may appear politically safe, but it comes with growing costs. Every year of delay deprives thousands of Nepali youth of access to employment, training and professional development. It also creates uncertainty around an institution that has served Nepal's economic and social interests for generations.

The choice before Kathmandu is therefore not between accepting or rejecting Agnipath. It is between participating in the evolution of the Gorkha partnership or risking gradual exclusion from it. Statesmanship lies in recognising that historic relationships survive not by resisting change, but by adapting to it. For India and Nepal, the time for that adaptation is now.

The author is a retired officer of the 4th Gorkha Rifles (Indian Army) and writes on geopolitics, strategic affairs and India–Nepal security relations. The views expressed are personal.","{'https://thehimalayantimes.com/theme_himalayantimes/images/layout/icon_youtube.png', 'https://thehimalayantimes.com/thehimalayantimes/uploads/images/2026/07/14/49616.jpg', 'https://cdnx.premiumread.com/?url=https://thehimalayantimes.com/thehimalayantimes/uploads/images/2026/07/14/49589.jpg&w=30&q=100&f=webp', 'https://thehimalayantimes.com/theme_himalayantimes/images/layout/icon_pinterest.png', 'https://thehimalayantimes.com/theme_himalayantimes/images/layout/icon-Instagram-colored.png', 'https://cdnx.premiumread.com/?url=https://thehimalayantimes.com/thehimalayantimes/uploads/images/2026/05/02/48047.jpeg&w=30&q=100&f=webp', 'https://thehimalayantimes.com/theme_himalayantimes/images/layout/icon_facebook.png', 'https://cdnx.premiumread.com/?url=https://thehimalayantimes.com/thehimalayantimes/uploads/images/2026/07/14/49616.jpg&w=800&q=100&f=webp', 'https://thehimalayantimes.com/theme_himalayantimes/images/logo-100.png', 'https://cdnx.premiumread.com/?url=https://thehimalayantimes.com/thehimalayantimes/uploads/images/2026/07/14/49599.jpg&w=30&q=100&f=webp', 'https://thehimalayantimes.com/theme_himalayantimes/images/layout/icon_x.png', 'https://cdnx.premiumread.com/?url=https://thehimalayantimes.com/thehimalayantimes/uploads/images/2026/07/14/49591.jpg&w=30&q=100&f=webp', 'https://thehimalayantimes.com/theme_himalayantimes/images/layout/icon_messenger.png', 'https://cdnx.premiumread.com/?url=https://thehimalayantimes.com/thehimalayantimes/uploads/images/2026/07/14/49579.jpg&w=30&q=100&f=webp', 'https://thehimalayantimes.com/theme_himalayantimes/images/layout/icon_viber.png', 'https://thehimalayantimes.com/theme_himalayantimes/images/layout/icon_whatsapp.png', 'https://cdnx.premiumread.com/?url=https://thehimalayantimes.com/thehimalayantimes/uploads/images/2026/05/26/48494.jpg&w=30&q=100&f=webp', 'https://thehimalayantimes.com/theme_himalayantimes/images/layout/icon-tiktok.png', 'https://thehimalayantimes.com/theme_himalayantimes/images/layout/icon_telegram.png', 'https://thehimalayantimes.com/theme_himalayantimes/images/layout/icon_linkedin.png'}","भारत केरऽ अग्निपथ सैन्य भर्ती सुधार, जे २०२२ म॑ शुरू करलऽ गेलऽ छेलै, क॑ एक युवा, दुबला आरू तकनीकी रूप स॑ अधिक फुर्तीला सशस्त्र बल पैदा करै लेली बनालऽ गेलऽ छेलै आरू साथ ही खजाना प॑ दीर्घकालिक पेंशन केरऽ बोझ कम करलऽ जाय । नई दिल्ली के नजरिया स॑ ई बदलतऽ सैन्य आवश्यकता आरू युद्ध केरऽ विकसित प्रकृति के प्रति आवश्यक प्रतिक्रिया छेलै । तइयो घरेलू प्रयोजनक उद्देश्य सं एकटा सुधारक परिणाम भारतक सीमा सं बहुत आगू बढ़ि गेल अछि, जाहि सं दक्षिण एशियाक एकटा पुरान आ सफल सैन्य संबंध- भारतीय सेनाक गोर्खा रेजिमेंट मे नेपाली नागरिकक भर्ती मे अनिश्चितता आबि गेल अछि.

एहि लेल आइ भारत आ नेपाल क सामने जे किछु अछि ओ मात्र भर्ती नीति पर असहमति नहि अछि । ई एकरऽ परीक्षा छै कि की दू घनिष्ठ पड़ोसी ऐतिहासिक साझेदारी क॑ नया वास्तविकता के अनुकूल बनाबै सकै छै, जेकरा स॑ ओकरा दू शताब्दी स॑ भी अधिक समय स॑ कायम रखै वाला विश्वास क॑ कमजोर नै करलऽ जाय सकै छै ।

संबंधित लेख बिना प्रेरित सिविल सेवा के कोनो सुधार नै : क्रियान्वयन क्षमता, मनोबल, आ प्रतिबद्धता पर निर्भर करैत अछि बंदीपुर मे खुजत विलेज टूरिज्म मार्ट; अगिला संस्करण गोरखा मे जेबाक लेल

गोरखा कनेक्शन बहुत दिन स भारत-नेपाल संबंध क एकटा अनूठा स्तंभ रहल अछि। ई कहियो खाली सैन्य सेवा के बात नै रहल छै। नेपाल के लेल भारतीय सेना में भर्ती के बाद पीढ़ी के युवक के स्थिर रोजगार, पेशेवर प्रशिक्षण, सामाजिक गतिशीलता आ दीर्घकालीन आर्थिक सुरक्षा उपलब्ध करायल गेल अछि। वेतन आ पेंशन सं हजारों परिवारक कें भरण-पोषण भेल छै, खासकर ग्रामीण जिलाक मे जतय आर्थिक अवसर सीमित छै. भारत के लेलऽ गोरखा सैनिकऽ न॑ राष्ट्रीय सुरक्षा म॑ अपार योगदान देल॑ छै, जेकरा स॑ साहस, अनुशासन आरू युद्ध के मैदान केरऽ प्रभावशीलता लेली दुर्जेय प्रतिष्ठा मिललऽ छै ।

एहि तरहें एहि व्यवस्था स सैन्य क्षेत्र स बहुत आगू क फायदा भेल अछि। ई लोगऽ स॑ लोगऽ के संबंध क॑ मजबूत करलकै, सद्भावना क॑ बढ़ावा देलकै आरू एगो दुर्लभ सुरक्षा साझेदारी के निर्माण करलकै जेतना कि विश्वास प॑ बनलऽ छै जेतना कि औपचारिक समझौता प॑ ।

गूगलटैग.सीएमडी.पुश (फंक्शन () { गूगलटैग.प्रदर्शन ('डिव-जीपीटी-विज्ञापन-1686127029429-0'); }); गूगलटैग.सीएमडी.पुश (फंक्शन () { गूगलटैग.प्रदर्शन ('डिव-जीपीटी-विज्ञापन-1686127067910-0'); }); गूगलटैग.सीएमडी.पुश (फंक्शन () { गूगलटैग.प्रदर्शन ('डिव-जीपीटी-विज्ञापन-1686127112906-0'); });

अग्निपथ ओहि साझेदारी के शर्त बदलि देलखिन्ह. नव व्यवस्था क तहत भर्ती चारि साल तक सेवा दैत अछि, जेकर बाद नियमित सेवा लेल मात्र एकटा अनुपात राखल जाइत अछि। ई मॉडल भारत केरऽ व्यापक सैन्य उद्देश्य के अनुरूप छै, लेकिन ई अनिवार्य रूप स॑ वू अपेक्षा म॑ बदलाव करै छै जे परंपरागत रूप स॑ नेपाली युवा सिनी क॑ गोरखा रेजिमेंट म॑ आकर्षित करै छेलै-एक ऐन्हऽ कैरियर जेकरा म॑ खाली सम्मान आरू सेवा ही नै बल्कि दीर्घकालीन आर्थिक सुरक्षा भी मिलै छेलै ।

अग्निपथ के तहत गोरखा भर्ती स्थगित करय के काठमांडू के फैसला एहि लेल बुझय योग्य चिंता सं उपजल अछि. नेपाली नीति निर्माता के तर्क छै कि ई योजना गोरखा भर्ती के नियंत्रित करै वाला १९४७ के त्रिपक्षीय समझौता के भावना स॑ हटै छै, खास करी क॑ सेवा के शर्त आरू सेवानिवृत्ति के बाद के लाभ के संबंध म॑ ।

तइयो एकटा आओर यथार्थ अछि जकरा नेपाल केँ स्वीकार करबाक चाही। भारत एकहि सेना के भीतर दू अलग-अलग भर्ती प्रणाली के यथार्थ रूप स संचालित नै क सकैत अछि-एकटा भारतीय नागरिक के लेल आ दोसर नेपाली नागरिक के लेल-जखन कि रैंक, वेतन, भत्ता, पेंशन आ कैरियर के प्रगति में समता कायम राखल जा सकैत अछि।

उत्साहवर्धक बात ई जे काठमांडू बेसी व्यावहारिक स्थिति दिस बढ़बाक संकेत भेटि रहल अछि । जून म॑ नई दिल्ली केरऽ दौरा के दौरान नेपाल केरऽ विदेश मंत्री न॑ ई मुद्दा प॑ मीडिया केरऽ सवालऽ के अनौपचारिक जवाब दै के संकेत देलकै कि जब॑ भी भारत जरूरी मानतै त॑ नेपाल ई मामला प॑ चर्चा करै लेली तैयार होतै । कोनो आधिकारिक नीतिगत बदलाव के घोषणा नै भेल अछि, मुदा टिप्पणी सं पता चलल जे संवाद के दरवाजा खुलल अछि.

नेपाल के चिंता के मूल में एकटा मौलिक सवाल अछि जे चारि साल के सेवा के बाद की होइत अछि?

ई चिंता जायज आ महत्वपूर्ण दुनू अछि। पारंपरिक भर्ती मॉडल के तहत सैन्य सेवा स्थिर रोजगार, पेंशन लाभ आ दीर्घकालिक आर्थिक उन्नति के रास्ता पेश करैत छल. अग्निपथ ओहि समीकरण केँ बदलि दैत अछि। हालांकि भर्ती मूल्यवान प्रशिक्षण, कार्य अनुभव आ पर्याप्त बचत पैकेज कें साथ सेवा छोड़य छै, लेकिन अधिकांश अपेक्षाकृत कम उम्र मे नागरिक जीवन मे वापस आओत.

नेपाल के लेल, जतय रोजगार पैदा करनाय एकटा लगातार चुनौती बनल अछि, हजारों प्रशिक्षित दिग्गज के रोजगार बाजार मे फेर सं प्रवेश के संभावना बुझय योग्य चिंता पैदा करैत अछि. मुद्दा ई नै छै कि सेवा के दौरान अग्निवीर क॑ पर्याप्त मुआवजा मिलै छै कि नै; ई छै कि एकरऽ बाद सार्थक अवसर सुरक्षित करी सकै छै कि नै ।

भारत एहि चुनौती कए दूर करबाक प्रयास केलक अछि। अग्निवीर कए सेवा पूरा भेला पर क्रमिक रूप स बढ़ैत वेतन आ टैक्स मुक्त सेवा निधि पैकेज भेटैत अछि। एकरऽ अलावा भारत सरकार केंद्रीय सशस्त्र पुलिस बल आरू अन्य क्षेत्रऽ म॑ पूर्व अग्निवीरऽ लेली रोजगार के रास्ता बनाबै के काम करी रहलऽ छै । भारत अग्निवीर केरऽ २५ प्रतिशत रिटेन सीमा के समीक्षा भी करी रहलऽ छै, जेकरा म॑ खबर छै कि सेवा विशेष भूमिका म॑ अधिक रिटेन के पक्ष म॑ छै, जहां अनुभव आरू निरंतरता सबसें जादा मायने रखै छै ।

मुदा, बेसी रिटेन स मात्र नेपाल क चिंता क समाधान हेबाक संभावना कम अछि। रिटेनमेंट रेट बढ़ला पर सेहो अधिकांश रंगरूट चारि साल बाद सैन्य सेवा छोड़ि देत। अतः भविष्य केरऽ गोरखा भर्ती लेली केंद्रीय मुद्दा अपरिवर्तित छै : दीर्घकालिक कैरियर सुरक्षा आरू पेंशन समर्थित भविष्य केरऽ अभाव जे परंपरागत रूप स॑ सैन्य सेवा क॑ एतना आकर्षक बनाबै छेलै ।

ठीक यही कारण छै कि बहस क॑ आलोचना स॑ आगू बढ़ी क॑ व्यावहारिक समाधान के तरफ बढ़ना जरूरी छै ।

बहुत बेर नेपाल मे चर्चा ई मानि लैत अछि जे अग्निवीर के सेवाोत्तर भविष्य के संबोधित करब असगर भारत के जिम्मेदारी अछि । ओ दृष्टिकोण ने यथार्थ अछि आ ने उत्पादक। यदि नेपाल ऐतिहासिक गोरखा संपर्क के संरक्षित करय चाहैत अछि त काठमांडू के अपन भविष्य के आकार देबय में सक्रिय हितधारक बनय पड़त.

नेपाल सरकार के लौटय वाला अग्निवीर के लेल पुनर्समायोजन के मार्ग बना क भारत के प्रयास के पूरक बनाबय के चाही. नेपाल के सुरक्षा बल, आपदा प्रबंधन एजेंसी, सीमा प्रबंधन संगठन आ लोक सेवा संस्थान मे पद के लेल पूर्व भर्ती के प्राथमिकता देल जा सकैत अछि। हुनकऽ सैन्य प्रशिक्षण, अनुशासन आरू नेतृत्व कौशल देश लेली बहुमूल्य संपत्ति होतै । नेपाल लक्षित ऋण योजना, व्यावसायिक प्रशिक्षण आ व्यवसाय-विकास कार्यक्रम के माध्यम सं उद्यमिता के सेहो प्रोत्साहित क सकैत अछि, जाहि सं दिग्गज लोकनि अपन बचत आ अनुभव के उपयोग टिकाऊ आजीविका के निर्माण में क सकैत छथि.

सहकारी दृष्टिकोण अग्निपथ कए एकटा अनुमानित समस्या स साझा अवसर मे बदलि देत।

अतः राजनीतिक नेतृत्व बहुत महत्वपूर्ण अछि। अनिश्चित काल लेल भर्ती निलंबित करब राजनीतिक रूप स सुरक्षित देखा सकैत अछि, मुदा एहि मे बढ़ैत लागत सेहो आबि रहल अछि। हर साल विलंब के कारण हजारों नेपाली युवा के रोजगार, प्रशिक्षण आ व्यावसायिक विकास के पहुंच सं वंचित भ जायत अछि. संगहि एकटा एहन संस्था के आसपास अनिश्चितता पैदा करैत अछि जे पीढ़ी दर पीढ़ी नेपाल के आर्थिक आ सामाजिक हित के सेवा केने अछि ।

तेँ काठमांडूक समक्ष विकल्प अग्निपथ केँ स्वीकार करब वा अस्वीकार करबाक बीच नहि अछि । ई गोरखा साझेदारी के विकास में भाग लेबै या ओकरा स॑ धीरे-धीरे बहिष्कार के जोखिम उठाबै के बीच छै । राज्यकर्त्ता ई बात क॑ स्वीकार करै म॑ निहित छै कि ऐतिहासिक संबंध परिवर्तन के विरोध करी क॑ नै, बल्कि ओकरा अनुकूल होय क॑ जीवित रहै छै । भारत आ नेपाल लेल ओहि अनुकूलनक समय आब अछि ।

लेखक चतुर्थ गोरखा राइफल (भारतीय सेना) के सेवानिवृत्त अधिकारी छै आरू भू-राजनीति, सामरिक मामला आरू भारत-नेपाल सुरक्षा संबंध पर लिखै छै । व्यक्त विचार व्यक्तिगत अछि।"
