title,description,published date,url,publisher.href,publisher.title,full_article,images,translated
Will Orind Magnesite Industry ever reopen ? - The Rising Nepal,Will Orind Magnesite Industry ever reopen ?  The Rising Nepal,2026-04-27 00:00:37,https://news.google.com/rss/articles/CBMiUEFVX3lxTE1lRmZaZzM0cTd1VHFZZkY0c05LRGpvUExJUGVqY3l4RmpPdVN2QUI0aDJCNElIQl9xOS1jUGVkY2VYcHpIU3h4X25sN0dCUkhv?oc=5&hl=en-US&gl=US&ceid=US:en,https://risingnepaldaily.com,The Rising Nepal,"By Chitra Kumar Mijar,Sindhupalchok, Apr. 27: Questions are once again being raised over whether the long-defunct Orind Magnesite Industry in Balefi Rural Municipality-8 will ever resume operations, as it has remained completely shut for the past 27 years.

Successive governments have repeatedly pledged to revive the industry, and the current administration has also stated that efforts are under way. However, no concrete timeline has been set.

Established on March 25, 1979 in Lamosanghu, the industry was shut down on December 10, 1998. Built at a cost of Rs. 3.59 billion, it was once considered the largest magnesite industry in Asia.

Spread across 364 ropanis of land in Lamosanghu, the industry is linked to the Kharidhunga mine in Bhimeshwor Municipality-9 of Dolakha, which covers around 5,200 ropanis. In total, 5,566 ropanis of land associated with the project now lies abandoned.

Despite operating amid various challenges until 1997, the factory has remained closed ever since. Neither locals nor federal authorities have been able to fix a date for its reopening. So far, revival plans have largely remained limited to political slogans.

Ramesh Shrestha, Chairperson of Balefi Rural Municipality-8, said that apart from site visits and report preparation by former industry ministers, federal lawmakers and other stakeholders, no tangible progress has been made towards reopening the plant.

The physical infrastructure of the industry has deteriorated significantly. Machinery and equipment used for magnesite production are no longer functional. The DBM furnace area is subsiding, while collection centres and laboratories are falling apart. Structures around the mining site have also been severely damaged.

Of the 51 residential quarters, most are abandoned, though some are currently used by the Armed Police Force and local organisations. The factory buildings continue to decay, and the 10.5-kilometre ropeway from Kharidhunga to Lamosanghu is in a critical condition, with cabins, cables and poles at risk of collapse.

Bikash Shrestha of Tripurasundari Rural Municipality warned that the deteriorating ropeway infrastructure poses a serious risk to life and property, as 87 towers are already bent and close to collapse.

More than 1,000 people lost their jobs when the factory shut down nearly three decades ago. Despite this, 18 employees are still receiving annual salaries and allowances amounting to Rs. 6.1 million.

Locals alleged that valuable materials, including timber, stone, copper wiring and iron, have been secretly sold off over the years. Remaining equipment and parts -- including those at the main plant and mining site, such as bulldozers, tippers and drilling machines -- are rusting and falling into disrepair.

The Government of Nepal holds an 83.33 per cent stake in the industry, with the remaining investment from Orissa Industries and the Khetan Group.

Magnesite deposits in Kharidhunga were first identified in 1970 by an Indian research team, which confirmed the presence of high-quality ore. Subsequent studies by the Department of Mines and Geology verified the findings. A German firm was later assigned to conduct surveys, technical studies and market analysis.

The German team reported reserves of 180 million metric tonnes of magnesite and 300,000 metric tonnes of associated minerals in the Kharidhunga area. It proposed a plant capable of producing 50,000 tonnes of dead-burnt magnesite and 20,000 tonnes of related products annually.

Following this, the government accepted a proposal from Orissa Industries, and an agreement was signed on October 17, 1978. The Nepal Orind Magnesite Pvt. Ltd. was then formally established under the Company Act 1964.","{'https://risingnepaldaily.com/storage/media/101002/conversions/Untitled-1-square-thumb.jpg', 'https://risingnepaldaily.com/storage/media/101000/conversions/Untitled-1-square-thumb.jpg', 'https://risingnepaldaily.com/storage/media/100996/conversions/Untitled-1-original-thumb.jpg', 'https://risingnepaldaily.com/storage/media/101001/conversions/Untitled-1-original-thumb.jpg', 'https://risingnepaldaily.com/storage/media/101008/conversions/edtoril-original-thumb.jpg', 'https://risingnepaldaily.com/storage/media/100997/Untitled-1.jpg', 'https://risingnepaldaily.com/storage/media/101006/conversions/Untitled-1-original-thumb.jpg', 'https://risingnepaldaily.com/storage/media/101006/conversions/Untitled-1-square-thumb.jpg', 'https://risingnepaldaily.com/storage/media/100999/conversions/Untitled-1-square-thumb.jpg', 'https://risingnepaldaily.com/storage/media/101000/conversions/Untitled-1-original-thumb.jpg', 'https://risingnepaldaily.com/storage/media/885/conversions/square-thumb-thumb-thumb.jpg', 'https://risingnepaldaily.com/storage/media/101002/conversions/Untitled-1-original-thumb.jpg', 'https://risingnepaldaily.com/storage/media/100998/conversions/Untitled-1-original-thumb.jpg', 'https://risingnepaldaily.com/commons/rising-logo.png', 'https://risingnepaldaily.com/storage/media/100999/conversions/Untitled-1-original-thumb.jpg', 'https://risingnepaldaily.com/storage/media/101009/conversions/-rajaswo-original-thumb.jpg'}","चित्र कुमार मिजर,सिंधुपाल्चोक, 27 अप्रैल : बलेफी ग्रामीण नगरपालिका-8 मे बहुत दिन स मृत ओरिंड मैग्नेसाइट उद्योग कहियो फेर स काज शुरू करत या नहि, एहि पर एक बेर फेर सवाल उठि रहल अछि, किया कि पिछला 27 साल स इ पूर्ण रूप स बंद अछि।

एक के बाद एक सरकार न॑ बार-बार ई उद्योग क॑ पुनर्जीवित करै के वादा करलकै, आरू वर्तमान प्रशासन न॑ भी कहल॑ छै कि प्रयास चलैलऽ जाय रहलऽ छै । मुदा, कोनो ठोस समय सीमा तय नहि कएल गेल अछि।

25 मार्च 1979 कए लामोसंघू मे स्थापित इ उद्योग 10 दिसंबर 1998 कए बंद भ गेल। 3.59 अरब केरऽ ई उद्योग क॑ एक समय म॑ एशिया केरऽ सबस॑ बड़ऽ मैग्नीसाइट उद्योग मानलऽ जाय छेलै ।

लामोसंघुके ३६४ रोपनी जमीनमे पसरल ई उद्योग दोलखाके भीमेश्वर नगरपालिका–९के खरिढुंगा खदानसँ जुड़ल अछि, जे लगभग ५२०० रोपनीमे अछि । कुल मिला कए एहि परियोजना स जुड़ल 5566 रोपनी जमीन आब परित्यक्त अछि।

1997 तक विभिन्न चुनौती क बीच संचालित रहला क बावजूद तहिया स इ फैक्ट्री बंद अछि। एकरा फेर स खोलबाक कोनो तारीख तय नहि क सकल अछि आ ने संघीय अधिकारी। एखन धरि पुनर्जागरण योजना बहुत हद तक राजनीतिक नारा तक सीमित रहल अछि ।

बलेफी ग्रामीण नगरपालिका–८ के अध्यक्ष रमेश श्रेष्ठ कहलनि जे, पूर्व उद्योग मंत्री, संघीय विधायक आ अन्य सरोकारवाला द्वारा स्थल भ्रमण आ रिपोर्ट तैयार करबाक अतिरिक्त संयंत्र के फेर सं खोलबाक दिशा मे कोनो मूर्त प्रगति नहि भेल अछि।

उद्योग क भौतिक बुनियादी ढांचा काफी खराब भ गेल अछि। मैग्नीसाइट उत्पादन कें लेल उपयोग कैल जाय वाला मशीनरी आ उपकरण आब काज नहि करएयत छै. डीबीएम भट्ठी क्षेत्र कम भ रहल अछि, जखन कि संग्रह केंद्र आ प्रयोगशाला टूटि रहल अछि। खनन स्थल क आसपास क संरचना कए सेहो काफी नुकसान पहुंचल अछि।

51 आवासीय क्वार्टर मे स अधिकतर परित्यक्त अछि, हालांकि किछु क उपयोग एखन सशस्त्र पुलिस बल आ स्थानीय संगठन करैत अछि। फैक्ट्री केरऽ भवनऽ के सड़ना जारी छै, आरू खरिधुंगा स॑ लामोसंघु तलक के १०.५ किलोमीटर के रोपवे केरऽ हालत गंभीर छै, जेकरा म॑ केबिन, केबल आरू खंभा गिरै के खतरा छै ।

त्रिपुरसुन्दरी ग्रामीण नगरपालिका के विकास श्रेष्ठ चेतावनी देलनि अछि जे, बिगड़ैत रोपवे के बुनियादी ढांचा स जान आ संपत्ति के लेल गंभीर खतरा अछि, किया कि 87 टा टावर पहिने स झुकल अछि आ ढहय के करीब अछि।

करीब तीन दशक पहिने जखन इ फैक्ट्री बंद भ गेल छल तखन एक हजार स बेसी लोक क नौकरी चलि गेल। एकर बावजूद 18टा कर्मचारी कए एखनो 100 टका क सालाना वेतन आ भत्ता भेट रहल अछि। 61 लाख के।

स्थानीय लोकक आरोप अछि जे वर्षों स लकड़ी, पाथर, तांबा के तार आ लोहा सहित बहुमूल्य सामग्री गुप्त रूप स बिका गेल अछि। शेष उपकरण आ पार्ट -- जाहि मे मुख्य संयंत्र आ खनन स्थल पर अछि, जेना बुलडोजर, टिपर आ ड्रिलिंग मशीन -- जंग लागि रहल अछि आ खराब भ रहल अछि.

एहि उद्योग मे नेपाल सरकार क 83.33 प्रतिशत हिस्सेदारी अछि, जखन कि शेष निवेश उड़ीसा इंडस्ट्रीज आ खेतन ग्रुप क अछि।

खरिधुंगा म॑ मैग्नेसाइट भंडार के पहचान सबसें पहलऽ १९७० म॑ भारतीय शोध टीम न॑ करलकै, जेकरा म॑ उच्च गुणवत्ता वाला अयस्क के मौजूदगी के पुष्टि करलऽ गेलै । खान आरू भूविज्ञान विभाग केरऽ बाद के अध्ययन स॑ ई निष्कर्ष के सत्यापन करलऽ गेलै । बाद म॑ एगो जर्मन फर्म क॑ सर्वेक्षण, तकनीकी अध्ययन आरू बाजार विश्लेषण करै के काम सौंपलऽ गेलै ।

जर्मन टीम न॑ खरिधुंगा क्षेत्र म॑ १८ करोड़ मीट्रिक टन मैग्नेसाइट आरू ३ लाख मीट्रिक टन संबद्ध खनिज के भंडार के रिपोर्ट देल॑ छै । एहि मे एकटा एहन संयंत्र क प्रस्ताव देल गेल छल जे सालाना 50 हजार टन मृत-जल मैग्नेसाइट आ 20 हजार टन संबंधित उत्पाद क उत्पादन करबा मे सक्षम होए।

एकरऽ बाद सरकार न॑ उड़ीसा इंडस्ट्रीज केरऽ प्रस्ताव क॑ स्वीकार करी लेलकै, आरू १७ अक्टूबर १९७८ क॑ समझौता प॑ हस्ताक्षर करलऽ गेलै ।नेपाल ओरिंड मैग्नेसाइट प्रा. लिमिटेड केरऽ औपचारिक स्थापना कंपनी एक्ट 1964 के तहत करलऽ गेलै ।"
Nepal Weather Forecast: Partial Cloudiness to Moderate Rain Expected - Ratopati,Nepal Weather Forecast: Partial Cloudiness to Moderate Rain Expected  Ratopati,2026-04-27 00:30:10,https://news.google.com/rss/articles/CBMif0FVX3lxTE9wckpfYkNzRndYRlVvRWlpWXIxU1Z4amZTajNVS3ZWUTMwcTFpbjdVV1BlX2VpZ1lqVlE2U0tsdDlpaHgzMGcteGZqT2JfV0Q1UnZvRHBtNzZod0lTNkh5VTFEd0xjbFhISFQ1MkNFVGpyZTZuVlN5VnJ2S0IxWVk?oc=5&hl=en-US&gl=US&ceid=US:en,https://english.ratopati.com,Ratopati,"Kathmandu. There is a possibility of partial cloudiness to moderate cloudiness across the country today. According to the Department of Hydrology and Meteorology, since this morning, the hilly and mountainous regions of the country have generally been cloudy, while the Terai region has been partly cloudy.

There is a possibility of light to moderate rain and snowfall in some places in Koshi, Madhesh, Bagmati, and Gandaki provinces, as well as in the hilly and mountainous regions of Lumbini province and the remaining hilly regions of the country.

In the afternoon, it will generally be cloudy in Koshi, Bagmati, and Gandaki provinces, while it will be partly cloudy in the hilly and mountainous regions of Madhesh province, Lumbini, Karnali, and Sudurpaschim provinces. The weather in the remaining areas will be mostly clear, the department has stated.

In the afternoon, there is a possibility of light to moderate rain and snowfall with thunderstorms in some places in the hilly and mountainous regions of Koshi, Bagmati, and Gandaki provinces, and in the hilly regions of Lumbini province, and one or two places in the mountainous regions of Karnali and Sudurpaschim provinces. Additionally, hot days are possible in the Terai regions of Lumbini and Sudurpaschim provinces.

According to the department, currently, there is a partial influence of westerly winds and local winds, along with a low-pressure area in the lower atmosphere near the eastern parts of the country.

Last night, the hilly and mountainous regions of the country were generally cloudy, and the Terai region was partly cloudy. There was a possibility of light to moderate rain and snowfall in some places in Koshi, Madhesh, Bagmati, and Gandaki provinces, as well as in the hilly and mountainous regions of Lumbini province and the remaining hilly regions of the country.","{'https://npcdn.ratopati.com/media/news/april-26_z6Fq5MHK2N.jpg', 'https://english.ratopati.com/build/img/logo-rp.png', 'https://npcdn.ratopati.com/media/news/lebnon_CDEFil6UjR.jpg', 'https://npcdn.ratopati.com/media/authors/ratopati_science_RGmmSpmAnu.jpg', 'https://npcdn.ratopati.com/media/news/9mmP2oIdNI.jpg', 'https://npcdn.ratopati.com/media/news/villarreal_I0atIEcH4Z.jpg', 'https://npcdn.ratopati.com/media/news/congress-sansadiya-dal_jctqpkyml0_0ekjSkyeVN.jpg', 'https://npcdn.ratopati.com/media/news/sukumbasi-balbalika_VA1z4Kqfv9.jpg', 'https://npcdn.ratopati.com/media/news/ovm4d16mwG.jpg', 'https://npcdn.ratopati.com/media/news/weather-kathmandu_nepal-photo-library-(13)_fRdCb9ktQ4.jpg', 'https://npcdn.ratopati.com/media/news/supreme-phewa_9sG79h31ak.jpg', 'https://rpcdn.ratopati.com/media/albums/forex_TBJOoiTBBY.jpg', 'https://npcdn.ratopati.com/media/news/manohara-sukumbasti-bastima-dozar_npl-(8)-001_6L60Bimb6i.jpg', 'https://npcdn.ratopati.com/media/news/rabi-balen_cbrvjcdhdw.jpg'}","काठमांडू। आइ देश भरि मे आंशिक बादल स मध्यम बादल क संभावना अछि। जल विज्ञान आरू मौसम विभाग के अनुसार आय सुबह स॑ देश केरऽ पहाड़ी आरू पहाड़ी क्षेत्रऽ म॑ सामान्यतः बादल छाए रहलऽ छै, जबकि तराई क्षेत्र म॑ आंशिक रूप स॑ बादल छाए रहलऽ छै ।

कोशी, मधेश, बागमती, आ गण्डकी प्रांतक किछु ठामक संग-संग लुम्बिनी प्रांतक पहाड़ी आ पहाड़ी क्षेत्र आ देशक शेष पहाड़ी क्षेत्र मे हल्का सँ मध्यम वर्षा आ बर्फबारीक संभावना अछि ।

दुपहर मे सामान्यतः कोशी, बागमती, आ गण्डकी प्रांत मे बादल छाएत, जखन कि मधेश प्रांत, लुम्बिनी, कर्णाली, आ सुदुरपश्चिम प्रांतक पहाड़ी आ पहाड़ी क्षेत्र मे आंशिक रूप सँ बादल छाएत। बाकी इलाका के मौसम बेसीतर साफ रहत विभाग के कहनाय अछि.

दुपहर मे कोशी, बागमती, आ गण्डकी प्रांतक पहाड़ी आ पहाड़ी क्षेत्र मे किछु ठाम, आ लुम्बिनी प्रांतक पहाड़ी क्षेत्र मे, आ कर्णाली आ सुदुरपस्चिम प्रांतक पहाड़ी क्षेत्र मे एक-दू ठाम मे हल्का सँ मध्यम वर्षा आ बर्फबारीक संग गरजबाक संभावना अछि । एकरऽ अतिरिक्त लुम्बिनी आरू सुदुरपस्चिम प्रांत केरऽ तराई क्षेत्रऽ म॑ गर्मी के दिन संभव छै ।

विभाग के अनुसार फिलहाल देश के पूर्वी भाग के पास निचला वायुमंडल में कम दबाव वाला क्षेत्र के साथ-साथ पश्चिमी हवा आरू स्थानीय हवा के आंशिक प्रभाव छै ।

काल्हि राति देशक पहाड़ी आ पहाड़ी क्षेत्र मे सामान्यतः बादल छाए रहल छल, आ तराई क्षेत्र मे आंशिक रूप सँ बादल छाए रहल छल । कोशी, मधेश, बागमती, आ गण्डकी प्रांतक किछु ठामक संग-संग लुम्बिनी प्रांतक पहाड़ी आ पहाड़ी क्षेत्र आ देशक शेष पहाड़ी क्षेत्र मे हल्का सँ मध्यम वर्षा आ बर्फबारीक संभावना छल ।"
Nepal’s The Everest Hotel Names Hospitality Veteran Pramod Dashora As The New General Manager - Travel And Tour World,Nepal’s The Everest Hotel Names Hospitality Veteran Pramod Dashora As The New General Manager  Travel And Tour World,2026-04-27 00:40:47,https://news.google.com/rss/articles/CBMi2AFBVV95cUxQMjdyRGRhb3dZNWdjZW1PbnRnM0RyRFFvTmxhd2ZvYjIyVzJZekxJY1RYMXA1N203Z3BGYlpJcHNiLXlSdDJKNXFXYTRhWlBzd1VWczhXSVBxdEFtTG1xcTFaaTZERWQwdms1VVZUcW00cVpPVUFfOG56WWo1TFROZkdoT2NwQng1a29rVFRzcXAwSXZZS0gxV0tWX3d1Q0FGbHl5bDdJQ0s0SHMxb09iZTBNX0V5TXIzY3RhVzBZNTJ2X0gzdjRmWEdwS1poMFlrX0hiMVJ3dDY?oc=5&hl=en-US&gl=US&ceid=US:en,https://www.travelandtourworld.com,Travel And Tour World,,,
