title,description,published date,url,publisher.href,publisher.title,full_article,images,translated
Revive Sick Industries - The Rising Nepal,Revive Sick Industries  The Rising Nepal,2026-04-27 02:15:51,https://news.google.com/rss/articles/CBMiUEFVX3lxTE5RVmtxN0k5cHZkendpMzRpWk56VzhRd3VTaXlhYlFLWXVMV1E4ajZhWWJKQmpLTTFaeDM3d2luUzVjczY0dkZ2bXdELVMxalNk?oc=5&hl=en-US&gl=US&ceid=US:en,https://risingnepaldaily.com,The Rising Nepal,"One factor hindering rapid economic growth in Nepal is the weak industrial base. While some public enterprises are running at loss worth billions of rupees, a number of big industries have been shut down for decades. The country needs to develop heavy or light industries to employ youth who are forced to migrate to foreign nations for better job prospects and study. It is estimated that over 500,000 persons enter the job market annually. But fewer than 100,000 youths can get employment within the country. This is a reason why more than 1,500 people leave for employment abroad daily. Widespread unemployment is the most visible problem arising from the lack of industries. The weak manufacturing has also caused other structural problems in the economy - soaring trade deficit, imbalance in the balance of payments, inadequate revenue collection and low budget for development.





This pessimistic scenario compels us to operate new industries or revive the old ones based on the needs and capacity of the state. Those industries now defunct once ran smoothly, fetching a significant amount of revenues to the country. But mismanagement, overstaffing, trade unionism and political interference led to their collapse. In the recent past, there were some efforts to reopen them but they came a cropper. With the new government in place, initiatives have been taken to this end. According to a news report, published in this daily on Sunday, the Ministry of Finance (MoF) has started conducting detailed audit and property assessment of seven large industries – Udayapur Cement Industry, Gorkahkali Rubber Industry, Janakpur Cigarette Factory (JCF), Nepal Metal Company (NMC), Butwal Spinning Mills (BSM), Hetauda Textile Factory (HTF) and Nepal Orient Magnesite (NOM). It has been suggested to operate them on the public-private partnership (PPP) model.





The authorities have said that mine-based industries such as Udayapur Cement, Orient Magnesite and Nepal Metal have the potential for revival based on the preliminary estimation of the Department of Mines and Geology (DoMG). Likewise, the Ministry of Industry, Commerce and Supplies (MoICS) has selected a consulting firm S. & S. Associates to assess the status of the four industrial establishments – JCF, BSM, NMC and NOM. Each sick industry has its specific problems. For instance, Udayapur Cement Industry that was running intermittently until February this year has been unable to pay the salary of nine months to the staff. Its coal-based technology has obstructed in upgrading production. When the government tried to evaluate property to privatise or run under the PPP model, the locals objected to the move, accusing that it was selling the factory at dirt cheap price.





A lack of modern technology, huge investment and smart management, and old equipment are some immediate issues that must be dealt with. The PPP model has been widely accepted but integrative approach and market assurance are necessary to motivate the prospective investors. One motivating element is the availability of physical infrastructure and land of sick industries. Investors have to spend a huge amount on purchasing land and managing basic industrial facilities. These enterprises hold huge potential to create jobs and substitute imports, thereby minimising the volumes of foreign trade bills. Focus should be on overcoming the maladies that made those industries sick. The present government under Prime Minister Balendra Shah has accorded priority to the domestic industries. During his poll campaign, he had urged the people to consume domestic agro products and promote the national economy. Thus, effective measures need to be taken to revive and run them.","{'https://risingnepaldaily.com/storage/media/101002/conversions/Untitled-1-square-thumb.jpg', 'https://risingnepaldaily.com/storage/media/101008/edtoril.jpg', 'https://risingnepaldaily.com/storage/media/100996/conversions/Untitled-1-original-thumb.jpg', 'https://risingnepaldaily.com/storage/media/100998/conversions/Untitled-1-square-thumb.jpg', 'https://risingnepaldaily.com/storage/media/101001/conversions/Untitled-1-original-thumb.jpg', 'https://risingnepaldaily.com/storage/media/101006/conversions/Untitled-1-original-thumb.jpg', 'https://risingnepaldaily.com/storage/media/101001/conversions/Untitled-1-square-thumb.jpg', 'https://risingnepaldaily.com/storage/media/100999/conversions/Untitled-1-square-thumb.jpg', 'https://risingnepaldaily.com/storage/media/101000/conversions/Untitled-1-original-thumb.jpg', 'https://risingnepaldaily.com/storage/media/885/conversions/square-thumb-thumb-thumb.jpg', 'https://risingnepaldaily.com/storage/media/101002/conversions/Untitled-1-original-thumb.jpg', 'https://risingnepaldaily.com/storage/media/100998/conversions/Untitled-1-original-thumb.jpg', 'https://risingnepaldaily.com/commons/rising-logo.png', 'https://risingnepaldaily.com/storage/media/100997/conversions/Untitled-1-original-thumb.jpg', 'https://risingnepaldaily.com/storage/media/100999/conversions/Untitled-1-original-thumb.jpg', 'https://risingnepaldaily.com/storage/media/101009/conversions/-rajaswo-original-thumb.jpg'}","नेपाल मे तेजी सँ आर्थिक विकास मे बाधा उत्पन्न करयवला एकटा कारक अछि कमजोर औद्योगिक आधार । जतय किछ सार्वजनिक उद्यम अरबों रुपया के घाटा मे चलि रहल अछि त कईटा बड़का उद्योग दशकों सं बंद अछि. देश क॑ भारी या हल्का उद्योग विकसित करै के जरूरत छै ताकि वू युवा सिनी क॑ रोजगार मिल॑ सक॑ जे बेहतर नौकरी के संभावना आरू पढ़ाई लेली विदेशी राष्ट्रऽ म॑ पलायन करै लेली मजबूर होय जाय छै । अनुमान अछि जे सालाना पांच लाख स बेसी लोक नौकरी क बाजार मे प्रवेश करैत छथि। मुदा देश के भीतर एक लाख सं कम युवा के रोजगार मिल सकैत अछि. इ एकटा कारण अछि जे रोजाना 1500 स बेसी लोक विदेश मे रोजगार क लेल निकलैत छथि। उद्योगक अभाव मे व्यापक बेरोजगारी सबसँ बेसी देखबा मे आबि रहल समस्या अछि । कमजोर विनिर्माण के कारण अर्थव्यवस्था म॑ अन्य संरचनात्मक समस्या भी पैदा होय गेलऽ छै - बढ़तऽ व्यापार घाटा, भुगतान संतुलन म॑ असंतुलन, अपर्याप्त राजस्व संग्रह आरू विकास लेली कम बजट ।





ई निराशावादी परिदृश्य हमरा सब क॑ राज्य केरऽ जरूरत आरू क्षमता के आधार प॑ नया उद्योग चलाबै या पुरानऽ उद्योग क॑ पुनर्जीवित करै लेली मजबूर करै छै । आब मृत भ गेल ओ उद्योग कहियो सुचारू रूप स चलैत छल, जाहि स देश कए काफी राजस्व भेटैत छल। लेकिन कुप्रबंधन, अधिक कर्मचारी, ट्रेड यूनियनवाद आरू राजनीतिक हस्तक्षेप के कारण एकरऽ पतन होय ​​गेलै । हाल के अतीत में एकरा सब के फेर स खोलय के किछ प्रयास भेल छल मुदा ओ सब एकटा क्रॉपर आबि गेल छल. नव सरकार बनला स एहि लेल पहल कैल गेल अछि। रविदिन एहि दैनिक मे प्रकाशित एकटा समाचार रिपोर्ट के अनुसार वित्त मंत्रालय सात पैघ उद्योग – उदयपुर सीमेंट उद्योग, गोरकहकाली रबर उद्योग, जनकपुर सिगरेट फैक्ट्री (जेसीएफ), नेपाल मेटल कंपनी (एनएमसी), बुटवाल स्पिनिंग मिल्स (बीएसएम), बुटवाल हेतुडा टेक्सटाइल फैक्टरी (एचटीएफ) के विस्तृत लेखा परीक्षा आ संपत्ति आकलन करय लागल अछि। आ नेपाल ओरिएंट मैग्नेसाइट (एनओएम)। एकरा पब्लिक-प्राइवेट पार्टनरशिप (पीपीपी) मॉडल पर संचालित करय कें सुझाव देल गेल छै.





खदान आ भूविज्ञान विभाग (डीओएमजी) के प्रारंभिक अनुमान के आधार पर उदयपुर सीमेंट, ओरिएंट मैग्नेसाइट आ नेपाल मेटल जेहन खदान आधारित उद्योग के पुनर्जागरण के संभावना रहल अधिकारी सब कहलनि अछि। तहिना उद्योग, वाणिज्य आ आपूर्ति मंत्रालय (एमओआईसीएस) चारि औद्योगिक प्रतिष्ठान – जेसीएफ, बीएसएम, एनएमसी आ एनओएम क स्थिति क आकलन करबा लेल एकटा परामर्शदात्री फर्म एस एंड एस एसोसिएट्स क चयन केलक अछि। प्रत्येक बीमार उद्योग के अपन विशिष्ट समस्या होइत छैक। जेना कि उदयपुर सीमेंट उद्योग जे एहि साल फरवरी तक रुक-रुक कए चलि रहल छल, ओ कर्मचारी कए नौ मास क वेतन नहि द सकल अछि। एकर कोयला आधारित तकनीक उत्पादन कए उन्नयन मे बाधा पहुंचेलक अछि। सरकार जखन संपत्ति कए निजीकरण करबा लेल या पीपीपी मॉडल क तहत चलाबय लेल मूल्यांकन करबाक कोशिश केलक त स्थानीय लोक एहि कदम पर आपत्ति जतौलथि आ आरोप लगौलथि जे ओ कारखाना कए गंदगी सस्ते दाम पर बेच रहल अछि।





आधुनिक तकनीक के कमी, भारी निवेश आ स्मार्ट मैनेजमेंट, आ पुरान उपकरण किछु तत्काल मुद्दा अछि जेकरा सं निपटय पड़त. पीपीपी मॉडल कें व्यापक रूप सं स्वीकार कैल गेल छै मुदा संभावित निवेशक कें प्रेरित करय कें लेल एकीकृत दृष्टिकोण आ बाजार आश्वासन आवश्यक छै. एकटा प्रेरक तत्व छै भौतिक बुनियादी ढाँचा आ बीमार उद्योगक कें जमीन कें उपलब्धता. निवेशक कए जमीन खरीदबा आ बुनियादी औद्योगिक सुविधा क प्रबंधन पर भारी राशि खर्च करय पड़ैत अछि। ई उद्यमऽ म॑ रोजगार पैदा करै आरू आयात के जगह लेबै के भारी संभावना छै, जेकरा स॑ विदेशी व्यापार बिल केरऽ मात्रा कम स॑ कम होय जाय छै । ओहि उद्योग सभ के बीमार करय वाला बीमारी सं उबरय पर ध्यान देल जेबाक चाही. प्रधानमंत्री बलेन्द्र शाह क नेतृत्व मे वर्तमान सरकार घरेलू उद्योग कए प्राथमिकता देलक अछि। चुनाव प्रचार के दौरान ओ जनता स घरेलू कृषि उत्पाद क उपभोग आ राष्ट्रीय अर्थव्यवस्था कए बढ़ावा देबाक आग्रह केने छलाह। एहि तरहें एकरा पुनर्जीवित आ चलाबए लेल प्रभावी उपाय करबाक जरूरत अछि।"
