title,description,published date,url,publisher.href,publisher.title,full_article,images,translated
8 killed in pro-Iran protest at US consulate in Pakistan’s Karachi - Nepal News | Nepal's First Online News Portal,8 killed in pro-Iran protest at US consulate in Pakistan’s Karachi  Nepal News | Nepal's First Online News Portal,2026-03-01 12:35:51,https://news.google.com/rss/articles/CBMisgFBVV95cUxOc1dXVEhNLTJUR0FBb1BvbENEZHRoeEFCTThfeVJpVkRJa2Y5VURvNVRRTjNJcDktSm9hZndCdVhmVkh0TEdWa2JPNnVHRWlNc1RaaEZBODJPeTdkdWJFVTN6T3dqa1h4V2xnZ2daMXpRLVA0ZFFHY1RzcEtFd21rZmFEWk5MVldqeWhxNHdwUjhXeHNFUUFERFFIRTFyaEtSM1oxekFDTWR5aDQ5QVB4eERR?oc=5&hl=en-US&gl=US&ceid=US:en,https://english.nepalnews.com,Nepal News | Nepal's First Online News Portal,"KARACHI: At least eight people were killed during pro-Iran protests at the United States consulate in the Pakistan megacity of Karachi on Sunday, a rescue service spokesman told AFP.

“We have moved at least eight dead bodies to Karachi’s civil hospitals, while 20 others were injured in the consulate incident,” said Muhammad Amin, a spokesman for the Edhi Foundation rescue service, adding most had bullet wounds.

Hundreds of pro-Iranian protesters tried to storm the consulate following the US-Israel strikes on Iran, an AFP journalist saw.

A crowd of young people climbed over the main gate and gained access to the driveway of the consular building, smashing some windows.

Police fired tear gas at the protesters who dispersed, the AFP journalist saw.

Videos on social media showed youngsters smashing the windows of the main building of the consulate as the American flag could be seen flying over the compound, whose perimeter is topped with barbed wire.

“We need to remain united. No power can stop us,” a young protester could be heard saying.

“We are setting the American consulate in Karachi on fire. God willing, we are avenging the killing of our leader,” another protester said as he filmed others trying to start a blaze.

Thousands of people are also taking to the streets in the eastern city of Lahore and in northern Skardu, with a demonstration expected in the afternoon near the diplomatic enclave housing the US embassy in Islamabad.","{'https://english.nepalnews.com/wp-content/uploads/2026/03/IRANNNN.jpeg', 'https://english.nepalnews.com/wp-content/uploads/2026/03/DOHA.jpeg', 'https://english.nepalnews.com/wp-content/uploads/2026/03/iran.jpeg', 'https://english.nepalnews.com/wp-content/uploads/2026/03/BLAST.jpeg', 'https://english.nepalnews.com/wp-content/uploads/2026/03/irann.jpeg', 'https://english.nepalnews.com/wp-content/uploads/2025/01/Nepal-news-white.png', 'https://english.nepalnews.com/wp-content/uploads/2025/01/cloudy-day.png', 'https://english.nepalnews.com/wp-content/uploads/2026/03/karachi.png', 'https://english.nepalnews.com/wp-content/uploads/2025/01/air-quality.png', 'https://english.nepalnews.com/wp-content/uploads/2025/01/direct-flight.png', 'https://english.nepalnews.com/wp-content/uploads/2026/02/america-1.webp', 'https://english.nepalnews.com/wp-content/uploads/2026/03/IAEA.jpg', 'https://english.nepalnews.com/wp-content/uploads/2025/01/close.png', 'https://english.nepalnews.com/wp-content/uploads/2025/01/gold.png', 'https://english.nepalnews.com/wp-content/uploads/2026/03/inbound7922411986294486180.jpg', 'https://english.nepalnews.com/wp-content/uploads/2025/01/change.png'}","कराची : बचाव सेवा केरऽ प्रवक्ता न॑ एएफपी क॑ बतैलकै कि रविवार क॑ पाकिस्तान केरऽ मेगासिटी कराची म॑ अमेरिका केरऽ वाणिज्य दूतावास म॑ ईरान समर्थक विरोध प्रदर्शन के दौरान कम स॑ कम आठ लोगऽ के मौत होय गेलै ।

एधी फाउंडेशन केरऽ बचाव सेवा केरऽ प्रवक्ता मुहम्मद अमीन न॑ कहलकै कि हम्में कम स॑ कम आठ मृत शरीर क॑ कराची केरऽ सिविल अस्पताल म॑ पहुँचाय देल॑ छियै, जबकि वाणिज्य दूतावास केरऽ घटना म॑ २० लोग घायल होय गेलऽ छै ।

एएफपी केरऽ एगो पत्रकार न॑ देखलकै कि ईरान प॑ अमेरिका-इजरायल केरऽ हमला के बाद सैकड़ों ईरानी समर्थक प्रदर्शनकारी न॑ वाणिज्य दूतावास प॑ हमला करै के कोशिश करलकै ।

युवा सब के भीड़ मुख्य गेट के ऊपर चढ़ि गेल आ किछु खिड़की तोड़ि क कांसुलर भवन के ड्राइववे तक पहुंच भ गेल।

एएफपी के पत्रकार देखलक जे पुलिस तितर-बितर भेल प्रदर्शनकारी पर आंसू गैस के गोली चला देलक।

सोशल मीडिया पर वीडियो में देखल गेल अछि जे युवा सब वाणिज्य दूतावास के मुख्य भवन के खिड़की तोड़ि रहल छल, कियाकि अमेरिकी झंडा परिसर के ऊपर उड़ैत देखल जा सकैत छल, जेकर परिधि के ऊपर कांटेदार तार लागल अछि।

एकटा युवा प्रदर्शनकारी कहैत सुनल जा सकैत छल जे, हमरा सब कए एकजुट रहबाक जरूरत अछि, कोनो सत्ता हमरा सब कए नहि रोकि सकैत अछि।

एकटा आओर प्रदर्शनकारी आगि लगाबय के कोशिश मे दोसर लोक के फिल्मांकन करैत कहलनि जे, हम कराची मे अमेरिकी वाणिज्य दूतावास मे आगि लगा रहल छी, भगवान चाहथि जे हम अपन नेता के हत्या के बदला ल रहल छी।

पूर्वी शहर लाहौर आरू उत्तरी स्कारडू म॑ भी हजारों लोग सड़कऽ प॑ उतरी रहलऽ छै आरू इस्लामाबाद म॑ अमेरिकी दूतावास केरऽ कूटनीतिक एन्क्लेव के पास दुपहर म॑ प्रदर्शन के उम्मीद छै ।"
Nepal polls: Border to remain sealed for 4 days from today - The Times of India,Nepal polls: Border to remain sealed for 4 days from today  The Times of India,2026-03-01 12:50:00,https://news.google.com/rss/articles/CBMiygFBVV95cUxOajlCWFFEZTR6djdldHVSNXdFRlg5bmdKUVJRNFdYTnkzS2FudG5aamVsNW1FTm5OUmNoenBvNTV1MTh2eDdvU0hpN25hbWMyZl9UVGFnNzJJaU1nRm5xRDU5cUdyZHdkdzRlbFI4Y3hRRk1NOHJCZmxTOVdpcC1ZWUdSUFR5UWxtV0pEOGhHOGNtRzc2UEs5UjB0YjRqRVdzcjJKNjhYQVh5LTRHY1NfY3drSHNha2JBWkVMLWJBZDdRXzlLdkNUQ0FR0gHPAUFVX3lxTE9CR3UxRGdETjMzNkdmamFWMXh1ZjA2RTVGTkdhYUo1NG9HbGZPVXdQSndadks4T0UweWUtUVlzODl3b1Q5Z1hsUVlFSVY3ZHJGQzA0R3A2aGtpVGJDQnhOb0xEMkszWDFwbjV0dHA5WEVTUmk5eVdyR253VWxQM215VFpfOVBLb3ZRZFVxNWdKVDdhc096UDhBUnZFOVI2dVphNTFiMXh1WEpRLUpBV3U2Q2thaGtCa2pieWhRZjF5QTV1aVZKRGJfSEtzM0NJYw?oc=5&hl=en-US&gl=US&ceid=US:en,https://timesofindia.indiatimes.com,The Times of India,"Associated with TOI for the last 25 years. A postgraduate in Political Science from BRA BU Muzaffarpur, I cover India-Nepal border news and activities of cross-border smuggling of arms, fake currency and narcotics, Integrated custom check post, Terrorist activities, college and university news, Civic, cultural affairs, flood and drought, agriculture news, Irrigation system, sports and other spot news. Read More","{'https://static.toiimg.com/photo/118390705.cms', 'https://www.facebook.com/tr?id=593671331875494&ev=PageView&noscript=1', 'https://static.toiimg.com/photo/92222747.cms', 'https://static.toiimg.com/photo/113254487.cms', 'https://static.toiimg.com/thumb/msid-128916064,imgsize-434796,width-400,height-225,resizemode-72/128916064.jpg', 'https://static.toiimg.com/thumb/msid-128916064,width-1280,height-720,imgsize-434796,resizemode-6,overlay-toi_sw,pt-32,y_pad-600/photo.jpg', 'https://static.toiimg.com/photo/83033472.cms', 'https://static.toiimg.com/photo/122244803.cms'}","पिछला 25 साल स टीओआई स जुड़ल। बीआरए बीयू मुजफ्फरपुर स राजनीति विज्ञान मे स्नातकोत्तर, हम भारत-नेपाल सीमा पार स हथियार, नकली मुद्रा आ मादक पदार्थ क तस्करी क गतिविधि, एकीकृत कस्टम चेक पोस्ट, आतंकवादी गतिविधि, कॉलेज आ विश्वविद्यालय क समाचार, नागरिक, सांस्कृतिक मामला, बाढ़ आ सूखा, कृषि समाचार, सिंचाई व्यवस्था, खेल आ अन्य स्पॉट समाचार कवर करैत छी। और पढ़ें"
