title,description,published date,url,publisher.href,publisher.title,full_article,images,translated
NEPAL: ‘Voting on Discord Was a Very Gen Z Way of Doing Politics’ - ipsnews.net,NEPAL: ‘Voting on Discord Was a Very Gen Z Way of Doing Politics’  ipsnews.net,2026-04-24 04:12:46,https://news.google.com/rss/articles/CBMimwFBVV95cUxOX3dWSFotZ3F6N1BjVlBNaDBKSXZ3RV9ZZ0NEZFR2QUZ3dXFud2RJS0tTdkZSX1Jzb2xBNmI5SVFheEkzLXpyY0M0cks1UmtkX2ZqVU8wQXBTcl8wMmlIdkV5N2dWb09IaVhZQ0s2WTRXdVpsVFp6NWJfQ2E0TmlTQWIyWXU0dVFUU1dWREtZelNaOThuY3RGaVpQUQ?oc=5&hl=en-US&gl=US&ceid=US:en,https://www.ipsnews.net,ipsnews.net,"Active Citizens, Asia-Pacific, Civil Society, Crime & Justice, Democracy, Development & Aid, Economy & Trade, Featured, Freedom of Expression, Headlines, Human Rights, Migration & Refugees, TerraViva United Nations

NEPAL: ‘Voting on Discord Was a Very Gen Z Way of Doing Politics’

By CIVICUS Reprint | | Print |

Apr 24 2026 (IPS) -

CIVICUS discusses Gen Z-led protests in Nepal with Abhijeet Adhikari (Abhi), a lawyer and political activist who took part in the protests.



Abhijeet Adhikari

What drove young people onto the streets, and what were their demands?

Since this protest was decentralised, there was no uniform agenda but rather a pile of frustrations with the workings of the political system.

A decade ago, Nepal introduced a new federal democratic constitution that people saw as a new beginning that would lead to development and better living conditions. But politicians didn’t live up to those aspirations and instead played a game of musical chairs with the post of prime minister, with a few politicians from the three biggest political parties taking turns and not allowing new parties or people in their own parties to rise against them. There was no clear separation between government and opposition, and five or six governments would rotate in quick succession during one parliamentary term. It was hard to hold anybody accountable.

Nepal’s economy is highly dependent on remittances sent by migrant workers, and following high school, every young person thinks about where to go to find a job or a better life. This went on for years, and frustration with politicians who only thought about their own benefit continued to accumulate.

The trigger was the government social media ban. Following a trend in Bangladesh and Sri Lanka, young people had started comparing their lives with those of politicians’ kids, and a trend called ‘nepokids’ exposing their lavish lifestyle went viral on TikTok. It seems that security agencies advised the then-prime minister that things might get out of control, so he decided to ban the platforms. He didn’t realise our generation was born with the internet and social media, meaning we know how to use VPNs to access the web. The ban only added another layer of frustration at not being able to express our frustration.

Once we were on the streets, we organised our demands. The first was the reversal of the social media ban. The second was an end to the musical chairs game between top-tier politicians. And the third was reform of the Commission for Investigation of Abuse of Authority, the institution that deals with corruption.

We tried to put all of this in language young people would connect with. We used AI tools to generate Gen Z-friendly slogans, such as ‘delete corruption’ and ‘stop putting filters on our democracy’. People also brought anime-inspired posters, particularly One Piece characters. The whole aesthetic was very uniquely Gen Z.

How did events unfold on 8 and 9 September?

We gathered at Maitighar Mandala, a symbolic monument located in the heart of Kathmandu, and planned to march to the Everest Hotel, which is the closest you could get to the parliament building, as the streets beyond the hotel were blocked. When we arrived, we were surprised there were very few security personnel there. We didn’t know that earlier, people had come towards parliament from various sides, with electric fence-cutting machines and kerosene. A few violent groups pushed the crowd towards restricted areas. The police, who weren’t prepared to handle the crowds, panicked and started shooting at protesters. Within four hours, they killed 19 people, including children, some of them in their school uniforms.

Before the protest, there had been rumours of international rules prohibiting shooting at people in school uniforms, and many people thought that if students marched in front, police wouldn’t shoot at them. That sadly wasn’t the case.

The next day, people took to the streets again, and some opportunist groups did too. Someone put up a website with politicians’ home addresses, and mobs marched to their homes and set them on fire. They also burned down government buildings, including parliament, executive offices and the Supreme Court.

The prime minister resigned and protesters pushed for the dissolution of parliament, which the president then did. Following further pressure on social media and in critical circles, a retired Supreme Court judge was brought in as transitional prime minister. Even though this was not the constitutional process, people accepted it as a temporary solution to regain political stability, and it was this prime minister who paved the way to a peaceful and fair election.

How were the protests organised, and what role did social media play?

Protests were decentralised. Two Discord channels were used, which no longer exist because all those violent plans, arson included, were discussed there. But only around 2,000 people were on Discord before the protest, and many more groups joined spontaneously. Those who were already activists posted about the protests on social media.

Some of us joined as a group, and thought we were at the centre of it, but when we reached Maitighar, we felt like drops in the ocean. It was a massive protest, and we didn’t know who was leading it.

The day before, we had got together and planned, and many other groups did the same. We shared the call through Instagram and TikTok. Some went to schools and asked school departments to give a half-day waiver so students could join.

After the protest, the Discord channel grew to around 10,000 people, who started voting on Discord for who should become prime minister. The person who received the most votes on Discord eventually became prime minister. It was a very Gen Z way of doing politics.

However, I think ‘youth-led’ would be a more appropriate label than Gen Z protest. Gen Z might be accurate from the perspective of social media driving it. But while people in the city who have access to the internet may have Gen Z characteristics, the same age group in rural Nepal may not fit the description.

What risks did you and other protesters face?

On the first day, when we reached the Everest Hotel and saw the crowd push further, I was aware I should not go beyond that point. But when we heard on social media that people were entering the parliament building, we ran through another alley. A special task force police officer, there to guard the parliament building, loaded his gun and pointed it directly at me. But he didn’t fire.

After the protest turned violent, the police searched every place where protesters could be hiding, taking people out and beating them. From around noon un late night, eight or nine of us hid in a cubicle. It was dangerous to go back home, because there were lots of police in civilian clothes on the streets. During those two or three days when the army had effectively taken over and there was no functioning government, we had reason to believe our phones were being monitored.

Now there are people in prison and facing criminal charges for throwing stones or making TikTok content while the parliament building was burning. But those who manipulated the crowds and instigated violence supposedly in the name of the movement do not seem to be facing consequences.

How has the movement organised since the protests?

After the protest, people from different circles started forming their own Gen Z groups. There are over 40 now. A few of them, including Gen Z Alliance, Gen Z Civic Forum and Gen Z Front, are still active. Some have remained informal, some have registered as non-governmental organisations and some have formed political parties, although they didn’t receive a significant share of the vote. These are the ones who positioned themselves as guardians of the Gen Z movement, but not in terms of the aspirations and values we actually had.

People continue to take to the streets because the Karki Commission, formed to investigate who is responsible for the 19 deaths on 8 September and for the arson and vandalism on 9 September, has submitted a huge report, but the government has not yet released it. This has happened before: in the 1990s, when democracy was restored, a similar committee, the Malik Commission, produced a similar report that was never made public. In the 2006 transition, the report by the Rayamajhi Commission wasn’t made public either. People won’t have it again and are demanding transparency.

What did the protests achieve, and what lessons have you taken from them?

I believe more in institutions and processes than in charismatic figures and results. So I think it would have been best not to dissolve parliament. By the second day of protests, we could have pushed for any law we wanted, because parliamentarians’ morale was so low that they would have agreed to almost anything protesters demanded. Instead, we demanded the dissolution of parliament.

Negotiations should have been held mostly by the president’s office as the only legitimate institution after the prime minister’s resignation, but instead, the army dominated negotiations. That was another blunder. The negotiation process itself should have been taken into public discussion. After that, the focus should have been on reforming the party system and making the system more accountable, but instead, we thought everything would change if new people were brought in. The problem is that the new will eventually become old, and any new party that doesn’t create radically different structures will end up like the old political parties.

I also think that when it comes to protest, organised leadership is best, because in decentralised structures no one can be held accountable if things go wrong. Also, they allow people to push their own agendas and the real demands of protests risk being lost.

Additionally, I am concerned that while bottom-up protests arising from rural areas may produce more inclusive and progressive results, urban-centred protests arising in reaction to governance failure and lack of economic opportunity may end up leading to polarisation and the rise of authoritarian figures. After this protest, political dynamics have shifted towards delivery. People have started demanding meritocracy, forgetting all about inclusion. Even if this government successfully delivers on people’s aspirations, it could be like the government in India, providing good infrastructure but dismantling political institutions, disrupting the social fabric and promoting religious extremism.

How do you see the future of Nepal’s democracy?

Right now, people have put their expectations and trust in a single person, while trust in institutions is shrinking by the day. Even civil society has lost credibility. Two decades ago, civil society was at the forefront of the change that took Nepal from monarchy to republic. But gradually, civil society leaders have been discredited. Civil society is mostly a launching pad for politics; people don’t remain there for long. Most prominent civil society leaders have become members of parliament for one party or another.

If this government fails, people will start thinking about bringing back the old monarch. Authoritarian nostalgia will take over. I am also concerned about political radicalisation taking on ethnic or religious dimensions, particularly given the fundamentalist elements active along the border with India.

As for the protests, I think the government will continue to allow people to come out in the street, but it won’t listen to our demands.

CIVICUS interviews a wide range of civil society activists, experts and leaders to gather diverse perspectives on civil society action and current issues for publication on its CIVICUS Lens platform. The views expressed in interviews are the interviewees’ and do not necessarily reflect those of CIVICUS. Publication does not imply endorsement of interviewees or the organisations they represent.

GET IN TOUCH

LinkedIn

Twitter

SEE ALSO

Gen Z protests: new resistance rises CIVICUS | State of Civil Society Report 2026

Nepal’s Gen Z electoral revolution CIVICUS Lens 19.Mar.2026

Nepal’s Gen Z uprising: time for youth-led change CIVICUS Lens 10.Oct.2025

Follow @IPSNewsUNBureau

!function(d,s,id){var js,fjs=d.getElementsByTagName(s)[0],p=/^http:/.test(d.location)?'http':'https';if(!d.getElementById(id)){js=d.createElement(s);js.id=id;js.src=p+'://platform.twitter.com/widgets.js';fjs.parentNode.insertBefore(js,fjs);}}(document, 'script', 'twitter-wjs');","{'https://www.ipsnews.net/wp-content/themes/ipsnews/images/social-tw.png', 'https://www.ipsnews.net/Library/2026/04/Abhijeet-Adhikari.jpg', 'https://www.facebook.com/tr?id=410340352767201&ev=PageView&noscript=1', 'https://www.facebook.com/tr?id=443189699154214&ev=PixelInitialized', 'https://www.ipsnews.net/wp-content/themes/ipsnews/images/tria.png', 'http://www.ipsnews.net/Library/2020/11/instagram-logo-ipsnewsunbureau_3_.jpg', 'https://www.ipsnews.net/Library/2026/04/Photo-7-100x100.jpg', 'https://www.ipsnews.net/wp-content/themes/ipsnews/images/feed.png', 'https://www.ipsnews.net/wp-content/themes/ipsnews/images/social-fb.png', 'https://www.ipsnews.net/wp-content/themes/ipsnews/images/logo-IPS.png', 'https://ipsnews.net/img/transparente.gif', 'https://www.ipsnews.net/Library/2026/04/bluesky_44.jpg', 'https://www.ipsnews.net/Library/2026/04/DSN4899-100x100.jpg', 'https://www.ipsnews.net/Library/2026/04/AU-Africa-100x100.jpeg'}","सक्रिय नागरिक, एशिया-प्रशांत, नागरिक समाज, अपराध एवं न्याय, लोकतंत्र, विकास एवं सहायता, अर्थव्यवस्था एवं व्यापार, विशेष रुप से प्रदर्शित, अभिव्यक्ति की स्वतंत्रता, शीर्षक, मानव अधिकार, प्रवास एवं शरणार्थी, टेराविवा संयुक्त राष्ट्र |

नेपाल : ‘विसंगति पर मतदान राजनीति करबाक एकटा बहुत जेन जेड तरीका छल’

CIVICUS द्वारा पुनर्मुद्रण | | प्रिंट |

२४ अप्रैल २०२६ (आईपीएस) - २.

सिविकस नेपालमे जेन जेड नेतृत्वक विरोध प्रदर्शनमे सहभागी भेल वकील आ राजनीतिक कार्यकर्ता अभिजीत अधिकारी (अभि)सँग चर्चा करैत अछि ।



अभिजीत अधिकारी

युवा सब के सड़क पर की धकेल देलक, आ ओकर की मांग छल?

चूँकि ई विरोध विकेंद्रीकृत छल, एक समान एजेंडा नहि छल बल्कि राजनीतिक व्यवस्था के कामकाज सं कुंठा के ढेर छल.

एक दशक पहिने नेपाल एकटा नव संघीय लोकतान्त्रिक संविधान के प्रवर्तन केलक जेकरा लोक एकटा नव शुरुआत के रूप में देखैत छल जे विकास आ बेहतर जीवन के स्थिति के ओर ल जायत। मुदा राजनेता ओहि आकांक्षा पर खरा नहि उतरलाह आ ओकर बदला मे प्रधानमंत्री पद के संग संगीत के कुर्सी के खेल खेललखिन्ह, जाहि मे तीनू बड़का राजनीतिक दल के किछ राजनेता बारी-बारी सं नवका पार्टी या अपन पार्टी के लोक के हुनका खिलाफ उठय नहि देलखिन्ह. सरकार आ विपक्ष मे कोनो स्पष्ट अलगाव नहि छल आ एक संसदीय कार्यकाल मे पांच-छहटा सरकार त्वरित उत्तराधिकार मे घुमैत छल । ककरो जवाबदेही देब कठिन छल।

नेपाल केरऽ अर्थव्यवस्था प्रवासी मजदूरऽ द्वारा भेजलऽ गेलऽ रेमिटैंस प॑ बहुत निर्भर छै, आरू हाई स्कूल के बाद हर युवा ई सोचै छै कि नौकरी या बेहतर जीवन खोजै लेली कत॑ जाय सकै छै । ई बात सालों धरि चलैत रहल, आ केवल अपन फायदा के बारे में सोचय वाला राजनेता सब सं कुंठा जमा होइत रहल.

एकर ट्रिगर छल सरकारी सोशल मीडिया बैन। बांग्लादेश आरू श्रीलंका म॑ एगो ट्रेंड के बाद युवा सिनी न॑ अपनऽ जीवन के तुलना राजनीतिज्ञऽ के बच्चा सिनी स॑ करना शुरू करी देल॑ छेलै, आरू टिकटोक प॑ हुनकऽ भव्य जीवनशैली क॑ उजागर करै वाला ‘नेपोकिड्स’ नाम केरऽ एगो ट्रेंड वायरल होय गेलै । लगैत अछि जे सुरक्षा एजेंसी तत्कालीन प्रधानमंत्री कए सलाह देलक जे भ सकैत अछि जे हालात बेकाबू भ जाए, ताहि लेल ओ एहि प्लेटफार्म पर रोक लगेबाक फैसला केलथि। हुनका ई नहि बुझल छलनि जे हमर पीढ़ी इंटरनेट आ सोशल मीडिया के संग पैदा भेल अछि, मतलब हमरा सभ के वेब तक पहुंचय लेल वीपीएन के इस्तेमाल करय के तरीका पता अछि. प्रतिबंध मात्र एकटा आओर कुंठाक परत जोड़लक जे हमरा लोकनिक कुंठा नहि व्यक्त क सकलहुं।

एक बेर सड़क पर आबि गेलौं त अपन मांग के संगठित केलहुं। पहिल छल सोशल मीडिया बैन कए उलटब। दोसर छल शीर्ष स्तर के राजनेता के बीच संगीत के कुर्सी के खेल के अंत. आरू तेसरऽ छेलै कमीशन फॉर इन्वेस्टिगेशन ऑफ एब्यूज ऑफ अथॉरिटी म॑ सुधार, जे भ्रष्टाचार स॑ निपटै वाला संस्था छेकै ।

हम सब कोशिश केलहुं जे एहि सब कए ओहि भाषा मे राखल जाए जाहि स युवा जुड़त। हम एआई टूल के उपयोग जेन जेड के अनुकूल नारा पैदा करय लेल केलहुं, जेना ‘भ्रष्टाचार के हटाउ’ आ ‘हमर लोकतंत्र पर फिल्टर लगाबय बंद करू’. लोक एनीमे सं प्रेरित पोस्टर सेहो ल क आयल छल, खास क वन पीस के पात्र. पूरा सौंदर्यशास्त्र बहुत विशिष्ट छल जेन जेड।

8 आ 9 सितम्बर के आयोजन कोना भेल?

काठमांडूक बीचोबीच अवस्थित प्रतीकात्मक स्मारक मैतीघर मंडलामें जमा भेल रही आ होटल सं आगूक सड़क जाम रहबाक कारणे संसद भवनक सब सं नजदीक एवरेस्ट होटल धरि मार्च करबाक योजना बनौलहुं. जखन पहुँचलौं त आश्चर्य भेल जे ओतय सुरक्षाकर्मी बहुत कम छल। हमरा लोकनि केँ ई नहि बुझल छल जे पहिने लोक विभिन्न कात सँ संसद दिस आबि गेल छल, इलेक्ट्रिक बाड़ि काटय बला मशीन आ मट्टी तेल ल’ क’. किछु हिंसक समूह भीड़ के प्रतिबंधित क्षेत्र दिस धकेल देलक। भीड़ के संभाल’ लेल तैयार नहि पुलिस घबरा गेल आ प्रदर्शनकारी पर गोली चलाब’ लागल. चारि घंटा के भीतर बच्चा सहित 19 लोक के हत्या क देलक, जाहि मे किछ स्कूल के वर्दी मे छल।

विरोध प्रदर्शन स’ पहिने अंतरराष्ट्रीय नियम मे स्कूली वर्दी मे लोक पर गोलीबारी पर रोक लगेबाक अफवाह छल, आ बहुत लोक के लागल जे जँ छात्र आगू मार्च करत त’ पुलिस हुनका पर गोली नहि चलाओत. दुखक बात ई जे एहन नहि छल.

दोसर दिन फेर लोक सड़क पर उतरि गेल, आ किछु अवसरवादी समूह सेहो। कियो राजनेता लोकनिक घरक पता पर वेबसाइट लगा देलक, आ भीड़ अपन घर पर मार्च क’ क’ आगि लगा देलक. संसद, कार्यपालिका कार्यालय आ सुप्रीम कोर्ट सहित सरकारी भवन सेहो जरा देलक।

प्रधानमंत्री इस्तीफा द देलखिन्ह आओर प्रदर्शनकारी संसद के भंग करय के लेल धक्का देलखिन्ह, जे राष्ट्रपति तखन केलनि. सोशल मीडिया आरू आलोचनात्मक हलका म॑ आरू दबाव के बाद सुप्रीम कोर्ट केरऽ एगो सेवानिवृत्त न्यायाधीश क॑ संक्रमणकालीन प्रधानमंत्री के रूप म॑ लानलऽ गेलै । भले ही ई संवैधानिक प्रक्रिया नै छेलै, लेकिन लोगऽ न॑ एकरा राजनीतिक स्थिरता वापस पाबै के अस्थायी समाधान के रूप म॑ स्वीकार करी लेलकै, आरू ई प्रधानमंत्री ही शांतिपूर्ण आरू निष्पक्ष चुनाव के रास्ता प्रशस्त करलकै ।

विरोध प्रदर्शन के आयोजन कोना भेल, आ सोशल मीडिया के की भूमिका छल?

विरोध विकेन्द्रीकृत भेल। दू टा डिस्कॉर्ड चैनल के प्रयोग भेल, जे आब नहिं अछि, कारण ओहि सब हिंसक योजना पर, आगजनी सहित, ओतय चर्चा भेल छल. मुदा विरोध प्रदर्शन सं पहिने मात्र करीब 2000 लोक डिस्कॉर्ड पर छलाह, आओर कतेको आओर समूह अनायास एहि मे शामिल भ गेल. जे पहिने सं कार्यकर्ता छलाह ओ सोशल मीडिया पर विरोध प्रदर्शन के बारे मे पोस्ट केलनि.

किछु गोटे ग्रुप के रूप में ज्वाइन केलहुं, आ सोचल जे हम सब एकर केंद्र में छी, मुदा मैतीघर पहुंचला पर हमरा सब के समुद्र में बूंद जकाँ लागल. ई एकटा पैघ विरोध छल, आ हमरा लोकनि केँ नहि बुझल छल जे एकर नेतृत्व के क’ रहल अछि.

एक दिन पहिने हम सब एक ठाम आबि योजना बनौने रही आ कतेको आन ग्रुप सेहो एहने केलक। हम सब इंस्टाग्राम आ टिकटोक के माध्यम स कॉल शेयर केलहुं। किछ लोक स्कूल मे जा क स्कूल विभाग सं कहलखिन्ह जे आधा दिन के माफी दिअ जाहि सं विद्यार्थी सभ ज्वाइन क सकय.

विरोध प्रदर्शन के बाद डिस्कॉर्ड चैनल बढ़ि कए करीब 10 हजार लोक भ गेल, जे डिस्कॉर्ड पर वोट देबय लगलाह जे केकरा प्रधानमंत्री बनबाक चाही. डिस्कॉर्ड पर जे व्यक्ति कए सबस बेसी वोट भेटल ओ अंततः प्रधानमंत्री बनि गेलाह। राजनीति करबाक ई एकदम जेन जेड तरीका छल।

ओना हमरा लगैत अछि जे जेन जेड विरोध सं बेसी ‘यूथ-लेड’ लेबल बेसी उपयुक्त होयत. जेन जेड एकरा चलाबै वाला सोशल मीडिया के नजरिया स॑ सही होय सकै छै । मुदा शहर मे इंटरनेट के सुविधा वाला लोक मे जेन जेड के विशेषता भ सकैत अछि, मुदा ग्रामीण नेपाल मे सेहो ओहि उम्र के समूह के वर्णन मे फिट नहि भ सकैत अछि.

अहां आओर दोसर प्रदर्शनकारी के कोन-कोन जोखिम के सामना करय पड़ल?

पहिल दिन जखन एवरेस्ट होटल पहुँचलहुं आ भीड़ के आगू बढ़ैत देखलहुं तं हमरा बूझल छल जे हमरा ओहि बिन्दु सं आगू नहिं बढ़बाक चाही. मुदा जखन सोशल मीडिया पर सुनलहुं जे संसद भवन मे लोक घुसि रहल अछि त दोसर गली मे दौड़लहुं। संसद भवनक पहरा देबय लेल ओतय एकटा विशेष टास्क फोर्स पुलिस अधिकारी अपन बंदूक लोड क' सोझे हमरा दिस इशारा केलनि. मुदा ओ फायरिंग नहि केलक।

विरोध प्रदर्शन हिंसक बनला के बाद पुलिस हर जगह के तलाशी लेलक जतय प्रदर्शनकारी नुकायल भ सकैत छल, लोक के बाहर निकालि क मारि-पीट केलक। दुपहर के करीब स अन देर राति स हम सब आठ-नौ गोटे एकटा क्यूबिकल में नुका गेलहुं। घर वापसी खतरनाक छल, कारण सड़क पर सिविल कपड़ा मे पुलिसक भरमार छल. ओहि दू-तीन दिन मे जखन सेना प्रभावी ढंग सं अपन कब्जा जमा लेने छल आ कोनो काज करय बला सरकार नहि छल, हमरा सभ के ई मानय के कारण छल जे हमर फोन पर नजरि राखल जा रहल अछि.

आब जेल मे बंद लोक अछि आओर संसद भवन जरि रहल छल तखन पाथर फेंकय या टिकटॉक कंटेंट बनेबाक आपराधिक आरोप के सामना करय पड़ि रहल अछि. मुदा भीड़ मे हेरफेर कए आन्दोलन क नाम पर कथित तौर पर हिंसा भड़काबय वाला कए परिणाम क सामना नहि क रहल बुझाइत अछि।

विरोध प्रदर्शन के बाद आन्दोलन केना संगठित भेल अछि ?

विरोध प्रदर्शन के बाद अलग-अलग हलका के लोक अपन जेन जेड ग्रुप बनाबय लगलाह. आब 40 स बेसी भ गेल अछि। जेन जेड एलायंस, जेन जेड सिविक फोरम आ जेन जेड फ्रंट सहित किछु गोटे एखनो सक्रिय छथि । किछ अनौपचारिक रहल अछि, किछ गैर सरकारी संगठन के रूप मे पंजीकृत भ’ गेल अछि आओर किछ राजनीतिक दल बना लेलक अछि, हालांकि हुनका वोट के कोनो खास हिस्सा नहिं मिलल. ई सब जेन जेड आन्दोलन के रक्षक के रूप में अपना के ठाढ़ केलक, मुदा वास्तव में हमरा सब के जे आकांक्षा आ मूल्य छल ओकर दृष्टि स नै।

लोक सड़क पर उतरैत रहैत अछि, कारण 8 सितंबर कए भेल 19 मौत आ 9 सितंबर कए भेल आगजनी आ तोड़फोड़ क लेल के जिम्मेदार अछि, एहि लेल गठित कार्की आयोग एकटा विशाल रिपोर्ट देलक अछि, मुदा सरकार एखन धरि एकरा जारी नहि केलक अछि। ई बात पहिने भी होय चुकलऽ छै: 1990 के दशक म॑ जब॑ लोकतंत्र बहाल होय गेलऽ छेलै, त॑ ऐसनऽ ही समिति मलिक कमीशन न॑ भी ऐसनऽ ही एगो रिपोर्ट तैयार करलकै जेकरा कभियो सार्वजनिक नै करलऽ गेलै । 2006 के संक्रमण मे रायमाझी आयोग के रिपोर्ट सेहो सार्वजनिक नहिं कएल गेल छल. लोक के फेर सं नहिं रहत आओर पारदर्शिता के मांग क’ रहल छथिन्ह.

विरोध प्रदर्शन स की हासिल भेल, आ अहां एहि स की सबक लेलहुं?

हम करिश्माई आंकड़ा आ परिणाम स बेसी संस्था आ प्रक्रिया मे विश्वास करैत छी। तेँ हमरा बुझने संसद नहि भंग करब नीक रहैत। विरोध के दोसर दिन तक हम सब जे कानून चाहैत छलहुं ओकरा लेल धक्का द सकैत छलहुं, किया कि संसद सदस्य के मनोबल एतेक कम छल जे प्रदर्शनकारी के मांग के लगभग हर चीज पर ओ सहमत भ गेल रहैत. बल्कि हम संसद भंग करबाक मांग केलहुं।

प्रधानमंत्री केरऽ इस्तीफा के बाद एकमात्र वैध संस्था के रूप म॑ राष्ट्रपति केरऽ कार्यालय क॑ अधिकतर बातचीत करलऽ जाना चाहियऽ छेलै, लेकिन एकरऽ बदला म॑ बातचीत प॑ सेना के बोलबाला छेलै । से एकटा आओर गलती छल। वार्ता प्रक्रिया के स्वयं जनविमर्श मे ल जेबाक चाही छल। एकर बाद पार्टी व्यवस्था मे सुधार आ व्यवस्था कए बेसी जवाबदेह बनेबा पर ध्यान देबाक चाही छल, मुदा एकर बदला मे हम सब सोचलहुं जे नव लोक कए आनल गेल त सब किछु बदलत। समस्या ई जे नवका अंततः पुरान भ’ जायत, आ जे कोनो नव पार्टी मौलिक रूप स’ अलग संरचना नहि बनाओत से पुरान राजनीतिक दल जकाँ समाप्त भ’ जायत.

हमरा इहो लगैत अछि जे जखन विरोधक बात अबैत अछि त संगठित नेतृत्व सबसँ नीक होइत अछि, कारण विकेन्द्रीकृत संरचना मे जँ काज गलत भ' जाय त' ककरो जवाबदेही नहि देल जा सकैत अछि. संगहि, ओ लोक के अपन एजेंडा के धक्का देबय दैत छथिन्ह आओर विरोध के असली मांग के नुकसान पहुंचय के खतरा अछि.

एकरऽ अलावा हमरा चिंता छै कि ग्रामीण क्षेत्रऽ स॑ पैदा होय वाला नीचे स॑ ऊपर के विरोध प्रदर्शन स॑ जहाँ अधिक समावेशी आरू प्रगतिशील परिणाम मिल॑ सकै छै, वहीं शासन केरऽ विफलता आरू आर्थिक अवसर के कमी के प्रतिक्रिया म॑ पैदा होय वाला शहरी केंद्रित विरोध के अंत म॑ ध्रुवीकरण आरू निरंकुश आंकड़ा के उदय होय सकै छै । एहि विरोध क बाद राजनीतिक गतिशीलता डिलीवरी दिस बढ़ल अछि। लोक समावेश के सब किछु बिसरि क मेरिटोक्रेसी के मांग करय लागल अछि. भले ही ई सरकार लोगऽ के आकांक्षा क॑ सफलतापूर्वक पूरा करै छै, लेकिन ई भारत केरऽ सरकार के तरह होय सकै छै, जे अच्छा बुनियादी ढाँचा उपलब्ध कराबै छै लेकिन राजनीतिक संस्था क॑ तोड़ी क॑ सामाजिक ताना-बाना क॑ बाधित करी क॑ धार्मिक अतिवाद क॑ बढ़ावा दै छै ।

नेपालक लोकतंत्रक भविष्य कोना देखैत छी ?

एखन लोक अपन उम्मीद आ भरोसा एकटा व्यक्ति पर राखि देने छथि, जखन कि संस्था पर भरोसा दिन पर दिन सिकुड़ैत जा रहल अछि। नागरिक समाज तक के विश्वसनीयता खत्म भ गेल अछि। दू दशक पहिने नेपाल कए राजतंत्र स गणतंत्र मे पहुंचेनिहार परिवर्तन मे नागरिक समाज सबस आगू छल। मुदा धीरे-धीरे नागरिक समाज के नेता के बदनामी भ गेल अछि. नागरिक समाज बेसीतर राजनीति के लॉन्चिंग पैड अछि; लोक बेसी दिन ओत’ नहि रहैत अछि. अधिकांश प्रमुख नागरिक समाजक नेता कोनो ने कोनो पार्टीक संसद सदस्य बनि गेल छथि ।

अगर ई सरकार असफल भ गेल त लोक बूढ़ राजकुमार के वापस लाबय के बारे मे सोचय लागत. निरंकुश नॉस्टेलजिया अपन कब्जा जमा लेत। हमरा राजनीतिक कट्टरता के जातीय या धार्मिक आयाम लेबै के चिंता भी छै, खास करी क॑ भारत के सीमा प॑ सक्रिय कट्टरपंथी तत्व क॑ देखत॑ हुअ॑ ।

रहल बात विरोध के त’ हमरा लगैत अछि जे सरकार लोक के सड़क पर बाहर निकलय देत, मुदा ओ हमरा सभक मांग नहि सुनत.

सिविकस अपन सिविकस लेंस प्लेटफॉर्म पर प्रकाशन कें लेल नागरिक समाज कें कार्यवाही आ वर्तमान मुद्दाक पर विविध दृष्टिकोण एकत्रित करय कें लेल नागरिक समाज कें कार्यकर्ताक, विशेषज्ञक आ नेताक कें एकटा विस्तृत श्रृंखला कें साक्षात्कार लैत छै. साक्षात्कार में व्यक्त विचार साक्षात्कारकर्ता के छै आरू जरूरी नै छै कि सिविकस के विचार के प्रतिबिंबित करै छै. प्रकाशन केरऽ मतलब ई नै छै कि साक्षात्कारकर्ता या ओकरऽ प्रतिनिधित्व करै वाला संगठनऽ के समर्थन करलऽ जाय ।

संपर्क में आ जाओ

लिंक्डइन

ट्विटर

इहो देखू

जनरल जेड विरोध: नया प्रतिरोध बढ़ी CIVICUS | नागरिक समाज की स्थिति प्रतिवेदन 2026

नेपाल के जेन जेड चुनावी क्रांति CIVICUS Lens 19.Mar.2026

नेपाल के जेन जेड विद्रोह : युवा नेतृत्व परिवर्तन के समय CIVICUS Lens 10.Oct.2025

@ IPSNewsUNBureau के फॉलो करू

!function (d,s,id) {var js,fjs = d.getElementsByTagName (s) [0], p=/^http:/.test (d.स्थान)?'http':'https';if (!d.getElementById (आईडी)) {js = d.creat eElement (s);js.id=id;js.src=p+'://प्लेटफॉर्म.ट्विटर.कॉम/विजेट्स.जेएस';fjs.parentNode.insertBefore (js,fjs);}} (दस्तावेज, 'स्क्रिप्ट', 'ट्विटर-डब्ल्यूजेएस');"
