title,description,published date,url,publisher.href,publisher.title,full_article,images,translated
Kriti Mainali’s couture brings Nepali fashion to global runways - The Kathmandu Post,Kriti Mainali’s couture brings Nepali fashion to global runways  The Kathmandu Post,2026-04-18 02:46:43,https://news.google.com/rss/articles/CBMisgFBVV95cUxOLTB5VGdMRnA5M0pHSWpxY2J5a0w3bDNkcFF4UGRYdVBLMFpWWHdnaXFvOXBlcG1naFJCckgtWVpqdkprSF9wTXNqWWFiU0tTblZVUnFMYlhvWDlYX3lib3VrbUw1QXdBVFktS1lxc2ZwX1hXcVJJOXJlSko0R2VUN2tqNElKSTlvbG9mSTRpcGZGcHJUM3dMaU5RTG1KQTBDV0Nla3BsMnlwYXY3TjlRcXR3?oc=5&hl=en-US&gl=US&ceid=US:en,https://kathmandupost.com,The Kathmandu Post,"There is a quiet confidence in how Kriti Mainali talks about fashion. Not the bravado of someone chasing trend cycles or courting viral moments, but the certainty of a woman who knows exactly what she is here to say and who she is saying it for. “I don’t just design clothes,” she says. “I create pieces that carry meaning, emotion, and identity.” For Mainali, the founder of the luxury couture label K R I T I, fashion has never been a decoration. It has always been language. Such a belief has led her from Kathmandu to the Sony Hall in Times Square and, currently, onto the legendary stages of Paris Fashion Week. In a global fashion landscape that is increasingly, if still imperfectly, making room for South Asian voices and diasporic narratives, Mainali is not waiting to be invited to the table. She is already seated, building something beautiful. Mainali was brought up in Nepal and was raised in the atmosphere of South Asian fabrics, the plushness of silk, the design of embroidery, and the ability of one dupatta to change the tone of the whole outfit. Her experiments with design began with domestic ornaments: as a child, she used bits of old kurthis to sew little dresses for her dolls. Mainali lived between two cultural worlds as her life expanded into the United States. Like many first-generation immigrants, she followed a corporate path, finding stability first and then ambition within that structure. But her creative instinct never faded. Travel sharpened it, history enriched it, and art gave it form. Every country she visited, every monument she encountered, and every piece of folk art she experienced became part of a growing design language—one that quietly developed alongside her corporate life. At heart, she still sees herself as a little girl drawn to travel, history, and culture.

Mainali’s collections draw on a rich reservoir of Nepali symbolism and craft.



Her collections are based upon a rich reservoir of Nepali symbolism and craft. There is Dhaka textiles: hand-woven on looms in the eastern Nepal hills, and Himalayan-inspired embroidery. The Mithila artworks, with their detailed line work and mythical overtones, are relevant to the couture silhouettes. The national flower of Nepal, the rhododendron, flowers on bodices of beadwork and crystal. The traditional image of the Boudhanath Stupa, Buddha’s eyes, looks through hand-painted wooden panels. Every motif has not only aesthetic appeal but also a deeper meaning—one that Mainali conveys through her design language for people worldwide to read. The symbols are not mere decorations. As she explains, she breaks them down into a luxurious, modern design language so that anyone, regardless of background, can relate to them. This is the key Mainali bargain: turning something particular into something universally appealing. “I don’t just place them for decoration,” she says. “I break them down into what feels like a luxurious and modern design language so that everyone can relate to it.” Every piece in the K R I T I collection is handcrafted by skilled artisans in Nepal and India—many of them women supporting their families through their craft. Beads, sequins, crystals, and hand-stitched motifs are layered with the patience of people who understand that quality cannot be rushed. There comes a moment that changes everything for a designer. For Mainali, it was Dubai. Her first breakthrough came during Emirates Fashion Week, when a collection inspired by Palm Island—created in collaboration with Arni Fashion LLC and drawing on the architectural grandeur of Dubai’s most recognisable buildings—captured the audience’s attention. The response from international media was immediate. Photographs circulated. Interest followed. It was the kind of attention that can either be lost or captured. Mainali seized it. The Dubai collection proved something significant: her ability to transform place and narrative into wearable form was not confined to her Nepali upbringing. That breakthrough was not accidental. It was the result of years of quiet, systematic labour—communication across time zones with craftsmen back home, managing logistics without large-scale support, and learning by doing rather than observing from a distance. “Everything required patience and constant coordination,” she reflects. “But I learned to adapt and grow through it.” In early 2026, Mainali made her international runway debut at New York Fashion Week with a 10-piece collection titled ‘Heritage of Nepal’, presented at Runway 7 in Sony Hall, Times Square, alongside 85 designers from 16 countries. The collection featured motifs from the Swayambhunath Temple and the Himalayas, accompanied by traditional Nepali music and digital visuals of Mount Everest. It created a fully immersive sensory experience, asserting fashion shows as spaces of cultural transmission rather than mere display. For Mainali, the moment carried significance far beyond personal achievement. As one of the few Nepali designers to feature on such a platform, it was not simply about presenting garments, but about making a statement on representation and presence. “When I reached that level,” she said, “I wanted to start by telling my own story first.”","{'https://jcss-cdn.kathmandupost.com/assets/images/logo-sticky-bar-tkp-weekender-1.png', 'https://jcss-cdn.kathmandupost.com/assets/images/tkp-logo-weekender.png', 'https://jcss-cdn.kathmandupost.com/assets/images/logos/thekathmandupost-logo.png', 'https://jcss-cdn.kathmandupost.com/assets/images/logos/thekathmandupost-logo-white.png', 'https://assets-cdn.kathmandupost.com/uploads/source/news/2026/third-party/FIRST-1776479830.jpg', 'https://openweathermap.org/img/w/04d.png', 'https://jcss-cdn.kathmandupost.com/assets/images/lazy.png'}","कृति मैनाली फैशनक गप्प कोना करैत छथि ताहि पर चुपचाप विश्वास अछि । ट्रेंड साइकिल के पीछा करय वाला के बहादुरी या वायरल मोमेंट के कोर्ट करय वाला के बहादुरी नै, बल्कि एकटा एहन महिला के निश्चितता जे ठीक सं जानय छै कि ओ एतय की कहय लेल आयल छथिन्ह आओर केकरा लेल कहि रहल छथिन्ह. ओ कहैत छथि, “हम खाली कपड़ा डिजाइन नहि करैत छी.” “हम एहन टुकड़ा बनबैत छी जे अर्थ, भाव आ पहिचान केँ धारण करैत अछि।” लग्जरी कूटूर लेबल के आर आई टी आई के संस्थापक मैनाली के लेल फैशन कहियो सजावट नै रहल अछि। सदिखन भाषा रहल अछि। एहन विश्वास हुनका काठमांडू सं टाइम्स स्क्वायर के सोनी हॉल तक पहुंचा देलक अछि आ वर्तमान में पेरिस फैशन वीक के पौराणिक मंच पर आबि गेल अछि. वैश्विक फैशन परिदृश्य में जे तेजी स॑, अगर अखनी भी अपूर्ण रूप स॑, दक्षिण एशियाई आवाज आरू प्रवासी कथ्य लेली जगह बनाबै छै, मैनाली क॑ टेबुल प॑ आमंत्रित करै के इंतजार नै छै । ओ पहिनेसँ बैसल छथि, किछु सुन्दर बनबैत छथि । मैनाली के पालन-पोषण नेपाल में भेल छल आ दक्षिण एशियाई कपड़ा के वातावरण, रेशम के आलीशानता, कढ़ाई के डिजाइन, आ एकटा दुपट्टा के पूरा पोशाक के टोन बदलय के क्षमता में पालन पोषण भेल छल. डिजाइन के साथ हुनकऽ प्रयोग घरेलू आभूषणऽ स॑ शुरू होलै : बचपन म॑ हुनी अपनऽ गुड़िया लेली छोटऽ-छोटऽ ड्रेस सियै लेली पुरानऽ कुर्थी के टुकड़ा के इस्तेमाल करै छेली । मैनाली दू सांस्कृतिक दुनिया के बीच रहैत छलीह जेना-जेना हुनकर जीवन के विस्तार अमेरिका में भेल छल. बहुतो पहिल पीढ़ी के आप्रवासी के तरह ओहो एकटा कॉरपोरेट मार्ग पर चललनि, पहिने स्थिरता आ फेर ओहि संरचना के भीतर महत्वाकांक्षा खोजलनि. मुदा हुनकर सृजनात्मक वृत्ति कहियो फीका नहि भेलनि । यात्रा एकरा तेज केलक, इतिहास एकरा समृद्ध केलक, आ कला एकरा रूप देलक। हुनकऽ हर देश, हुनकऽ सामना करलऽ गेलऽ हर स्मारक, आरू लोक कला के हर टुकड़ा हुनकऽ अनुभव एगो बढ़तऽ डिजाइन भाषा के हिस्सा बनी गेलै-जे हुनकऽ कॉर्पोरेट जीवन के साथ-साथ चुपचाप विकसित होय गेलै । हृदय सँ ओ एखनो अपना केँ यात्रा, इतिहास, आ संस्कृति दिस आकर्षित छोट बच्ची बुझैत छथि ।

मैनाली केरऽ संग्रह नेपाली प्रतीकात्मकता आरू शिल्प केरऽ समृद्ध जलाशय स॑ आकर्षित करलऽ गेलऽ छै ।



हिनक संग्रह नेपाली प्रतीकात्मकता आ शिल्पक समृद्ध जलाशय पर आधारित अछि । ढाका कपड़ा अछि : पूर्वी नेपाल पहाड़ी में करघा पर हाथ सं बुनल, आ हिमालय सं प्रेरित कढ़ाई. मिथिला कलाकृति, अपन विस्तृत लाइन वर्क आ पौराणिक ओवरटोन के संग, कूटूर सिल्हूट के लेल प्रासंगिक अछि । नेपालक राष्ट्रीय फूल रोडोडेंड्रोन, मोतीक काज आ स्फटिकक बोडीस पर फूलैत अछि । बौधनाथ स्तूप के पारंपरिक छवि बुद्ध के आँखि हाथ स चित्रित लकड़ी के पैनल स देखैत अछि | हर मोटिफ केरऽ सौंदर्य आकर्षण ही नै छै बल्कि एकरऽ गहराई स॑ अर्थ भी होय छै-जे मैनाली अपनऽ डिजाइन भाषा के माध्यम स॑ दुनिया भर के लोगऽ क॑ पढ़ै लेली संप्रेषित करै छै । प्रतीक मात्र सजावट नहि अछि। जेना कि ओ बतबैत छथि, ओ एकरा सभ केँ एकटा आलीशान, आधुनिक डिजाइन भाषा मे तोड़ि दैत छथि जाहि सँ कियो चाहे कोनो पृष्ठभूमिक हो, एहि सभ सँ संबंधित भ' सकय. ई मुख्य मैनाली सौदा छै: कोनो खास चीज के सार्वभौमिक रूप स आकर्षक चीज में बदलना। ओ कहैत छथि, “हम ओकरा सभ केँ खाली सजावट लेल नहि राखैत छी।” “हम ओकरा सब के तोड़ैत छी जे एकटा आलीशान आ आधुनिक डिजाइन भाषा बुझाइत अछि जाहि स सब कियो एकरा स संबंधित भ सकए।” के आर आई टी संग्रह केरऽ हर टुकड़ा नेपाल आरू भारत केरऽ कुशल कारीगरऽ द्वारा हस्तनिर्मित छै-ओकरा म॑ स॑ बहुत सारा महिला अपनऽ शिल्प के माध्यम स॑ अपनऽ परिवार केरऽ भरण-पोषण करी रहलऽ छै । मोती, सेक्विन, क्रिस्टल, आ हाथ सं सिलाई कयल मोटिफ के परतदार एहन लोकक धैर्य सं कयल गेल अछि जे बुझैत छथि जे गुणवत्ता के हड़बड़ी नहिं कयल जा सकैत अछि. एकटा एहन क्षण अबैत अछि जे एकटा डिजाइनर लेल सब किछु बदलि दैत अछि। मैनाली लेल दुबई छल। हुनकऽ पहलऽ सफलता अमीरात फैशन वीक के दौरान मिललै, जब॑ पाम आइलैंड स॑ प्रेरित संग्रह-जे अर्नी फैशन एलएलसी के सहयोग स॑ बनलऽ छेलै आरू दुबई केरऽ सबसें पहचानऽ वाला भवनऽ के वास्तुशिल्प भव्यता क॑ आकर्षित करी क॑-दर्शकऽ के ध्यान आकर्षित करी लेलकै । अंतरराष्ट्रीय मीडिया स तत्काल प्रतिक्रिया भेटल। फोटोग्राफ घूमि गेल। ओकर बाद रुचि सेहो आबि गेल। ई एहन ध्यान छल जे या तऽ हेरा सकैत अछि वा पकड़ल जा सकैत अछि । मैनाली जब्त क लेलक। दुबई संग्रह किछु महत्वपूर्ण साबित भेल : स्थान आ कथ्य केँ पहिरय योग्य रूप मे बदलबाक हुनक क्षमता हुनक नेपाली परवरिश धरि सीमित नहि छल । ओ सफलता आकस्मिक नहि छल। ई वर्षों के शांत, व्यवस्थित श्रम के परिणाम छेलै-घर वापसी में कारीगरऽ के साथ समय क्षेत्रऽ के पार संवाद, बिना बड़ऽ पैमाना पर सहायता के रसद के प्रबंधन, आरू दूर स॑ अवलोकन करै के बजाय करी क॑ सीखना । ओ मनन करैत छथि, “सब किछु मे धैर्य आ निरंतर समन्वयक आवश्यकता छल। “मुदा हम एकरा माध्यमे अनुकूल बनब आ बढ़ब सीखलहुँ।” 2026 केरऽ शुरुआत म॑ मैनाली न॑ न्यूयॉर्क फैशन वीक म॑ अपनऽ अंतर्राष्ट्रीय रनवे प॑ शुरुआत करलकै, जेकरा म॑ ‘हेरिटेज ऑफ नेपाल’ नाम केरऽ १० टुकड़ा के संग्रह छेलै, जेकरा सोनी हॉल, टाइम्स स्क्वायर म॑ रनवे ७ म॑ १६ देशऽ के ८५ डिजाइनर के साथ प्रस्तुत करलऽ गेलै । संग्रह में स्वयंभूनाथ मंदिर आ हिमालय के मोटिफ के संग पारंपरिक नेपाली संगीत आ माउंट एवरेस्ट के डिजिटल विजुअल सेहो छल । ई एगो पूर्ण रूप स॑ विसर्जनशील संवेदी अनुभव के निर्माण करलकै, जेकरा म॑ फैशन शो क॑ खाली प्रदर्शन के बजाय सांस्कृतिक संचरण के स्थान के रूप म॑ दावा करलऽ गेलै । मैनाली के लेलऽ ई क्षण व्यक्तिगत उपलब्धि स॑ बहुत आगू के महत्व रखै छेलै । एहन प्लेटफॉर्म पर फीचर करय वाला किछु नेपाली डिजाइनर मे सं एक के रूप मे ई सिर्फ परिधान प्रस्तुत करय के बात नहि छल, बल्कि प्रतिनिधित्व आओर उपस्थिति पर बयान देबय के छल. ओ कहलीह जे जखन हम ओहि स्तर पर पहुंचलहुं त पहिने अपन कहानी कहबा स शुरू करय चाहैत छलहुं।"
Weather largely to remain clear despite cloud cover in some places - Nepalnews.com,Weather largely to remain clear despite cloud cover in some places  Nepalnews.com,2026-04-18 02:50:04,https://news.google.com/rss/articles/CBMiqwFBVV95cUxOT2s0UDJMQkwtYW92UlJadTdkWW43TGRqRlBtWEJGajhFdThkbGxaNWRGZTVKQm51RklCeGlydUxtdVViV21WSkhodmlpOGlNb0ZCSy1PUEszdEgycFlDc2EwamdFMU91cFFZeFVHdjc3VjRRRlVsa3EtTk9YSXFiSXRlRVFnNmdHUlZkcFVzaDZDbVFNTC11cGVWeXE5T3Vna2ZlLWF4RGo0Wnc?oc=5&hl=en-US&gl=US&ceid=US:en,https://english.nepalnews.com,Nepalnews.com,,,
