title,description,published date,url,publisher.href,publisher.title,full_article,images,translated
Can better insurance buffer Nepali farmers against climate change? - The Kathmandu Post,Can better insurance buffer Nepali farmers against climate change?  The Kathmandu Post,2024-05-25 02:02:34,https://news.google.com/rss/articles/CBMibmh0dHBzOi8va2F0aG1hbmR1cG9zdC5jb20vd2VhdGhlci8yMDI0LzA1LzI1L2Nhbi1iZXR0ZXItaW5zdXJhbmNlLWJ1ZmZlci1uZXBhbGktZmFybWVycy1hZ2FpbnN0LWNsaW1hdGUtY2hhbmdl0gEA?oc=5&hl=en-US&gl=US&ceid=US:en,https://kathmandupost.com,The Kathmandu Post,"Every year, adverse weather events such as drought, excessive rainfall, and storms cause huge losses to farmers in Asia and beyond.

This year, South Asian meteorologists have said that most of South Asia, including Nepal, will receive above-normal monsoon rainfall, which is good for Nepal’s rain-fed agriculture system.

But experts say it is also a warning sign. Excessive rainfall brings disaster and may offset economic gains. They say agricultural insurance can protect farmers by covering losses from adverse weather events. This can help farmers maintain their income and continue farming even if a harvest is lost.

“This monsoon, we have projected to witness 35 percent to 55 percent more rains than usual,” said Bharat Mani Pandey, joint secretary at the National Disaster Risk Reduction and Management Authority, during an orientation on insurance and risk finance, jointly organised by the United Nations Development Programme (UNDP) and Society Of Economic Journalists-Nepal.

According to Pandey, the monsoon, which begins in mid-June and ends in early October, may affect 1.8 million people this year.

""We are bringing a disaster management strategy soon to tackle the problems. We are mobilising around 35,000 security personnel in disaster-prone areas as part of our preparedness plan.”

According to Pandey, this year, Gandaki Province will be the most affected area as it may receive 60 percent more rainfall than the usual monsoon rains. “If we prepare early, we can save lives and properties.”

Nepal’s agriculture sector is the mainstay of the country’s economy. It contributes 24.60 percent to the country's GDP and employs over half of the population. The sector is mainly rain-fed and heavily dependent on rainfall.

When there is not enough rain, the GDP tumbles. This dependence makes the country particularly vulnerable to the adverse impacts of climate change.

According to the National Climate Change Survey 2022, the second of its kind, released by the National Statistics Office recently, the economic losses in both farm and off-farm sectors in the last five years, as reported by households, excluding significant infrastructure damages, amounted to Rs415.44 billion.

The survey report said that over the past 25 years, due to climate change, approximately 50 percent of households reported the emergence of new diseases in their crops, 53.9 percent observed the presence of new insects or pests affecting their crops, and 29.8 percent of households noted the appearance of new diseases in their livestock.

Respondents said that drought had been reported as the major disaster, affecting 65.4 percent of households, followed by diseases and insects at 54.3 percent, storms at 46.2 percent, hailstorms at 32.6 percent, floods at 28.5 percent, cold waves at 21.7 percent, landslides at 21.5 percent, and inundation at 17.5 percent.

Experts say that due to extreme climate behaviour, farmers might lose the basis of their livelihoods, and even those who have escaped poverty may be dragged back into it.

Managing risks that affect many people at one time is generally very challenging and costly. Insurance is an important risk management tool, they say.

Pujan Adhikary, director of the insurance development and promotion division of the Nepal Insurance Authority, said that smallholder farmers and rural communities cannot manage climate risks by themselves without adequate financial instruments.

“But insurance is the answer for the extreme weather events and climate change that have increased the risks and uncertainties of farmers and agriculture-based enterprises.”

Agriculture insurance can help promote stability and growth in the industry by reducing the financial risks associated with farming.

But there are problems galore.

Non-life insurance companies have stopped settling claims for insured farm products since mid-March after failing to receive government premium subsidies.

The government is yet to clear around Rs3 billion under this heading to the non-life insurance companies.

“The non-payment issue in the agriculture sector has put us in difficulties. Since companies have totally stopped farm insurance, it will erode the confidence of the farmers towards insurance,” said Adhikary.

Besides non-payment issues, one of the main challenges is to define an appropriate payout rate corresponding to the actual loss experienced by the farmers.

“Lower payout rates than expected will result in a low demand for insurance,” said Adhikary.

She said that careful research and climate risk assessments are essential to design an appropriate weather-based index insurance product rather than relying on the traditional weather-based policy, to meet the demands of farmers.

Nepal has been adopting a weather-based insurance policy.

Experts, however, said that weather-based index insurance could be a powerful tool for stabilising farmers’ income.

Index insurance is a relatively new tool farmers can use to help manage risk. It pays out based on an index, such as rainfall, measured at a local weather station or by satellite, rather than on a consequence of weather, such as a farmer’s crop yield.

Unlike traditional crop insurance, the insurance company does not need to visit a farmer’s field to determine premiums or assess damage. Instead, if the rainfall amount is below a pre-specified threshold, the insurance pays out.

Since the payout is not linked to crop survival or failure, the farmer is always incentivised to make the best decisions for crop survival. This innovation significantly lowers the insurance company’s transaction costs and risks, reducing insurance premiums and increasing accessibility.

Besides, according to Adhikary, they have been working on an ‘inclusive insurance’ policy that covers micro, health and agro sectors broadly.

""We need inclusive insurance which is affordable and accessible. This will cover the low-bracket income people,” said Adhikary.

“We are also studying the possibility of purchasing insurance through mobile phones. The inclusive insurance policy will be simplified to a single page, making it easier for people to understand compared to the current 17-18 pages policy. Claim settlement will also be rapid to build trust among policyholders.""

Sabnam Shivakoti, joint secretary at the Ministry of Agriculture and Livestock Development, said farmers are currently discouraged because many of them are unable to receive insurance payouts. “If farmers are affected, it will affect the national food system. So, the issue regarding the non-payment issue should be resolved as soon as possible.”

Crop insurance was introduced in Nepal with much fanfare. The government has been implementing crop and livestock insurance since January 2013 by formulating directives.

Under the scheme, the government provided a 50 percent subsidy on the premium in the first year and raised it to 75 percent in the second year.

The premium subsidy was again reduced to 50 percent and raised to 80 percent in 2021.

According to Shivakoti, when the insurance scheme started ten years ago, there were 802 claims. In the last fiscal year, the annual claims reached 36,000. According to her, of the total agricultural insurance, crop insurance accounts for just 5 percent, while 95 percent is livestock insurance.

“The agriculture sector is a highly risk-prone sector, and agricultural insurance is the key option to manage farm-level risk induced by climate and other disasters,” said Shivakoti.

“The compensation demand for the losses of crops and livestock is rising and causing a burden to the state. Insurance is only the way to compensate farmers,” she said.","{'https://jcss-cdn.kathmandupost.com/assets/images/logos/thekathmandupost-logo-white.png', 'https://jcss-cdn.kathmandupost.com/assets/images/logo-sticky-bar-tkp-weekender-1.png', 'https://jcss-cdn.kathmandupost.com/assets/images/tkp-logo-weekender.png', 'https://jcss-cdn.kathmandupost.com/assets/images/lazy.png', 'https://jcss-cdn.kathmandupost.com/assets/images/logos/thekathmandupost-logo.png', 'https://assets-cdn.kathmandupost.com/uploads/source/news/2024/money/Untitled2-1716602522.jpg', 'https://openweathermap.org/img/w/03d.png'}","हर साल मौसम केरऽ प्रतिकूल घटना जेना कि सूखा, अधिक बारिश, आरू तूफानऽ स॑ एशिया आरू ओकरा बाद के किसानऽ क॑ भारी नुकसान होय ​​छै ।ई साल दक्षिण एशियाई मौसम वैज्ञानिक न॑ कहल॑ छै कि नेपाल सहित दक्षिण एशिया के अधिकांश भाग सामान्य मानसून स॑ ऊपर के वर्षा मिलतै, जे नेपाल केरऽ वर्षा स॑ लड़लऽ कृषि प्रणाली लेली अच्छा छै ।मुदा विशेषज्ञ सभ के कहनाय छनि जे ई चेतावनी संकेत सेहो अछि.अत्यधिक वर्षा आपदा आनि दैत अछि आ आर्थिक लाभक भरपाई क सकैत अछि ।हुनकऽ कहना छै कि कृषि बीमा मौसमी घटना स॑ घाटा क॑ पूरा करी क॑ किसानऽ के सुरक्षा करी सकै छै ।अइ सं किसानक कें अपन आमदनी आ खेती जारी रखनाय मे मदद मिल सकय छै भले ही फसल कें नुकसान भ गेल होय.राष्ट्रीय आपदा जोखिम कम करय आरू प्रबंधन प्राधिकरण केरऽ संयुक्त सचिव, बीमा आरू जोखिम वित्त प॑ अभिविन्यास के दौरान, संयुक्त रूप स॑ आयोजित करलऽ गेलऽ भारत मणी पांडेय न॑ कहलकै कि ई मानसून न॑ सामान्य स॑ 35 प्रतिशत स॑ 55 प्रतिशत अधिक बारिश के गवाह बनै के अनुमान लगैल॑ छियै । संयुक्त राष्ट्र विकास कार्यक्रम (यूएनडीपी) एवं सोसाइटी ऑफ इकोनॉमिक पत्रकार-नेपाल |पैंडी के अनुसार जून के मध्य में शुरू होय वाला आरू अक्टूबर के शुरूआत में समाप्त होय वाला ई मानसून के असर ई साल 18 लाख लोगऽ के पड़॑ सकै छै ।&quot;हम समस्या स॑ निपटै लेली जल्दिये आपदा प्रबंधन रणनीति लानी रहलऽ छियै । हम अपनऽ तैयारी योजना के हिस्सा के रूप म॑ आपदा स॑ ग्रस्त क्षेत्रऽ म॑ लगभग ३५,००० सुरक्षा कर्मी क॑ जुटा रहलऽ छियै ।&quot;पांडेय के अनुसार, ई साल गंडाकी प्रांत सबसें प्रभावित क्षेत्र होतै, कैन्हेंकि ओकरा सामान्य मानसून वर्षा के तुलना म॑ 60 प्रतिशत अधिक वर्षा मिलै छै ।नेपाल के कृषि क्षेत्र देश के अर्थव्यवस्था के मुख्य आधार छै. .ई निर्भरता जलवायु परिवर्तन कें प्रतिकूल प्रभावक कें लेल विशेष रूप सं कमजोर बनायत छै. पिछला पांच साल मे, जेना कि घर मे महत्वपूर्ण बुनियादी ढांचागत क्षतिपूर्ति कए छोड़ि देल गेल अछि, सर्वेक्षण क रिपोर्ट मे कहल गेल अछि जे पिछला 25 साल मे जलवायु परिवर्तन क कारण लगभग 50 प्रतिशत घर मे नव बीमारियक क उदय क रिपोर्ट देल गेल अछि। अपनऽ फसलऽ म॑ ५३.९ प्रतिशत न॑ अपनऽ फसल क॑ प्रभावित करै वाला नया कीड़ा या कीटऽ के उपस्थिति देखलकै, आरू 29.8 प्रतिशत घरऽ म॑ अपनऽ माल-जाल म॑ नया बीमारी केरऽ उपस्थिति के नोट करलऽ गेलै ।उत्तरदाता सब कहलनि जे सूखा के प्रमुख आपदा के रूप में बताओल गेल अछि, जाहि सं 65.4 प्रतिशत घर के प्रभावित कएल गेल अछि, ओकर बाद 54.3 प्रतिशत के बीमारी आ कीड़ा-मकोड़ा, 46.2 प्रतिशत पर तूफान, 32.6 प्रतिशत पर ओलाबंद, 28.5 प्रतिशत पर बाढ़ि, 21.7 प्रतिशत पर ठंडा लहर, लैंडस्लिडेड पर, लैंडस्लिडेड पर लैंडस्लिडेस पर, लैंड्स्लिडेड पर लैंडस्लिडेस पर, लैंडस्लिडेड पर लैंडस्लिडेस पर, लैंडस्लिडेड पर लैंडस्लिडेड पर. 21.5 प्रतिशत, आ 17.5 प्रतिशत पर बाढ़ि।विशेषज्ञऽ के कहना छै कि जलवायु के चरम व्यवहार के कारण किसानऽ क॑ अपनऽ रोजी-रोटी के आधार खोय सकै छै, आरू जे गरीबी स॑ बचलऽ छै, ओकरा भी ओकरा वापस घसीटलऽ जाय सकै छै ।एक समय मे बहुत लोगक कें प्रभावित करएय वाला जोखिम कें प्रबंधन सामान्यतया बहुत चुनौतीपूर्ण आ महग छै.बीमा एकटा महत्वपूर्ण जोखिम प्रबंधन उपकरण छै, ओ सब कहैत छै.नेपाल बीमा प्राधिकरण केरऽ बीमा विकास आरू संवर्धन प्रभाग केरऽ निदेशक पुजन अतिकाररी न॑ कहलकै कि लघु किसान आरू ग्रामीण समुदाय बिना पर्याप्त वित्तीय साधन के जलवायु जोखिम के प्रबंधन नै करी सकै छै ।“लेकिन मौसम केरऽ चरम घटना आरू जलवायु परिवर्तन केरऽ जवाब छै जेकरा स॑ किसान आरू कृषि आधारित उद्यमऽ के जोखिम आरू अनिश्चितता बढ़ी गेलऽ छै ।”कृषि बीमा खेती सं जुड़ल वित्तीय जोखिम कें कम करयत उद्योग मे स्थिरता आ विकास कें बढ़ावा देवय मे मदद कयर सकय छै.मुदा समस्याक भरमार अछि।सरकारी प्रीमियम सब्सिडी प्राप्त करय मे असफल रहल मार्च कें मध्य सं बीमा कंपनीक कें बीमा कंपनीक कें बीमा कंपनीक कें बीमा कंपनीक कें दावा बंद करय कें बात बंद कैल गेल छै.गैर-जीवन बीमा कंपनी क एहि हेडिंग क तहत सरकार लगभग 3 अरब रुपया साफ नहि भ सकल अछि।ओ कहला जे कृषि क्षेत्र मे गैर-भुगतान क मुद्दा हमरा सब कए कठिनाइ मे डाललक अछि।चूँकि कंपनी सब खेती बीमा के पूर्ण रूप स रोकने अछि, ताहि लेल किसान के बीमा के प्रति विश्वास के क्षीण क देत।&#39;गैर-भुगतान कें मुद्दाक कें अलावा, एकटा मुख्य चुनौतियक छै कि किसानक कें द्वारा अनुभव कैल गेल वास्तविक नुकसान कें अनुरूप एकटा उचित भुगतान दर कें परिभाषित कैल जै.अतिकारी कहलनि जे, अपेक्षित सं कम भुगतान दर सं बीमा के मांग कम होयत।हुनी कहलकै कि पारंपरिक मौसम आधारित पॉलिसी प भरोसा करै के बजाय, किसानऽ के मांग क पूरा करै लेली एगो उचित मौसम आधारित सूचकांक बीमा उत्पाद के डिजाइन लेली सावधानीपूर्वक शोध आरू जलवायु जोखिम के आकलन बहुत जरूरी छै ।नेपाल मौसम आधारित बीमा पॉलिसी अपनाबैत रहल अछि।विशेषज्ञऽ न॑ कहलकै कि मौसम आधारित सूचकांक बीमा किसानऽ के आय क॑ स्थिर करै लेली एगो शक्तिशाली उपकरण बनी सकै छै ।इंडेक्स बीमा एकटा अपेक्षाकृत नव उपकरण छै जे किसान जोखिम कें प्रबंधन मे मदद करय कें लेल उपयोग कयर सकय छै.ई मौसम के परिणाम के बजाय, स्थानीय मौसम स्टेशन पर या उपग्रह के द्वारा मापल जाय वाला सूचकांक के आधार पर, जेना कि किसान के फसल के पैदावार के आधार पर, एकरऽ भुगतान करै छै ।पारंपरिक फसल बीमा कें विपरीत, बीमा कंपनी कें प्रीमियम निर्धारित करय या नुकसान कें आकलन करय कें लेल कोनों किसान कें क्षेत्र मे जाय कें जरूरत नहि छै.बल्कि, यदि वर्षा कें राशि कोनों पूर्व-निर्दिष्ट सीमा सं नीचा छै, त बीमा कें भुगतान भ जायत छै.चूँकि भुगतान फसल कें जीवित रहय या असफलता सं नहि जुड़ल छै, अइ कें लेल किसान कें हमेशा फसल कें अस्तित्व कें लेल सर्वोत्तम निर्णय लेवा कें लेल प्रोत्साहित कैल जायत छै.इ नवीनता बीमा कंपनी कें लेनदेन लागत आ जोखिम कें काफी कम करयत छै, जे बीमा प्रीमियम कें कम करयत छै आ पहुंच मे वृद्धि करयत छै.एकरऽ अलावा अधीकरी के अनुसार, वू एगो ‘समावेशी बीमा’ पॉलिसी प॑ काम करी रहलऽ छै जेकरा म॑ सूक्ष्म, स्वास्थ्य आरू कृषि क्षेत्र क॑ व्यापक रूप स॑ शामिल करलऽ गेलऽ छै ।अधीकरी नँ कहलकै, &quot;हमरा समावेशी बीमा के जरूरत छै जे सस्ती आरू सुलभ छै, ई कम-ब्रैकेट आय वाला लोगऽ क कवर करतै,&quot; हमनी मोबाइल फोन के माध्यम स॑ बीमा खरीदै के संभावना के भी अध्ययन करी रहलऽ छियै । समावेशी बीमा पॉलिसी क॑ एक पन्ना प॑ सरल बनाबै के संभावना छै । , वर्तमान 17-18 पृष्ठ नीति के तुलना में लोगऽ क॑ समझै म॑ आसान बनाबै वाला छै ।कृषि आरू पशुधन विकास मंत्रालय केरऽ संयुक्त सचिव सबनम शिवाकोटी न॑ कहलकै कि वर्तमान म॑ किसानऽ क॑ हतोत्साहित करलऽ गेलऽ छै, कैन्हेंकि ओकरा म॑ स॑ बहुत लोगऽ क॑ बीमा भुगतान नै मिल॑ पारै छै ।ओ कहला जे अगर किसान प्रभावित होएत त राष्ट्रीय खाद्य प्रणाली पर असर पड़त।अस्तु, गैर-भुगतान मुद्दा के संबंध में मुद्दा के जल्द सं जल्द समाधान करबाक चाही.”नेपाल मे बहुत धूमधाम स फसल बीमा शुरू भेल।सरकार जनवरी 2013 सं निर्देशक कें निर्माण सं फसल आ पशुधन बीमा लागू करय रहल छै.एहि योजना क तहत सरकार पहिल साल मे प्रीमियम पर 50 प्रतिशत सब्सिडी उपलब्ध करौलक आ दोसर साल मे एकरा 75 प्रतिशत करि देलक।प्रीमियम सब्सिडी कए फेर स 50 प्रतिशत भ गेल आ 2021 मे 80 प्रतिशत भ गेल।शिवाकोटी क अनुसार जखन दस साल पहिने बीमा योजना शुरू भेल छल, तखन 802 दावा कैल गेल छल।पिछला वित्तीय वर्ष मे वार्षिक दावा 36 हजार भ गेल।हुनकर अनुसार कुल कृषि बीमा मे स फसल बीमा महज 5 प्रतिशत क हिसाब स अछि, जखन कि 95 प्रतिशत पशुधन बीमा अछि।शिवाकोटी न॑ कहलकै कि कृषि क्षेत्र एगो अत्यधिक जोखिम वाला क्षेत्र छै, आरू जलवायु आरू अन्य आपदा स॑ प्रेरित खेत स्तर के जोखिम के प्रबंधन लेली कृषि बीमा मुख्य विकल्प छै ।ओ कहला जे फसल आ माल-जाल क नुकसान क मुआवजा मांग बढ़ि रहल अछि आ राज्य कए भार भ रहल अछि।बीमा मात्र किसानक भरपाई करबाक तरीका अछि।&#39;"
