title,description,published date,url,publisher.href,publisher.title,full_article,images,translated
Ujyalo Nepal Party Protests Continuous Fuel Price Hikes - Ratopati,Ujyalo Nepal Party Protests Continuous Fuel Price Hikes  Ratopati,2026-04-18 02:06:25,https://news.google.com/rss/articles/CBMi6gFBVV95cUxQTFpXVnlPX0laMjdiV3l2bmE3eDJKNnk2cUxHREhLb3ZmVk1peFFaaEJTQnNuTFc2V19IdVJQSDM4dHpQY19ReDVMR0RIM29hVzFDM0FOcXk4YzdqVTdnb0RpQWczLXFXRnpRcmNxOHhvMzZXQ0RDYXk5MjdMNWh2SWZyMC16ZkZkczlGT3pzMnQ2YjBWbm1BY09vNi1RS3p4TEc4cXVjbmlnWWp1cHZyZXc5MXpfcWdONDVOXzhvSDZuZWNKWkNCMGZrbjVFc2M0Sk9iX1Q2MG5fVHE1cWNvcGt6SkplZmVsdnc?oc=5&hl=en-US&gl=US&ceid=US:en,https://english.ratopati.com,Ratopati,"Kathmandu. The Ujyalo Nepal Party has expressed strong objection to the recent continuous increases in petroleum prices. In a press release, the party stated that there were expectations of stability in the fuel market after Prime Minister Balen Shah assumed office on 27 March 2026. However, the reality has proven to be the opposite, with fuel prices being hiked repeatedly since the government's formation.

The party further added, 'When fuel prices rise, the impact is not limited to petrol pumps. It creates a chain reaction affecting transportation, logistics, agriculture, construction, industry, retail, schools, hospitals, and daily household expenses. More critically, once prices rise due to increased costs, they rarely return to previous levels even if fuel prices drop. Therefore, fuel price hikes are one of the most sensitive triggers for inflation.'

The party noted that while other South Asian countries have attempted to provide relief through tax adjustments, subsidies, and automated pricing systems during difficult times, no such strategic intervention has been seen in Nepal.

The statement reads, 'Currently, petrol has reached Rs 219 and diesel Rs 237 per liter in Kathmandu. Comparing this to prices in the bordering Indian town of Raxaul, petrol is approximately Rs 48 and diesel Rs 88 more expensive in Nepal. Such an unnatural price gap significantly increases the risk of smuggling, informal supply, and illegal trade. If this imbalance persists, it could lead to a rise in illegal cross-border fuel trade and negatively impact state revenue.'

Asserting that the government's role in essential commodities like fuel cannot be limited to merely approving price hikes, the party demanded that the state take an active role in price control, relief, transparency, and developing alternatives.

The Ujyalo Nepal Party has placed the following demands before the government:

1. Immediately review taxes, customs, infrastructure levies, and other charges on petroleum products to reduce retail prices.

2. Utilize available price stabilization funds immediately to provide relief to the public.

3. Establish a special price equalization mechanism to reduce the unnatural price gap between Nepal and Indian border markets.

4. Conduct joint monitoring campaigns to control smuggling, black marketing, artificial shortages, and carteling.

5. Reduce dependence on petroleum by providing targeted subsidies for electric stoves, electric vehicles, and the use of domestic energy.

6. Ensure full transparency by regularly publishing the actual cost price, tax structure, profit/loss, and the basis for price adjustments of the Nepal Oil Corporation.","{'https://rpcdn.ratopati.com/media/albums/kanchanganga_gab5GdO5Tc.jpg', 'https://english.ratopati.com/build/img/logo-rp.png', 'https://npcdn.ratopati.com/media/news/water-bottle_5cd38cc983e3b8ce28c9595b3133f63b_ToYxSmOjBx.avif', 'https://npcdn.ratopati.com/media/authors/ratopati_science_RGmmSpmAnu.jpg', 'https://npcdn.ratopati.com/media/news/deuba-gagan_G5WF8gLC73.jpg', 'https://npcdn.ratopati.com/media/news/01-1776481757-o8lng_Y1bECmTeis.jpg', 'https://npcdn.ratopati.com/media/news/matdata-namabali-darta-(12)_reokQGrQgj.jpg', 'https://npcdn.ratopati.com/media/news/gagan-thapa_VVgrawger3.jpg', 'https://npcdn.ratopati.com/media/news/kulmanghising_banner_OlDQHEp4Li.jpg', 'https://npcdn.ratopati.com/media/news/perisdanda-anasan_DTXgMNNzA6.jpg', 'https://npcdn.ratopati.com/media/news/durga_8l9uFh1qBa.png', 'https://npcdn.ratopati.com/media/news/accident1_0HVVwEUEAJ.jpg', 'https://npcdn.ratopati.com/media/news/UKB2PCDB6U.jpg'}","काठमांडू। हाल मे पेट्रोलियम के दाम मे लगातार बढ़ोतरी पर उज्यालो नेपाल पार्टी घोर आपत्ति जतौलक अछि । पार्टी न॑ एक प्रेस विज्ञप्ति म॑ कहलकै कि प्रधानमंत्री बालेन शाह केरऽ २७ मार्च २०२६ क॑ पदभार संभालला के बाद ईंधन बाजार म॑ स्थिरता के उम्मीद छेलै ।लेकिन वास्तविकता एकरऽ उल्टा साबित होय गेलऽ छै, सरकार केरऽ गठन के बाद स॑ ईंधन केरऽ दाम म॑ बार-बार बढ़ोत्तरी होय रहलऽ छै ।

पार्टी आगू कहलनि जे, जखन ईंधन के दाम बढ़ैत अछि त एकर असर सिर्फ पेट्रोल पंप तक सीमित नहि रहैत अछि। इ परिवहन, रसद, कृषि, निर्माण, उद्योग, खुदरा, स्कूल, अस्पताल, आ दैनिक घरेलू खर्च कें प्रभावित करय वाला श्रृंखलाबद्ध प्रतिक्रिया पैदा करएयत छै. एहि सं बेसि गंभीर बात ई जे एक बेर बढ़ल लागत के कारण दाम बढ़ला पर ईंधन के दाम गिरला पर सेहो ओ शायदे पहिने के स्तर पर वापस आबि जाएत अछि. एहि लेल ईंधन क दाम मे बढ़ोतरी महंगाई क सबस संवेदनशील ट्रिगर मे स एक अछि।'

पार्टी न॑ नोट करलकै कि दक्षिण एशिया केरऽ अन्य देश न॑ जहाँ कठिन समय म॑ कर समायोजन, सब्सिडी, आरू स्वचालित मूल्य निर्धारण प्रणाली के माध्यम स॑ राहत दै के कोशिश करलकै, वहीं नेपाल म॑ ऐसनऽ कोनो रणनीतिक हस्तक्षेप नै देखलऽ गेलऽ छै ।

बयान मे कहल गेल अछि जे, ‘अखन काठमांडू मे पेट्रोल 219 टका आ डीजल 237 टका प्रति लीटर पहुंच गेल अछि। एकरऽ तुलना सीमावर्ती भारतीय शहर रक्सौल केरऽ दाम स॑ करलऽ जाय त॑ नेपाल म॑ पेट्रोल केरऽ दाम लगभग ४८ रुपया आरू डीजल ८८ रुपया अधिक छै । एहन अप्राकृतिक मूल्य अंतर तस्करी, अनौपचारिक आपूर्ति, आ अवैध व्यापार कें खतरा काफी बढ़ाबैत छै. अगर ई असंतुलन बनलऽ रहतै त॑ एकरा स॑ सीमा पार स॑ अवैध रूप स॑ ईंधन के व्यापार बढ़ी सकै छै आरू राज्य केरऽ राजस्व प॑ नकारात्मक असर पड़॑ सकै छै ।'

ईंधन जैसनऽ आवश्यक वस्तु म॑ सरकार केरऽ भूमिका खाली दाम बढ़ाबै क॑ मंजूरी दै तलक सीमित नै हुअ॑ सकै छै, ई बात प॑ जोर दैत पार्टी न॑ मांग करलकै कि राज्य न॑ मूल्य नियंत्रण, राहत, पारदर्शिता, आरू विकल्प विकसित करै म॑ सक्रिय भूमिका निभाबै ।

उज्यलो नेपाल पार्टी सरकारक समक्ष निम्नलिखित माँग रखलक अछि : १.

1. खुदरा मूल्य मे कमी कें लेल पेट्रोलियम उत्पादक पर कर, सीमा शुल्क, बुनियादी ढांचे कें लेवी, आ अन्य शुल्क कें तुरंत समीक्षा करनाय.

2. उपलब्ध मूल्य स्थिरीकरण निधि कें तुरंत उपयोग करनाय ताकि जनता कें राहत देल जा सकय.

3. नेपाल आ भारतीय सीमा बाजारक बीच अप्राकृतिक मूल्य अंतर केँ कम करबाक लेल विशेष मूल्य समीकरण तंत्र स्थापित करब।

4. तस्करी, ब्लैक मार्केटिंग, कृत्रिम कमी, आ कार्टेलिंग कें नियंत्रित करय कें लेल संयुक्त निगरानी अभियान चलानाय.

5. इलेक्ट्रिक स्टोव, इलेक्ट्रिक वाहन, आ घरेलू ऊर्जा कें उपयोग कें लेल लक्षित सब्सिडी प्रदान कयर पेट्रोलियम पर निर्भरता कें कम करनाय.

6. नेपाल तेल निगम के वास्तविक लागत मूल्य, कर संरचना, लाभ/हानि, आ मूल्य समायोजन के आधार नियमित रूप स प्रकाशित क पूर्ण पारदर्शिता सुनिश्चित करब।"
Nepal set for contraceptive shortage amid funding cuts - The Kathmandu Post,Nepal set for contraceptive shortage amid funding cuts  The Kathmandu Post,2026-04-18 02:06:39,https://news.google.com/rss/articles/CBMiogFBVV95cUxQNXhYbXM0bkx5MWJ2MUN3LUlXendEZy1OSy1uMUdiTmhNSzY0eTZ4S05CY3JkUWJNdkxySVpOU3dqVk9OMHBaYkZVbmFiUGJicVJyUmFiVEsxNUR6MzBQUFdwQllYbnc1U2MwbVZXMTRiYmxGbGN4ZHJoNUlpc3pWX1dtbnh6QWVRLU54LWZ1ZTJTY2p5b2R0N01pZzZOeEdtZXc?oc=5&hl=en-US&gl=US&ceid=US:en,https://kathmandupost.com,The Kathmandu Post,"Until a few months ago, many health facilities across the country faced a critical shortage of family planning products, especially Depo-Provera, a birth control shot, intrauterine devices (IUDs), and condoms, among other things. Health authorities had requested the United Nations Population Fund (UNFPA) for those commodities to address the critical shortage.

Although there is currently no shortage of contraceptives at present in health facilities, officials say existing stocks may not last long since both major aid agencies and the government are reducing the budget for the family planning programmes.

“The Ministry of Health and Population used to allocate Rs250 million to purchase contraceptives, but the ceiling for the next fiscal year [2026-27] has been brought down to Rs170 million,” said Sarmila Dahal, chief of the Family Planning and Reproductive Health Section at the Family Welfare Division under the Department of Health Services.

“Likewise, the UNFPA, which used to provide $3.2 million a year to Nepal, has reduced its budget to $1.06 million for 2026.”

Officials say that the suspension of USAID grants, both to the Health Ministry and to the UN agency, was responsible for the previous shortfall in family planning commodities.

“The UN agency may have other priorities and countries to focus on, which forced it to cut funding,” an official at the Family Welfare Division said, asking not to be named, as he is not authorised to speak on issues related to development partners.”

Officials say they have informed officials at the Health Ministry and the Ministry of Finance about the looming shortage of contraceptives and urged them to allocate more budget. They say that the previous shortage was due to the failure of federal government agencies to purchase them for about 2 years, the appreciation of the US dollar against the Nepali rupee, and inadequate funding.

“We have to purchase family planning funds through multi-year bidding,” said Dahal. “If the budget is not increased, there will be a shortage.”

Experts say that the shortage of family planning commodities and instruments for a long time leads to a rise in unintended pregnancies and unsafe abortions.

In Nepal, nearly half of all pregnancies are unintended, and close to two-thirds of them end in abortion, according to a report by the UNFPA.

The UNFPA’s ‘State of World Population 2022’ report, titled “Seeing the Unseen”, says half of the 1.2 million pregnancies in 2017 in Nepal were unintended, and nearly 359,000 ended in abortion.

The report stated that the toll of unintended pregnancies is—and has long been—unseen.

“Although we can estimate healthcare costs, monitor school dropout rates and project levels of workforce attrition due to unintended pregnancies, these only scratch the surface,” the report says. “No number could adequately represent the loss of life, agency and human capital that result from unintended pregnancies.”

Every year, around 100,000 women undergo abortions in Nepal at legally authorised clinics and health facilities. Gynaecologists, however, say the actual number of abortions could be several times the government figure, as many abortions, especially medical ones, go unreported.

The National Demographic Health Survey-2022 shows that 21 percent of currently married women in Nepal have an unmet need for family planning services. Officials said that the demand for contraceptives, including birth control shots in the state-run health facilities, has risen after the USAID funding to private organisations was suspended in January last year.

The government has a commitment to provide contraceptives, including birth control shots, IUDs, and implants free of cost, but its own budget is limited.","{'https://assets-cdn.kathmandupost.com/uploads/source/news/2026/third-party/shortgae1695606170-1776477940.jpg', 'https://jcss-cdn.kathmandupost.com/assets/images/logo-sticky-bar-tkp-weekender-1.png', 'https://jcss-cdn.kathmandupost.com/assets/images/tkp-logo-weekender.png', 'https://jcss-cdn.kathmandupost.com/assets/images/logos/thekathmandupost-logo.png', 'https://jcss-cdn.kathmandupost.com/assets/images/logos/thekathmandupost-logo-white.png', 'https://openweathermap.org/img/w/04d.png', 'https://jcss-cdn.kathmandupost.com/assets/images/lazy.png'}","किछ महीना पहिले तइक देश भर मे बहुत सं स्वास्थ्य सुविधाक मे परिवार नियोजन उत्पादक कें गंभीर कमी कें सामना करय पड़य छै, खासकर डेपो-प्रोवेरा, जन्म नियंत्रण शॉट, गर्भाशय कें भीतर उपकरण (आईयूडी), आ कंडोम, आ अन्य चीजक कें. स्वास्थ्य अधिकारी न॑ संयुक्त राष्ट्र जनसंख्या कोष (यूएनएफपीए) स॑ वू वस्तु लेली आग्रह करल॑ छेलै ताकि ई गंभीर कमी क॑ दूर करलऽ जाय सक॑ ।

हालांकि एखन स्वास्थ्य सुविधा मे गर्भनिरोधक क कमी नहि अछि, मुदा अधिकारी क कहब अछि जे मौजूदा स्टॉक बेसी दिन नहि चल सकैत अछि, किया कि प्रमुख सहायता एजेंसी आ सरकार दुनू परिवार नियोजन कार्यक्रम क बजट मे कमी क रहल अछि।

स्वास्थ्य सेवा विभाग के तहत परिवार कल्याण प्रभाग के परिवार नियोजन आ प्रजनन स्वास्थ्य अनुभाग के प्रमुख सरमिला दाहाल कहलनि जे, स्वास्थ्य आ जनसंख्या मंत्रालय गर्भनिरोधक खरीदबा लेल 25 करोड़ रुपया आवंटित करैत छल, मुदा अगिला वित्तीय वर्ष [2026-27] के सीमा 17 करोड़ रुपया तक घटा देल गेल अछि।

“तहिना नेपाल के सालाना 32 लाख डॉलर के मदद करय वाला यूएनएफपीए 2026 के लेल अपन बजट घटा क 10.6 लाख डॉलर क देलक अछि।”

अधिकारी सब के कहनाय छनि जे स्वास्थ्य मंत्रालय आओर संयुक्त राष्ट्र एजेंसी दुनू के यूएसएआईडी के अनुदान के निलंबन परिवार नियोजन के वस्तु मे पहिने के कमी के लेल जिम्मेदार छल.

परिवार कल्याण प्रभाग केरऽ एगो अधिकारी न॑ कहलकै कि संयुक्त राष्ट्र एजेंसी केरऽ दोसरऽ प्राथमिकता आरू देशऽ प॑ ध्यान देना पड़॑ सकै छै, जेकरा चलतें ओकरा फंडिंग म॑ कटौती करै ल॑ मजबूर होय गेलै ।

अधिकारी के कहनाय छनि जे ओ स्वास्थ्य मंत्रालय आओर वित्त मंत्रालय के अधिकारी के गर्भनिरोधक के आबि रहल कमी के बारे मे जानकारी देलखिन्ह आओर बेसि बजट आवंटित करय के आग्रह केलखिन्ह. हुनका सब के कहनाय छनि जे पहिने के कमी के कारण संघीय सरकार के एजेंसी के करीब 2 साल तक एकरा खरीदय मे असफलता, नेपाली रुपया के मुकाबले अमेरिकी डॉलर के बढ़ोतरी, आओर अपर्याप्त फंडिंग छल.

दाहाल कहलनि जे, हमरा सबके बहुवर्षीय बोली के माध्यम स परिवार नियोजन के फंड खरीदय पड़त। “बजट नहि बढ़ल तऽ कमी होयत।”

विशेषज्ञऽ के कहना छै कि परिवार नियोजन केरऽ वस्तु आरू उपकरण केरऽ बहुत दिन स॑ कमी के कारण अनचाहा गर्भधारण आरू असुरक्षित गर्भपात म॑ वृद्धि होय छै ।

नेपाल म॑ लगभग आधा सब गर्भधारण अनचाहा होय छै, आरू लगभग दू तिहाई गर्भपात म॑ समाप्त होय जाय छै, यूएनएफपीए केरऽ एगो रिपोर्ट के अनुसार ।

यूएनएफपीए केरऽ ‘विश्व जनसंख्या केरऽ स्थिति २०२२’ केरऽ रिपोर्ट म॑ कहलऽ गेलऽ छै कि नेपाल म॑ २०१७ म॑ १२ लाख गर्भधारणऽ म॑ स॑ आधा अनचाहा छेलै, आरू लगभग ३५९,००० गर्भपात म॑ समाप्त होय गेलऽ छेलै ।

रिपोर्ट मे कहल गेल अछि जे अनचाहा गर्भधारण के टोल अदृश्य अछि-आ बहुत दिन सं अछि-अनदेखल अछि.

रिपोर्ट मँ कहलौ गेलौ छै, “हालांकि हम स्वास्थ्य देखभाल केरौ लागत के अनुमान लगाय सकै छियै, स्कूल छोड़ै के दर आरू अनचाहा गर्भधारण के कारण कार्यबल के क्षय के परियोजना स्तर के निगरानी करी सकै छियै, लेकिन ई सब केवल सतह के खरोंच करै छै । “कोनो संख्या पर्याप्त रूप सं जान, एजेंसी आ मानव पूंजी कें नुकसान कें प्रतिनिधित्व नहि कयर सकय छै जे अनचाहा गर्भधारण कें परिणामस्वरूप होयत छै.”

नेपाल मे प्रति वर्ष लगभग एक लाख महिला कानूनी रूप सँ अधिकृत क्लिनिक आ स्वास्थ्य सुविधा मे गर्भपात कराबैत छथि । हालांकि स्त्री रोग विशेषज्ञ के कहनाय छनि जे गर्भपात के वास्तविक संख्या सरकारी आंकड़ा सं कई गुना भ सकैत अछि, किएक त बहुत रास गर्भपात खास क मेडिकल गर्भपात के रिपोर्ट नहिं भ जाइत अछि.

राष्ट्रीय जनसांख्यिकीय स्वास्थ्य सर्वेक्षण-2022 के अनुसार नेपाल मे वर्तमान मे विवाहित महिला मे सं 21 प्रतिशत महिला के परिवार नियोजन सेवा के अपूर्ण आवश्यकता अछि. अधिकारी सब के कहनाय छनि जे पिछला साल जनवरी मे निजी संगठन के यूएसएआईडी के फंडिंग रोकला के बाद सरकारी स्वास्थ्य सुविधा मे जन्म नियंत्रण के शॉट सहित गर्भनिरोधक के मांग बढ़ल अछि.

सरकार केरऽ प्रतिबद्धता छै कि गर्भनिरोधक दवाई, जेकरा म॑ जन्म नियंत्रण केरऽ शॉट, आईयूडी, आरू इम्प्लांट शामिल छै, मुफ्त म॑ उपलब्ध कराबै के छै, लेकिन ओकरऽ अपनऽ बजट सीमित छै ।"
"“Present, vigilant, ready”, says US Central Command as naval blockade continues against Iran - Nepalnews.com","“Present, vigilant, ready”, says US Central Command as naval blockade continues against Iran  Nepalnews.com",2026-04-18 02:10:08,https://news.google.com/rss/articles/CBMizwFBVV95cUxORFp2dDNKbGNvVmlxSGhfTldjUnFLYzRHb3pGWUNSS0lHRUVteVVFem13WWlxOW8xNW9udDBvMVNRck1zODZiWE96QWhULVkyZ05waGlYczE3Zk9SN3RPRmppb3ZBWjNrYnhCUmdHT1ZFN29BNVQzbHIwcTVDZkZRSUhidVFkNUVBamdabWlQa2Vjd2xfdlBlTl9MQmp2Y1E3SElOc3JPTGlpUHBwdENIVUNMZWxQcnFRNmhRZDRTUHVkVkVFYTVlLUg2RTRJTWM?oc=5&hl=en-US&gl=US&ceid=US:en,https://english.nepalnews.com,Nepalnews.com,,,
