title,description,published date,url,publisher.href,publisher.title,full_article,images,translated
"Operational Update: Boosting Rural Health in Nepal, Dengue Relief in Mexico, Mental Health in the US - Direct Relief","Operational Update: Boosting Rural Health in Nepal, Dengue Relief in Mexico, Mental Health in the US  Direct Relief",2024-05-24 21:41:28,https://news.google.com/rss/articles/CBMihwFodHRwczovL3d3dy5kaXJlY3RyZWxpZWYub3JnLzIwMjQvMDUvb3BlcmF0aW9uYWwtdXBkYXRlLWJvb3N0aW5nLXJ1cmFsLWhlYWx0aC1pbi1uZXBhbC1kZW5ndWUtcmVsaWVmLWluLW1leGljby1tZW50YWwtaGVhbHRoLWluLXRoZS11cy_SAYsBaHR0cHM6Ly93d3cuZGlyZWN0cmVsaWVmLm9yZy8yMDI0LzA1L29wZXJhdGlvbmFsLXVwZGF0ZS1ib29zdGluZy1ydXJhbC1oZWFsdGgtaW4tbmVwYWwtZGVuZ3VlLXJlbGllZi1pbi1tZXhpY28tbWVudGFsLWhlYWx0aC1pbi10aGUtdXMvYW1wLw?oc=5&hl=en-US&gl=US&ceid=US:en,https://www.directrelief.org,Direct Relief,"When republishing:

Include a byline with the reporter’s name and Direct Relief in the following format: ""Author Name, Direct Relief."" If attribution in that format is not possible, include the following language at the top of the story: ""This story was originally published by Direct Relief.""

If publishing online, please link to the original URL of the story.

Maintain any tagline at the bottom of the story.

With Direct Relief's permission, news publications can make changes such as localizing the content for a particular area, using a different headline, or shortening story text. To confirm edits are acceptable, please check with Direct Relief by clicking this link.

If new content is added to the original story — for example, a comment from a local official — a note with language to the effect of the following must be included: ""Additional reporting by [reporter and organization].""

If republished stories are shared on social media, Direct Relief appreciates being tagged in the posts: Twitter (@DirectRelief) Facebook (@DirectRelief) Instagram (@DirectRelief)



Republishing Images:

Unless stated otherwise, images shot by Direct Relief may be republished for non-commercial purposes with proper attribution, given the republisher complies with the requirements identified below.

Maintain correct caption information.

Credit the photographer and Direct Relief in the caption. For example: ""First and Last Name / Direct Relief.""

Do not digitally alter images.

Direct Relief often contracts with freelance photographers who usually, but not always, allow their work to be published by Direct Relief’s media partners. Contact Direct Relief for permission to use images in which Direct Relief is not credited in the caption by clicking here.

Other Requirements:

Do not state or imply that donations to any third-party organization support Direct Relief's work.

Republishers may not sell Direct Relief's content.

Direct Relief's work is prohibited from populating web pages designed to improve rankings on search engines or solely to gain revenue from network-based advertisements.

Advance permission is required to translate Direct Relief's stories into a language different from the original language of publication. To inquire, contact us here.

If Direct Relief requests a change to or removal of republished Direct Relief content from a site or on-air, the republisher must comply.

For any additional questions about republishing Direct Relief content, please email the team here.","{'https://i0.wp.com/www.directrelief.org/wp-content/uploads/2024/05/Untitled-design-46.jpg?ssl=1', 'https://i0.wp.com/www.directrelief.org/wp-content/uploads/2024/05/Untitled-design-43.jpg?ssl=1', 'https://i0.wp.com/www.directrelief.org/wp-content/uploads/2024/05/Untitled-design-45.jpg?fit=1200%2C675&ssl=1', 'https://i0.wp.com/www.directrelief.org/wp-content/uploads/2024/05/fb-dengue-post-2-e1716583573285.jpg?ssl=1', 'https://i0.wp.com/www.directrelief.org/wp-content/uploads/2024/05/Untitled-design-48.jpg?ssl=1', 'https://i0.wp.com/www.directrelief.org/wp-content/uploads/2024/05/Untitled-design-47-copy.jpg?ssl=1', 'https://i0.wp.com/www.directrelief.org/wp-content/uploads/2024/05/Untitled-design-45.jpg?ssl=1', 'https://i0.wp.com/www.directrelief.org/wp-content/uploads/2024/05/Untitled-design-45.jpg?resize=1280%2C720&ssl=1'}","पुनर्प्रकाशन करय कें समय: रिपोर्टर कें नाम कें साथ एकटा बाईलाइन आ निम्नलिखित प्रारूप मे प्रत्यक्ष राहत कें शामिल करूं: &quot;लेखक नाम, प्रत्यक्ष राहत.&quot;यदि ओहि प्रारूप मे एट्रिब्यूशन संभव नहि अछि त&#39; कथाक शीर्ष पर निम्नलिखित भाषा शामिल करू: &quot;ई कथा मूलतः प्रत्यक्ष राहत द्वारा प्रकाशित भेल छल.&quot;यदि ऑनलाइन प्रकाशन, कृपया कहानी के मूल यूआरएल से लिंक करें |कथाक निचला भाग मे कोनो टैगलाइन केँ बरकरार राखू।प्रत्यक्ष राहत के अनुमति के साथ, समाचार प्रकाशन कोनो विशेष क्षेत्र के लेल सामग्री के स्थानीयकरण, अलग हेडलाइन के उपयोग करय के, या कहानी के पाठ के छोट करय के तरह परिवर्तन करय सकय छै.संपादन स्वीकार्य अछि, एहि लिंक पर क्लिक कए सीधा राहत सं जांच करू.यदि मूल कथा में नया सामग्री जोड़लऽ जाय छै — उदाहरण के लेलऽ, कोनो स्थानीय अधिकारी के टिप्पणी — भाषा के साथ एक टिप्पणी निम्नलिखित के प्रभाव के साथ शामिल करलऽ जाय छै: &quot;[रिपोर्टर आरू संगठन] द्वारा अतिरिक्त रिपोर्टिंग.&quot;यदि सोशल मीडिया पर पुनर्प्रकाशित कहानी साझा करलऽ जाय छै, त॑ प्रत्यक्ष राहत पोस्टऽ म॑ टैग होय के सराहना करै छै: ट्विटर (@DirectRelief) Facebook (@DirectRelief) Instagram (@DirectRelief) पुनः प्रकाशित करलऽ गेलऽ छवि: जब॑ तलक कि अन्यथा नै कहलऽ गेलऽ छै, प्रत्यक्ष राहत द्वारा शूट करलऽ गेलऽ छवि क॑ नॉन लेली पुनर्प्रकाशित करलऽ जाब॑ सकै छै । -पुनः प्रकाशक कें देखतय उचित विशेषणक कें साथ व्यावसायिक उद्देश्य निम्नलिखित आवश्यकताक कें अनुपालन करयत छै.सही कैप्शन जानकारी बनाए रखें।फोटोग्राफर के श्रेय आ कैप्शन में सीधा राहत।जेना : &quot;पहिल आ अंतिम नाम / प्रत्यक्ष राहत।&quot;डिजिटल रूप सं छवि मे बदलाव नहि करू.प्रत्यक्ष राहत अक्सर फ्रीलांस फोटोग्राफरऽ स॑ अनुबंध करै छै जे आमतौर प॑, लेकिन हमेशा नै, अपनऽ काम क॑ डायरेक्ट रिलीफ केरऽ मीडिया पार्टनर द्वारा प्रकाशित करै के अनुमति दै छै ।एतय क्लिक कए कैप्शन मे प्रत्यक्ष राहत कें श्रेय नहि देल गेल छवि कें उपयोग करय कें अनुमति कें लेल सीधा राहत सं संपर्क करूं.अन्य आवश्यकताक: इ नहि कहल जै या इ इंगित नहि करूं की कोनों तृतीय पक्ष संगठन कें दान प्रत्यक्ष राहत कें काज कें समर्थन करएयत छै.पुनर्प्रकाशनकर्ता सीधा राहतक सामग्री नहि बेचि सकैत छथि.प्रत्यक्ष राहत केरऽ काम क॑ सर्च इंजन प॑ रैंकिंग म॑ सुधार लेली डिजाइन करलऽ गेलऽ वेब पेज प॑ आबाद करलऽ जाय छै या केवल नेटवर्क आधारित विज्ञापनऽ स॑ राजस्व प्राप्त करै लेली डिजाइन करलऽ गेलऽ छै ।प्रत्यक्ष राहत के कथा के प्रकाशन के मूल भाषा स॑ अलग भाषा म॑ अनुवाद करै लेली अग्रिम अनुमति के जरूरत छै ।जिज्ञासा करबाक लेल एतय संपर्क करू।यदि प्रत्यक्ष राहत कोनों साइट या ऑन-एयर सं पुनर्प्रकाशित प्रत्यक्ष राहत सामग्री मे बदलाव या हटावय कें अनुरोध करय छै, त पुनर्प्रकाशक कें अनुपालन करनाय आवश्यक छै.प्रत्यक्ष राहत सामग्री कें पुनर्प्रकाशन कें बारे मे कोनों अतिरिक्त सवालक कें लेल, कृपया टीम कें एतय ईमेल करूं."
Nepal sherpa scales Everest for record 30th time; two climbers go missing - Reuters,Nepal sherpa scales Everest for record 30th time; two climbers go missing  Reuters,2024-05-24 21:49:00,https://news.google.com/rss/articles/CBMiY2h0dHBzOi8vd3d3LnJldXRlcnMuY29tL3dvcmxkL2FzaWEtcGFjaWZpYy9uZXBhbC1zaGVycGEtc2NhbGVzLWV2ZXJlc3QtcmVjb3JkLTMwdGgtdGltZS0yMDI0LTA1LTIyL9IBAA?oc=5&hl=en-US&gl=US&ceid=US:en,https://www.reuters.com,Reuters,,,
