title,description,published date,url,publisher.href,publisher.title,full_article,images,translated
"Unlocking Nepal’s Digital Future: A Call for Courage, Collaboration, and Collective Growth - myRepublica","Unlocking Nepal’s Digital Future: A Call for Courage, Collaboration, and Collective Growth  myRepublica",2025-07-17 04:02:51,https://news.google.com/rss/articles/CBMiygFBVV95cUxQaE5OSG8zb1lFdkNvcDRsRU1CTHVVcHdYVFJZN05neU1tOG16dmZPOERNRkExZ25KLWFlX0tGZWkwOFBzTEliei03eEd1V0lsSUFFbVlscm1QVjVvQ1pmSUswbkc3THlOYWRGSnVxMGpYTHdyTVE2RkNRdFdCQkNIc1JFUE1zcFdNazc1SzNnOGktUEhQRmhVZ2hldlN2blF0VFBWUW5EZU9nRFNheDNaS29oWW8tajZNM0FJaGZpNkxiLVJRTDdfeWFR?oc=5&hl=en-US&gl=US&ceid=US:en,https://myrepublica.nagariknetwork.com,myRepublica,,{'https://lh3.googleusercontent.com/J6_coFbogxhRI9iM864NL_liGXvsQp2AupsKei7z0cNNfDvGUmWUy20nuUhkREQyrpY4bEeIBuc=s0-w300'},
Upsurge of snakebite cases in Nepal - The Kathmandu Post,Upsurge of snakebite cases in Nepal  The Kathmandu Post,2025-07-17 04:21:59,https://news.google.com/rss/articles/CBMihgFBVV95cUxQN1hpV0ZpaHo4OUVjRGF2X0F4X2d2bjFENUo4dkEtZnZBM1pQbEVsb2tJblhUZjlTdEljS2xkMG1MS29nanRnWGZqLXlnRTBEM0h1OUhYMk5EMnVGRmNYY1gzM0o1empJcmV4cjBJcjNlb0h1S2lDMFFDMG1Da1diY0xuUjNkUQ?oc=5&hl=en-US&gl=US&ceid=US:en,https://kathmandupost.com,The Kathmandu Post,,{'https://lh3.googleusercontent.com/J6_coFbogxhRI9iM864NL_liGXvsQp2AupsKei7z0cNNfDvGUmWUy20nuUhkREQyrpY4bEeIBuc=s0-w300'},
Nepal sees 11.33% rise in revenue collection in FY 2024/25 - Khabarhub,Nepal sees 11.33% rise in revenue collection in FY 2024/25  Khabarhub,2025-07-17 04:46:05,https://news.google.com/rss/articles/CBMiWEFVX3lxTE5WRzhIOG5KSUhTRFQyc1pfSk9zRU9GdEpReGR0dXpLWVlzNGJfamdnaU8yZGtxcFpTNTZ3Q3AwdkhoUHQ3cDA4Ym5hT0xnTUFSSko3bUhhcEw?oc=5&hl=en-US&gl=US&ceid=US:en,https://english.khabarhub.com,Khabarhub,,{'https://lh3.googleusercontent.com/J6_coFbogxhRI9iM864NL_liGXvsQp2AupsKei7z0cNNfDvGUmWUy20nuUhkREQyrpY4bEeIBuc=s0-w300'},
Nepal to face Sri Lanka again in SAFF U-20 Women’s Championship - Onlinekhabar English,Nepal to face Sri Lanka again in SAFF U-20 Women’s Championship  Onlinekhabar English,2025-07-17 05:29:00,https://news.google.com/rss/articles/CBMid0FVX3lxTE9aZWZpVk1XYzRWT0VrYXJobXplYUdvdFlLWmx6Z3d6M1FsNTh4T2RhOEgwM3JxcmJFbVhrQ3lpenVRUkFWaEJqRE1LaFJoMjVpX2RZaXg2WmliRVMtdU4xUVNzS1hxelMxQWhQZVlza00yUl9tVGow?oc=5&hl=en-US&gl=US&ceid=US:en,https://english.onlinekhabar.com,Onlinekhabar English,,{'https://lh3.googleusercontent.com/J6_coFbogxhRI9iM864NL_liGXvsQp2AupsKei7z0cNNfDvGUmWUy20nuUhkREQyrpY4bEeIBuc=s0-w300'},
JSP-N withdraws support for Oli-led government - The Himalayan Times,JSP-N withdraws support for Oli-led government  The Himalayan Times,2025-07-17 05:48:45,https://news.google.com/rss/articles/CBMiigFBVV95cUxQN0ZKTDlFVVRfR2tidmNtWDZFUTZGSlRiS3VQLUNiYXRFWTBHVlYzaVJQM0JuN193UHZVVFBpOHVwSmNSV2VOQUxhcFBxTDRSVHNqdlVhUDRWX21MVGJjeW80RWs4ZkFVN2NpcFhjNDN1VWZ4YXo3RUtOemJONDdJLUYtQWxWZ2Fqa0E?oc=5&hl=en-US&gl=US&ceid=US:en,https://thehimalayantimes.com,The Himalayan Times,,{'https://lh3.googleusercontent.com/J6_coFbogxhRI9iM864NL_liGXvsQp2AupsKei7z0cNNfDvGUmWUy20nuUhkREQyrpY4bEeIBuc=s0-w300'},
Kicking change: Aurium Academy blends football with mental wellness in Nepal - The Himalayan Times,Kicking change: Aurium Academy blends football with mental wellness in Nepal  The Himalayan Times,2025-07-17 05:50:15,https://news.google.com/rss/articles/CBMisgFBVV95cUxPMXlPMmVmTC1MaFIxTjJnZUxfUzhCdTViOTNBamp1bjhxeEh6MVdoVlRzRzBmdG1pNTU0RkJING1RSVdzZ0lXRElBdmlmSzF6WDdTNFJaM2dFbFFodVZnN014S3pTRHVBeHhfTlNtWVQxM3RiQ0dsRG4wOFNpOVJybmMxVFpXejVFbVRBdy1JREcwV1hfaGEtUWNycnI2U1lydWNSQkVkVzIySlM4Z0ZsaFBn?oc=5&hl=en-US&gl=US&ceid=US:en,https://thehimalayantimes.com,The Himalayan Times,,{'https://lh3.googleusercontent.com/J6_coFbogxhRI9iM864NL_liGXvsQp2AupsKei7z0cNNfDvGUmWUy20nuUhkREQyrpY4bEeIBuc=s0-w300'},
Nepal Enhances Tourist Safety with Cutting-Edge Satellite Communication Services: A New Era of Secure Travel - Travel And Tour World,Nepal Enhances Tourist Safety with Cutting-Edge Satellite Communication Services: A New Era of Secure Travel  Travel And Tour World,2025-07-17 06:04:35,https://news.google.com/rss/articles/CBMi7AFBVV95cUxOX0kzU0t1bWU3ZUFuNjJXTnlENWNmOFhzSWIwLWhkNXNlcWNfajBlOWE0Zjd1TEk5bHBKQVJOblFRNGpLa2gtTlBPTVVuZ1AxUEhPZXp6dVZ5NDc4UEkwUS0tN0FyOXRlVGpJSHQ1SXpnR09YbDhZbWxsNnFFc0ZySHhDNTFlSnYwd21FOXNCRkdvQS1ETTdRVHVtMGZoRXFhWTNpc0REblZnX3hxTHU4SjhfR0toaUxIZXRtUGNZSUNuNjhTUzJfUWZjN1ktcTZsOFZDeVRJb0loZEhaQjdjRXNFQTYtbFhQSTdhaw?oc=5&hl=en-US&gl=US&ceid=US:en,https://www.travelandtourworld.com,Travel And Tour World,,{'https://lh3.googleusercontent.com/J6_coFbogxhRI9iM864NL_liGXvsQp2AupsKei7z0cNNfDvGUmWUy20nuUhkREQyrpY4bEeIBuc=s0-w300'},
Disasters kill 93 in 3 months in Nepal - Latest news from Azerbaijan,Disasters kill 93 in 3 months in Nepal  Latest news from Azerbaijan,2025-07-17 06:05:33,https://news.google.com/rss/articles/CBMia0FVX3lxTFBnWjQzQkVGRUdjMHo5eDlwbHVkVnd4aGhSNEZpeTZ5MURJZFZYci1uS1luc0dLcTJzQmg0WXg3TGhQVWd3Q0xyN1JsaHVxTllzOTY0N1pQUGZOTHZrLV81c1BKUEwtTVF3Nlhv?oc=5&hl=en-US&gl=US&ceid=US:en,https://news.az,Latest news from Azerbaijan,,{'https://lh3.googleusercontent.com/J6_coFbogxhRI9iM864NL_liGXvsQp2AupsKei7z0cNNfDvGUmWUy20nuUhkREQyrpY4bEeIBuc=s0-w300'},
FDI and Nepal’s economic development - The Annapurna Express,FDI and Nepal’s economic development  The Annapurna Express,2025-07-17 06:08:23,https://news.google.com/rss/articles/CBMiV0FVX3lxTE1YX19GOXdmZUttTjZ6eEF6cW5qc3EzTU9mZjhKMmFvYjA0aklIMVdMZm5xcjJ5YUNucktET1RmVEt0WnJ4a193RTU2N3ZVcm9JLTVJNWRlNA?oc=5&hl=en-US&gl=US&ceid=US:en,https://theannapurnaexpress.com,The Annapurna Express,,{'https://lh3.googleusercontent.com/J6_coFbogxhRI9iM864NL_liGXvsQp2AupsKei7z0cNNfDvGUmWUy20nuUhkREQyrpY4bEeIBuc=s0-w300'},
Dassault Systèmes Partners with Yatri Motorcycles in Nepal - SMEStreet,Dassault Systèmes Partners with Yatri Motorcycles in Nepal  SMEStreet,2025-07-17 06:22:12,https://news.google.com/rss/articles/CBMiogFBVV95cUxOMDYwdk9mMHdwRS1pZUgwbnhfd1dKVy1raEZiR1dmRFdlTjB3MFJJM3VlZFpCYU9hQk5TTDFla1ppMlpDTTBvMDU3VlViY3FWS1dEbXVvcUlyQWZBQ2FEbmZ3WjFZMFhhdFRTdG1xSUs5VXlMckNjcExSZFlhN0p5SE5PZHFJejM5aWJ2YXR6S0ZkMTJnREpkQ0dCaGtBVGRnX3c?oc=5&hl=en-US&gl=US&ceid=US:en,https://smestreet.in,SMEStreet,,{'https://lh3.googleusercontent.com/J6_coFbogxhRI9iM864NL_liGXvsQp2AupsKei7z0cNNfDvGUmWUy20nuUhkREQyrpY4bEeIBuc=s0-w300'},
Nepal captain signs for Wellington Phoenix - RNZ,Nepal captain signs for Wellington Phoenix  RNZ,2025-07-17 06:35:24,https://news.google.com/rss/articles/CBMiigFBVV95cUxPT0dfLTVNcURzUEk0M1ByWXhWeDZDS0MyRUJwOW5fODRyVDFUVk1FdkNQWlFhd2daRVpMdFhmLWdnU1FhQnBOMkhVZlNPUjRaSUR6cnN0N19mbWN0SGNiUS1xR1pIUXhUYlVraFNoQ3FmZWdSX1lHNVByU2JrZTBhcHV3QWw2b21oTUE?oc=5&hl=en-US&gl=US&ceid=US:en,https://www.rnz.co.nz,RNZ,,{'https://lh3.googleusercontent.com/J6_coFbogxhRI9iM864NL_liGXvsQp2AupsKei7z0cNNfDvGUmWUy20nuUhkREQyrpY4bEeIBuc=s0-w300'},
Nepali Congress at a strategic crossroads: The urgency of unity amid emerging threats - The Himalayan Times,Nepali Congress at a strategic crossroads: The urgency of unity amid emerging threats  The Himalayan Times,2025-07-17 08:15:00,https://news.google.com/rss/articles/CBMivwFBVV95cUxPTEVCV3pNY29JLURQREJjaEhxQ2gwUl9wa1JvMVdvRFFhdjkzelFCUzhVNWpOcGtrN3hJc1pnUjRjaXk4VnJkb1gzVHRReGtWdDc1UFc3cWVoSDZtWF9SOEVsTVBwa0VkSzNVZ0ZCdWxoei1Md3RVVVNRcXF6Q3ZUS1BiNkdPTmk2X3Njd3FaTmcwNWZjOXRLRGZqVnNqckl3ZnN2X0FxNWJqV0JvT0FYVHV2ODRtSjd5a25TbVFDQdIBXEFVX3lxTE9OcUptbV9JNGdSSnJQc0IwWnNVeHRSWXotSDByMEl6a1pmTElwQldHSDFWanZpbG13VWNNdWhtOFRubGsyRnQ1U2g1LUgtaXp1XzI5U3A5ak9GOFl3?oc=5&hl=en-US&gl=US&ceid=US:en,https://thehimalayantimes.com,The Himalayan Times,,{'https://lh3.googleusercontent.com/J6_coFbogxhRI9iM864NL_liGXvsQp2AupsKei7z0cNNfDvGUmWUy20nuUhkREQyrpY4bEeIBuc=s0-w300'},
"Nepal’s Aampani Waterfall In Kailali Emerges As A Premier Ecotourism Destination, Offering A Perfect Blend Of Natural Beauty, Sustainable Travel, And Community Development For Visitors Seeking Authentic Experiences - Travel And Tour World","Nepal’s Aampani Waterfall In Kailali Emerges As A Premier Ecotourism Destination, Offering A Perfect Blend Of Natural Beauty, Sustainable Travel, And Community Development For Visitors Seeking Authentic Experiences  Travel And Tour World",2025-07-17 08:21:25,https://news.google.com/rss/articles/CBMi2AJBVV95cUxNbEJJLXluZDQ2Q1EzUjVLcFczQXBqX2c5VFFNQzUtQ1gwWEg5M2lNZE9OTnZMeTB4MjM3aVRBeXd2OTlMU19jUGFiWUlwNl82b0pqZkduMU9FRnl0d3haejlTbHNIU2gwUWlSRWJ5TGRuTWFZQUVfZkl3TC1QSDRfU3NvWUh1cVFGbzRQcldXR0tobmp0RDJqY1d6eThfRVJQdncycjZSdUpYdlJlcmk1dUM5ZmJleWh6VURzTGtJSG5tZEI2c1Q4NHNsVzNYU0JFdUlRQzVvQ1RsUVNsemEwZWNkckgxNVEyYktiSE5FcEVsVDVMLUZNS1ViaFBFRjZjdDNiZm9DVzA4Q0NsaDNiNm5SUWtqWHJmQUZhOVZqeklxTkVWNTNVQmNRZkU0MmxuY3UydXNYNUlqaFJ3NTZDcmtWTHRMRWVfUGNwTU4yamJVY2tTX3BqcA?oc=5&hl=en-US&gl=US&ceid=US:en,https://www.travelandtourworld.com,Travel And Tour World,,{'https://lh3.googleusercontent.com/J6_coFbogxhRI9iM864NL_liGXvsQp2AupsKei7z0cNNfDvGUmWUy20nuUhkREQyrpY4bEeIBuc=s0-w300'},
Nepal captain Sabitra Bhandari signed by A-League club Wellington Phoenix - Sportstar,Nepal captain Sabitra Bhandari signed by A-League club Wellington Phoenix  Sportstar,2025-07-17 09:03:34,https://news.google.com/rss/articles/CBMi7gFBVV95cUxNaHpURmlFMnZSTUdxOHdCRzJmSmozYUkzcUJoVFdKUXdUcGNFa0cxbjRDRGZLTVpYTEFwSldOOWxlR1ItZDRKa19fN1c0SkREOGFWeUw2OFNROWs0RkFSU1htcVZVTkNxZ1FROFViVl9zVW1paGN3TlZ5YzV2UzB0eGxvM2hhR1N2VHJTZVZXQzVodlVjcUhySXdDY1VGZEdIaTM1dXRCbU5qMnNkOUNGR2JMdUZzcDRiMXJnUHg5eXJlVHhGNlRnMFo5VFJiWnd4TzBZbDBlUWgyWm1aY3BoN2pyRllyVm1NRHQ5ZGVR0gH0AUFVX3lxTE5RWktSYlItYXZVUVc1SDhXMDdfTkxmeVVZT29NdGkwTklwN3lkMGJSa3Vjb2xEdk5YSFlyZGdoektGRW1hNU1Uelctd09zOWVEbmQtcnREcEVoSVRpc0JHX09Ua3E3R3BqczM3Sk9BWVNCbnJGbF8xNEZ0UFdvbWo1d3VvcUMxQjRMTDd1T3R3ZkZQUnVEV2xCbjZRaGExQXVDN1RkOFFwczdoMmVvSks3MFV0WlN2amdWY0ZHNzdSQXA5VG5XdFJfSTRPVmd6TE5OcDRPd0xndm1iem9mVExLSGttdGZZdXRJc0p3dndfbDZDcEw?oc=5&hl=en-US&gl=US&ceid=US:en,https://sportstar.thehindu.com,Sportstar,,{'https://lh3.googleusercontent.com/J6_coFbogxhRI9iM864NL_liGXvsQp2AupsKei7z0cNNfDvGUmWUy20nuUhkREQyrpY4bEeIBuc=s0-w300'},
A ‘Himalayan tsunami’ has just devastated Nepal. It should be a wake-up call - The Independent,A ‘Himalayan tsunami’ has just devastated Nepal. It should be a wake-up call  The Independent,2025-07-17 09:57:00,https://news.google.com/rss/articles/CBMiqgFBVV95cUxNV1FhSXN6YVhfd1pCd3FfRk12cG9iQmhyUHlNcDhQeTRETjZOZk9PREZHRzRjU19IZzhkdTM1NlZZOWQtbXR3bXlDalZMTkVtVGJoUmR2cjFtU3VZeGYxVVlxMFJnTUludklrdmhlSmY4SHBWTlBreHZFOEFuejlFVF9MZ2Z6XzVFM1owbmc4dDdSdFdOLTZqRTg5N0piYVZIMmpfYWNIQ0Ezdw?oc=5&hl=en-US&gl=US&ceid=US:en,https://www.independent.co.uk,The Independent,,{'https://lh3.googleusercontent.com/J6_coFbogxhRI9iM864NL_liGXvsQp2AupsKei7z0cNNfDvGUmWUy20nuUhkREQyrpY4bEeIBuc=s0-w300'},
SAFF U-20 Women’s Championship: Nepal to face Sri Lanka again - myRepublica,SAFF U-20 Women’s Championship: Nepal to face Sri Lanka again  myRepublica,2025-07-17 10:49:21,https://news.google.com/rss/articles/CBMitAFBVV95cUxPSm5SVWJfeWVaSGVJaDNoSFVYcXlBa1VHUDlKcVQ2ZUU4cl9uN0ZJQmlWbmlpNTJvWXRfMm43aG81blB1MXZCYTNTdVN2VUY1SUNUQ3BsRWxLdHB4YUhmbmN4MjFabGc1QUxBcWVfMTVqRkNLend4Y0tuUXotQllRYUI0bGZXZ3U2REE5WTVuMHZSdmJLcWJ4NU83QmNXem05Y2tIQWJ0X1VtOHVrQlNmdlc1Slc?oc=5&hl=en-US&gl=US&ceid=US:en,https://myrepublica.nagariknetwork.com,myRepublica,,{'https://lh3.googleusercontent.com/J6_coFbogxhRI9iM864NL_liGXvsQp2AupsKei7z0cNNfDvGUmWUy20nuUhkREQyrpY4bEeIBuc=s0-w300'},
Nepal thrashes Sri Lanka at SAFF U-20 Women’s Championship 2025; Bangladesh to play Bhutan next - Sportstar,Nepal thrashes Sri Lanka at SAFF U-20 Women’s Championship 2025; Bangladesh to play Bhutan next  Sportstar,2025-07-17 11:04:15,https://news.google.com/rss/articles/CBMi5gFBVV95cUxQb0pvNjY2bi1HNEQ5RUVMQjJ2MWNhcnJ0dExJa1d5bHBOWklUUUdtLXdmOFp4WDc2SGY0NmZPOXZlUEk2M193UFB0dS1KXzJJUENodFRQR1laUkFIVzI3aVF0bkh4YWhRNDVINXkyLTF5SVk1cEF3NzM2MUIyZ2hBOWQ0LUViZE80dWxBOWpzMUFKN2diemNqelhmMElrT0Z0VjFtUGd1OFRSRzJMTVJJNVhDWFBHS2hwdVNrUjVrNjJ6di1FV1lPUEZXWHNKeTRWNzBWUWpxYWo5UEVwcm9RdzFhU3ZSQdIB7AFBVV95cUxQb2VHZUxaZi03S2UyRkNqdHBsV1FKNWpIU3U0NUJ0M010T25Ib2xmUjBKY0NjRFJGTkRrWjFuLVZFN1BpX3UwcnlpTERkRFVRM1JtOUctOGJ5NE4xbHVqOU5Qb0ZPWlVoOUlKV1pfamdwTm1SQndjODhfYkZtYk5pWlZoOFhDOENreDhGX2RPVHRvSUl1Rk1HZjVXVlhnRm9DOGhNTEVlZmY4dlFUeXF6Tlh6Tmg0M3FEakpCc3R1TEhOdTRmWWtFWG9JcTNqWkhMU3JvZ2RwRHlRZndpdlRoMXl2NWFHUEprenVfMw?oc=5&hl=en-US&gl=US&ceid=US:en,https://sportstar.thehindu.com,Sportstar,,{'https://lh3.googleusercontent.com/J6_coFbogxhRI9iM864NL_liGXvsQp2AupsKei7z0cNNfDvGUmWUy20nuUhkREQyrpY4bEeIBuc=s0-w300'},
A ‘Himalayan tsunami’ has just devastated Nepal. It should be a wake-up call - MSN,A ‘Himalayan tsunami’ has just devastated Nepal. It should be a wake-up call  MSN,2025-07-17 11:50:21,https://news.google.com/rss/articles/CBMivwFBVV95cUxON2xLdlpHM3V6czZvTDJXZ3ByNDFidDRRS3VHUkR1VTV4endsZUQ5Tlc2Sll5UWpqVnlHbFNBYU1Oa2EzNkV4ZFNjcWdRMXltTUhRclhodmxZVk1JSndVR3ltejFadmRLcFBFMHZaOElRQ2JEUU1uam5XZmJaSlFPSUdMLTJFR25Zeno5SG5CV2NESXd4OTV5SW5JQmw4THc2Q2h0TFQ3c0djQ1BXbXU3cXE5azZiSFI3R0d1Y0k2QQ?oc=5&hl=en-US&gl=US&ceid=US:en,https://www.msn.com,MSN,,{'https://lh3.googleusercontent.com/J6_coFbogxhRI9iM864NL_liGXvsQp2AupsKei7z0cNNfDvGUmWUy20nuUhkREQyrpY4bEeIBuc=s0-w300'},
Nepal secures another dominant 7-0 victory over Sri Lanka in SAFF U-20 Women’s Championship - Onlinekhabar English,Nepal secures another dominant 7-0 victory over Sri Lanka in SAFF U-20 Women’s Championship  Onlinekhabar English,2025-07-17 11:53:19,https://news.google.com/rss/articles/CBMixwFBVV95cUxQY1pKMjBCQXpMb3V5UzRyZkhIWE5oNXlUUERYY0UycE1lWjRfdzRkZ1N5U1ZDc3hFUlNmOW1LdW1CTlRrdmRQMDdMdDd4NEdPSTZfNlE2bUtzT3dFUUpqcnFGRjZ1bFZadTIxWW1zQmtZWGdoUk5zM2xQQlh4YlBOa1pzOU9sRWY3Ym5zQjM1cFpwU05PcnNuVnpsYXVBUm5kOEszaFRNOWI4OUhsaE5SZUo0YzF6anpDTlEwbWJId2cyU0tpUmNj?oc=5&hl=en-US&gl=US&ceid=US:en,https://english.onlinekhabar.com,Onlinekhabar English,,{'https://lh3.googleusercontent.com/J6_coFbogxhRI9iM864NL_liGXvsQp2AupsKei7z0cNNfDvGUmWUy20nuUhkREQyrpY4bEeIBuc=s0-w300'},
Nepal earn third win in SAFF U-20 Women’s Championship - Bangladesh Sangbad Sangstha (BSS),Nepal earn third win in SAFF U-20 Women’s Championship  Bangladesh Sangbad Sangstha (BSS),2025-07-17 12:28:02,https://news.google.com/rss/articles/CBMiTkFVX3lxTE81b2M0SmwyZGNrR2ZKZU9UT0JRS2JaQVBuTzRJTTBMWmYzQ203eGdrVHc0WjNaN1FRd2xUWE5aMEYzRzNWNlVHX1FEVGdvdw?oc=5&hl=en-US&gl=US&ceid=US:en,https://www.bssnews.net,Bangladesh Sangbad Sangstha (BSS),,{'https://lh3.googleusercontent.com/J6_coFbogxhRI9iM864NL_liGXvsQp2AupsKei7z0cNNfDvGUmWUy20nuUhkREQyrpY4bEeIBuc=s0-w300'},
