title,description,published date,url,publisher.href,publisher.title,full_article,images,translated
Nepal’s development spending short of even half of annual allocation - The Kathmandu Post,Nepal’s development spending short of even half of annual allocation  The Kathmandu Post,2026-07-17 01:00:57,https://news.google.com/rss/articles/CBMisAFBVV95cUxNTEFNU3lBdGNJcjhVS3R1RjltWjlzWkw1OE5sUHRtbTNudG85MlBINTRDdDdwbGhubUljVW94S3ZreXkxUXhyU2hSS2Z3TzcwLTczbmxreURYUUNJN3R0RW5SVWhieEJIOVM2ZU1zYmdRS1djTEVDWUJNNUFpMVVUdXNKRnJFaTFJVUs5d0F2dllEMkdWd0V4WTZQZlgwY3A5VjdMUWd1c1loRHlzUjg1YQ?oc=5&hl=en-US&gl=US&ceid=US:en,https://kathmandupost.com,The Kathmandu Post,"The government has fallen far short of its development spending target, underscoring a persistent problem that has slowed infrastructure expansion and weakened the impact of public investment.

Despite repeated commitments to improve budget execution, successive governments have struggled for years to convert allocated funds into completed projects. Low capital spending in Nepal has often been blamed on delays in project preparation, procurement hurdles, weak implementation capacity and frequent political disruptions.

The problem has continued despite changes in government and repeated calls for reforms in public spending systems. Economists say poor capital expenditure not only slows infrastructure development but also limits economic growth by reducing demand for construction, materials and related industries.

The government spent less than half of the capital budget allocated for the current fiscal year, with development expenditure reaching only 46.79 percent of the annual target a day before the fiscal year ended.

For the fiscal year 2025-26, the government had allocated Rs407.89 billion for capital expenditure. By July 15, only Rs190 billion had been spent, according to government data.

The government failed to spend even half of the capital budget allocated for the current fiscal year, recording the country’s weakest development spending performance in six years.

This is the lowest capital expenditure rate since the fiscal year 2019-20, when the government spent only 46 percent of its annual capital budget. That year, Rs408 billion had been allocated for capital expenditure, but only Rs189 billion was spent.

Since then, capital spending has remained above that level, reaching 57 percent in one fiscal year and between 60 and 65 percent in each of the subsequent four years.

Government officials attributed this year's weak performance to the Gen Z protests of September last year, the March 5 federal parliamentary elections earlier this year, the subsequent formation of a new government, and disruptions to the supply of construction materials caused by the conflict in West Asia.

Nepal has long struggled to utilise its capital budget effectively, but this year marks one of its poorest performances, with development spending falling below 50 percent of the original allocation.

Economists say the change in governments following the Gen Z movement failed to translate into better fiscal management.

The protests, which demanded good governance, action against corruption and improvements in public service delivery, led to the fall of the Nepali Congress-CPN-UML coalition and the appointment of a new government. However, fiscal indicators show little improvement since then.

Economist Dilli Raj Khanal said the current government, which came as an outcome of the Gen Z movement, had failed to prioritise development works, resulting in another year of poor capital spending.

“The government came to power on the promise of good governance, but it has neglected governance in development spending,” Khanal said. “There is a high risk that the same pattern of poor capital expenditure will continue next year because the budget itself has not been designed in a way that addresses financial misgovernance and ensures its effective implementation.”

He said the budget should be formulated only after ensuring that projects are ready for implementation, but argued that the new fiscal budget also fails to ensure that.

Nepal's poor record on capital spending is not new. Over the past three decades, governments have spent only around 60 percent of the capital budget on average each year. Experts say addressing the problem requires structural reforms, including changes to procurement rules and project implementation procedures.

“We blame everything from earthquakes to Covid-19 and now the Gen Z protests for poor capital spending while ignoring our own institutional weaknesses,” a Finance Ministry official said. “These are excuses to avoid acknowledging the real problem. Broad structural reforms are essential if Nepal wants to improve capital expenditure.”

Amrit Lamsal, spokesperson for the Ministry of Finance, acknowledged that spending only 46.79 percent of the original capital budget was low.

“Based on the figures up to July 15, capital expenditure stands at around 47 percent of the annual target,” Lamsal said. “The final figures may increase slightly after incorporating July 16 data.”

He said the Gen Z protests had disrupted regular government operations after several public offices were damaged, while the March 5 election diverted the attention of civil servants and contractors. At the same time, the conflict in West Asia disrupted supplies of construction materials and pushed up prices, slowing implementation of infrastructure projects.

According to Lamsal, shortages of materials such as bitumen and rising construction costs also contributed to the poor spending performance.

“The Ministry of Finance delegated budget reallocation authority to line ministries and repeatedly urged them to accelerate spending while facilitating implementation,” he said. “Despite these efforts, capital expenditure did not increase as expected.”

He said the government had laid the groundwork for stronger capital spending and expressed confidence that implementation would improve from the beginning of the new fiscal year.

Meanwhile, the government collected Rs1.225 trillion in revenue in the fiscal year 2025-26. This represents a seven percent increase from the previous fiscal year’s collection but only 82.76 percent of the annual target.

Last year, the government achieved 80.35 percent of its revenue target. For the current fiscal year, it had set a revenue target of Rs1.48 trillion.

Lamsal said revenue collection had reached around 84 percent of the annual target.

“The target for the current fiscal year was Rs1.48 trillion,” he said. “By Wednesday, revenue collection had reached around Rs1.25 trillion. We had hoped to reach at least Rs1.3 trillion, but that now seems unlikely.”

Although revenue grew seven percent year on year, Lamsal said stronger capital spending would have generated higher tax collection.

“Had capital expenditure increased, revenue collection would also have been higher,” he said. “Weak development spending has directly affected revenue mobilisation.”

Despite missing the revenue target, he said the government's fiscal position remained manageable.

Recurrent expenditure reached Rs1.045 trillion during the fiscal year, equivalent to 88.51 percent of the annual target and higher than the spending during the same period last year.

Officials said recurrent expenditure increased partly because the government financed election-related activities from recurrent expenditure and other budget headings.

The government also spent Rs347.33 billion on debt servicing and investment in public enterprises under the financial management heading, equivalent to 92.56 percent of the annual allocation. In the previous fiscal year, spending under the same heading stood at Rs320 billion, or 87.14 percent of the target.

Foreign grants received during the fiscal year amounted to Rs31.25 billion, representing 58.5 percent of the annual target. In the fiscal year 2024-25, Nepal received Rs23.20 billion in foreign grants, or 44.34 percent of the target.

By Thursday, the government's fiscal deficit had reached around Rs358.61 billion. Total revenue stood at Rs1.264 trillion while total expenditure reached Rs1.583 trillion.

In the previous fiscal year, the fiscal deficit stood at around Rs347.75 billion.

The government had initially announced a budget of Rs1.964 trillion for the current fiscal year but reduced it to Rs1.688 trillion through the mid-term review after failing to mobilise sufficient resources and carry out spending.

Interim government’s finance minister Rameshore Khanal cut the budget by Rs275.78 billion during the mid-term review after it became clear that both revenue collection and expenditures would fall short of expectations.

The original budget of Rs1.964 trillion had been presented by Bishnu Prasad Paudel while serving as finance minister in the KP Sharma Oli-led government.

According to the mid-term budget review report for the fiscal 2025-26, recurrent expenditure was revised down from Rs1.181 trillion to Rs1.126 trillion.

Capital expenditure was reduced from the original allocation of Rs407.89 billion to Rs243.30 billion. Even that revised target was not achieved.

Likewise, the allocation for financial management was cut from Rs375.24 billion to Rs319.04 billion through the mid-term review.","{'https://openweathermap.org/img/w/04d.png', 'https://jcss-cdn.kathmandupost.com/assets/images/logo-sticky-bar-tkp-weekender-1.png', 'https://jcss-cdn.kathmandupost.com/assets/images/lazy.png', 'https://assets-cdn.kathmandupost.com/uploads/source/news/2026/third-party/capital-1784249976.jpg', 'https://jcss-cdn.kathmandupost.com/assets/images/tkp-logo-weekender.png', 'https://jcss-cdn.kathmandupost.com/assets/images/logos/thekathmandupost-logo.png', 'https://jcss-cdn.kathmandupost.com/assets/images/logos/thekathmandupost-logo-white.png'}","सरकार अपनऽ विकास खर्च के लक्ष्य स॑ बहुत कम होय गेलऽ छै, जेकरा स॑ एगो लगातार समस्या प॑ प्रकाश डाललऽ गेलऽ छै जेकरा स॑ बुनियादी ढांचा के विस्तार म॑ धीमापन आबी गेलऽ छै आरू सार्वजनिक निवेश केरऽ प्रभाव कमजोर होय गेलऽ छै ।

बजट केरऽ निष्पादन म॑ सुधार लेली बार-बार प्रतिबद्धता के बावजूद लगातार सरकारऽ क॑ आवंटित धनराशि क॑ पूरा करलऽ गेलऽ परियोजना म॑ बदलै लेली सालौ स॑ संघर्ष करना पड़लऽ छै । नेपाल मे कम पूँजी खर्च के दोष प्रायः परियोजना तैयारी मे देरी, खरीद मे बाधा, कमजोर कार्यान्वयन क्षमता आ बेर-बेर राजनीतिक व्यवधान के कारण मानल गेल अछि ।

सरकार मे बदलाव आ सार्वजनिक खर्च प्रणाली मे सुधार क बेर-बेर आह्वान क बावजूद इ समस्या जारी अछि। अर्थशास्त्री के कहनाय छनि जे खराब पूंजीगत व्यय सं बुनियादी ढांचा के विकास त धीमा त होएत अछि संगहि निर्माण... सामग्री आओर एहि सं जुड़ल उद्योग के मांग कम क आर्थिक विकास सेहो सीमित भ जाएत अछि.

सरकार चालू वित्तीय वर्ष क लेल आवंटित पूंजी बजट क आधा स कम खर्च केलक, जखन कि वित्तीय वर्ष समाप्त हेबा स एक दिन पहिने विकास क खर्च सालाना लक्ष्य क मात्र 46.79 प्रतिशत तक पहुंच गेल।

वित्तीय वर्ष 2025-26 क लेल सरकार पूंजीगत व्यय लेल 407.89 अरब टका आवंटित केने छल। सरकारी आंकड़ा क अनुसार 15 जुलाई तक मात्र 190 अरब टका खर्च भ गेल छल।

सरकार चालू वित्तीय वर्ष लेल आवंटित पूंजी बजट क आधा हिस्सा सेहो खर्च करबा मे असफल रहल, जाहि स देश क छह साल मे सबस कमजोर विकास खर्च प्रदर्शन दर्ज कैल गेल।

वित्तीय वर्ष 2019-20 के बाद ई सबस कम पूंजीगत व्यय दर अछि, जखन सरकार अपन वार्षिक पूंजी बजट के मात्र 46 प्रतिशत खर्च केलक। ओहि साल पूंजीगत व्यय लेल 408 अरब टका आवंटित भ गेल छल, मुदा मात्र 189 अरब टका खर्च भेल।

एकरऽ बाद स॑ पूंजीगत खर्च वू स्तर स॑ ऊपर रहलऽ छै, जे एक वित्तीय वर्ष म॑ ५७ प्रतिशत आरू बाद केरऽ हर चार साल म॑ ६० स॑ ६५ प्रतिशत के बीच पहुँची गेलऽ छै ।

सरकारी अधिकारी न॑ ई साल केरऽ कमजोर प्रदर्शन के कारण पिछला साल सितंबर म॑ जेन जेड विरोध प्रदर्शन, ई साल केरऽ शुरुआत म॑ ५ मार्च क॑ संघीय संसदीय चुनाव, एकरऽ बाद नया सरकार केरऽ गठन, आरू पश्चिम एशिया म॑ संघर्ष के वजह स॑ निर्माण सामग्री के आपूर्ति म॑ बाधा बतैलकै ।

नेपाल बहुत दिन स अपन पूंजी बजट क प्रभावी उपयोग करबा लेल संघर्षरत अछि, मुदा एहि साल ओकर सबस खराब प्रदर्शन मे स एक अछि, जाहि मे विकास खर्च मूल आवंटन स 50 प्रतिशत स कम भ गेल अछि।

अर्थशास्त्री के कहना छै कि जेन जेड आंदोलन के बाद सरकारऽ म॑ बदलाव बेहतर राजकोषीय प्रबंधन म॑ बदलै म॑ विफल रहलै ।

सुशासन, भ्रष्टाचार के खिलाफ कार्रवाई आ लोक सेवा प्रदायगी मे सुधार के मांग करय वाला विरोध प्रदर्शन मे नेपाली कांग्रेस-नेकपा एमाले गठबंधन के पतन आ नव सरकार के नियुक्ति के कारण बनल. मुदा ओकर बाद राजकोषीय सूचकांक मे कोनो खास सुधार नहि देखा रहल अछि।

अर्थशास्त्री डिल्ली राज खनाल नँ कहलकै कि जेन जेड आन्दोलन के परिणाम के रूप मँ आबै वाला वर्तमान सरकार विकास के काम क प्राथमिकता दै मँ विफल रहलौ छै, जेकरौ परिणामस्वरूप एक साल आरू पूंजीगत खर्च खराब होय गेलौ छै ।

खनाल कहलनि जे, सरकार सुशासन के वादा पर सत्ता मे आयल छल, मुदा विकास खर्च मे शासन के उपेक्षा केलक अछि। “अगिला साल भी खराब पूंजीगत व्यय केरऽ वही पैटर्न जारी रहै के उच्च जोखिम छै, कैन्हेंकि बजट क॑ ही ऐन्हऽ तरीका स॑ डिजाइन नै करलऽ गेलऽ छै कि वित्तीय कुशासन क॑ दूर करलऽ जाय आरू एकरऽ प्रभावी क्रियान्वयन सुनिश्चित करलऽ जाय।”

ओ कहला जे परियोजना लागू करबा लेल तैयार अछि, तखने बजट बनेबाक चाही, मुदा तर्क देलथि जे नव राजकोषीय बजट सेहो इ सुनिश्चित करबा मे असफल अछि।

पूँजी खर्च पर नेपालक खराब रिकॉर्ड कोनो नव बात नहि अछि। पिछला तीन दशक मे सरकार हर साल औसतन पूंजी बजट क करीब 60 प्रतिशत मात्र खर्च केलक अछि। विशेषज्ञऽ के कहना छै कि ई समस्या के समाधान लेली संरचनात्मक सुधार के जरूरत छै, जेकरा म॑ खरीद नियम आरू परियोजना कार्यान्वयन प्रक्रिया म॑ बदलाव शामिल छै ।

वित्त मंत्रालय केरऽ एगो अधिकारी न॑ कहलकै कि हम्में भूकंप स॑ ल॑ क॑ Covid-19 तक के दोष दै छियै आरू अब॑ जेन जेड न॑ अपनऽ संस्थागत कमजोरी क॑ नजरअंदाज करतें हुअ॑ खराब पूंजीगत खर्च के विरोध करै छै । “असली समस्या के स्वीकार नै करै के ई सब बहाना छै, नेपाल पूंजीगत व्यय में सुधार करना चाहै छै त व्यापक संरचनात्मक सुधार जरूरी छै।”

वित्त मंत्रालय क प्रवक्ता अमृत लमसल स्वीकार केलथि जे मूल पूंजी बजट क मात्र 46.79 प्रतिशत खर्च कम अछि।

लमसल कहला जे 15 जुलाई तक क आंकड़ा क आधार पर पूंजीगत व्यय सालाना लक्ष्य क करीब 47 प्रतिशत अछि। “16 जुलाई के आंकड़ा के शामिल करला के बाद अंतिम आंकड़ा में किछु बढ़ोतरी भ सकैत अछि।”

ओ कहलनि जे, जेन जेड विरोध प्रदर्शन सं कईटा सार्वजनिक कार्यालय के नुकसान पहुंचला के बाद नियमित सरकारी परिचालन बाधित भ गेल अछि, जखन कि 5 मार्च के चुनाव सं सिविल सेवक आ ठेकेदार के ध्यान भटकल अछि. एकरऽ साथ ही पश्चिम एशिया म॑ संघर्ष के वजह स॑ निर्माण सामग्री के आपूर्ति म॑ बाधा पहुँचलै आरू दाम बढ़ी गेलै, जेकरा स॑ बुनियादी ढांचा परियोजना के क्रियान्वयन म॑ धीमापन आबी गेलै ।

लमसल क अनुसार कोलतार जेहन सामग्री क कमी आ बढ़ैत निर्माण लागत सेहो खर्च क खराब प्रदर्शन मे योगदान देलक।

ओ कहला जे वित्त मंत्रालय बजट पुनर्वितरण प्राधिकरण लाइन मंत्रालय कए सौंपलक आ बेर-बेर आग्रह केलक जे ओ खर्च मे तेजी आनत आ संगहि क्रियान्वयन मे सुविधा सेहो देल जाए। “एहि प्रयासक बादो पूंजीगत व्यय मे अपेक्षाक अनुसार वृद्धि नहि भेल।”

ओ कहला जे सरकार मजबूत पूंजीगत खर्च क आधार तैयार केलक अछि आ विश्वास व्यक्त केलक अछि जे नव वित्तीय वर्ष क शुरुआत स एकर क्रियान्वयन मे सुधार होएत।

एहि बीच सरकार वित्तीय वर्ष 2025-26 मे 1.225 खरब टका क राजस्व संकलन केलक। ई पिछला वित्तीय वर्ष के संग्रह सं सात प्रतिशत के बढ़ोतरी के प्रतिनिधित्व करैत अछि मुदा सालाना लक्ष्य के मात्र 82.76 प्रतिशत.

पिछला साल सरकार अपन राजस्व लक्ष्य क 80.35 प्रतिशत पूरा केलक। चालू वित्तीय वर्ष क लेल ओ 1.48 खरब टका क राजस्व क लक्ष्य निर्धारित केने छल।

लमसल कहला जे राजस्व वसूली सालाना लक्ष्य क करीब 84 प्रतिशत तक पहुंच गेल अछि।

ओ कहला जे चालू वित्तीय वर्ष क लक्ष्य 1.48 खरब टका छल। ओ कहला जे बुधदिन तक राजस्व वसूली करीब 1.25 खरब टका पहुंच गेल छल, हमरा सब कए उम्मीद छल जे कम स कम 1.3 खरब टका भ जाएत, मुदा आब इ संभावना कम बुझाइत अछि।”

हालांकि राजस्व मे साल दर साल सात प्रतिशत क वृद्धि भेल, मुदा लमसल कहला जे मजबूत पूंजीगत खर्च स कर वसूली बेसी होइत।

ओ कहला जे अगर पूंजीगत व्यय बढ़ि गेल रहैत त राजस्व वसूली सेहो बेसी होइत। “कमजोर विकास खर्च के सीधा असर राजस्व जुटान पर पड़ल अछि।”

राजस्व के लक्ष्य स चूकला के बादो सरकार के राजकोषीय स्थिति प्रबंधनीय बनल रहल कहलनि।

वित्तीय वर्ष क दौरान आवर्ती व्यय 1.045 खरब टका तक पहुंच गेल, जे वार्षिक लक्ष्य क 88.51 प्रतिशत क बराबर अछि आ पिछला साल एहि अवधि मे भेल खर्च स बेसी अछि।

अधिकारी सब के कहनाय छनि जे आवर्ती खर्च मे आंशिक रूप सं बढ़ोतरी एहि लेल भेल जे सरकार आवर्ती व्यय आओर अन्य बजट हेडिंग सं चुनाव सं जुड़ल गतिविधि के वित्तपोषण करैत छल.

सरकार वित्तीय प्रबंधन शीर्षक क तहत सार्वजनिक उद्यम मे ऋण सेवा आ निवेश पर सेहो 347.33 अरब टका खर्च केलक जे वार्षिक आवंटन क 92.56 प्रतिशत क बराबर अछि। पिछला वित्तीय वर्ष मे एहि शीर्षक क तहत खर्च 320 अरब टका यानी लक्ष्य क 87.14 प्रतिशत रहल।

वित्तीय वर्ष मे भेटल विदेशी अनुदान 31.25 अरब टका रहल जे वार्षिक लक्ष्य क 58.5 प्रतिशत अछि। वित्तीय वर्ष 2024-25 मे नेपाल कए 23.20 अरब टका विदेशी अनुदान यानी लक्ष्य क 44.34 प्रतिशत भेटल अछि।

गुरुवार तक सरकार के राजकोषीय घाटा करीब 358.61 अरब रुपया पहुंच गेल छल। कुल राजस्व 1.264 खरब टका रहल जखन कि कुल खर्च 1.583 खरब टका पहुंच गेल।

पिछला वित्तीय वर्ष मे राजकोषीय घाटा करीब 347.75 अरब टका छल।

सरकार शुरू मे चालू वित्तीय वर्ष क लेल 1.964 खरब टका क बजट क घोषणा केने छल, मुदा पर्याप्त संसाधन जुटाबा आ खर्च नहि करबा मे असफल रहला क बाद मध्यावधि समीक्षा क माध्यम स एकरा घटा कए 1.688 खरब टका क देलक।

अंतरिम सरकार के वित्त मंत्री रामेश्वर खनाल मध्यावधि समीक्षा के दौरान बजट मे 275.78 अरब रुपया के कटौती केलनि, जखन कि ई साफ भ गेल छल जे राजस्व वसूली आओर व्यय दुनू उम्मीद सं कम होएत.

केपी शर्मा ओली के नेतृत्व वाला सरकार में वित्त मंत्री के रूप में कार्यरत समय विष्णु प्रसाद पौडेल 1.964 खरब रुपया के मूल बजट पेश केने छलाह।

वित्तीय वर्ष 2025-26 क मध्यावधि बजट समीक्षा रिपोर्ट क अनुसार आवर्ती व्यय कए 1.181 खरब स घटा कए 1.126 खरब टका क देल गेल।

पूंजीगत व्यय मूल आवंटन 407.89 अरब टका स घटि कए 243.30 अरब टका भ गेल। ओहो संशोधित लक्ष्य सेहो पूरा नहि भेल।

तहिना मध्यावधि समीक्षा क माध्यम स वित्तीय प्रबंधन क लेल आवंटन कए 375.24 अरब टका स घटा कए 319.04 अरब टका करि देल गेल।"
