title,description,published date,url,publisher.href,publisher.title,full_article,images,translated
Grants-based initiatives under NAMP prove beneficial for target groups in Bhojpur - Nepalnews.com,Grants-based initiatives under NAMP prove beneficial for target groups in Bhojpur  Nepalnews.com,2026-07-07 07:21:22,https://news.google.com/rss/articles/CBMivgFBVV95cUxQaE1ORV91dFJsQUxQNkVqbnU0clBkWUNVU2RqN3lsTEp5RVl5WGQwZFJDNElMLVlneWpNemZISG5Nc1VrR0dIeWFSMFN1LWdOTVdCY2tFVTRuZGFSOEswS09IamhYRXVqd1lCNTZpZFZiSGxKYjBBeVpwNlgzM004N2JONXJMTDdNOFA5VGIxZ3d6MzNPakhCZk1EVGxPbHBUNjJhQVhZd0dId3hjNzUzVTFOb1VBQjJhTFAtX1Vn?oc=5&hl=en-US&gl=US&ceid=US:en,https://english.nepalnews.com,Nepalnews.com,,,
Daya Foundation celebrates Nepal’s cultural heritage - Nepalnews.com,Daya Foundation celebrates Nepal’s cultural heritage  Nepalnews.com,2026-07-07 07:46:23,https://news.google.com/rss/articles/CBMilgFBVV95cUxNOUFuUHRGalNyS254dW9BZDNUTUVJTWRJZmV5aGpVd2hhQV9iR1dCeGZaUTFic3hMcURPU01hOUNZbFRodXhoTmtWVVoxRFF1MXFhMUIwaGtPcTJxRDBrV3BWS3Y3aVV2U3J6LXZyMENOZXNtYlBrTlh5Y1ZCWGJ2bVQ4M2UyMHBlOEJLNGRER0E3dkJzVkE?oc=5&hl=en-US&gl=US&ceid=US:en,https://english.nepalnews.com,Nepalnews.com,,,
Oscar College honors Cannes-winning ‘Elephants in the Fog’ team - Nepalnews.com,Oscar College honors Cannes-winning ‘Elephants in the Fog’ team  Nepalnews.com,2026-07-07 07:56:23,https://news.google.com/rss/articles/CBMiugFBVV95cUxNSXdLWXJEelhCZEVLQlZXdmdHbjU1S09TUXlqVTIySnNLQUdWM2U2TV9Hc3FyT2R5NUNyenN1Qk5nSjBkdXp6TFNqMExZclVDLXowRUNQRUJzVTVlVWhRd1VQakRqSi0zNldTdkl0R2Z2dTF4LUNZcVRvN0pIeTVpTnNrTkE0aFlyVWY4M1FLM3lPT3pvcUxsM2dOQzlZeGJEaC1OVDhQeWZyejloRzd4UWpwa2Jpc3NXZkE?oc=5&hl=en-US&gl=US&ceid=US:en,https://english.nepalnews.com,Nepalnews.com,,,
UAE grants royal amnesty to 111 Nepali prisoners - Nepalnews.com,UAE grants royal amnesty to 111 Nepali prisoners  Nepalnews.com,2026-07-07 08:06:24,https://news.google.com/rss/articles/CBMilgFBVV95cUxNN1hVb1pTUU1XOHY4RFhOYWxSWWdzc2ltUVVsczE2R3hFVEYxVFJGYVpzMXE2Qm5GbW4xcU1hZzB4dHZfaUNnZVM2T2t6YUtEQkZtSkt5eXk0QUJDME8xc0VDOEVhdkcxUnJ0R0JyOFpWVTVEdzR5SGJUY0V0RFBib0cwWXBqTlN4VXlJaDQtQnFUdF9KMFE?oc=5&hl=en-US&gl=US&ceid=US:en,https://english.nepalnews.com,Nepalnews.com,,,
"Bird flu brought under control in 7 districts, remains active in 4 - Nepalnews.com","Bird flu brought under control in 7 districts, remains active in 4  Nepalnews.com",2026-07-07 08:11:24,https://news.google.com/rss/articles/CBMiqwFBVV95cUxQYllwbzExRnRJNjBZWHRkYWc5YkpwLW51Um55YXlCTjMyTEQ4cXhKclpzM2pFakJ0THJNb3ZtaG5kTXF5Z24xQk5ic2FwNUlxSVhDcllCNkF3STZFSGs4aFVlVXphX3I5aDJrVV9NRUR5SUxPaHN5YS1IQkxjSVMtOHZhWm16emE4OWxZV1ozbXZnQW1sNF9lNkZ0WThLVHRuSXc2R3NIUFlja2c?oc=5&hl=en-US&gl=US&ceid=US:en,https://english.nepalnews.com,Nepalnews.com,,,
"Nepal, Cambodia agree to deepen cooperation against trafficking and cybercrime - Nepalnews.com","Nepal, Cambodia agree to deepen cooperation against trafficking and cybercrime  Nepalnews.com",2026-07-07 08:21:24,https://news.google.com/rss/articles/CBMivAFBVV95cUxOYlA0ZUppU2xtV25vN0pqMG1XdHk0MklKVGNRMGF1RW9CUXVwbWxfMFFrTzlNN0J3RWw5djdMazJfV19KZGowUHFiTzZCcWsyeFdGMERLWnBTWHV1Ymg1dUJwbGc5QW5UZUV2UG94alNGUGhjbkNyN29Od3VPOHpvalZRNmlLLXlOWTJadnZnR2pYZDlPcnlBTEVvSzJHQ0hlQmdKcGNqMjR5b2thYnF6ZUM3anZzbXI2MXNQMQ?oc=5&hl=en-US&gl=US&ceid=US:en,https://english.nepalnews.com,Nepalnews.com,,,
"Late monsoon slows Nepal’s padi transplantation, but experts say there’s no need to worry - The Star","Late monsoon slows Nepal’s padi transplantation, but experts say there’s no need to worry  The Star",2026-07-07 08:22:00,https://news.google.com/rss/articles/CBMi4wFBVV95cUxOVUYteHFSaWZvZVlnZzRYdXJjY2FFQ3Q2cGQ3TXc4NHR6SjlhcnBqOGt5TEV6RnBMM0dIMnZYazRjZWNBc01UXzZHMDhTaW96N1h0UGo3TlljQXRmZWItMlh4SjEtMEdvSEZTMklXMFR5NnY2U2ZUbEQ5MllhWHlINTk3U1AzdnRlVks4bjVDLURyeC05TEtJVEF0ZlhNVklkeU1rblU3QTdhNUJuU3VCbGIzMTNkQmE1MU90ZUxlWWg3cUdVMl9fMm85UHNRaUR4NDdvSHh0UzlaTEQwb0Ztb0JFaw?oc=5&hl=en-US&gl=US&ceid=US:en,https://www.thestar.com.my,The Star,"KATHMANDU: The delayed and sluggish advance of the south-west monsoon has begun taking a visible toll on Nepal’s agriculture, with fresh government data showing that padi transplantation has been completed on only 32.38 per cent of the country’s cultivated area as of Monday (July 6).

The figure marks a significant slowdown compared to the same period last year, when 45 percent of padi fields had already been transplanted. Delayed transplantation leaves young seedlings vulnerable to peak pest infestations and unfavourable weather, slowing plant growth and ultimately reducing productivity.

According to the latest data from the Department of Agriculture under the Ministry of Agriculture, padi has so far been transplanted on 443,595 hectares out of the country’s total 1.37 million hectares of land designated for padi cultivation during the monsoon season.

Despite the slower pace, government officials and agricultural experts say there is no immediate cause for alarm.

“We don’t have to worry yet,” said Rajendra Koirala, spokesperson for the Department of Agriculture. “Concern will arise only if transplantation continues to lag from the first week of August. The monsoon has only recently begun spreading gradually from east to west.”

Padi transplantation schedules vary across Nepal depending on rainfall patterns and topography. In the upper hills, transplantation is generally completed by mid-June. In the Tarai—the country’s food basket—it usually begins in early July and can continue until early September, depending on water availability.

The Tarai (lowlands) accounts for 71 pecent of Nepal’s total rice cultivation area, followed by the hills with 25 pecent and the mountains with four per cent.

Last year, below-average rainfall delayed transplantation in Madhesh Province, affecting both production and productivity.

Officials say the slow onset of this year’s monsoon has left vast stretches of farmland dry and lacking adequate soil moisture, forcing farmers to postpone transplantation while waiting for sustained rainfall.

The monsoon officially entered Nepal on June 19, six days later than its normal arrival date of June 13.

Regional forecasts by South Asian meteorologists suggest Nepal is likely to receive below-normal monsoon rainfall this year, ending three consecutive years of above-average precipitation.

Monsoon rains are critical for Nepal’s Rs6.6 trillion (US$43.3 billion) economy, providing nearly 80 per cent of the water needed for agriculture while replenishing reservoirs and groundwater reserves.

With nearly half of the country’s farmland lacking irrigation facilities, agriculture remains heavily dependent on rainfall between June and September. The monsoon is therefore regarded as a key macroeconomic factor, closely watched by policymakers, investors and consumers.

Agriculture contributes about 24 per cent of Nepal’s gross domestic product and provides employment to more than 60 per cent of the population. As rural incomes largely depend on agricultural output, the strength of the monsoon has a direct impact on household spending and overall economic activity.

Experts warn that a combination of below-normal rainfall, fertiliser shortages and high fuel prices could place additional strain on Nepal’s already fragile economy, posing a challenge for the new Rastriya Swatantra Party-led government, which has pledged to achieve annual economic growth of seven per cent and raise per capita income to at least US$3,000.

The government has also committed to expanding the economy to nearly Rs100 trillion within the next five to seven years while creating jobs and improving public service delivery.

Rajendra Uprety, a rice expert, also believes it is too early to predict the season’s outcome.

“So far, although rainfall has been irregular in eastern Nepal, transplantation has progressed relatively well because of irrigation and groundwater pumping facilities,” he said.

“We should be concerned only if transplantation remains weak in Koshi, Madhesh and Lumbini provinces, which together account for nearly one million hectares of padi land. At the current pace, we expect transplantation to be completed by the end of July, although it is running slightly behind schedule.”

A provincial breakdown shows that Sudurpashchim has made the most progress so far.

According to the department, padi has been transplanted on 89,742 hectares out of the province’s total cultivation area of 154,950 hectares, representing 57.9 per cent completion.

Even so, the province remains behind last year’s performance, when transplantation had reached 82.8 per cent by the same period.

Gandaki province ranks second, with transplantation completed on 38,389 hectares, or 41 per cent of its total 93,606 hectares of padi fields.

Karnali province follows closely, with transplantation completed on 17,549 hectares, or 40.5 per cent of its total 43,290 hectares under padi cultivation. During the same period last year, transplantation had reached 55.6 per cent in Gandaki and 71.7 per cent in Karnali.

In Lumbini province, where padi is cultivated on 301,372 hectares, transplantation has been completed on only 112,509 hectares, equivalent to 37.3 per cent of the total area. By the same time last year, the province had achieved 52.1 per cent transplantation.

Bagmati province has also recorded slower progress. Of its total 114,524 hectares of padi land, only 38,026 hectares, or 33.2 per cent, have been transplanted, compared to 51.9 per cent during the same period last year.

Koshi province has completed transplantation on 87,033 hectares, or 31.5 per cent of its total 276,387 hectares of padi fields. This is slightly ahead of last year’s 29.5 per cent at the same stage.

The weakest performance has been recorded in Madhesh province, Nepal’s largest rice-producing region.

Despite having the country’s largest padi cultivation area—385,933 hectares—only 60,346 hectares had been transplanted by the first week of July. This represents just 15.6 per cent of the total cultivated area, the lowest among all seven provinces.

During the corresponding period last year, Madhesh had completed 25.1 per cent of its padi transplantation. - The Kathmandu Post/ANN","{'https://apicms.thestar.com.my/uploads/images/2026/07/07/3997041.jpg', 'https://cdn.thestar.com.my/Themes/img/close.png', 'https://apicms.thestar.com.my/uploads/images/2026/06/30/thumbs/200/3985166.webp', 'https://cdn.thestar.com.my/Themes/img/times-solid.png', 'http://b.scorecardresearch.com/p?c1=2&c2=6035691&cv=2.0&cj=1', 'https://cdn.thestar.com.my/Themes/img/nexus_logo.svg', 'https://cdn.thestar.com.my/Themes/img/Nexus/gift-spin.png', 'https://apicms.thestar.com.my/uploads/images/2026/07/04/thumbs/200/3992234.webp', 'https://apicms.thestar.com.my/uploads/images/2026/07/07/thumbs/200/3997041.webp', 'https://www.thestar.com.my/theme_metro/images/TSOL640x100.png'}","काठमांडू, मिथिला मिरर: दक्षिण पश्चिम मानसून के देरी आ सुस्त आगू बढ़ला सं नेपाल के कृषि पर स्पष्ट असर पड़य लागल अछि, जखन कि ताजा सरकारी आंकड़ा बता रहल अछि जे सोमदिन (6 जुलाई) तक देश के खेती वाला क्षेत्र के मात्र 32.38 प्रतिशत पर पाडी प्रत्यारोपण पूरा भ गेल अछि.

पिछला साल क एहि अवधि क मुकाबले इ आंकड़ा काफी मंदी क रूप मे देखा रहल अछि, जखन कि 45 प्रतिशत पाड़ी क खेत मे प्रत्यारोपण भ चुकल छल। प्रत्यारोपण मे देरी सं युवा अंकुरक कें कीट कें चरम आक्रमण आ प्रतिकूल मौसम कें शिकार भ जायत छै, जे पौधाक कें विकास मे धीमा भ जायत छै आ अंततः उत्पादकता मे कमी आबि जायत छै.

कृषि मंत्रालय के तहत कृषि विभाग के ताजा आंकड़ा के अनुसार मानसून के मौसम में पाडी के खेती के लेल निर्धारित देश के कुल 13.7 लाख हेक्टेयर जमीन में सं एखन धरि 443,595 हेक्टेयर में पाडी के रोपनी भ चुकल अछि.

धीमा गति के बावजूद सरकारी अधिकारी आओर कृषि विशेषज्ञ के कहनाय छनि जे तत्काल अलार्म के कोनो कारण नहिं अछि.

कृषि विभाग के प्रवक्ता राजेन्द्र कोइराला कहलनि जे, हमरा सब के एखन धरि चिंता नहि करय पड़त। “अगस्त केरऽ पहिलऽ सप्ताह स॑ प्रत्यारोपण म॑ पिछड़लऽ रहतै तखनी चिंता पैदा होतै ।मानसून केरऽ प्रसार पूर्व स॑ पश्चिम म॑ धीरे-धीरे हाल म॑ ही शुरू होय गेलऽ छै ।”

वर्षा के पैटर्न आ स्थलाकृति के आधार पर नेपाल भर में पाड़ी प्रत्यारोपण के समय भिन्न-भिन्न होइत अछि । ऊपरी पहाड़ी पर आम तौर पर जून के मध्य तक प्रत्यारोपण पूरा भ जायत अछि. तराई में-देश के भोजन के टोकरी में-ई आमतौर पर जुलाई के शुरूआत में शुरू होइत अछि आ सितंबर के शुरू तक चलैत रहैत अछि, ई पानिक उपलब्धता के आधार पर.

नेपाल के कुल धान के खेती के क्षेत्रफल के 71 प्रतिशत तराई (नीचाई) के छै, ओकरऽ बाद पहाड़ी के 25 प्रतिशत आरू पहाड़ के क्षेत्र चार प्रतिशत छै ।

पिछला साल औसत स कम वर्षा स मधेश प्रांत मे प्रत्यारोपण मे देरी भेल, जाहि स उत्पादन आ उत्पादकता दुनू प्रभावित भेल।

अधिकारी सब के कहनाय छनि जे एहि साल के मानसून के धीमा शुरुआत के कारण खेती के जमीन के विशाल हिस्सा सूखल अछि आओर माटिक पर्याप्त नमी के कमी अछि, जाहि सं किसान के लगातार बरखा के इंतजार मे प्रत्यारोपण स्थगित करय पड़ल अछि.

मानसून अपन सामान्य आगमन तिथि 13 जून स छह दिन बाद 19 जून कए आधिकारिक तौर पर नेपाल मे प्रवेश केलक।

दक्षिण एशियाई मौसम वैज्ञानिकऽ के क्षेत्रीय पूर्वानुमान स॑ लगै छै कि नेपाल म॑ ई साल सामान्य स॑ कम मानसून केरऽ वर्षा होय के संभावना छै, जेकरा स॑ लगातार तीन साल स॑ औसत स॑ अधिक वर्षा के समापन होय रहलऽ छै ।

नेपाल केरऽ ६.६ खरब रुपया (४३.३ अरब अमेरिकी डॉलर) केरऽ अर्थव्यवस्था लेली मानसून केरऽ बारिश बहुत महत्वपूर्ण छै, जेकरा स॑ कृषि लेली जरूरी पानी के लगभग ८० प्रतिशत मिलै छै जबकि जलाशय आरू भूजल भंडार क॑ भरना मिलै छै ।

देश केरऽ लगभग आधा खेती के जमीन म॑ सिंचाई के सुविधा के कमी के कारण जून स॑ सितंबर के बीच खेतीबाड़ी बरसात प॑ काफी निर्भर छै । अतः मानसून क॑ एगो प्रमुख मैक्रोइकोनॉमिक कारक के रूप म॑ मानलऽ जाय छै, जेकरा प॑ नीति निर्माता, निवेशक आरू उपभोक्ता केरऽ बारीकी स॑ नजर छै ।

नेपाल केरऽ सकल घरेलू उत्पाद म॑ लगभग २४ प्रतिशत कृषि के योगदान छै आरू ६० प्रतिशत स॑ भी अधिक आबादी क॑ रोजगार मिलै छै । जेना कि ग्रामीण आय काफी हद तइक कृषि उत्पादन पर निर्भर करय छै, मानसून कें मजबूती कें सीधा प्रभाव घरेलू खर्च आ समग्र आर्थिक गतिविधि पर पड़य छै.

विशेषज्ञऽ न॑ चेतावनी देल॑ छै कि सामान्य स॑ कम बारिश, खाद के कमी आरू ईंधन केरऽ अधिक दाम के संयोजन स॑ नेपाल केरऽ पहल॑ स॑ ही नाजुक अर्थव्यवस्था प॑ अतिरिक्त तनाव पड़॑ सकै छै, जेकरा स॑ राष्ट्रीय स्वतंत्र पार्टी केरऽ नेतृत्व वाला नयका सरकार लेली चुनौती बनी सकै छै, जे सात प्रतिशत के वार्षिक आर्थिक विकास आरू प्रति व्यक्ति आय कम स॑ कम ३,००० अमेरिकी डॉलर तलक बढ़ाबै के प्रतिबद्धता जतैन॑ छै ।

सरकार अगिला पांच स सात साल क भीतर अर्थव्यवस्था कए लगभग 100 खरब टका तक पहुंचेबाक प्रतिबद्धता जतौने अछि, संगहि रोजगार पैदा करत आ लोक सेवा प्रदायगी मे सुधार करत।

चावल विशेषज्ञ राजेन्द्र उप्रेटी के सेहो मानब छनि जे एहि सीजन के परिणाम के भविष्यवाणी करब एखन बहुत जल्दी अछि.

ओ कहलनि जे, एखन धरि पूर्वी नेपाल मे वर्षा अनियमित रहला पर सिंचाई आ भूजल पम्पिंग के सुविधा के कारण प्रत्यारोपण अपेक्षाकृत नीक प्रगति भेल अछि।

ओ कहला जे हमरा सब कए तखने चिंतित हेबाक चाही जखन कोशी, मधेश आ लुम्बिनी प्रांत मे प्रत्यारोपण कमजोर रहत, जे मिलिकय लगभग दस लाख हेक्टेयर पाडी जमीन अछि। वर्तमान गति स हमरा सब कए उम्मीद अछि जे जुलाई क अंत तक प्रत्यारोपण पूरा भ जाएत, हालांकि इ समय स किछु पाछू चलि रहल अछि।”

प्रांतीय विभाजन स पता चलैत अछि जे सुदुरपश्चिम एखन धरि सबस बेसी प्रगति केलक अछि।

विभाग क अनुसार प्रांत क कुल खेती क्षेत्र 154,950 हेक्टेयर मे स 89,742 हेक्टेयर मे पाडी क रोपनी कैल गेल अछि, जे 57.9 प्रतिशत पूरा हेबाक प्रतिनिधित्व करैत अछि।

तइयो ई प्रांत पिछला साल के प्रदर्शन सं पाछू अछि, जखन कि एहि अवधि तक प्रत्यारोपण 82.8 प्रतिशत भ गेल छल.

गण्डकी प्रदेश दोसर स्थान पर अछि, जाहि मे 38,389 हेक्टेयर मे प्रत्यारोपण पूरा भेल अछि, जे ओकर कुल 93,606 हेक्टेयर पाडी खेत मे 41 प्रतिशत अछि।

कर्णाली प्रांत एकरऽ निकटता स॑ एकरऽ बाद छै, जेकरा म॑ १७,५४९ हेक्टेयर प॑ प्रत्यारोपण पूरा होय गेलऽ छै, जे कि एकरऽ कुल ४३,२९० हेक्टेयर म॑ ४०.५ प्रतिशत छै जे पाडी के खेती के तहत छै । पिछला साल एही अवधि मे गंडकी मे प्रत्यारोपण 55.6 प्रतिशत आ कर्णाली मे 71.7 प्रतिशत पहुंच गेल छल।

लुम्बिनी प्रांत मे, जतय 301,372 हेक्टेयर मे पाडी क खेती होइत अछि, ओतय मात्र 112,509 हेक्टेयर मे प्रत्यारोपण पूरा भ गेल अछि, जे कुल क्षेत्रफल क 37.3 प्रतिशत क बराबर अछि। पिछला साल एहि समय तक एहि प्रांत मे 52.1 फीसदी प्रत्यारोपण भ गेल छल।

बागमती प्रांत मे सेहो धीमा प्रगति दर्ज कैल गेल अछि। एकर कुल 114,524 हेक्टेयर पाडी जमीन मे स मात्र 38,026 हेक्टेयर यानी 33.2 प्रतिशत मे प्रत्यारोपण भेल अछि, जखन कि पिछला साल एहि अवधि मे 51.9 प्रतिशत छल।

कोशी प्रांत मे 87,033 हेक्टेयर मे प्रत्यारोपण पूरा भ गेल अछि जे ओकर कुल 276,387 हेक्टेयर पाड़ी खेत मे 31.5 प्रतिशत अछि। ई पिछला साल के 29.5 प्रतिशत सं किछ आगू अछि जे एहि चरण मे छल.

सबसँ कमजोर प्रदर्शन नेपालक सबसँ पैघ धान उत्पादक क्षेत्र मधेश प्रदेश मे दर्ज भेल अछि ।

देश केरऽ सबस॑ बड़ऽ पाड़ी खेती के क्षेत्र-३८५,९३३ हेक्टेयर- रहला के बावजूद जुलाई केरऽ पहलऽ सप्ताह तलक मात्र ६०,३४६ हेक्टेयर म॑ रोपनी होय चुकलऽ छेलै । ई कुल खेती वाला क्षेत्र के महज 15.6 प्रतिशत के प्रतिनिधित्व करै छै, जे सब सात प्रांतऽ म॑ सबस॑ कम छै ।

पिछला साल एहिना अवधि मे मधेश अपन पाडी प्रत्यारोपण क 25.1 प्रतिशत पूरा क चुकल छल। - द काठमांडू पोस्ट/एएनएन"
