title,description,published date,url,publisher.href,publisher.title,full_article,images,translated
"Child malnutrition in Nepal has reached ‘alarming’ levels since aid cuts, survey finds - The Guardian","Child malnutrition in Nepal has reached ‘alarming’ levels since aid cuts, survey finds  The Guardian",2026-06-26 07:02:00,https://news.google.com/rss/articles/CBMizwFBVV95cUxQR0Z3QTJqNW1aNHV0cmRYVGw1UVZfcWpFVHVNV0x2clIyNkw1TmxzMnJCX3oxZzR1bzE1VkdOOEhBU3NsaktJdVVyclNmQWxXd1A4ek5jaUhGT1FhSUlLTWN1SloxZ2tNYTl5SXpxcGdUQTN2c0s1QUNRdGpBbFNVcVpyOVdiVXBBa3JZalhXcjFfb1BTcjhJRld4MTV2cC0yX3FjTFQ2UFNTamVZUWFXOGVhWUJrOEFVNkVvZmlDU1JUWXpsRTBaLVV4NWs3X3c?oc=5&hl=en-US&gl=US&ceid=US:en,https://www.theguardian.com,The Guardian,"Child malnutrition in Nepal has reached “alarming” levels, according to the largest ever survey of under-fives in the country.

The new figures came just over a year after USAID, the former US flagship agency closed by the Trump administration in 2025, stopped funding work on child nutrition in Nepal.

A senior Nepalese nutrition expert, who ran programmes in the country that were axed in the US aid cuts, said she worried that hard-won gains in reducing child mortality over the past 20 years were at risk.

“If you are malnourished, your risk of dying, compared to a child who is not malnourished, is 12 times higher,” said Pooja Pandey Rana. “What we’re seeing is [an] alarming rate of acute malnutrition in Nepal .”

More than one million children aged between six months and five years were weighed and measured as part of a government screening programme carried out over three weeks in May.

The World Health Organization deems rates of wasting – the percentage of children who are underweight for their height – of 10% or above to be “high”, and suggests they should prompt immediate intervention.

The survey revealed rates as high as 12.3% in one province, Madhesh, near the Indian border. There, 24.2% of children were classed as underweight, meaning their weight was low for their age.

Overall, 7.8% of children suffered from wasting and 1.6% from severe wasting, while 17.4% were underweight.

Pandey Rana, Helen Keller Intl’s country director for Nepal, said the screening had only reached about half of the country’s children in the relevant age groups, and rates in remote areas could be higher still.

Nepal had been a leading country in reducing death rates among under-fives, which declined by 72% between 1996 and 2022. Pandey Rana said: “The worry we have is we are now backsliding.”

Beyond the immediate risk to a child’s life from malnutrition that compromises the immune system, she pointed to research that also linked it to worse school performance and productivity as they got older.

Helen Keller Intl was due to receive $72m from USAID over five years, beginning in 2025, to deliver nutrition programmes covering almost 9 million people in 48 districts.

It has only been able to partly replace that funding, raising just under $5m from other donors to reach 223,000 people in nine districts.

Nepal’s government buys the country’s stocks of Ready-to-Use Therapeutic Food (RUTF), a nutrient-rich and high-calorie paste that can treat malnourished children. But much of the community outreach – such as health workers going door to door to identify children who needed treatment – was aid funded and stopped with the US cuts.

“We saw this sudden, abrupt [halt],” Pandey Rana said. “In the last 14 months, we have seen this breakdown of systems where you have RUTF, but we don’t have families coming in. You have services, but there’s no one to refer or follow up.”

View image in fullscreen Food is distributed in Kathmandu during the pandemic. A recent increase in prices has made it more difficult to keep children healthy. Photograph: Narendra Shrestha/EPA

Reducing malnutrition required an integrated approach, she said, including work on gender equality, because of links between women’s empowerment and the health of their children, and on access to clean, safe water.

Increasing prices were also making things harder, she said. “Prices have really shot up – for example, we promote egg as a very wholesome, nutritious food. The price of two eggs is equal to a kilogram of rice … what would you choose, if you’re a food-insecure family?”

While differences in methodology mean comparisons with earlier surveys are difficult, Pandey Rana said the figures were “for sure” higher than they would have been 14 months earlier. A 2025 survey put the national rate of wasting among under-fives at 6.6%.

Aid cuts could cause 22m avoidable deaths by 2030, study finds Read more

Malnutrition was competing for domestic government funding with other health priorities such as immunisation, she said.

A spokesperson for Unicef in Nepal said: “Supplies are still insufficient to meet the overall demand for treatment.”

Only about 35% of children under the age of five affected by wasting currently received treatment, they said.","{'https://static.theguardian.com/commercial/sponsor/22/Feb/2024/f459c58b-6553-486d-939a-5f23fd935f78-Guardian.orglogos-for%20badge.png', 'https://i.guim.co.uk/img/media/a7d276afd40788b07d8eb9621489b6e8fc9083eb/0_0_4256_3340/master/4256.jpg?width=445&dpr=1&s=none&crop=none', 'https://i.guim.co.uk/img/media/691e99e495752417900a793cf02f4a1b3c6ae2ae/667_0_3333_2667/master/3333.jpg?width=1200&height=630&quality=85&auto=format&fit=crop&precrop=40:21,offset-x50,offset-y0&overlay-align=bottom%2Cleft&overlay-width=100p&overlay-base64=L2ltZy9zdGF0aWMvb3ZlcmxheXMvdGctZGVmYXVsdC5wbmc&enable=upscale&s=682fee833e269346759bb65ccd1d723a', 'https://i.guim.co.uk/img/media/691e99e495752417900a793cf02f4a1b3c6ae2ae/667_0_3333_2667/master/3333.jpg?width=465&dpr=1&s=none&crop=none', 'https://sb.scorecardresearch.com/p?c1=2&c2=6035250&cv=2.0&cj=1&cs_ucfr=0&comscorekw=global-development'}","देश मे पांच साल सं कम उम्र के सबस पैघ सर्वेक्षण के अनुसार नेपाल मे बाल कुपोषण “आतंकित करय वाला” स्तर पर पहुंच गेल अछि.

ई नया आंकड़ा २०२५ म॑ ट्रंप प्रशासन द्वारा बंद करलऽ गेलऽ अमेरिकी पूर्व प्रमुख एजेंसी यूएसएआईडी न॑ नेपाल म॑ बाल पोषण प॑ काम के फंडिंग बंद करला के एक साल स॑ कुछ अधिक समय बाद आबी गेलऽ छै ।

अमेरिका केरऽ सहायता कटौती म॑ कुल्हाड़ी मारलऽ गेलऽ देश म॑ ऐसनऽ कार्यक्रम चलाबै वाला नेपाल केरऽ एगो वरिष्ठ पोषण विशेषज्ञ न॑ कहलकै कि ओकरा चिंता छै कि पिछला २० साल म॑ बाल मृत्यु दर कम करै म॑ मेहनत स॑ मिललऽ फायदा खतरा म॑ छै ।

पूजा पाण्डेय राणा कहलनि जे, जौं कुपोषित छी त कुपोषित नहि बच्चा के तुलना मे मरय के खतरा 12 गुना बेसी अछि। “हमरा सब जे देख रहल छी ओ नेपाल मे तीव्र कुपोषण के [एकटा] चिंताजनक दर अछि .”

मई मे तीन सप्ताह मे कैल गेल सरकारी जांच कार्यक्रम कें तहत छह महीना सं पांच साल कें बीच कें दस लाख सं बेसि बच्चाक कें तौल आ मापल गेलय.

विश्व स्वास्थ्य संगठन बर्बादी कें दर – बच्चाक कें प्रतिशत जे ओकर लंबाई कें लेल कम वजन वाला छै – 10% या ओय सं बेसि कें “उच्च” मानयत छै, आ सुझाव देयत छै की ओकरा तुरंत हस्तक्षेप कें लेल प्रेरित करबाक चाही.

सर्वेक्षण मे भारतीय सीमा के पास एकटा प्रांत मधेश मे 12.3% तक के दर के पता चलल अछि. ओतय 24.2% बच्चाक कें कम वजन वाला वर्गीकृत कैल गेलय, मतलब ओकर वजन ओकर उम्र कें हिसाब सं कम छल.

कुल मिलाकय 7.8% बच्चाक कें बर्बादी आ 1.6% गंभीर बर्बादी सं पीड़ित छल, जखन कि 17.4% बच्चाक कें वजन कम छल.

नेपाल के लेल हेलेन केलर अंतर्राष्ट्रीय के देश निदेशक पांडे राणा कहलनि जे, ई स्क्रीनिंग संबंधित उम्र समूह के देश के लगभग आधा बच्चा तक मात्र पहुंचल अछि, आ दूरस्थ इलाका में एकर दर एखनो बेसी भ सकैत अछि।

नेपाल पाँच वर्ष सं कम उम्र के मृत्यु दर कम करय मे अग्रणी देश रहल छल, जे 1996 सं 2022 के बीच 72% घटल छल.

प्रतिरक्षा प्रणाली सं समझौता करय वाला कुपोषण सं बच्चा के जान के तत्काल जोखिम सं परे, ओ शोध के तरफ इशारा केलनि जे एकरा उम्र बढ़ला पर स्कूल के खराब प्रदर्शन आ उत्पादकता सं सेहो जोड़ल गेल अछि.

हेलेन केलर इंटरनेशनल क॑ 2025 स॑ शुरू होय क॑ पांच सालऽ म॑ यूएसएआईडी स॑ 72 मिलियन डॉलर मिलना छेलै, जेकरा स॑ 48 जिला म॑ लगभग 90 लाख लोगऽ क॑ कवर करै वाला पोषण कार्यक्रम उपलब्ध कराय देलऽ जाय सक॑ ।

ई खाली आंशिक रूप स॑ वू फंडिंग क॑ बदलै म॑ सफल रहलऽ छै, जेकरा स॑ दोसरऽ दाता स॑ ५ मिलियन डॉलर स॑ कुछ कम के धनराशि जुटाबै म॑ सफल रहलऽ छै ताकि नौ जिला म॑ २,२३,००० लोगऽ तलक पहुँची सक॑ ।

नेपाल सरकार देश के भंडार रेडी-टू-यूज थेरेपिस्टिक फूड (आरयूटीएफ) के खरीदैत अछि, जे पोषक तत्व सं भरपूर आ उच्च कैलोरी वाला पेस्ट अछि जे कुपोषित बच्चा के इलाज क सकैत अछि. लेकिन सामुदायिक आउटरीच केरऽ बहुत हिस्सा – जेना कि स्वास्थ्यकर्मी केरऽ घर-दर-दर जाय क॑ बच्चा सिनी के पहचान करलऽ जाय जेकरा इलाज के जरूरत छै – सहायता केरऽ फंडिंग छेलै आरू अमेरिका केरऽ कटौती स॑ बंद होय गेलऽ छेलै ।

पाण्डेय राना कहलनि जे, हम सब ई अचानक, अचानक [रोक] देखलहुं। “पिछला 14 महीना मे हम सब सिस्टम के ई टूटब देखलहुं जतय अहां के आरयूटीएफ अछि, मुदा हमरा सभ लग परिवार नहि आबि रहल अछि.. अहां के सेवा अछि, मुदा रेफर करय वाला या फॉलोअप करय वाला कियो नहि अछि.”

View image in fullscreen महामारी के समय काठमांडू मे भोजन वितरण होइत अछि । हाल मे दाम मे बढ़ोतरी के कारण बच्चा के स्वस्थ राखब आओर मुश्किल भ गेल अछि. फोटोग्राफ : नरेन्द्र श्रेष्ठ/ईपीए

ओ कहली जे कुपोषण कें कम करय कें लेल एकटा एकीकृत दृष्टिकोण कें आवश्यकता छै, जेकरा मे लैंगिक समानता पर काज शामिल छै, कियाकि महिला सशक्तिकरण आ ओकर बच्चाक कें स्वास्थ्य कें बीच संबंध छै, आ स्वच्छ, सुरक्षित पानी कें पहुंच पर.

ओ कहली जे बढ़ैत दाम सेहो काज कठिन भ रहल छल। “दाम सचमुच बढ़ि गेल अछि – जेना, हम अंडा केँ एकटा बहुत स्वस्थ, पौष्टिक भोजनक रूप मे बढ़ावा दैत छी. दू अंडा’क दाम एक किलो चावल’क बराबर अछि... अहाँ की चुनब, जँ अहाँ भोजनक असुरक्षित परिवार छी?”

पद्धति म॑ अंतर के मतलब छै कि पहलऽ सर्वेक्षणऽ स॑ तुलना करना मुश्किल छै, लेकिन पांडेय राणा न॑ कहलकै कि ई आंकड़ा १४ महीना पहलें के तुलना म॑ “निश्चित” अधिक छै । 2025 केरऽ एगो सर्वेक्षण म॑ पांच स॑ कम उम्र के उम्र म॑ बर्बादी के राष्ट्रीय दर 6.6% बतालऽ गेलऽ छै ।

अध्ययन में पता चलल अछि जे सहायता में कटौती के कारण 2030 तक 22 मिलियन टालय योग्य मौत भ सकैत अछि Read more

ओ कहली जे कुपोषण टीकाकरण जेहन अन्य स्वास्थ्य प्राथमिकता क संग घरेलू सरकारी फंडिंग क लेल प्रतिस्पर्धा क रहल अछि।

नेपालमे यूनिसेफके प्रवक्ता कहलनि जे, “इलाजके समग्र माँग पूरा करय लेल अखनो आपूर्ति अपर्याप्त अछि।”

ओ सब कहलनि जे, बर्बादी सं प्रभावित पांच साल सं कम उम्र के बच्चा मे सं फिलहाल मात्र करीब 35% बच्चा के इलाज भ रहल अछि।"
"Dahal, Nepal hold talks with Shekhar Koirala at Biratnagar residence - myRepublica","Dahal, Nepal hold talks with Shekhar Koirala at Biratnagar residence  myRepublica",2026-06-26 07:59:02,https://news.google.com/rss/articles/CBMivwFBVV95cUxQVGxiZzdFaEFrb2hOb3J6ZWxndEs4V2xUd3ZhTnM3QUNXenNSRHBQUi1zNm0teWRnZ2w4d28wcGpQY1M4WklGMW93Ry1Fd0RmN2kwTjlYaWRORm40YjJsTlREVklfMUkyTy1CTmoxMW5oTHNqMWdZRlNKczE5T0xKU1JMQzdTOVZ3UXBKclRacUtfTjBFU2JRTzVVQlpSd2hUbi1iX3VoMkwwcWlHZHQ1OUJ0aTMyamVKVnJkaktsVQ?oc=5&hl=en-US&gl=US&ceid=US:en,https://myrepublica.nagariknetwork.com,myRepublica,"KATHMANDU, June 26: Nepali Communist Party Coordinator Pushpa Kamal Dahal and Co-coordinator Madhav Kumar Nepal held a meeting with Nepali Congress leader Dr Shekhar Koirala at his residence in Biratnagar, Morang, on Thursday, amid ongoing political developments.

(adsbygoogle = window.adsbygoogle || []).push({});

Related story Biratnagar development projects in limbo

The two leaders reached Koirala’s residence for the meeting, where they discussed contemporary political issues, according to sources.","{'https://republicajscss.nagariknewscdn.com//img/nagarik-logo.png', 'https://republicajscss.nagariknewscdn.com//img/radio-nagarik-logo.png', 'https://republicajscss.nagariknewscdn.com//img/sukrabar-logo.png', 'https://republicajscss.nagariknewscdn.com//img/side-bar-logo.svg', 'https://republicaimg.nagariknewscdn.com/shared/web/uploads/media/Dahal-1782459511.webp', 'https://republicajscss.nagariknewscdn.com//img/logo-mobile.svg', 'https://republicajscss.nagariknewscdn.com//img/default_image.png', 'https://republicajscss.nagariknewscdn.com//img/logo.svg', 'https://republicajscss.nagariknewscdn.com//img/nrm-logo-with-tagline-english.png'}","काठमाण्डू, २६ जून : नेपाली कम्युनिस्ट पार्टी के संयोजक पुष्पकमल दाहाल आ सहसंयोजक माधव कुमार नेपाल नेपाली कांग्रेस नेता डा. शेखर कोइराला के साथ बृहस्पति दिन मोरङ के विराटनगर स्थित हुनक आवास पर चलि रहल राजनीतिक घटनाक्रम के बीच बैसार केलनि ।

(adsbygoogle = विंडो.adsbygoogle || []).पुश ({});

संबंधित कहानी विराटनगर विकास परियोजनाओं लिम्बो में

सूत्रक अनुसार दुनू नेता बैसार लेल कोइराला के आवास पर पहुंचलाह, जतय समकालीन राजनीतिक मुद्दा पर चर्चा भेल छल."
