title,description,published date,url,publisher.href,publisher.title,full_article,images,translated
Snow blankets Nepal’s Humla and Mugu impacting daily life - asianews.network,Snow blankets Nepal’s Humla and Mugu impacting daily life  asianews.network,2024-12-30 01:42:54,https://news.google.com/rss/articles/CBMiigFBVV95cUxNZ283NVczU18xV1dsLVBJTE9UMjA5bktSZGl5c1hlYVpSbmMzWncyMktLb0JsMV9yeGpnMWtPYmRlYmVDZWZQNEJlMWpSdm14MElUbjEtM09qV2tkYk5hYk1zcmFuZnlyMlR0SGhlMzhZWEV3UjZ1VXd2bjh4Ti01aHdBSmg1LW1na3c?oc=5&hl=en-US&gl=US&ceid=US:en,https://asianews.network,asianews.network,,{'https://lh3.googleusercontent.com/J6_coFbogxhRI9iM864NL_liGXvsQp2AupsKei7z0cNNfDvGUmWUy20nuUhkREQyrpY4bEeIBuc=s0-w300'},
"Quiet, persistent and determined efforts should bring about enduring results. And New Delhi can play a major role in rolling back the SAARC into meaningful action. - The Rising Nepal","Quiet, persistent and determined efforts should bring about enduring results. And New Delhi can play a major role in rolling back the SAARC into meaningful action.  The Rising Nepal",2024-12-30 02:05:22,https://news.google.com/rss/articles/CBMiUEFVX3lxTE9WMnlCSU1rajJieVA2YUI5Mm8yTE9VaVlkY0JfVUY0QU5kTTVRenI1OFdRWFY3eHczcDI4OUVRMkg5RFAzQ1l5SWVyVFIxWThp?oc=5&hl=en-US&gl=US&ceid=US:en,https://risingnepaldaily.com,The Rising Nepal,,{'https://lh3.googleusercontent.com/J6_coFbogxhRI9iM864NL_liGXvsQp2AupsKei7z0cNNfDvGUmWUy20nuUhkREQyrpY4bEeIBuc=s0-w300'},
Government not accepting NOC’s presidential election - The Rising Nepal,Government not accepting NOC’s presidential election  The Rising Nepal,2024-12-30 02:10:23,https://news.google.com/rss/articles/CBMiUEFVX3lxTFA2cjJMM3NzeUlOYmExQWQ1ZnpDLUVHNFRrZnVQRkl5V1otcFVtUXVuOERuNmhGNUNnRWFHc1R1ZGViVFJ1djZCYXd1ZjZmRDFE?oc=5&hl=en-US&gl=US&ceid=US:en,https://risingnepaldaily.com,The Rising Nepal,,{'https://lh3.googleusercontent.com/J6_coFbogxhRI9iM864NL_liGXvsQp2AupsKei7z0cNNfDvGUmWUy20nuUhkREQyrpY4bEeIBuc=s0-w300'},
Economic Digest: Nepal’s Business News in a Snap - Khabarhub,Economic Digest: Nepal’s Business News in a Snap  Khabarhub,2024-12-30 02:20:16,https://news.google.com/rss/articles/CBMiWEFVX3lxTE5LWjEzQkN6M054dm5KOGdGeXF1eEl4eGl1OWt6V0g2SFZLbXVIdnZuN0ZUbmVqeEJYd0dxNDUtd2JIOUphWmFyak15ZHg3aVpnRVlHM3h2Mm4?oc=5&hl=en-US&gl=US&ceid=US:en,https://english.khabarhub.com,Khabarhub,,{'https://lh3.googleusercontent.com/J6_coFbogxhRI9iM864NL_liGXvsQp2AupsKei7z0cNNfDvGUmWUy20nuUhkREQyrpY4bEeIBuc=s0-w300'},
"Hearts online, hurt offline: The dark side of Nepali teenagers’ virtual relationships - asianews.network","Hearts online, hurt offline: The dark side of Nepali teenagers’ virtual relationships  asianews.network",2024-12-30 02:30:35,https://news.google.com/rss/articles/CBMirAFBVV95cUxNY2dNOXB3NWNSS2VHVkFjb0RVSUhIOWFZYWlSRVVrV1NNdEk2ZGNhdUVuRl9pSzlWejRaX1ktMzR3LTFaR1FQekxuaGFKUDdDQzFJbGRNV2tVbXJCd0dELW9hbGlVRzVUYTlGS3RqRjF1Y3JpRDR6SXFtLW5fd2hPamdyT0hPQ0VaOGNELUV2TTFjbWFGTXZ1UnBNWGFRTVFzdk9uRWxqQUlhaUNw?oc=5&hl=en-US&gl=US&ceid=US:en,https://asianews.network,asianews.network,,{'https://lh3.googleusercontent.com/J6_coFbogxhRI9iM864NL_liGXvsQp2AupsKei7z0cNNfDvGUmWUy20nuUhkREQyrpY4bEeIBuc=s0-w300'},
Overseas job-seeker now creates jobs in Nepal - Nepali times,Overseas job-seeker now creates jobs in Nepal  Nepali times,2024-12-30 02:32:52,https://news.google.com/rss/articles/CBMihAFBVV95cUxOZmVVTmZSRVk3VlBIaDlfTnB0b1BJMHpBbEZiRC1FLWZZUThTLTg2ekhlY1lVTkZpMWlzU0t4UEcybUV1U21wYVpURUdQNUstNWZCendnQ1ZKN0VXMm4ySURhUFptZkJSYUNXbDdvUE53NzVoa2NsUXdmV2dTMTE2dXpJZ28?oc=5&hl=en-US&gl=US&ceid=US:en,https://nepalitimes.com,Nepali times,,{'https://lh3.googleusercontent.com/J6_coFbogxhRI9iM864NL_liGXvsQp2AupsKei7z0cNNfDvGUmWUy20nuUhkREQyrpY4bEeIBuc=s0-w300'},
Helicopter sightseeing banned in Nepal - Travel Daily,Helicopter sightseeing banned in Nepal  Travel Daily,2024-12-30 03:00:58,https://news.google.com/rss/articles/CBMifEFVX3lxTE9BMG5NNjF5WTBwN1YwZmFUZVJiV1BLVjEzVmxReXBYOW44YmFNNWw1ekpsY3RXemVLbXRHUnNyNm5tdGRlMm1aVGlrYWc5cUZWUzQ4X0lDQjZGaUxHZmthWDJQdDR4X0YwUWNVNy1hOW9ZRE9mQkhNOVZyU2k?oc=5&hl=en-US&gl=US&ceid=US:en,https://www.traveldailymedia.com,Travel Daily,,{'https://lh3.googleusercontent.com/J6_coFbogxhRI9iM864NL_liGXvsQp2AupsKei7z0cNNfDvGUmWUy20nuUhkREQyrpY4bEeIBuc=s0-w300'},
Speaker Ghimire extends best wishes on Tamu Lhosar - The Rising Nepal,Speaker Ghimire extends best wishes on Tamu Lhosar  The Rising Nepal,2024-12-30 03:01:05,https://news.google.com/rss/articles/CBMiUEFVX3lxTE5lUngwS2gyaHg3SkF6TDBBYnRLWVA2WEc2NE5PM0dJY2dydFVLcnV5Q0xnR1U4aDZqamNMN1pEZzVheEdkUXdENC1hU1dnZWsx?oc=5&hl=en-US&gl=US&ceid=US:en,https://risingnepaldaily.com,The Rising Nepal,,{'https://lh3.googleusercontent.com/J6_coFbogxhRI9iM864NL_liGXvsQp2AupsKei7z0cNNfDvGUmWUy20nuUhkREQyrpY4bEeIBuc=s0-w300'},
Festival reinforces cultural values: Vice President Yadav - The Rising Nepal,Festival reinforces cultural values: Vice President Yadav  The Rising Nepal,2024-12-30 03:01:05,https://news.google.com/rss/articles/CBMiUEFVX3lxTFBXWmFaaFg3RjV0YzN6d2pwX3k0ZlZmS3BjNmR1Z19uX184QTRuLV83R1Vpd3BsVVRycEpHb3dMYmJjX1NPQWNWall6WGx1aW5P?oc=5&hl=en-US&gl=US&ceid=US:en,https://risingnepaldaily.com,The Rising Nepal,,{'https://lh3.googleusercontent.com/J6_coFbogxhRI9iM864NL_liGXvsQp2AupsKei7z0cNNfDvGUmWUy20nuUhkREQyrpY4bEeIBuc=s0-w300'},
Rajasthan teenager Parul Choudhary bags maiden junior international badminton title in Nepal - The Times of India,Rajasthan teenager Parul Choudhary bags maiden junior international badminton title in Nepal  The Times of India,2024-12-30 03:20:00,https://news.google.com/rss/articles/CBMi-gFBVV95cUxNaEpScnlwb183Wnk4TmNyeWpQbHlfUkxZMUdEYkp4eHNtTUxHR2NySkdSdGtEcWwzTGRGYUZ1N0h3aVRfWHhuOVlwTm9nVno4UWs5WnN6V1VqTlNzRE9yUnBlYUlLOThuYkhfQ1k3eE5JSHlXRjBFYU1hRUdielhxdGJGMFFDdFQtU0JaLUlxM04xc3REQXRmQWN3THJJNkZWZXZQTjlhWnc4NUtuY0hTQ21vTzhESklBWFBEa2tXX19PY3lrUUxGSzBsMUJHWHB4aDNlRUJ4QWoyUnhMT09kdk5LSzQ1Mk5RRkdnVk5hV05KZWw0TVdJQ0Rn0gH_AUFVX3lxTE56QXNKclFsVFZiMmNLQm10ZU9faUxJZEZJWWswRmZrclFGb1pzVE54M0s2NWNLR3J3a0h5NTUwNDNtRUQ5UFBPNDZlN0U1ekZVUS1vQVdyWUJkaFVScEp0WDU2dndmNF9XSy1jLTlxdHR3RTR1R1FjZTdrTW5FbldZSWg4UGFwOTIxV2VRcnQzTVBhUFpSc1ZqZm9Ha0dLS1pRUEo5M0ZodDBoaVJuSnlScWZIUi1sMzN0OUFiZEJ3T2oxbVFNQURJdVRsZElyVXFxeEtYaGNaY1ljV2pjd0tCaUtTd056TTFFTFV4VERPUFFLY1JYUV9pQk9aMVFQTQ?oc=5&hl=en-US&gl=US&ceid=US:en,https://timesofindia.indiatimes.com,The Times of India,,{'https://lh3.googleusercontent.com/J6_coFbogxhRI9iM864NL_liGXvsQp2AupsKei7z0cNNfDvGUmWUy20nuUhkREQyrpY4bEeIBuc=s0-w300'},
Lessons for Nepal - Annapurna Express,Lessons for Nepal  Annapurna Express,2024-12-30 03:50:28,https://news.google.com/rss/articles/CBMiV0FVX3lxTE03Qnltbk1GLWdvVWpUYzQtUW9ybFR6RnZ1VktOZ05oVzJMdzJZcFRpeGc1QjFjOHRuMnVsZkY1dlFIaEhHM191N1B6WWY4S0VaRDZib2tyaw?oc=5&hl=en-US&gl=US&ceid=US:en,https://theannapurnaexpress.com,Annapurna Express,,{'https://lh3.googleusercontent.com/J6_coFbogxhRI9iM864NL_liGXvsQp2AupsKei7z0cNNfDvGUmWUy20nuUhkREQyrpY4bEeIBuc=s0-w300'},
Grounded aircraft halt Nepal Airlines domestic ops - ch-aviation,Grounded aircraft halt Nepal Airlines domestic ops  ch-aviation,2024-12-30 03:58:41,https://news.google.com/rss/articles/CBMilAFBVV95cUxPYnZuR1ZwN0k0cHFQbmNNVzRtMXY0bFhoX0FSLWE5dmhwX1BzYzNEQzB1cE0zSWozbVdZZkh5c3ZsX2ZrejFYblhBYTdnZnpqaUxLTEZoSk44UkIzeE9XZzhJQUo0LWpVb0RBNFFZN3hzaWVZMV9CQ1h1M3BfLWg5M1p2RUxudDQyal9hRm1LTUNVa2ZH?oc=5&hl=en-US&gl=US&ceid=US:en,https://www.ch-aviation.com,ch-aviation,,{'https://lh3.googleusercontent.com/J6_coFbogxhRI9iM864NL_liGXvsQp2AupsKei7z0cNNfDvGUmWUy20nuUhkREQyrpY4bEeIBuc=s0-w300'},
Nepali President Paudel issues ordinance to amend cooperative-related laws - asianews.network,Nepali President Paudel issues ordinance to amend cooperative-related laws  asianews.network,2024-12-30 04:45:31,https://news.google.com/rss/articles/CBMiogFBVV95cUxPY0dvcTM4cGVtcExRc29yaE4tZWZjcF95TFlPZDBNWU5EY2stTlNvUG5SNjVZSVRERHJ1TzBuX2ZXN1FlZm8xTW9KdUJCbXF4eDdISlFYX0JUVEFaTE95aEtiOGJqeEtRU0tUYklBSHdzZlVjc0I5VjA2QXduMzM4dUc2Tk9jU0lQR0xlMXdVdGZ2VGhnM181M2EzOEpiY1lGZHc?oc=5&hl=en-US&gl=US&ceid=US:en,https://asianews.network,asianews.network,,{'https://lh3.googleusercontent.com/J6_coFbogxhRI9iM864NL_liGXvsQp2AupsKei7z0cNNfDvGUmWUy20nuUhkREQyrpY4bEeIBuc=s0-w300'},
"Archbold potter participates in Arts Envoy program, teaches in Nepal - Napoleon Northwest Signal","Archbold potter participates in Arts Envoy program, teaches in Nepal  Napoleon Northwest Signal",2024-12-30 05:00:00,https://news.google.com/rss/articles/CBMijwFBVV95cUxPb0dQRHVncEVPT19lMlBIOXdQQ0ZuTzkxRlVOQXVpRTNZOTJlSDZCV0cwcEJzOTQtUi1FeXlkUmNadzJhSk9SSWpRWFVQTHQ0bmZFS00xaDZPWGk5V0ZOLWFIcmJrZW53Z3VQZFozbWhrbVBEM011RFRDVnFud01seS1seS1CSFpGNDZXNW5LYw?oc=5&hl=en-US&gl=US&ceid=US:en,https://www.northwestsignal.net,Napoleon Northwest Signal,,{'https://lh3.googleusercontent.com/J6_coFbogxhRI9iM864NL_liGXvsQp2AupsKei7z0cNNfDvGUmWUy20nuUhkREQyrpY4bEeIBuc=s0-w300'},
Int'l conference 'In Sight Live Nepal' in May - The Rising Nepal,Int'l conference 'In Sight Live Nepal' in May  The Rising Nepal,2024-12-30 05:06:11,https://news.google.com/rss/articles/CBMiUEFVX3lxTFByQmRiRDAzWkFWZVZqWVd0akxQamJjSDJ1ZVRVdWplSXZ3Q0tmZFBkc3lRZUNabDR1a1BvX2ZqYmZfWlV0bmV3c2ktR21rTm51?oc=5&hl=en-US&gl=US&ceid=US:en,https://risingnepaldaily.com,The Rising Nepal,,{'https://lh3.googleusercontent.com/J6_coFbogxhRI9iM864NL_liGXvsQp2AupsKei7z0cNNfDvGUmWUy20nuUhkREQyrpY4bEeIBuc=s0-w300'},
Government working to issue identity cards for Nepali-origin individuals abroad - The Kathmandu Post,Government working to issue identity cards for Nepali-origin individuals abroad  The Kathmandu Post,2024-12-30 05:10:06,https://news.google.com/rss/articles/CBMiwwFBVV95cUxQRTVDUVZiaThCcTFGQVpyNTBQUHpvc0RFQVhIbWZkdTBuWWpTaDhER2dpX0xleElxc3FWMlJtck5XWWVZQVVVNWtlT0JKNEJ6RUFwbVN2cU1zVUtxdTBHcDlIaDJQWDRlYTZwVWZEYUNXbWhEZkxmXzM3UXNBcGdYRFNSdE9ZbW1mWmZiQkIzZHhoclFOcWtFV0piTWp4TWpTN2lYWHlXQ0hnTFRfNTVod2pnN0ptNFBUYTZlcGpCUmtOVGM?oc=5&hl=en-US&gl=US&ceid=US:en,https://kathmandupost.com,The Kathmandu Post,,{'https://lh3.googleusercontent.com/J6_coFbogxhRI9iM864NL_liGXvsQp2AupsKei7z0cNNfDvGUmWUy20nuUhkREQyrpY4bEeIBuc=s0-w300'},
Tamu Lhosar being marked today - The Rising Nepal,Tamu Lhosar being marked today  The Rising Nepal,2024-12-30 05:31:16,https://news.google.com/rss/articles/CBMiUEFVX3lxTE1IR3JPdXAxR2ZETjc0bFE0V2hlSnMzQ3pNODczNTd0aTBCQjRzX3NabmljSVFvWGItaG9zQjZ2TzRDcHFhR3RlZmdzUHR3TU5P?oc=5&hl=en-US&gl=US&ceid=US:en,https://risingnepaldaily.com,The Rising Nepal,,{'https://lh3.googleusercontent.com/J6_coFbogxhRI9iM864NL_liGXvsQp2AupsKei7z0cNNfDvGUmWUy20nuUhkREQyrpY4bEeIBuc=s0-w300'},
Nepal’s First International Balloon Festival elevates adventure tourism to new heights - Business Traveller,Nepal’s First International Balloon Festival elevates adventure tourism to new heights  Business Traveller,2024-12-30 05:34:24,https://news.google.com/rss/articles/CBMi4AFBVV95cUxPV29POThNUE9NLXhJa1oteURfNC1uelB6M3F5bjVnTHNpVU1zeDcxSmNwdl9fRE1tR29HVXAydFFDc3EtQTRrNk5IX3pyWWRfU1g0enhuZkNxc3FtYmJsQU5RSE5BS1o5ZVZPOXhLNHZ1eEdTMWcxVlFfbm9oekN2aFpBWUtXUWZKODZXTTRsTDdKSU1yV1cyQWxCeTltMnRDRFJIQVdPZHVMOFZnTkVXSkpkbXNXaGt2NXZoYUpnQV9ZNmFaeDBXOEE5UUctbGVoZ1lsS0xHeGo3dVRBNDU0eA?oc=5&hl=en-US&gl=US&ceid=US:en,https://www.businesstraveller.com,Business Traveller,,{'https://lh3.googleusercontent.com/J6_coFbogxhRI9iM864NL_liGXvsQp2AupsKei7z0cNNfDvGUmWUy20nuUhkREQyrpY4bEeIBuc=s0-w300'},
Why Nepal’s Gurkha fighters want to join India’s army again - Al Jazeera English,Why Nepal’s Gurkha fighters want to join India’s army again  Al Jazeera English,2024-12-30 05:44:05,https://news.google.com/rss/articles/CBMipgFBVV95cUxPMlRfSWM5X2RDTUNnaFpFMkc5Q3J4cjdiY290VzlJSkxiQWpSV0ZIN09MUEgtZVZuRHNfbUEzYzNZb21LOUxqbVctMlpYOGFhdzJyQWJPNkZzVWlGNW9uZ1BfWU4yZFFFZDRvZXpvNXNjWGYxZGJ5TG5USWhIZHB4R1MtMnFDc3B5WDlqb1R0R29sRnk3OFNBS3dNTjktd3ZoU3Zuc1Nn0gGrAUFVX3lxTFBXRHUxRFRGTkNMTEFjSmhJNTZJaThPdmNrSmNPaF9jR3NwakVOQUE2RGMxdVctVWYxaTM3ZGwtZTZJd1NibmRHd2d1OXBENFZXWHZONVo5dm40d0NENnNSaUs3R0NIQmJNakU2M2xxX2x1SzEyb1B6V3c4NnJmWk9JWEdfWkNOcDFlV0hxcERwR25NSGgyS01qN0NxUndRR0ZNVmk4Z0IxUlFKTQ?oc=5&hl=en-US&gl=US&ceid=US:en,https://www.aljazeera.com,Al Jazeera English,,{'https://lh3.googleusercontent.com/J6_coFbogxhRI9iM864NL_liGXvsQp2AupsKei7z0cNNfDvGUmWUy20nuUhkREQyrpY4bEeIBuc=s0-w300'},
Another monkeypox case confirmed in Nepal - Khabarhub,Another monkeypox case confirmed in Nepal  Khabarhub,2024-12-30 05:50:50,https://news.google.com/rss/articles/CBMiWEFVX3lxTE9qTUdrOEUybkJDX1pXSDZZR1diRkhmRkJicmVtMmItdUhaY1A3NVI1WUVpYlVkdmFBMUxoeGJYSldsOHdueTNuSUJMZ3pnM0ROTEhCM3FVVHA?oc=5&hl=en-US&gl=US&ceid=US:en,https://english.khabarhub.com,Khabarhub,,{'https://lh3.googleusercontent.com/J6_coFbogxhRI9iM864NL_liGXvsQp2AupsKei7z0cNNfDvGUmWUy20nuUhkREQyrpY4bEeIBuc=s0-w300'},
