title,description,published date,url,publisher.href,publisher.title,full_article,images,translated
SC legitimizes special general convention of Nepali Congress - The Rising Nepal,SC legitimizes special general convention of Nepali Congress  The Rising Nepal,2026-04-18 03:12:24,https://news.google.com/rss/articles/CBMiUEFVX3lxTFBjRWRyUWh6VGNiM0lBSlhQZ0NZNlkzMUdYRlM3ZzY5bnRyOGJfZEs3WlBkMXhBbzFxMG5uN1RqY2dINDBPSW1taWZCbzRHQmxL?oc=5&hl=en-US&gl=US&ceid=US:en,https://risingnepaldaily.com,The Rising Nepal,"Kathmandu, April 18: The Supreme Court (SC) has given legitimacy to the Gagan Kumar Thapa-led Nepali Congress (NC).

A divisional bench comprising Justice duo, Sharanga Subedi and Nripadhwaj Niraula, recognized the special general convention of the NC and validated the party leadership emerged through the process.

Challenging the Election Commission's decision to recognize the Thapa leadership elected through the special general convention, NC's former President and ex-Prime Minister Sher Bahadur Deuba and then acting President Purna Bahadur Khadka knocked the apex court's doors.

With the Supreme Court's verdict Thursday, the writ petition filed by Deuba and Khadka has been dismissed.

The petitioners in the writ had claimed that the special general convention was illegal arguing it was contrary to the party statute and prevailing laws.

The apex court verdict upheld the Election Commission's decision validating the special general convention held on 27 and 28 Poush.

Although schedule for the party's 15th regular general convention was announced, the SC determined that it could not take place on time.

The order mentions that the demand for a special general convention under Article 17(2) of the NC statute in exceptional circumstances cannot be dismissed.

Supreme Court spokesperson Arjun Koirala had informed that there was a verdict regarding the dispute over the authority of the Nepali Congress.

Regular hearings were held at the Supreme Court on Thursday and Friday (today). NC Vice President Bishw Prakash Sharma also participated in the hearing on Thursday.

Verdict recognizes everyone's dignity and contribution

Meanwhile, NC General Secretary duo, Gururaj Ghimire and Pradip Paudel welcomed the apex court's decision regarding the official status of the Nepali Congress is fair.

Commenting on the verdict, NC General Secretary Gururaj Ghimire said it was an outcome of the relentless struggle by NC members for law and order in the country to this day.

""This decision recognizes everyone's dignity and contribution. It is neither a loss nor a victory for anyone"".

Similarly, another General Secretary, Pradip Paudel, stated that the Supreme Court's verdict on the party's official status will be accepted.

He said, ""This decision should not be a matter of loss or victory for anyone"". (RSS)","{'https://risingnepaldaily.com/storage/media/100446/conversions/sun-original-thumb.jpg', 'https://risingnepaldaily.com/commons/rising-logo.png', 'https://risingnepaldaily.com/storage/media/886/conversions/logo-thumb-thumb-thumb.jpg', 'https://risingnepaldaily.com/storage/media/100447/conversions/Untitled-1-square-thumb.jpg', 'https://risingnepaldaily.com/storage/media/100454/conversions/ason-original-thumb.jpg', 'https://risingnepaldaily.com/storage/media/100450/conversions/aakha-birami-original-thumb.jpg', 'https://risingnepaldaily.com/storage/media/100450/conversions/aakha-birami-square-thumb.jpg', 'https://risingnepaldaily.com/storage/media/100449/conversions/Bagmati-original-thumb.jpg', 'https://risingnepaldaily.com/commons/placeholders/original-thumb.jpg', 'https://risingnepaldaily.com/storage/media/100445/Supreme-court.jpg', 'https://risingnepaldaily.com/storage/media/100455/conversions/Screenshot-2026-04-18-122940-original-thumb.jpg', 'https://risingnepaldaily.com/storage/media/100452/conversions/pull-sadak-square-thumb.jpg', 'https://risingnepaldaily.com/storage/media/100452/conversions/pull-sadak-original-thumb.jpg', 'https://risingnepaldaily.com/storage/media/100448/conversions/1592388170-square-thumb.jpg', 'https://risingnepaldaily.com/storage/media/100448/conversions/1592388170-original-thumb.jpg'}","काठमांडू, १८ अप्रिल : गगन कुमार थापा नेतृत्वक नेपाली कांग्रेसके सर्वोच्च न्यायालय वैधता देलक अछि ।

न्यायमूर्ति जोड़ी शरणगा सुबेदी आरू नृपध्वज निरौला स॑ मिललऽ एगो संभागीय पीठ न॑ नेकां के विशेष सामान्य अधिवेशन क॑ मान्यता देलकै आरू ई प्रक्रिया के माध्यम स॑ पार्टी नेतृत्व क॑ उभरलऽ क॑ मान्यता देलकै ।

विशेष सामान्य अधिवेशन के माध्यम स निर्वाचित थापा नेतृत्व के मान्यता देबाक निर्वाचन आयोग के निर्णय के चुनौती दैत नेकपा के पूर्व राष्ट्रपति आ पूर्व प्रधानमंत्री शेरबहादुर देउबा आ तत्कालीन कार्यवाहक अध्यक्ष पूर्णबहादुर खड्का सर्वोच्च न्यायालय के दरवाजा खटखटौलनि।

गुरुवार कए सुप्रीम कोर्ट क फैसला क संग देउबा आ खडका क रिट याचिका खारिज भ गेल अछि।

रिट म॑ याचिकाकर्ता न॑ दावा करल॑ छेलै कि ई विशेष सामान्य सम्मेलन गैरकानूनी छै आरू ई तर्क देल॑ छेलै कि ई पार्टी केरऽ विधान आरू प्रचलित कानून के विपरीत छै ।

सुप्रीम कोर्ट केरऽ फैसला म॑ २७ आरू २८ पौश क॑ आयोजित विशेष सामान्य अधिवेशन क॑ मान्य करै वाला चुनाव आयोग केरऽ फैसला क॑ सही ठहरालऽ गेलै ।

हालांकि पार्टी के 15म नियमित आम अधिवेशन के कार्यक्रम के घोषणा भ गेल छल, मुदा अनुसूचित जाति समय पर नहि भ सकैत अछि से तय केलक।

आदेश मे उल्लेख अछि जे असाधारण परिस्थिति मे नेकां विधान क अनुच्छेद 17(2) क तहत विशेष सामान्य सम्मेलन क मांग कए खारिज नहि कैल जा सकैत अछि।

सर्वोच्च न्यायालयके प्रवक्ता अर्जुन कोइराला नेपाली कांग्रेसके अधिकारके विवादके सम्बन्धमे फैसला भेल जानकारी देने छल ।

गुरुवार आ शुक्रदिन (आइ) सुप्रीम कोर्ट मे नियमित सुनवाई भेल। बृहस्पतिदिन सुनवाई मे नेकपा उपाध्यक्ष विश्व प्रकाश शर्मा सेहो भाग लेलनि।

फैसला सबहक गरिमा आ योगदान के मान्यता दैत अछि

ओतहि नेपाली कांग्रेसक आधिकारिक दर्जाक संबंध मे सर्वोच्च न्यायालयक निर्णय उचित अछि नेकपा महासचिवक जोड़ी गुरुराज घिमिरे आ प्रदीप पौडेल स्वागत केलनि ।

एहि फैसला पर टिप्पणी करैत नेकपा महासचिव गुरुराज घिमिरे कहलनि जे, ई नेकपा सदस्य द्वारा आइ धरि देश मे कानून व्यवस्था लेल अथक संघर्षक परिणाम अछि।

""ई निर्णय सबहक गरिमा आ योगदान के मान्यता दैत अछि। ई ने ककरो लेल नुकसान अछि आ ने जीत""।

तहिना एकटा आओर महासचिव प्रदीप पौडेल के कहनाय छनि जे पार्टी के आधिकारिक दर्जा पर सुप्रीम कोर्ट के फैसला स्वीकार कएल जाएत.

ओ कहलनि जे, ई निर्णय ककरो लेल हारि या जीत के बात नहि हेबाक चाही। (आर एस एस) २."
US Assistant Secretary of State S. Paul Kapur to Visit Nepal - Ratopati,US Assistant Secretary of State S. Paul Kapur to Visit Nepal  Ratopati,2026-04-18 03:33:45,https://news.google.com/rss/articles/CBMingFBVV95cUxQNlhCOWp5RmdqZjZsaHNCeXdHMk9PeUV6Ul93anFnd3MwWm1YTm1Ya0w0NzhTZ2VVRERXSFp5bnMzVlJDeWRkNU9ubzRmNEZsa1Z2MTY1OXkwVF9hNTI1U2VuTnAtRUVUaTRhSXRzYlQwNWN1SFh0ZUZGWkN0NGZZRlFldGNhMFFXLVdNLUNOVDhEa2dLeFNPYXA4TjhMQQ?oc=5&hl=en-US&gl=US&ceid=US:en,https://english.ratopati.com,Ratopati,"Kathmandu. As preparations are underway for Indian Foreign Secretary Vikram Misri's visit to Nepal, US Assistant Secretary of State S. Paul Kapur is set to arrive for a three-day visit. According to Ministry of Foreign Affairs sources, he is scheduled to arrive in Nepal on Monday for an official visit.

This is considered the highest-level visit during the tenure of the current government formed after the Gen-Z movement. Kapur, known as a close associate of US President Donald Trump, also oversees South and Central Asian affairs.

President Trump appointed Kapur in Falgun 2081, replacing former Assistant Secretary of State Donald Lu. His appointment sparked significant discussion due to his Indian heritage; he was born in India to an Indian father and an American mother.

Former Assistant Secretary of State Donald Lu visited Nepal four times during his tenure. He is widely credited with playing a major role in the implementation of the MCC in Nepal. The MCC was passed by parliament following his high-level meetings in Nepal at the time.

Assistant Secretary Kapur's upcoming visit to Nepal is being viewed as highly significant.

Kapur, a former professor at the US Department of National Security Affairs, also served on the State Department's Policy Planning Staff during the final year of President Trump's previous term from 2020-21, where he was responsible for South Asian affairs. A former professor at the US Naval Postgraduate School, Kapur was once analyzed as a staunch critic of Pakistan, though his role in the mediation between Iran and the US facilitated by Pakistan has also been noted.

During his time as a State Department official, he established himself as an expert in South Asian security, nuclear strategy, and international relations. He has conducted research specifically on India-Pakistan relations, terrorism, and regional security.

Amidst growing geopolitical competition in South and Central Asia, Nepal's foreign policy is currently a subject of discussion. The steps taken by the Balen-led government in the diplomatic sphere have garnered attention. It is reported that Assistant Secretary Kapur will exchange views with Nepal on regional stability, security, and cooperation.

He is expected to hold high-level meetings, including with Foreign Minister Shishir Khanal. However, it remains uncertain whether a meeting with Prime Minister Balen will take place.","{'https://npcdn.ratopati.com/media/news/durga_8l9uFh1qBa.png', 'https://rpcdn.ratopati.com/media/albums/kanchanganga_gab5GdO5Tc.jpg', 'https://npcdn.ratopati.com/media/news/water-bottle_5cd38cc983e3b8ce28c9595b3133f63b_ToYxSmOjBx.avif', 'https://npcdn.ratopati.com/media/authors/ratopati_science_RGmmSpmAnu.jpg', 'https://npcdn.ratopati.com/media/news/s-paul-kapur_rznVBp6jKt.png', 'https://english.ratopati.com/build/img/logo-rp.png', 'https://npcdn.ratopati.com/media/news/deuba-gagan_G5WF8gLC73.jpg', 'https://npcdn.ratopati.com/media/news/01-1776481757-o8lng_Y1bECmTeis.jpg', 'https://npcdn.ratopati.com/media/news/matdata-namabali-darta-(12)_reokQGrQgj.jpg', 'https://npcdn.ratopati.com/media/news/gagan-thapa_VVgrawger3.jpg', 'https://npcdn.ratopati.com/media/news/perisdanda-anasan_DTXgMNNzA6.jpg', 'https://npcdn.ratopati.com/media/news/accident1_0HVVwEUEAJ.jpg', 'https://npcdn.ratopati.com/media/news/UKB2PCDB6U.jpg'}","काठमांडू। भारतीय विदेश सचिव विक्रम मिश्री के नेपाल यात्रा के तैयारी चलि रहल अछि, तहिना अमेरिका के सहायक विदेश सचिव एस. विदेश मन्त्रालयके सूत्रके अनुसार सोमदिन ओ आधिकारिक भ्रमणके लेल नेपाल आबयके कार्यक्रम रहल अछि ।

जेन-जेड आन्दोलन के बाद बनल वर्तमान सरकार के कार्यकाल में ई उच्चतम स्तरीय यात्रा मानल जाइत अछि । अमेरिकी राष्ट्रपति डोनाल्ड ट्रंप केरऽ करीबी सहयोगी के रूप म॑ जानलऽ जाय वाला कपुर दक्षिण आरू मध्य एशिया केरऽ मामलऽ के देखरेख भी करै छै ।

राष्ट्रपति ट्रंप न॑ फाल्गुन २०८१ म॑ कपुर क॑ पूर्व सहायक विदेश सचिव डोनाल्ड लू के जगह प॑ नियुक्त करलकै । हुनकऽ नियुक्ति के कारण हुनकऽ भारतीय धरोहर के कारण महत्वपूर्ण चर्चा शुरू होय गेलै; हुनकऽ जन्म भारत में भारतीय पिता आरू अमेरिकी माता के घरऽ में भेलऽ छेलै ।

पूर्व सहायक राज्य सचिव डोनाल्ड लु अपन कार्यकाल मे चारि बेर नेपाल गेल छलाह । नेपालमे एमसीसीके क्रियान्वयनमे प्रमुख भूमिका निभाबयके श्रेय हिनका व्यापक रूपसँ देल जाइत अछि । ओहि समय नेपाल मे हुनक उच्च स्तरीय बैसारक बाद संसद द्वारा एमसीसी पारित कएल गेल छल ।

सहायक सचिव कपुर केरऽ आगामी नेपाल यात्रा क॑ अत्यंत महत्वपूर्ण मानलऽ जाय रहलऽ छै ।

अमेरिकी राष्ट्रीय सुरक्षा मामलों विभाग केरऽ पूर्व प्रोफेसर कपुर न॑ राष्ट्रपति ट्रंप केरऽ पिछला कार्यकाल केरऽ अंतिम साल म॑ भी विदेश विभाग केरऽ नीति योजना स्टाफ के रूप म॑ काम करलकै, जेकरा म॑ हुनकऽ दक्षिण एशियाई मामलऽ के जिम्मेदारी छेलै । अमेरिकी नौसेना स्नातकोत्तर स्कूल केरऽ पूर्व प्रोफेसर कपुर क॑ एक बार पाकिस्तान केरऽ कट्टर आलोचक के रूप म॑ विश्लेषण करलऽ गेलऽ छेलै, हालांकि पाकिस्तान द्वारा सहायता प्राप्त ईरान आरू अमेरिका के बीच मध्यस्थता म॑ हुनकऽ भूमिका भी नोट करलऽ गेलऽ छै ।

विदेश विभाग केरऽ अधिकारी के रूप म॑ अपनऽ समय म॑ दक्षिण एशियाई सुरक्षा, परमाणु रणनीति, आरू अंतर्राष्ट्रीय संबंधऽ के विशेषज्ञ के रूप म॑ खुद क॑ स्थापित करलकै । भारत-पाकिस्तान संबंध, आतंकवाद, आरू क्षेत्रीय सुरक्षा पर विशेष रूप स॑ शोध करल॑ छै ।

दक्षिण आ मध्य एशिया मे बढ़ैत भूराजनीतिक प्रतिस्पर्धाक बीच नेपालक विदेश नीति एखन चर्चाक विषय अछि । कूटनीतिक क्षेत्र मे बलेन के नेतृत्व वाला सरकार के तरफ सं उठाओल गेल कदम पर ध्यान आकर्षित कएल गेल अछि. सहायक सचिव कपुर नेपालक संग क्षेत्रीय स्थिरता, सुरक्षा, आ सहयोग पर विचार आदान-प्रदान करबाक सूचना अछि ।

हुनका उच्च स्तरीय बैठक करबाक उम्मीद अछि, जाहि मे विदेश मंत्री शिशिर खनाल सेहो शामिल अछि। मुदा प्रधानमंत्री बालेन सं भेंट होएत कि नहि से अनिश्चित अछि."
