title,description,published date,url,publisher.href,publisher.title,full_article,images,translated
"Monsoon floods destroy Nepal-China border bridge, 18 missing | VIDEO - Mathrubhumi English","Monsoon floods destroy Nepal-China border bridge, 18 missing | VIDEO  Mathrubhumi English",2025-07-08 09:20:30,https://news.google.com/rss/articles/CBMiogFBVV95cUxNTThqOGhhbFdkZDVyZnp3RnRtWjE5TzhBX0d4S3hjNG1RY0FQZzdnMEs0TUZaUVAxaTloUDNiOUJtQjk1YzNFLVVrLTJFUTN6S29ERUo2U0lXUUVoak9ldWhBV1AtVnd4bXRLMHRDY3V6OFZUc21FZ1A4QTUtTXFQVlE3N3hrMnp3YXFITWxRVVlQNzF1bTkwQng4MjU2Qk9TMGc?oc=5&hl=en-US&gl=US&ceid=US:en,https://english.mathrubhumi.com,Mathrubhumi English,,{'https://lh3.googleusercontent.com/J6_coFbogxhRI9iM864NL_liGXvsQp2AupsKei7z0cNNfDvGUmWUy20nuUhkREQyrpY4bEeIBuc=s0-w300'},
Monsoon floods sweep away 18 people and the main bridge linking Nepal to China - Goshen News,Monsoon floods sweep away 18 people and the main bridge linking Nepal to China  Goshen News,2025-07-08 09:22:30,https://news.google.com/rss/articles/CBMihAJBVV95cUxOSWlBTTdBUkJQbXhRMzJFSUgzTVhTZFppLWpNZ0xKbkRRS0RyMk1TXzhzbGFid0xfeXhWNDBtbGQ4MXJHVDY0d190XzV0YjcxdVVZcVNVZVdCY1B6NUVTTFJkd3JtYUF0TV8zMXo5blJSeGRtSDVuVWp0QUFMY05hOTAzWlVlYzBXM05RNmR0SUg2MTZKVkdhcTdPTDA3QTdxam5iTENMajZ1SWR0Z3pjd1EzcXY4OFpGSVFyVzJIVjFNQ3h0ZkliV3J5NENSNndTSUtoTXhULVoyVEp6ajgxRVFpS0laRV8wVVpTTVRBd0E3MnNNS0xralhVSVVaVXI0cnVNUQ?oc=5&hl=en-US&gl=US&ceid=US:en,https://www.goshennews.com,Goshen News,,{'https://lh3.googleusercontent.com/J6_coFbogxhRI9iM864NL_liGXvsQp2AupsKei7z0cNNfDvGUmWUy20nuUhkREQyrpY4bEeIBuc=s0-w300'},
Monsoon floods sweep away 18 people and the main bridge linking Nepal to China - The Hill,"Monsoon floods sweep away 18 people and the main bridge linking Nepal to China  The HillDeadly Flash Floods Sweep Away Nepal-China Bridge  The New York TimesDozens missing after floods on Nepal-China border  ReutersFlash floods in Nepal wash away border bridge with China | World News - Hindustan Times  Hindustan Times17 missing after mudslide hits China-Nepal border port  Deccan HeraldFloods sweep away 18 people and bridge linking Nepal to China  The IndependentNepal-China flash floods: 1 dead, dozens missing as torrential rains hit; rescue ops underway  Times of IndiaMonsoon floods sweep away 18 people and the main bridge linking Nepal to China  Yahoo",2025-07-08 09:30:00,https://news.google.com/rss/articles/CBMiywFBVV95cUxOZ3poV1BmWDBxZ2Q4aU1LV3FzWmphZWI1dnFTZEtOa0tHZUxaSEpka2V2TWtSSE1xdTRWaEQ1Y29vWENGVjFEbDE4aWhjZHFWcHVsX29MY0hCTy1ENldtRlFiMlIyTHh0MmFZQ0hCakpmZWF2VE1qb0lFekszaXdIRS1NaFYtNFF1VDRnQnZ3eGpOcXVHdTNlTnpidTJOS0ZiRGF2RDZJRUoyMFlla0tiR0xKVW9mLXM1MkYya3NQcXVBQmx3bVJmR2QzONIB0AFBVV95cUxPa3lQOTZGWFQ5ZGs5Y3lPdEpyYS1qTDRSU1VQVjRVVWhaUTJwWVdKd3NmVi14Zk9nclJtUWMyZ3V5ZmNLSVNRbW8zMy1BVmNqOHFiTWJENVdUOE5ybWhXSkstSXN5UF9wRVJDMlo1M3dvOXZsUG1WU2REUzZuWXZrVDJ1QWp1OGtCUW9CMk5QYWlDdDVubXNIdkZQMGI4VmRsV1N2WmZmVG1hRlBUaTJ2REF3NUhvN3JPb19FeTFGeFI1cTExX3EwNzVrU2wwMnpT?oc=5&hl=en-US&gl=US&ceid=US:en,https://thehill.com,The Hill,,{'https://lh3.googleusercontent.com/J6_coFbogxhRI9iM864NL_liGXvsQp2AupsKei7z0cNNfDvGUmWUy20nuUhkREQyrpY4bEeIBuc=s0-w300'},
Monsoon floods sweep away 18 people and the main bridge linking Nepal to China - AP News,Monsoon floods sweep away 18 people and the main bridge linking Nepal to China  AP News,2025-07-08 09:30:00,https://news.google.com/rss/articles/CBMimwFBVV95cUxNaTFwdktRZzJzcGlZTDVqRTBWUWtNR0Y0cHR1S0tQUnpxVkJoSmRNOGg5dWdWb0EyVHdtdXVtZHJtS0o4LVRCTDNHdmcxQ1pVbmQzeGZ4QmtoUnVtX09LaEhKUUdpYjRmY3ZuOU5uQVV6WXB3VVVsS2pJenZlTDFYX1QwR2lfTG5rTVRpbmdyMGxVTmxmdGhJN0pKWQ?oc=5&hl=en-US&gl=US&ceid=US:en,https://apnews.com,AP News,,{'https://lh3.googleusercontent.com/J6_coFbogxhRI9iM864NL_liGXvsQp2AupsKei7z0cNNfDvGUmWUy20nuUhkREQyrpY4bEeIBuc=s0-w300'},
"Floods destroy bridge between Nepal, China, 18 missing - Report.az","Floods destroy bridge between Nepal, China, 18 missing  Report.az",2025-07-08 09:32:00,https://news.google.com/rss/articles/CBMilAFBVV95cUxQMmNVeHlvT0Vib0ppUHhzZjNkUGFhREVXLS04TnJxQ3pMUndlTVU2VnZaZUpJRS1QTUhSYUx5VEMtdnpFamg0bWs5LUhNQkpvbE9wVUhzd3VRQXhNcHFzX2c1Vk9FemtmNWZWeE1tbXFFTENCRXlZMVRITGptM21DYXNlWXFlTHctd1hFMkwtNXBwWG9V0gGaAUFVX3lxTE5LdEZsZjlyVkFtM08zdkM5UkRLSHhHd08tVlJINEkzSnNyQnJMRWVQbENxZFJ3aFAtcWxkZDNZTTlRV3NSdVRqeEVXRXRFYzdMdEtfZUpfSDRIWm9NalVNTHlvSWNER3FXUEw2VFRFZ1Q2VExjY1poLVlRc2Z6aFh6YWU5NW9jRUpCYWNkUHA3SkZaVUxZUVhRYlE?oc=5&hl=en-US&gl=US&ceid=US:en,https://report.az,Report.az,,{'https://lh3.googleusercontent.com/J6_coFbogxhRI9iM864NL_liGXvsQp2AupsKei7z0cNNfDvGUmWUy20nuUhkREQyrpY4bEeIBuc=s0-w300'},
"Flash floods hit Nepal-China border, 18 missing - MorungExpress","Flash floods hit Nepal-China border, 18 missing  MorungExpress",2025-07-08 09:40:21,https://news.google.com/rss/articles/CBMifEFVX3lxTE14WTUxbjJoWkZuaXhLMkxGMzhISjJUZTM0QmltYlJrVUM2dDNQV0hENzBTc1lKSEljZHZRMmszUm5UOWdWckR3Y2xuUzVtUnVwLVJvWlJLVkd1ZVdUMVJtMDB2WnZJc1F0ZFA2SWxsSGVzVFJtN2ZQbGJDa2w?oc=5&hl=en-US&gl=US&ceid=US:en,https://morungexpress.com,MorungExpress,,{'https://lh3.googleusercontent.com/J6_coFbogxhRI9iM864NL_liGXvsQp2AupsKei7z0cNNfDvGUmWUy20nuUhkREQyrpY4bEeIBuc=s0-w300'},
Floods wash away Nepal-China border bridge - Udayavani,Floods wash away Nepal-China border bridge  Udayavani,2025-07-08 10:30:00,https://news.google.com/rss/articles/CBMiiAFBVV95cUxQcDJWUzRIa2M4b3JWR2RlUlBnTXMzWEdLSE54WjdTdzZEd21QOHE5WEN3RUtZY3ZYVWJCS1l3UGJJdTJMckZTVEVPbkNkZEVPX0dleVpKb2VHOE84U3N3d3h0aHE0VHo2YWlMRjFwMkVTamJnSnREc3dCOGE2WlNxWEZwRTdXS29f?oc=5&hl=en-US&gl=US&ceid=US:en,https://www.udayavani.com,Udayavani,,{'https://lh3.googleusercontent.com/J6_coFbogxhRI9iM864NL_liGXvsQp2AupsKei7z0cNNfDvGUmWUy20nuUhkREQyrpY4bEeIBuc=s0-w300'},
"Monsoon floods wash away Nepal-China bridge, 18 missing - United News of Bangladesh","Monsoon floods wash away Nepal-China bridge, 18 missing  United News of Bangladesh",2025-07-08 10:38:07,https://news.google.com/rss/articles/CBMimwFBVV95cUxPUlZ1UVJYWFFQU1pmbnB5OThnemNUWWFrdnhxcGNheDMzWUhJOEVpeGJvemRTUHVmQnZDM3gza2RQVjRkbkk4TVNxQ3RYc3lCNDc2VVFpUm5XMkxhTEh1VlVMWnVfZVRCeHhMYVM2MWl2T2ljek1KT196X21YNEtzOVNpaGxOTFp5QU1SQk5GYjNQUmdEd2x3Qk1YNA?oc=5&hl=en-US&gl=US&ceid=US:en,https://unb.com.bd,United News of Bangladesh,,{'https://lh3.googleusercontent.com/J6_coFbogxhRI9iM864NL_liGXvsQp2AupsKei7z0cNNfDvGUmWUy20nuUhkREQyrpY4bEeIBuc=s0-w300'},
"Flash floods hit Nepal-China border; at least one dead, dozens missing - WION","Flash floods hit Nepal-China border; at least one dead, dozens missing  WION",2025-07-08 10:45:00,https://news.google.com/rss/articles/CBMiswFBVV95cUxNOVhrelA4ZkZjNDBOTHRaRjl0OWFGbW5KWUJTS21SLTV6YWw3dXRBNmR3MXRBNXVxWGlWVjgxY0syVUVuWWlFUHNWdnBTU2RwRGh1ZTRza2pfRWJlR2kzT0pmS3FJNXpyRG43THYxN1ZnUE9jRnBRdkNYeUk5OVJ6UnVBcVZjNGVlTHo2OWN6a3JPZlRLM0E4RFAzZjdiOW5Mbk0zZHJ6SU5IbVhPZENIRDMtY9IBuAFBVV95cUxNLTBuMUhiRUdPU2tfby1BMGVIdHdtcXpfempvbXNUMFhiRlRHZFNNMnFsanJsSGN4UlZOdFFtUURwTlR1NENnOXZxY1ZQSHFCazhLX0w2LWg5OTE2S0hDeHNKTHpwbzlabWl0akd3dnRQWkNDeXZwTm0xd3V5aWQtRUpzcldoVmVUMDNOVkx1U3R3OFRZRVFTc1gzMl9PVUFmTXd1VVZQaXNNQ1pWWjFmdXNfb2k2eVM3?oc=5&hl=en-US&gl=US&ceid=US:en,https://www.wionews.com,WION,,{'https://lh3.googleusercontent.com/J6_coFbogxhRI9iM864NL_liGXvsQp2AupsKei7z0cNNfDvGUmWUy20nuUhkREQyrpY4bEeIBuc=s0-w300'},
17 missing after mudslide hits China-Nepal border port - Daily Excelsior,17 missing after mudslide hits China-Nepal border port  Daily Excelsior,2025-07-08 10:47:16,https://news.google.com/rss/articles/CBMijwFBVV95cUxNa2NkRWFTSVkzVW9RTmJ0UTZSakxkMWo0SnhxX0hiMGZPTVJtREhJX1VMejVtLXE4UDdSaXZRNTlpenZweFcxeW10VXc3VVlscC05d3l5TzBIZTVrRXh3ZEI3VW9KOTlPNnBhUEk2TGp3WExKYzQ0S0Z2Sjl3MEhZczJJWkpfcVZ2SHBxQU9IQQ?oc=5&hl=en-US&gl=US&ceid=US:en,https://www.dailyexcelsior.com,Daily Excelsior,,{'https://lh3.googleusercontent.com/J6_coFbogxhRI9iM864NL_liGXvsQp2AupsKei7z0cNNfDvGUmWUy20nuUhkREQyrpY4bEeIBuc=s0-w300'},
"USAID Lost: Stories from Colombia, Kenya, and Nepal - Think Global Health","USAID Lost: Stories from Colombia, Kenya, and Nepal  Think Global Health",2025-07-08 11:00:15,https://news.google.com/rss/articles/CBMijgFBVV95cUxNbmR0Q09RUkN0aXJzOF9LbUhodTdTVC10ZWJBTS03ajlaVG92S1Y5cllSbUVUS1pFZXpNNmhfMWlRUmtJQmRneFpmSGI4Ym5QcTU4dE9YR191QW9YSWZvbVdHOFpzdlhTU2RXeWQ0SFZaVHVIVUFiV0w0UUEwbnBpc2h6OXhmS2hvQjdIQUZR?oc=5&hl=en-US&gl=US&ceid=US:en,https://www.thinkglobalhealth.org,Think Global Health,,{'https://lh3.googleusercontent.com/J6_coFbogxhRI9iM864NL_liGXvsQp2AupsKei7z0cNNfDvGUmWUy20nuUhkREQyrpY4bEeIBuc=s0-w300'},
Weekly Nepal Update: Parliamentary probe committee formed to review ‘cooling-off period’ - SBS Australia,Weekly Nepal Update: Parliamentary probe committee formed to review ‘cooling-off period’  SBS Australia,2025-07-08 11:16:52,https://news.google.com/rss/articles/CBMi7wFBVV95cUxNWUxTSGNsM0N4eFY1ZWUweThmcmplOUY4U3UzVDRSR2dXdURiejJpN05jdHpMNXIxOTdEWE9aTTBpMUw5RUlHOTdwV3RtMFVOTTZfcVF3d29VUkhmQ3FxRXhFelZjVXpGcjFYUnZ1aXZ2NExKc3RtVWxaSVh0VV8ydkZkeTRFVWpBLVZ5cVhYM1BTNG85X3NrZHA3MGh1V1Fmb2pvT2lobklwQ0d0Z2J3OENwRXh5bkw2QXlUcmpDZDVyTEt4QllkelU4UGd0WkcwLUl1RnhDT0Q3d2lFeW1KWURrcVpfcVp4d1IxSU9HNA?oc=5&hl=en-US&gl=US&ceid=US:en,https://www.sbs.com.au,SBS Australia,,{'https://lh3.googleusercontent.com/J6_coFbogxhRI9iM864NL_liGXvsQp2AupsKei7z0cNNfDvGUmWUy20nuUhkREQyrpY4bEeIBuc=s0-w300'},
Monsoon floods sweep away 18 people and the main bridge linking Nepal to China - MSN,Monsoon floods sweep away 18 people and the main bridge linking Nepal to China  MSN,2025-07-08 11:17:15,https://news.google.com/rss/articles/CBMiyAFBVV95cUxOdk1vT3pOWDRzdzkweDBQZmhEUW1IQV9teGlDdzJGTlJnZHNTNG1iZFRQMXJ4TlRxUFFkQTdvaXNsQzg5eG1RWW5XeFBXLS1TXy1KLTVBZ2I4V25uakltNUR4VmNCUU5BRWlaU0RRRUVCbG1IRjJiRDZuX1lWbFNPSFlZVjJvM05nVUtzMDBqWXRVbGhCNnJjU0N4Tk9kX1FwVWR1UFNzLWZiRTVqM3RrUFpNMFJ2QnloSk50a0I3aVhyVGJ6a3hqNA?oc=5&hl=en-US&gl=US&ceid=US:en,https://www.msn.com,MSN,,{'https://lh3.googleusercontent.com/J6_coFbogxhRI9iM864NL_liGXvsQp2AupsKei7z0cNNfDvGUmWUy20nuUhkREQyrpY4bEeIBuc=s0-w300'},
Pokhara International Airport: Nepal’s costly White Elephant - The Borderlens,Pokhara International Airport: Nepal’s costly White Elephant  The Borderlens,2025-07-08 11:18:09,https://news.google.com/rss/articles/CBMingFBVV95cUxOb3BLTFNhaEhDalhqWVlPcFVWbmh3Qk1GSHJPUTBCOXRuUFNLem5LTGxIaTc3c0p2LUE4WmtLTXRPOFdhcFptX0M5WTFrdmJVanM3V2Y1elF2Szd1aURhd1BsTEU3b211elJEb1NYZlpBdlZ6SFdSUnZJRDB3Zm5YVGFaa08zcnhxdm9FTW9odWZKbmcwLWlaMlJBQ3Zadw?oc=5&hl=en-US&gl=US&ceid=US:en,https://www.borderlens.com,The Borderlens,,{'https://lh3.googleusercontent.com/J6_coFbogxhRI9iM864NL_liGXvsQp2AupsKei7z0cNNfDvGUmWUy20nuUhkREQyrpY4bEeIBuc=s0-w300'},
Floods sweep away 18 people and bridge linking Nepal to China - Yahoo,Floods sweep away 18 people and bridge linking Nepal to China  Yahoo,2025-07-08 11:31:05,https://news.google.com/rss/articles/CBMid0FVX3lxTE1yUkF2VWVlM3Q0QlV3amRlSjBEVkQzdGFPc3FCV1dVTVNPbUpwNnlvdnZBY2U1U0dpQk5xZEtwdng0THlXNmVRMW9WQ0xkSzQtQ0FScmYzWkE1clZ5M2lGMHo1UGRJcjh5d1pqMmNoYnpSeTFGbEdV?oc=5&hl=en-US&gl=US&ceid=US:en,https://uk.news.yahoo.com,Yahoo,,{'https://lh3.googleusercontent.com/J6_coFbogxhRI9iM864NL_liGXvsQp2AupsKei7z0cNNfDvGUmWUy20nuUhkREQyrpY4bEeIBuc=s0-w300'},
Flood wreaks havoc on Nepal-China border; 18 missing - dynamitenews.com,Flood wreaks havoc on Nepal-China border; 18 missing  dynamitenews.com,2025-07-08 11:35:22,https://news.google.com/rss/articles/CBMimgFBVV95cUxOSWI1N3pQZEVwNndPWGVZM3R4bmptZ0J5N25LMDQ5OElWcXNfRUcxT0FybTZjX0xHOHZNLTI0RVdGUTA2Rk1RVWEzdlFIYWozRmpuZnE5clU5aFdaSF9GQUJvcFhDemxTMVhaZUpXMlV6aDZjeE5CeHkwMDRJdE1aWHNsNXdCaGplTU1WX0NoMkNmRTFIYndkNVp3?oc=5&hl=en-US&gl=US&ceid=US:en,https://www.dynamitenews.com,dynamitenews.com,,{'https://lh3.googleusercontent.com/J6_coFbogxhRI9iM864NL_liGXvsQp2AupsKei7z0cNNfDvGUmWUy20nuUhkREQyrpY4bEeIBuc=s0-w300'},
"Nepal's trade deficit rises to Rs 1,397 billion in 11 months - The Himalayan Times","Nepal's trade deficit rises to Rs 1,397 billion in 11 months  The Himalayan Times",2025-07-08 11:44:53,https://news.google.com/rss/articles/CBMingFBVV95cUxNRkZaTk1od00xdXE3SzVyamIyTnZyWXM5QVBScHhiM2RwbmlHbmtjNUFpR01qMHZLOGRKcDZ1Y0M2VWlvcjJwZzBVYU02QmNVRXhKck9uV2pWZE9aeDFfNUxmdUVMclUxUWF4MVRkaHRZa3FFZWJudEJsYmpfYXlJWUNZaFRFT0JwRnRkQll3TnZTSTYxR1hKX3doMm9Xdw?oc=5&hl=en-US&gl=US&ceid=US:en,https://thehimalayantimes.com,The Himalayan Times,,{'https://lh3.googleusercontent.com/J6_coFbogxhRI9iM864NL_liGXvsQp2AupsKei7z0cNNfDvGUmWUy20nuUhkREQyrpY4bEeIBuc=s0-w300'},
"Nepal PM says ‘Ram was not Indian’, sparks debate - GujaratSamachar English","Nepal PM says ‘Ram was not Indian’, sparks debate  GujaratSamachar English",2025-07-08 12:02:52,https://news.google.com/rss/articles/CBMiowFBVV95cUxQVHV3OU5icnZLcGhNX0xjbS00a29JYjRCTWJnRmtIMS1EWVJMalJxQWpLbjBIa0NfRjhXclRvdFR0ancxa3NSMlAzY3kyanZSUkFVVTAxdHUtRzIzRktDV25SNmdiY0pfdXdTemNueWVHLVl5c2M5S2g0a0VWNWRiTWR2M0l3dFNZeFF2V0VRZG41dll3THN1T3FXc20wMi1FT3JN?oc=5&hl=en-US&gl=US&ceid=US:en,https://english.gujaratsamachar.com,GujaratSamachar English,,{'https://lh3.googleusercontent.com/J6_coFbogxhRI9iM864NL_liGXvsQp2AupsKei7z0cNNfDvGUmWUy20nuUhkREQyrpY4bEeIBuc=s0-w300'},
Nepal hosted a Referee & Judge Certification Course - asbcnews,Nepal hosted a Referee & Judge Certification Course  asbcnews,2025-07-08 12:14:39,https://news.google.com/rss/articles/CBMif0FVX3lxTE1ka2Yta0xFRDJZMVJDN2xlZk1BVTVuNWZpZmVNdGpSZjlnVXpTUVJDTXJRSlFpREN2eU55Q2dXUjJnakFVSUJEQmp0RmZCblhKb3BJRzRtQWVZVEFYX1ZuQUY4a2FMSVFGS1pUc3hfWV9xU3A4VDhrUXhPcWdJNFE?oc=5&hl=en-US&gl=US&ceid=US:en,http://www.asbcnews.org,asbcnews,,{'https://lh3.googleusercontent.com/J6_coFbogxhRI9iM864NL_liGXvsQp2AupsKei7z0cNNfDvGUmWUy20nuUhkREQyrpY4bEeIBuc=s0-w300'},
"Floods sweep Nepal-China border, dozens missing after bridge washout - Daily Times","Floods sweep Nepal-China border, dozens missing after bridge washout  Daily Times",2025-07-08 12:20:48,https://news.google.com/rss/articles/CBMipAFBVV95cUxQRWFVSTBWOGpwWjZnSzFuUExxUWVpUVByc1dfU2NGNEdBNFhUc0pVVDV2dDAtT3hLaTk0X0o2TUR3aEJQcFdvcDNKc25rYU1Yb0dHNFBvTlJBcDV1aTlsMHVGZTRhNEVVcmdaZWpXMDJQUjRtUUJSU2ZxekRSSDI5NE93UFdZd1lBLTlOVXpTbi1LVi04TTcyT2ZTYkg3eFJMUUR0UNIBqgFBVV95cUxOYjdxeEJDSndBZ0hYNEVCanE0NU04NDQzMkUzcFNwbFR2V21MS3BiZk1QcXBSOU9JRW9FN0hXYzdHNC1MWjczNUwxcXR0WlBqck8wX3BrcmE4OGp2dUNRUkVxMWIwaXYzeVZzSmFHczhRTzF0R2RZck1BMnRhd1BfV2dQemFZaHRmQVVoQTVGMkFaWHR6eFdwWlNKdlhjUE5sMjJ1VUJLaXZBZw?oc=5&hl=en-US&gl=US&ceid=US:en,https://dailytimes.com.pk,Daily Times,,{'https://lh3.googleusercontent.com/J6_coFbogxhRI9iM864NL_liGXvsQp2AupsKei7z0cNNfDvGUmWUy20nuUhkREQyrpY4bEeIBuc=s0-w300'},
