title,description,published date,url,publisher.href,publisher.title,full_article,images,translated
Some laws are barrier to disaster management: Home Minister - Nepalnews.com,Some laws are barrier to disaster management: Home Minister  Nepalnews.com,2026-06-11 12:29:44,https://news.google.com/rss/articles/CBMiogFBVV95cUxQangweGppUThWSzdCUzhlbi1YcUN2NXlOb0otNFd5b0xLYmo3eXlpRTZQSVhZUnNrXzdvRk1zVG9nTFMwVDRGTUNYMi1YcV9UT1BOOXVTMjVXTmJUaTRDSGlTa05GaThXVGp2MXpoZ2NEY01NbXJFQWZqaUFnRXB2NkRxR0xETTFmQ3VzbFNCWXV1SHdxSHlZVHNPN2hzU0EwVVE?oc=5&hl=en-US&gl=US&ceid=US:en,https://english.nepalnews.com,Nepalnews.com,,,
"India, Nepal launch cross-border remittance mechanism; links UPI, NPI - BusinessLine","India, Nepal launch cross-border remittance mechanism; links UPI, NPI  BusinessLine",2026-06-11 12:29:49,https://news.google.com/rss/articles/CBMi2AFBVV95cUxPSF9fZndWYV81S204THVSOVlfZEtpWExRdmhFd1pwZTFrQjVaV04zMGZhSDRpYTIweE5pYWFZLUR5alEtZFpYcGVIZG5vNjQ0a0ZWWTVUalZEbGx0THRETU55RXpvY1daLXJLQnFUNXEtc05XZFhmMjZzb21iMDl2RVBBYzVfYWVFRkVnZVJHMHFzTGVtOEl1R2M0Q0hFZVZlS0JaWGpOeDFtSy1OTGE5SDJzRDhfYTM0QkZCeXVzZF9TMkZVQ1Z6SHBybmJ3UjR3dEY2S0syQUTSAd8BQVVfeXFMT3R3Q1E2aFlJR29EZ3lrbUF2WlpNTnJjbTdOLVJ4NzRVSXF2MjhZbENCbGswMWNkdkExTGV6VW1MVW1kVVBacTdRTDZQTmZiNmRzZjE4UXpkbGN4eVZCVnczWGlpYmFmaWtTUldGSG1oYmtPWHVUYU5YVV9BQW8xTERxVEdPX05WaUE3RGpreVVPYWsyUEEya21qdk9QMFJtaS0zNVJZejAtRDNORURJS2NpblpxNTYtd1RaQ2VYTjZqTVpGQ1I1N2hmaU53RmRTTkpzdXdJaVpsb29lcDFMRQ?oc=5&hl=en-US&gl=US&ceid=US:en,https://www.thehindubusinessline.com,BusinessLine,"India and Nepal have launched a peer-to-peer (P2P) cross-border remittance mechanism on June 6 to enhance convenience for travellers and businesses across both countries, the finance ministry said on Thursday.

The newly operationalised system establishes a direct link between India's Unified Payments Interface (UPI) and Nepal's National Payments Interface (NPI), and enables citizens of both nations to make real-time money transfers directly via mobile banking applications and digital wallets.

""The UPI-NPI linkage represents a major advancement in financial inclusion, fostering stronger economic and digital ties between India and Nepal. This aligns perfectly with regional goals for accessible, safe, and affordable cross-border payments, reinforcing longstanding social and economic bonds,"" the ministry said in a statement.

The technical integration was executed via collaboration between NPCI International Payments Limited (NIPL), the international arm of the National Payments Corporation of India, and the Nepal Clearing House Limited (NCHL).

""The initiative strengthens financial inclusion, boosts digital and economic integration, and enhances convenience for travellers and businesses across both countries,"" the ministry added.

The key features of the UPI-NPI remittance linkage are enhanced traveller convenience by eliminating the friction of physical currency exchange, carrying large amounts of cash, or navigating unfamiliar foreign exchange fees.

It would also give an economic boost for local merchants as Nepalese businesses gain immediate access to a massive Indian visitor demographic, driving higher transaction volumes.

UPI is now accepted in nine countries - Singapore, the United Arab Emirates, France, Mauritius, Nepal, Bhutan, Qatar, Sri Lanka and Cambodia - enabling Indian travellers to make seamless payments abroad through familiar platforms.

Comments

Published on June 11, 2026

requirejs(['jquery'], function ($) { $(""body"").removeClass('articlepaywall'); $(""body"").addClass('freeArticleTags'); });","{'https://assetsbl.thehindubusinessline.com/theme/images/bl-online/mobile-logo.svg', 'https://assetsbl.thehindubusinessline.com/theme/images/bl-online/1x1_spacer.png', 'https://sb.scorecardresearch.com/p?c1=2&c2=11398210&cs_ucfr=1&cv=4.4.0&cj=1', 'https://assetsbl.thehindubusinessline.com/theme/images/BLRX/icon/bl-home-btn.png', 'https://assetsbl.thehindubusinessline.com/theme/images/google-signin/group-12945.svg', 'https://bl-i.thgim.com/public/incoming/k5zvjg/article71089155.ece/alternates/LANDSCAPE_1200/BL20_Think_mobile_payment.jpg', 'https://www.google-analytics.com/g/collect?v=2&tid=G-Q576Y2SZ0E&cid=555&en=js_disabled', 'https://assetsbl.thehindubusinessline.com/theme/images/bl-online/logo.svg', 'https://assetsbl.thehindubusinessline.com/theme/images/google-signin/bl-online-icon.svg', 'https://assetsbl.thehindubusinessline.com/theme/images/BLRX/icon/newsletter.svg', 'https://www.thehindubusinessline.com/theme/images/th-online/1x1_spacer.png'}","वित्त मंत्रालय बृहस्पतिदिन जनौलक अछि जे भारत आ नेपाल दुनू देशक यात्री आ व्यवसायी लेल सुविधा बढेबाक लेल ६ जून सँ पीयर-टू-पीयर (पी टू पी) सीमा पार सँ प्रेषण तंत्र शुरू केलक अछि ।

नव संचालित प्रणाली भारत कें एकीकृत भुगतान इंटरफेस (यूपीआई) आ नेपाल कें राष्ट्रीय भुगतान इंटरफेस (एनपीआई) कें बीच सीधा संबंध स्थापित करयत छै, आ दूनू राष्ट्रक कें नागरिकक कें मोबाइल बैंकिंग एप्लीकेशन आ डिजिटल वॉलेट कें माध्यम सं सीधा वास्तविक समय मे मनी ट्रांसफर करय मे सक्षम बनायत छै.

मंत्रालय नँ एक बयान मँ कहलकै, ""यूपीआई-एनपीआई संबंध वित्तीय समावेश मँ एगो बड़ौ प्रगति के प्रतिनिधित्व करै छै, जेकरा सँ भारत आरू नेपाल के बीच मजबूत आर्थिक आरू डिजिटल संबंध क बढ़ावा मिलै छै। ई सुलभ, सुरक्षित, आरू सस्ती सीमा पार स॑ भुगतान लेली क्षेत्रीय लक्ष्य के साथ एकदम सही ढंग स॑ मिलै छै, जेकरा स॑ लंबा समय स॑ चलै वाला सामाजिक आरू आर्थिक बंधन क॑ मजबूत करलऽ जाय छै।""

भारतीय राष्ट्रीय भुगतान निगम केरऽ अंतर्राष्ट्रीय शाखा एनपीसीआई इंटरनेशनल पेमेंट्स लिमिटेड (एनआईपीएल) आरू नेपाल क्लियरिंग हाउस लिमिटेड (एनसीएचएल) के बीच सहयोग के माध्यम स॑ तकनीकी एकीकरण क॑ निष्पादित करलऽ गेलऽ छेलै ।

मंत्रालय नँ आरू कहलकै, “ई पहल वित्तीय समावेश क मजबूत करै छै, डिजिटल आरू आर्थिक एकीकरण क बढ़ावा दै छै, आरू दूनू देशौ मँ यात्री आरू व्यवसायी लेली सुविधा बढ़ाबै छै ।

यूपीआई-एनपीआई रेमिटंस लिंकेज कें मुख्य विशेषता भौतिक मुद्रा विनिमय कें घर्षण कें समाप्त करय, पैघ मात्रा मे नकदी ले जाय, या अपरिचित विदेशी मुद्रा शुल्क कें नेविगेट करय सं यात्रीक कें सुविधा मे वृद्धि छै.

एकरा स॑ स्थानीय व्यापारी सिनी लेली आर्थिक बढ़ावा भी मिलतै, कैन्हेंकि नेपाली व्यवसायी सिनी क॑ भारतीय आगंतुकऽ के भारी जनसांख्यिकीय तलक तत्काल पहुँच मिलतै, जेकरा स॑ लेनदेन के मात्रा बढ़ी जैतै ।

यूपीआई क॑ अब॑ नौ देशऽ म॑ स्वीकार करलऽ जाय छै - सिंगापुर, संयुक्त अरब अमीरात, फ्रांस, मारीशस, नेपाल, भूटान, कतार, श्रीलंका आरू कम्बोडिया - जेकरा स॑ भारतीय यात्री परिचित प्लेटफॉर्म के माध्यम स॑ विदेशऽ म॑ निर्बाध भुगतान करी सकै छै ।

टिप्पणी

11 जून, 2026 को प्रकाशित

requirejs (['jquery'], फ़ंक्शन ($) { $ (""शरीर"").removeClass ('लेख पेवाल'); $ (""शरीर""). addClass ('मुक्तलेखटैग'); });"
Nepal clarifies no ban on import of Indian mangoes - Agro Spectrum India,Nepal clarifies no ban on import of Indian mangoes  Agro Spectrum India,2026-06-11 12:29:59,https://news.google.com/rss/articles/CBMinAFBVV95cUxOVWNBMXVIY2ZwcHRyLUt0WFZRakh1WGUzS1FyYVdvc0wwTTFxRWpfOVNEVTdtdXpXbU82cGh5MGhFT3Q5V1dqOXRQU3VxVngwb1kyVnpwcFFSYkp4alJfalRfTE1SazBWQXJqeUJhNUdEcXRhYkRHR05WRFQ3X3lfRHN1WGFJTXE1eHBfejVoUm5Md1ZjOHlTTmZlaVY?oc=5&hl=en-US&gl=US&ceid=US:en,https://agrospectrumindia.com,Agro Spectrum India,,,
Deuba-Shekhar alliance puts NC establishment under pressure - Nepalnews.com,Deuba-Shekhar alliance puts NC establishment under pressure  Nepalnews.com,2026-06-11 12:34:44,https://news.google.com/rss/articles/CBMiowFBVV95cUxQeUMyLWNIeWR6YW1zUmFIbk9MZ1lXb1B1ZnMySEpINlFJdDFkem1KeEJIRTZYZGFSVkhPdWFFSFZvcVdMaDQ4QU1XaXA0bzJXMmRXa2pYeHlQRDBPdDZRejBiWHFmZlI1Z09mMzdLSldoSWUyVUNVbnV0cl96YlJjb2pxSVpMTmRWYl9lTDA5QzhUbS1uZUxQZVBjTWhWOW1RcjhF?oc=5&hl=en-US&gl=US&ceid=US:en,https://english.nepalnews.com,Nepalnews.com,,,
