title,description,published date,url,publisher.href,publisher.title,full_article,images,translated
"Nepal, Korea launch commemorative logo, book to mark 50 years of diplomatic relations - The Himalayan Times","Nepal, Korea launch commemorative logo, book to mark 50 years of diplomatic relations  The Himalayan Times",2024-01-30 09:20:15,https://news.google.com/rss/articles/CBMie2h0dHBzOi8vdGhlaGltYWxheWFudGltZXMuY29tL2thdGhtYW5kdS9uZXBhbC1rb3JlYS1sYXVuY2gtY29tbWVtb3JhdGl2ZS1sb2dvLWJvb2stdG8tbWFyay01MC15ZWFycy1vZi1kaXBsb21hdGljLXJlbGF0aW9uc9IBAA?oc=5&hl=en-US&gl=US&ceid=US:en,https://thehimalayantimes.com,The Himalayan Times,"KATHMANDU, JANUARY 30

The Embassy of the Republic of Korea in Nepal and Nepal unveiled a special commemorative logo and a book highlighting success stories after the EPS program marking the 50th anniversary of the diplomatic relations between the Republic of Korea and Nepal at Yak and Yeti Hotel, Kathmandu, today.

The diplomatic relations between the Republic of Korea and Nepal were established in 1974. This year – 2024, marks the 50th anniversary of the establishment of diplomatic relations between the two countries.

The commemorative logo was jointly unveiled by the high level officials of the Government of Nepal and the Ambassador of the Republic of Korea to Nepal, Park Taeyoung, during the ceremony. The logo shall be jointly used by the Embassy of the Republic of Korea and the Government of Nepal for the programs related to Korea, according to the statement issued by the South Korean Embassy.

The logo incorporates ""50 Years"" to mark the 50th anniversary with the colors and elements of the flags of both countries - Korea and Nepal. The slogan ""Everesting Friendship – Korea-Nepal 50th Anniversary"" is composed of a combination of ""Mt. Everest,"" representing Nepal, and the word ""Everlasting"" to promote the eternal friendship and partnership between the two countries, the statement added.

Moreover, the accompanying book showcases the success stories of 26 Nepali returnees who have successfully established their businesses in Nepal with the help of the skills learned from the Republic of Korea through various programs such as Employment Permit System (EPS). The book is a collection of success stories of 7 Nepali Returnees in Manufacturing sector, 6 in Agriculture sector, 8 in Service sector and 5 in Education sector. The Embassy firmly believes that this will further inspire and encourage more Nepali Returnees from the Republic of Korea, it said.

""The Republic of Korea and Nepal have established cordial relations with steady growth in exchanges of mutual cooperation in multiple areas including economy, infrastructure, development and employment since the establishment of diplomatic ties,"" Embassy said.

South Korean Ambassador Taeyoung announced that the Embassy will be organizing various programs in cultural, economic and development areas to commemorate the 50th anniversary of diplomatic ties this year in 2024. He also expressed that through the mutual cooperation programs, the close ties will be further deepened and the bilateral relation between the two countries will reach to a new height.

During the event, Chief Guest, Minister for Foreign Affairs, Narayan Prakash Saud appreciated that the two countries have been closely cooperating in various fields, including the economy, employment, education, and people-to-people exchanges since the establishment of diplomatic ties in 1974 and there shall be further cooperation between the two countries in the future.","{'https://cdn4.premiumread.com/?url=https://thehimalayantimes.com/thehimalayantimes/uploads/images/2024/01/26/29666.jpeg&w=30&q=100&f=jpg', 'https://cdn4.premiumread.com/?url=https://thehimalayantimes.com/thehimalayantimes/uploads/images/2024/01/29/29730.jpg&w=30&q=100&f=jpg', 'https://news.google.com/theme_himalayantimes/images/layout/icon_linkedin.png', 'https://news.google.com/theme_himalayantimes/images/layout/icon_telegram.png', 'https://cdn4.premiumread.com/?url=https://thehimalayantimes.com/thehimalayantimes/uploads/images/2024/01/30/29735.jpg&w=30&q=100&f=jpg', 'https://cdn4.premiumread.com/?url=https://thehimalayantimes.com/thehimalayantimes/uploads/images/2024/01/29/29731.JPG&w=30&q=100&f=jpg', 'https://cdn4.premiumread.com/?url=https://thehimalayantimes.com/thehimalayantimes/uploads/images/2023/12/20/28958.jpg&w=30&q=100&f=jpg', 'https://cdn4.premiumread.com/?url=https://thehimalayantimes.com/thehimalayantimes/uploads/images/2023/10/24/27637.jpg&w=30&q=100&f=jpg', 'https://news.google.com/theme_himalayantimes/images/layout/icon_instagram.png', 'https://news.google.com/theme_himalayantimes/images/layout/icon_viber.png', 'https://cdn4.premiumread.com/?url=https://thehimalayantimes.com/thehimalayantimes/uploads/images/2024/01/30/29753.jpg&w=30&q=100&f=jpg', 'https://cdn4.premiumread.com/?url=https://thehimalayantimes.com/thehimalayantimes/uploads/images/2024/01/30/29754.jpg&w=30&q=100&f=jpg', 'https://news.google.com/theme_himalayantimes/images/layout/icon_youtube.png', 'https://news.google.com/theme_himalayantimes/images/layout/icon_twitter.png', 'https://news.google.com/theme_himalayantimes/images/logo-100.png', 'https://news.google.com/theme_himalayantimes/images/layout/icon_messenger.png', 'https://news.google.com/theme_himalayantimes/images/layout/icon_pinterest.png', 'https://news.google.com/theme_himalayantimes/images/layout/icon_facebook.png', 'https://thehimalayantimes.com/thehimalayantimes/uploads/images/2024/01/30/29753.jpg', 'https://news.google.com/theme_himalayantimes/images/layout/icon_whatsapp.png'}","काठमांडू, 30 जनवरी नेपाल में कोरिया गणराज्य के दूतावास आ नेपाल न॑ एक विशेष स्मारक लोगो आरू एक पुस्तक के अनावरण करलकै जेकरा में ईपीएस कार्यक्रम के बाद याक आरू यति होटल में कोरिया आरू नेपाल गणराज्य आरू नेपाल के बीच कूटनीतिक संबंध के 50 वीं वर्षगांठ के चिह्नित करलऽ गेलऽ छै । , काठमाण्डू, आइ।कोरिया आरू नेपाल गणराज्य के बीच कूटनीतिक संबंध के स्थापना 1974 में करलऽ गेलऽ छेलै ।ई साल – 2024 ई दूनू देशऽ के बीच कूटनीतिक संबंध के स्थापना के 50 साल पूरा होय के मौका पर छै ।स्मारक के दौरान समारोह के दौरान नेपाल सरकार के उच्च स्तरीय अधिकारी आ कोरिया गणराज्य के राजदूत पार्क ताएयोंग के लेल स्मारक लोगो के संयुक्त रूप सं अनावरण कयल गेल छल.दक्षिण कोरिया केरऽ दूतावास द्वारा जारी बयान के अनुसार कोरिया स॑ जुड़लऽ कार्यक्रमऽ लेली कोरिया गणराज्य आरू नेपाल सरकार केरऽ दूतावास आरू नेपाल सरकार द्वारा ई लोगो केरऽ उपयोग करलऽ जैतै ।ई लोगो म॑ &quot;50 साल&quot; शामिल छै जेकरा स॑ 50 वीं वर्षगांठ के रूप म॑ दोनों देशऽ - कोरिया आरू नेपाल - कोरिया आरू नेपाल केरऽ झंडा के तत्व छै ।बयान म॑ आरू कहलऽ गेलऽ छै कि &quot;एब्सिंग फ्रेंडशिप – कोरिया-नेपाल 50 वीं वर्षगांठ&quot; स॑ &quot;मेन्ट. एवरेस्ट&quot;, आरू दूनू देशऽ के बीच शाश्वत दोस्ती आरू साझेदारी क॑ बढ़ावा दै लेली &quot;एवरलास्टिंग&quot; शब्द के संयोजन स॑ बनलऽ छै ।एतबे नै, साथ देल गेल पुस्तक म॑ 26 नेपाली रिटर्नी के सफलता के कहानी के प्रदर्शन करलऽ गेलऽ छै जे न॑ नेपाल म॑ अपनऽ व्यवसाय क॑ सफलतापूर्वक कोरिया स॑ सीखलऽ गेलऽ कौशल के मदद स॑ विभिन्न कार्यक्रम जेना कि रोजगार परमिट प्रणाली (ईपीएस) के माध्यम स॑ स्थापित करी लेल॑ छै ।ई पुस्तक विनिर्माण क्षेत्र म॑ ७ नेपाली रिटर्नी के सफलता के कहानी के संग्रह छै, ६ कृषि क्षेत्र म॑, ८ सेवा क्षेत्र म॑ आरू 5 शिक्षा क्षेत्र म॑ ।दूतावास केरऽ दृढ़ मानना ​​छै कि ई बात क॑ कोरिया गणराज्य स॑ आरू नेपाली रिटर्नी क॑ आरू प्रेरित आरू प्रोत्साहित करतै ।दूतावास नँ कहलकै कि कोरिया आरू नेपाल गणराज्य नँ कूटनीतिक संबंध के स्थापना के बाद स॑ अर्थव्यवस्था, बुनियादी ढाँचा, विकास आरू रोजगार सहित कईएक क्षेत्रऽ म॑ आपसी सहयोग के आदान-प्रदान म॑ स्थिर विकास के साथ सौहार्दपूर्ण संबंध स्थापित करलकै ।दक्षिण कोरियाई राजदूत ताएयोंग न॑ घोषणा करलकै कि दूतावास ई साल २०२४ म॑ कूटनीतिक संबंध केरऽ ५० साल पूरा होय के याद म॑ सांस्कृतिक, आर्थिक आरू विकास क्षेत्रऽ म॑ विभिन्न कार्यक्रमऽ के आयोजन करतै । आ दुनू देशक बीच द्विपक्षीय संबंध एकटा नव ऊंचाई धरि पहुँचत ।आयोजन के दौरान मुख्य अतिथि, विदेश मंत्री, नारायण प्रकाश सौद न॑ सराहना करलकै कि ई दूनू देशऽ म॑ विभिन्न क्षेत्रऽ म॑ निकटता स॑ सहयोग करी रहलऽ छै, जेकरा म॑ अर्थव्यवस्था, रोजगार, शिक्षा, आरू लोगऽ के लोगऽ के आदान-प्रदान शामिल छै, जेकरा स॑ म॑ कूटनीतिक संबंधऽ के स्थापना के बाद स॑ कूटनीतिक संबंधऽ के स्थापना करलऽ गेलऽ छै । 1974 आ भविष्य मे दुनू देशक बीच आओर सहयोग होयत।"
