title,description,published date,url,publisher.href,publisher.title,full_article,images,translated
National Women’s Cricket Team: Middle-order ‘disorder’ persists - Nepal News | Nepal's First Online News Portal,National Women’s Cricket Team: Middle-order ‘disorder’ persists  Nepal News | Nepal's First Online News Portal,2026-01-22 13:58:13,https://news.google.com/rss/articles/CBMioAFBVV95cUxPRXFxdVVVT2RnY1ZYemw3ZDI5N21EY0NaSEVTZHR4UWpESHhlekpyT1BDQUROeGFES1hYSFg5NmpoblRhNVlVWW03S04wNkxzZm5tdnZJUFFTaF85Snd5TlBrRkNkeWlFMnY3d0ZEQ1hsZ0h1YlRiYVgyZGtTU3ZNYjBnRUZaWkRqM1ZueEZBZ2ZYYlVIRmh3eDFCcWFmYWk3?oc=5&hl=en-US&gl=US&ceid=US:en,https://english.nepalnews.com,Nepal News | Nepal's First Online News Portal,,{'https://lh3.googleusercontent.com/J6_coFbogxhRI9iM864NL_liGXvsQp2AupsKei7z0cNNfDvGUmWUy20nuUhkREQyrpY4bEeIBuc=s0-w300'},
"Nepal’s top parties continue to field few women candidates, perpetuating gender imbalance - Khabarhub","Nepal’s top parties continue to field few women candidates, perpetuating gender imbalance  Khabarhub",2026-01-22 14:22:36,https://news.google.com/rss/articles/CBMiWEFVX3lxTFBjN0E1M05wb0t2NzMyemtuRzFaLVhmOHBUY0lselZtZ19VcEljeXFMUTdEU2gzc25tbHhHUzFqemlmR0NWZzFwVEItS2FqazBMX3lNRTBtbzM?oc=5&hl=en-US&gl=US&ceid=US:en,https://english.khabarhub.com,Khabarhub,,{'https://lh3.googleusercontent.com/J6_coFbogxhRI9iM864NL_liGXvsQp2AupsKei7z0cNNfDvGUmWUy20nuUhkREQyrpY4bEeIBuc=s0-w300'},
"Nepal News Evening Economic Brief – January 22, 2026 - Nepal News | Nepal's First Online News Portal","Nepal News Evening Economic Brief – January 22, 2026  Nepal News | Nepal's First Online News Portal",2026-01-22 14:58:48,https://news.google.com/rss/articles/CBMilgFBVV95cUxQaXVPU1o0dnlkLWpPTy0wU3lZNzdnSDZQRE5lYXplZUJWQlZqMmZuTTFqMUJCOVM0eTA1d0pWbF85SmxJS244VWp2RXQ5cXl3X0pESTU5VmlyQ3RhcXhwVC1oZXBFN0QyVy1oYXZfWjFubzZmLUo1cGNQblR4V2daYmVZOE56Wk5GY2kzTTZwaFEtZF9tVFE?oc=5&hl=en-US&gl=US&ceid=US:en,https://english.nepalnews.com,Nepal News | Nepal's First Online News Portal,,{'https://lh3.googleusercontent.com/J6_coFbogxhRI9iM864NL_liGXvsQp2AupsKei7z0cNNfDvGUmWUy20nuUhkREQyrpY4bEeIBuc=s0-w300'},
"Even after 123 days, probe into the two-day Gen Z revolt remains incomplete - Nepal News | Nepal's First Online News Portal","Even after 123 days, probe into the two-day Gen Z revolt remains incomplete  Nepal News | Nepal's First Online News Portal",2026-01-22 15:48:49,https://news.google.com/rss/articles/CBMitwFBVV95cUxQZWZMOGNmVFFuM2ptbjNZdVZ0bENOQmM2SHlhSFhTR1VPbzRyQWlOMXVBaS1NLUhQMkxrQjVtdDZPVkRqVF9lenptUl8yRVFiNUlFaWgwaFhaejNOcGVpR185NHBjNTUxMVdLa0dJTHB1YWxVVTM0WjBCWC1JUU54QkNpQVhiV2o0NUlHTzlUM2s4UkRRNlNxaVROQzJYNFJ1UjVER193ZmVfRUxlRkFhYzZpYWhoYUk?oc=5&hl=en-US&gl=US&ceid=US:en,https://english.nepalnews.com,Nepal News | Nepal's First Online News Portal,,{'https://lh3.googleusercontent.com/J6_coFbogxhRI9iM864NL_liGXvsQp2AupsKei7z0cNNfDvGUmWUy20nuUhkREQyrpY4bEeIBuc=s0-w300'},
Govt raises Nipah Virus alert across Nepal borders - The Himalayan Times,Govt raises Nipah Virus alert across Nepal borders  The Himalayan Times,2026-01-22 15:57:30,https://news.google.com/rss/articles/CBMikAFBVV95cUxNYmdwTndtRDVKWno0SFlPcmk4bWpTZUNhd0FITElvaXBUX1BaTXNoa0doUTAwWkRfaWZQUm5Sc2JDU2pTWmpjcVhQeHFCLVljZXJIQWZQWVF2WFNIa0dTdlFheTRnQXdxOEhGTjRwZGZwTWUzNFZGZ3F1ekZSQ1BYM3JkdjZucUZYNUVzMzBpUDXSAVxBVV95cUxQZ2tGSm5ZZC1hM2VUMmJXYjFESFhsZzJPZC1nZ29BNGJIWVRiLThwQ05mQmxlTVhsWlE2MWtDSkU5Ni1zS2pZb1I5NXF1VzAzZGlSY201d0NLY19Iaw?oc=5&hl=en-US&gl=US&ceid=US:en,https://thehimalayantimes.com,The Himalayan Times,,{'https://lh3.googleusercontent.com/J6_coFbogxhRI9iM864NL_liGXvsQp2AupsKei7z0cNNfDvGUmWUy20nuUhkREQyrpY4bEeIBuc=s0-w300'},
Council asks stakeholders to avoid participation of children in polls campaigns - Nepal News | Nepal's First Online News Portal,Council asks stakeholders to avoid participation of children in polls campaigns  Nepal News | Nepal's First Online News Portal,2026-01-22 15:58:49,https://news.google.com/rss/articles/CBMiuwFBVV95cUxQM1o4aFZLbi1LUV9iMkc1MDA3SWFhSmJKQ0NiX25yZzRwSVFCcXN0VmRnM09YOUZVdFplOF9KVHBaVXozNVlyLXZ4R2NJYjBKLWJtcTZxdE9QOHVaWGRqWWxIYmdERE1xaHhqNU9pYkczbmp5T2NyNDFxclVTcEJsdExZWEVLUGlTYTV4bEJYaUVUdTRGdlEwMUZaMk1qOWU4YnlfVTgxdm5VVFFQRkVFcElxRmlxRDliZjEw?oc=5&hl=en-US&gl=US&ceid=US:en,https://english.nepalnews.com,Nepal News | Nepal's First Online News Portal,,{'https://lh3.googleusercontent.com/J6_coFbogxhRI9iM864NL_liGXvsQp2AupsKei7z0cNNfDvGUmWUy20nuUhkREQyrpY4bEeIBuc=s0-w300'},
"Nepal News Evening Briefing | Thursday, January 22, 2026 - Nepal News | Nepal's First Online News Portal","Nepal News Evening Briefing | Thursday, January 22, 2026  Nepal News | Nepal's First Online News Portal",2026-01-22 15:59:02,https://news.google.com/rss/articles/CBMimwFBVV95cUxPdnppSTNLU1A1eDhUNVladnJJc0JQaWhBV1VIWlRkcEFkSUR5N2hPcEkxWlhzUE1qbHZKWVd4clVWTDQtNmNMaVBaT00ySExwdVpBQy0zUEFFZk1OSFM3Sy1hdGxpVlJOalpjWDdkNGN6Z01ZUWI1aHE3Z2lwVnFZYmhIQkFzVTh0SXVsX1ZFcGFvUkJfTV9FdjhEYw?oc=5&hl=en-US&gl=US&ceid=US:en,https://english.nepalnews.com,Nepal News | Nepal's First Online News Portal,,{'https://lh3.googleusercontent.com/J6_coFbogxhRI9iM864NL_liGXvsQp2AupsKei7z0cNNfDvGUmWUy20nuUhkREQyrpY4bEeIBuc=s0-w300'},
High alertness against Nipah virus - The Rising Nepal,High alertness against Nipah virus  The Rising Nepal,2026-01-22 16:00:10,https://news.google.com/rss/articles/CBMiUEFVX3lxTE5TNlF2Smx2dTEzal9NUVgzeGV0RWVVQUVURldJSUNtaWQxYXNEMXlwQ01aNU03Ry1uUTF6QjRqWHkyWjdHWnF4bER5eUVVNnc4?oc=5&hl=en-US&gl=US&ceid=US:en,https://risingnepaldaily.com,The Rising Nepal,,{'https://lh3.googleusercontent.com/J6_coFbogxhRI9iM864NL_liGXvsQp2AupsKei7z0cNNfDvGUmWUy20nuUhkREQyrpY4bEeIBuc=s0-w300'},
NC CWC to meet on Friday - Nepal News | Nepal's First Online News Portal,NC CWC to meet on Friday  Nepal News | Nepal's First Online News Portal,2026-01-22 16:18:51,https://news.google.com/rss/articles/CBMidEFVX3lxTFB5cFNqbVVmelplbVE2dmpGMDdIQW5EUE1Ra2pPVUlwcDhWZmJLcTAzOFJmLXkzbEgtVENtWmZsR2ltZjBMWjc2MnZwMDBhM1pxbjhOU0RMWWxkekwwUTJmSk1rM25aNlpvaHhSbDFZLTdvQ0l2?oc=5&hl=en-US&gl=US&ceid=US:en,https://english.nepalnews.com,Nepal News | Nepal's First Online News Portal,,{'https://lh3.googleusercontent.com/J6_coFbogxhRI9iM864NL_liGXvsQp2AupsKei7z0cNNfDvGUmWUy20nuUhkREQyrpY4bEeIBuc=s0-w300'},
Ujyalo Nepal to support Mahabir Pun in Myagdi - Khabarhub,Ujyalo Nepal to support Mahabir Pun in Myagdi  Khabarhub,2026-01-22 16:23:01,https://news.google.com/rss/articles/CBMiWEFVX3lxTE9DZU1GWmNfZUlxRFJNRFM0X0JEcklMejdWdjIwOWJiSG14LWc3Sy1PWk41d2pCbjBmRW5Lbko0akZYR2p1c1pya2MweXVjVngxcjJ2WWJWQmQ?oc=5&hl=en-US&gl=US&ceid=US:en,https://english.khabarhub.com,Khabarhub,,{'https://lh3.googleusercontent.com/J6_coFbogxhRI9iM864NL_liGXvsQp2AupsKei7z0cNNfDvGUmWUy20nuUhkREQyrpY4bEeIBuc=s0-w300'},
Campaigning starts for Bangladesh’s first national election after Hasina’s ouster - Nepal News | Nepal's First Online News Portal,Campaigning starts for Bangladesh’s first national election after Hasina’s ouster  Nepal News | Nepal's First Online News Portal,2026-01-22 16:38:54,https://news.google.com/rss/articles/CBMiwAFBVV95cUxPejNQTjdtWllLNHREOERNbHlzSy1QUXhlc2tEVmNRci1fc0Rjb0NsZzEwazhLN2N5Q2N3LWdqc1dVQ29rV2xCUzFUNDVNOF82VXNWQzdDdm1yUzJKRnk5VGs1QW5xajU2Rzc0RnRBY3BCMkdKTmNfclBOVnFkc3NtSzZXUWZlSVRsREpOV0s2b1Rzbm1aQUlRbUpaM21QUWtYNUV5Y1UyT1lOUFoyaHNuOWt4Q1VOc1JIajlJeWRYTWc?oc=5&hl=en-US&gl=US&ceid=US:en,https://english.nepalnews.com,Nepal News | Nepal's First Online News Portal,,{'https://lh3.googleusercontent.com/J6_coFbogxhRI9iM864NL_liGXvsQp2AupsKei7z0cNNfDvGUmWUy20nuUhkREQyrpY4bEeIBuc=s0-w300'},
"Dhumba Lake in Mustang, Nepal: A Serene Destination for Year-Round Visitors Amid Changing Weather Patterns - Travel And Tour World","Dhumba Lake in Mustang, Nepal: A Serene Destination for Year-Round Visitors Amid Changing Weather Patterns  Travel And Tour World",2026-01-22 16:51:19,https://news.google.com/rss/articles/CBMi6AFBVV95cUxOVG5MRUtFeU5obl9md3ZWTUNwaFJTVU8yTVUyWjJZSXhHWEpDMlJUSUtCQWNZdUFzQ0JGcjFmbV9wSC1xTk9VMFpfNlZZcElFYnBPTkYyaUt3UlBTWlNza215MHNha3ZnaGVPdi1qX1RvUGVhWnlvdTBfb25WdnlTX3V6RHFFcUpwc3laazVfTjItY2lQMURJa0NlUDVXZEJScEFSUS1oUnFWOTJsM29odEdEMUdwUV9BNlVLYWNLVHBKOWZRY1JoS1RadTY3VmdGV0VVcmY1YXNmZUlCcTZlNnZNeHp5NnV1?oc=5&hl=en-US&gl=US&ceid=US:en,https://www.travelandtourworld.com,Travel And Tour World,,{'https://lh3.googleusercontent.com/J6_coFbogxhRI9iM864NL_liGXvsQp2AupsKei7z0cNNfDvGUmWUy20nuUhkREQyrpY4bEeIBuc=s0-w300'},
Nepal woman who underwent heart transplant at Ernakulam General Hospital passes away - The Hindu,Nepal woman who underwent heart transplant at Ernakulam General Hospital passes away  The Hindu,2026-01-22 17:00:00,https://news.google.com/rss/articles/CBMivAFBVV95cUxNNzJsMG9ic1VfejNhUlVSSXBpbUw2dUZhYVI4aHRGRmQySVJYZDEwWTB6MGxTM1Y5ME1Yc3JRLW5yU056ZE9LUFVIU3E4V1lFOEFuWWduQmMzU2FPRmczbXhOdGU1MHR5OWFVSGZlQm9zWEVxS0tYRmdVbXRDeG1vMFQxYzR2TGxBNWNIcUc2cHRrQkNnZmQtUHZLMlU0cUVPRmtjcFh2VGpNNjRCNWxqci1wb21GWGhJbG4tR9IBwwFBVV95cUxQLW9HUk1XUHdnNnhsREZuQ2sxR0VEX2NrRUR4ck50bXFVaVA5bUlDbEd1eXdmdVhYOGlXYWIwdGNQQzBFRnVUcWhnN0x0SmlUN1U2OHVTSUZQLVA1SFc0X3NqQ19qc2lKQ21ZSExyR1NIUzJsd0dmeFdEWV9mMi1tOWVBa29Ed0JsYmZGYkJrWjFKWFU2OWYzc2o3bEx1WDJQU1ZfcE85amlHdGtaNGpNWGtYRGRhYnViUXVTUXZDZmJzOFk?oc=5&hl=en-US&gl=US&ceid=US:en,https://www.thehindu.com,The Hindu,,{'https://lh3.googleusercontent.com/J6_coFbogxhRI9iM864NL_liGXvsQp2AupsKei7z0cNNfDvGUmWUy20nuUhkREQyrpY4bEeIBuc=s0-w300'},
163 complaints lodged at Press Council Nepal in six months - The Rising Nepal,163 complaints lodged at Press Council Nepal in six months  The Rising Nepal,2026-01-22 19:58:22,https://news.google.com/rss/articles/CBMiUEFVX3lxTE43ZW5xbGVFSkU3YTJrTHRiR3k0eGs0SVdmZE9kaVA5dUxrUHdJTWluOEo2SHE2aW5LUlRqVmlvczFkaHEySDZVT0JwMm1lNGVB?oc=5&hl=en-US&gl=US&ceid=US:en,https://risingnepaldaily.com,The Rising Nepal,,{'https://lh3.googleusercontent.com/J6_coFbogxhRI9iM864NL_liGXvsQp2AupsKei7z0cNNfDvGUmWUy20nuUhkREQyrpY4bEeIBuc=s0-w300'},
IGP Karki directs police units to make reliable security plan for fear-free election - The Rising Nepal,IGP Karki directs police units to make reliable security plan for fear-free election  The Rising Nepal,2026-01-22 21:53:40,https://news.google.com/rss/articles/CBMiUEFVX3lxTE1ZaUVRWEMxOERISi03RmRmNWpDcnBVdkJuSXBpN1BHLTlha24tdWh1anBoRVN5c3VfUm01TjU5TDZ0amttYXMtcUwxWUhlZTUw?oc=5&hl=en-US&gl=US&ceid=US:en,https://risingnepaldaily.com,The Rising Nepal,,{'https://lh3.googleusercontent.com/J6_coFbogxhRI9iM864NL_liGXvsQp2AupsKei7z0cNNfDvGUmWUy20nuUhkREQyrpY4bEeIBuc=s0-w300'},
Nepal Election - bdtonline.com,Nepal Election  bdtonline.com,2026-01-22 22:07:48,https://news.google.com/rss/articles/CBMiqgFBVV95cUxQSnNQWm91Y1JJaWJva1hwN2dnclI1eVliU1FtR1hCWFl2X0Q1S3ZNN2ZCdzdJM28tSjJrT3lSZWhZQWt2MU5FVURqMUlQXzBKbFRhUGh4Ymo5RURjMjdkX2xlZndReHkwRDF6aEdSQXlha2JicVVTOGNuY0h2UllQUl9MYzVZUFg4ejkxTDhNYlNVanRoWWNKaG1mOVlmb0FJX281aThPUXM5UQ?oc=5&hl=en-US&gl=US&ceid=US:en,https://www.bdtonline.com,bdtonline.com,,{'https://lh3.googleusercontent.com/J6_coFbogxhRI9iM864NL_liGXvsQp2AupsKei7z0cNNfDvGUmWUy20nuUhkREQyrpY4bEeIBuc=s0-w300'},
"Air pollution clouds health, tourism, and economy in Nepal - kathmandupost.com","Air pollution clouds health, tourism, and economy in Nepal  kathmandupost.com",2026-01-23 00:52:56,https://news.google.com/rss/articles/CBMioAFBVV95cUxNbHZuNkdGeHlweHZEN0FqT0ZFVWxZUEhvTENFT25qLVM1cU4xLVFzWEU0akp1ZGdSNzJ6dmNLUDl6QmVERGZ0ZEUxR2p2MEJNMmlfMUJxUUNoZ1l6YWxuUU9TMWhHQjlvM21pNktpS3VyczJDUHFyRUotSjVwZEdHN1VJaS1kczY3OWFhVUVEYnJlZUVXZGw5cHhiTDN2YURB?oc=5&hl=en-US&gl=US&ceid=US:en,https://kathmandupost.com,kathmandupost.com,,{'https://lh3.googleusercontent.com/J6_coFbogxhRI9iM864NL_liGXvsQp2AupsKei7z0cNNfDvGUmWUy20nuUhkREQyrpY4bEeIBuc=s0-w300'},
Nepali Congress set to declare Thapa as prime ministerial candidate - kathmandupost.com,Nepali Congress set to declare Thapa as prime ministerial candidate  kathmandupost.com,2026-01-23 01:07:48,https://news.google.com/rss/articles/CBMiswFBVV95cUxNcElVZlFKZThhRG9mdWE5NVJCVndKR1Z2cUdxaVFFOGNxaFhtcFhJM2tCS3FwbGJKN2lIODlta3daaVZpUnNuNkQtaC1tb05QUjhiUGtPNWpWaXgxdC1PZ0d5clEzcGJIZUt2TTBkUFRGUFRlakxqMlJOYV9xUUZ3RFZTanM5MUtVcVh0dHBzaVhvbHJkS2FoRlFpNnhFQjFibERWYk5sOVlJLTkxaUZobnQ4Zw?oc=5&hl=en-US&gl=US&ceid=US:en,https://kathmandupost.com,kathmandupost.com,,{'https://lh3.googleusercontent.com/J6_coFbogxhRI9iM864NL_liGXvsQp2AupsKei7z0cNNfDvGUmWUy20nuUhkREQyrpY4bEeIBuc=s0-w300'},
Nepal suffer second straight defeat at Women’s T20 World Cup Qualifier - kathmandupost.com,Nepal suffer second straight defeat at Women’s T20 World Cup Qualifier  kathmandupost.com,2026-01-23 01:18:24,https://news.google.com/rss/articles/CBMitgFBVV95cUxPTjVVN1dEcHVEN0JFRGdfZ1daNVdzdHByUDRONERhSFFNeU9MRkM2a1Y4MVBJUmY5Y2MzLVVxMUUwZVVjeEJ2aF9LUDY5dkFRRkNESUQ0RW1Xd3pyVHRvcC0wVDVEelFfb2xYNjJEcXQtSWFpWnBfWXBlUHVSM2NJZkhpNnJBNzgybWt1TE9hUG1RVEQwaUpVbHFXYVBteXZTUUtOb2g1VUlhNlJxeXRwTnZ4d3h5Zw?oc=5&hl=en-US&gl=US&ceid=US:en,https://kathmandupost.com,kathmandupost.com,,{'https://lh3.googleusercontent.com/J6_coFbogxhRI9iM864NL_liGXvsQp2AupsKei7z0cNNfDvGUmWUy20nuUhkREQyrpY4bEeIBuc=s0-w300'},
"Nepal and China agree to expedite projects, boost border trade - kathmandupost.com","Nepal and China agree to expedite projects, boost border trade  kathmandupost.com",2026-01-23 01:37:39,https://news.google.com/rss/articles/CBMiqwFBVV95cUxOcWlCNkgxM19yNFluc0pkR2g2SFNscmRhbldsWHJMMGpNX3p6dy1CSHNCYlFYVmdTeVB0WHVSekJRbklOMG03VjVhU0FOVkpadkRZQlZxX2N0SVVSN3NGUW03eV9pY1VWNnBJSVNUY3R0SmZnZzBnekdaOHlEWHlXdE1fWUgzTHR4RmpKWnBQZGxXM1JudHhQZ0hYdGRuQjBTV0dxUi1CVkwyejA?oc=5&hl=en-US&gl=US&ceid=US:en,https://kathmandupost.com,kathmandupost.com,,{'https://lh3.googleusercontent.com/J6_coFbogxhRI9iM864NL_liGXvsQp2AupsKei7z0cNNfDvGUmWUy20nuUhkREQyrpY4bEeIBuc=s0-w300'},
