title,description,published date,url,publisher.href,publisher.title,full_article,images,translated
Govt does not hassle businesspersons: RSP Chair Lamichhane - The Himalayan Times,Govt does not hassle businesspersons: RSP Chair Lamichhane  The Himalayan Times,2026-05-03 11:15:00,https://news.google.com/rss/articles/CBMinAFBVV95cUxPTGpZeDVQcmpSSEpxLUtwcXVqNlJfTUhGbGNFTWYxRGt1LTlTaEZrNVpoY0FwNnozdUcwck1zeW52NEdGWGc2UlBxMXlIcG9ycHdwX29MbmV6Um5QQklCLW96T2VpVVJUS1QxMzhhalkwUE9Jekg1QnZvNmEteEEyMEtpbmwxY0YtazE1ZXAxWTJaRW9PR09pdzJGU0jSAVxBVV95cUxNT01jQTl1LXBDYnFiRnQ0OV9wV1haaklIZkp4YXNrVk8yM1llSTRqcE9mVFZHT1poZENjRW1udndjZWtqMmxEY0d3M0JyWDE1cGFYRmpXX0Z6eG9fYw?oc=5&hl=en-US&gl=US&ceid=US:en,https://thehimalayantimes.com,The Himalayan Times,"KATHMANDU, MAY 3

Chairperson of the Rastriya Swatantra Party (RSP), Rabi Lamichhane, has told the industrialists and businesspersons that there was no point in getting harassed and panicked while involving in fair business.

Related Articles We will pay back voters by fulfilling our responsibility: RSP President Lamichhane RSP President Lamichhane, LSP Chair Thakur meet

At a discussion with representatives of private entities including the Federation of Nepalese Chambers of Commerce and Industry (FNCCI), Confederation of Nepalese Industries (CNI), Nepal Chamber of Commerce (NCC) in the federal capital today, Lamichhane urged them not to cast doubt on activities of RSP and the government it has led.

However, he made it clear that government had to emerge tough against the businesspersons and elements who have held hostage of national economy.

googletag.cmd.push(function() { googletag.display('div-gpt-ad-1686127029429-0'); }); googletag.cmd.push(function() { googletag.display('div-gpt-ad-1686127067910-0'); }); googletag.cmd.push(function() { googletag.display('div-gpt-ad-1686127112906-0'); });

According to him, private sector's problems should be addressed for the development of real economy. RSP has already set a 'roadmap' for it, he reminded, urging industrialists and businessperson not to visit any leaders' homes and party offices with complaints.

""You may have witnessed different scenario in the past and even involved in it, but this government wants to make ensure change in a different manner,"" he said.

During the meeting, FNCCI President Chandra Dhakal sought government assistance for private sector to run business in peaceful setting. ""Private sector is under attack in every movement. We want such attacks stopped,"" he said.

CNI President Birendra Raj Pandey mentioned urgency of encouragement to the private sector at a time when the capital formation is declining.

Similarly, Deepak Malhotra said he had expected much from the RSP government in development and economic reform.","{'https://thehimalayantimes.com/theme_himalayantimes/images/layout/icon_whatsapp.png', 'https://cdnx.premiumread.com/?url=https://thehimalayantimes.com/thehimalayantimes/uploads/images/2026/05/03/48071.jpg&w=30&q=100&f=webp', 'https://thehimalayantimes.com/theme_himalayantimes/images/layout/icon_instagram.png', 'https://cdnx.premiumread.com/?url=https://thehimalayantimes.com/thehimalayantimes/uploads/images/2026/03/31/47203.jpg&w=30&q=100&f=webp', 'https://thehimalayantimes.com/theme_himalayantimes/images/layout/icon_facebook.png', 'https://thehimalayantimes.com/theme_himalayantimes/images/layout/icon_pinterest.png', 'https://thehimalayantimes.com/theme_himalayantimes/images/logo-100.png', 'https://thehimalayantimes.com/theme_himalayantimes/images/layout/icon_linkedin.png', 'https://thehimalayantimes.com/thehimalayantimes/uploads/images/2026/05/03/48084.jpg', 'https://cdnx.premiumread.com/?url=https://thehimalayantimes.com/thehimalayantimes/uploads/images/2026/05/03/48084.jpg&w=30&q=100&f=webp', 'https://cdnx.premiumread.com/?url=https://thehimalayantimes.com/thehimalayantimes/uploads/images/2026/05/03/48051.jpeg&w=30&q=100&f=webp', 'https://thehimalayantimes.com/theme_himalayantimes/images/layout/icon_messenger.png', 'https://cdnx.premiumread.com/?url=https://thehimalayantimes.com/thehimalayantimes/uploads/images/2026/05/03/48057.jpg&w=30&q=100&f=webp', 'https://thehimalayantimes.com/theme_himalayantimes/images/layout/icon_telegram.png', 'https://thehimalayantimes.com/theme_himalayantimes/images/layout/icon_youtube.png', 'https://cdnx.premiumread.com/?url=https://thehimalayantimes.com/thehimalayantimes/uploads/images/2026/05/03/48056.jpg&w=30&q=100&f=webp', 'https://cdnx.premiumread.com/?url=https://thehimalayantimes.com/thehimalayantimes/uploads/images/2026/04/02/47287.jpg&w=30&q=100&f=webp', 'https://thehimalayantimes.com/theme_himalayantimes/images/layout/icon_viber.png', 'https://thehimalayantimes.com/theme_himalayantimes/images/layout/icon_x.png'}","काठमाण्डू, 3 मई

राष्ट्रीय स्वतंत्र पार्टी के अध्यक्ष रबी लामिछाने उद्योगपति आ व्यवसायी सब के कहलखिन्ह जे निष्पक्ष कारोबार मे लागल रहैत परेशान आ घबराहट के कोनो फायदा नहि छल.

संबंधित लेख हम अपनी जिम्मेदारी निभाकर मतदाताओं को वापस कर देंगे : रासपा अध्यक्ष लामिछाने रासपा अध्यक्ष लामिछाने, लोसपा अध्यक्ष ठाकुर की बैठक

संघीय राजधानीमे आइ नेपाली उद्योग महासंघ (एफएनसीसीआई), नेपाली उद्योग महासंघ (सीएनआई), नेपाल वाणिज्य संघ (एनसीसी) सहित निजी संस्थाक प्रतिनिधिसभक संग भेल चर्चामे लामिछाने आरएसपी आ ओकर नेतृत्वमे केने सरकारके गतिविधि पर संदेह नहि करबाक आग्रह कएलनि ।

लेकिन हुनी साफ करलकै कि सरकार क॑ राष्ट्रीय अर्थव्यवस्था क॑ बंधक बनाबै वाला व्यापारी आरू तत्वऽ के खिलाफ कड़ा उभरना छै ।

गूगलटैग.सीएमडी.पुश (फंक्शन () { गूगलटैग.प्रदर्शन ('डिव-जीपीटी-विज्ञापन-1686127029429-0'); }); गूगलटैग.सीएमडी.पुश (फंक्शन () { गूगलटैग.प्रदर्शन ('डिव-जीपीटी-विज्ञापन-1686127067910-0'); }); गूगलटैग.सीएमडी.पुश (फंक्शन () { गूगलटैग.प्रदर्शन ('डिव-जीपीटी-विज्ञापन-1686127112906-0'); });

हुनकऽ अनुसार वास्तविक अर्थव्यवस्था के विकास लेली निजी क्षेत्र के समस्या के समाधान करलऽ जाय । आरएसपी एकरा लेल ‘रोडमैप’ तय क’ चुकल अछि, उद्योगपति आ व्यवसायी स आग्रह केलथि जे कोनो नेता क घर आ पार्टी कार्यालय मे शिकायत ल कए नहि जाथि।

ओ कहला जे अहां पहिने सेहो अलग-अलग परिदृश्य देखलहुं होएत आओर एहि मे सेहो शामिल भ गेल होयब, मुदा इ सरकार अलग तरीका स बदलाव सुनिश्चित करय चाहैत अछि।

बैठक के दौरान एफएनसीसीआई के अध्यक्ष चंद्र ढकाल निजी क्षेत्र के शांतिपूर्ण परिवेश मे कारोबार चलाबय लेल सरकारी सहयोग मंगलखिन्ह. ओ कहलनि जे, हर आंदोलन मे निजी क्षेत्र पर हमला भ रहल अछि, हम चाहैत छी जे एहन हमला बंद भ जाय।

सीएनआई अध्यक्ष बीरेन्द्र राज पाण्डेय एहि समय मे निजी क्षेत्र कए प्रोत्साहन देबाक तात्कालिकता क जिक्र केलथि, जखन कि पूंजी निर्माण मे गिरावट आबि रहल अछि।

तहिना दीपक मल्होत्रा ​​कहलनि जे, विकास आ आर्थिक सुधार मे आरएसपी सरकार स बहुत उम्मीद छल।"
CPN-Maoist led by Chand protests against eviction of squatter settlements [Photo Feature] - Nepalnews.com,CPN-Maoist led by Chand protests against eviction of squatter settlements [Photo Feature]  Nepalnews.com,2026-05-03 11:22:58,https://news.google.com/rss/articles/CBMixwFBVV95cUxObThSQ3E3dDNPazVVVXZ0ZUdySU80dnFtTTVYQno0TlIzSFdsQWZtMDRmVnQ5UGlydWlUWFozLXNqV3hXOGRKbFYyVURGMlozaXJjSEFmRFpoejAtZGhPeDY1OUJWYy1BNFpYN25VZDl1NUNJMjNVNmRiaWxoemRlS2k4TWtoY1hRRk5LRF9RUjJkNi1mUWZVVzlPcW1IYjZyeDhRV1JXdThuWVNUT01OUzFSTWtVeGFQUVFUa3JfQjhKY3VqV0hn?oc=5&hl=en-US&gl=US&ceid=US:en,https://english.nepalnews.com,Nepalnews.com,,,
9 killed in Delhi house fire after air-conditioner blast - Nepalnews.com,9 killed in Delhi house fire after air-conditioner blast  Nepalnews.com,2026-05-03 11:37:58,https://news.google.com/rss/articles/CBMiogFBVV95cUxQUEYxRkpRNmd1MnJJX2RwZ24yckdqbnUwcUNJR3FVS2hlSHY1S29MOGxGSDladWx4eG80Uk51c0tqSHRMRzFGYnZRNlE0NVNFeUZuVDhzVHlBQWI4MV9URlBvckNmUDJzT0c2SU1SWkhTQXJVZHVjcURvN2gyMXNTcmxQTkMyRzd0SFJESU1RdlFoR08xU2dqZF9mTktPb1Y0MVE?oc=5&hl=en-US&gl=US&ceid=US:en,https://english.nepalnews.com,Nepalnews.com,,,
Nepal lets Rs 20 billion in sal timber rot in forests every year - Nepalnews.com,Nepal lets Rs 20 billion in sal timber rot in forests every year  Nepalnews.com,2026-05-03 11:57:59,https://news.google.com/rss/articles/CBMiqgFBVV95cUxNRnJIeVl1eVJsSThtXzhFZWlSVzRiYWFaMTZROTBhdUpCa1lNdWpreHdKZU5OTEJ4VGl6bTdxMEkyb0xMLWdfeU5rNzlFa1VOT0NmX3hnSlZzaFBja2lQRGdqeHpWS2lWWlFIQm4zeG5tVmNub3JjOU5ZOFNLNHNKWURDY2I3Nm9LQTNJb2docEJ1UV9ZbTlmSERJN0RrOHpuWUVHTDJDbngxUQ?oc=5&hl=en-US&gl=US&ceid=US:en,https://english.nepalnews.com,Nepalnews.com,,,
Ministry urges individuals in need of relocation to visit Dasharath Stadium - Nepalnews.com,Ministry urges individuals in need of relocation to visit Dasharath Stadium  Nepalnews.com,2026-05-03 12:00:00,https://news.google.com/rss/articles/CBMitgFBVV95cUxPYUk5anpEeTBCLUJ1NnJ2M3hXbElJSmhHMTNPNmxKekVNSVhvOFBsN2d2SzNxR3dKYmpuU0ROMU41Z3hLV1pyd3dEUHVyNlRDcmdYUXBkdUhyN2JLaVpxZ2tDUjFjazJuOWdsLUl0d1B0X0JYdVBJU3BpTlpQZ0J5YlhSUXpGdlhYOVplQ1lsVnpMSXNHZzNXTFRkU01NY1pyeWRKT2RkR3h4c05ja3NETnl3WXRPdw?oc=5&hl=en-US&gl=US&ceid=US:en,https://english.nepalnews.com,Nepalnews.com,,,
President authenticates ordinance amending Nepal Acts - Khabarhub,President authenticates ordinance amending Nepal Acts  Khabarhub,2026-05-03 12:09:10,https://news.google.com/rss/articles/CBMiWEFVX3lxTE1GRWVTQUxpZXUxSzcycDRlSGlJYjFMV2hPdDljVXhIQjhiZGtjc3BZazhzb19fYk1VZHlYLWxVTFJhTjZaUTFjajcweHYyU1V2b0hYSmp3eTY?oc=5&hl=en-US&gl=US&ceid=US:en,https://english.khabarhub.com,Khabarhub,"KATHMANDU: President Ramchandra Paudel has authenticated an ordinance to amend various Nepal Acts.

The ordinance titled “Some Nepal Acts Amendment Ordinance, 2083” was issued on the recommendation of the Council of Ministers in accordance with Article 114 (1) of the Constitution.

According to a statement issued by the Office of the President, spokesperson Ritesh Kumar Shakya said the ordinance has come into effect from Sunday.

The President’s Office stated that the ordinance was introduced as per constitutional provisions to amend necessary legal arrangements.","{'https://english.khabarhub.com/wp-content/themes/Khabarhubenglish/img/icons/appstore.svg', 'https://english.khabarhub.com/wp-content/themes/Khabarhubenglish/img/icons/playstore.svg', 'https://english.khabarhub.com/wp-content/themes/Khabarhubenglish/img/icons/linked-in.svg', 'https://english.khabarhub.com/wp-content/themes/Khabarhubenglish/img/icons/viber.svg', 'https://english.khabarhub.com/wp-content/themes/Khabarhubenglish/img/icons/youtube.svg', 'https://english.khabarhub.com/wp-content/uploads/2019/01/logo-300x300-1-150x150.png', 'https://english.khabarhub.com/wp-content/uploads/2026/04/Rabi-Lamichhane-150x100.jpg', 'https://english.khabarhub.com/wp-content/uploads/2026/05/Ramchandra-paudel-11-1.jpg', 'https://english.khabarhub.com/wp-content/themes/Khabarhubenglish/img/logos.png', 'https://english.khabarhub.com/wp-content/uploads/2026/05/Pushpa-Kamal-Dahal-Prachanda-150x100.jpg', 'https://english.khabarhub.com/wp-content/uploads/2026/05/Ramchandra-paudel-11-1-150x100.jpg', 'https://english.khabarhub.com/wp-content/themes/Khabarhubenglish/img/logo-white-sm.png', 'data:image/gif;base64,R0lGODdhAQABAPAAAMPDwwAAACwAAAAAAQABAAACAkQBADs=', 'https://english.khabarhub.com/wp-content/themes/Khabarhubenglish/img/icons/instagram.svg'}","काठमाण्डु, मिथिला मिरर: राष्ट्रपति रामचन्द्र पौडेल नेपालक विभिन्न अधिनियम मे संशोधन करबाक अध्यादेश केँ प्रमाणित कयलनि अछि।

“किछु नेपाल अधिनियम संशोधन अध्यादेश, २०८३” शीर्षक अध्यादेश संविधानक अनुच्छेद ११४ (१) के अनुसार मन्त्री परिषद् के अनुशंसा पर जारी कएल गेल अछि ।

राष्ट्रपति कार्यालय द्वारा जारी विज्ञप्ति के अनुसार प्रवक्ता रितेश कुमार शाक्य रविदिन सँ अध्यादेश लागू भेल बतौलनि अछि ।

राष्ट्रपति कार्यालय के अनुसार आवश्यक कानूनी व्यवस्था में संशोधन के लेल संवैधानिक प्रावधान के अनुसार अध्यादेश के शुरूआत कायल गेल अछि ।"
"Centuries-Old Buddha Idol Stolen in 1980s Returned to Nepal Temple from New York - The Sentinel - of this Land, for its People","Centuries-Old Buddha Idol Stolen in 1980s Returned to Nepal Temple from New York  The Sentinel - of this Land, for its People",2026-05-03 12:09:42,https://news.google.com/rss/articles/CBMizwFBVV95cUxNMl9oZVpiUnVBSE5CTktJbkRJcjFUUGxaZ1FwbDFkdktTR25hbUhkWUFMdVlNVXcwREE4cnQtYU9yRDUtNFg4Tlo4bWtXM0RfczlqUjJpNXBkWXN3dFhTaTZXWUlrQnFjbmhtM2FiZXpNb2QzUlRsNFFNZHdEMzhvaGszQi1zY2tNUWEzdWljSGFXZ3RrUVhwcFozWFIwVHlrUDJsZkgzUG1GOFozWVNuNklCOEdkQV9EX3k1QjhFOGlVSnpUOWlBZW4wV2VBZ2fSAdwBQVVfeXFMTllZVk05V0c0VkdPOTVVZFlQV0Jab3U0N0NiNUJhM3JPQmNsbEw3UXZsQXhWR0xhdXBMLVZ5amxkeVNVamFoNUtiOEFNdDROMlBMODFZZllZUlVBMFA5dVZkNWViVWUwa05ERXlKa2taLXYweFE4NDJuZHVCVEZZRmVyUFAyejFiZXppREFuLVJxem9Yc0hMaDRrcGlONjlKSGtOWDNZU2U0bmlRbEhIdHc1VjJjeFZtSFI0UmNEdmZpdWNqS2I2dG9vQW1SN1U2ZGI5VDJLUFNoQ3BBWg?oc=5&hl=en-US&gl=US&ceid=US:en,https://www.sentinelassam.com,"The Sentinel - of this Land, for its People","NEW YORK: A Buddha statue that had been stolen from a temple in Nepal centuries ago has now been returned to its original home, marking another successful repatriation of cultural artefacts from overseas collections. The 13th-century statue was ceremonially brought back to its pagoda-style temple in Kathmandu on Friday, carried in a palanquin amid traditional music and celebrations. “I feel incredibly happy—everyone does. Our deity is finally coming home,” said 67-year-old temple visitor Sunkesari Shakya, who remembered the distress caused when the statue was taken, describing the incident as “devastating” for the local community. The statue had been stolen during the 1980s before eventually surfacing at Tibet House US, a cultural institution based in New York. According to Nepal’s Department of Archaeology, it had been donated there by an unidentified monk. (Agencies)

Also Read: PM Modi Hails Leh Exposition of Buddha Relics, Says Event to Draw Pilgrims and Tourists Across Ladakh","{'https://media.assettype.com/sentinelassam-english%2F2026-05-03%2F7fcl3k8w%2Fbbb.jpg?w=1200&ar=40%3A21&auto=format%2Ccompress&ogImage=true&mode=crop&enlarge=true&overlay=false&overlay_position=bottom&overlay_width=100', 'data:image/gif;base64,R0lGODlhAQABAAD/ACwAAAAAAQABAAACADs=', 'https://media.assettype.com/sentinelassam-english%2F2026-05-03%2F7fcl3k8w%2Fbbb.jpg?w=480&auto=format%2Ccompress&fit=max'}","न्यूयार्क : नेपाल केरऽ एगो मंदिर स॑ सदियो पहलें चोरी होय गेलऽ बुद्ध केरऽ मूर्ति क॑ अब॑ ओकरऽ मूल घर म॑ वापस करी देलऽ गेलऽ छै, जेकरा स॑ विदेशऽ के संग्रह स॑ मिललऽ सांस्कृतिक कलाकृति केरऽ एगो आरू सफल वापसी के निशानी छै । 13वीं सदी के ई मूर्ति क॑ शुक्रवार क॑ विधिवत रूप स॑ काठमांडू स्थित अपनऽ पैगोडा शैली के मंदिर म॑ वापस लानलऽ गेलै, जेकरा पारंपरिक संगीत आरू उत्सव के बीच पालकी म॑ ल॑ जायलऽ गेलै । मूर्ति लेला के समय भेल संकट के याद करय वाला 67 वर्षीय मंदिर के आगंतुक सुनकेसरी शाक्य कहलनि जे, हमरा अविश्वसनीय रूप सं खुशी महसूस होइत अछि-सब के अछि, हमर देवता आखिरकार घर आबि रहल छथि। ई मूर्ति 1980 के दशक के दौरान चोरी होय गेलऽ छेलै आरू अंततः न्यूयॉर्क स्थित सांस्कृतिक संस्थान तिब्बत हाउस यूएस में सामने ऐलै । नेपाल के पुरातत्व विभाग के अनुसार ओतय एकटा अज्ञात भिक्षु द्वारा दान कयल गेल छल | (एजेन्सी) २.

इहो पढ़ू : पीएम मोदी बुद्ध अवशेष के लेह प्रदर्शनी के प्रशंसा केलनि, लद्दाख भरि तीर्थयात्री आ पर्यटक के आकर्षित करय वाला आयोजन के कहलनि"
