title,description,published date,url,publisher.href,publisher.title,full_article,images,translated
Scotland v Nepal | Feel The Thrill | T20WC 2026 - ICC,Scotland v Nepal | Feel The Thrill | T20WC 2026  ICC,2026-02-16 18:56:02,https://news.google.com/rss/articles/CBMitAFBVV95cUxPdGVQcXNhNUV4NlVZRWxfbVRadkRpQmkzZzdqVFotRUdnTXhlZmo3ZHQ0aWZvQWpTNmNIcFJsdS1GQnlaMlRTRk9MT1JFRFczT1c3cGdKdEt0V3lIOUNqN1RZRFhxY3g4cXZNdVk4S05nTVBQVmVYVkVNRE5KZWFnZUpxWXVHV0toLTBOZXBZWXZFYUNKZ2RPNzVJTlZ1QkFZTjVfcFhpd0xDR3UwVzQ4X0dWamg?oc=5&hl=en-US&gl=US&ceid=US:en,https://www.icc-cricket.com,ICC,"Match Highlights Aramco POTM Highlights Player Highlights Feel The Thrill Previews Warm-Up Highlights Latest Videos

{""@context"":""https://schema.org"",""@type"":""VideoObject"",""name"":""Scotland v Nepal | Feel The Thrill | T20WC 2026"",""thumbnailUrl"":""https://images.icc-cricket.com/image/upload/t_ratio1_1-size20/prd/wyp9tohzy2rwqwh6lfqo"",""uploadDate"":""2026-02-16T18:56:02.732Z"",""description"":""Playing for the badge. Playing for pride.



Nepal and Scotland lock horns in their final appearance of the ICC Men's T20 World Cup 2026."",""duration"":""PT1M27S"",""embedUrl"":""https://www.icc-cricket.com/tournaments/mens-t20-world-cup-2026/videos/scotland-v-nepal-feel-the-thrill-t20wc-2026"",""contentUrl"":""https://vod-i-01-icc-we.akamaized.net/Content/HLSv4/VOD/12429/15091/11ef0655-bc15-46bc-bb36-489cb90e5d21/bc57f716-2de1-5767-3056-8fa378c33d7c/master.m3u8?hdnts=st%3D1771300205~exp%3D4924900205~acl%3D%2F*~hmac%3D6ea469292afcae3b9ecd2b85a9c578eec8f7798de2d2346993ac1d9624146de2""}","{'https://images.icc-cricket.com/image/private/t_q-best/v1761236552/prd/assets/tournaments/mens-t20-world-cup-2026/newwww-mt20wc-2026-top-right.svg', 'https://images.icc-cricket.com/image/private/t_q-best/v1761065042/prd/assets/tournaments/mens-t20-world-cup-2026/alternate-small-m-t20wc-2026-logo.svg', 'https://images.icc-cricket.com/image/private/s--fzcZfncW--/v1758003928/prd/assets/app-nav-dropdown/wtc-icon.png', 'https://images.icc-cricket.com/image/private/s--NSrt8OYQ--/v1763555244/prd/assets/app-nav-dropdown/app-womens-emerging-event-dropdown.svg', 'https://www.icc-cricket.com/favicon.ico', 'https://images.icc-cricket.com/image/private/s--KIeQ_mG4--/v1758004253/prd/assets/app-nav-dropdown/w-cwc-2025-icon.png', 'https://images.icc-cricket.com/image/private/s--6SstyD6r--/v1758004346/prd/assets/app-nav-dropdown/champs-2025-icon.png', 'https://images.icc-cricket.com/image/private/s--8GRWH3nd--/v1758004901/prd/assets/app-nav-dropdown/u19-w-t20wc-2025.png', 'https://images.icc-cricket.com/image/private/s--tk0Z8S-s--/v1758004667/prd/assets/app-nav-dropdown/w-t20wc-2026-icon.png', 'https://images.icc-cricket.com/image/upload/t_ratio16_9-size20-webp/prd/wyp9tohzy2rwqwh6lfqo', 'https://images.icc-cricket.com/image/private/s--ftYEli3s--/v1758103166/prd/assets/app-nav-dropdown/mens-cwc-2023-icon.png', 'https://images.icc-cricket.com/image/private/s--ceTYWUWH--/v1765887122/prd/assets/app-nav-dropdown/u19-cwc-2026-events-dropdown.png', 'https://images.icc-cricket.com/image/private/s--90zFOyUh--/v1761395835/prd/assets/tournaments/mens-t20-world-cup-2026/m-t20-2026-icon.svg', 'https://images.icc-cricket.com/image/private/s--XXucTS2y--/v1758005874/prd/assets/app-nav-dropdown/w-champs-icon.png', 'https://images.icc-cricket.com/image/private/t_q-best/v1761236746/prd/assets/tournaments/mens-t20-world-cup-2026/newwwwwww-mt20wc-2026-top-left.svg'}","मैच हाइलाइट Aramco POTM हाइलाइट खिलाड़ी हाइलाइट रोमांच महसूस करू पूर्वावलोकन वार्म-अप हाइलाइट नवीनतम वीडियो

{""@context"":""https://schema.org"",""@type"":""VideoObject"",""name"":""स्कॉटलैंड बनाम नेपाल | रोमांच महसूस | T20WC 2026"",""thumbnailUrl"":""https://images.icc-cricket.com/image/upload/t_ratio1_1-size20/prd/wyp9tohzy2rwqwh6lfqo"",""अपलोडतिथि"":""2026-02-16T18:56:02.732Z"",""विवरण"":""के लेल खेलाइत अछि बिल्ला के। घमंड के लिये खेलते हुए।



आईसीसी पुरुष टी-२० विश्वकपमे नेपाल आ स्कॉट्लैण्डमे अपन अंतिम उपस्थितिमे हॉर्न बनि गेल अछि 2026."",""अवधि"":""PT1M27S"",""embedUrl"":""https://www.icc-cricket.com/टूर्नामेंट्स/mens-t20-world-cup-2026/videos/ स्कॉटलैंड-वी-नेपाल-फेल-द-थ्रिल-t20wc-2026"",""contentUrl"":""https://vod-i-01-icc-we.akamaized.net/सामग्री/HLSv4/V ओडी/12429/15091/11ef0655-bc15-46bc-bb36-489cb90e5d21/bc57f716-2de1-5767-3056-8fa378c33d7c/मास्टर.m3u8?hdnts=st%3D 1771300205 ~ expp% 3D4924900205 ~ acl% 3D% 2F * ~ hmac% 3D6ea469292afcae3b9ecd2b85a9c578eec8f7798de2d2346993ac1d9624146de2""}"
"New Everest Regulations: You Must Climb a 7,000m Peak in Nepal First - Explorersweb »","New Everest Regulations: You Must Climb a 7,000m Peak in Nepal First  Explorersweb »",2026-02-16 20:38:41,https://news.google.com/rss/articles/CBMilwFBVV95cUxPUngxbWJ6UjJnQnYwUXM0MndxWGYyZnVCY3I0ZnNCa0FpNkVjRW1ZTnlSWmdTVG9HaEM5QTc1eVpiYlJvdThjYm0yNG1VVFhvb19kaVlWZXM3WUVMeWdpM1I5UXJRWkVYRjA3NmRxQ1RDd0xQMldQOVB4YXNlenhaa1BHbzJOcWZQVmc5TVUtbGhqT1pqNHNn?oc=5&hl=en-US&gl=US&ceid=US:en,https://explorersweb.com,Explorersweb »,"A new Tourism Bill passed Nepal’s National Assembly last week. It will require climbers to have previously climbed a 7,000’er in Nepal before tackling Everest. In part, the move will prevent inexperienced or unfit climbers on the mountain, but it also boosts the country’s thriving expedition business.

Every year, new regulations are proposed for trekking and mountaineering in Nepal. We then wait to see which ones are actually implemented, and how. The difference this time is that the Everest rules are on the verge of becoming national law. This differs significantly from the regulations of the Department of Tourism or regional authorities.

The Nepali side of Everest Base Camp in 2025. Photo: Furtenbach Adventures

This Integrated Tourism Bill contains numerous rules and requirements for high-altitude climbers, especially Everest clients. Everest is by far the largest source of revenue for the expedition industry. The measures will reportedly enhance safety and protect the environment, though they will mean foreign clients will pay more. The bill passed unanimously.

7,000m before Everest

The most notable regulation regards previous climbing experience for Everest climbers. Every would-be Everest summiter must have climbed a 7,000m peak in Nepal.

File image of climbers on Baruntse’s upper slopes. Photo: Asian Trekking

“Officials say this provision is intended to curb the growing number of inexperienced climbers attempting the world’s highest peak, a trend often blamed for congestion, accidents, and strain on rescue services,” local media reported. It also explains the recent trend among Nepalese outfitters to offer expeditions to the country’s 7,000’ers, such as Himlung and Baruntse.

Climbing royalties for foreign climbers (in US dollars) in Nepal, updated to 2026. Source: Nepal’s Department of Tourism

There are 86 peaks (including sub-peaks) between 7,000m and 7,999m in Nepal, and the royalties for foreigners to climb them in spring range from $500 to $800, depending on the altitude. Prices drop 50% in the fall.

Several other countries in the world have 7,000m peaks (eg. the ‘Stans), but the new rule ensures the revenues remain in the country. Even if you opened a new route on K2 and won a Piolet d’Or for it, you still need a Nepal 7,000’er on your resumé before attempting Everest.

Carlonine Ogle, General Manager at Adventure Consultants, confirms the regulations may affect their potential clients in the following video:

View this post on Instagram See this post on Instagram

Health and style

Some of the rules in the bill also appeared in other recent regulations, such as the requirement to submit a recent health certificate to obtain a climbing permit. The measure is common for international expedition outfitters (and the climbers themselves, for their own sake). However, the requirements now extend to the local staff, including supporting Sherpas, guides, and even the Liaison Officer.

On the upper sections of Everest, Makalu in the background. Photo: Nani Stahringer/CT7S

The permit application must also include a detailed climbing plan, specifying the route and style — meaning that there should be no surprise no-oxygen claims after returning to Base Camp or new variation routes opened on the fly. We don’t know whether applicants may report a preliminary plan, such as a no-O2 or fast ascent, “depending on conditions.” It is rather common for climbers to declare their intent to climb without supplementary oxygen, only to turn to gas and extra support during their summit push.

Money for the environment

The Bill also lays the groundwork for a general environmental fund that will collect climbers’ money previously directed to specific goals, such as the garbage management fee and each foreigner’s $4,000 deposit, which is returned only if a minimum amount of solid waste is returned from the mountain.

Employees of the Sagarmatha Pollution Control Committee retrieve garbage bags from Everest Base Camp. Photo: SPCC

What is not mentioned

As far as we know, the proposed new regs do not mention the use of drones, which were such a great tool last year for the Icefall Doctors as they fixed the route across the Khumbu Icefall, or the always controversial helicopters, widely used to carry climbers and equipment from Kathmandu, but also used above Base Camp. There also remains no limit to the number of annual permits, which in recent years has totaled between 800 and 900.

The new bill specifies that the responsibility for coordinating search and rescue missions lies with the outfitters. It also states that missing climbers whose remains are not located will be declared dead in one year.

Climber/filmmaker Elia Saikaly has proposed an addition:

Elia Saikali/Instagram

No time for this spring

The bill now moves to the House of Representatives (the lower house) after the March 5 elections, the Kathmandu Post explained. From there, it returns to the National Assembly (the upper house) before going to the President for signature into law. That means the bill will not take effect this season.

The delay may also prove beneficial for business in 2026, as those considering climbing Everest without prior experience on a Nepalese 7,000’er might hurry to do so this spring, before the new law comes into force.","{'https://sb.scorecardresearch.com/p?c1=2&c2=31601662&cv=3.6.0&cj=1', 'https://explorersweb.com/wp-content/uploads/2024/05/Everest-summit-area-ct7s-e1715760679865-420x700.jpg', 'https://s3.amazonaws.com/www.explorersweb.com/wp-content/uploads/2020/10/23235615/Baruntse-Asian-Trekking-1024x640.jpg', 'https://s3.amazonaws.com/www.explorersweb.com/wp-content/uploads/2022/09/22132619/Elite-building-300x211.jpg', 'https://explorersweb.com/wp-content/uploads/2026/02/Nepal-royalties-2026-700x250.jpg', 'https://pixel.quantserve.com/pixel/p-KbMJ-y4beb5AJ.gif', 'https://www.facebook.com/tr?id=3399673563680433&ev=PageView&noscript=1', 'https://explorersweb.com/wp-content/uploads/2026/02/Jost-wie-06-300x183.jpg', 'https://explorersweb.com/wp-content/uploads/2025/05/Everest-BAse-Camp-Furtenbach-700x700.jpg', 'https://explorersweb.com/wp-content/uploads/2025/05/Everest-final-SPCC-retrieval-700x366.jpg', 'https://explorersweb.com/wp-content/uploads/2026/01/IMG_4629-300x170.jpg', 'https://explorersweb.com/wp-content/uploads/2026/02/tyler-01-300x184.jpg', 'https://s3.amazonaws.com/www.explorersweb.com/wp-content/uploads/2019/02/24004742/IMG-20190225-WA0010-300x300.jpg', 'https://explorersweb.com/wp-content/uploads/2026/02/Elia-story-Feb16-458x700.jpg', 'https://s3.amazonaws.com/www.explorersweb.com/wp-content/uploads/2023/07/10162354/oleg-people.jpg', 'https://explorersweb.com/wp-content/uploads/2026/01/shutterstock_1489473716-e1769459322342-300x236.jpg', 'https://explorersweb.com/wp-content/uploads/2026/01/tiger-02-shutterstock-300x225.jpg'}","पिछला सप्ताह नेपाल के राष्ट्रीय सभा मे एकटा नव पर्यटन विधेयक पारित भेल छल. एहि लेल पर्वतारोही कए एवरेस्ट स निपटबा स पहिने नेपाल मे 7000’र पर चढ़ल हेबाक चाही। आंशिक रूप स एहि कदम स पहाड़ पर अनुभवहीन या अयोग्य पर्वतारोही कए रोकल जा सकैत अछि, मुदा एहि स देश क समृद्ध अभियान व्यवसाय कए सेहो बढ़ावा भेटत।

नेपाल मे ट्रेकिंग आ पर्वतारोहण के लेल हर साल नव नियम प्रस्तावित होइत अछि । तखन हम सब इंतजार करैत छी जे कोन-कोन वास्तव मे लागू होइत अछि, आ कोना। एहि बेर अंतर ई अछि जे एवरेस्ट के नियम राष्ट्रीय कानून बनय के कगार पर अछि. ई पर्यटन विभाग या क्षेत्रीय प्राधिकारी केरऽ नियमऽ स॑ काफी भिन्न छै ।

2025 मे एवरेस्ट बेस कैम्प के नेपाली पक्ष।फोटो: फुर्टेनबच एडवेंचर्स

ई एकीकृत पर्यटन विधेयक म॑ उच्च ऊंचाई प॑ पर्वतारोही खास करी क॑ एवरेस्ट ग्राहकऽ लेली अनेक नियम आरू आवश्यकता छै । एवरेस्ट अभियान उद्योग लेली राजस्व केरऽ सबस॑ बड़ऽ स्रोत छै । खबर छै कि ई उपाय स॑ सुरक्षा बढ़तै आरू पर्यावरण के सुरक्षा होतै, हालांकि एकरऽ मतलब ई होतै कि विदेशी ग्राहक अधिक भुगतान करतै । सर्वसम्मति स विधेयक पारित भ गेल।

एवरेस्ट स पहिने 7,000 मीटर

सबस उल्लेखनीय नियमन एवरेस्ट पर्वतारोही क लेल पूर्व पर्वतारोहण अनुभव क संबंध मे अछि । एवरेस्ट शिखर पर चढ़य वाला हर होबय वाला नेपाल के 7000 मीटर के चोटी पर चढ़ल होएत.

बरुंसे’क ऊपरी ढलान पर पर्वतारोहीक फाइल छवि. फोटो: एशियाई ट्रेकिंग

स्थानीय मीडिया न॑ बतैलकै कि अधिकारियऽ के कहना छै कि ई प्रावधान के उद्देश्य दुनिया केरऽ सबस॑ उच्च चोटी प॑ पहुँचै के कोशिश करै वाला अनुभवहीन पर्वतारोही के बढ़तऽ संख्या प॑ लगाम लगाना छै, जेकरा अक्सर भीड़, दुर्घटना आरू बचाव सेवा प॑ तनाव के जिम्मेदार ठहरालऽ जाय छै । एकरा म॑ नेपाली आउटफिटरऽ के बीच हाल केरऽ ट्रेंड क॑ भी बतैलऽ गेलऽ छै कि वू देश केरऽ ७,०००’ers, जेना कि हिमलुंग आरू बारुंसे क॑ अभियान के पेशकश करै छै ।

नेपाल मे विदेशी पर्वतारोही (अमेरिकी डॉलर मे) के लेल चढ़ाई के रॉयल्टी, 2026 तक अपडेट.स्रोत: नेपाल के पर्यटन विभाग

नेपाल में 7,000 मीटर सं 7,999 मीटर के बीच 86 चोटी (उप-पीक सहित) अछि, आ वसंत में विदेशी लोकनि के एहि पर चढ़बाक रॉयल्टी 500 सं 800 डॉलर धरि अछि, जे ऊँचाई पर निर्भर करैत अछि. गिरावट मे दाम मे 50% क गिरावट अछि।

दुनिया केरऽ कई अन्य देशऽ म॑ ७,००० मीटर के चोटी छै (जैना कि ‘स्टैन्स), लेकिन नया नियम ई सुनिश्चित करै छै कि राजस्व देश म॑ ही रह॑ । भले ही अहां के2 पर नवका रूट खोललहुं आओर एहि लेल पायोलेट डी’ओर जीतलहुं, मुदा एवरेस्ट के कोशिश करय सं पहिने अहां के रिज्यूमे पर नेपाल 7000’र के जरूरत अछि.

एडवेंचर कंसल्टेंट्स केरऽ महाप्रबंधक कार्लोनिन ओगल न॑ निम्नलिखित वीडियो म॑ ई बात के पुष्टि करलकै कि ई नियम ओकरऽ संभावित ग्राहकऽ क॑ प्रभावित करी सकै छै:

इंस्टाग्राम पर ई पोस्ट देखू इंस्टाग्राम पर ई पोस्ट देखू

स्वास्थ्य एवं शैली

एहि विधेयक मे किछु नियम हाल क अन्य नियमावली मे सेहो आयल छल, जेना कि चढ़ाई क परमिट लेबा लेल हाल मे स्वास्थ्य प्रमाणपत्र जमा करबाक आवश्यकता। ई उपाय अंतर्राष्ट्रीय अभियान आउटफिटर ( आ स्वयं पर्वतारोही लोकनिक हेतु , अपन हितमें ) ले आम बात थिक. मुदा, आब ई आवश्यकता स्थानीय कर्मचारी धरि पहुँचि गेल अछि, जाहि में शेरपा, गाइड, आ संपर्क अधिकारी धरि के सहायता सेहो शामिल अछि.

एवरेस्ट के ऊपरी खंडों पर पृष्ठभूमि में मकालू | फोटो : नानी स्ताहरिंजर/सीटी7एस

परमिट आवेदन म॑ विस्तृत चढ़ाई योजना भी शामिल होना चाहियऽ, जेकरा म॑ मार्ग आरू शैली क॑ निर्दिष्ट करलऽ गेलऽ छै — मतलब कि बेस कैंप म॑ वापसी के बाद या मक्खी प॑ खुललऽ नया भिन्नता मार्गऽ प॑ कोनो आश्चर्य के बात नै होना चाहियऽ । हमरा सब कें पता नहि छै की आवेदक कोनों प्रारंभिक योजना कें रिपोर्ट कयर सकय छै, जेना कि नो-ओ2 या तेज चढ़ाई, “शर्तक कें आधार पर.” ई काफी आम बात छै कि पर्वतारोही बिना पूरक ऑक्सीजन के चढ़ै के अपनऽ इरादा के घोषणा करै छै, केवल अपनऽ शिखर धक्का के दौरान गैस आरू अतिरिक्त सहायता के तरफ मुड़ै छै ।

पर्यावरण के लिये पैसा

ई विधेयक म॑ एगो सामान्य पर्यावरण कोष केरऽ नींव भी रखलऽ गेलऽ छै जेकरा म॑ पर्वतारोही केरऽ पैसा इकट्ठा करलऽ जैतै जे पहिने स॑ विशिष्ट लक्ष्य प॑ निर्देशित करलऽ गेलऽ छेलै, जेना कि कचरा प्रबंधन शुल्क आरू हर विदेशी केरऽ ४,००० डॉलर के जमा, जे तखनी वापस करलऽ जाय छै जब॑ पहाड़ स॑ न्यूनतम मात्रा म॑ ठोस कचरा वापस करलऽ जाय ।

सगरमाथा प्रदूषण नियंत्रण समिति के कर्मचारी एवरेस्ट बेस कैंप से कूड़ा के थैली निकालते हुए | फोटो : एसपीसीसी

जे बात नहि कहल गेल अछि

जहाँ तक हमरा सब क॑ पता छै, प्रस्तावित नया रेग म॑ ड्रोन के इस्तेमाल के जिक्र नै छै, जे पिछला साल आइसफॉल डॉक्टर लेली एतना बड़ऽ औजार छेलै, कैन्हेंकि वू खुम्बू आइसफॉल, या हमेशा विवादित हेलीकॉप्टर, जेकरऽ व्यापक रूप स॑ काठमांडू स॑ पर्वतारोही आरू उपकरण ले जाय लेली प्रयोग करलऽ जाय छै, लेकिन बेस कैंप के ऊपर भी इस्तेमाल करलऽ जाय छै, के रास्ता तय करी लेल॑ छेलै । सालाना परमिट क संख्या क सेहो कोनो सीमा नहि बनल अछि, जे हाल क साल मे कुल 800 स 900 क बीच अछि।

नबका विधेयक मे इ निर्दिष्ट कैल गेल छै कि खोज आ बचाव मिशन कें समन्वय कें जिम्मेदारी आउटफिटर कें छै. संगहि कहल गेल अछि जे लापता पर्वतारोही जिनकर अवशेष नहि अछि ओकरा एक साल मे मृत घोषित क देल जाएत।

पर्वतारोही/फिल्म निर्माता एलिया सैकाली एकटा जोड़ प्रस्तावित केने छथि :

एलिया सैकाली/इंस्टाग्राम

एहि बसंतक कोनो समय नहि

५ मार्च के चुनाव के बाद आब ई विधेयक प्रतिनिधि सभा (निचला सदन) मे स्थानांतरित भ रहल अछि, काठमांडू पोस्ट स्पष्ट केलक अछि । ओतय सं ई कानून मे हस्ताक्षर करय लेल राष्ट्रपति के पास जेबा सं पहिने राष्ट्रीय सभा (उच्च सदन) मे वापस आबि जाइत अछि. मतलब एहि सीजन मे इ बिल लागू नहि होएत।

ई देरी 2026 म॑ व्यापार लेली भी फायदेमंद साबित होय सकै छै, कैन्हेंकि जे लोग नेपाली 7,000’er प॑ पूर्व अनुभव के बिना एवरेस्ट प॑ चढ़ै प॑ विचार करी रहलऽ छै, वू ई वसंत म॑, नया कानून लागू होय स॑ पहल॑ ही ऐसनऽ करै म॑ जल्दी करी सकै छै ।"
