title,description,published date,url,publisher.href,publisher.title,full_article,images,translated
With rain comes dengue - Nepali Times,With rain comes dengue  Nepali Times,2026-05-03 10:55:34,https://news.google.com/rss/articles/CBMiWEFVX3lxTE9lWGl3VWsyS2NVU0RkdTFFRDRfSGM5bUxad3FjSVI0RkctelVSQmVMeElJNEtJTDA3bHJxemtJdDF6UnBWaF9ibExtRTh3cVVqck81TzZVTDQ?oc=5&hl=en-US&gl=US&ceid=US:en,http://nepalitimes.com,Nepali Times,"Nepal’s worst dengue outbreak was in 2022, when at least 88 were killed nationwide and 54,000 were diagnosed. In 2024, there were 10,000 cases in Kathmandu Valley alone, although the real figure was many times higher.

With heavier than usual pre-monsoon showers in April, public health experts warn that there could be another upsurge of the deadly mosquito-borne infection this year.

The first ever case of dengue in Nepal was reported in a traveler returning from India in 2004. But since then, dengue is locally transmitted and as the atmosphere warms the vector is moving up the mountains.

Dengue is spread by the daytime bite of the female of two species of mosquitos, the Aedes aegypti, and the Aedes albopictus. Researchers have found that A. albopictus in particular has adapted to colder conditions and is moving to higher elevations.

Warns virologist Sher Bahadur Pun at Sukraraj Tropical and Infectious Disease Hospital in Kathmandu: “If we go by past cycles, we are due for a major outbreak because it takes place every 2-3 years, and it could be the worst yet.”

There are four serotypes of dengue, and each consecutive infection by a different strain can be increasingly more severe. The same goes for outbreaks, Pun adds, and Kathmandu could face two more major outbreaks, possibly by 2030.

Infected Aedes mosquitos breed in stagnant water and hatch infected offspring. August-September during the monsoon is usually when dengue cases peak, and rain followed by sunshine is the ideal condition for the larvae to metamorphose into pupae and hatch.

“The longer the gap between dengue occurrences, the bigger the outbreak,” explains Sudeep Adhikari at the Oxford University Clinical Research Unit (OUCRU) Nepal office. “There are three scenarios: a new serotype that the population isn’t immune to yet, the same serotype for which the population has lost its immunity, and a mix of more than one serotype.”

Vaccines are now available and the WHO recommends them for children in high dengue burden areas, but they are not as effective as they do not equally prevent infections from all serotypes. In Nepal it is not yet available and the newer vaccines haven’t existed long enough to analyse their long-term effectiveness.

Prevention, therefore, is the best form of cure. Draining clear stagnant water in the city and in the home from drains, used tyres, flower pots, even bottle caps, will prevent mosquitos from breeding. People are advised to wear full-sleeve shirts, rub insect repellent on exposed skin, and use treated mosquito nets.

“If we don’t control mosquitos at the larvae stage and wait for the outbreak to deploy search and destroy mode, that is too late,” says Pun. “At most, we will manage to contain the spread in that specific area. But this is a daytime biter, and people going to school or work could be infected at any point.”

Despite rising temperatures and early rains, there is no sense of urgency at the public and government level. He laments: “We are all too busy with hardcore politics to care about public health. Local governments, especially, must immediately mobilise volunteers to clear stagnant pools of water before the outbreak hits.”

Many who are infected are asymptomatic, but can spread the virus through mosquito bites. The mortality rate among patients is low, but dengue is called break-bone fever because patients suffer unbearable pain in the joints and eyes, severe headache, and vomiting, which can only be managed but not treated.

“Because there is no treatment, people just go about their daily lives despite the infection, treating it like a common cold, further spreading the disease as well as aggravating their condition,” says Pun, who now calls the fever “walking dengue”.

Because regular dengue fever is extremely painful, it is often not easy to identify when an individual has progressed to severe haemorrhagic dengue. That is when dengue patients tend to crowd hospitals because of persistent and extreme symptoms, occupying beds for weeks at a time when there are other infections.

“There must be a public understanding of what constitutes a normal dengue case versus a severe case, and we have to upgrade hospital services to prepare for the dengue season,” says Adhikari.

He adds: “Ultimately, Nepalis are reactive and therein lies the problem. Preparedness is an on-going process, and public awareness is of paramount importance to actively identify stagnant bodies of water before an outbreak, not after.”","{'https://media.nepalitimes.com/cover/With rain comes dengue NT.jpg', 'http://nepalitimes.com/cdn-cgi/image/w=1200,h=675/https://media.nepalitimes.com/cover/With rain comes dengue NT.jpg', 'http://nepalitimes.com/brand/nepali-times-icon.svg', 'http://nepalitimes.com/brand/nepali-times.png'}","नेपाल केरऽ सबसें खराब डेंगू केरऽ प्रकोप २०२२ म॑ छेलै, जब॑ देश भर म॑ कम स॑ कम ८८ लोगऽ के मौत होय गेलऽ छेलै आरू ५४,००० लोगऽ के निदान होय ​​गेलऽ छेलै । 2024 मे असगर काठमांडू उपत्यका मे 10 हजार मामला सामने आयल छल, हालांकि असली आंकड़ा कई गुना बेसी छल।

अप्रैल म॑ मानसून स॑ पहल॑ सामान्य स॑ अधिक भारी बारिश के साथ जनस्वास्थ्य विशेषज्ञऽ न॑ चेतावनी देल॑ छै कि ई साल मच्छरऽ स॑ होय वाला घातक संक्रमण केरऽ एक आरू उछाल आबी सकै छै ।

नेपाल में डेंगू के पहिल बेर 2004 में भारत सं लौटल एकटा यात्री में डेंगू के मामला सामने आयल छल.मुदा तहिया सं डेंगू स्थानीय रूप सं संक्रमित भ रहल अछि आ जेना-जेना वातावरण गर्म भ रहल अछि ओ संवाहक पहाड़ पर चलि रहल अछि.

डेंगू दू प्रजाति के मच्छर, एडीज एजिप्टी आ एडीज अल्बोपिक्टस के मादा के दिन में काटला सं फैलैत अछि. शोधकर्ता सब के कहना छै कि विशेष रूप स॑ ए.अल्बोपिक्टस ठंडा परिस्थिति के अनुकूल होय गेलऽ छै आरू अधिक ऊंचाई प॑ जाय रहलऽ छै ।

काठमांडू के सुकराराज ट्रॉपिकल एंड इंफेक्शियस डिजीज अस्पताल के वायरोलॉजिस्ट शेरबहादुर पुन के चेतावनी दैत छथिन: “अगर हम सब पिछला चक्र के हिसाब स जायब त हमरा सब के एकटा पैघ प्रकोप के कारण अछि, कियाक त ई हर 2-3 साल पर होइत अछि, आ ई एखन धरि के सबस खराब भ सकैत अछि।”

डेंगू कें चारि सेरोटाइप छै, आ अलग-अलग तनाव सं लगातार प्रत्येक संक्रमण तेजी सं बेसि गंभीर भ सकएयत छै. पुन आरू कहै छै कि प्रकोप के मामला म॑ भी यही हाल छै आरू काठमांडू क॑ दू आरू बड़ऽ प्रकोप के सामना करना पड़॑ सकै छै, संभवतः २०३० तलक ।

संक्रमित एडीज मच्छर ठहरल पानी मे प्रजनन करएयत छै आ संक्रमित संतान कें बच्चा पैदा करएयत छै. मानसून के दौरान अगस्त-सितम्बर आमतौर पर डेंगू के मामला चरम पर पहुँचै वाला समय होय छै, आरू बारिश के बाद धूप के रोशनी लार्वा के प्यूपा में रूपांतरित होय के आरू बच्चा निकलै के आदर्श स्थिति छै.

ऑक्सफोर्ड विश्वविद्यालय क्लिनिकल रिसर्च यूनिट (ओयूसीआरयू) नेपाल कार्यालय मे सुदीप अधिकारी बतबैत छथि, “डेंगू क घटना मे जतेक बेसी अंतर रहत, प्रकोप ओतबे पैघ होयत। “तीन परिदृश्य अछि: एकटा नव सेरोटाइप जकरा सँ आबादी एखन धरि अछूता नहि अछि, वैह सेरोटाइप जकर प्रतिरक्षा क्षमता खतम भ’ गेल अछि, आ एक सँ बेसी सेरोटाइप’क मिश्रण.”

आब टीका उपलब्ध छै आ डब्ल्यूएचओ एकर सिफारिश डेंगू कें अधिक बोझ वाला इलाकाक मे बच्चाक कें लेल करएयत छै, मुदा इ ओतेक प्रभावी नहि छै, कियाकि इ सबटा सेरोटाइप सं संक्रमण कें समान रूप सं नहि रोकएयत छै. नेपाल मे ई एखन धरि उपलब्ध नहिं अछि आओर नवका टीका एतेक दिन सं नहिं अछि जे ओकर दीर्घकालीन प्रभावशीलता के विश्लेषण क’ सकय.

अतः रोकथाम इलाज केरऽ सबसे अच्छा तरीका छै । शहर मे आ घर मे साफ ठहरल पानि कें नाली, उपयोग कैल गेल टायर, फूलक कें बर्तन, एतय तइक की बोतल कें टोपी सं निकालला सं मच्छर कें प्रजनन सं बचाव होयत. लोकक कें सलाह देल गेल छै की ओ फुल स्लीव शर्ट पहनूं, उजागर त्वचा पर कीटनाशक कें रगड़ूं, आ उपचारित मच्छरदानी कें उपयोग करूं.

पुन कहैत छथि, “जँ हम लार्वा अवस्था मे मच्छर केँ नियंत्रित नहि करब आ प्रकोप केर प्रतीक्षा करब जे खोज आ नष्ट मोड तैनात भ’ जाय त’ ई बहुत देर भ’ गेल अछि.” ""बेसी स बेसी हम सब ओहि विशिष्ट क्षेत्र मे फैलाव कए रोकबा मे सफल रहब। मुदा इ दिन मे काटय वाला अछि, आ स्कूल या काज पर जेबा वाला लोक कोनो समय संक्रमित भ सकैत छथि।""

बढ़ैत तापमान आ जल्दी बरखा के बावजूद जनता आ सरकारी स्तर पर तात्कालिकता के कोनो भाव नहिं अछि. ओ विलाप करैत कहैत छथि: ""हम सब कट्टर राजनीति मे व्यस्त छी जे जनस्वास्थ्य क चिंता नहि क सकैत छी। खास क स्थानीय सरकार कए प्रकोप स पहिने तुरंत स्वयंसेवक कए जुटा कए ठमकल पानिक कुंड कए साफ करबाक चाही।""

बहुत सं जे संक्रमित छै, ओ लक्षणहीन छै, मुदा मच्छर कें काटला सं इ वायरस फैला सकएय छै. मरीजऽ में मृत्यु दर कम होय छै, लेकिन डेंगू क॑ ब्रेक-बोन फीवर कहलऽ जाय छै, कैन्हेंकि मरीजऽ क॑ जोड़ आरू आँखऽ म॑ असहनीय दर्द, गंभीर माथा दर्द, आरू उल्टी होय छै, जेकरा केवल प्रबंधन करलऽ जाब॑ सकै छै लेकिन ओकरऽ इलाज नै होय छै ।

आब बुखार के “चलैत डेंगू” कहय वाला पुन कहैत छथि, “कोनो इलाज नै हेबाक कारणे लोक बस संक्रमण के बावजूद अपन रोजमर्रा के जीवन में लागि जाइत छथि, एकरा आम सर्दी के तरह व्यवहार करैत छथि, बीमारी के आओर फैलाबैत छथि आ संगहि हुनकर हालत सेहो बढ़ि जाइत छथि।”

चूँकि नियमित डेंगू बुखार अत्यंत दर्दनाक होयत छै, अइ कें लेल अक्सर इ पहचान करनाय आसान नहि होयत छै की कोनों व्यक्ति कखन गंभीर रक्तस्राव वाला डेंगू कें रूप मे बढ़ल छै. तखनहि डेंगू के मरीज लगातार आ चरम लक्षण के कारण अस्पताल में भीड़ लगाबय के प्रवृत्ति रखैत छथि, जखन कि अन्य संक्रमण के समय में हफ्ता भरि बिस्तर पर कब्जा क लैत छथि.

अधिकारी कहै छै, “सामान्य डेंगू केस बनाम गंभीर केस के गठन की छै, एकरऽ जन समझ होना चाहियऽ, आरू डेंगू के मौसम के तैयारी लेली अस्पताल के सेवा क॑ अपग्रेड करै ल॑ पड़तै ।

ओ आगू कहैत छथि: “अंततः नेपाली प्रतिक्रियाशील होइत अछि आ ओहि मे समस्या निहित अछि, तैयारी एकटा चलैत प्रक्रिया अछि, आ प्रकोप के बाद नहि, प्रकोप सं पहिने ठमकल जल निकाय के सक्रिय रूप सं पहचान करय लेल जनजागरण के सर्वोपरि महत्व अछि।”"
