title,description,published date,url,publisher.href,publisher.title,full_article,images,translated
"Promoting Nepal's tourism potential beyond Mount Everest - myRepublica - The New York Times Partner, Latest news ... - Myrepublica","Promoting Nepal's tourism potential beyond Mount Everest - myRepublica - The New York Times Partner, Latest news ...  Myrepublica",2024-04-03 01:46:00,https://news.google.com/rss/articles/CBMiZWh0dHBzOi8vbXlyZXB1YmxpY2EubmFnYXJpa25ldHdvcmsuY29tL25ld3MvcHJvbW90aW5nLW5lcGFsLXMtdG91cmlzbS1wb3RlbnRpYWwtYmV5b25kLW1vdW50LWV2ZXJlc3Qv0gEA?oc=5&hl=en-US&gl=US&ceid=US:en,https://myrepublica.nagariknetwork.com,Myrepublica,,,
World Bank predicts modest growth for Nepal's economy - The Kathmandu Post,World Bank predicts modest growth for Nepal's economy  The Kathmandu Post,2024-04-03 01:52:19,https://news.google.com/rss/articles/CBMiYGh0dHBzOi8va2F0aG1hbmR1cG9zdC5jb20vbW9uZXkvMjAyNC8wNC8wMy93b3JsZC1iYW5rLXByZWRpY3RzLW1vZGVzdC1ncm93dGgtZm9yLW5lcGFsLXMtZWNvbm9tedIBAA?oc=5&hl=en-US&gl=US&ceid=US:en,https://kathmandupost.com,The Kathmandu Post,,,
Nepal faces trade deficit with Bangladesh for over one decade - Myrepublica,Nepal faces trade deficit with Bangladesh for over one decade  Myrepublica,2024-04-03 02:16:27,https://news.google.com/rss/articles/CBMiamh0dHBzOi8vbXlyZXB1YmxpY2EubmFnYXJpa25ldHdvcmsuY29tL25ld3MvbmVwYWwtZmFjZXMtdHJhZGUtZGVmaWNpdC13aXRoLWJhbmdsYWRlc2gtZm9yLW92ZXItb25lLWRlY2FkZS_SAWhodHRwOi8vbXlyZXB1YmxpY2EubmFnYXJpa25ldHdvcmsuY29tL2FtcC9uZXBhbC1mYWNlcy10cmFkZS1kZWZpY2l0LXdpdGgtYmFuZ2xhZGVzaC1mb3Itb3Zlci1vbmUtZGVjYWRlLw?oc=5&hl=en-US&gl=US&ceid=US:en,https://myrepublica.nagariknetwork.com,Myrepublica,,,
LIVE Cricket Streaming Nepal A vs Ireland Wolves 1st ODI | Ireland Wolves Tour of Nepal - Cricket World,LIVE Cricket Streaming Nepal A vs Ireland Wolves 1st ODI | Ireland Wolves Tour of Nepal  Cricket World,2024-04-03 03:44:45,https://news.google.com/rss/articles/CBMifGh0dHBzOi8vd3d3LmNyaWNrZXR3b3JsZC5jb20vbGl2ZS1jcmlja2V0LXN0cmVhbWluZy1uZXBhbC1hLXZzLWlyZWxhbmQtd29sdmVzLTFzdC1vZGktaXJlbGFuZC13b2x2ZXMtdG91ci1vZi1uZXBhbC85MzU1OC5odG3SAQA?oc=5&hl=en-US&gl=US&ceid=US:en,https://www.cricketworld.com,Cricket World,,,
Nepal and Switzerland discuss bilateral cooperation in trade and tourism - Myrepublica,Nepal and Switzerland discuss bilateral cooperation in trade and tourism  Myrepublica,2024-04-03 03:46:42,https://news.google.com/rss/articles/CBMidWh0dHBzOi8vbXlyZXB1YmxpY2EubmFnYXJpa25ldHdvcmsuY29tL25ld3MvbmVwYWwtYW5kLXN3aXR6ZXJsYW5kLWRpc2N1c3MtYmlsYXRlcmFsLWNvb3BlcmF0aW9uLWluLXRyYWRlLWFuZC10b3VyaXNtL9IBAA?oc=5&hl=en-US&gl=US&ceid=US:en,https://myrepublica.nagariknetwork.com,Myrepublica,,,
"First one-day practice match: Nepal ‘A’ lose toss, fielding first against Ireland Wolves - Myrepublica","First one-day practice match: Nepal ‘A’ lose toss, fielding first against Ireland Wolves  Myrepublica",2024-04-03 03:57:41,https://news.google.com/rss/articles/CBMifmh0dHBzOi8vbXlyZXB1YmxpY2EubmFnYXJpa25ldHdvcmsuY29tL25ld3MvZmlyc3Qtb2QtcHJhY3RpY2UtbWF0Y2gtbmVwYWwtYS1sb3NzZXMtdG9zcy1maWVsZGluZy1maXJzdC1hZ2FpbnN0LWlyZWxhbmQtd29sdmVzL9IBfGh0dHA6Ly9teXJlcHVibGljYS5uYWdhcmlrbmV0d29yay5jb20vYW1wL2ZpcnN0LW9kLXByYWN0aWNlLW1hdGNoLW5lcGFsLWEtbG9zc2VzLXRvc3MtZmllbGRpbmctZmlyc3QtYWdhaW5zdC1pcmVsYW5kLXdvbHZlcy8?oc=5&hl=en-US&gl=US&ceid=US:en,https://myrepublica.nagariknetwork.com,Myrepublica,,,
Nepal 'A' limits Ireland Wolves to 157 runs - Myrepublica,Nepal 'A' limits Ireland Wolves to 157 runs  Myrepublica,2024-04-03 07:25:32,https://news.google.com/rss/articles/CBMiVmh0dHBzOi8vbXlyZXB1YmxpY2EubmFnYXJpa25ldHdvcmsuY29tL25ld3MvbmVwYWwtYS1saW1pdHMtaXJlbGFuZC13b2x2ZXMtdG8tMTU3LXJ1bnMv0gFUaHR0cDovL215cmVwdWJsaWNhLm5hZ2FyaWtuZXR3b3JrLmNvbS9hbXAvbmVwYWwtYS1saW1pdHMtaXJlbGFuZC13b2x2ZXMtdG8tMTU3LXJ1bnMv?oc=5&hl=en-US&gl=US&ceid=US:en,https://myrepublica.nagariknetwork.com,Myrepublica,,,
Maruti Suzuki's Car Production Almost Equals Nepal's Entire Population - Times Now,Maruti Suzuki's Car Production Almost Equals Nepal's Entire Population  Times Now,2024-04-03 07:29:43,https://news.google.com/rss/articles/CBMigQFodHRwczovL3d3dy50aW1lc25vd25ld3MuY29tL2F1dG8vY2FyLW5ld3MvbWFydXRpLXN1enVraXMtY2FyLXByb2R1Y3Rpb24tYWxtb3N0LWVxdWFscy1uZXBhbHMtZW50aXJlLXBvcHVsYXRpb24tYXJ0aWNsZS0xMDg5OTY3ODnSAYUBaHR0cHM6Ly93d3cudGltZXNub3duZXdzLmNvbS9hdXRvL2Nhci1uZXdzL21hcnV0aS1zdXp1a2lzLWNhci1wcm9kdWN0aW9uLWFsbW9zdC1lcXVhbHMtbmVwYWxzLWVudGlyZS1wb3B1bGF0aW9uLWFydGljbGUtMTA4OTk2Nzg5L2FtcA?oc=5&hl=en-US&gl=US&ceid=US:en,https://www.timesnownews.com,Times Now,,,
SMS Friendship T20 Cup match: Nepal to face host team Gujarat today - Myrepublica,SMS Friendship T20 Cup match: Nepal to face host team Gujarat today  Myrepublica,2024-04-03 08:15:00,https://news.google.com/rss/articles/CBMib2h0dHBzOi8vbXlyZXB1YmxpY2EubmFnYXJpa25ldHdvcmsuY29tL25ld3Mvc21zLWZyaWVuZHNoaXAtdDIwLWN1cC1tYXRjaC1uZXBhbC10by1mYWNlLWhvc3QtdGVhbS1ndWphcmF0LXRvZGF5L9IBbWh0dHA6Ly9teXJlcHVibGljYS5uYWdhcmlrbmV0d29yay5jb20vYW1wL3Ntcy1mcmllbmRzaGlwLXQyMC1jdXAtbWF0Y2gtbmVwYWwtdG8tZmFjZS1ob3N0LXRlYW0tZ3VqYXJhdC10b2RheS8?oc=5&hl=en-US&gl=US&ceid=US:en,https://myrepublica.nagariknetwork.com,Myrepublica,,,
"Forbes releases list of world's billionaires 2024; Nepal’s Binod Chaudhary at 1764th position among 2,781 billionaires - Myrepublica","Forbes releases list of world's billionaires 2024; Nepal’s Binod Chaudhary at 1764th position among 2,781 billionaires  Myrepublica",2024-04-03 08:58:07,https://news.google.com/rss/articles/CBMirgFodHRwczovL215cmVwdWJsaWNhLm5hZ2FyaWtuZXR3b3JrLmNvbS9uZXdzL2ZvcmJlcy1yZWxlYXNlcy1saXN0LW9mLXdvcmxkLXMtYmlsbGlvbmFpcmVzLTIwMjQtbnVtYmVyLW9mLWJpbGxpb25haXJlcy1yZWFjaGVzLTItNzgxLW5lcGFsLXMtYmlub2QtY2h1YWRoYXJ5LWF0LTE3NjR0aC1wb3NpdGlvbi_SAawBaHR0cDovL215cmVwdWJsaWNhLm5hZ2FyaWtuZXR3b3JrLmNvbS9hbXAvZm9yYmVzLXJlbGVhc2VzLWxpc3Qtb2Ytd29ybGQtcy1iaWxsaW9uYWlyZXMtMjAyNC1udW1iZXItb2YtYmlsbGlvbmFpcmVzLXJlYWNoZXMtMi03ODEtbmVwYWwtcy1iaW5vZC1jaHVhZGhhcnktYXQtMTc2NHRoLXBvc2l0aW9uLw?oc=5&hl=en-US&gl=US&ceid=US:en,https://myrepublica.nagariknetwork.com,Myrepublica,,,
Despair in Nepal over young men lured to fight for Russia – DW – 04/03/2024 - DW (English),Despair in Nepal over young men lured to fight for Russia – DW – 04/03/2024  DW (English),2024-04-03 09:29:15,https://news.google.com/rss/articles/CBMiXmh0dHBzOi8vd3d3LmR3LmNvbS9lbi9kZXNwYWlyLWluLW5lcGFsLW92ZXIteW91bmctbWVuLWx1cmVkLXRvLWZpZ2h0LWZvci1ydXNzaWEvdmlkZW8tNjg3Mjg3MzPSAQA?oc=5&hl=en-US&gl=US&ceid=US:en,https://www.dw.com,DW (English),,,
'They put us all in front': Nepalese men recruited by Russia to fight in Ukraine - Focus - FRANCE 24 English,'They put us all in front': Nepalese men recruited by Russia to fight in Ukraine - Focus  FRANCE 24 English,2024-04-03 09:38:07,https://news.google.com/rss/articles/CBMigQFodHRwczovL3d3dy5mcmFuY2UyNC5jb20vZW4vdHYtc2hvd3MvZm9jdXMvMjAyNDA0MDMtdGhleS1wdXQtdXMtYWxsLWluLWZyb250LW5lcGFsZXNlLW1lbi1yZWNydWl0ZWQtYnktcnVzc2lhLXRvLWZpZ2h0LWluLXVrcmFpbmXSAQA?oc=5&hl=en-US&gl=US&ceid=US:en,https://www.france24.com,FRANCE 24 English,,,
Nepal 'A' lose to Ireland Wolves by 21 runs - Myrepublica,Nepal 'A' lose to Ireland Wolves by 21 runs  Myrepublica,2024-04-03 10:00:52,https://news.google.com/rss/articles/CBMiVmh0dHBzOi8vbXlyZXB1YmxpY2EubmFnYXJpa25ldHdvcmsuY29tL25ld3MvbmVwYWwtYS1sb3NlLXRvLWlyZWxhbmQtd29sdmVzLWJ5LTIxLXJ1bnMv0gEA?oc=5&hl=en-US&gl=US&ceid=US:en,https://myrepublica.nagariknetwork.com,Myrepublica,,,
Nepal-A lose to Ireland Wolves by 21 runs in first match of one-day series - The Kathmandu Post,Nepal-A lose to Ireland Wolves by 21 runs in first match of one-day series  The Kathmandu Post,2024-04-03 10:56:53,https://news.google.com/rss/articles/CBMid2h0dHBzOi8va2F0aG1hbmR1cG9zdC5jb20vY3JpY2tldC8yMDI0LzA0LzAzL25lcGFsLWEtbG9zZS10by1pcmVsYW5kLXdvbHZlcy1ieS0yMS1ydW5zLWluLWZpcnN0LW1hdGNoLW9mLW9uZS1kYXktc2VyaWVz0gEA?oc=5&hl=en-US&gl=US&ceid=US:en,https://kathmandupost.com,The Kathmandu Post,,,
Ramro's $99 Nepalese Filipino Tasting Menu Is Worth It - Grub Street,Ramro's $99 Nepalese Filipino Tasting Menu Is Worth It  Grub Street,2024-04-03 11:00:47,https://news.google.com/rss/articles/CBMiTGh0dHBzOi8vd3d3LmdydWJzdHJlZXQuY29tL2FydGljbGUvcmFtcm8tbmVwYWxlc2UtZmlsaXBpbm8tdGFzdGluZy1tZW51Lmh0bWzSAQA?oc=5&hl=en-US&gl=US&ceid=US:en,https://www.grubstreet.com,Grub Street,,,
Mental Health Crisis in Nepal - The Himalayan Times,Mental Health Crisis in Nepal  The Himalayan Times,2024-04-03 11:15:08,https://news.google.com/rss/articles/CBMiQ2h0dHBzOi8vdGhlaGltYWxheWFudGltZXMuY29tL29waW5pb24vbWVudGFsLWhlYWx0aC1jcmlzaXMtaW4tbmVwYWzSATBodHRwczovL3RoZWhpbWFsYXlhbnRpbWVzLmNvbS9hbXBBcnRpY2xlLzEwMjYzNjY?oc=5&hl=en-US&gl=US&ceid=US:en,https://thehimalayantimes.com,The Himalayan Times,,,
"India Watching New Nepal Regime Closely, Concerned about Chinese Debt Trap: Top Govt Sources to News18 - News18","India Watching New Nepal Regime Closely, Concerned about Chinese Debt Trap: Top Govt Sources to News18  News18",2024-04-03 11:26:04,https://news.google.com/rss/articles/CBMijgFodHRwczovL3d3dy5uZXdzMTguY29tL2luZGlhL2luZGlhLXdhdGNoaW5nLW5ldy1uZXBhbC1yZWdpbWUtY2xvc2VseS1jb25jZXJuZWQtYWJvdXQtY2hpbmVzZS1kZWJ0LXRyYXAtdG9wLWdvdnQtc291cmNlcy10by1uZXdzMTgtODgzODQyMS5odG1s0gGSAWh0dHBzOi8vd3d3Lm5ld3MxOC5jb20vYW1wL2luZGlhL2luZGlhLXdhdGNoaW5nLW5ldy1uZXBhbC1yZWdpbWUtY2xvc2VseS1jb25jZXJuZWQtYWJvdXQtY2hpbmVzZS1kZWJ0LXRyYXAtdG9wLWdvdnQtc291cmNlcy10by1uZXdzMTgtODgzODQyMS5odG1s?oc=5&hl=en-US&gl=US&ceid=US:en,https://www.news18.com,News18,,,
Global Watch | Why India and the West Should Be Concerned About New Ruling Alliance in Nepal - News18,Global Watch | Why India and the West Should Be Concerned About New Ruling Alliance in Nepal  News18,2024-04-03 11:27:57,https://news.google.com/rss/articles/CBMihgFodHRwczovL3d3dy5uZXdzMTguY29tL29waW5pb24vZ2xvYmFsLXdhdGNoLXdoeS1pbmRpYS1hbmQtdGhlLXdlc3Qtc2hvdWxkLWJlLWNvbmNlcm5lZC1hYm91dC1uZXctcnVsaW5nLWFsbGlhbmNlLWluLW5lcGFsLTg4Mzc5NDcuaHRtbNIBigFodHRwczovL3d3dy5uZXdzMTguY29tL2FtcC9vcGluaW9uL2dsb2JhbC13YXRjaC13aHktaW5kaWEtYW5kLXRoZS13ZXN0LXNob3VsZC1iZS1jb25jZXJuZWQtYWJvdXQtbmV3LXJ1bGluZy1hbGxpYW5jZS1pbi1uZXBhbC04ODM3OTQ3Lmh0bWw?oc=5&hl=en-US&gl=US&ceid=US:en,https://www.news18.com,News18,,,
"Nepal's new legends, Susma Tamang and Anjani Teli are among the winners at the 6th Bir Ghaneshman Singh ... - Asian Boxing Confederation","Nepal's new legends, Susma Tamang and Anjani Teli are among the winners at the 6th Bir Ghaneshman Singh ...  Asian Boxing Confederation",2024-04-03 11:29:53,https://news.google.com/rss/articles/CBMilQFodHRwOi8vd3d3LmFzYmNuZXdzLm9yZy9uZXBhbHMtbmV3LWxlZ2VuZHMtc3VzbWEtdGFtYW5nLWFuZC1hbmphbmktdGVsaS1hcmUtYW1vbmctdGhlLXdpbm5lcnMtYXQtdGhlLTZ0aC1iaXItZ2hhbmVzaG1hbi1zaW5naC1uYXRpb25hbC1jaGFtcGlvbnNoaXBzL9IBAA?oc=5&hl=en-US&gl=US&ceid=US:en,http://www.asbcnews.org,Asian Boxing Confederation,,,
Ireland 'A' defeats Nepal 'A' - The Himalayan Times,Ireland 'A' defeats Nepal 'A'  The Himalayan Times,2024-04-03 11:54:11,https://news.google.com/rss/articles/CBMiPmh0dHBzOi8vdGhlaGltYWxheWFudGltZXMuY29tL3Nwb3J0cy9pcmVsYW5kLWEtZGVmZWF0cy1uZXBhbC1h0gEwaHR0cHM6Ly90aGVoaW1hbGF5YW50aW1lcy5jb20vYW1wQXJ0aWNsZS8xMDI2MzY5?oc=5&hl=en-US&gl=US&ceid=US:en,https://thehimalayantimes.com,The Himalayan Times,,,
