title,description,published date,url,publisher.href,publisher.title,full_article,images,translated
Nepal's Kami Rita summits Mt. Qomolangma for 32nd time - bastillepost.com,Nepal's Kami Rita summits Mt. Qomolangma for 32nd time  bastillepost.com,2026-05-18 08:23:00,https://news.google.com/rss/articles/CBMipwFBVV95cUxQdm1RTHJYWVFDTGc3czcySWFqSkNpT0VkNlpFSXhDTmljQ2EyZ3kwMlY3WThCSTFZWVNrdVJLaTFaLXJCTEg3MV9hbGJ2UWQwRV9HZzNvaDVfbXd2dzJtdEVfUFFUQ3d4WnZBUXVnOE9taHJVbUg4NEdtczBYYURLUEsyakNZYmVrT01ENHA2NEVSNW9qOExnSjVncjBZLS0zSnE0RG03QQ?oc=5&hl=en-US&gl=US&ceid=US:en,https://www.bastillepost.com,bastillepost.com,"The World Health Organisation (WHO) on Sunday determined that the Ebola outbreak in the Democratic Republic of the Congo (DRC) and Uganda constitutes a ""public health emergency of international concern.""

The WHO said on social media platform X that the outbreak, caused by the Bundibugyo virus, does not meet the criteria of a pandemic emergency.

The designation aims to coordinate a stronger international response to end the outbreak. The global health body has sent experts and delivered medical supplies to curb the spread of the disease.

Racing against time to stop the spread of the Ebola virus, UN agencies are scaling up the delivery of medical supplies to Ituri province in the DRC following the confirmation of the infectious disease on Friday.

More than 240 suspected cases and 80 deaths have been reported in two mining towns so far.

The WHO has prompted global partners to aid the DRC government.

""This is a local challenge needing leadership on the frontlines and we are going to have it and we are going to support it but this local challenge can go global in an instant, and those are the stakes that we are all aware of, pushing a pandemic where it belongs and ending it,"" said David Stevenson, a representative of the World Food Program and country director for Nigeria.

The outbreak has been reported in Uganda. Authorities have also confirmed a case in the DRC capital Kinshasa. In both cases, patients are believed to have traveled from Ituri.

International health organizations have mobilized more than 600 kilograms of medical supplies to support the DRC government to treat Ebola patients and stop the spread of the contagious disease that has occurred in a region affected by conflict.

Officials fear that displacement of populations and cross-border trade may hinder response efforts.

""I think the main challenge we are going to face in Ituri is the population because the population there is very important and they go everywhere. So, you know that there are many traders there and people are going everywhere so this is the big issue we face there,"" Samuel Roger Kamba, health minister of the DRC.

Countries bordering the DRC are considered high risk. The WHO has urged them to enhance surveillance and report cases. Rwanda has closed its border with the DRC in the western province of Rubavu following the announcement.

The latest Ebola outbreak is the 17th in the DRC since 1976.

Scientists say the disease spreads through contact with the bodily fluids of infected people.

WHO declares Ebola outbreak in DR Congo, Uganda global public health emergency","{'https://media.bastillepost.com/wp-content/uploads/global/2026/01/asia-pacific.jpeg', 'https://media.bastillepost.com/wp-content/uploads/hongkong/2018/12/new_icon_china.png', 'https://image.bastillepost.com/wp-content/uploads/hongkong/2026/02/sponsor-btn-20260216.png', 'https://www.bastillepost.com/global/images/logo_global.jpg', 'https://www.facebook.com/tr?id=2014126905534741&ev=PageView&noscript=1', 'https://media.bastillepost.com/wp-content/uploads/hongkong/2016/09/icon_0.png', 'https://media.bastillepost.com/wp-content/uploads/hongkong/2016/09/icon_sport.png', 'https://www.bastillepost.com/global/images/bp_logo_114x29.png', 'https://media.bastillepost.com/wp-content/uploads/hongkong/2018/01/tech_appIcon_01-1.png', 'https://image.bastillepost.com/704x369/wp-content/uploads/global/2026/05/8479907_1779081212419_a_FB.jpg.webp', 'https://image.bastillepost.com/704x369/wp-content/uploads/global/2026/05/8479895_1779084496002_a_FB.jpg.webp', 'https://image.bastillepost.com/1138x/wp-content/uploads/global/2026/05/8479953_1779093599177_a.jpg.webp', 'https://media.bastillepost.com/wp-content/uploads/hongkong/2016/09/icon_ent.png', 'https://image.bastillepost.com/640x/wp-content/uploads/global/2026/05/8479953_1779093599177_a_FB.jpg', 'https://image.bastillepost.com/704x369/wp-content/uploads/global/2026/05/8479893_1779082680002_a_FB.jpg.webp', 'https://image.bastillepost.com/704x369/wp-content/uploads/global/2026/05/8479918_1779092568412_a_FB.jpg.webp', 'https://media.bastillepost.com/wp-content/uploads/global/2024/04/news.jpg', 'https://image.bastillepost.com/704x369/wp-content/uploads/global/2026/05/8479912_1779082908003_a_FB.jpg.webp', 'https://media.bastillepost.com/wp-content/uploads/hongkong/2016/09/icon_blog.png', 'https://media.bastillepost.com/wp-content/uploads/global/2024/04/hongkong_icon.jpg', 'https://image.bastillepost.com/704x369/wp-content/uploads/global/2026/05/8479919_1779092432414_a_FB.jpg.webp', 'https://image.bastillepost.com/1138x/wp-content/uploads/global/2026/05/8479941_1779094140436_a.jpg.webp', 'https://media.bastillepost.com/wp-content/uploads/hongkong/2016/09/icon_hottopic.png', 'https://media.bastillepost.com/wp-content/uploads/hongkong/static/20230718-default-feature-704x369.jpg', 'https://media.bastillepost.com/wp-content/uploads/global/2024/04/businessicon.jpg', 'https://image.bastillepost.com/704x369/wp-content/uploads/global/2026/05/8479931_1779093452590_a_FB.jpg.webp'}","विश्व स्वास्थ्य संगठन (डब्ल्यूएचओ) नँ रविवार क ई तय करलकै कि कांगो लोकतांत्रिक गणराज्य (डीआरसी) आरू युगांडा मँ इबोला के प्रकोप एगो “अंतर्राष्ट्रीय चिंता के जनस्वास्थ्य आपातकाल” के गठन करै छै ।

डब्ल्यूएचओ न॑ सोशल मीडिया प्लेटफॉर्म एक्स प॑ कहलकै कि बुंडीबुग्यो वायरस के वजह स॑ ई प्रकोप महामारी केरऽ आपातकाल केरऽ मानदंड प॑ खरा नै उतरै छै ।

ई पदनाम के उद्देश्य प्रकोप के समाप्त करै लेली मजबूत अंतर्राष्ट्रीय प्रतिक्रिया के समन्वय करना छै । वैश्विक स्वास्थ्य निकाय एहि बीमारी के प्रसार पर रोक लगेबाक लेल विशेषज्ञ पठा क चिकित्सा आपूर्ति पहुंचा देलक अछि।

इबोला वायरस केरऽ प्रसार क॑ रोकै लेली समय के साथ दौड़त॑ हुअ॑ संयुक्त राष्ट्र केरऽ एजेंसी शुक्रवार क॑ संक्रामक बीमारी के पुष्टि के बाद डीआरसी केरऽ इतुरी प्रांत म॑ चिकित्सा आपूर्ति के डिलीवरी क॑ बढ़ाबै के काम करी रहलऽ छै ।

दूटा खनन शहर मे एखन धरि 240 स बेसी संदिग्ध मामला आ 80 गोटे क मौत क सूचना भेटल अछि।

डब्ल्यूएचओ न॑ वैश्विक भागीदारऽ क॑ डीआरसी सरकार क॑ सहायता दै लेली प्रेरित करलकै ।

विश्व खाद्य कार्यक्रम केरऽ प्रतिनिधि आरू नाइजीरिया केरऽ देश निदेशक डेविड स्टीवेंसन न॑ कहलकै कि ई एगो स्थानीय चुनौती छै जेकरा म॑ फ्रंटलाइन प॑ नेतृत्व के जरूरत छै आरू हमरा पास एकरा मिलै वाला छै आरू हम्में एकरऽ समर्थन करै वाला छियै लेकिन ई स्थानीय चुनौती पल भर म॑ वैश्विक होय सकै छै, आरू वू दांव छै जेकरा स॑ हम्मं॑ सब जानत॑ छियै, जे महामारी क॑ वहीं धकेल॑ क॑ जहाँ ओकरऽ संबंध छै आरू ओकरा समाप्त करी देलऽ जाय छै ।

युगांडा मे ई प्रकोप देखल गेल अछि । अधिकारि सब डीआरसी के राजधानी किन्शासा में सेहो एकटा मामला के पुष्टि केलक अछि। दुनू मामला मे मरीज इतुरी स यात्रा केल गेल मानल जा रहल अछि।

अंतरराष्ट्रीय स्वास्थ्य संगठन न॑ इबोला मरीजऽ के इलाज आरू संघर्ष स॑ प्रभावित क्षेत्र म॑ घटित संक्रामक बीमारी के प्रसार क॑ रोकै लेली डीआरसी सरकार क॑ सहायता दै लेली ६०० किलोग्राम स॑ भी अधिक चिकित्सा आपूर्ति जुटान॑ छै ।

अधिकारी सब क॑ आशंका छै कि आबादी केरऽ विस्थापन आरू सीमा पार स॑ व्यापार के कारण प्रतिक्रिया के प्रयास म॑ बाधा आबी सकै छै ।

डीआरसी के स्वास्थ्य मंत्री सैमुअल रोजर कम्बा, ""हमरा लगै छै कि इतुरी मँ हमरा सब क मुख्य चुनौती आबादी छै, कैन्हेंकि वहाँ के आबादी बहुत महत्वपूर्ण छै आरू वू सब जगह जाय छै। ई लेली, आपने सब क पता छै कि वहाँ बहुत व्यापारी छै आरू लोग सब जगह जा रहलौ छै, ई लेली ई बड़ौ मुद्दा छै जेकरा स॑ हमरा सब क॑ वहाँ सामना करना पड़ै छै।""

डीआरसी के सीमा पर बनल देश के उच्च जोखिम वाला मानल जाइत अछि. डब्ल्यूएचओ हुनका सब स आग्रह केलक अछि जे ओ निगरानी बढ़ाउ आ मामला क रिपोर्ट करथि। ई घोषणा के बाद रवांडा न॑ पश्चिमी प्रांत रुबावु म॑ डीआरसी के साथ अपनऽ सीमा बंद करी देल॑ छै ।

इबोला केरऽ ताजा प्रकोप १९७६ के बाद डीआरसी म॑ १७वां प्रकोप छेकै ।

वैज्ञानिक के कहनाय छनि जे संक्रमित लोक के शरीर के तरल पदार्थ के संपर्क सं ई बीमारी फैलैत अछि.

डब्ल्यूएचओ न॑ युगांडा केरऽ डीआर कांगो म॑ इबोला केरऽ प्रकोप क॑ वैश्विक जनस्वास्थ्य आपातकालीन घोषित करलकै"
Chinese team becomes first this spring to summit Mt Everest and Lhotse - Nepalnews.com,Chinese team becomes first this spring to summit Mt Everest and Lhotse  Nepalnews.com,2026-05-18 08:24:44,https://news.google.com/rss/articles/CBMisAFBVV95cUxPRFNYd1llTnNtX1dwZzg0TFZPZmdPOWVyaWhFNFRMTjNmT3MwRk8yVnB2MklTMEQxc2tHTl9rQUFKTkcwTVFKSnE4NE5mQ2pvMFRSeVdDbHN3em5ET2pMLUhJdllIYTluZ1R0b3RkSEZYWFNOSDRrNHpIV05sRlNqeE5GWi04R3N4SUlkT3hab2ltUFlzeWZPTWN6OUY3R1hhQmgxNEN5TkEtdVp5N2pBQw?oc=5&hl=en-US&gl=US&ceid=US:en,https://english.nepalnews.com,Nepalnews.com,,,
UML secretariat meeting underway - Nepalnews.com,UML secretariat meeting underway  Nepalnews.com,2026-05-18 08:34:45,https://news.google.com/rss/articles/CBMiggFBVV95cUxQWElveTIzd0tLeVVweGlVRkJ3cXRQa3BXLWlOQVYtSnE4VHpkc28yUE9iWEMwQ3ZTX29Yc1NOektwYlpXbnQydGNsWDlRejJ6RzdYZHNGOUVuSEx3cEEtX2NQUnhuejJ4dml6RjFLWUMySnFvS2pKUDN4elRGVWVQSnlR?oc=5&hl=en-US&gl=US&ceid=US:en,https://english.nepalnews.com,Nepalnews.com,,,
Foreign Minister Discusses Stranded Body Issue - Ratopati,Foreign Minister Discusses Stranded Body Issue  Ratopati,2026-05-18 08:57:11,https://news.google.com/rss/articles/CBMi1AFBVV95cUxORHprbklTTTNRN01mdEJjd2wtRnV2UFMyZXdpeC10Y0RsZDFMWmo3b2JLWVRuQUd2WXJ2MFYtd0RBbTI1RGpPcnA0emFLUjNaV0QwaUNRYW93VU9keVVpbmxXN21hNEhUY0QwTTVZTUMxR293amRFaHh4VGtBSmcxMDR2SlpuYWhZNmg4VHY1TTAxWTFTNUIyM01rRW1DZ0F1YjhLbVpUWlZzWWpzTkhCWmNEMXJneVpNMlM4Q1ZBZ3lwN1NuWWZ4LXZfMEhjTWx4MnNISA?oc=5&hl=en-US&gl=US&ceid=US:en,https://english.ratopati.com,Ratopati,"Kathmandu. Foreign Minister Shishir Khanal said that there is a problem in bringing the body of Santosh Rai, who died in Cambodia, to Nepal. Rai, 42, a resident of Dhunibeshi Municipality-9, Dhading, had gone to Cambodia illegally via India last August. However, he died on April 29 at Kalmet Hospital during treatment due to 'hemorrhagic stroke' cerebral hemorrhage.

The wife of the deceased, Junu Rai, had appealed for help, stating that the body could not be brought to Nepal due to poor economic condition and legal complications.

Regarding this matter, Ratopati had informed Foreign Minister Khanal. In response, he said that the body is being facilitated to be brought to Nepal through the Ministry of Foreign Affairs, but problems are arising because he went illegally.

'The Ministry of Foreign Affairs has been facilitating this since the day before yesterday. There is no separate fund in the Ministry of Foreign Affairs for such matters. If one had gone with a valid labor permit, it would have been covered by the Foreign Employment Fund. In the case of going illegally on a visit visa, the Government of Nepal does not have any fund arrangement yet. It is usually done with the help of the family or NRN, and help has been sought from NRN at the moment,' he said.

The family of the deceased is in further distress as Rai's body has been stranded in a Cambodian hospital for 6 days. The Nepali Embassy in Thailand, which also oversees Cambodia, stated that this incident occurred just as preparations were being made to send Rai back home on April 30, after getting a waiver for the 'overstay fine' from the Cambodian government for staying in Cambodia beyond his visa period.

The embassy had informed the Ministry of Foreign Affairs about this while he was ill.","{'https://npcdn.ratopati.com/media/news/malesia-flag_5CRA3WEgx9.png', 'https://npcdn.ratopati.com/media/news/rastriya-sava_mko6RI7tDr.jpg', 'https://npcdn.ratopati.com/media/news/yubaraj-dulal_cJ8O9I6QkT.jpg', 'https://npcdn.ratopati.com/media/news/samsad_coLE18tPo4.jpg', 'https://npcdn.ratopati.com/media/news/700943904_1516480266861940_5618226950054792020_n_l2yVFcPVnQ.jpg', 'https://npcdn.ratopati.com/media/news/shishir-khanal_IhU1JCO15O.jpg', 'https://npcdn.ratopati.com/media/news/rai-shantosh_nK4gXR2F4n.jpg', 'https://npcdn.ratopati.com/media/news/674695833_1853304465343092_3125691332860614111_n_VfVc3zgxJB.jpg', 'https://encdn.ratopati.com/media/setting/default-banner_2uD78e1iMP.jpg', 'https://english.ratopati.com/build/img/logo-rp.png', 'https://npcdn.ratopati.com/media/news/budget_aKDC5KTN28.jpg', 'https://npcdn.ratopati.com/media/news/akhtiyar-team-bises-adalat-(2)_b6GEHTJHdR.jpg', 'https://npcdn.ratopati.com/media/news/1779086469-3jfaz_3m6vFy7Ktp.jpg', 'https://npcdn.ratopati.com/media/news/balawati_57gIaoy20f.png', 'https://npcdn.ratopati.com/media/news/sansad-adalat_BXECWvTQik.jpg', 'https://npcdn.ratopati.com/media/authors/ratopati_science_RGmmSpmAnu.jpg'}","काठमांडू। विदेश मन्त्री शिशिर खनाल कम्बोडियामे मृत्यु भेल संतोष रायके शवके नेपाल अनबामे समस्या रहल बतौलनि । धादिङके धुनिबेशी नगरपालिका–९ निवासी ४२ वर्षीय राय विगत अगस्तमे भारत होइत अवैध तरीकासँ कम्बोडिया गेल छल । मुदा 29 अप्रैल कए ‘हेमरेजिक स्ट्रोक’ सेरेब्रल हेमरेज क कारण इलाज क दौरान कलमेट अस्पताल मे हुनकर मौत भ गेल।

मृतकक पत्नी जूनू राय आर्थिक स्थिति खराब आ कानूनी जटिलताक कारणेँ शव नेपाल नहि आनल जा सकल कहैत सहयोगक अपील केने छलीह ।

एहि मामला क संबंध मे रटोपति विदेश मंत्री खनाल कए जानकारी देने छलाह। जवाब मे ओ कहलनि जे, शव के विदेश मंत्रालय के माध्यम सं नेपाल आनय के सुविधा देल जा रहल अछि, मुदा अवैध तरीका सं गेला के कारण समस्या पैदा भ रहल अछि.

'विदेश मंत्रालय काल्हि सँ एक दिन पहिने सँ एहि मे सुविधा प्रदान क' रहल अछि।' विदेश मंत्रालय मे एहि तरहक मामला लेल अलग स कोनो कोष नहि अछि। जँ वैध श्रम परमिट ल' क' गेल रहैत त' विदेशी रोजगार कोष मे कवर भ' जाइत. विजिट वीजा पर अवैध तरीका स जेबाक मामला मे नेपाल सरकार लग एखन धरि कोनो फंड क व्यवस्था नहि अछि। ई आमतौर पर परिवार या एनआरएन के मदद स॑ करलऽ जाय छै, आरू फिलहाल एनआरएन स॑ मदद मँगलऽ गेलऽ छै ।'

मृतक के परिवार आओर परेशानी मे अछि किएक त राय के लाश 6 दिन सं कम्बोडिया के अस्पताल मे फंसल अछि. थाईलैंड मँ नेपाली दूतावास, जे कम्बोडिया के देखरेख भी करै छै, नँ कहलकै कि ई घटना ठीक वैसने घटित होलै जब॑ राय क॑ ३० अप्रैल क॑ घर वापस भेजै के तैयारी करलऽ जाय रहलऽ छै, जेकरा बाद कम्बोडिया सरकार स॑ हुनकऽ वीजा अवधि स॑ आगू रहला के कारण ‘ओवरस्टे जुर्माना’ के माफी मिललै ।

दूतावास एहि बातक जानकारी विदेश मंत्रालय के देने छल जखन कि ओ बीमार छलाह."
