title,description,published date,url,publisher.href,publisher.title,full_article,images,translated
"MPs demand probe into assets, NHRC report and human trafficking networks - Nepalnews.com","MPs demand probe into assets, NHRC report and human trafficking networks  Nepalnews.com",2026-05-18 06:24:40,https://news.google.com/rss/articles/CBMiswFBVV95cUxPMUxuWWpzMXJ1RWNOalFZVzVTWXVGYzhFRkRJd2tCcnZaV3JzMG5DRW5KUjlsUkRwdzhVa1JWMUwyN1puOU9HWVNpZm1zYldrelJScVlfNElnd1AtRENPN2NEZWZfOUFPTlNPSi11bzFPYUFBc3pBQnBVMUlyYndNeUNDY2lZTkQxYmpBZmdJekUyZFJNTnZ5eDVNVDhkYS1mWE9uTXNLNHVpRUJMWUswSFczQQ?oc=5&hl=en-US&gl=US&ceid=US:en,https://english.nepalnews.com,Nepalnews.com,,,
