title,description,published date,url,publisher.href,publisher.title,full_article,images,translated
Scotland bowled out for 194 as Nepal dominate bowling attack in ODI clash - Nepalnews.com,Scotland bowled out for 194 as Nepal dominate bowling attack in ODI clash  Nepalnews.com,2026-05-18 06:34:29,https://news.google.com/rss/articles/CBMiswFBVV95cUxOaGctTnY4OUJ3Y2w3aXhsaEFrSk9TMlpNY2ZQX0hQcElxaks0UWZxLXRFR1d5eGxhR3ZkOHJpekMxdW9pekw4Z2VsLUxMUWJFNzNnVlVXMHNLUmlGT01nOTBxdWl2QkRXMmtkbTJLU3NfRG1aYnNwZUh5YmxMRTAwd2J0U1JGdWFqOUpuamRmYUNfd21QLVgxalQ4aGFhVVRrUl93QmJWcFBndkUyTjQxNGtSTQ?oc=5&hl=en-US&gl=US&ceid=US:en,https://english.nepalnews.com,Nepalnews.com,,,
Drought insurance helps Nepal families survive food crisis - www.christiantoday.com,Drought insurance helps Nepal families survive food crisis  www.christiantoday.com,2026-05-18 06:42:29,https://news.google.com/rss/articles/CBMimgFBVV95cUxONzVTcFpycVRleC1IQXdDNHFQcldZQXZvSnZRaVlaalJ6dlpFd1ZPZXA1TlpSQ3M1Q2otMW1vTFlha2ZQeXdoSm9LR2lmcFIweEFVZU82SlZNMEF0T1BvNktNY1FyRVJ4eVQ0T1RQbEhyT0d4NGh6bjd1bFZPZWpDSm84MDdGbGtPM2xiNnNuMlZkcmcxZjZDMzJR?oc=5&hl=en-US&gl=US&ceid=US:en,https://www.christiantoday.com,www.christiantoday.com,"Women in Bajura queue to receive food staples brought through a ‘drought insurance’ payout to Tearfund. (Photo: Tearfund)

An innovative drought insurance scheme has provided emergency support to hundreds of vulnerable farming families in western Nepal, in what Christian relief organisation Tearfund says is a major step forward in protecting communities from climate-driven hunger before disaster fully sets in.

Tearfund announced that a $100,000 insurance payout had been triggered in Nepal’s Bajura district after severe drought conditions threatened crops and livelihoods across the region.

The scheme uses satellite technology to monitor soil moisture and water availability for crops. When rainfall and moisture levels reach critically low levels, funding is automatically released without the need for lengthy damage assessments.

Tearfund said the payout is believed to be the first of its kind in Nepal and forms part of a wider pilot programme exploring “anticipatory finance” - a growing humanitarian approach aimed at releasing aid before a situation escalates.

Tearfund and its local partner, International Nepal Fellowship, provided food assistance to 671 households and dispensed drought-resistant vegetable seeds, farming tools and agricultural training to 405 people, most of them women.

Water collection tanks for small-scale irrigation were also installed for 176 households. Families facing acute food shortages received emergency supplies including rice, lentils, oil and salt.

Among those supported was 59-year-old blacksmith and farmer Bune Sunar, whose crops were devastated after flooding last summer was followed by severe drought during the winter months.

“In my whole life, I have never seen this much food in my house at one time,” he said after receiving assistance.

Sunar said his family had previously relied on modest harvests of wheat, millet and rice to survive for several months each year.

However, failed crops and worsening drought had reduced that security to just a single month’s supply of food this year.

Alongside farming, he supports his family of 11 by crafting farming tools and kitchen utensils, sometimes receiving grain instead of money as payment.

Pranaya Pandey Chhetri, Tearfund’s Country Director for Nepal, said climate-related disasters were making farming increasingly unpredictable across Asia and placing growing pressure on already vulnerable communities.

“The gap between the cost of global disasters and the finance available to respond to their impact is growing,” he said.

He added that access to insurance and emergency financial protection could help families avoid falling deeper into poverty by enabling them to protect assets, adapt livelihoods and respond more quickly to failed harvests.

“This insurance innovation brings vital finance to support those on the front lines of the climate crisis,” he remarked. “This payout is helping people keep hope alive through a desperate food shortage.”

The payout was arranged through a parametric insurance product developed by Global Parametrics, part of the CelsiusPro Group, and supported through funding from Humanity Insured, a UK-registered charity aided by the insurance sector.

The wider risk financing initiative is supported by the UK Foreign, Commonwealth and Development Office, alongside Germany’s development bank KfW.

Chief executive of CelsiusPro Group Mark Rüegg said “fast, pre-arranged financial aid” could play an important role in helping climate-vulnerable communities develop resilience against increasingly severe weather events.

He said the Nepal payout demonstrated how satellite-based insurance systems could deliver fast and practical support to families facing food insecurity and economic hardship.

Tearfund warned that countries such as Nepal are becoming more vulnerable to alternating cycles of floods and drought linked to climate change, with rural farming communities often among the hardest hit.","{'https://www.christiantoday.com/media/cache/img/9/88/98843sp_109w_62h_373x_236y.png', 'https://deal-media.christianpost.com/media/original/thumbnail/1/75/17584.jpg', 'https://www.christiantoday.com/media/cache/img/9/13/91392sp_109w_62h_49x_63y.jpg', 'https://www.christiantoday.com/media/cache/thumbnail/14/49/144928sp_109w_62h_1x_1y.jpg', 'https://www.christiantoday.com/media/cache/img/9/80/98078sp_109w_62h_448x_368y.jpg', 'https://deal-media.christianpost.com/media/original/thumbnail/2/84/28442.jpg', 'https://www.christiantoday.com/media/cache/img/9/87/98788sp_109w_62h_353x_289y.jpg', 'https://www.christiantoday.com/media/cache/thumbnail/14/49/144932sp_109w_62h_1x_1y.png', 'https://www.christiantoday.com/media/cache/img/9/88/98852sp_385w_217h_608x_316y.jpeg', 'https://deal-media.christianpost.com/media/original/thumbnail/1/93/19364.jpg', 'https://www.christiantoday.com/media/cache/thumbnail/14/49/144953sp_287w_162h_1x_1y.jpeg', 'https://www.christiantoday.com/media/original/thumbnail/14/49/144953.jpeg', 'https://www.christiantoday.com/media/cache/thumbnail/14/49/144923sp_109w_62h_1x_1y.png', 'https://www.christiantoday.com/media/cache/thumbnail/14/49/144926sp_109w_62h_1x_1y.jpg', 'https://www.christiantoday.com/media/cache/thumbnail/14/49/144952sp_287w_162h_1x_1y.jpg', 'https://deal-media.christianpost.com/media/original/thumbnail/2/81/28137.jpg', 'https://www.christiantoday.com/media/cache/thumbnail/14/49/144940sp_109w_62h_1x_1y.jpg', 'https://deal-media.christianpost.com/media/original/thumbnail/2/39/23906.jpg', 'https://deal-media.christianpost.com/media/original/thumbnail/2/18/21876.png', 'https://deal-media.christianpost.com/media/original/thumbnail/2/84/28422.jpg', 'https://www.christiantoday.com/media/cache/thumbnail/14/49/144951sp_287w_162h_1x_1y.png', 'https://www.christiantoday.com/media/cache/thumbnail/14/49/144929sp_287w_162h_1x_1y.png', 'https://www.christiantoday.com/media/cache/thumbnail/14/49/144948sp_109w_62h_1x_1y.jpg', 'https://deal-media.christianpost.com/media/original/thumbnail/2/53/25304.jpg', 'https://www.christiantoday.com/assets/images/icon/CT_logo.svg', 'https://deal-media.christianpost.com/media/original/thumbnail/2/81/28100.jpg', 'https://deal-media.christianpost.com/media/original/thumbnail/2/56/25679.jpg'}","बाजुरा मे महिला टीयरफंड कें ‘सूखा बीमा’ भुगतान कें माध्यम सं आनल गेल खाद्य स्टेपल प्राप्त करय कें लेल कतार मे लगय छै. (फोटो: टीयरफंड)

एक अभिनव सूखा बीमा योजना न॑ पश्चिमी नेपाल केरऽ सैकड़ों कमजोर किसान परिवारऽ क॑ आपातकालीन सहायता प्रदान करलकै, जेकरा म॑ ईसाई राहत संगठन टीयरफंड के कहना छै कि आपदा पूरा तरह स॑ शुरू होय स॑ पहल॑ समुदायऽ क॑ जलवायु संचालित भूख स॑ बचाबै म॑ एगो बड़ऽ कदम छै ।

टीयरफंड न॑ घोषणा करलकै कि नेपाल केरऽ बाजुरा जिला म॑ भयंकर सूखा के कारण पूरा क्षेत्र म॑ फसल आरू आजीविका प॑ खतरा मंडराबै के बाद एक लाख डॉलर के बीमा भुगतान शुरू करलऽ गेलऽ छै ।

इ योजना मे उपग्रह तकनीक कें उपयोग फसलक कें लेल मिट्टी कें नमी आ पानी कें उपलब्धता कें निगरानी कें लेल कैल जायत छै. जखन वर्षा आ नमी कें स्तर गंभीर रूप सं कम स्तर पर पहुंच जायत छै, तखन बिना लंबा नुकसान कें आकलन कें आवश्यकता कें बिना फंडिंग स्वचालित रूप सं जारी भ जायत छै.

टीयरफंड नँ कहलकै कि ई भुगतान नेपाल मँ अपनौ तरह के पहिलौ भुगतान मानलौ जाय रहलौ छै आरू ई “प्रत्याशित वित्त” के खोज करै वाला एगो व्यापक पायलट कार्यक्रम के हिस्सा छेकै - जे बढ़तौ मानवीय दृष्टिकोण छै जेकरौ उद्देश्य कोनो स्थिति बढ़ै स॑ पहल॑ सहायता जारी करना छै ।

टीयरफंड आ ओकर स्थानीय सहयोगी इन्टरनेशनल नेपाल फेलोशिप ६७१ घरके खाद्य सहायता प्रदान केलक आ ४०५ गोटेके सूखा प्रतिरोधी सब्जीक बीज, खेतीके औजार आ कृषि प्रशिक्षण वितरण केलक, जाहिमे अधिकांश महिला रहल अछि ।

176 घर क लेल छोट-छोट सिंचाई क लेल जल संग्रहण टंकी सेहो लगाउल गेल। तीव्र भोजन के कमी के सामना करय वाला परिवार के चावल, मसूर, तेल आ नमक सहित आपातकालीन आपूर्ति भेटल.

समर्थन प्राप्त करय वाला मे 59 वर्षीय लोहार आ किसान बुने सुनार सेहो शामिल छलाह, जिनकर फसल पिछला गर्मी मे बाढ़ि के बाद जाड़ के महीना मे भयंकर सूखा के बाद तबाह भ गेल छल.

सहायता भेटलाक बाद ओ कहलनि जे, पूरा जीवन मे हम अपन घर मे एतेक भोजन एक समय मे नहि देखलहुं।

सुनर कहलनि जे, हुनकर परिवार पहिने हर साल कई महीना तक जीबय लेल गहूम, बाजरा आ चाउर के मामूली फसल पर निर्भर छल।

मुदा असफल फसल आ बिगड़ैत सूखा के कारण ओ सुरक्षा एहि साल मात्र एक महीना के भोजन के आपूर्ति भ गेल छल.

खेती के संग-संग खेती के औजार आ भनसा घर के बर्तन बना क अपन 11 गोटे के परिवार के भरण-पोषण करैत छथि, कखनो काल भुगतान के रूप में पाइ के जगह अनाज सेहो भेटैत छनि।

टीयरफंड केरऽ नेपाल केरऽ देश निदेशक प्राणाया पाण्डेय क्षेत्री न॑ कहलकै कि जलवायु स॑ जुड़लऽ आपदा स॑ पूरा एशिया म॑ खेती क॑ तेजी स॑ अप्रत्याशित होय रहलऽ छै आरू पहल॑ स॑ ही कमजोर समुदाय प॑ बढ़त॑ दबाव पड़॑ लगलऽ छै ।

ओ कहला जे वैश्विक आपदा क लागत आ ओकर प्रभाव क जवाब देबा लेल उपलब्ध वित्त क बीच अंतर बढ़ि रहल अछि।

हुनी आरू कहलकै कि बीमा आरू आपातकालीन वित्तीय सुरक्षा के पहुँच स॑ परिवारऽ क॑ संपत्ति के सुरक्षा, आजीविका के अनुकूलन आरू असफल फसल के प्रति जल्दी जवाब दै म॑ सक्षम बनाबै स॑ गरीबी म॑ गहराई स॑ नै पड़ै म॑ मदद मिल॑ सकै छै ।

हुनी टिप्पणी करलकै कि ई बीमा नवाचार जलवायु संकट के फ्रंट लाइन प मौजूद लोगौ क सहायता लेली महत्वपूर्ण वित्त लानै छै । “ई भुगतान लोगऽ क॑ भोजन केरऽ हताश कमी के माध्यम स॑ आशा क॑ जिंदा रखै म॑ मदद करी रहलऽ छै ।”

ई भुगतान के व्यवस्था सेल्सियसप्रो ग्रुप केरऽ हिस्सा ग्लोबल पैरामेट्रिक्स द्वारा विकसित पैरामेट्रिक बीमा उत्पाद के माध्यम स॑ करलऽ गेलऽ छेलै आरू बीमा क्षेत्र केरऽ सहायता स॑ यूके म॑ पंजीकृत चैरिटी ह्यूमैनिटी इंश्योरेंड केरऽ फंडिंग के माध्यम स॑ समर्थन करलऽ गेलऽ छेलै ।

व्यापक जोखिम वित्तपोषण पहल कें समर्थन जर्मनी कें विकास बैंक केएफडब्ल्यू कें साथ-साथ यूके कें विदेश, राष्ट्रमंडल आ विकास कार्यालय कें द्वारा कैल जायत छै.

सेल्सियसप्रो ग्रुप केरऽ मुख्य कार्यकारी मार्क रुएग न॑ कहलकै कि “तेजी स॑, पूर्व-व्यवस्थित वित्तीय सहायता” जलवायु के प्रति कमजोर समुदायऽ क॑ बढ़त॑-बढ़त॑ गंभीर मौसमी घटना के खिलाफ लचीलापन विकसित करै म॑ मदद करै म॑ महत्वपूर्ण भूमिका निभा सकै छै ।

ओ कहला जे नेपालक भुगतान स इ दर्शाउल गेल जे कोना उपग्रह आधारित बीमा प्रणाली खाद्य असुरक्षा आ आर्थिक कष्ट क सामना करय वाला परिवार कए तेजी स आ व्यावहारिक सहयोग द सकैत अछि।

टीयरफंड न॑ चेतावनी देल॑ छै कि नेपाल जैसनऽ देश जलवायु परिवर्तन स॑ जुड़लऽ बाढ़ आरू सूखा केरऽ बारी-बारी स॑ चक्र के शिकार होय रहलऽ छै, जेकरा म॑ ग्रामीण किसान समुदाय अक्सर सबसें जादा प्रभावित होय वाला छै ।"
Nepal’s spinners trigger Scotland collapse to restrict visitors to 194 - The Kathmandu Post,Nepal’s spinners trigger Scotland collapse to restrict visitors to 194  The Kathmandu Post,2026-05-18 06:51:50,https://news.google.com/rss/articles/CBMitgFBVV95cUxOM2pmZU1yVXFiQVZDUmtWcl9fa053Z09jeDJrVmMxTEJVY2VVQm1EYnhOWTIwb29fUW4teVF1dS1IVFhpVnF0cnVmSFZWbTVaVHJ4dWNuc1pOTEppQ1htNnF5dUJWRHBTQ1NDY2xBYkF0c3hmWHNrNGdRNmF4ZjRVWVhWdzJFQVNKYk9kaXNVSXdteXVGSUFIdXRMV3NzYUtBcGtqOFpWU2o1Qi0wNGc0NDZabUFGUQ?oc=5&hl=en-US&gl=US&ceid=US:en,https://kathmandupost.com,The Kathmandu Post,"Scotland were bowled out for 194 in 39.1 overs after a volatile innings in the ICC Men's Cricket World Cup League 2 match at the TU cricket ground on Monday.

The visitors started steadily, after electing to bat first, through George Munsey, who struck 21 off 31 balls, but Nepal broke early when Finlay McCreath was trapped lbw by Dipendra Singh Airee. Munsey followed soon after, dismissed by Sandeep Lamichhane.

The innings briefly accelerated through Brandon McMullen, who produced the defining knock of the innings. He scored 73 off 44 balls with six fours and six sixes, driving Scotland past the 100-mark quickly. His counterattack lifted Scotland to 126 for 4, giving them a platform for a stronger finish. However, his dismissal marked the turning point of the innings.

Richie Berrington fell earlier for 12, while Michael English anchored one end with a composed 51 off 72 balls. Despite his effort, Scotland failed to build long partnerships around him. Matthew Cross and Michael Leask were dismissed cheaply, both falling to the growing pressure created by Nepal’s spinners.

The middle and lower orders then unravelled quickly. Lalit Rajbanshi was the standout bowler, taking four wickets with his left-arm spin and breaking the backbone of the innings. He removed Leask, Davidson and Jones, while also accounting for key breakthroughs in the middle phase. Lamichhane added three wickets, including Munsey and Cross, tightening Nepal’s grip.

Support from Sompal Kami and others ensured Scotland never recovered after reaching 150. Wickets fell regularly in the final 10 overs, with Mark Watt’s 20 providing brief resistance before Rajbanshi and Lamichhane closed out the tail.

Scotland lost their last five wickets for just 15 runs, slipping from a competitive position to a modest total of 194.","{'https://assets-cdn.kathmandupost.com/uploads/source/news/2026/sports/701342011273036445659098478377946299369919344n-1779087019.jpg', 'https://openweathermap.org/img/w/04d.png', 'https://jcss-cdn.kathmandupost.com/assets/images/lazy.png', 'https://jcss-cdn.kathmandupost.com/assets/images/logos/thekathmandupost-logo-white.png', 'https://jcss-cdn.kathmandupost.com/assets/images/logo-sticky-bar-tkp-weekender-1.png', 'https://jcss-cdn.kathmandupost.com/assets/images/tkp-logo-weekender.png', 'https://jcss-cdn.kathmandupost.com/assets/images/logos/thekathmandupost-logo.png'}","सोमदिन टीयू क्रिकेट मैदान मे आईसीसी पुरुष क्रिकेट विश्व कप लीग २ के मैच मे अस्थिर पारी के बाद स्कॉटलैंड ३९.१ ओवर मे १९४ रन पर आउट भ गेल छल ।

मेहमान टीम न॑ लगातार शुरुआत करलकै, पहल॑ बल्लेबाजी करै के फैसला करला के बाद, जॉर्ज मुनसे के माध्यम स॑, जेकरा न॑ ३१ गेंद प॑ २१ रन बनैलकै, लेकिन नेपाल न॑ जल्दी टूटी गेलै जब॑ फिनले मैकक्रीथ क॑ दीपेन्द्र सिंह ऐरी न॑ एलबीडब्ल्यू म॑ फंसलऽ छेलै । एकरऽ तुरंत बाद मुनसे क॑ संदीप लामिछाने न॑ बर्खास्त करी देलकै ।

ब्रैंडन मैकमुलेन के माध्यम स॑ पारी म॑ कुछ समय लेली तेजी आबी गेलै, जेकरा न॑ पारी केरऽ परिभाषित दस्तक पैदा करलकै । हुनी ४४ गेंद प॑ ६ चौका आरू ६ छक्का के साथ ७३ रन बनैलकै, जेकरा स॑ स्कॉटलैंड क॑ १०० के निशान स॑ जल्दी पार करी देलकै । हुनकऽ जवाबी हमला न॑ स्कॉटलैंड क॑ ४ विकेट प॑ १२६ रन प॑ पहुँचाय देलकै, जेकरा स॑ ओकरा मजबूत फिनिश के मंच मिललै । ओना हुनकर आउट भेला स पारी क मोड़ आबि गेल।

रिची बेरिंगटन पहिने 12 रन पर गिर गेल छलाह, जखन कि माइकल इंग्लिश 72 गेंद पर कंपोज 51 रन बना कए एक छोर लंगर लगेलथि। हुनकऽ प्रयास के बावजूद स्कॉटलैंड हुनकऽ आसपास लंबा साझेदारी नै बनाबै म॑ विफल रहलै । मैथ्यू क्रॉस आरू माइकल लीस्क क॑ सस्ता म॑ आउट करलऽ गेलै, जेकरा म॑ दोनों नेपाल केरऽ स्पिनरऽ के बढ़तऽ दबाव म॑ गिरी गेलै ।

तखन मध्यम आ निचला क्रम जल्दीए खुलि गेल। ललित राजबंशी स्टैंडआउट गेंदबाज रहलाह, जे अपन बामा हाथक स्पिन सं चारि विकेट लैत पारी के रीढ़ तोड़ि देलनि. ओ लीस्क, डेविडसन आ जोन्स कए हटा देलथि, जखन कि मध्य चरण मे प्रमुख सफलता क हिसाब सेहो देलथि । लामिछाने न॑ मुनसे आरू क्रॉस सहित तीन विकेट जोड़लकै, जेकरा स॑ नेपाल केरऽ पकड़ कड़ा होय गेलै ।

सोम्पल कामी आरू अन्य केरऽ सहयोग स॑ ई सुनिश्चित होय गेलै कि स्कॉटलैंड १५० रन प॑ पहुँचला के बाद कहियो ठीक नै होय सकलै ।अंतिम १० ओवर म॑ विकेट नियमित रूप स॑ गिरी गेलै, जेकरा म॑ मार्क वाट केरऽ २० रन स॑ कुछ देर लेली प्रतिरोध करलऽ गेलै आरू ओकरा बाद राजबंशी आरू लामिछाने न॑ पूंछ बंद करी देलकै ।

स्कॉटलैंड न॑ अपनऽ आखिरी पाँच विकेट महज १५ रन स॑ गंवाय क॑ प्रतिस्पर्धी स्थिति स॑ फिसल क॑ मामूली कुल १९४ रन बनैलकै ।"
