title,description,published date,url,publisher.href,publisher.title,full_article,images,translated
Embassy of Nepal and PHDCCI India-Nepal Centre organize “India-Nepal Economic Cooperation Meet 2025” in Bhopal - Khabarhub,Embassy of Nepal and PHDCCI India-Nepal Centre organize “India-Nepal Economic Cooperation Meet 2025” in Bhopal  Khabarhub,2025-07-15 07:24:48,https://news.google.com/rss/articles/CBMiWEFVX3lxTE5fNGNDVERrbExpckIxLW9lNzRYS0QtN3F4WG5GV2l3aVFEWXBsd1lrWjlHYnh0M25Xbk1kaTlneU1CMC14X1d3Q3YxVl8yUGxxeWsxUFlTSUg?oc=5&hl=en-US&gl=US&ceid=US:en,https://english.khabarhub.com,Khabarhub,,{'https://lh3.googleusercontent.com/J6_coFbogxhRI9iM864NL_liGXvsQp2AupsKei7z0cNNfDvGUmWUy20nuUhkREQyrpY4bEeIBuc=s0-w300'},
Leadership or hypnosis? Welcome to Nepali politics - Onlinekhabar English,Leadership or hypnosis? Welcome to Nepali politics  Onlinekhabar English,2025-07-15 07:31:44,https://news.google.com/rss/articles/CBMikAFBVV95cUxOYVMtU1RIRzFfNGhqRnpBbUFTdFNyRWJVSXcyTnE1djdRTjlBQ2hmU2pjcmdFQkM0NFhQZ1lzZ3lYanVodktoZU1MNk01RDR1S0hHNmNPSG1QMVJ5dmVkT1ZMYnhPanByMjgtQnFYRXZ2UGtpcmM3WTVucXJVYjNRWlBVLVVMTXgtSXQtZm5xdmU?oc=5&hl=en-US&gl=US&ceid=US:en,https://english.onlinekhabar.com,Onlinekhabar English,,{'https://lh3.googleusercontent.com/J6_coFbogxhRI9iM864NL_liGXvsQp2AupsKei7z0cNNfDvGUmWUy20nuUhkREQyrpY4bEeIBuc=s0-w300'},
Reliance Consumer launches Campa in Nepal; partners with Chaudhary Group - ET Retail,Reliance Consumer launches Campa in Nepal; partners with Chaudhary Group  ET Retail,2025-07-15 07:36:27,https://news.google.com/rss/articles/CBMijgJBVV95cUxQVDM5ZHB4WHJNUGh1Y09LS1VNOWpQdDdfRWQ1cENWS2QyNzFFTXRQT2Z1R1FvZHdrbEdROWZ0NmhMN2IzQjFoVWtSREJkbG1kWGJBLU00Qkh3MjhZRzcyOUtvMzlXcGgyaUNOWkFwNHRzenZ5c0FGdUhHdDhZeEVRaFJ5dXNnOFFhTkRWd1lERk1aSnZPbDROWjVqNzI5WVZKQktPRlZLenVYTXdCUjNaNHFBV2xtWHZheW04ZTdBVlA2NUFtdGRjYm5iYjNvYkk5M0daZzc3Smk2ZjJ2X0x0alU1c0k4TFBPYURHRHE2aXNfUjVFM243aFE0UDZ6clhYYmdVbVJMRGtXenUyelHSAZMCQVVfeXFMUEozWUlqR081MFVZT1VRWW5XZUZhSV9IT3FSWVdCdnZQc1lLYnpoTkNvWFM4OU5pZVhsY002R3R5RjZ2eUpmVUViN3F0V25mczJ6clU0eG92T0xrYTlpWWtsQ1pNbjRoODcxUllycUowdnEtQ3lEdGZZSWpxSzNXQmVwbm5rTVpkSjBvTWkxVDg2RDVqc1lYRXVDZ3Ywb2VHdm1wTzZjVUtpOHFXa2hLMEpCbE96dVFwY0FtazZtSHRDQ3JVbzRUamJvZS15Z3FHMURIMGZOTUsyVkItb2FEZ0V4WTZCbGNXeGtZc3FQejFQa1BFX241MW1UVU95MTk3UXVCZXdSTDl2ODZwWnBJelNPMTg?oc=5&hl=en-US&gl=US&ceid=US:en,https://retail.economictimes.indiatimes.com,ET Retail,,{'https://lh3.googleusercontent.com/J6_coFbogxhRI9iM864NL_liGXvsQp2AupsKei7z0cNNfDvGUmWUy20nuUhkREQyrpY4bEeIBuc=s0-w300'},
NEPAL: Students focus on clean environment initiative - MissionNewswire,NEPAL: Students focus on clean environment initiative  MissionNewswire,2025-07-15 08:22:27,https://news.google.com/rss/articles/CBMiiAFBVV95cUxNUGZjRnBZVW1aRVJzWmlCNzNUa1ZoWm1FT0ZDY3cxUGR5M3Nkd1VoUWZSbnNKMmNSSHBSdTRTZUkyZTFZSVZ4U1I1enRIeTdEbnNZb00tU21YOWdOaDU0bm95N1Q2OGFFaE9yWV9sVzRRYkZQNFNGbjVQZm5oTVZCdUpDTEpZNEJF?oc=5&hl=en-US&gl=US&ceid=US:en,https://missionnewswire.org,MissionNewswire,,{'https://lh3.googleusercontent.com/J6_coFbogxhRI9iM864NL_liGXvsQp2AupsKei7z0cNNfDvGUmWUy20nuUhkREQyrpY4bEeIBuc=s0-w300'},
All districts across Nepal declared fully immunized - myRepublica,All districts across Nepal declared fully immunized  myRepublica,2025-07-15 08:39:28,https://news.google.com/rss/articles/CBMiqgFBVV95cUxQdFJQdVpackZYeDVCYkdoajVBYVRSZ24wbGZ2cld0bWVHQXB0aE9uUlpaZ25VR0RhZGxlbktWd0gtYXZlZVlEOHF5X1loWWI1M2R6N2c4bUdJLU1wWU1FaUdmNWdGSXZMckcwNGZFNnFsaHpIdWF1czZGOXcxSGtReUswdi1rd3ZQMER0dFY5ZHlJWTlTSWFlTzBZUENNcWZhaUFlei00cTBlUQ?oc=5&hl=en-US&gl=US&ceid=US:en,https://myrepublica.nagariknetwork.com,myRepublica,,{'https://lh3.googleusercontent.com/J6_coFbogxhRI9iM864NL_liGXvsQp2AupsKei7z0cNNfDvGUmWUy20nuUhkREQyrpY4bEeIBuc=s0-w300'},
Poet Gyanu ‘Walker’ Poudyal says Nepal is turning into an aged-care institution! - SBS Australia,Poet Gyanu ‘Walker’ Poudyal says Nepal is turning into an aged-care institution!  SBS Australia,2025-07-15 09:17:06,https://news.google.com/rss/articles/CBMi3gFBVV95cUxNRjg1NTl2VndoR1VDRzFzNlNYWEJpdWNkVmZLT1R0bTY4SXVONWo5MmdZZEtsNzY2MTdaV2V5WWpqNy11ZF9remx3M0xxWlZfWkJHOGs5bEJBdlBvLXp1SmpUUHdZZS00TENpa2tsRF8yS1p3NTY4cEVJNTQxOE1nUWcxcGxQUDJ1MHpYcGVMb05Iamo0S3VoNE4wV1k0ZE51bWR3Qnp4Yi1Qc3RKbXFFZUFVMFlndFFTTXA4c1Ftc1FaSWQxUTZGNlJlZmRaWHJsNURTQXRiX2pPTmlreVE?oc=5&hl=en-US&gl=US&ceid=US:en,https://www.sbs.com.au,SBS Australia,,{'https://lh3.googleusercontent.com/J6_coFbogxhRI9iM864NL_liGXvsQp2AupsKei7z0cNNfDvGUmWUy20nuUhkREQyrpY4bEeIBuc=s0-w300'},
Breaking Barriers: Rethinking Capacity Building for Climate Resilience in Nepal - The Himalayan Times,Breaking Barriers: Rethinking Capacity Building for Climate Resilience in Nepal  The Himalayan Times,2025-07-15 10:07:30,https://news.google.com/rss/articles/CBMitwFBVV95cUxPY2dMWndjektOekJaYk93dnYyUUZMM29aUnU1Y3RHUS0yamNnYkxoMWF5ZXpZa0dqZDRXeGpiMmM3WURuMVZ3ZU5Xc3dFbERhb2ZqNWtGbm1xMEtFaVZ0azJTVHFXOHRxMWtEN2RPR0hsX1QtX3BSczBRTUpMNnJvVTBINXVWdE1NUTNJUm9DZnRmN3ZSNk5CWXp3S2NEUVA3ZU1RT093LWJJRzljOVVndERrWjduV3c?oc=5&hl=en-US&gl=US&ceid=US:en,https://thehimalayantimes.com,The Himalayan Times,,{'https://lh3.googleusercontent.com/J6_coFbogxhRI9iM864NL_liGXvsQp2AupsKei7z0cNNfDvGUmWUy20nuUhkREQyrpY4bEeIBuc=s0-w300'},
Yangdup Lama’s new bar in Kathmandu is a toast to Nepal’s emerging cocktail scene - Condé Nast Traveller India,Yangdup Lama’s new bar in Kathmandu is a toast to Nepal’s emerging cocktail scene  Condé Nast Traveller India,2025-07-15 11:05:55,https://news.google.com/rss/articles/CBMiswFBVV95cUxPZkNLS1BKdEg1bVg3TmNzbG01SkJ3RTNPRjJPcTVTNlNpdXVnbnBYUVFCajV0UGVTY0NzdWxEMTYwVWx5QWxvMkxKaU54R2pQUVh1SHh5bzVtMDBQTzNYTlllNUFaSEhlcUFSbkVJcFRNY0RoZWJEUEN5NUFoQzJLVVpvOTl5QzRCOTlXczdTakdfYjZ6dURxRnVBcHlILTlick1lNzBKQTRxb0w2dk53YkFtdw?oc=5&hl=en-US&gl=US&ceid=US:en,https://www.cntraveller.in,Condé Nast Traveller India,,{'https://lh3.googleusercontent.com/J6_coFbogxhRI9iM864NL_liGXvsQp2AupsKei7z0cNNfDvGUmWUy20nuUhkREQyrpY4bEeIBuc=s0-w300'},
Nepali man found murdered in Shimla’s Theog - Tribune India,Nepali man found murdered in Shimla’s Theog  Tribune India,2025-07-15 11:36:57,https://news.google.com/rss/articles/CBMijwFBVV95cUxNNmlZNGVfQnFZSWhqR3lyc0YzQURkVVQ1QzNiT05tSEx2MG94T19jeUhsRU5xSEROMzJvb3M5WW8teGlNXzBKQXV2T1pqNHRoT3ZpeFM4aTdycF90VWFVc0UzU2pWUHBwZXpwOGxXMUpnRldkREVSTTI2RExJQ2ZLQU5ZLVcyQ0ducXZhUGh5WdIBkwFBVV95cUxOZkRhbEFqU3E5OWhwTUJTc2NBTjZEX2wtTHRZTjNsZWk5WkJWZzE1ekwycEgxZjUwX2VSN081LXBnLTJjRFRVV2tBSXMwS3JXMWJCaXBaN0lKUEVUSVZTSDdsNHBuYUowdms2TmlHWGVXdEpLcUFYdDBhdUMtNnFmU2p3akkwLTZnUDdUUUlJT082cFE?oc=5&hl=en-US&gl=US&ceid=US:en,https://www.tribuneindia.com,Tribune India,,{'https://lh3.googleusercontent.com/J6_coFbogxhRI9iM864NL_liGXvsQp2AupsKei7z0cNNfDvGUmWUy20nuUhkREQyrpY4bEeIBuc=s0-w300'},
"Sri Lanka vs Nepal LIVE Streaming info: When, where to watch SAFF U-20 Women’s Championship? - Sportstar","Sri Lanka vs Nepal LIVE Streaming info: When, where to watch SAFF U-20 Women’s Championship?  Sportstar",2025-07-15 11:43:21,https://news.google.com/rss/articles/CBMi3gFBVV95cUxQdUFoNUdlUktuUmwwenF5cm1PNDBaMkJQX2cwaUVpMjlfaTByTEVEcllkZVFLYWxORGRia1dNVUpkQVdnWlhDcGJUWE5JYWtxaWtxVVVnUnp3dXJEdkVheW1CUVZmcTh6Yzl3VWp6d093Q2JLUW5raG1uVGZWektfREVlc0JYOFVHMFJYTjRBeVpTcF9wS3VwRUItclpWM3ZCLWZPSXVMbmlOdlhqWk1jTno3aUpXa25HckljOS1EX19qSjA4YUI0MC05Qm1KaUxJcl9nYlNLN2N6NWNBRnfSAeQBQVVfeXFMT0syTVNNNy1xc1duaHpuSlRHcnplTk1rRFl2dWRFbUZlTUpxZTFwZDFnaTZudnk0aDUwaDN2amJ3cjVYa2x6S3dmNFkwRnFfRTNkLUpGYlZuZEFwdWNiYmVnNTRnUmVHOFNhb3NqY01vaVJzTDFZeVFCQjdTZ1UwMEswOEFvaEc2Zm9DWENDRU1jYTFaWEpiRjJSX25RSWRoeWtPRXZKTnhQclpMSVNDMTNEdXF0ZmxWTy1YaXBpVTRFT2lCbzVfNmhWWmhmeHhsbFA1eWIwTU5sUm1CUldHZ3h0bDJZ?oc=5&hl=en-US&gl=US&ceid=US:en,https://sportstar.thehindu.com,Sportstar,,{'https://lh3.googleusercontent.com/J6_coFbogxhRI9iM864NL_liGXvsQp2AupsKei7z0cNNfDvGUmWUy20nuUhkREQyrpY4bEeIBuc=s0-w300'},
Trekking in Nepal in September - Vocal,Trekking in Nepal in September  Vocal,2025-07-15 12:03:07,https://news.google.com/rss/articles/CBMiakFVX3lxTFAwRWZNSnl2eFNjV1NZVnZWYjFtSUJuTjFDRVpybWZHTjh5bHctRmhTRmZMOEVHMERtSk9aRGlrMXdOaEl1UElVSDN6UFY0ZFdyTzFwbnplVmZ2NWR3b0NFc2p1MTFRU1d2OVE?oc=5&hl=en-US&gl=US&ceid=US:en,https://vocal.media,Vocal,,{'https://lh3.googleusercontent.com/J6_coFbogxhRI9iM864NL_liGXvsQp2AupsKei7z0cNNfDvGUmWUy20nuUhkREQyrpY4bEeIBuc=s0-w300'},
Government appoints Sebantak Pokharel as acting chair of Nepal Insurance Authority - The Kathmandu Post,Government appoints Sebantak Pokharel as acting chair of Nepal Insurance Authority  The Kathmandu Post,2025-07-15 12:15:15,https://news.google.com/rss/articles/CBMiwwFBVV95cUxNMEMxWW1WM1R2QnFsYS1WU3g4ZkdiMXIzX1Zxc3czMUs2VUh1XzdIRDE0ZzlRTGZ1VzlBcC1aaGpIeHpvNmlUSW9UZUJ5OEpBSG9mWjRmN3pyeFhXaVJIQkUxc0VjUThiUVFLSUxuZVBkRERMdmtlS0xla3U2SHlGbldjbExlTnllcUJGcUkyS2pjQmYxNkM5NHMzVVRQaTJ2SjRySVIzcGNKRUFyWFA0dHNDbFZzeVVKX2kyWFNKQVNXU3M?oc=5&hl=en-US&gl=US&ceid=US:en,https://kathmandupost.com,The Kathmandu Post,,{'https://lh3.googleusercontent.com/J6_coFbogxhRI9iM864NL_liGXvsQp2AupsKei7z0cNNfDvGUmWUy20nuUhkREQyrpY4bEeIBuc=s0-w300'},
MoHP and WHO engage medical colleges and private clinical practitioners to strengthen immunization and surveillance in urban cities of Nepal - World Health Organization (WHO),MoHP and WHO engage medical colleges and private clinical practitioners to strengthen immunization and surveillance in urban cities of Nepal  World Health Organization (WHO),2025-07-15 12:33:44,https://news.google.com/rss/articles/CBMimAJBVV95cUxNQVpGblE3b05qSVZDS2tvRVZFbFpVREVzWEdpY0pYSWZIOHZydzFGTWRla3BEOWdjVmY1dXVJQ1owU2V3ZlJXT0Jrb3E5bXljU3I1Sl96UmxzQ0lBaFJYZkFhVjFreV9TNVhubHJDRzl6aUMtNk9QNEVjaTd2T1RySVk2UFlEWGxFQjgwbW93eElLTjZvX19LTHhrOUxxbkVWS2ZSeHVWVFV3WGFDQVRYSVI3dUN2YW5zSVZ1RjhMVWJsN0h4c25jUWZzZ1lBMzFMQ0hmb0RqQ2ljOWFHcWg1NHRiLVRieDNqT2x1NlFsOTFGekhQaTZhaW5CQnZtb0J1M0tjYTA1S0FnbkRUMW5lbDBaMVJjOHlt?oc=5&hl=en-US&gl=US&ceid=US:en,https://www.who.int,World Health Organization (WHO),,{'https://lh3.googleusercontent.com/J6_coFbogxhRI9iM864NL_liGXvsQp2AupsKei7z0cNNfDvGUmWUy20nuUhkREQyrpY4bEeIBuc=s0-w300'},
Post Distribution Monitoring Survey Report of Nepal Flood and Landslide Response 2024 - Final Report (April 2025) - ReliefWeb,Post Distribution Monitoring Survey Report of Nepal Flood and Landslide Response 2024 - Final Report (April 2025)  ReliefWeb,2025-07-15 13:12:15,https://news.google.com/rss/articles/CBMi2AFBVV95cUxONS1aT19odXdNakNVdEFkRDBaczJWZy1uOFpEcTBndWJueEwzRUt5TVNYUWdiUkZpOHBnM0pXNzNGb0dESl82T2ZxQlVUN3Y1eHRvYWdETHJ4RHc5TF9Scy1TS2JuX0RUS1dFSFRJOXFCOVNUeHQtYzQ1Sy1zcVJjRzFBY1FTVkNBdi1kN2UxMFREbGNoaEVZcjVrZHhaYThjNnFpMDRyYV9EeUFmMVdUcTRFYXQtOTZscVVyWW5jNXlNVmhyNUZ1djJYa1FEYTZNX1YzTkVhU3k?oc=5&hl=en-US&gl=US&ceid=US:en,https://reliefweb.int,ReliefWeb,,{'https://lh3.googleusercontent.com/J6_coFbogxhRI9iM864NL_liGXvsQp2AupsKei7z0cNNfDvGUmWUy20nuUhkREQyrpY4bEeIBuc=s0-w300'},
Foundation stone laid for construction of Arun Multipurpose Building with Indian assistance in Nepal - Tribune India,Foundation stone laid for construction of Arun Multipurpose Building with Indian assistance in Nepal  Tribune India,2025-07-15 14:30:20,https://news.google.com/rss/articles/CBMi2AFBVV95cUxPbnE1Tk04NTdRakdkOEJPWmJuRVJscEo3Ny1IY2ZFOWZXUEJsRlZPTTJWd1E4RUJPekpVWHhoY0dZT1NmcC1nTllwT0pDRGlGUjVYNmwxQVN0M28zNzgzb1phSDJjcEJRU1piODRMOE1xUHFzcHlnRjFPdnl3MGl4YmliR0lzQmlVeDVHNVVKN0RBSzFTRXBuTFZhNzE0aFZxU0VSdlVBWU5JYy0tUF9qTy1WaEJDd0xCLVhvUXctQ0R1dGdhbFFHOFVkbU9JdXhIQjRQa0JveUHSAdwBQVVfeXFMTXQ3b1dMSkZkakFjTWlqSkx1dFdyOS11bWhRSmt6cEFMb25BbmNwNlNiNDdUQlBaSTVUQ1d3NDVSU3kxUjlNVlliT3lsZXdKSUhadnoyaWViMWliWG02YjRDVlptX0dfN2IxMTBkZ2pheXJnQXdCX2xtdHRWYnppR0JoSjlMX3dQMWJDcmR2Y05UNndoRV9oMXB2MTZ4d0ZrLU14LTVHc3pfSFdOdjRhSENRc2FhX2VVcUlDcTZielI2d29hX1JlaDFpQUk2bl9WRWJGR1VSeGYtU09RZw?oc=5&hl=en-US&gl=US&ceid=US:en,https://www.tribuneindia.com,Tribune India,,{'https://lh3.googleusercontent.com/J6_coFbogxhRI9iM864NL_liGXvsQp2AupsKei7z0cNNfDvGUmWUy20nuUhkREQyrpY4bEeIBuc=s0-w300'},
New York Event Showcases Nepal as a Premier Travel Destination for American Tourists—Here’s Why - nepyork,New York Event Showcases Nepal as a Premier Travel Destination for American Tourists—Here’s Why  nepyork,2025-07-15 16:18:40,https://news.google.com/rss/articles/CBMixAFBVV95cUxQTWhMamxwM0FIZ2dQNFYyeGVRWDhCZ3lRZTB3bnRZdmlTTkVUM182Z01QX0RQc3RLdzdEbnlhMGtvaU5SQlZXRTdWeHctUEw4UmlhenQxOTlHeV90aHREQjdxRlNHVWFjenUwb0hxcjVwbjNOeXk1VXhTdldYNEgwLU5kVWNOMVRCb0tNbXFoTU1EZUJmc0M1N1MyYjc3UjZEbnNXY0didk5JXy1wQVpYVmhEM0E2WDM0ZVo1UnRzTEVuRGJM?oc=5&hl=en-US&gl=US&ceid=US:en,https://nepyork.com,nepyork,,{'https://lh3.googleusercontent.com/J6_coFbogxhRI9iM864NL_liGXvsQp2AupsKei7z0cNNfDvGUmWUy20nuUhkREQyrpY4bEeIBuc=s0-w300'},
Fact Sheet: Temporary Protected Status for Nepal - Immigrant Law Center of Minnesota,Fact Sheet: Temporary Protected Status for Nepal  Immigrant Law Center of Minnesota,2025-07-15 16:30:02,https://news.google.com/rss/articles/CBMiiAFBVV95cUxOYmpRbEVWdkc0RjlNUzhLYm9OR1E4b0FGSXctZzZGRmVGMmNWT1ItNkJTRXN1UW9uV2hmbTk3OEMzeXVQSXk1bG00R3pOY05jMUxlbHdibGVLYkFtVk5CZ1RBeWliS2h2RWxXYkl4WlAwVkxCaW5oMGd0dVBvVjUxMmpuWnFsOFNy?oc=5&hl=en-US&gl=US&ceid=US:en,https://www.ilcm.org,Immigrant Law Center of Minnesota,,{'https://lh3.googleusercontent.com/J6_coFbogxhRI9iM864NL_liGXvsQp2AupsKei7z0cNNfDvGUmWUy20nuUhkREQyrpY4bEeIBuc=s0-w300'},
Bangladesh consolidates top spot; Nepal close second at SAFF U-20 Women’s Championship - Sportstar,Bangladesh consolidates top spot; Nepal close second at SAFF U-20 Women’s Championship  Sportstar,2025-07-15 16:46:48,https://news.google.com/rss/articles/CBMi3gFBVV95cUxQblNHNnNrSTNVSDFGeVYxNDJ2ZnJONzFMSGJNZFFmV1cxRjNwcXhDWXJrVVNjUGR4Q3FoNzZ0Y2xyeXZOdXFWVkNRWmRIR3M1R1ZYNUoxVEVUN0t2SGxoYWRnbXJSdmVIMGl3ekNmOTNZd2ItMkJwN3FVUmhTbTJBMmcxLTY2N1c4dXg3WVMxRS1xWW9lMVhTVjlBVmNZckRSaHprWS14NzkxMm1EN3lhanBaUy01bHEyS1Ytb0NpQ3RTdHpDSFk5andFLUlpMlFtZ3BwRTRaalRraTJ4MHfSAeQBQVVfeXFMUDRvWG1oY2k0TTdrdzVEWjFMbHd3cTZzdnRtM2g1VjYzdWV0Wm1WVThjcTFXSzFNWlFXN0dudFhyT0FGRlRuNUhKSkhtSEVwMVBWSm13Z1A1cDZwdUdUb2hHZ2ZuV2RiUjdWOGJ1S3NtaHZnbV8tTkhCcXczZ3V4S1g5VEdVT29HSlZTaTFORTJuMGN0RUFSSVpKdmNQNlNJeVhDTDdsRkVyYk9waEUtbGp6eTl6QmdkSmItZ0szTTlrRUdBaUw0cXhDNUJTVGVGTXg3MmhwOTZaOEFudm1KYkdTdHhp?oc=5&hl=en-US&gl=US&ceid=US:en,https://sportstar.thehindu.com,Sportstar,,{'https://lh3.googleusercontent.com/J6_coFbogxhRI9iM864NL_liGXvsQp2AupsKei7z0cNNfDvGUmWUy20nuUhkREQyrpY4bEeIBuc=s0-w300'},
Nepal to host Power Summit 2025 in September - theweek.in,Nepal to host Power Summit 2025 in September  theweek.in,2025-07-15 16:59:42,https://news.google.com/rss/articles/CBMilAFBVV95cUxOTFlfSWtIRkx5SkhXT2F2QWFXbFktUlljaTFWdjQzbVBXU0l1OUpCZGRhT3NLaDBhckRORFIyV1lfbXFvU0ZyZjFyWmtRNFZrLUhnMl9wVWMySi1pUDRVeUFJcXFHUUg5cG1nczExenpEWjA5eHNIQWtxZHV6OHgwdVNYQVMwWHhkdDhXS3g1ZHZxdXdY0gGaAUFVX3lxTE41YjVId2ZSQ3JrNlZfc3o0MEdKcFllR09rVFJrUGdTMlZaMkd1aVl0RC0xT0x4em5rTllmWXlSanlBMURXS3VnWlEzUEZxMlF0R1ljYVREMFBURkFrYTVaZmt3SkZqRnp1djNUQWJ1bWg2d3JEU3dWTC1JS0lrMlZmT0l6MHVDcmJaai0wUE9acFU4a3ZDY01LUVE?oc=5&hl=en-US&gl=US&ceid=US:en,https://www.theweek.in,theweek.in,,{'https://lh3.googleusercontent.com/J6_coFbogxhRI9iM864NL_liGXvsQp2AupsKei7z0cNNfDvGUmWUy20nuUhkREQyrpY4bEeIBuc=s0-w300'},
"Inter-state drug cartel busted near Nepal border, 1 held - Times of India","Inter-state drug cartel busted near Nepal border, 1 held  Times of India",2025-07-15 17:19:00,https://news.google.com/rss/articles/CBMiywFBVV95cUxPNFg1X1kybmpFV2ZQYXpZT0N1eFZfeXhFV3dubkFpS2ZUNEJRZzRwanhCbjFYWjBCVElmR01nREVNMFZvb1Z5cUJsLXRYZ2RsM09DVG54WDV5T3U0ZzhtZ3dybG9NSmhmYTNVWVVTQUxIQ1dKMkhFUmZEa1VJcGI5U0h0aVlxcG1hdklrWE42SlRtbnptSWRQY0hiSjZPaWRTd2Z5MzZXMFBTdlRZbVhEVC14bzl2d1BjRC1oTUFIWUFjNXdvd1Ita3JOWdIB0AFBVV95cUxObEJZbGk3d1ZZNkVnSW9BZ0U3elV5TXpHS1pkM1JGQjdRVWJobVhoM2pCZk5fckNTb3ltR290dmxKSWpMSDRYZmJoQzFBQ2NkNGJPODhTMDhhTERGVWVGSWhxWlJUX25YSEc4aEZxMHg0VWgyOXVMZUhZNnFha3duZFMteXVyNjhDMjlKSzFZQmY0R0hPdzZyaDNKTXROOFNudUQwM1h5M05uWV8wSUk4OVAtVHd3X1hBSmxfSVpKdHd3MGlCaC1sTjUyQTM5cVd0?oc=5&hl=en-US&gl=US&ceid=US:en,https://timesofindia.indiatimes.com,Times of India,,{'https://lh3.googleusercontent.com/J6_coFbogxhRI9iM864NL_liGXvsQp2AupsKei7z0cNNfDvGUmWUy20nuUhkREQyrpY4bEeIBuc=s0-w300'},
