title,description,published date,url,publisher.href,publisher.title,full_article,images,translated
ISKCON Nepal denies cover-up and abuse charges at Budhanilkantha Gurukul - The Himalayan Times,ISKCON Nepal denies cover-up and abuse charges at Budhanilkantha Gurukul  The Himalayan Times,2026-06-26 08:06:28,https://news.google.com/rss/articles/CBMisgFBVV95cUxQMFlIeldPR2gyTmNLTVM1SVJGWHZzcms3aEF0WERHTG9OY2l3bkpJem1HWU1yWHJPVnlPRG02LW9NcmZNR0d3THE4OXluZGZWdm9vMHZHTkd2dERpTlF2OVZLMGxPUmNtSHZDX3c4QUpXWW5Ea0RwZ3IwaWxlaEcwb184eWZlSjZGaXItR1I3NUxXLUNlT3ctWW9KNlRwTVBWRVNfZnRZNmF2WGQ3bVpkVzNR0gFcQVVfeXFMT2pkVjBhYXgzaC14ZFZsQnhFald5bVI4UG53ZmlfWkNTaC1TNWVXaDZBNDJLalNvMlFCZHp0b2haU2tLNC1TNU1GSDBYcFJJNV9JQW5uZDFMeTFPN0Q?oc=5&hl=en-US&gl=US&ceid=US:en,https://thehimalayantimes.com,The Himalayan Times,"KATHMANDU, JUNE 24

The International Society for Krishna Consciousness (ISKCON) Nepal has rebutted the cover-up and accusations of child abuse through a point-by-point response to a series of front-page reports published by The Himalayan Times on June 14, 2026, which have exposed serious child abuse, sexual misconduct, and institutional cover-ups at its Bhaktivedanta Gurukul based in Budhanilkantha.

Related Articles What nurses taught me that Nepal has forgotten French prosecutors summon Elon Musk over allegations of child abuse images and deepfakes on X

In an official statement signed by Joint Secretary Harendra Thakur and sent to the Press Council Nepal, ISKCON has stated the reporting was ""one-sided, fabricated and highly misleading"" and has caused irreparable damage to the image of the spiritual institution.

In response to the headline that the ISKCON operator had been arrested, the institution said that the person in custody, Sundar Gopal Das (Suraj Krishna Shrestha), was just a general coordinator of the Gurukul and not an owner or operator.

googletag.cmd.push(function() { googletag.display('div-gpt-ad-1686127029429-0'); }); googletag.cmd.push(function() { googletag.display('div-gpt-ad-1686127067910-0'); }); googletag.cmd.push(function() { googletag.display('div-gpt-ad-1686127112906-0'); });

ISKCON has also stated that the media twisted the legal charges. Quoting official statements from the police spokesperson, the organisation said Das was being held under the Act Relating to Children for investigation into alleged physical punishment and battery (child abuse) and not child sexual exploitation as reported.

The organisation also responded with details about the main accused, 19-year-old Ishwor Shrestha. Shrestha was never an employee or official but a student, ISKCON said, and was himself a 15-year-old minor at the time of the alleged incident. ""Both sides have voluntarily left the facility since then,"" reads the response.

ISKCON has strongly refuted claims of any illegal activities in the Main Temple Hall, stating that Gurukul and the temple are two separate buildings. Such allegations are illogical, as the temple hall is very much crowded with public devotees all through the day.

The leadership responded to claims that 13 senior officials, including ISKCON Nepal President Sabin Regmi, had colluded to cover up the crimes, saying that the local executive board had not received any formal complaint. However, once a complaint reached the international Governing Body Commission (GBC), local management provided full logistics, housing, and meals to the investigation team-an interaction they state is backed by preserved CCTV footage.

Responding to a reported clash on April 22, when an armed mob allegedly attacked investigators, ISKCON clarified that the crowd was only of concerned parents and relatives of the students.

ISKCON said the friction occurred when investigators filmed sensitive videos of minors without parental consent. Parents gathered peacefully to secure copies of the footage to prevent public leaks, a valid concern when the videos were later aired on a local television channel. Local Budhanilkantha police arrived at the scene immediately, ISKCON said, adding police can confirm there was no physical assault.

It has also denied claims its legal team misled the court by saying the school shut years ago. ISKCON said the parents involved were from middle-class families, and management had immediately shut down the Gurukul's operations unconditionally following the start of the investigation.

""We have asked the publication to print our clarification with the same prominence as per the country's press laws and the journalistic code of conduct,"" ISKCON Nepal said.","{'https://thehimalayantimes.com/theme_himalayantimes/images/layout/icon_telegram.png', 'https://thehimalayantimes.com/theme_himalayantimes/images/layout/icon-Instagram-colored.png', 'https://cdnx.premiumread.com/?url=https://thehimalayantimes.com/thehimalayantimes/uploads/images/2026/06/25/49119.jpg&w=30&q=100&f=webp', 'https://thehimalayantimes.com/theme_himalayantimes/images/layout/icon_viber.png', 'https://thehimalayantimes.com/theme_himalayantimes/images/layout/icon-tiktok.png', 'https://thehimalayantimes.com/theme_himalayantimes/images/logo-100.png', 'https://thehimalayantimes.com/theme_himalayantimes/images/layout/icon_pinterest.png', 'https://thehimalayantimes.com/theme_himalayantimes/images/layout/icon_facebook.png', 'https://thehimalayantimes.com/thehimalayantimes/uploads/images/2026/06/26/49137.jpg', 'https://cdnx.premiumread.com/?url=https://thehimalayantimes.com/thehimalayantimes/uploads/images/2026/06/26/49137.jpg&w=800&q=100&f=webp', 'https://cdnx.premiumread.com/?url=https://thehimalayantimes.com/thehimalayantimes/uploads/images/2026/04/20/47702.jpg&w=30&q=100&f=webp', 'https://thehimalayantimes.com/theme_himalayantimes/images/layout/icon_whatsapp.png', 'https://thehimalayantimes.com/theme_himalayantimes/images/layout/icon_x.png', 'https://thehimalayantimes.com/theme_himalayantimes/images/layout/icon_linkedin.png', 'https://thehimalayantimes.com/theme_himalayantimes/images/layout/icon_youtube.png', 'https://cdnx.premiumread.com/?url=https://thehimalayantimes.com/thehimalayantimes/uploads/images/2026/05/12/48263.jpg&w=30&q=100&f=webp', 'https://cdnx.premiumread.com/?url=https://thehimalayantimes.com/thehimalayantimes/uploads/images/2026/06/26/49138.jpg&w=30&q=100&f=webp', 'https://thehimalayantimes.com/theme_himalayantimes/images/layout/icon_messenger.png', 'https://cdnx.premiumread.com/?url=https://thehimalayantimes.com/thehimalayantimes/uploads/images/2026/06/25/49121.jpg&w=30&q=100&f=webp', 'https://cdnx.premiumread.com/?url=https://thehimalayantimes.com/thehimalayantimes/uploads/images/2026/06/26/49127.jpg&w=30&q=100&f=webp', 'https://cdnx.premiumread.com/?url=https://thehimalayantimes.com/thehimalayantimes/uploads/images/2026/06/25/49122.jpg&w=30&q=100&f=webp'}","काठमाण्डू, 24 जून

इंटरनेशनल सोसाइटी फॉर कृष्ण चेतना (इस्कॉन) नेपाल न॑ १४ जून २०२६ क॑ द हिमालयन टाइम्स द्वारा प्रकाशित फ्रंट पेज रिपोर्ट के श्रृंखला के बिन्दु-दर-बिंदु प्रतिक्रिया के माध्यम स॑ बाल दुर्व्यवहार केरऽ झाँप आरू आरोपऽ के खंडन करलकै, जेकरा म॑ बुधनिलकांत स्थित अपनऽ भक्तिवेदांत गुरुकुल म॑ गंभीर बाल दुर्व्यवहार, यौन दुराचार, आरू संस्थागत ढकना के खुलासा करलऽ गेलऽ छै ।

संबंधित लेख नर्स सब हमरा की सिखबैत छल जे नेपाल बिसरि गेल अछि फ्रांसीसी अभियोजक एक्स पर बाल दुर्व्यवहार छवि आ डीपफेक के आरोप पर एलान मस्क के बुलबैत अछि

संयुक्त सचिव हरेन्द्र ठाकुर के हस्ताक्षर आरू प्रेस परिषद नेपाल क॑ भेजलऽ गेलऽ आधिकारिक बयान म॑ इस्कॉन न॑ ई रिपोर्टिंग क॑ “एकतरफा, मनगढ़ंत आरू बहुत भ्रामक” बतैलकै आरू आध्यात्मिक संस्था के छवि क॑ अपूरणीय क्षति पहुँचैलकै ।

इस्कॉन संचालक कए गिरफ्तार करबाक हेडलाइन क जवाब मे संस्था कहलक जे हिरासत मे बैसल व्यक्ति सुंदर गोपाल दास (सूरज कृष्ण श्रेष्ठ) गुरुकुल क सामान्य समन्वयक मात्र छल, मालिक या संचालक नहि।

गूगलटैग.सीएमडी.पुश (फंक्शन () { गूगलटैग.प्रदर्शन ('डिव-जीपीटी-विज्ञापन-1686127029429-0'); }); गूगलटैग.सीएमडी.पुश (फंक्शन () { गूगलटैग.प्रदर्शन ('डिव-जीपीटी-विज्ञापन-1686127067910-0'); }); गूगलटैग.सीएमडी.पुश (फंक्शन () { गूगलटैग.प्रदर्शन ('डिव-जीपीटी-विज्ञापन-1686127112906-0'); });

इस्कॉन न॑ ई भी बतैलकै कि मीडिया न॑ कानूनी आरोप क॑ मोड़लकै । पुलिस प्रवक्ता के आधिकारिक बयान के हवाला दैत संस्था कहलनि जे, दास के कथित शारीरिक दंड आ बैटरी (बाल दुर्व्यवहार) के जांच के लेल बाल संबंधी अधिनियम के तहत राखल गेल अछि, नहि कि रिपोर्ट के अनुसार बाल यौन शोषण के लेल।

संस्था मुख्य आरोपी 19 वर्षीय ईश्वर श्रेष्ठ के बारे मे विस्तार सं जवाब सेहो देलक। श्रेष्ठ कहियो कर्मचारी या अधिकारी नहि बल्कि छात्रा छल, इस्कॉन कहलनि जे, कथित घटनाक समय स्वयं 15 वर्षीय नाबालिग छल। प्रतिक्रिया मे कहल गेल अछि जे, तहिया स दुनू पक्ष स्वेच्छा स एहि सुविधा स बाहर भ गेल अछि।

इस्कॉन न॑ मुख्य मंदिर हॉल म॑ कोनो तरह के गैरकानूनी गतिविधि के दावा के कड़ा खंडन करतें हुअ॑ कहलकै कि गुरुकुल आरू मंदिर दू अलग-अलग भवन छै । एहन आरोप तर्कहीन अछि, किया कि मंदिर हॉल मे दिन भरि जनभक्त क बहुत भीड़ रहैत अछि।

इस्कॉन नेपाल के अध्यक्ष सबिन रेग्मी सहित १३ वरिष्ठ अधिकारी मिलिकय अपराध के झाँपने के दावा के जवाब मे नेतृत्व स्थानीय कार्यकारिणी मंडल के कोनो औपचारिक शिकायत नै भेटल अछि । लेकिन, एक बार जब॑ कोनो शिकायत अंतरराष्ट्रीय गवर्निंग बॉडी कमीशन (जीबीसी) म॑ पहुँची गेलै, त॑ स्थानीय प्रबंधन न॑ जांच टीम क॑ पूरा रसद, आवास, आरू भोजन उपलब्ध कराय देलकै-एक बातचीत केरऽ समर्थन हुनकऽ कहना छै कि संरक्षित सीसीटीवी फुटेज स॑ मिलै छै ।

22 अप्रैल कए जखन सशस्त्र भीड़ कथित तौर पर जांचकर्ता पर हमला केलक तखन भेल झड़प क जवाब दैत इस्कॉन स्पष्ट केलक जे भीड़ केवल छात्र क चिंतित अभिभावक आ रिश्तेदार क अछि।

इस्कॉन के कहनाय छनि जे ई घर्षण तखन भेल जखन जांचकर्ता बिना अभिभावक के सहमति के नाबालिग के संवेदनशील वीडियो फिल्मौलक. सार्वजनिक लीक नै होबय लेल फुटेज के कॉपी सुरक्षित करय लेल अभिभावक शांति सं जमा भ गेलाह, जे एकटा वैध चिंता के विषय छल जखन बाद में ई वीडियो स्थानीय टेलीविजन चैनल पर प्रसारित भेल. स्थानीय बुधनिलकांत पुलिस तुरंत मौका पर पहुंचल इस्कॉन कहलनि जे, पुलिस पुष्टि क सकैत अछि जे कोनो शारीरिक हमला नहि भेल अछि।

एकरऽ कानूनी टीम न॑ ई दावा क॑ भी खारिज करी देल॑ छै कि सालऽ पहल॑ स्कूल बंद होय गेलऽ कहतें हुअ॑ कोर्ट क॑ गुमराह करलऽ गेलऽ छेलै । इस्कॉन के कहनाय छनि जे एहि मे शामिल अभिभावक मध्यम वर्गीय परिवार के छथिन्ह, आओर जांच शुरू भेला के बाद प्रबंधन तुरंत गुरुकुल के संचालन के बिना शर्त बंद क देलक अछि.

इस्कॉन नेपाल कहलनि जे, हम प्रकाशन स कहने छी जे देश के प्रेस कानून आ पत्रकारिता आचार संहिता के अनुसार अपन स्पष्टीकरण के ओतबे प्रमुखता स छपब।"
Candidates make final push for votes in RSP office-bearer elections (Photo Feature) - Nepalnews.com,Candidates make final push for votes in RSP office-bearer elections (Photo Feature)  Nepalnews.com,2026-06-26 08:12:32,https://news.google.com/rss/articles/CBMiwAFBVV95cUxNV3dpbXVGNHBhMkhGOGctNlRsUjNERWlGTm1LUnE5ZW93UnU2Q0R4RWFFUFlZbWtwdjYtX1R2VDExZ2NXNnFXSk8yR3dLZl84WVZhWDJ2QVlpVENUaGZRRWZMQjNDdW1QWnM3Zi1vdHFVWFdMbk5PVU1NbE5nRWFkTjB3ZlBXWmlQRjFUZnhoVVMyTTNIeE5mTmN3cmo2SVYzZUlNX0p6MmM2MzhMaEZrMmZoS2J1WHZoNHhnUGg3eXg?oc=5&hl=en-US&gl=US&ceid=US:en,https://english.nepalnews.com,Nepalnews.com,,,
