title,description,published date,url,publisher.href,publisher.title,full_article,images,translated
Nepal celebrates 75th ascent anniversary of Mount Annapurna - Watauga Democrat,Nepal celebrates 75th ascent anniversary of Mount Annapurna  Watauga Democrat,2025-06-04 12:31:13,https://news.google.com/rss/articles/CBMi6wFBVV95cUxQaWJ0MW9zTnVCVnppVFZVTzRWWTducFU4Y1VmSGdwSDNDVDJaeW84QkJpVGVlcHozNThXN3B3ZkRpSnBkMVFLSFVaU0FHaU5vcXdCMkctcklmNVpvSEtwRzkxVXRQV3VDRTR5eGZyNHhpY1hXNFljRkRuTXpmNjYybmZDcEU4Q3R1TF9qcERXWk1ZYmQ2eHQyRnJFU0hoOGtrNWQ1ZWF3U2pOTG91WUxUaHl5anpfRDBNMmZkNFBtaXQ3T0R5ZWstZ19Yc0hnV2NzSElndkZvS1huLW56anphTERmZGtpTnc3aW44?oc=5&hl=en-US&gl=US&ceid=US:en,https://www.wataugademocrat.com,Watauga Democrat,,{'https://lh3.googleusercontent.com/J6_coFbogxhRI9iM864NL_liGXvsQp2AupsKei7z0cNNfDvGUmWUy20nuUhkREQyrpY4bEeIBuc=s0-w300'},
Kiran Pandit appointed Spokesperson of Nepal Rastra Bank - myRepublica,Kiran Pandit appointed Spokesperson of Nepal Rastra Bank  myRepublica,2025-06-04 13:14:15,https://news.google.com/rss/articles/CBMisAFBVV95cUxNdTNrd3U5NXAwR1pHOFFuUjBBN09fMElSeTYxQWgxdWdYRkNfRVBNcnpPbzdQRE5uRWEwZmpNUG1jeG1vYlNfbE9ILTZZNTVZUGhJXzZWQ0JucnlwRVNZRXFITnhYblN4VVJKVU40S0VTeGlONnpRdUFIWFRhYkE3MVVhVHpLdEEtUUdMTjVHTWZjaDVDM1h4RHh0RXRHemZ3Ri0zb09ndEN3VVJXWjFnQQ?oc=5&hl=en-US&gl=US&ceid=US:en,https://myrepublica.nagariknetwork.com,myRepublica,,{'https://lh3.googleusercontent.com/J6_coFbogxhRI9iM864NL_liGXvsQp2AupsKei7z0cNNfDvGUmWUy20nuUhkREQyrpY4bEeIBuc=s0-w300'},
The Sustainable Finance Podcast: Bringing banking to Nepal’s underserved population - Equities.com,The Sustainable Finance Podcast: Bringing banking to Nepal’s underserved population  Equities.com,2025-06-04 13:24:57,https://news.google.com/rss/articles/CBMiwgFBVV95cUxPMnplYmd2RllqNEtOeFlhMEwzX3FLZUxhN3otWGpKTWh0MzRPOHFMR1pBbk1WWjhSY2VDbGF1cUY4MHdubHNCXzdNci12aU1iQ2E3c002ZWVsR01vdW5uRnJ2d1d5R1hLdXZTYVdYY3BkcXF4ZVRVeEVLeGV2eWRGMko1VEY1LXFrY0pUWkF1cTBFOXVwaXpWdFhpZ0dwWV9ma1pOdkNuMWFNOGl0cHM4TjRyek0zdGNFVk11blFfT1Q1QQ?oc=5&hl=en-US&gl=US&ceid=US:en,https://www.equities.com,Equities.com,,{'https://lh3.googleusercontent.com/J6_coFbogxhRI9iM864NL_liGXvsQp2AupsKei7z0cNNfDvGUmWUy20nuUhkREQyrpY4bEeIBuc=s0-w300'},
Nepal's health insurance program: Challenges and early impacts - Medical Xpress,Nepal's health insurance program: Challenges and early impacts  Medical Xpress,2025-06-04 14:27:14,https://news.google.com/rss/articles/CBMiekFVX3lxTE1YWHNzQ0FXd1hRUVhmS2ZFb1RIck5tc3Nib1E0QXNjXy0tcWl6dWVuNXFFUTNDT0x0TTNyLWxnUnIyZDh1WldtVllSRnNGRzM4LUpja1BzemtTRVkycG9LRU5uZzhaZ2lTOUZzbUh4NllPYmZLX1B0WUR3?oc=5&hl=en-US&gl=US&ceid=US:en,https://medicalxpress.com,Medical Xpress,,{'https://lh3.googleusercontent.com/J6_coFbogxhRI9iM864NL_liGXvsQp2AupsKei7z0cNNfDvGUmWUy20nuUhkREQyrpY4bEeIBuc=s0-w300'},
Fifth Edition of Himalayan Travel Mart Kicks Off in Kathmandu to Boost Nepal’s Tourism - Travel And Tour World,Fifth Edition of Himalayan Travel Mart Kicks Off in Kathmandu to Boost Nepal’s Tourism  Travel And Tour World,2025-06-04 14:37:21,https://news.google.com/rss/articles/CBMizwFBVV95cUxPenFickpTbm9uV2VnWEtaRmd1aFdmZFZBNUNIX3FZeE1mNy0tTWdLMnhNRjVtWExXckpJZ2VZVUp6NEM2bEhPWkFJT3hMZ1l0aE1PXzluWWJ4TlMtSFg2WlFHWHBucWlEWjNHVG9scDJmSHV4VTAyRmVQeDZyRzUzSzFhMDYyT3Z1cVBpb1BkU3F0bWkwRWxOWDJxdFpHc1BfMnQwYlJlbTZ0TnlkS2JkWlNZSUxwQy0xZDFMU0JQZHVwTnZmaGl3RFFNTWZnUlk?oc=5&hl=en-US&gl=US&ceid=US:en,https://www.travelandtourworld.com,Travel And Tour World,,{'https://lh3.googleusercontent.com/J6_coFbogxhRI9iM864NL_liGXvsQp2AupsKei7z0cNNfDvGUmWUy20nuUhkREQyrpY4bEeIBuc=s0-w300'},
Nepal face 226-run target against Netherlands - The Kathmandu Post,Nepal face 226-run target against Netherlands  The Kathmandu Post,2025-06-04 15:04:09,https://news.google.com/rss/articles/CBMilAFBVV95cUxOLWdCQ096MEhONDZwNEVHMm9abHlYOUw4RXd1NDNTZXFCNW5qajJPYXJSZmZJbkIzMlZrNGFNMEF2ZWVVZTB6YWk5eFJ1Vjlvc1NaMjJtdC1abU43QU9zbkNhSXg1SEJYNjhmRHlwT1RpQ3ZRdmtTdThDWmphaXNkQTlTbjZzWnJjNGFNRlFvbmxMYlh5?oc=5&hl=en-US&gl=US&ceid=US:en,https://kathmandupost.com,The Kathmandu Post,,{'https://lh3.googleusercontent.com/J6_coFbogxhRI9iM864NL_liGXvsQp2AupsKei7z0cNNfDvGUmWUy20nuUhkREQyrpY4bEeIBuc=s0-w300'},
Nepal's apex court orders criminal investigation against former House Speaker Agni Sapkota on war crime charge - The News Mill,Nepal's apex court orders criminal investigation against former House Speaker Agni Sapkota on war crime charge  The News Mill,2025-06-04 15:34:57,https://news.google.com/rss/articles/CBMi2gFBVV95cUxQYWhCS0FvbmlRT2xRdm4wUWF5X1FlVmVJQjZ1NmxubUF5MlNRVzgyUllYLS1DOXV2T0UybUdHb0tiSnRFbkxSNmlUNzdUcG45Y09FNzVFMEZUcGxlVTZjQ0tKdXNZa1NGelNhMmVtVUZBRVpXT0I5ekZ5clpUNGN2blZLMnVkMjFlcGduWUlWa1U3cDBnV3VERkZYX2NmWWVXa2ZHbmd3V2phYTVabkxIMmJsTTRlQUtSMzJqWnY4NUM5dFpqUndMalhHekhsNU1tRGVDZE5sdkxrZw?oc=5&hl=en-US&gl=US&ceid=US:en,https://thenewsmill.com,The News Mill,,{'https://lh3.googleusercontent.com/J6_coFbogxhRI9iM864NL_liGXvsQp2AupsKei7z0cNNfDvGUmWUy20nuUhkREQyrpY4bEeIBuc=s0-w300'},
"Climate change is severely impacting Nepal, says Deuba - The Himalayan Times","Climate change is severely impacting Nepal, says Deuba  The Himalayan Times",2025-06-04 16:20:17,https://news.google.com/rss/articles/CBMikwFBVV95cUxOWEpWamtTa0VwTDBqTzQ3Zm9CVTJtM0gwNEhnc01NUlpwOFhCRHYxSnhDd0ZpS2dVWTVKdDRfN29YVnY3ZGxobmlmZmxoT0dJYWMxMDh4eGlDRDB1UzB6ZGZfYjBhdTBGNHd4Zl91X29WZmo4anJKeXhvQXY3OU84RmFNb2tWUmdvUnNyd3pSeXBHLVU?oc=5&hl=en-US&gl=US&ceid=US:en,https://thehimalayantimes.com,The Himalayan Times,,{'https://lh3.googleusercontent.com/J6_coFbogxhRI9iM864NL_liGXvsQp2AupsKei7z0cNNfDvGUmWUy20nuUhkREQyrpY4bEeIBuc=s0-w300'},
Nepal–Jordan private sector collaboration poised for trade and economic expansion - The Annapurna Express,Nepal–Jordan private sector collaboration poised for trade and economic expansion  The Annapurna Express,2025-06-04 17:51:40,https://news.google.com/rss/articles/CBMiV0FVX3lxTFB6eXktVkVWUnJLY3EzbmVEdGZ4bUlZRzQxZXN3NEkyNFg2VC1PTUlyOWlpdWNoQ3JYOVktZEVVal9EVkM0NVRQaE5NOWpMc3RQdk1rMVNsUQ?oc=5&hl=en-US&gl=US&ceid=US:en,https://theannapurnaexpress.com,The Annapurna Express,,{'https://lh3.googleusercontent.com/J6_coFbogxhRI9iM864NL_liGXvsQp2AupsKei7z0cNNfDvGUmWUy20nuUhkREQyrpY4bEeIBuc=s0-w300'},
Indian Politician Wants to Ban Climbing on Sacred Kangchenjunga - Explorersweb »,Indian Politician Wants to Ban Climbing on Sacred Kangchenjunga  Explorersweb »,2025-06-04 19:38:15,https://news.google.com/rss/articles/CBMikwFBVV95cUxQOVBOQzdRLUxqblN2aE9yeUpHdnNsWjQ4dnhoM3dIc241RGNQNVhkekxsWFlnVV82aTNjRlZLaW9ZOWQ4eGxvV01oVUpUdURCaHBjSTJVVUw0RGNHSUpoWlRJR1ZXZEFsSnI0eU5WbjVPT3RTdnk4T2gyRnZhMFBhWTlNTEhnUXQzN3o2ODdENUhXQlE?oc=5&hl=en-US&gl=US&ceid=US:en,https://explorersweb.com,Explorersweb »,,{'https://lh3.googleusercontent.com/J6_coFbogxhRI9iM864NL_liGXvsQp2AupsKei7z0cNNfDvGUmWUy20nuUhkREQyrpY4bEeIBuc=s0-w300'},
Malda cops help Nepal boy return home - Times of India,Malda cops help Nepal boy return home  Times of India,2025-06-04 19:57:00,https://news.google.com/rss/articles/CBMisgFBVV95cUxNMTk2dG5QdHp4SWdJRDVwQXIwa0xObWZ0WERvTzlFc19KMGZRcEVTaUJIaGZtRlRXVXVUM3g3T0hRUFFfTHpRVmZZcmg2VmpYd1U4Q0M5QTFfbEpHRFhRVGVQbVB5bUQ4a2g4TnRxWDVCbXBLay1fSTZWQXZ1amxlZDlKaWZkWC1FX2UzM3RPU2FjbEVkd05sRnd3Wm83MWhheU0zUUc0azRMNE1YUEJuNTJ30gG3AUFVX3lxTFBBZlA1ck5ocEhnWFNDME1vdC1GVnh0aXR2aVpwVmVVT0hjMHZYY2JuNjdhd252b3hURng0WFBzWWlHYnZENUEzdUV3RzBRUTZORlY0V3dkRXU4ZGxjUDlKOVdraEQ3Vk96Q1ota2dTSDVrNHk3LXBOVFI0UVBYUWY4ajJzRjlHRVhRR3JfeWtMWFcxV0hOdDR2RkljdnlQZXRKR1ZFWmp3NGMtT1RfNDBCVl9mcDhtYw?oc=5&hl=en-US&gl=US&ceid=US:en,https://timesofindia.indiatimes.com,Times of India,,{'https://lh3.googleusercontent.com/J6_coFbogxhRI9iM864NL_liGXvsQp2AupsKei7z0cNNfDvGUmWUy20nuUhkREQyrpY4bEeIBuc=s0-w300'},
Centring women’s knowledge and leadership in Nepal’s climate response - UN Women Asia and the Pacific,Centring women’s knowledge and leadership in Nepal’s climate response  UN Women Asia and the Pacific,2025-06-04 20:05:17,https://news.google.com/rss/articles/CBMitAFBVV95cUxOMjZBNWZqU092ZWVQOUkzSUdwa0RRVzY4N3B6M3FLYkZDWEt5enFDajJpcjN6V3ZGX3VYMGNqOVBBek16azVnLUt0VTdUVHlEdWFUcDJtYnR5ME1ycDFqQXpBSll5VGQ0ckpYSFF2ZU5WWC1TYmNCd1pzM082amVrV2FvMzhFbllaUFZGdEVJVTlUUTcxUFpaRzdKT3oxWjNOZzFxQWdHV3h2UkdUMTMwZHVVWlk?oc=5&hl=en-US&gl=US&ceid=US:en,https://asiapacific.unwomen.org,UN Women Asia and the Pacific,,{'https://lh3.googleusercontent.com/J6_coFbogxhRI9iM864NL_liGXvsQp2AupsKei7z0cNNfDvGUmWUy20nuUhkREQyrpY4bEeIBuc=s0-w300'},
A Tiny Otter That Vanished From Nepal in the 1800s Reappears - Explorersweb »,A Tiny Otter That Vanished From Nepal in the 1800s Reappears  Explorersweb »,2025-06-04 20:38:29,https://news.google.com/rss/articles/CBMijwFBVV95cUxQcDFnVWQ0cENaNXIwVW1YRS1ucDBxdEUxNVBmRjVya1JDQTJwcnNSZjBTTHhsMTg5U3pPazhvRDE3am1ONzFYT2pLc1duYkVLZDhmb0NFOHVWeGQ2eHZkOE9zVm1YcElnVkFkQUVYd0lrOEh1UlFsRlNmTGdHbGp0Z2tCM1M1cHFYZmw1dm5jaw?oc=5&hl=en-US&gl=US&ceid=US:en,https://explorersweb.com,Explorersweb »,,{'https://lh3.googleusercontent.com/J6_coFbogxhRI9iM864NL_liGXvsQp2AupsKei7z0cNNfDvGUmWUy20nuUhkREQyrpY4bEeIBuc=s0-w300'},
Nepal v Netherlands | Match Highlights | ICC Men's CWCL2 2023-27 - ICC,Nepal v Netherlands | Match Highlights | ICC Men's CWCL2 2023-27  ICC,2025-06-04 22:58:25,https://news.google.com/rss/articles/CBMi1AFBVV95cUxPUzlLOC1udnpGc0V4NTJPdUtvYl85MGc5RGJHUkxvalo5UVBZQjNFVlRmTzhnaFNhSW9UbGRoa0lPT1l4SUU5QXVYRFA4ZmJ0SFIwWXM3WE1ObGJRLXJXMGFOQWJIMEdHUnBGTmc4UzNVSWdMRnBNU0x5aGpBM1o3cXFGS1lwcUtVOW1jNmUyZC1fTWhjMVhIRlFXd2ZtazZHQ0kzMTVFVkNxQWZRX3phSGtzWEZxNzBkMkp3UGRHTjk0UHlxUERWX2JSX3ZRVEh4RHNjOQ?oc=5&hl=en-US&gl=US&ceid=US:en,https://www.icc-cricket.com,ICC,,{'https://lh3.googleusercontent.com/J6_coFbogxhRI9iM864NL_liGXvsQp2AupsKei7z0cNNfDvGUmWUy20nuUhkREQyrpY4bEeIBuc=s0-w300'},
Nepal’s unbreakable spirit and bus-driver-turned-coach powering Asian Cup ride - South China Morning Post,Nepal’s unbreakable spirit and bus-driver-turned-coach powering Asian Cup ride  South China Morning Post,2025-06-04 23:00:20,https://news.google.com/rss/articles/CBMi0AFBVV95cUxPX1JBcVJxeGdjU1RXajd6RFVSREEwR0p5RDlxYy1PRFJ1bkdKajFkTlN5akZ6U1puanpLNFR3UTBSVVpENWw3TjR5eHVkbXhkOWV5MWRabmVpdnpwS1BxYmxuNWJRNmpQZUU0ZUxOZzN0Y1hLV3RDanhkM1lfLV9zSnhqNXpJSjdpSmtsa2Y0dHJEYzBkYnRFRHktajl1enI2YzNMM0xIeEVfRG5PRmYyUnRBX1F5RVExNzBPNlVjZ1M1YmJsSnZ1NzJ1dXU5WGZL0gHQAUFVX3lxTE5xeWJrR0pyUksybnJROEhNdXdtWU1YLVVGRmxyXzJUVUt3S1RDMnFoeVdYcTR5TXQ5WVpUTEpFUHkxSWlxVDdpdzNDVUxjTkdUUnNvbG1HSFpneWtXTjBWc2t1OVBYNVY4RXB0TkRLOTd5aTVJRW1jWXdXcUw3MTFOQlVCRXR5eEhXdjFiQU9mQmllV3JYU3JRX2ZRalpScXliTjQ1N2hVaTFhSE5GMi12T0RYam5CLXhkWGxQWDBVMnkyTzBaUGpEcTZMdi1NY3M?oc=5&hl=en-US&gl=US&ceid=US:en,https://www.scmp.com,South China Morning Post,,{'https://lh3.googleusercontent.com/J6_coFbogxhRI9iM864NL_liGXvsQp2AupsKei7z0cNNfDvGUmWUy20nuUhkREQyrpY4bEeIBuc=s0-w300'},
Aarif Sheikh inspires Nepal to a 5-wicket victory over Netherlands - The Kathmandu Post,Aarif Sheikh inspires Nepal to a 5-wicket victory over Netherlands  The Kathmandu Post,2025-06-04 23:19:25,https://news.google.com/rss/articles/CBMirwFBVV95cUxNa1dRTjZXdzdacHhkdXc4NlZRZ1JNbXVmMzg5bVRXa1ItTTM5V09PczVfM215RmpiRFJ1WlkwMXl0WldGMXhNTGk0R1BNdGFrdkxjYms0Q0hXcVZJenU0eWRnbFNmZ1FIX1NhQU5hc0Jmdi1WajhmXzlQd09BNURwNmlkT1NIcDJ3Wks5Y2ZsZWpLbGpXellnLVJac1NNNDVOY28wVWFHdmhPckZoMEtV?oc=5&hl=en-US&gl=US&ceid=US:en,https://kathmandupost.com,The Kathmandu Post,,{'https://lh3.googleusercontent.com/J6_coFbogxhRI9iM864NL_liGXvsQp2AupsKei7z0cNNfDvGUmWUy20nuUhkREQyrpY4bEeIBuc=s0-w300'},
5 Indians among 17 individuals arrested for online gambling in Nepal - Daily Excelsior,5 Indians among 17 individuals arrested for online gambling in Nepal  Daily Excelsior,2025-06-04 23:50:11,https://news.google.com/rss/articles/CBMiogFBVV95cUxNLUxDcUFFanFTRjM0dGVQT2FsakhjNXBWaWJQOGlDTjNMckgzRDlVVm15UU83WXcxWUZaRzZvSkFjVDRUYTRIdFIwZDVtLTRRYjhJYlBkem92UTBzZU14RnpESkV3aERFX1Y4WXhIQVYwWi1CMmVybVZyem43RGlJSUFybHliZ09nNFJJSGpkTFh5dGNtNFI0LUxXRWk2QzFFNEE?oc=5&hl=en-US&gl=US&ceid=US:en,https://www.dailyexcelsior.com,Daily Excelsior,,{'https://lh3.googleusercontent.com/J6_coFbogxhRI9iM864NL_liGXvsQp2AupsKei7z0cNNfDvGUmWUy20nuUhkREQyrpY4bEeIBuc=s0-w300'},
FEEN urges govt to focus on export promotion - The Rising Nepal,FEEN urges govt to focus on export promotion  The Rising Nepal,2025-06-05 00:48:57,https://news.google.com/rss/articles/CBMiUEFVX3lxTFBsWER1anFpUlcwREFra2R1bTFSdEtRZlZjRkFiUV9OMXZpWkk3bF9vVmNobFJiaS1xODlkR05wa0xOSHpzUWFyZXZkRGdjTzcx?oc=5&hl=en-US&gl=US&ceid=US:en,https://risingnepaldaily.com,The Rising Nepal,,{'https://lh3.googleusercontent.com/J6_coFbogxhRI9iM864NL_liGXvsQp2AupsKei7z0cNNfDvGUmWUy20nuUhkREQyrpY4bEeIBuc=s0-w300'},
Nepal’s energy sector rocked by ‘take-and-pay’ budget policy - The Kathmandu Post,Nepal’s energy sector rocked by ‘take-and-pay’ budget policy  The Kathmandu Post,2025-06-05 00:57:14,https://news.google.com/rss/articles/CBMipwFBVV95cUxOdzV5U3BHcnB0cDlQSmxlVUJJbTRhWlktYmhQclpHOU1QT1lsbGc1Mm5GdkNyRnZPSWJtX1AxVFpEUFVRSDFkcnhnVGo2alhIdjdvcVhrMEZBOXd1SVdfaF9CemhNeEhPbnVhb3dNVEN1TnZBU2VsMl9nZm9qbXZkanNIRU8zeGZyQkNuUjVubDhPNFZUYlF5dnR2WUhtQndlTEdURUNrNA?oc=5&hl=en-US&gl=US&ceid=US:en,https://kathmandupost.com,The Kathmandu Post,,{'https://lh3.googleusercontent.com/J6_coFbogxhRI9iM864NL_liGXvsQp2AupsKei7z0cNNfDvGUmWUy20nuUhkREQyrpY4bEeIBuc=s0-w300'},
Annapurna I base camp resonates with music - The Rising Nepal,Annapurna I base camp resonates with music  The Rising Nepal,2025-06-05 01:05:28,https://news.google.com/rss/articles/CBMiUEFVX3lxTE1kMUxUQXBtbFBjVTVhLVNraVdHMmUxek16a3A0NVNucDBwNkhrTndRYWgxQXJaQ0hPRGdLeHp1ZXNYQ3ZSenN2RUVfLUpQMDFo?oc=5&hl=en-US&gl=US&ceid=US:en,https://risingnepaldaily.com,The Rising Nepal,,{'https://lh3.googleusercontent.com/J6_coFbogxhRI9iM864NL_liGXvsQp2AupsKei7z0cNNfDvGUmWUy20nuUhkREQyrpY4bEeIBuc=s0-w300'},
