title,description,published date,url,publisher.href,publisher.title,full_article,images,translated
"Husband Of Nepali-Origin Woman Arrested In US After Wife Goes Missing, Accused Of Concealing Body - News18","Husband Of Nepali-Origin Woman Arrested In US After Wife Goes Missing, Accused Of Concealing Body  News18",2024-08-25 11:39:50,https://news.google.com/rss/articles/CBMi1AFBVV95cUxQc3BpZDl1VG9aWExjc3hNOW4yWS05MWxGaU5XMFd0Tkpta3I1NW1ZbktmSDhGWjJmRFJTa29ya01fZ1ZCMnM2dnlISjY2cTJQMjNnOTl0YkRFQmNYODRDd04tR2I4OHFiVXA3VVRWNUZOcnZReVBrOEtRX2JIY0pjdzVqVV9uSnlpVm1QWkVBdlYzRlg4N3VFR25IYzVZYVdGRDBzYUZYYkowUXNiUTJxSzZubnNUblVWWmxfMXZxek0wSzJvY2dzaEhaTm81WHg1WjJ3btIB2gFBVV95cUxNYWVHdVU1X0F2anljdDB0WW5VeUVoYmJONXplWkNCanhVOG1NNHdFOHdiQTE5YXo1dVU4NGNaYkRKbFhGRzZjSGFkVmNDdFNGbTFnN2ljaTRKTm9mSV9ObUpPYkppdXpJMTBvem9NVnFvODJuZjBfOXVYN1dQamFPcVNucWpWWGc2WmRIQ082UDV3MDNWZzhmdVpIMzVSeHJBZjA0cVhsWkJlbFRfUFk1SElkNEpPWW8wUk41ZE5GZXB5MHRjQTdwOENzak5UMHBCd1FRTFdZRlYwdw?oc=5&hl=en-US&gl=US&ceid=US:en,https://www.news18.com,News18,,{'https://lh3.googleusercontent.com/J6_coFbogxhRI9iM864NL_liGXvsQp2AupsKei7z0cNNfDvGUmWUy20nuUhkREQyrpY4bEeIBuc=s0-w300'},
Husband of missing Nepali American nurse arrested in Virginia - The Himalayan Times,Husband of missing Nepali American nurse arrested in Virginia  The Himalayan Times,2024-08-25 11:56:56,https://news.google.com/rss/articles/CBMingFBVV95cUxPRFNoUThLX25RU2tnSE1Tem5ZbVhrcy11NGVmYVAxWDF4eXl3Z3Q4YzVvbXhoMjFuRTFSNkJ0Ry1vZExGZTRYNTY5SkVqMTNzTHg0S0ZyaVg5c0txRGFOZjRucUg5TG5KbTg5SjBPS0ROWF9CcEQtU2NDVDVmX0pVMEdWNzc2YzhsN1N2ZFYzQnhlZG50WWRJXzFjSmhvUdIBXEFVX3lxTE90OTF2ZzlyVWdBQzRadl92RDd2OGtXUk04b0pJbTdQa1VWNUtnczFCYjRxSEZuM1dwODhhcTcyYXlzWkZSd2pXR3k2c0hyaXY5OWYtR1JBTGVucDdC?oc=5&hl=en-US&gl=US&ceid=US:en,https://thehimalayantimes.com,The Himalayan Times,,{'https://lh3.googleusercontent.com/J6_coFbogxhRI9iM864NL_liGXvsQp2AupsKei7z0cNNfDvGUmWUy20nuUhkREQyrpY4bEeIBuc=s0-w300'},
"Husband arrested for killing Nepali-origin wife in US, claimed he was ‘suffering’ over her disappearance - The Indian Express","Husband arrested for killing Nepali-origin wife in US, claimed he was ‘suffering’ over her disappearance  The Indian Express",2024-08-25 19:42:14,https://news.google.com/rss/articles/CBMimwFBVV95cUxNT25UcU9ZbHJkTmF6SlNxcVA5SnhqdjU5RlFFRHlWUDZYMzc4UXVMNGh5TktvR1JEZ3lUWFJvV2ZPYTMxbmRXNFlkOEtUTjdhdzZvR1I4VEdGTXI1ZndBMFRIa0ZlU1BIellkX3BQTW9mbU9VbzFhN0JWMDN1aU53TEE2SEh2VXBBRVVLRGI4QzJNU1doWWowSm9NY9IBogFBVV95cUxNVVE4VVlPcktRTWwyLWg4eGd6QktyZXREY0poVXhyOWVvVlc1cnYwVm1RSnJyb0s2S3NiVEc1ZmxSbEdJcFJubHR4ZmVyaXlPclliMzRwMVlRNFFuM1B6cHlLVmYwUDdEY29abk1ZelRjenFjRURldkhQRTBXWkpCY0RnMTdkdGFpQlR6bFFjdm5jUW56YWMwQ3JWa1czZmNPTUE?oc=5&hl=en-US&gl=US&ceid=US:en,https://indianexpress.com,The Indian Express,,{'https://lh3.googleusercontent.com/J6_coFbogxhRI9iM864NL_liGXvsQp2AupsKei7z0cNNfDvGUmWUy20nuUhkREQyrpY4bEeIBuc=s0-w300'},
Community Health Workers’ submit Charter of Demands to Nepal’s Prime Minister - Public Services International,Community Health Workers’ submit Charter of Demands to Nepal’s Prime Minister  Public Services International,2024-08-26 12:20:39,https://news.google.com/rss/articles/CBMi3gFBVV95cUxNUk5YdEFKMVlveWtETDYxS05vSWpDRnptRGZuLUw0VXJWd1ZRNVFqcVpiTUI3Xzh2YU51ZjI2bkFYZFBEUXlINE0xYXNoS0l1aGloendkRjEyRzluaUNMZ0dkMTM4c1o1THZDZDJUWVphX0tobEN4V2VwckhCaGxnei1yQ2NQQUUzMWJNVGJFX1VOTXBGaDZUMzJoX1BvdjBLOFpOYnJIOTVBY3Z6Z1dXNTB1aEwzXzFfdklkSDFJLV9uYXpYN2hPdkFoMURkX1RncmR1Uld2bUZadkdrcFE?oc=5&hl=en-US&gl=US&ceid=US:en,https://publicservices.international,Public Services International,,{'https://lh3.googleusercontent.com/J6_coFbogxhRI9iM864NL_liGXvsQp2AupsKei7z0cNNfDvGUmWUy20nuUhkREQyrpY4bEeIBuc=s0-w300'},
27 killed after a bus with Indian pilgrims drives off a Nepal highway and crash - ABC News,27 killed after a bus with Indian pilgrims drives off a Nepal highway and crash  ABC News,2024-08-26 14:03:21,https://news.google.com/rss/articles/CBMitAFBVV95cUxQY3dmX0JMejhKY28tTndkRUJLT3dValNZVnpQRWxlekdPZWN4akJLX01EVGxkQ3FyOU1VaFI5Z29JOXJHcFdhLXNlME5leGNBZV80R3JUSkh3cVRnNURDU2cyRURlV0ZvZEJFMkNZaTVqSlJzc1ZFN0FQNU1VdGRVRzREcjlKaVFYanVuSUZxNFlXampPZm5TMU5qUndVdjJ0TVZSMGU4TWRkdmtaVjMwZUlSOVPSAboBQVVfeXFMT0wzdEY1N3lmM2lYNTFZRVBVbnBoeFdRaTNLenc4WWxHVVpuV1plRF9OcUxoN3ZXWFJwUUhqZGRwVVlJRlUwb09CdmNETXZLeGZmaUNicWJTZ2JCd2ZqWmhlSVJ3ZzNtNEY5STQwb1ZPdEhkR3JSYXJrTWt0VXNFM25LOXpDYlFBZENQYTYyalF4aFVaeGtiQkM2Qlo0bDRqeXl1LVUxYlFDNk9KT1Y3TXB1Y2JWd0ZPQmpB?oc=5&hl=en-US&gl=US&ceid=US:en,https://abcnews.go.com,ABC News,,{'https://lh3.googleusercontent.com/J6_coFbogxhRI9iM864NL_liGXvsQp2AupsKei7z0cNNfDvGUmWUy20nuUhkREQyrpY4bEeIBuc=s0-w300'},
Nepal maintains balanced 'friendly' ties with India & China: PM Oli - Deccan Herald,Nepal maintains balanced 'friendly' ties with India & China: PM Oli  Deccan Herald,2024-08-26 16:28:29,https://news.google.com/rss/articles/CBMiqAFBVV95cUxPMnRqSFhCTExCMnBCa3h0NFNwdWc4dUJaOVdBZWJrYk9RWEdGOHdHMHlMZmZYdU54VVlUMy1udktST3NNdEplcFY5TlhXSXlZRzI5bE5xaGR3c210V2lDamFpNGhMVzNtV2VVVXgzM0ZXWGJSUDB1cVM2aUhCZWpoMFBQTkdRU3NJY2o3WVpEX3dVWW9HUmpRb2haTmVYTVB1eHRXdDVTV1k?oc=5&hl=en-US&gl=US&ceid=US:en,https://www.deccanherald.com,Deccan Herald,,{'https://lh3.googleusercontent.com/J6_coFbogxhRI9iM864NL_liGXvsQp2AupsKei7z0cNNfDvGUmWUy20nuUhkREQyrpY4bEeIBuc=s0-w300'},
US Aviation Academy Adds Nepal CAA Approval as Approved Training Organisation - Airline fleet Management,US Aviation Academy Adds Nepal CAA Approval as Approved Training Organisation  Airline fleet Management,2024-08-26 21:29:30,https://news.google.com/rss/articles/CBMimwFBVV95cUxPb0U4RHNTcHlNNVUwakFBZFhmZXFMbjJxaUplampWX3hiLVNqRTFIM1A0VGNlNVVJdXhIeENCai0zaDNjYWJxTG1yOWFmZnBWa2xMRl95Zi11SWpGM2lWclVGNzlBTm85eTQyNk4zZmFHUmFLQk42dXBVVVNmc2RqQ0RTYjNxRHNfVGdramlJWEdBMUZKbTBCR3d4SQ?oc=5&hl=en-US&gl=US&ceid=US:en,https://afm.aero,Airline fleet Management,,{'https://lh3.googleusercontent.com/J6_coFbogxhRI9iM864NL_liGXvsQp2AupsKei7z0cNNfDvGUmWUy20nuUhkREQyrpY4bEeIBuc=s0-w300'},
TikTok’s comeback in Nepal: The Kathmandu Post - asianews.network,TikTok’s comeback in Nepal: The Kathmandu Post  asianews.network,2024-08-27 03:47:36,https://news.google.com/rss/articles/CBMiekFVX3lxTFB4TDNBa3laa0VTeXRQU1lQQzFDWC1JamU2YzMwRl8xYndMaEVUQ1FpRnZjT2R3SHQ0V1gxaTk3ejhaSkJMLWJIeDlVM1FIM2NGVkFLT2RsaktvVzk0OVA0VzVrR0UtcDlua3BleDhXWWY3cjc4YnNKSUpR?oc=5&hl=en-US&gl=US&ceid=US:en,https://asianews.network,asianews.network,,{'https://lh3.googleusercontent.com/J6_coFbogxhRI9iM864NL_liGXvsQp2AupsKei7z0cNNfDvGUmWUy20nuUhkREQyrpY4bEeIBuc=s0-w300'},
Budget constraints limit wildlife protection in major Nepali road project - Mongabay.com,Budget constraints limit wildlife protection in major Nepali road project  Mongabay.com,2024-08-27 05:20:22,https://news.google.com/rss/articles/CBMirAFBVV95cUxOZE4xNGVOZmRHTW9JdndmWGlRbGdWcWtXN21kTk93RElBY1NHeU00WTgzN3JwTS1NTzhxbjFLWW5zeTBMOVVhejNJRk0yT1ZIUkdqRjR0SVNaelhRUEtYVjQ1MnBVZ05UOC05b2xrYU1MVVVkcVNfQVlJWlVwRWRqM1pROTFkZHRLbjN4ODlJSXVSVjZJRklKNkE1WUtKY3VRRjBLU1RGYV9vRlhj?oc=5&hl=en-US&gl=US&ceid=US:en,https://news.mongabay.com,Mongabay.com,,{'https://lh3.googleusercontent.com/J6_coFbogxhRI9iM864NL_liGXvsQp2AupsKei7z0cNNfDvGUmWUy20nuUhkREQyrpY4bEeIBuc=s0-w300'},
"Did Nepal lose me, or I lost Nepal? :: Dr. Lok Bahadur Shrestha - Setopati","Did Nepal lose me, or I lost Nepal? :: Dr. Lok Bahadur Shrestha  Setopati",2024-08-27 06:18:41,https://news.google.com/rss/articles/CBMiS0FVX3lxTFBPWTdhdzFJRmM1MUdtekNwa2EwNElYUGVUd3BZZ3BOS0dORVNzQUdxZW0wZmUwUW52SHNIblZkOS1acU43SkF2UG5RRQ?oc=5&hl=en-US&gl=US&ceid=US:en,https://en.setopati.com,Setopati,,{'https://lh3.googleusercontent.com/J6_coFbogxhRI9iM864NL_liGXvsQp2AupsKei7z0cNNfDvGUmWUy20nuUhkREQyrpY4bEeIBuc=s0-w300'},
China's New Silk Road: Beijing increases its influence in Nepal - Focus - FRANCE 24 English,China's New Silk Road: Beijing increases its influence in Nepal - Focus  FRANCE 24 English,2024-08-27 08:48:52,https://news.google.com/rss/articles/CBMitAFBVV95cUxNNHlVTVNRVFMyWTdJcS1kZnNsT183c0dDNktkNmJwc3hjbXJweE5tbF9MQ1Mxd09YcUJ1ZDRDMHdBUjBJOUhpNGFORW1QNms5OE9UNU95SlFqWWlFamFYNzlwTjFUeDQwOFBSSlhpa0pvenlOQnFZVDIzbEN5OXJrckZwZXEzSFRHSDFWS2Q2TEhEakh5V2EwY3lwUXNnaFpjX2U4UHVMR19XR0xmZG1RbzNPdE8?oc=5&hl=en-US&gl=US&ceid=US:en,https://www.france24.com,FRANCE 24 English,,{'https://lh3.googleusercontent.com/J6_coFbogxhRI9iM864NL_liGXvsQp2AupsKei7z0cNNfDvGUmWUy20nuUhkREQyrpY4bEeIBuc=s0-w300'},
Nepal acknowledges BCCI's efforts for NCA training camp: Details here - NewsBytes,Nepal acknowledges BCCI's efforts for NCA training camp: Details here  NewsBytes,2024-08-27 11:00:41,https://news.google.com/rss/articles/CBMiowFBVV95cUxPRTVWR25sdURnU093Wnh0d0RYWWNjdk41LUFwOGtOSjVwX2R1M0o2UU91TU1KVTVQUkU0UFF1cTc1YVI5aGhKdm1pa0ZLUk1DS2hiRlhfOFRuc1UxZHRnREhYeWpOX1gyQ1ZXSTFYZG93NkhwM2piek9WcTY4cnNPUFhHUlZrSGpmbDFRS2VYdzdZRE4tSmt0RmxjcTRrTzNXRndB?oc=5&hl=en-US&gl=US&ceid=US:en,https://www.newsbytesapp.com,NewsBytes,,{'https://lh3.googleusercontent.com/J6_coFbogxhRI9iM864NL_liGXvsQp2AupsKei7z0cNNfDvGUmWUy20nuUhkREQyrpY4bEeIBuc=s0-w300'},
Nepal should recognise Palestinian sovereignty - Nepali times,Nepal should recognise Palestinian sovereignty  Nepali times,2024-08-27 12:27:01,https://news.google.com/rss/articles/CBMimgFBVV95cUxQM1VIbVZSTFQzaTdod3VpTi1hM19KU3YxUlBGd3JIaUJHV296VFV6ZDM3RUt4Xy1weFFFcHcyLVFzT2lWd0hkaElRX015UmlQX0RxUks4T2daT3IwaV9wV0JNQ3JmTlYtS2o5c1JuUU9xZUdGMmxyYlJuQ0VVQS13XzVvSFF1S0F6b1dnNUJaSkZudWRPZ01TYmN3?oc=5&hl=en-US&gl=US&ceid=US:en,https://nepalitimes.com,Nepali times,,{'https://lh3.googleusercontent.com/J6_coFbogxhRI9iM864NL_liGXvsQp2AupsKei7z0cNNfDvGUmWUy20nuUhkREQyrpY4bEeIBuc=s0-w300'},
"Live streaming, Nepal vs Bangladesh in SAFF U20 Championship 2024 final on August 28: Where to watch in India - SportsAdda","Live streaming, Nepal vs Bangladesh in SAFF U20 Championship 2024 final on August 28: Where to watch in India  SportsAdda",2024-08-27 13:08:48,https://news.google.com/rss/articles/CBMiywFBVV95cUxPR3Zuak5yMnBIaXJmc281WE1FYS04U0NicXEtVFYxSWVpNU5EMlZYNm92eUhuLVdPVTA4QVZWaEZfRjhEVjlXS1VqVnVQZE1wWmNWZ1FiNmZiWl8tY2dyRUlfYTJNajdCdnBVeFhEVE1KNktWTHA4WndiRTlzS2IySnFlR2NhekJiYjNUU09fLXdQTkY5UzI4STc4WnNIXzQ4UlNiNGgzdXk4Q1FRWGFBWGRidkt0RGdLbVNNUXRiaEFZUVBrMk1Td0I0WQ?oc=5&hl=en-US&gl=US&ceid=US:en,https://www.sportsadda.com,SportsAdda,,{'https://lh3.googleusercontent.com/J6_coFbogxhRI9iM864NL_liGXvsQp2AupsKei7z0cNNfDvGUmWUy20nuUhkREQyrpY4bEeIBuc=s0-w300'},
"Russian roulette. The first of two reports from Nepal, where impoverished locals are being duped into fighting in Ukraine - Новая газета. Европа","Russian roulette. The first of two reports from Nepal, where impoverished locals are being duped into fighting in Ukraine  Новая газета. Европа",2024-08-27 14:20:04,https://news.google.com/rss/articles/CBMicEFVX3lxTE14andFN0ZxRVVDVG9YLUdpN2Q3RzF0YWU3bU05ZVZ2eXktYXJqUXZCdHRUN2Z3R19vZFd0NnJmVkZOMXgzdThsekNsdTZmbXNTdkFzMWV6WDdhb3p5bWNHOWQ5MXFDNDBZcXp0NjhoVmY?oc=5&hl=en-US&gl=US&ceid=US:en,https://novayagazeta.eu,Новая газета. Европа,,{'https://lh3.googleusercontent.com/J6_coFbogxhRI9iM864NL_liGXvsQp2AupsKei7z0cNNfDvGUmWUy20nuUhkREQyrpY4bEeIBuc=s0-w300'},
Leveraging climate finance in Nepal - Dialogue Earth,Leveraging climate finance in Nepal  Dialogue Earth,2024-08-27 15:40:28,https://news.google.com/rss/articles/CBMiekFVX3lxTFBWWmZYdFpjM1lsRnEwOE5RbFFHTG9sM2ZudTJqazhxZEJsT0Y2MFJYNi1lMEhJRjVVS3doYzFhMDBwSXQ3YV96NWNUdmdaLThsWFEwUzJyZ2o4RUpxQ1dieS1nMmtzYU9YcHVfajRxTGcxeEdqbFBhRTNn?oc=5&hl=en-US&gl=US&ceid=US:en,https://dialogue.earth,Dialogue Earth,,{'https://lh3.googleusercontent.com/J6_coFbogxhRI9iM864NL_liGXvsQp2AupsKei7z0cNNfDvGUmWUy20nuUhkREQyrpY4bEeIBuc=s0-w300'},
"Spanish tourist found dead in Nepal, companion still missing - The Indian Express","Spanish tourist found dead in Nepal, companion still missing  The Indian Express",2024-08-27 17:43:21,https://news.google.com/rss/articles/CBMirAFBVV95cUxPU1RYekxRZm8wSGNBdzZpRF8xUW5wUnVpVk9VWHdrZU5fTmxOcXFXRl9jemVJVGFxMnpiSy1sSkhaQVVaYjl6dklsc3ZjMlJoYmFHWDFSNFJVSlJ4THRjZkI0Y3hrVGpsOUItdjJoTDY1UDhKY01hSWtuZjFBWTliSTEyTmNGYVlzcXluQzg2Uk1SZHFMSmlxOGZJQmliVnhieEIybDQwTHBfUHlQ0gGzAUFVX3lxTE9yUHh0TXZVNWNrempoc0s5LXZCTlhfUkw3eHk5d2dsYlRZZDYxem1Ralo3WkNnSUUyekt6ZFBFLVFFc1hwYVRzcXFzWEJycl92NG5KODRTRm42UGxiWUFGSG81YlJ6TVNxOFZ6dXV3Y2tlXzhTX1ZnSjNoWTk5a2h6YXNvZXF0bEIyMElsQU1JNVg4QUZ3TW9YdS1VUUIyRzhocWlRcDcyVjdPU3VBRzljZTBZ?oc=5&hl=en-US&gl=US&ceid=US:en,https://indianexpress.com,The Indian Express,,{'https://lh3.googleusercontent.com/J6_coFbogxhRI9iM864NL_liGXvsQp2AupsKei7z0cNNfDvGUmWUy20nuUhkREQyrpY4bEeIBuc=s0-w300'},
Nepal's Cricket Team Improves Its Skills With India's Support - Athlon Sports,Nepal's Cricket Team Improves Its Skills With India's Support  Athlon Sports,2024-08-27 19:44:18,https://news.google.com/rss/articles/CBMiqwFBVV95cUxNYkFER3lKVFJTbHoyWmY1VDYzeG15Tkp4OW9OQl9aQm9FTWxJODY4ZXNIRFZEdEdvWW81VV81ZWxrcXd2WWMtN1NXdm13bmdOSWFpZlpkbmVLNTNscWpBY2RPUHAxWThrak80cldRQy1lVURiY3EtWkY1S212RDJRbkg1WlNDX1Z5QXl1QzRYSW5pZGZLVE5xcElkSkN5VjcwUUQ4UEFKR2VmZ3M?oc=5&hl=en-US&gl=US&ceid=US:en,https://athlonsports.com,Athlon Sports,,{'https://lh3.googleusercontent.com/J6_coFbogxhRI9iM864NL_liGXvsQp2AupsKei7z0cNNfDvGUmWUy20nuUhkREQyrpY4bEeIBuc=s0-w300'},
"2 Nepal kids, who strayed into India, to reunite with parents - The Times of India","2 Nepal kids, who strayed into India, to reunite with parents  The Times of India",2024-08-27 22:58:00,https://news.google.com/rss/articles/CBMiyAFBVV95cUxQSnN5ZlVIZnYzTWlGclE2elJzWl9qbVRDekR6eEhzVXBHLVBXMDJIbTd5c0hHVmhSLUdGR2o0WEVvZ1F2X0U4TmRsRkVPNUJ4T0cwaHBRVU4wSkt1OVdxaEQ4QnF3YS1FNlZsRk0tRmdyaDlSM0ZvbXB5YXIxVTNXTnlpVjZyOVljR1pZQ2ZZdmstZmYyMUtWSlh4cmJkcFN3eHI4azF0aGlIdjNtOWVrUm5JNDJNSVlFbXVBV3VGVnB6QTFoNGQwWdIBzgFBVV95cUxQcFkxMk84d1ExOE8wU0FUZzRoUmQ2bFI2ME9KWU9CWkVTQ0FmS3NUbU1GN0V5R3NYMHVtZFRSdWt0aHVxeE1RQWtBenRicjAwUUVpdmxxTE0wbzU0X0RHTnRPU2drQlJNT0lscHdKeU9oNXVKT2twVm5OTWNXMmtqbVVUOFljNU1WWFk0TUxMNDk3RjR3MXRfRlVhcHJOTTNwMTZURDVIajBxcHJpT2pXcFRNZ20wLWFOd2VjRHVtSGVjU2ZnaDlfclpIVjB4QQ?oc=5&hl=en-US&gl=US&ceid=US:en,https://timesofindia.indiatimes.com,The Times of India,,{'https://lh3.googleusercontent.com/J6_coFbogxhRI9iM864NL_liGXvsQp2AupsKei7z0cNNfDvGUmWUy20nuUhkREQyrpY4bEeIBuc=s0-w300'},
7 Bhusawal residents injured in Nepal return to Mumbai - The Times of India,7 Bhusawal residents injured in Nepal return to Mumbai  The Times of India,2024-08-27 23:15:00,https://news.google.com/rss/articles/CBMixwFBVV95cUxOXzYzRlFRQkVFUE5QSjNtS0tBMTQzWFU1Nml4ZmxTNGcwcTZtNFNqbVJtMkEydklYQ3BGY19jOUVIRkRzM2t4MUtBVHdSUkJmWGpKdzFNMG5jaUlraWlfLXB1dVU4YTRyV2p0WG9YR2p4bzJFYkVPTnBCVVh3V004VnZXbEpQenJXcjZNUXpsMTFaYlBfSUhscHdmb1hqQ3BKdE0xcmNEblNvcmROS0o0elVpb3NESEdGTTNDdHpYckVZWk9MeUtF0gHMAUFVX3lxTE5JTkI2WnZaRm54TEZJOC13VzlGbUNUTzA0NlowcUNsNTNrbzBpNDhyc1l6REQ1T3pRWVRaNDdReUdEdnNkYnhqSnhITkthMFgxU3o3TmZOSUpZbnVxcDN6ZlY0RXpCaTgzYm1LY1ozeWFUYjJGYUhlWTNqd1N2TXp6MjhFNEpqSlNyaVA0UXk3U2hHaHhrem1ZSHBYbE9tTVpYMF9BdUxOSlk0ZWhXX0U4eERRYkhlY1BfaWFPVDRHbThNNktNWmp3b3JtOQ?oc=5&hl=en-US&gl=US&ceid=US:en,https://timesofindia.indiatimes.com,The Times of India,,{'https://lh3.googleusercontent.com/J6_coFbogxhRI9iM864NL_liGXvsQp2AupsKei7z0cNNfDvGUmWUy20nuUhkREQyrpY4bEeIBuc=s0-w300'},
