title,description,published date,url,publisher.href,publisher.title,full_article,images,translated
"Opinion | Between Delhi and Beijing, Nepal forgets Kathmandu - The Kathmandu Post","Opinion | Between Delhi and Beijing, Nepal forgets Kathmandu  The Kathmandu Post",2026-07-17 01:31:02,https://news.google.com/rss/articles/CBMimgFBVV95cUxOY1pxWVJkZ0ZfNnRSTFM3X2c1STQyc0lQaVc2cmhRcmotSWVURGpqQUlKSzR5NnpDbThSMUoxdWZ2WWpwNUQ4Q0xQRFdZV3dpWkVGdmhlbjB3X0k3WUlGN2E3ZmlWTS1LNFNCTC1FYTk0U2JiOGtMWlZFQ1BsRnpVNWRobXVJSEtueEJ0bEowWjE2ZXRoWktQNzRR?oc=5&hl=en-US&gl=US&ceid=US:en,https://kathmandupost.com,The Kathmandu Post,"Every few years, Nepal rediscovers its neighbourhood. A new government promises a reset with India, a fresh understanding with China and a development-driven foreign policy. Yet, the debate always ends where it began. Nepal’s greatest foreign policy problem is not Delhi or Beijing. It is the weakness of the Nepali state. The real divide is no longer between India and China but between ambition and implementation.

Rabi Lamichhane’s op-ed, published as the chairman of the Rastriya Swatantra Party visited New Delhi to meet Prime Minister Narendra Modi, identified several real problems. He wrote about the gap between Nepal’s potential and its performance, the need to move beyond grievance politics and the untapped promise of hydropower. On each of these points, he is broadly correct.

But none of this is new. Since 1990, every major government has framed its neighborhood policy around development cooperation. Madhav Kumar Nepal spoke of balanced engagement; Baburam Bhattarai emphasised infrastructure; KP Sharma Oli mixed connectivity with confrontation; and Nepali Congress governments pursued the same agenda. The vocabulary rotated, not the implementation.

The past month illustrated this pattern. Within nine days, Foreign Minister Shishir Khanal visited New Delhi and Beijing. In Delhi, he assured India that the new government carried ‘no old baggage’ and gave bilateral ties the highest priority. In Beijing, he reaffirmed the One-China policy, pledged that Nepali soil would not be used against Chinese interests and proposed new trans-Himalayan connectivity. While both visits produced warm declarations, neither produced a single new agreement.

This is not an exception. Nepal promises the Raxaul-Kathmandu railway to India and a trans-Himalayan railway to China. The 2017 Belt and Road framework remains largely on paper. The Pancheswor Project has awaited implementation since 1996. The problem is not which neighbour Nepal chooses. It is that Nepal struggles to deliver either.

The border episode revealed the same weakness. In his first address to Parliament, Prime Minister Balendra Shah said Nepal had also encroached on Indian territory and proposed a third-party involvement in resolving the dispute. Within days, Nepal’s position shifted from internationalisation to clarification and back to bilateralism. A state that cannot speak with one voice cannot negotiate from a position of strength.

And the ‘no old baggage’ formula deserves examination, not applause. A country does not carry the baggage of its parties. It carries the weight of its treaties, its disputes and its diplomatic record. The 1950 Treaty is not the Rana regime’s treaty. Kalapani and Lipulekh are not any party’s baggage. The Eminent Persons Group report, unimplemented since 2018, belongs to Nepal as a state. The baggage Khanal disclaimed in Delhi included baggage his own prime minister had produced days earlier. Governments do not only inherit history. They produce it.

These recurring failures point to a deeper structural problem: Foreign policy is ultimately implemented not by speeches, but by institutions.

Political theorist Benjamin Barber argued that modern states are pulled apart by domestic fragmentation and pushed together by global economic integration. Nepal lives in that tension. The Gen Z protest that reshaped the country’s politics demanded accountability from a state perceived as captured, while remittances, payment systems, power grids and connectivity corridors pull the country into deeper integration with both neighbours. A state that struggles to govern effectively at home will also struggle to negotiate and deliver abroad. External ambition depends on domestic capability.

Integration is no longer a question but a fact. Cross-border power trade has become structural, with Nepali electricity flowing into the Indian grid and onward to Bangladesh. The linkage of India’s UPI with Nepal’s payments system is more than a banking arrangement, marking a shared economic space where payments, tourism and remittances move through common platforms. The old debate was dependence versus sovereignty. The real question is whether Nepal can convert integration into leverage.

Nepal’s neighbours have changed faster than Nepal has. India is now a major economic and digital power, central to global supply chains. China courts Nepal through the Belt and Road, a family of global initiatives and party-to-party channels, while reminding Kathmandu that ‘distant relatives matter less than close neighbours’. Nepal is negotiating today with two states that treat connectivity, security and digital integration as strategic priorities. Pretending otherwise only weakens Nepal’s hand with both.

Yet, responsibility does not lie with Nepal alone. As Kautilya observed, lasting influence rests more on mutual benefit than coercion, and that principle applies to larger powers as much as to smaller ones. A neighbour constantly reminded of its smallness rarely becomes a more reliable partner. Strategic competition between India and China has increased Nepal’s relevance, but geography rewards only those states capable of using it. Otherwise, location becomes a source of pressure rather than a source of leverage.

India has known Nepal’s hydropower since the 1950s, and China has discussed Himalayan connectivity for decades. What has held Nepal back was never only Indian indifference or Chinese hesitation. It was the absence of regulatory certainty, administrative competence and political continuity needed to turn opportunity into power. Winning an election and governing are different things. Electoral mandates remove excuses, but they do not create capability. Nepal’s recent history is a procession of governments that entered office with political capital and left without strengthening the institutions that translate ambition into achievement.

BP Koirala understood this long before ‘state capability’ became the language of modern political science. Remembered as a democrat, he was equally a strategist. During the 1954 Koshi negotiations, he opposed not Indian investment but Nepal’s inability to negotiate from a position of internal coherence. The negotiation was revised 12 years later, but the political cost fell on Nepal. His lesson remains relevant today: Sovereignty is measured not by rhetoric but by capability. A weak state can speak the language of independence while remaining dependent in practice. A capable state can negotiate confidently with powers far larger than itself.

That is why Nepal’s neighbourhood debate keeps missing the point. The decisive question is no longer whether Nepal leans towards Delhi or Beijing, nationalism or pragmatism, old parties or new. It is whether the Nepali state can negotiate, implement, regulate and sustain what it signs. Nepal has never lacked opportunities. What it has lacked, too often, is the institutional capability to turn these opportunities into national power.","{'https://assets-cdn.kathmandupost.com/uploads/source/news/2026/opinion/DOWN_AI%20Generated%20Image%20(1).png', 'https://openweathermap.org/img/w/04d.png', 'https://jcss-cdn.kathmandupost.com/assets/images/logo-sticky-bar-tkp-weekender-1.png', 'https://jcss-cdn.kathmandupost.com/assets/images/lazy.png', 'https://jcss-cdn.kathmandupost.com/assets/images/tkp-logo-weekender.png', 'https://jcss-cdn.kathmandupost.com/assets/images/logos/thekathmandupost-logo.png', 'https://jcss-cdn.kathmandupost.com/assets/images/logos/thekathmandupost-logo-white.png'}","हर किछु वर्ष पर नेपाल अपन पड़ोसक पुनः खोज करैत अछि । एकटा नव सरकार भारत के संग रीसेट, चीन के संग ताजा समझौता आ विकास संचालित विदेश नीति के वादा करैत अछि. तइयो बहस सदिखन ओतहि समाप्त होइत अछि जतय सँ शुरू भेल छल। नेपाल केरऽ विदेश नीति केरऽ सबसें बड़ऽ समस्या दिल्ली या बीजिंग नै छै । ई नेपाली राज्यक कमजोरी थिक। असली विभाजन आब भारत आ चीन के बीच नै बल्कि महत्वाकांक्षा आ कार्यान्वयन के बीच अछि।

राष्ट्रिय स्वतंत्र पार्टी केरऽ अध्यक्ष के रूप म॑ प्रकाशित रबी लामिछाने केरऽ ओपी-एड म॑ प्रधानमंत्री नरेंद्र मोदी स॑ मिलै लेली नई दिल्ली गेलऽ छेलै, जेकरा म॑ कईएक वास्तविक समस्या के पहचान करलऽ गेलऽ छै । नेपाल केरऽ क्षमता आरू ओकरऽ प्रदर्शन के बीच के अंतर, शिकायत के राजनीति स॑ आगू बढ़ै के जरूरत आरू जलविद्युत के अप्रयुक्त वादा के बारे म॑ हुनी लिखलकै । एहि प्रत्येक बिन्दु पर ओ मोटा-मोटी सही छथि ।

मुदा एहि मे सँ कोनो बात नव नहि अछि। 1990 स हर पैघ सरकार अपन पड़ोसी नीति कए विकास सहयोग क इर्द-गिर्द बनौने अछि। माधव कुमार नेपाल संतुलित जुड़ावक बात केलनि; बाबुराम भट्टराई बुनियादी ढांचा पर जोर देलनि; केपी शर्मा ओली टकराव के संग कनेक्टिविटी के मिला देलखिन; आ नेपाली कांग्रेस सरकार सेहो एही एजेंडा के पालन केलक। शब्दावली घुमि गेल, क्रियान्वयन नहि।

पिछला मास एहि पैटर्न कए दर्शाबैत छल। नौ दिन के भीतर विदेश मंत्री शिशिर खनाल नई दिल्ली आ बीजिंग के दौरा केलनि। दिल्ली मे ओ भारत कए आश्वासन देलथि जे नव सरकार ‘कोनो पुरान सामान नहि’ ल’ क’ चलैत अछि आ द्विपक्षीय संबंध कए सर्वोच्च प्राथमिकता दैत अछि । बीजिंग मे ओ एक चीन नीति के दोबारा पुष्टि केलनि, नेपाली माटि के चीनी हित के खिलाफ उपयोग नहि करबाक प्रतिज्ञा केलनि आ हिमालय पार सं नव संपर्क के प्रस्ताव देलनि। जखन कि दुनू यात्रा स गर्मजोशी स घोषणा भेल, मुदा दुनू मे स कोनो एकटा नव समझौता नहि भेल।

ई कोनो अपवाद नहि अछि। नेपाल भारत के रक्सौल-काठमांडू रेलवे आ चीन के हिमालय पार रेलवे के वादा करैत अछि । 2017 क बेल्ट एंड रोड ढाँचा काफी हद तक कागज पर बनल अछि। पंचेश्वर परियोजना 1996 स क्रियान्वयन क प्रतीक्षा मे अछि।समस्या इ नहि अछि जे कोन पड़ोसी नेपाल चुनैत अछि। ई जे नेपाल दुनू मे सँ कोनो एक केँ पहुँचाबय लेल संघर्ष करैत अछि।

सीमा प्रकरण मे सेहो इएह कमजोरी सामने आयल। संसदमे अपन पहिल संबोधनमे प्रधानमन्त्री बलेन्द्र शाह नेपाल भारतीय क्षेत्रमे सेहो अतिक्रमण केने बतौलनि आ विवादक निराकरणमे तेसर पक्षक संलग्नताक प्रस्ताव रखलनि । किछुए दिन मे नेपालक स्थिति अंतर्राष्ट्रीयकरण सँ स्पष्टीकरण दिस आ फेर द्विपक्षीयता दिस बढ़ि गेल । जे राज्य एक आवाज स नहि बाजि सकैत अछि ओ ताकत क स्थिति स वार्ता नहि क सकैत अछि।

आ ‘नो ओल्ड बैगेज’ फार्मूला वाहवाही नहि, परीक्षणक पात्र अछि । कोनो देश अपन दलक सामान नहि लऽ जाइत अछि । ई अपनऽ संधि, अपनऽ विवाद आरू अपनऽ कूटनीतिक रिकॉर्ड के वजन उठाबै छै । 1950 के संधि राणा शासन के संधि नहिं अछि. कालापानी आ लिपुलेख कोनो पार्टी’क सामान नहि. २०१८ सँ अप्रवर्तित प्रख्यात व्यक्ति समूहक प्रतिवेदन राज्यक रूपमे नेपालक अछि । दिल्ली मे खनाल जे सामान अस्वीकार केलथि ओहि मे ओ सामान सेहो शामिल छल जे हुनकर अपन प्रधानमंत्री किछु दिन पहिने पेश केने छलाह। सरकार के खाली इतिहास के विरासत में नै मिलै छै। एकर उत्पादन करैत छथि ।

ई बार-बार आबै वाला असफलता एगो गहरी संरचनात्मक समस्या के तरफ इशारा करै छै: विदेश नीति अंततः भाषण स॑ नै, बल्कि संस्था द्वारा लागू करलऽ जाय छै ।

राजनीतिक सिद्धांतकार बेंजामिन बार्बर के तर्क छेलै कि आधुनिक राज्य घरेलू विखंडन के कारण अलग होय जाय छै आरू वैश्विक आर्थिक एकीकरण के कारण एक साथ धकेललऽ जाय छै । नेपाल ओहि तनाव मे जीबैत अछि। देश केरऽ राजनीति क॑ नया रूप दै वाला जेन जेड विरोध प्रदर्शन म॑ कैप्चर करलऽ गेलऽ राज्य स॑ जवाबदेही के मांग करलऽ गेलऽ छेलै, जबकि रेमिटंस, भुगतान प्रणाली, पावर ग्रिड आरू कनेक्टिविटी कॉरिडोर देश क॑ दोनों पड़ोसी देशऽ के साथ गहराई स॑ एकीकरण म॑ खींचै छै । जे राज्य घर मे प्रभावी ढंग स शासन करबा लेल संघर्ष करत ओ विदेश मे सेहो बातचीत आ डिलीवरी करबा मे संघर्ष करत। बाहरी महत्वाकांक्षा घरेलू क्षमता पर निर्भर करैत अछि।

एकीकरण आब कोनो सवाल नहि रहि गेल अछि बल्कि तथ्य बनि गेल अछि। सीमा पार स बिजली व्यापार संरचनात्मक भ गेल अछि, जाहि स नेपाली बिजली भारतीय ग्रिड मे आ आगू बांग्लादेश तक बहैत अछि। भारत केरऽ यूपीआई क॑ नेपाल केरऽ भुगतान प्रणाली स॑ जोड़ना बैंकिंग व्यवस्था स॑ भी अधिक छै, जे एगो साझा आर्थिक स्थान के चिन्हित करै छै, जहां भुगतान, पर्यटन आरू रेमिटैंस आम प्लेटफॉर्मऽ के माध्यम स॑ चलै छै । पुरान बहस छल निर्भरता बनाम संप्रभुता। असली सवाल ई छै कि नेपाल एकीकरण क॑ लीवरेज म॑ बदली सकै छै कि नै ।

नेपाल के पड़ोसी देश मे नेपाल सं बेसि तेजी सं बदलाव आयल अछि. भारत आब एकटा प्रमुख आर्थिक आ डिजिटल शक्ति अछि, जे वैश्विक आपूर्ति श्रृंखला मे केंद्रीय अछि । चीन वैश्विक पहल आरू पार्टी-टू-पार्टी चैनल के परिवार बेल्ट एंड रोड के माध्यम स॑ नेपाल क॑ कोर्ट करै छै, जबकि काठमांडू क॑ याद दिलाबै छै कि ‘नजदीकी पड़ोसी स॑ दूर के रिश्तेदारऽ के महत्व कम छै’ । नेपाल आइ कनेक्टिविटी, सुरक्षा आ डिजिटल एकीकरण कए सामरिक प्राथमिकता मानय वाला दूटा राज्य स बातचीत क रहल अछि। अन्यथा नाटक करब दुनू स’ नेपाल’क हाथ कमजोर भ’ जाइत छैक.

तइयो जिम्मेदारी मात्र नेपालक नहि अछि । जेना कि कौटिल्य देखलनि जे स्थायी प्रभाव जबरदस्ती स बेसी आपसी लाभ पर निर्भर करैत अछि आ ओ सिद्धांत पैघ शक्ति पर ओतबे लागू होइत अछि जतेक छोट शक्ति पर । एकरऽ छोटऽपन के याद लगातार याद दिलाबै वाला पड़ोसी शायद ही कभी अधिक विश्वसनीय साथी बनी जाय छै । भारत आरू चीन के बीच सामरिक प्रतिस्पर्धा स॑ नेपाल केरऽ प्रासंगिकता बढ़ी गेलऽ छै, लेकिन भूगोल खाली वू राज्यऽ क॑ पुरस्कृत करै छै जे एकरऽ उपयोग करै म॑ सक्षम छै । अन्यथा स्थान लीवरेज के स्रोत स बेसी दबाव के स्रोत बनि जाइत अछि ।

भारत नेपाल केरऽ जलविद्युत क॑ १९५० के दशक स॑ ही जानत॑ छै, आरू चीन दशकऽ स॑ हिमालय केरऽ कनेक्टिविटी प॑ चर्चा करी रहलऽ छै । नेपाल के जे रोकने अछि ओ कहियो भारतीय उदासीनता या चीनी संकोच नहि छल । ई छेलै कि अवसर क॑ सत्ता म॑ बदलै लेली नियामक निश्चितता, प्रशासनिक दक्षता आरू राजनीतिक निरंतरता के अभाव के जरूरत छेलै । चुनाव जीतब आ शासन करब अलग-अलग बात अछि। चुनावी जनादेश बहाना हटाबै छै, लेकिन क्षमता पैदा नै करै छै । नेपाल केरऽ हाल केरऽ इतिहास ऐन्हऽ सरकारऽ के जुलूस छेकै जे राजनीतिक पूंजी के साथ पद प॑ प्रवेश करी क॑ महत्वाकांक्षा क॑ उपलब्धि म॑ बदलै वाला संस्था क॑ मजबूत नै करी क॑ चल्लऽ गेलै ।

बी.पी.कोइराला ई बात ‘राज्य क्षमता’ आधुनिक राजनीति विज्ञानक भाषा बनबा सँ बहुत पहिने बुझि गेल छलाह | डेमोक्रेट के रूप में याद करलऽ जाय वाला वू भी ओतने रणनीतिकार छेलै । 1954 के कोशी वार्ता के दौरान ओ भारतीय निवेश के नहि बल्कि नेपाल के आंतरिक सुसंगतता के स्थिति स बातचीत करय मे असमर्थता के विरोध केलखिन्ह. 12 साल बाद वार्ता मे संशोधन भेल, मुदा राजनीतिक लागत नेपाल पर पड़ल। हुनक पाठ आइयो प्रासंगिक अछि : संप्रभुताक नाप अलंकार सँ नहि अपितु क्षमता सँ होइत छैक | कमजोर राज्य व्यवहार मे आश्रित रहैत स्वतंत्रताक भाषा बाजि सकैत अछि । एकटा सक्षम राज्य अपना सं कहीं पैघ शक्ति सं आत्मविश्वास सं बातचीत क सकैत अछि.

यैह कारण अछि जे नेपाल’क पड़ोसी बहस मे बात छूटि जाइत रहैत अछि. निर्णायक प्रश्न आब ई नहि अछि जे नेपाल दिल्ली दिस झुकल अछि वा बीजिंग, राष्ट्रवाद वा व्यवहारवाद, पुरान दल वा नव । ई छै कि नेपाली राज्य जे हस्ताक्षर करै छै ओकरा बातचीत, कार्यान्वयन, नियमन आरू कायम रखै सकै छै कि नै । नेपाल मे कहियो अवसरक अभाव नहि भेल अछि । एकरा म॑ जे कमी रहलऽ छै, बहुत बार, वू छै ई अवसरऽ क॑ राष्ट्रीय सत्ता म॑ बदलै के संस्थागत क्षमता ।"
