title,description,published date,url,publisher.href,publisher.title,full_article,images,translated
Reconstruction of monasteries in Sindhupalchowk nears completion - The Rising Nepal,Reconstruction of monasteries in Sindhupalchowk nears completion  The Rising Nepal,2025-05-24 01:43:05,https://news.google.com/rss/articles/CBMiUEFVX3lxTE8zUkdjUzEyYzcyNEl4U1BmLURQX0xVamFNMWx6ZEVySGV3SkpSUEJVdFJCbnktWDVMblpvdURTRU9SeF9hWU8wR0NzTUM2TDBL?oc=5&hl=en-US&gl=US&ceid=US:en,https://risingnepaldaily.com,The Rising Nepal,,{'https://lh3.googleusercontent.com/J6_coFbogxhRI9iM864NL_liGXvsQp2AupsKei7z0cNNfDvGUmWUy20nuUhkREQyrpY4bEeIBuc=s0-w300'},
KOICA hands over three volunteers - The Rising Nepal,KOICA hands over three volunteers  The Rising Nepal,2025-05-24 01:47:46,https://news.google.com/rss/articles/CBMiUEFVX3lxTE5GRUZjdndDSlpXSURqajFXeHB0Nkg2MVhGN2lqc1JsSU1XbE4zeW15ZUFJMzQ1b1g0NkNWQ0hEbWx2X1NmaGFJcHpOVXdReG51?oc=5&hl=en-US&gl=US&ceid=US:en,https://risingnepaldaily.com,The Rising Nepal,,{'https://lh3.googleusercontent.com/J6_coFbogxhRI9iM864NL_liGXvsQp2AupsKei7z0cNNfDvGUmWUy20nuUhkREQyrpY4bEeIBuc=s0-w300'},
Nepal’s tea export increases - The Rising Nepal,Nepal’s tea export increases  The Rising Nepal,2025-05-24 01:57:48,https://news.google.com/rss/articles/CBMiUEFVX3lxTE1KNEtJNkZIOWFaTEQxSjd0WjNoV3loV1JfOXZ1bnY1TFFkeVd5aTRzZi1DWlN5VnRTMzhVM1paUkRObXdCcUJCVWgzbDFuZjBR?oc=5&hl=en-US&gl=US&ceid=US:en,https://risingnepaldaily.com,The Rising Nepal,,{'https://lh3.googleusercontent.com/J6_coFbogxhRI9iM864NL_liGXvsQp2AupsKei7z0cNNfDvGUmWUy20nuUhkREQyrpY4bEeIBuc=s0-w300'},
SCO demonstration area promoted in Nepal - Xinhua,SCO demonstration area promoted in Nepal  Xinhua,2025-05-24 02:15:00,https://news.google.com/rss/articles/CBMifEFVX3lxTE1TUU10V0pnUDRFTmowOHRVdWQ5NDh5T3l3dW1oYWxxSmJoMXZxcTg3VXZwaFVfaXpYcndwTXZfYUpmNlozUTdRcWI4eVdObTBxUS1oVzBxeHJWNXJIOVBOOEtKeUZZQ1ZwVk1ucC16XzZYOGk1QlN3ZGlvMFY?oc=5&hl=en-US&gl=US&ceid=US:en,https://english.news.cn,Xinhua,,{'https://lh3.googleusercontent.com/J6_coFbogxhRI9iM864NL_liGXvsQp2AupsKei7z0cNNfDvGUmWUy20nuUhkREQyrpY4bEeIBuc=s0-w300'},
Economic Digest: Nepal’s Business News in a Snap - Khabarhub,Economic Digest: Nepal’s Business News in a Snap  Khabarhub,2025-05-24 02:25:28,https://news.google.com/rss/articles/CBMiWEFVX3lxTFBKMmEtelFJTk5jZW5qUjU2OVJHekkwUzFQUVlhZEdYcW1MRGE2SVF6MDRfaUh4UnBEbUxDYlRoTzQ0Y3ZRNGJaeGs3WVd5Q1NadjFaN0M1cHc?oc=5&hl=en-US&gl=US&ceid=US:en,https://english.khabarhub.com,Khabarhub,,{'https://lh3.googleusercontent.com/J6_coFbogxhRI9iM864NL_liGXvsQp2AupsKei7z0cNNfDvGUmWUy20nuUhkREQyrpY4bEeIBuc=s0-w300'},
Nepal’s export boom driven by edible oil re-exports raises trade manipulation concerns - The Kathmandu Post,Nepal’s export boom driven by edible oil re-exports raises trade manipulation concerns  The Kathmandu Post,2025-05-24 02:50:52,https://news.google.com/rss/articles/CBMiyAFBVV95cUxObTQ5MG43RUlNRTdYZTlMR2hCS0wzU2Q1dEl6MUYySEE2RVJ2YnpXLVZ0NkNBc1cxVVlCeXRrWWNJbmcyUHRvUUdzQnJ5cjM4aG1TTHVsMF8zc1I2TTJnajdmOVl2Q1dZVmd0Um1kSjFJajNhSnBMS0UyVjdPVTcwWEVIWHNEV0tNOG5NQWZ1dFdWamZZakQ4WXFrbEFEMFVkbDNlZG5TczNHSXZpaFJqQ0xTNGIySEtyMy1TeFZyMXNQOGFuY0Rlaw?oc=5&hl=en-US&gl=US&ceid=US:en,https://kathmandupost.com,The Kathmandu Post,,{'https://lh3.googleusercontent.com/J6_coFbogxhRI9iM864NL_liGXvsQp2AupsKei7z0cNNfDvGUmWUy20nuUhkREQyrpY4bEeIBuc=s0-w300'},
Sukra wins Surya Nepal Challenge—in style - The Kathmandu Post,Sukra wins Surya Nepal Challenge—in style  The Kathmandu Post,2025-05-24 03:21:07,https://news.google.com/rss/articles/CBMijgFBVV95cUxOUTVtY2k2UGRTaUU5RFpvUHBGOEY5bHBCTC1uTkloTThzVV9tWE92R18wVk5Sdnh1MEZKN2FQYzYwMTBzV2ljck9Hd2htdmRxdGkyZTEyNDM0WFl5Z0VXcTFJbTh2SkVoMnVnR09HLXljUmd1SnpwTDJEQnhLamdNYnNhbER5WWdLeFZhS1h3?oc=5&hl=en-US&gl=US&ceid=US:en,https://kathmandupost.com,The Kathmandu Post,,{'https://lh3.googleusercontent.com/J6_coFbogxhRI9iM864NL_liGXvsQp2AupsKei7z0cNNfDvGUmWUy20nuUhkREQyrpY4bEeIBuc=s0-w300'},
Nepal’s top court upholds former Home Minister Lamichhane judicial custody - Public TV English,Nepal’s top court upholds former Home Minister Lamichhane judicial custody  Public TV English,2025-05-24 03:41:42,https://news.google.com/rss/articles/CBMipAFBVV95cUxNWWt6Y0c0OHd5Yy1QSmFKclR3NFBPRUQzTkxLTDBqXzlfNlhGRExNWV9McWRLdUhPTmFhbEFwZjdGZDdybFFoMURVRDZBVFkzR0xiVE5JM2F1b0ZiNG96SW5FSW1DUjdtU3BzX01jUHRQekliOXIyMl9ZMlB3cUlka21CcVdTeTV0Mk5KRW9ZcEExSVJ0amlxeE9OdXRsUlR3cG9wag?oc=5&hl=en-US&gl=US&ceid=US:en,https://english.publictv.in,Public TV English,,{'https://lh3.googleusercontent.com/J6_coFbogxhRI9iM864NL_liGXvsQp2AupsKei7z0cNNfDvGUmWUy20nuUhkREQyrpY4bEeIBuc=s0-w300'},
"India, Nepal conduct joint search operation for suspected Pakistani terrorists - Hindustan Times","India, Nepal conduct joint search operation for suspected Pakistani terrorists  Hindustan Times",2025-05-24 04:01:22,https://news.google.com/rss/articles/CBMi1wFBVV95cUxQTkY0Qk1fZWZjWWFRN1pOTzhod1VKSGJkWU1Yd0JXSjFiVWJ2bW5wZktmakcyNG94OWt4RHVuQ2hlWGJEYk1LTmpQM1dwMnNWb05LZVBxSmF2NXJwOW5yblFCZzJRbFVqOTQzOHVPc1hWb0NINEFIM05TQXpUaFhTVmRuU3duMzJvanN0bjkwbVRqLW91aGxVdTVWZGpLcHBsUk1Wb1lPTmR0N0F5ek5uOTdRNUY3bGowMlZDU1R3RVZTS0dlV3NBXzFXTDFwbUU3QjQ0b3dTc9IB3AFBVV95cUxNV3ZrOVlxVWE2V0xRTUhnWG1SWkRDRVllN3ptdzY0WlpYcUZNaXBiOTBRYnh6SXcxZXhpM3UwdE90aHB4Z2xISGVITHg5M21CZEZ6Mkg3WkttLWtUaFhvbEJKTnVEX1h3MlZCYWMtRXh2cUdWYWU1dTl4XzQwanZjNnlkc011RDNaYkNOR0pzTGdkSWw3VllFVF9BQU9KTkxXNDFmSTJSdTI3T05LZW1RZFNVMzBWSjlOWlU1YnEtYlJ6Ml9LaXJBWVA1UkU3SWdZQ2RibEdlV1FXMzVN?oc=5&hl=en-US&gl=US&ceid=US:en,https://www.hindustantimes.com,Hindustan Times,,{'https://lh3.googleusercontent.com/J6_coFbogxhRI9iM864NL_liGXvsQp2AupsKei7z0cNNfDvGUmWUy20nuUhkREQyrpY4bEeIBuc=s0-w300'},
Nepali films want more than applause - The Kathmandu Post,Nepali films want more than applause  The Kathmandu Post,2025-05-24 04:26:11,https://news.google.com/rss/articles/CBMijgFBVV95cUxNeXJaS2RyWWY5RHhXM3RBbEpralRjMmdSeTRHY2N6U1Fqd01zT0t2TlFZVGFUQUpXWTl2Rjh6WUNjRmxqTlpKa0FMNDZUNHRMcEloRkxoLUdDek9xYzN4aUZyaWNoU19nX1VWeFhvREJNVWFPWWNfSDBxR0toSWdHVkd4UldQZXlPUDZXU3FR?oc=5&hl=en-US&gl=US&ceid=US:en,https://kathmandupost.com,The Kathmandu Post,,{'https://lh3.googleusercontent.com/J6_coFbogxhRI9iM864NL_liGXvsQp2AupsKei7z0cNNfDvGUmWUy20nuUhkREQyrpY4bEeIBuc=s0-w300'},
"India, Nepal conduct joint border patrol amid terror threats - Daijiworld","India, Nepal conduct joint border patrol amid terror threats  Daijiworld",2025-05-24 04:30:26,https://news.google.com/rss/articles/CBMiakFVX3lxTFBueTZKTjE5RHRKTmlGY2xPbWFtcXBRbzlPMmF5alpXcnlrYWNxbVVTSld6TXBnaTFZaXVTZWFLSTVVN3ItUVVVNTd2cEVZSW9taVNJRkdLZEg4cjJtb09tWlNYVFNhX1J6MEE?oc=5&hl=en-US&gl=US&ceid=US:en,https://www.daijiworld.com,Daijiworld,,{'https://lh3.googleusercontent.com/J6_coFbogxhRI9iM864NL_liGXvsQp2AupsKei7z0cNNfDvGUmWUy20nuUhkREQyrpY4bEeIBuc=s0-w300'},
"Nepal’s young voices, unmuted - The Kathmandu Post","Nepal’s young voices, unmuted  The Kathmandu Post",2025-05-24 04:31:12,https://news.google.com/rss/articles/CBMigwFBVV95cUxNV3VYYmxJaHYtb0ltOE1rcElrNTg0NnFiem1hM1V1XzE4WUNHWmxJX3BDeVVzWEw0WTh5NVFnak5vWW51SFBYSEg3Vk9xc1RPVjBvYzlINi1Na2xwQlFDaXdBMjcxSExkTWxIZnlpaGpEcnRRbnJKc3RDVU4yLXNPTWh1MA?oc=5&hl=en-US&gl=US&ceid=US:en,https://kathmandupost.com,The Kathmandu Post,,{'https://lh3.googleusercontent.com/J6_coFbogxhRI9iM864NL_liGXvsQp2AupsKei7z0cNNfDvGUmWUy20nuUhkREQyrpY4bEeIBuc=s0-w300'},
"India, Nepal hold military drill after intel on Pak terrorists in Himalayan nation - MSN","India, Nepal hold military drill after intel on Pak terrorists in Himalayan nation  MSN",2025-05-24 05:01:59,https://news.google.com/rss/articles/CBMiygFBVV95cUxNM3BfME0wTmNsQ3l1U2x5bk5BSFNrRTVjVDRvTDl1VWZWRHNzNEpqN3NsdXZkdUxaYkVJUEdFajNqbmt1ZjFDdWt3QXdSbkxCX1dESkk5Z3dORko2Um11SHJ6MUpvbnhyYVptYmh2MXpIbVVXUUdDVDVNRUhYTmlWSklnOVJfTmlodVFnQXFTYjBvWFI5cXJ6RlpnbEtBdHVIOTBHWllDR0tQY01TeUcydTJyLW8tWTVhSXlSeXpnVl9fbHpzOFlwdFNR?oc=5&hl=en-US&gl=US&ceid=US:en,https://www.msn.com,MSN,,{'https://lh3.googleusercontent.com/J6_coFbogxhRI9iM864NL_liGXvsQp2AupsKei7z0cNNfDvGUmWUy20nuUhkREQyrpY4bEeIBuc=s0-w300'},
India-Nepal Forces Conduct Joint Border Patrol Amid Terror Alert - pragativadi.com,India-Nepal Forces Conduct Joint Border Patrol Amid Terror Alert  pragativadi.com,2025-05-24 05:21:38,https://news.google.com/rss/articles/CBMikwFBVV95cUxQMG5NNWtWSkdlcDlPRnZHZ3lqdlh5OGpHaVN4Y2s3MFBGRllwc3RtMlUtS3lXZHVqOEFXckFkVFFZdElkLU5Yc2hwN3JJbG9YYi1oOGNzM1pGZHhfLTBBUV9UXzcxVjUzajk2YkRJcGZZOWhtcEdQTWVoMG9iOE5yaUJhMXF6V2VXcjNhMDlYM3VBYW8?oc=5&hl=en-US&gl=US&ceid=US:en,https://pragativadi.com,pragativadi.com,,{'https://lh3.googleusercontent.com/J6_coFbogxhRI9iM864NL_liGXvsQp2AupsKei7z0cNNfDvGUmWUy20nuUhkREQyrpY4bEeIBuc=s0-w300'},
India and Nepal join hands to boost Cross-Border tourism - BW Hotelier,India and Nepal join hands to boost Cross-Border tourism  BW Hotelier,2025-05-24 06:19:21,https://news.google.com/rss/articles/CBMinwFBVV95cUxPQkdmS2Y3QXF0cC1xOWtSY1pEX3FpUl9IeUt0TmdMbklGMHpvN1dqMEpXUktCTW1hMGNMWEM5TFVzT2dfbHV6LWlvTXdjRVBYZFhxNmhFa09qSlhTU0VGSzJvdlg2d1BmWU1ja293dTZSSW1WU0N4QmJfdklNd0dVS2czbzQ0N0RuN1IzclpXaEFBMDNubkxGSW4zZ1dtYjA?oc=5&hl=en-US&gl=US&ceid=US:en,https://www.bwhotelier.com,BW Hotelier,,{'https://lh3.googleusercontent.com/J6_coFbogxhRI9iM864NL_liGXvsQp2AupsKei7z0cNNfDvGUmWUy20nuUhkREQyrpY4bEeIBuc=s0-w300'},
China and Nepal Accelerate Dynamic Economic and Cultural Collaboration to Unlock Unprecedented Growth and Transform Regional Connectivity by 2025 - Travel And Tour World,China and Nepal Accelerate Dynamic Economic and Cultural Collaboration to Unlock Unprecedented Growth and Transform Regional Connectivity by 2025  Travel And Tour World,2025-05-24 09:59:10,https://news.google.com/rss/articles/CBMinwJBVV95cUxOQmk5ZUM5VFNRTkszelR2SkczOTZ3MXg3STlHdHNkcVNrTndXM08ydXV4REZnMUF4RlJKUmRweTcyeDd2eUdSaDVSV3cxdk9HZlZQbm9zQW9OdWR2V1FiSVZBUTYyZUZJX1JxTTM2M0ppck5PaktZV3Z3TGtTenJSRXhMNV9zN2lFbDZPeEJQVnY0U285U3Q1VVRqNVJtLVRrNm5CZnpON1MwVHp0X0hJdF9lUk4xUTdqYmNrcVJ0b003U1ZaM2lXQnlheXo0bVVFNkJ4UkVqazRrLVkwOFN0cWJpTnc0ei05bmJYZkRvVHZWdTl0VnFVTVp4aERTRWFYQjVITlVPOWwxYVdhUEU3UXBORjQxalB3YVlRREE5SQ?oc=5&hl=en-US&gl=US&ceid=US:en,https://www.travelandtourworld.com,Travel And Tour World,,{'https://lh3.googleusercontent.com/J6_coFbogxhRI9iM864NL_liGXvsQp2AupsKei7z0cNNfDvGUmWUy20nuUhkREQyrpY4bEeIBuc=s0-w300'},
Nepal urgently needs National Climate Change Assessments - The Himalayan Times,Nepal urgently needs National Climate Change Assessments  The Himalayan Times,2025-05-24 10:12:36,https://news.google.com/rss/articles/CBMilwFBVV95cUxPcEZCbFdFTGNMSjRkSTVCWkJ0d1Y5cDNNSE5YSVkySUE4ZlBnRTU5NEszdkVCMUJPQWJyZ1NESjVjQUNzRWY2b2ZYSVBiRWFFUzBkY0JZOThNUDMzRVVJaGEzV1h4V1lheEpQbGd4MjJON1RLdjM3dHBuSEI2dGRsVnFYaFJzcGlPRjcxbUM1T21PdEp1Wktv?oc=5&hl=en-US&gl=US&ceid=US:en,https://thehimalayantimes.com,The Himalayan Times,,{'https://lh3.googleusercontent.com/J6_coFbogxhRI9iM864NL_liGXvsQp2AupsKei7z0cNNfDvGUmWUy20nuUhkREQyrpY4bEeIBuc=s0-w300'},
IATO and NATTA sign MoU to boost cross-border tourism between India and Nepal - ET TravelWorld,IATO and NATTA sign MoU to boost cross-border tourism between India and Nepal  ET TravelWorld,2025-05-24 10:30:00,https://news.google.com/rss/articles/CBMi4gFBVV95cUxOOXBtWlo5dXRSaVBUQl9TUU1sNWhRWXFiblN5YkJ3X0s4UEsydFVOUVZvWmFnd2NiVjk4MTAwUldidllMSWhMMkJoSFNxVjVYaU1Hb0dhbk1oMVFvcXFGN25FYWVlejRCWnlfYWdlMzFPeXRvVmNHRHh1NGlrYVoxYkx2c3JUQkJ3SGJyUktHNnItdFd2dmxOUlp6OFZpRHpiOXVqNGd5bFJkVHd3TElLcEQ3d0xJdWdpbUhpTWp4S1YtWjhfYl82UjEwWS15eXVRUkVLVWM3WG9WeldBQnBLTTJB0gHnAUFVX3lxTE9zYi1meEc3cFpEal9ONmxDb0s5bjNOQmJJcFBYTV9kcllZQU5iNnBXMHZLMC04UzNaOUwzMEgxT2xjdFNJNFMwM3VaY0g1VmFia1VwVC1NUXdIZTByYS1ZVGVLZ2xTaGlrdWlzRE9hY2NBZHlQOWQ3bi12d0JTai0wY1pPUTIzWkVFVm5HSEV3Wm16RzZqVERoZVRsYWN6aEZiTE9aLS13dTZkVE1PZjNiWHc0OHFZSGZ2Q3duenpQNS1KM0t2RnFPUDdJOHFmUUZDVExVTl9ubFVGR01FWngyMEp3Nm1TYw?oc=5&hl=en-US&gl=US&ceid=US:en,https://travel.economictimes.indiatimes.com,ET TravelWorld,,{'https://lh3.googleusercontent.com/J6_coFbogxhRI9iM864NL_liGXvsQp2AupsKei7z0cNNfDvGUmWUy20nuUhkREQyrpY4bEeIBuc=s0-w300'},
India & Nepal hold military drills amid suspicion of Pak terrorist presence in the country - Firstpost,India & Nepal hold military drills amid suspicion of Pak terrorist presence in the country  Firstpost,2025-05-24 10:44:59,https://news.google.com/rss/articles/CBMiugFBVV95cUxOZ255Z0x3Vm9lSWRvaGR1Mi1PdG9xU3FaN1dMSVBkNWFnb0lkeDZvUjdqNFRob2FuV3loR3EtUkRNdE5xcHlUREE1WG9hSTEtN1h1YnJBUTRWdUIyVkVtSDRobDlKbjRXLUFaMmZUdGN3VHhtSHRRTFhQRFhFa0RpVWVEV1hGZExGOFhaS0ljckwwOGxFcENGUDhHV2RRT2VpbEVLSXhFU3lyemFuMEVKc1dRS2N3VW9yUFHSAb8BQVVfeXFMUFRNMWRNSkkwVHM2QmtpRms0SGRzaGxzUW5udTZnUU5mVzRfMEU5THk1T2hEZzdZYlRVcnpfUHJGbUk0eU5hUllSSUdUTGstdmFSV2xEcV9RdmpFalgxUmpqSHRTRlpZendhXzR4S0xHNi0xRlFPV2N3NDIzV25HbzhIVmpIbUNlMHRUc1ExeHdtbUs4ak4xRHZyaHREYVNHeXJwNFZDUl96TngtaFhsSUliMzlJalA3YlVWTEVoY3M?oc=5&hl=en-US&gl=US&ceid=US:en,https://www.firstpost.com,Firstpost,,{'https://lh3.googleusercontent.com/J6_coFbogxhRI9iM864NL_liGXvsQp2AupsKei7z0cNNfDvGUmWUy20nuUhkREQyrpY4bEeIBuc=s0-w300'},
Indo-Nepal joint military team scales Mt Kanchenjunga - The Himalayan Times,Indo-Nepal joint military team scales Mt Kanchenjunga  The Himalayan Times,2025-05-24 10:50:46,https://news.google.com/rss/articles/CBMikwFBVV95cUxOZ2Z3d0RUX3JTbzNMdWdJb0pPb0FlQloxS0tYSl9IZUcwY2Eyek1pOUtHblRzenJYcGI4Qk5fVXJoa25iWUJIczVGS2NkTk5PVFpXbFBMaUVrbldUSE0zcU9hQ05GdG1oMDAtazFIVklMTExLVm9TYnhxYURGbDZtWF8wdzB3QzZJTWRjSFN6a2RqZ1U?oc=5&hl=en-US&gl=US&ceid=US:en,https://thehimalayantimes.com,The Himalayan Times,,{'https://lh3.googleusercontent.com/J6_coFbogxhRI9iM864NL_liGXvsQp2AupsKei7z0cNNfDvGUmWUy20nuUhkREQyrpY4bEeIBuc=s0-w300'},
