title,description,published date,url,publisher.href,publisher.title,full_article,images,translated
The Balen government must build Nepal’s IT Highway - Onlinekhabar English,The Balen government must build Nepal’s IT Highway  Onlinekhabar English,2026-04-24 07:11:21,https://news.google.com/rss/articles/CBMifEFVX3lxTFBHNldvOHE5d1Y0NTBiNnlCejhZUnBpZy1rLWVRLTZXYnFQZlpKaURUajBoTHdLU25CY3JnLU1STl9sLXoyVDctcDlabFY2ejZXem8wOEMwQlBKNl8tdHZRcHZCR1FiWjZwZS1jWWdMd1dPc2I0UUM2S0ZvamI?oc=5&hl=en-US&gl=US&ceid=US:en,https://english.onlinekhabar.com,Onlinekhabar English,"Image: Pixabay

As Nepal enters a new phase of governance under the leadership of Balen Shah, the country stands at a critical juncture. Economic transformation can no longer rely solely on traditional sectors. The next leap must come from digital infrastructure, and the government must be bold enough to build it right.

What invests in Information Technology, different from roads or hydropower, is its asymmetric advantage: relatively modest capital can unlock exponential returns in productivity, service delivery, and global integration. And yet, Nepal’s past attempts at digital transformation have repeatedly made the same mistake of prioritising applications over foundations. The result is what we have today: fragile systems that collapse under scale, duplicated efforts across ministries, and citizens who have lost trust in government technology.

The opportunity before the Balen Government is not to build more apps. It is to build Nepal’s IT Highway, a resilient, scalable digital backbone that the entire nation can run on.

What the IT Highway actually means

The IT Highway is not a single system or platform. Think of it the way you think of physical highways; they do not move goods themselves, but without them, nothing moves. A digital highway enables data, services, and innovation to flow efficiently across the country. India’s Digital Public Infrastructure, anchored by Aadhaar, is the clearest example of what this looks like in practice: a platform so foundational that an entire digital economy was built on top of it.

For Nepal, this backbone must be built in layers. The first is pure infrastructure: seven regional data centres, one per province, each with disaster recovery capacity, hosting the scalable cloud services that all government systems will eventually depend on. The second is security: SOC2-compliant, centralised cybersecurity operations built to global standards. Cybersecurity must be embedded from day one, not retrofitted after a breach makes headlines. The third is a data exchange layer: a secure interoperability framework that enables government systems to actually talk to each other, eliminating the duplication and inefficiencies that currently cost the state enormous time and money. Only after these three foundations are in place should the fourth layer, applications to be built, be built, whether for e-governance, taxation, healthcare, or logistics.

This sequencing matters enormously. It shifts the government’s role from service builder to platform enabler. Once the highway exists, innovation can flourish on top of it, from both the public and private sectors.

Five areas that will define Nepal’s digital future

Built on this foundation, five strategic areas will determine how far Nepal’s digital economy can reach. The first is Digital Public Infrastructure (DPI). A national identity system with National ID integration, eKYC for instant verification, digital signatures, and document storage, exposed through open APIs, will allow private companies in fintech, e-commerce, and logistics to build services on top of government infrastructure. India’s DPI has already shown how dramatically this model can accelerate financial inclusion and economic activity. Nepal can replicate that.

The second is Artificial Intelligence. Nepal cannot afford to watch this revolution from the sidelines. The government must act as a catalyst: partnering with public-private entities to attract international AI data centre investment, funding a Nepalese national and regional languages translation models initiative similar to India’s Bhashini project, and establishing AI research and incubation centres, one per province, to build local talent and nurture startups.

The third is something far less glamorous but equally critical: a national addressing and geospatial system. Nepal’s informal addressing system is a silent tax on the entire economy. Every logistics company, every delivery service, every emergency response team, every urban planner hits this wall. A standardised national address system combined with a digital geospatial map is a foundational investment with economic spillovers that touch every sector, from e-commerce to disaster management to infrastructure planning.

Fourth, the government must invest in building a physical and institutional startup ecosystem. IT parks across provinces, incubation centres, a government innovation fund, venture capital attraction, and a mandate for open APIs on all public services – together, these create an “Open Government” model where private firms and startups can innovate on top of public infrastructure, generating employment and economic activity that the government could never produce alone.

Fifth, Nepal needs a government-supported, privately operated national messaging platform that is secure, scalable, and interoperable. This is not a luxury. Resilient communication infrastructure for citizens, businesses, and emergency services is a national security issue as much as a convenience one.

The mistake Nepal keeps making

Nepal’s past digital initiatives have almost always focused on building isolated applications, well-intentioned efforts that consistently suffer from the same problems: they cannot scale, they do not talk to other systems, and they must be rebuilt every few years. The pattern is expensive and demoralising.

The Balen Government has a chance to break this cycle, but only by committing to infrastructure first, standardisation second, and applications third. India’s experience makes the argument clear: Aadhaar and DPI did not succeed because they were applications. They succeeded because they became platforms and on those platforms, entire industries were built.

The time to build is now

Nepal does not need to copy any single country. It needs to build the right foundations for its own context – its languages, its geography, its federal structure. But the direction is clear. An IT Highway will improve how government works, attract foreign investment, give startups a real platform to grow on, and pull Nepal into the regional digital economy in a way that isolated applications never could.

The question is not whether Nepal will digitise. It will. The only question is whether it will digitise on solid foundations or fragile ones.

If the Balen Government has the discipline to prioritise infrastructure over short-term visibility, it can build a digital economy that is resilient, scalable, and inclusive. The window for that choice is open right now. The time to build is now.","{'https://english.onlinekhabar.com/wp-content/uploads/2026/04/DSC05734.jpg', 'https://certify.alexametrics.com/atrk.gif?account=au/Vl1a8FRh2em', 'https://english.onlinekhabar.com/wp-content/themes/onlinekhabar-english-2020/img/site-main-logo.png', 'https://english.onlinekhabar.com/wp-content/uploads/2026/03/IMG-20260317-WA0000.jpg', 'https://english.onlinekhabar.com/wp-content/themes/onlinekhabar-english-2020/img/flag.png', 'https://english.onlinekhabar.com/wp-content/plugins/ok-user-manager/img/ajax-loader.gif', 'https://english.onlinekhabar.com/wp-content/uploads/2025/08/cumin.jpg', 'https://english.onlinekhabar.com/wp-content/uploads/2026/04/pexels-tara-winstead-8849295-150x150.jpg', 'https://english.onlinekhabar.com/wp-content/uploads/2026/04/Dunai-bazar-1024x768-1.jpg', 'https://english.onlinekhabar.com/wp-content/uploads/2026/04/sudhan-gurung-3-1024x500-1-150x150.jpg', 'https://english.onlinekhabar.com/wp-content/uploads/2026/04/geralt-artificial-intelligence-3382507_1920-1024x683.jpg', 'https://english.onlinekhabar.com/wp-content/themes/onlinekhabar-english-2020/img/ajax-loader.gif', 'https://english.onlinekhabar.com/wp-content/uploads/2026/03/kp-oli-ramesh-lekhak-chandrakuber-khapung-1.png', 'https://english.onlinekhabar.com/wp-content/uploads/2026/04/WhatsApp-Image-2026-04-21-at-2.03.43-PM-150x150.jpeg', 'https://english.onlinekhabar.com/wp-content/uploads/2021/05/lemonade-3571083_1280-150x150.jpg', 'https://english.onlinekhabar.com/wp-content/uploads/2026/04/Dunai-bazar-1024x768-1-150x150.jpg', 'https://english.onlinekhabar.com/wp-content/uploads/2026/04/Umpire-Eror-News-1024x500-1.jpg', 'https://english.onlinekhabar.com/wp-content/uploads/2026/03/Kennes.jpg', 'https://english.onlinekhabar.com/wp-content/uploads/2026/04/geralt-artificial-intelligence-3382507_1920.jpg', 'https://english.onlinekhabar.com/wp-content/uploads/2026/04/Swaanim-1024x500-1-150x150.jpg', 'https://english.onlinekhabar.com/wp-content/uploads/2026/04/Umpire-Eror-News-1024x500-1-150x150.jpg'}","छवि: पिक्साबे

जेना-जेना नेपाल बलेन शाह के नेतृत्व में शासन के नव चरण में प्रवेश करैत अछि, देश एकटा गंभीर मोड़ पर ठाढ़ अछि। आर्थिक परिवर्तन आब केवल पारंपरिक क्षेत्र पर निर्भर नहि भ सकैत अछि। अगिला छलांग डिजिटल इंफ्रास्ट्रक्चर स आबय पड़त, आ सरकार के एतेक बोल्ड होबय पड़त जे एकरा सही तरीका सं बना सकय.

सड़क या जलविद्युत सं अलग सूचना प्रौद्योगिकी मे जे निवेश करयत छै, ओ ओकर असममित फायदा छै: अपेक्षाकृत मामूली पूंजी उत्पादकता, सेवा प्रदायगी, आ वैश्विक एकीकरण मे घातीय रिटर्न कें ताला खोल सकय छै. आरू तइयो नेपाल केरऽ डिजिटल रूपांतरण केरऽ पिछला प्रयास म॑ बार-बार फाउंडेशन स॑ बेसी एप्लीकेशन क॑ प्राथमिकता दै के वू गलती करलऽ गेलऽ छै । एकरऽ परिणाम ई छै कि आज हमरा पास वू छै: नाजुक सिस्टम जे पैमाना के तहत ढह॑ छै, मंत्रालयऽ भर म॑ दोहराबै वाला प्रयास, आरू नागरिक जेकरा सरकारी तकनीक प॑ भरोसा खतम होय गेलऽ छै ।

बलेन सरकार के सामने मौका आओर ऐप बनेबाक नहि अछि. ई नेपाल केरऽ आईटी हाईवे, एगो लचीला, स्केल करलऽ जाय वाला डिजिटल बैकबोन के निर्माण लेली छै, जेकरा प॑ पूरा राष्ट्र चलै सकै छै ।

आईटी हाईवे के असल मतलब की अछि

आईटी हाईवे कोनो एकटा सिस्टम या प्लेटफॉर्म नहि अछि। एकरा ओहिना सोचू जेना भौतिक राजमार्गक बारे में सोचैत छी; स्वयं माल नहि हिलाबैत छथि, मुदा हुनका बिना किछु नहि हिलैत अछि । डिजिटल राजमार्ग देश भर मे डाटा, सेवा आ नवाचार कें कुशलता सं प्रवाहित करय मे सक्षम बनायत छै. आधार द्वारा एंकर करलौ गेलौ भारत केरौ डिजिटल पब्लिक इंफ्रास्ट्रक्चर एकरौ सबसें स्पष्ट उदाहरण छै कि व्यवहार मँ ई केना लगै छै: एगो ऐसनौ मंच जे एतना बुनियादी छै कि एकरा ऊपर एगो पूरा डिजिटल अर्थव्यवस्था के निर्माण करलौ गेलौ छेलै ।

नेपाल लेल ई रीढ़ के परत परत मे बनय पड़त। पहिल शुद्ध बुनियादी ढाँचा छै: सात क्षेत्रीय डाटा सेंटर, प्रति प्रांत एकटा, प्रत्येक आपदा सं बचाव कें क्षमता वाला, स्केल करय योग्य क्लाउड सेवाक कें मेजबानी करयत छै, जेकरा पर अंततः सबटा सरकारी प्रणाली निर्भर करतय. दोसर सुरक्षा छै: वैश्विक मानक कें अनुसार बनल एसओसी2 कें अनुरूप, केंद्रीकृत साइबर सुरक्षा संचालन. साइबर सुरक्षा क॑ पहिलऽ दिन स॑ ही एम्बेड करलऽ जाय, नै कि उल्लंघन केरऽ सुर्खी बनला के बाद रिट्रोफिट करलऽ जाय । तेसर एकटा डाटा एक्सचेंज लेयर छै: एकटा सुरक्षित इंटरऑपरेबिलिटी फ्रेमवर्क जे सरकारी प्रणालीक कें वास्तव मे एक दोसरा सं बात करय मे सक्षम बनायत छै, जे दोहराव आ अक्षमता कें समाप्त करयत छै जे वर्तमान मे राज्य कें भारी समय आ पैसा कें नुकसान उठायत छै. इ तीनू नींव कें जगह पर बनला कें बाद ही चारिम परत, जे एप्लीकेशन बनायल जायत छै, कें निर्माण कैल जेबाक चाही, चाहे ओ ई-गवर्नेंस, कर, स्वास्थ्य देखभाल, या रसद कें लेल हो.

ई अनुक्रमण अत्यंत मायने रखैत अछि। ई सरकार के भूमिका के सर्विस बिल्डर सं प्लेटफॉर्म एनेबलर मे बदलि दैत अछि. एक बेर राजमार्ग अस्तित्व मे आबि गेलाक बाद एकर ऊपर नवाचार पनपि सकैत अछि, सार्वजनिक आ निजी दुनू क्षेत्र स।

पांच क्षेत्र जे नेपाल के डिजिटल भविष्य के परिभाषित करत

एहि नींव पर बनल पांचटा रणनीतिक क्षेत्र इ तय करत जे नेपाल क डिजिटल अर्थव्यवस्था कतेक दूर तक पहुंच सकैत अछि। पहिल अछि डिजिटल पब्लिक इंफ्रास्ट्रक्चर (डीपीआई)। राष्ट्रीय आईडी एकीकरण, तत्काल सत्यापन, डिजिटल हस्ताक्षर, आ दस्तावेज भंडारण कें साथ राष्ट्रीय पहचान प्रणाली, जे खुला एपीआई कें माध्यम सं उजागर कैल गेल छै, फिनटेक, ई-कॉमर्स, आ रसद मे निजी कंपनीक कें सरकारी बुनियादी ढाँचा कें ऊपर सेवाक कें निर्माण करय कें अनुमति देयत. भारत केरऽ डीपीआई न॑ पहल॑ ही देखा चुकलऽ छै कि ई मॉडल वित्तीय समावेश आरू आर्थिक गतिविधि म॑ कतेक नाटकीय रूप स॑ तेजी लानी सकै छै । नेपाल तकर नकल क सकैत अछि।

दोसर अछि आर्टिफिशियल इंटेलिजेंस। नेपालक सामर्थ्य नहि अछि जे एहि क्रान्ति केँ कात सँ देखब। सरकार कें एकटा उत्प्रेरक कें रूप मे काज करनाय आवश्यक छै: अंतरराष्ट्रीय एआई डाटा सेंटर निवेश कें आकर्षित करय कें लेल सार्वजनिक-निजी संस्थाक कें साथ साझेदारी करनाय, भारत कें भाशिनी परियोजना कें समान नेपाली राष्ट्रीय आ क्षेत्रीय भाषाक कें अनुवाद मॉडल पहल कें वित्तपोषण करनाय, आ स्थानीय प्रतिभा कें निर्माण आ स्टार्टअप कें पोषण कें लेल एआई अनुसंधान आ ऊष्मायन केंद्रक कें स्थापना, प्रति प्रांत एकटा, कें स्थापना करनाय.

तेसर किछु कहीं कम ग्लैमरस मुदा ओतबे आलोचनात्मक अछि : राष्ट्रीय संबोधन आ भू-स्थानिक प्रणाली । नेपाल केरऽ अनौपचारिक संबोधन प्रणाली पूरा अर्थव्यवस्था प॑ मौन कर छै । हर रसद कंपनी, हर डिलीवरी सेवा, हर आपातकालीन प्रतिक्रिया टीम, हर शहरी योजनाकार एहि देबाल सं टकरा जाइत अछि. डिजिटल भू-स्थानिक नक्शा कें साथ मिलल मानकीकृत राष्ट्रीय पता प्रणाली आर्थिक स्पिलओवर कें साथ एकटा बुनियादी निवेश छै जे ई-कॉमर्स सं ल क आपदा प्रबंधन सं ल क बुनियादी ढांचा योजना तइक हर क्षेत्र कें छूबै छै.

चारिम, सरकार कए भौतिक आ संस्थागत स्टार्टअप इकोसिस्टम क निर्माण मे निवेश करबाक चाही। प्रांतक भर मे आईटी पार्क, ऊष्मायन केंद्र, एकटा सरकारी नवाचार कोष, उद्यम पूंजी आकर्षण, आ सबटा सार्वजनिक सेवाक पर खुला एपीआई कें लेल एकटा जनादेश – इ सब मिल क एकटा “खुला सरकार” मॉडल बनायत छै जत निजी फर्म आ स्टार्टअप सार्वजनिक बुनियादी ढाँचा कें ऊपर नवाचार कयर सकय छै, जे रोजगार आ आर्थिक गतिविधि पैदा कयर सकय छै जे सरकार असगर कहियो पैदा नहि कयर सकय छै.

पांचम, नेपाल के एकटा सरकारी समर्थित, निजी संचालित राष्ट्रीय संदेश प्लेटफॉर्म के जरूरत अछि जे सुरक्षित, स्केल करय योग्य, आ इंटरऑपरेबल हो. ई कोनो विलासिता नहि अछि। नागरिक, व्यवसाय, आ आपातकालीन सेवाक कें लेल लचीला संचार बुनियादी ढाँचा राष्ट्रीय सुरक्षा कें मुद्दा ओतबे सुविधा कें मुद्दा छै.

जे गलती नेपाल करैत रहैत अछि

नेपाल केरऽ पिछला डिजिटल पहल लगभग हमेशा अलग-थलग एप्लीकेशन के निर्माण प॑ केंद्रित रहलऽ छै, अच्छा नीयत वाला प्रयास जे लगातार वू ही समस्या स॑ ग्रस्त छै: वू स्केल नै करी सकै छै, वू दोसरऽ सिस्टम स॑ बात नै करै छै, आरू हर कुछ सालऽ प॑ एकरऽ पुनर्निर्माण करना जरूरी छै । पैटर्न महग आ मनोबल गिराबय वाला अछि.

बेलेन सरकार क॑ ई चक्र क॑ तोड़ै के मौका छै, लेकिन केवल पहलऽ बुनियादी ढाँचा, दोसरऽ मानकीकरण, आरू तेसरऽ अनुप्रयोग के प्रति प्रतिबद्धता स॑ । भारत केरऽ अनुभव स॑ ई तर्क साफ होय जाय छै कि आधार आरू डीपीआई सफल नै होलै, कैन्हेंकि ई सब आवेदन छेलै । ओ सब एहि लेल सफल भेल जे ओ सब प्लेटफार्म बनि गेल आ ओहि प्लेटफार्म पर पूरा उद्योग बनल।

निर्माणक समय आब अछि

नेपाल के कोनो एक देश के नकल करय के जरूरत नहिं. ओकरा अपन संदर्भ – अपन भाषा, अपन भूगोल, अपन संघीय संरचना – लेल सही आधार बनेबाक आवश्यकता अछि । मुदा दिशा स्पष्ट अछि। एकटा आईटी राजमार्ग सरकार कोना काज करैत अछि ताहि मे सुधार करत, विदेशी निवेश कए आकर्षित करत, स्टार्टअप कए बढ़बा लेल एकटा वास्तविक मंच देत, आ नेपाल कए क्षेत्रीय डिजिटल अर्थव्यवस्था मे एहन तरीका स खींचत जे अलग-थलग एप्लीकेशन कहियो नहि क सकैत छल।

सवाल ई नहि अछि जे नेपाल डिजिटलीकरण करत कि नहि। हेतैक। सवाल एतबे अछि जे ठोस नींव पर डिजिटल भ जाएत आ कि नाजुक नींव पर।

यदि बेलेन सरकार कें पास अल्पकालिक दृश्यता सं बेसि बुनियादी ढाँचा कें प्राथमिकता देवय कें अनुशासन छै त ओ एकटा डिजिटल अर्थव्यवस्था कें निर्माण कयर सकय छै जे लचीला, स्केल करय योग्य आ समावेशी होयत. ओहि चुनावक खिड़की एखन खुजल अछि। निर्माणक समय आब अछि।"
