title,description,published date,url,publisher.href,publisher.title,full_article,images,translated
Kabindra Burlakoti withdraws as RSP General Secretary race narrows to eight contenders - Nepalnews.com,Kabindra Burlakoti withdraws as RSP General Secretary race narrows to eight contenders  Nepalnews.com,2026-06-26 06:17:29,https://news.google.com/rss/articles/CBMixwFBVV95cUxNWGNZZWZ3YnFZWFhULWphWXR3SU1WRi1YOXQ0TkM2dU5oN21zU2czc1VLVFdxdnJNZDg0bTMyZE1aeW8zOWY5TzhiUzBiMnNUYlBNZThyTGRmQzhfbDlsTE9nNTAzX25FeFZ1RThkclRpSVcwN1RObng2d2hJMFRiVENpWnRyZm5VSDJkcEVPM0lQZE90YlA3YmJScE96WWpGUEdFRnhHem5ObjJCMWZFZS1Vc3I4MEpPNFNqZkJxdUFQR1FXcWRN?oc=5&hl=en-US&gl=US&ceid=US:en,https://english.nepalnews.com,Nepalnews.com,,,
"Unaware of ID card changes, police arrest Nepalese man - 朝日新聞","Unaware of ID card changes, police arrest Nepalese man  朝日新聞",2026-06-26 06:38:00,https://news.google.com/rss/articles/CBMiVkFVX3lxTE1tZHhBekFBcVowbVhETUJmX2IyWDZrN1NwdG5mbGw1OHdCRG81NzNqbDRoWHp2aUZSTHQtZUlNanh3czRfOEtQc0l2aUNvUTJSSTZ0VXF3?oc=5&hl=en-US&gl=US&ceid=US:en,https://www.asahi.com,朝日新聞,"Tokyo police wrongfully arrested and detained a Nepalese man on June 25 after failing to recognize his new, officially updated residence card.

The Metropolitan Police Department issued an apology to the man who was held for about an hour.

According to the MPD, the four officers involved, aged from their 20s to their 40s, work at the Shibuya Police Station.

The incident began around 10:10 a.m. on June 25 near the Hachiko statue plaza in Tokyo’s Shibuya district, when two officers on patrol stopped two Nepalese men in their 20s over “suspicious” behavior.

One of the men presented a residence card when asked for ID. But the officers did not recognize the card’s design, leading them to suspect it was counterfeit.

Two backup officers who arrived around 10:30 a.m. concurred with the assessment. And the man was arrested on the spot on suspicion of violating the Immigration Control Law by using a forged residence card.

However, the card was legitimate.

The Immigration Services Agency had updated the color, text thickness and layout for all cards issued on or after June 14.

The Nepalese man explained to the officers, “I was given this by my company.”

But the police were unaware of the changes.

Their mistake was discovered after they took the man to the station, where other officers pointed out the card was authentic.

He was released around 11:30 a.m., and officers at the Shibuya station apologized to him.

MPD headquarters had sent multiple notifications about the design change of the residence card to all police stations between June 5 and 12.

An MPD representative acknowledged the information “had not been thoroughly disseminated within the Shibuya Police Station.”

The department will “ensure thorough guidance to prevent such incidents from happening in the future,” the representative said.","{'https://i.ytimg.com/vi/g2ZZeILCN6U/mqdefault.jpg', 'https://p.potaufeu.asahi.com/aefe-p/picture/30968412/f3fcb76001d98c241f7821ef1a1a9423_300px.jpg', 'https://p.potaufeu.asahi.com/eff8-p/picture/31005040/62dfd51a2df1228f418ecac02f1fb8b7.jpg', 'https://p.potaufeu.asahi.com/f3a3-p/picture/27407472/0a697cbfe2d2a9b640ac11c83b547ba9.jpg', 'https://p.potaufeu.asahi.com/e691-p/picture/26500687/9727e64adef5e4b77fc75ad5d97d3f42.jpg', 'https://i.ytimg.com/vi/BL5QHh48C4I/mqdefault.jpg', 'https://p.potaufeu.asahi.com/a2af-p/picture/30978741/950de264d7db56f0f074c8598f1ddb26_300px.jpg', 'https://p.potaufeu.asahi.com/12f5-p/picture/30973688/8861df9520905c1a8fea0f6aed2e0be3_300px.jpg', 'https://p.potaufeu.asahi.com/6c8f-p/picture/26795499/65ede122624ce157d5b6374d11685b84.jpg', 'https://p.potaufeu.asahi.com/03eb-p/picture/30996851/6f6e235fcb70cc9ea57a25c6432c8bca_300px.jpg', 'https://p.potaufeu.asahi.com/ajw/css/images/en_logo@2x.png', 'https://p.potaufeu.asahi.com/856a-p/picture/31000524/fc923bc9f8b492aeab5421b235564c9c_300px.jpg', 'https://public.potaufeu.asahi.com/ajw/images/banner/2025DiplomatDocuments-300x150.jpg', 'https://p.potaufeu.asahi.com/6a62-p/picture/31007828/59779a6ec44d32e6ba3eb50748e6f92f_300px.jpg', 'https://p.potaufeu.asahi.com/2bae-p/picture/30969332/ba7d01e2194ca5336d37750cc8b97a83_300px.jpg', 'https://p.potaufeu.asahi.com/6a97-p/picture/30583901/7a939b3973bb9b814ee5c6de43737378_300px.jpg', 'https://p.potaufeu.asahi.com/1823-p/picture/28885739/e48c7314d37a7d5fbe13ce8826705aa7.jpg', 'https://p.potaufeu.asahi.com/85db-p/picture/27383821/1eb57ff204b7880550a35cd9eff2b84d.jpg', 'https://p.potaufeu.asahi.com/b0a3-p/picture/26812467/da82bba8ce177a752a1dd83ee1a38491.jpg', 'https://p.potaufeu.asahi.com/9b48-p/picture/31001886/6878753c2101b33adb3b4b35f671320a_300px.jpg', 'https://p.potaufeu.asahi.com/aada-p/picture/30987698/01c67e4c8742b2fd9c6057ed895259d2_300px.jpg', 'https://p.potaufeu.asahi.com/aac1-p/picture/30996052/bd12f4d07c072b8eb561d56856acefad_300px.jpg', 'https://p.potaufeu.asahi.com/d4c6-p/picture/28252540/a8a8c8ce9c1c502b685bd996ee06a8a5.jpg', 'https://p.potaufeu.asahi.com/860b-p/picture/30996208/077b3022adae1bc5280673c32b50be68_300px.jpg', 'https://p.potaufeu.asahi.com/a3f5-p/picture/30179128/e3d0e307d00e2337fb00d49f70218f49_300px.jpg', 'https://p.potaufeu.asahi.com/9e20-p/picture/28252734/541860dfaa346e951f12716eb2643ad7.jpg', 'https://p.potaufeu.asahi.com/0b5a-p/picture/30995749/7c0eb1dec98b3cabffc2d3326275ae0d_300px.jpg', 'https://i.ytimg.com/vi/quKsCgjaOPE/mqdefault.jpg', 'https://public.potaufeu.asahi.com/ajw/images/banner/2026LowerHouseelection_300_150 1.jpg', 'https://p.potaufeu.asahi.com/951b-p/picture/30676813/8beb17561e66abedfa3528774e5873d0_300px.jpg', 'https://p.potaufeu.asahi.com/d9d9-p/picture/27527831/bd5290cd3052fff5365da44575f88404.jpg', 'https://p.potaufeu.asahi.com/355d-p/picture/31002887/ea60550952dea6e784d4b008d736151a_300px.jpg', 'https://p.potaufeu.asahi.com/5a6f-p/picture/30996843/af0da6ee44b4dc0db2cdfa67df14773e_300px.jpg', 'https://public.potaufeu.asahi.com/ajw/images/banner/2025_80years_since_the_end_of_world_war_2_300_150.jpg', 'https://p.potaufeu.asahi.com/13f3-p/picture/26712803/63b88459ddc940f708637cf7a864b340.jpg', 'https://p.potaufeu.asahi.com/798c-p/picture/27622744/a760936c0299309577bc578cae72bd03.jpg'}","टोक्यो पुलिस 25 जून कए एकटा नेपाली आदमी कए ओकर नव, आधिकारिक तौर पर अपडेट कएल गेल आवास कार्ड कए नहि चिन्हबा मे गलत तरीका स गिरफ्तार करि हिरासत मे लेलक।

महानगर प्रहरी विभाग करीब एक घंटा तक हिरासत मे बैसल ओहि आदमी के माफीनामा जारी केलक अछि।

एमपीडी के अनुसार, एहि मे शामिल चारिटा अधिकारी, जेकर उम्र 20 सं 40 के दशक अछि, शिबुया थाना मे काज करैत अछि.

टोक्यो के शिबुया जिला के हाचिको मूर्ति प्लाजा के पास 25 जून के करीब 10:10 बजे ई घटना शुरू भेल छल, जखन गश्त पर बैसल दू टा अधिकारी 20 के दशक के दू टा नेपाली आदमी के “संदिग्ध” व्यवहार के ल क रोकलक।

एकटा आदमी आईडी मंगला पर रेजिडेंस कार्ड भेंट केलक। मुदा अफसर सभ कार्ड’क डिजाइन नहि चिन्हलखिन्ह, जाहि सं हुनका सभ के शक भ’ गेलन्हि जे ई नकली अछि.

करीब 10:30 बजे पहुंचल दूटा बैकअप अधिकारी एहि आकलन स सहमत छलाह। आरू जाली रेजिडेंस कार्ड के इस्तेमाल करी क॑ आप्रवासन नियंत्रण कानून के उल्लंघन करै के आशंका म॑ मौका प॑ ही गिरफ्तार करी लेलऽ गेलै ।

ओना कार्ड जायज छल।

आप्रवासन सेवा एजेंसी 14 जून या ओकर बाद जारी सबटा कार्ड क रंग, पाठ क मोटाई आ लेआउट कए अपडेट केने छल।

नेपाली आदमी अफसर सब के बुझेलक, “हमरा ई हमर कंपनी देलक।”

मुदा पुलिस एहि बदलाव स अनभिज्ञ छल।

हुनकऽ गलती के पता चललै जब॑ हुनी वू आदमी क॑ स्टेशन प॑ ल॑ गेलै, जहां दोसरऽ अधिकारी न॑ कार्ड प्रामाणिक होय के बात बतैलकै ।

हुनका 11:30 बजे के आसपास रिहा क देल गेल, आ शिबुया स्टेशन के अधिकारी हुनका सं माफी मंगलखिन्ह.

एमपीडी मुख्यालय 5 स 12 जून क बीच सब थाना कए रेजिडेंस कार्ड क डिजाइन बदलबाक कईटा सूचना पठेने छल।

एमपीडी केरऽ प्रतिनिधि न॑ स्वीकार करलकै कि ई जानकारी क॑ “शिबुया थाना के भीतर पूरा तरह स॑ प्रसारित नै करलऽ गेलऽ छै ।”

प्रतिनिधि नँ कहलकै कि विभाग “भविष्य मँ ऐसनौ घटना नै घटै लेली गहन मार्गदर्शन सुनिश्चित करतै ।"
"7 dead, 87 injured across Nepal in 24-hour road accident toll - Nepalnews.com","7 dead, 87 injured across Nepal in 24-hour road accident toll  Nepalnews.com",2026-06-26 06:42:30,https://news.google.com/rss/articles/CBMiogFBVV95cUxNUjBhZnpwLWVRdjAwWnBTSWRkb0ZSWUZodUdJdHM1b2Y1S0taZDNfaVZ4WXNkQ1hkWUpySFl4UExSdWZfM3ZqdjhMUHVCOG8xT2RCWXZQakpWZ1NzQVZ5VUcteU5uSWJndDdVZmFRREhYLTMydDNVVkJxQTBZcFVpYWwwT1c1aGNiTzhMdG1Ha0JMNDNuMGxjRjJLbHZWakpzTnc?oc=5&hl=en-US&gl=US&ceid=US:en,https://english.nepalnews.com,Nepalnews.com,,,
RSP General Secretary race narrows as key leaders withdraw in favor of Bipin Acharya - Nepalnews.com,RSP General Secretary race narrows as key leaders withdraw in favor of Bipin Acharya  Nepalnews.com,2026-06-26 06:57:30,https://news.google.com/rss/articles/CBMixAFBVV95cUxQRXA1d3AySEFxbmJkQS00a284bnRnWFliNTR1UGNJeEVEMTZsN1JGTXBMbWhRQkRkZXJHbmdJSExFVzZzd190eGdWUWdDS2JvakZfVkdRZHloeHJPRGZHRTFESEwxTDBoallnV3FWZXAxTlNzRGhBRWlRSGNsM2VNSTV0TDBHZDJtRkh1TkRfcmgtc3lWUmo5cWtKVEtUUW9QemhEN2x0Ml8xcmxlaDZzelRrTEFQbE9hS05UdGRQbXFxb2dU?oc=5&hl=en-US&gl=US&ceid=US:en,https://english.nepalnews.com,Nepalnews.com,,,
Prachanda and Nepal Meet Shekhar Koirala - Ratopati,Prachanda and Nepal Meet Shekhar Koirala  Ratopati,2026-06-26 07:01:12,https://news.google.com/rss/articles/CBMiigFBVV95cUxPMXR1QllfV29JNTQzYy0tTlc3TF9oRjNLamdYR2txNzhtQ3hodjh0UFhRV1Ezb3U4Tk5oRUFNc3k3N2VVZ3ZtcTUxZk1ZRlpzNkszaXMxeTVaSUdPMndseE1MY3RZY3B3T2xFT3ZrbDRtU3dzaV8wakJDTmRkTHJUczUzNVg0MGZpd2c?oc=5&hl=en-US&gl=US&ceid=US:en,https://english.ratopati.com,Ratopati,"Kathmandu. Nepali Communist Party coordinator and former Prime Minister Pushpa Kamal Dahal Prachanda and former Prime Minister Madhav Kumar Nepal have met with Nepali Congress leader Dr. Shekhar Koirala.

Shekhar Koirala's personal secretary Dinesh Chandra Thapaliya informed that they met this morning at Koirala's residence in Biratnagar.

It is said that they discussed contemporary political issues.","{'https://npcdn.ratopati.com/media/news/rajkumar-shrestha_dqVkhDhTxw.jpg', 'https://npcdn.ratopati.com/media/news/rastriya-sabha_BrOi4J07mD.jpg', 'https://npcdn.ratopati.com/media/news/suman-ghimire_vtajhzAAsP.jpg', 'https://npcdn.ratopati.com/media/authors/ratopati_science_RGmmSpmAnu.jpg', 'https://rpcdn.ratopati.com/media/albums/buddi_3DFiJESiSM.jpg', 'https://npcdn.ratopati.com/media/news/sunita-dangol_jH8ljcovuW.jpg', 'https://npcdn.ratopati.com/media/news/ramkumari-jhakri_C1KvUZ7cpy.jpg', 'https://npcdn.ratopati.com/media/news/krishna-bahadur-rokaya_lt4wTubxMg.jpg', 'https://english.ratopati.com/build/img/logo-rp.png', 'https://npcdn.ratopati.com/media/news/rsp-mahadhibeshan-(13)_WC8r3AjirG.jpg', 'https://npcdn.ratopati.com/media/news/balen-shah_X06tgA3ST4.jpg', 'https://rpcdn.ratopati.com/archived-media/UCPN-Maoist-flag.jpg', 'https://npcdn.ratopati.com/media/news/dd_Wq8FDjuss6.jpg', 'https://npcdn.ratopati.com/media/news/prachanda-madhab-sekhar_UKDzLPygJH.jpg'}","काठमांडू। नेपाली कम्युनिस्ट पार्टी के संयोजक आ पूर्व प्रधानमन्त्री पुष्पकमल दाहाल प्रचण्ड आ पूर्व प्रधानमन्त्री माधवकुमार नेपाल नेपाली कांग्रेसक नेता डा. शेखर कोइरालासँग भेंट भेल अछि ।

शेखर कोइरालाके निजी सचिव दिनेशचन्द्र थापलिया आइ भोरे विराटनगर स्थित कोइरालाके आवासमे भेंट भेल जानकारी देलनि ।

कहल जाइत अछि जे ओ सब समकालीन राजनीतिक मुद्दा पर चर्चा केलनि।"
