title,description,published date,url,publisher.href,publisher.title,full_article,images,translated
Central Security Committee decides to step up surveillance in border areas and airports - The Rising Nepal,Central Security Committee decides to step up surveillance in border areas and airports  The Rising Nepal,2025-05-07 12:17:19,https://news.google.com/rss/articles/CBMiUEFVX3lxTE4zMnJoZ2dGeFQ4bFBaWW5faGpacFRFYW5kaU5sYnBRbVBCQ0FOelNSV0E2dUJsQlhIUUtxZkVuRlFFcWQ3M2kySkRDcFVvQkVW?oc=5&hl=en-US&gl=US&ceid=US:en,https://risingnepaldaily.com,The Rising Nepal,,{'https://lh3.googleusercontent.com/J6_coFbogxhRI9iM864NL_liGXvsQp2AupsKei7z0cNNfDvGUmWUy20nuUhkREQyrpY4bEeIBuc=s0-w300'},
Democracy without free press unimaginable: President - The Rising Nepal,Democracy without free press unimaginable: President  The Rising Nepal,2025-05-07 12:36:59,https://news.google.com/rss/articles/CBMiUEFVX3lxTE9Lc0lTd1RvdlM5anZ2RGdDMTdtTHVLcXQ1NjZUbGJjcHExMWM2YnRLWF8tbzdpaWFDQmFScElVVFg0elI1cHBrVjM5LXZjcTl2?oc=5&hl=en-US&gl=US&ceid=US:en,https://risingnepaldaily.com,The Rising Nepal,,{'https://lh3.googleusercontent.com/J6_coFbogxhRI9iM864NL_liGXvsQp2AupsKei7z0cNNfDvGUmWUy20nuUhkREQyrpY4bEeIBuc=s0-w300'},
Nepal Temples: Explore The Most Sacred Spaces In The Himalayan Nation - Travel and Leisure Asia,Nepal Temples: Explore The Most Sacred Spaces In The Himalayan Nation  Travel and Leisure Asia,2025-05-07 13:03:13,https://news.google.com/rss/articles/CBMinwFBVV95cUxNTDdxX1hDX1dxYmdsVUxmUkp3b2wxbGFpMmhnN21tengtNEVpTDR0VWh6YURNU0tmVmN4LXlBcTRRUFVWczBOOUNrdzROY2ozUzN6bFZ5RFdQV2M1R2NXM1NuTGdZSktOdGtsLVdsU0RUTlNnc0Q0QmhxbkxYUkxsV0Rqd08xMGNkRmlNZEt5MmhxbnZocDhoeDZjbklnZWfSAZ8BQVVfeXFMTUw3cV9YQ19XcWJnbFVMZlJKd29sMWxhaTJoZzdtbXp4LTRFaUw0dFVoemFETVNLZlZjeC15QXE0UVBVVnMwTjlDa3c0TmNqM1MzemxWeURXUFdjNUdjVzNTbkxnWUpLTnRrbC1XbFNEVE5TZ3NENEJocW5MWFJMbFdEandPMTBjZEZpTWRLeTJocW52aHA4aHg2Y25JZ2Vn?oc=5&hl=en-US&gl=US&ceid=US:en,https://www.travelandleisureasia.com,Travel and Leisure Asia,,{'https://lh3.googleusercontent.com/J6_coFbogxhRI9iM864NL_liGXvsQp2AupsKei7z0cNNfDvGUmWUy20nuUhkREQyrpY4bEeIBuc=s0-w300'},
Cipla launches AI initiative to support respiratory patients in Nepal - The Kathmandu Post,Cipla launches AI initiative to support respiratory patients in Nepal  The Kathmandu Post,2025-05-07 13:04:20,https://news.google.com/rss/articles/CBMitgFBVV95cUxNZVRpVjZnUWlZdWpYcW05d1dZeExxME1FUlh4eWRUeU1SbnEyaGtVUlVXeEdoYnNWQjdNQlZVNVlsQ1g3cGRjdnVPWUpJbEZJOVg2OHRKRVlxT255alJoZTV1aWZ2QkFveGVRaHhsUmpHazZvTmRlQU5JTFdXZy1wQWtUVnBCOXV5eGxRUzZRcHd3WEFwYVhwdkViRHpKWDJmVGRSMVRsTTJIOUZORmF0RUFMS3lEdw?oc=5&hl=en-US&gl=US&ceid=US:en,https://kathmandupost.com,The Kathmandu Post,,{'https://lh3.googleusercontent.com/J6_coFbogxhRI9iM864NL_liGXvsQp2AupsKei7z0cNNfDvGUmWUy20nuUhkREQyrpY4bEeIBuc=s0-w300'},
Women praised for driving economic recovery post-Covid at ‘Nirvik Nari’ - The Kathmandu Post,Women praised for driving economic recovery post-Covid at ‘Nirvik Nari’  The Kathmandu Post,2025-05-07 13:14:23,https://news.google.com/rss/articles/CBMitgFBVV95cUxNa19acWJBNkEwZWZPUUFCa21GRHMyU1Bua1ZkTTBYdWhJcW1QaW4zWXZUUGExQ3A2ZVRVUnpFX0NvYVlpeHJ2MlpqZFZGTTVicFI1VlpOMnlIQk9YM3ZNalNjNUdnaHJncUJTQWxzVmV3aDF1V0JxS2loeE01ZkJ3Y1BQcTAyWDBYRnNjZU16UC1SQUdqekU1c19Wa3pscXJmRVFhdlVvNHJiV2xWRGRqNGVkYTk1Zw?oc=5&hl=en-US&gl=US&ceid=US:en,https://kathmandupost.com,The Kathmandu Post,,{'https://lh3.googleusercontent.com/J6_coFbogxhRI9iM864NL_liGXvsQp2AupsKei7z0cNNfDvGUmWUy20nuUhkREQyrpY4bEeIBuc=s0-w300'},
Fonepay hosts 21st Asian Payment Network Forum in Nepal - The Kathmandu Post,Fonepay hosts 21st Asian Payment Network Forum in Nepal  The Kathmandu Post,2025-05-07 13:40:04,https://news.google.com/rss/articles/CBMinwFBVV95cUxQSlNoa3hxQThmQ09VcVFoRWNidnpjZW9fZjF3T2RsYU5WcmI1MndUNEZSWU5vdk5PRTN4QU5SOHkwZEtiUlM1TWVHREpCV2IwT1FpeTQzd2N5c18tLTBjNTlfcUpYY0RPeDZFbXV3QkdMU0Z5ZllwMWdRV0ZtbE9IYkNyd3NURmpSMmJZdnlMZG40QjZlcE1lVk82NVFSUjQ?oc=5&hl=en-US&gl=US&ceid=US:en,https://kathmandupost.com,The Kathmandu Post,,{'https://lh3.googleusercontent.com/J6_coFbogxhRI9iM864NL_liGXvsQp2AupsKei7z0cNNfDvGUmWUy20nuUhkREQyrpY4bEeIBuc=s0-w300'},
'Despite Heinous Attack On Our Neighbour': Nepali Lawmaker's Stinging Remarks Against Pakistani Delegation's Visit Amid Tensions With India - Newsx,'Despite Heinous Attack On Our Neighbour': Nepali Lawmaker's Stinging Remarks Against Pakistani Delegation's Visit Amid Tensions With India  Newsx,2025-05-07 15:01:00,https://news.google.com/rss/articles/CBMi5wFBVV95cUxOLWFCVXI5MjNfcXJBdXJkU1hsNXA0UGM2VlRqU1ducWxROWtia1B1RS1xaTlpdmhIUE1BZEZ3bGowX1FQTHBzcFNIS21jeThJeHJiaU5iOUp6Z0N4UmxrVTJJYjJlbTE5UW8yUG1LR0poSmZ1SXhJWWVOTXR0TmpyV0FVelJDVWlzWTJtR3NFLWMwZW1XTmhSX0RlUWVqNlZXUkg3b1Nsb1F5eFVNVmZfdmdKaE4tc2hmNWFReEdQS0IwRTFzTzlDOGR0ZWtDNkFLS3lmT3hKRTVzbTBUNkFEZjZsaG1Id1U?oc=5&hl=en-US&gl=US&ceid=US:en,https://www.newsx.com,Newsx,,{'https://lh3.googleusercontent.com/J6_coFbogxhRI9iM864NL_liGXvsQp2AupsKei7z0cNNfDvGUmWUy20nuUhkREQyrpY4bEeIBuc=s0-w300'},
"CMs of states with Pak, Nepal borders congratulated PM for Operation Sindoor success: MHA - Deccan Herald","CMs of states with Pak, Nepal borders congratulated PM for Operation Sindoor success: MHA  Deccan Herald",2025-05-07 15:49:07,https://news.google.com/rss/articles/CBMiygFBVV95cUxORy1UcHFaLVJET1B3WVhNVjQ2N3Y1THliaHhUenVoUk03UWIzT1J0MzJsMVJiTGhvU2IySS13eTBReGI2ekhyUkNOV0piMmp5Y3M3c1VlZ0wtNk51d0RtMWdfLXA0Zl96QTRjNlhUQ013OWFHRFNjcjlRUlZsREVYZkZXbVI4RVlQXzdWU3dKdkdNQ0Z4aTVFWmMwdHV6Q0s2LWxtTlB4bUl6SU5KckMzenRjcVp6VmRWYTRzS3ZucU9ndUVZcE9OSEVB?oc=5&hl=en-US&gl=US&ceid=US:en,https://www.deccanherald.com,Deccan Herald,,{'https://lh3.googleusercontent.com/J6_coFbogxhRI9iM864NL_liGXvsQp2AupsKei7z0cNNfDvGUmWUy20nuUhkREQyrpY4bEeIBuc=s0-w300'},
Meet the Nepali lawyers defending nature one case at a time - Mongabay,Meet the Nepali lawyers defending nature one case at a time  Mongabay,2025-05-07 16:17:50,https://news.google.com/rss/articles/CBMimgFBVV95cUxOdUhwbk9vX1RjUVFMYW04dlk0YWtiTUNRTkk1ZS1OSllud0VQRkttMjA2cFZLMUMtbTVPRXIza2UtQWJjWktSSTUzTG1nODE1TzhMbGYxU2JBekRpYjZrbW1uRzlzMU5HZndtVnNBNmR1ZGNuamk2dWFwYVdveTRuM2RUZjZweWpTb203cW41SzVGN191N0pJZ0RR?oc=5&hl=en-US&gl=US&ceid=US:en,https://news.mongabay.com,Mongabay,,{'https://lh3.googleusercontent.com/J6_coFbogxhRI9iM864NL_liGXvsQp2AupsKei7z0cNNfDvGUmWUy20nuUhkREQyrpY4bEeIBuc=s0-w300'},
Security Tightened Along Nepal-India Border Amid India-Pakistan Tensions - The Himalayan Times,Security Tightened Along Nepal-India Border Amid India-Pakistan Tensions  The Himalayan Times,2025-05-07 16:39:19,https://news.google.com/rss/articles/CBMirAFBVV95cUxOSG43SGFpaFZ1TEE4RVdBbG5PeVhBNGUxWW1lOUtlSERscmxtclFOTnZ6VHMzWXRndk5ySGNfY2RnWXhib3VDRjZaMGdVTHJvMXJ6Q0szNHRfcllqOU50VHk2Nkd3bHVqWVdGbWVvM1RxbmszVzUxQ3NIc21yQXF3SHY4SXdUc2JIczY2Ul9DeElGUzR0cGNxSVkzaDVLeF9zQlFpRERGQkRoWXRp0gFcQVVfeXFMUElMSlBPQU5NV1ViOUlhTTdIVUExSDAzWC1ZYzZnc00wZ0JvMmJhS0lWUDNOY1Bzdng4cnNGMnZFOVhvOHNyNDg4U19UVnJYZGlFVko2UXBZN1NlQXQ?oc=5&hl=en-US&gl=US&ceid=US:en,https://thehimalayantimes.com,The Himalayan Times,,{'https://lh3.googleusercontent.com/J6_coFbogxhRI9iM864NL_liGXvsQp2AupsKei7z0cNNfDvGUmWUy20nuUhkREQyrpY4bEeIBuc=s0-w300'},
Nepal ramps up security amid India-Pakistan tensions - The Annapurna Express,Nepal ramps up security amid India-Pakistan tensions  The Annapurna Express,2025-05-07 17:24:37,https://news.google.com/rss/articles/CBMiV0FVX3lxTE9kSnFka3pkYVNCZ2tnaUkyaWRJbWFrZEhZM0steWNIbnZ6U051T2dsYktPLVFzYjFWa3FqcGhkUlEzbHJyeGVlMC05SzVjSmwwazR3dnVKRQ?oc=5&hl=en-US&gl=US&ceid=US:en,https://theannapurnaexpress.com,The Annapurna Express,,{'https://lh3.googleusercontent.com/J6_coFbogxhRI9iM864NL_liGXvsQp2AupsKei7z0cNNfDvGUmWUy20nuUhkREQyrpY4bEeIBuc=s0-w300'},
Security beefed up along Nepal-India bordering areas - The Rising Nepal,Security beefed up along Nepal-India bordering areas  The Rising Nepal,2025-05-07 17:31:41,https://news.google.com/rss/articles/CBMiUEFVX3lxTE9ad1g0QWVObDduMk1IN1VSSUkwcjRjZC1IdVYwaTFPV3lBOWRPUW14cG1PVFdmc2VLUjFfaE13aGxOci1feWdQdHdGMGY1MFRV?oc=5&hl=en-US&gl=US&ceid=US:en,https://risingnepaldaily.com,The Rising Nepal,,{'https://lh3.googleusercontent.com/J6_coFbogxhRI9iM864NL_liGXvsQp2AupsKei7z0cNNfDvGUmWUy20nuUhkREQyrpY4bEeIBuc=s0-w300'},
Man shares chilling story of how his Nepali help’s wife started speaking fluent Tamil after being possess - Times of India,Man shares chilling story of how his Nepali help’s wife started speaking fluent Tamil after being possess  Times of India,2025-05-07 17:42:00,https://news.google.com/rss/articles/CBMiowJBVV95cUxQcXVoUnpxSEhnclFwei15dkNtWTRoN09LazF1NndQZmpPVEVxMk1oVk12Ml9GZTY1TXg1QlZpTGVUUllRU1Z5ZExDQjYxY2hqaXV0azBkSlZqaTVsNUhDaXluX0N0amdCcnhqNlpKZ0duNllycXFPcUdoUmxELUxSeDh4dEdHMXN5SVVkSVJWQmVKS1RnQ3JkTFpFRkY2a3BTTktuZ3dlOFJxVEJkTDlId2FjNmVPUTN6YzRibDJiZnpha09GR3E2V1RkWjhmRURVeE16bzh0enVtOVl2UllhLWt1Yk1TODRjSm03QUc1RlUwa3p0YWdxczAxQ0xBVXhHbjVyb3NFMU9CLTRPWXdTdXhCR2V5QWJxSkhkRUdWa3FWaEXSAagCQVVfeXFMT1NZV2hOdXlBMGI1UExBTkF5NVZ2UEMyVkRad012azRvT0RWUDBFX3FhRDZNblp5Y25KcG0yeTVPaHRFNjU3WFRpaFV1YWZreXU5UjdvLWlTMnQ3TFNFZ0tUblVBd0lTakpLZThFSXhPT3JFeEZrTEpZT3IxeE0xdEJXNzJCbWozbUJpZThYZDNKd1pNbzVSbUZwYXVHVkVwbk1iZkE2UFNfNkFfd1g4emlwSGphaklLOG9yYkpwRU01YWhvUktRdUYzdGxxandEU1BtTEZFaW1CWjVlZmdzRDdjazRYdDJvM1BrZ09DOTlIQUNVMWREZEx5bEM1NzB2a1llSWF4cjJCb0ZqX0M4RlYtb200UmNpLU1kaDFrbEZRLThGUEwwTmc?oc=5&hl=en-US&gl=US&ceid=US:en,https://timesofindia.indiatimes.com,Times of India,,{'https://lh3.googleusercontent.com/J6_coFbogxhRI9iM864NL_liGXvsQp2AupsKei7z0cNNfDvGUmWUy20nuUhkREQyrpY4bEeIBuc=s0-w300'},
Press advocacy group urges Nepal to investigate journalist deaths - Jurist.org,Press advocacy group urges Nepal to investigate journalist deaths  Jurist.org,2025-05-07 18:56:17,https://news.google.com/rss/articles/CBMipAFBVV95cUxQbS1PQUZvUElnUXd0X2lHV1JZYnFyaks2YnpwdHE5QnJtUXZXZUFydjFXdWdpZDJiMzhUVlVNY1JtZks0VHVwdjEwM0pLYUVsNW91N0NfRGlVVF94VGxaMWxfa0JqR0JESHhia3QwNV81QTIxQUFXXzVMLXlCdDRrTzcwRGQtY3huX2xJaTBzMjhJNTVPOUV5aXVoZW5RdURVVzZpaA?oc=5&hl=en-US&gl=US&ceid=US:en,https://www.jurist.org,Jurist.org,,{'https://lh3.googleusercontent.com/J6_coFbogxhRI9iM864NL_liGXvsQp2AupsKei7z0cNNfDvGUmWUy20nuUhkREQyrpY4bEeIBuc=s0-w300'},
NAIMA Nepal Mobility Expo 2025: The ultimate showcase of innovation and excellence in Automotive Industry - Technology Khabar,NAIMA Nepal Mobility Expo 2025: The ultimate showcase of innovation and excellence in Automotive Industry  Technology Khabar,2025-05-07 20:04:33,https://news.google.com/rss/articles/CBMiW0FVX3lxTE02N3J0elJWOHVLZVJpNW5wYjgxNDJhQndZZWJ3NVdZMDZvWm9Cd3YwNVJBQ3BBV3ZtcTFUY2RhcXp4RC1VSmNBRXF4bDhQOVdNMmZCMnFvb09xeEU?oc=5&hl=en-US&gl=US&ceid=US:en,https://technologykhabar.com,Technology Khabar,,{'https://lh3.googleusercontent.com/J6_coFbogxhRI9iM864NL_liGXvsQp2AupsKei7z0cNNfDvGUmWUy20nuUhkREQyrpY4bEeIBuc=s0-w300'},
Fonepay hosts 21st Asian Payment Network Forum in Nepal - MSN,Fonepay hosts 21st Asian Payment Network Forum in Nepal  MSN,2025-05-07 23:04:36,https://news.google.com/rss/articles/CBMiygFBVV95cUxPNkt1VjBFaVhSc0xNUTVHanJYNUQzVzI5TlN6Ulh1Y241eXNtUERwY3V2bHRXR2liUkZZUldreFhxVC1UQldPdkgtQldzT3ItZ3BKTnZoazlPcXhmMjR2T0U0cktzVFhoWXM2T0o2RDJYY2RzcDJtc1hzeUlyTlB5NmN1NUF4UTdiS3pFYUVpaDlGT3JuNjdUQml4RlFubGVlcTlUdUMtdXBxX3RRbUlsMmpBUGszTnlfeFNYalZoS1I5a1I2RDZhX3lB?oc=5&hl=en-US&gl=US&ceid=US:en,https://www.msn.com,MSN,,{'https://lh3.googleusercontent.com/J6_coFbogxhRI9iM864NL_liGXvsQp2AupsKei7z0cNNfDvGUmWUy20nuUhkREQyrpY4bEeIBuc=s0-w300'},
Advance ticket booking of 'Unko Sweater' begins - The Rising Nepal,Advance ticket booking of 'Unko Sweater' begins  The Rising Nepal,2025-05-08 00:49:42,https://news.google.com/rss/articles/CBMiUEFVX3lxTE1FVVF1MEU4RmhBeUZrM0VKZ1VZay1uY1F6MmJHU3ktcXJhbmpvdjFGMFl2d3RyTXVEUXdnYnJaUEJrTzY0NnptZ0xOb2UybHUx?oc=5&hl=en-US&gl=US&ceid=US:en,https://risingnepaldaily.com,The Rising Nepal,,{'https://lh3.googleusercontent.com/J6_coFbogxhRI9iM864NL_liGXvsQp2AupsKei7z0cNNfDvGUmWUy20nuUhkREQyrpY4bEeIBuc=s0-w300'},
"Journalism is a medium of nation building, says President Paudel - The Rising Nepal","Journalism is a medium of nation building, says President Paudel  The Rising Nepal",2025-05-08 00:54:00,https://news.google.com/rss/articles/CBMiUEFVX3lxTE1SaUVMWndfVGloR283bEJtVkZ1MHI5a25kN3N6cENhYzNfc2E1UG92NFF3ZXJjdmtVT0l3ZkNjdE9adlRfbW10aWhGZFh2Y3Fu?oc=5&hl=en-US&gl=US&ceid=US:en,https://risingnepaldaily.com,The Rising Nepal,,{'https://lh3.googleusercontent.com/J6_coFbogxhRI9iM864NL_liGXvsQp2AupsKei7z0cNNfDvGUmWUy20nuUhkREQyrpY4bEeIBuc=s0-w300'},
Nepal lawmakers press for clear stand on terrorism - The Kathmandu Post,Nepal lawmakers press for clear stand on terrorism  The Kathmandu Post,2025-05-08 00:59:43,https://news.google.com/rss/articles/CBMinAFBVV95cUxOdTlvYXFoT1NxMzE3Wkw5SXVORVYzdkVuUjExZExJU0tnazBvcjBBcEZ0QjJHUHVjRkxWTjhHVHBxMzU0V1JjeTBreGs2MXQ4Q29ZUHE1ZkJDNXF5bGtzc1QwVkRVUVZTWmd2QVRiZXVHT2dtRnZmSGRsVU1HNEdvMlZsWGNkSUhYSThRdXpCMDRORlZ1dl90ZWlJMUY?oc=5&hl=en-US&gl=US&ceid=US:en,https://kathmandupost.com,The Kathmandu Post,,{'https://lh3.googleusercontent.com/J6_coFbogxhRI9iM864NL_liGXvsQp2AupsKei7z0cNNfDvGUmWUy20nuUhkREQyrpY4bEeIBuc=s0-w300'},
Nepal renews push to revive long-defunct factories amid fiscal concerns - The Kathmandu Post,Nepal renews push to revive long-defunct factories amid fiscal concerns  The Kathmandu Post,2025-05-08 01:15:19,https://news.google.com/rss/articles/CBMitAFBVV95cUxPZXpmYjRNbEU0SnFYdjJkUG00emlsUWplTmtxSTV1RHZKRTBQSlQ0ejMxeEJhWmRadWxUeWE0by1fd3FYVTN4N01vUzFJZmVHamFRM0NNNE9SMC03TjVuR3FNWmMzQmY3WXZzaEZxUmJYbDdVSmhBcFg0UFVNTkFxNHczbHBIVmtoOFZMRGh0OF9xSlRIVlhpS2tXSXZIVVJ6R2JVazZuN3Z4OUNmRGV2NGp6MGE?oc=5&hl=en-US&gl=US&ceid=US:en,https://kathmandupost.com,The Kathmandu Post,,{'https://lh3.googleusercontent.com/J6_coFbogxhRI9iM864NL_liGXvsQp2AupsKei7z0cNNfDvGUmWUy20nuUhkREQyrpY4bEeIBuc=s0-w300'},
