title,description,published date,url,publisher.href,publisher.title,full_article,images,translated
Nepal to review Everest summit event after corruption complaint - Everest Chronicle,Nepal to review Everest summit event after corruption complaint  Everest Chronicle,2026-07-14 17:32:12,https://news.google.com/rss/articles/CBMigwFBVV95cUxOUkZhQWRmd1hhakVBZm1WZEwtUUNpUnBVOUt1VkJ5cXdKZF9pd3BpVGVaV0tlV2lNYVhJWHAtNUw5bktPZGZnc19pR2dna25yaGZ0REFXem0walpvT3pLUkg1M1htZ1BReTBfeEtLamFnTjg5OFdUTUpTUnc0NVV2ZlpBdw?oc=5&hl=en-US&gl=US&ceid=US:en,https://everestchronicle.com,Everest Chronicle,"Nepal's tourism authorities have asked the country's two leading mountaineering organisations to examine allegations against the organiser of a high-profile Everest event attended by the country's president and leading climbers after a complaint accused the private group of illegally issuing summit certificates and misrepresenting itself as a government body.

The Department of Tourism has written to the Nepal Mountaineering Association (NMA) and the Expedition Operators' Association Nepal (EOAN), asking them to review allegations against Everest Alliance Nepal, a non-governmental organisation that organises an annual event to honours Everest climbers. The department has also asked the two organisations to submit their opinions together with any available evidence.

The request follows a complaint lodged with the Commission for the Investigation of Abuse of Authority (CIAA), Nepal's anti-graft agency, which referred the matter to the department for further action.

According to the department's letter, the two organisations have been asked to recommend what action, if any, should be taken on the complaint and provide their assessment in line with the department's decision.

The complaint alleges that Everest Alliance Nepal, described as a family-run private organisation, falsely portrayed itself as a national-level body representing Nepal's mountaineering sector while organising the Everest Summiteers Summit.

It alleges the organisers presented themselves to the Chinese mountaineering community as representatives of the Nepal government, solicited donations from Chinese supporters and deposited the funds into private bank accounts.

The complaint further alleges that the organisation invited climbers to China and distributed Everest summit certificates without informing or obtaining verification from the Department of Tourism.

Under Nepal's mountaineering regulations, summit certificates are issued only after the Department of Tourism verifies expedition records, including documents submitted by expedition operators and government liaison officers.

The complaint also accuses the organisation of charging participants illegal fees and profiting from both climbers and donors. It says the alleged activities have created confusion among climbers and mountaineering organisations and undermined confidence in Nepal's official summit certification system.

Everest Alliance Nepal is headed by Sudarshan Nepal, who runs Nepal Big Mountain (NBM) Travel, a trekking agency. Although there is no legal requirement for organisers of mountaineering events to have expedition experience, the complaint notes that he has not organised expeditions on big mountains.

Nepal already has the Everest Summiteers Association, an organisation representing Everest climbers. However, some members of Nepal's mountaineering community say it has remained largely inactive because many climbers lack experience in running organisations. By contrast, Everest Alliance Nepal quickly gained prominence within a year of its establishment by organising high-profile events, honouring Nepali and foreign climbers, and appointing brand ambassadors and country representatives to promote Nepal's tourism.

The complaint further alleges that fraudulent certification continued with the support of some Department of Tourism officials who were offered financial incentives, although it provides no public evidence to support the allegation.

It calls for immediate legal action against those involved, saying the alleged activities have harmed the credibility and international reputation of Nepal's mountaineering industry.

The latest Everest Summiteers Summit, held at the Soaltee Hotel in Kathmandu on May 27, was attended by President Ram Chandra Paudel, Minister for Culture, Tourism and Civil Aviation Badri Prasad Pandey, senior government officials and prominent mountaineers. Dozens of Nepali and foreign climbers with notable Himalayan records were honoured during the event.

The complaint comes despite the event being held with visible government participation. Event banners displayed the logos of the Government of Nepal and the Nepal Tourism Board alongside that of Everest Alliance Nepal, while the president, the tourism minister and the tourism secretary attended the programme, which coincided with International Everest Day.

""The head of state and the tourism minister attended the event, but now it is being portrayed as a China-sponsored programme organised by an NGO,"" a veteran mountain guide, who requested anonymity because of the sensitivity of the issue, told Everest Chronicle. ""Ironically, the government's own official Everest Day programme two days later was much smaller.""

The government's official Everest Day celebration on May 29 consisted of a rally in Kathmandu organised in coordination with the Nepal Mountaineering Association, followed by a ceremony at the Nepal Tourism Board.

The Department of Tourism's letter does not make any findings on the allegations. Instead, it asks the NMA and EOAN to examine the complaint and submit their opinions before the government decides on any further course of action.

Neither Everest Alliance Nepal nor the CIAA immediately responded to requests for comment.","{'https://everestchronicle.com/storage/wp-content/uploads/2022/02/Kami-Rita-IV.jpeg', 'https://everestchronicle.com/storage/wp-content/uploads/2022/02/Jost-.jpeg', 'https://everestchronicle.com/storage/wp-content/uploads/2021/12/IMG-20211128-WA0002.jpg', 'https://everestchronicle.com/storage/wp-content/uploads/2022/02/Lakpa-Dendi-Sherpa.jpeg', 'https://everestchronicle.com/storage/wp-content/uploads/2021/11/Everest-crowds-Mingma-Dorchi.jpg', 'https://everestchronicle.com/storage/wp-content/uploads/2021/11/image_6487327-scaled.jpg', 'https://everestchronicle.com/storage/wp-content/uploads/2022/02/1-2.jpeg', 'https://everestchronicle.com/storage/wp-content/uploads/2021/12/Kit.jpg', 'https://everestchronicle.com/image/everest-summiteers-photo.jpeg'}","निजी समूह पर अवैध रूप स शिखर प्रमाणपत्र जारी करबाक आ अपना कए सरकारी निकाय क रूप मे गलत तरीका स पेश करबाक आरोप लगलाक बाद नेपाल क पर्यटन प्राधिकारी देश क दूटा प्रमुख पर्वतारोहण संगठन स देश क राष्ट्रपति आ प्रमुख पर्वतारोही क उपस्थिति वाला हाई प्रोफाइल एवरेस्ट आयोजन क आयोजक पर लागल आरोप क जांच करबा लेल कहलक अछि।

पर्यटन विभाग नेपाल पर्वतारोही संघ (एनएमए) आ अभियान संचालक संघ नेपाल (ईओएएन) केँ पत्र लिखि, एवरेस्ट पर्वतारोही सभक सम्मान मे वार्षिक आयोजन करयवला गैरसरकारी संस्था एवरेस्ट एलायंस नेपाल पर लागल आरोपक समीक्षा करबाक आग्रह केने अछि । विभाग दूनू संस्था स कोनो उपलब्ध सबूत क संग अपन राय देबा लेल सेहो कहलक अछि।

ई आग्रह नेपालक भ्रष्टाचार विरोधी एजेंसी प्राधिकरण दुरुपयोग अनुसन्धान आयोग (सीआईएए) मे दाखिल शिकायत के बाद भेल अछि, जे मामला के आगू के कार्रवाई के लेल विभाग के सौंपलक।

विभाग क पत्र क अनुसार दूनू संगठन स कहल गेल अछि जे ओ शिकायत पर की कार्रवाई, जौं कोनो कार्रवाई होए त ओकर सिफारिश करथि आ विभाग क फैसला क अनुरूप अपन आकलन देथि।

शिकायत मे आरोप अछि जे परिवार संचालित निजी संस्था बताओल गेल एवरेस्ट एलायंस नेपाल एवरेस्ट शिखर सम्मेलन के आयोजन करैत अपना के नेपाल के पर्वतारोहण क्षेत्र के प्रतिनिधित्व करय वाला राष्ट्रीय स्तर के निकाय के रूप मे झूठ पेश केलक।

एकर आरोप अछि जे आयोजक नेपाल सरकारक प्रतिनिधिक रूप मे चीनी पर्वतारोही समुदाय मे अपना केँ प्रस्तुत कए चीनी समर्थक सँ चंदा मँगलनि आ निजी बैंक खाता मे धनराशि जमा केलनि।

शिकायत मँ आगू आरोप लगैलौ गेलौ छै कि संगठन नँ चीन मँ पर्वतारोही क आमंत्रित करी क पर्यटन विभाग सँ बिना जानकारी या सत्यापन लेलौ एवरेस्ट शिखर सम्मेलन के प्रमाणपत्र वितरित करलकै ।

नेपाल के पर्वतारोहण नियमावली के तहत पर्यटन विभाग द्वारा अभियान के अभिलेख के सत्यापन के बाद ही शिखर प्रमाणपत्र जारी करलऽ जाय छै, जेकरा म॑ अभियान संचालक आरू सरकारी संपर्क अधिकारी द्वारा जमा करलऽ गेलऽ दस्तावेज भी शामिल छै ।

शिकायत मे संगठन पर प्रतिभागी स गैरकानूनी शुल्क लेबाक आ पर्वतारोही आ दाता दुनू स मुनाफा लेबाक आरोप सेहो लागल अछि। एकरऽ कहना छै कि कथित गतिविधि स॑ पर्वतारोही आरू पर्वतारोहण संगठनऽ म॑ भ्रम पैदा होय गेलऽ छै आरू नेपाल केरऽ आधिकारिक शिखर प्रमाणीकरण प्रणाली प॑ विश्वास कमजोर होय गेलऽ छै ।

एवरेस्ट एलायन्स नेपालक अध्यक्षता सुदर्शन नेपाल अछि, जे नेपाल बिग माउण्टेन् (एनबीएम) ट्रैवल नामक ट्रेकिंग एजेन्सी चला रहल अछि । हालांकि पर्वतारोहण आयोजन के आयोजक के अभियान के अनुभव होबय के कोनो कानूनी आवश्यकता नै छै, लेकिन शिकायत में कहल गेल छै कि ओ पैघ पहाड़ पर अभियान के आयोजन नै केने छैथ।

नेपाल मे पहिने सँ एवरेस्ट पर्वतारोही के प्रतिनिधित्व करय वाला संस्था एवरेस्ट समिटियर्स एसोसिएशन अछि. मुदा नेपाल के पर्वतारोही समुदाय के किछु सदस्य के कहनाय छनि जे ई बहुत हद तक निष्क्रिय रहल अछि किएक त बहुतो पर्वतारोही के दौड़ के संगठन के अनुभव के कमी अछि. एकरऽ विपरीत एवरेस्ट एलायंस नेपाल न॑ अपनऽ स्थापना के एक साल के भीतर ही हाई प्रोफाइल आयोजन के आयोजन करी क॑, नेपाली आरू विदेशी पर्वतारोही क॑ सम्मानित करी क॑, आरू नेपाल केरऽ पर्यटन क॑ बढ़ावा दै लेली ब्रांड एम्बेसडर आरू देश प्रतिनिधि के नियुक्ति करी क॑ जल्दी स॑ प्रमुखता हासिल करी लेलकै ।

शिकायत म॑ आरू आरोप लगैलऽ गेलऽ छै कि पर्यटन विभाग केरऽ कुछ अधिकारियऽ के सहयोग स॑ धोखाधड़ी के प्रमाणीकरण जारी रहलै, जेकरा आर्थिक प्रोत्साहन के पेशकश करलऽ गेलऽ छेलै, हालांकि ई आरोप के समर्थन करै लेली कोय सार्वजनिक सबूत नै देलऽ गेलऽ छै ।

कथित गतिविधि स नेपाल के पर्वतारोहण उद्योग के विश्वसनीयता आ अंतर्राष्ट्रीय प्रतिष्ठा के नुकसान पहुंचल कहैत एहि मे संलग्न लोक के खिलाफ तत्काल कानूनी कार्रवाई के आह्वान करैत अछि।

काठमांडूके सोलटी होटलमे २७ मईके आयोजित नवीनतम एवरेस्ट शिखर सम्मेलनमे राष्ट्रपति रामचन्द्र पौडेल, संस्कृति, पर्यटन तथा नागरिक उड्डयन मन्त्री बद्री प्रसाद पाण्डेय, वरिष्ठ सरकारी अधिकारी आ प्रमुख पर्वतारोहीसब सहभागिता रहल छल । एहि दौरान उल्लेखनीय हिमालयी अभिलेख रखनिहार दर्जनों नेपाली आ विदेशी पर्वतारोही कए सम्मानित कएल गेल ।

ई शिकायत दृश्यमान सरकारी सहभागिता के साथ आयोजन के बावजूद आबी रहलऽ छै । आयोजन बैनर पर एवरेस्ट एलायंस नेपाल के लोगो के संग नेपाल सरकार आ नेपाल पर्यटन बोर्ड के लोगो सेहो देखाओल गेल छल, जखन कि अंतर्राष्ट्रीय एवरेस्ट दिवस के संग संयोग सं भेल कार्यक्रम मे अध्यक्ष, पर्यटन मंत्री आ पर्यटन सचिव शामिल छलाह.

ई मुद्दा के संवेदनशीलता के वजह स॑ नाम नै बताबै के आग्रह करै वाला एगो अनुभवी माउंटेन गाइड न॑ एवरेस्ट क्रॉनिकल क॑ बतैलकै कि ई आयोजन म॑ राष्ट्रपति आरू पर्यटन मंत्री शामिल छेलै, लेकिन अब॑ एकरा चीन द्वारा प्रायोजित एगो गैर सरकारी संगठन द्वारा आयोजित कार्यक्रम के रूप म॑ पेश करलऽ जाय रहलऽ छै । विडंबना ई छै कि सरकार केरऽ अपनऽ आधिकारिक एवरेस्ट डे कार्यक्रम दू दिन बाद बहुत छोटऽ छेलै ।

सरकारके २९ मईके आधिकारिक एवरेस्ट दिवस समारोहमे नेपाल पर्वतारोही संघके समन्वयमे काठमाण्डौमे आयोजित रैलीके बाद नेपाल पर्यटन बोर्डमे समारोहके आयोजना कएल गेल ।

पर्यटन विभाग क पत्र मे एहि आरोप पर कोनो निष्कर्ष नहि निकलल अछि। बल्कि एनएमए आरू ईओएएन स॑ कहलऽ गेलऽ छै कि सरकार न॑ आगू केरऽ कोय भी कार्रवाई के फैसला करै स॑ पहल॑ शिकायत के जांच करी क॑ अपनऽ राय पेश कर॑ ।

टिप्पणी के आग्रह पर ने एवरेस्ट एलायंस नेपाल आ ने सीआईएए तत्काल कोनो जवाब देलक।"
