title,description,published date,url,publisher.href,publisher.title,full_article,images,translated
"Cricket commentary | Scotland vs Nepal, 33rd Match, Group C, ICC Men's T20 World Cup 2026 - Cricbuzz.com","Cricket commentary | Scotland vs Nepal, 33rd Match, Group C, ICC Men's T20 World Cup 2026  Cricbuzz.com",2026-02-17 01:30:40,https://news.google.com/rss/articles/CBMirgFBVV95cUxQX1MtelphNGpWTmx6Wm9kUzZDSnhrNHNuRm52Y29RZ1FIaThVQTdkNFdid2thdjdPdXNmOGJwMTJfU0djanBxU2s4VDhoNUtPaFkzdDl3TlZ4bnNvdGh4UE4zbUE2OW9HYXc1dXd4dUQtcjlDX0ZocWhnRkE4SzNtbjNrYUpOT3hPZUhtOUpOaUdxZjQ2ZGlOMGY2M1J1aXU3UEFRZUFmSEdJYWdRcVE?oc=5&hl=en-US&gl=US&ceid=US:en,https://www.cricbuzz.com,Cricbuzz.com,"Preview



England's win over Italy ensured they joined West Indies as the two teams from Group C to qualify for the Super Eights, turning this contest between Scotland and Nepal into the tournament's first dead rubber. Both sides are already eliminated, but a victory would at least offer some consolation after campaigns filled with what-ifs.



Nepal opened their campaign by falling just four runs short of England's 184 in a spirited chase. What followed were two crushing defeats to Italy and West Indies, with recurring batting failures leaving the bowlers with too much to do. At the heart of Nepal's struggles have been their misfiring stars with Kushal Bhurtel struggling with both bat and ball while Sandeep Lamichhanne has gone wicketless since the England game. That they managed to pick up just one wicket across those two games also highlights deeper concerns within their bowling.



Scotland's campaign has been a roller-coaster right from their unexpected entry into the tournament. A defeat to West Indies was followed by a commanding win over Italy before they were brushed aside by neighbours England. Yet they'll remain upbeat considering how well they've adapted despite their limited preparation. Their spinners have excelled, claiming 11 wickets at 24.63, the most among teams to have played all their matches in India.



Nepal have enjoyed the rare luxury of playing all their games at the Wankhede, gaining both familiarity with the conditions and strong backing from fans who have thronged the stadium. The advantage, however, might still lie with the Scots. The venue has statistically favoured spinners this tournament, and Nepal's batting will face a stern test against a confident spin attack.



When: Scotland vs Nepal, February 17, 2026 at 7 PM IST



Where: Wankhede Stadium, Mumbai



What to expect: The Wankhede stadium has offered 2.2 degrees of turn on average - the most amongst all venues in this World Cup so far. The first three games were won by the teams batting first while the last two were won by the chasing side, although that was largely due to Nepal posting below-par totals in both those games.



Team News



Scotland



Safyaan Sharif injured his right groin ahead of Scotland's previous game and has since been replaced by Jack Jarvis. While they have no pressing reasons to make changes to their XI, they could still use the opportunity to give their bench players a run in a World Cup fixture.



Probable XI - George Munsey, Michael Jones, Brandon McMullen, Richie Berrington (c), Tom Bruce, Michael Leask, Matthew Cross (w), Mark Watt, Oliver Davidson, Brad Currie/Zainullah Ihsan, Brad Wheal/Chris Greaves



Nepal



Like Scotland, Nepal may opt to hand their bench players an opportunity to feature in a World Cup game.



Probable XI - Kushal Bhurtel, Aasif Sheikh (w), Rohit Paudel (c), Dipendra Singh Airee, Aarif Sheikh/Basir Ahamad, Lokesh Bam/Sundeep Jora, Gulsan Jha, Sompal Kami, Karan KC, Nandan Yadav, Sandeep Lamichhane



What they said:



""If you keep listening to outside noise, it will be hard for all the players to perform in the next match. So we are keeping it outside and when the team is losing, it is very important to keep everyone very positive and we are trying to do that"" - Nepal captain Rohit Paudel.



""Yeah, look, last game against England, we played in front of 50,000. And they were supporting us. So I think now we can expect probably less crowd, more noise, but to be supporting Nepal. So I think it's best of both worlds for the guys to experience that"" - Scotland's Tom Bruce.","{'https://static.cricbuzz.com/a/img/v1/i1/c863496/zimbabwe-one-win-away-from-super-8s-ireland-chase-survival.jpg?d=low&p=det', 'https://static.cricbuzz.com/a/img/v1/i1/c863489/scotland-and-nepal-eye-positive-finish-in-dead-rubber.jpg?d=low&p=det', 'https://static.cricbuzz.com/a/img/v1/i1/c863482/highlights-australia-vs-sri-lanka-icc-mens-t20-world-cup-2026.jpg?d=high&p=det', 'https://static.cricbuzz.com/a/img/v1/i1/c863458/scintillating-nissanka-ton-puts-australia-on-the-brink-of-elimination.jpg?d=low&p=det', 'https://static.cricbuzz.com/a/img/v1/i1/c863455/pathum-nissankas-100-v-aus.jpg?d=high&p=det', 'https://static.cricbuzz.com/a/img/v1/i1/c863424/mcconchie-cleared-to-replace-injured-bracewell-in-nz-squad.jpg?d=low&p=det', 'https://static.cricbuzz.com/a/img/v1/i1/c863495/fatima-sana-stars-as-pakistan-sign-off-with-consolation-win.jpg?d=low&p=det', 'https://static.cricbuzz.com/a/img/v1/384x216/i1/c829459/india-vs-new-zealand-3rd-odi-indore.jpg', 'https://static.cricbuzz.com/a/img/v1/i1/c863497/marsh-rues-poor-execution-as-australia-near-early-exit.jpg?d=low&p=det', 'https://static.cricbuzz.com/a/img/v1/i1/c863499/live-india-a-vs-nepal-womens-asia-cup-rising-stars-2029.jpg?d=high&p=det', 'https://static.cricbuzz.com/a/img/v1/384x216/i1/c791826/india-vs-south-africa-2025-2nd-odi-raipur.jpg', 'https://static.cricbuzz.com/a/img/v1/384x216/i1/c822456/india-vs-new-zealand-1st-odi-baroda.jpg', 'https://static.cricbuzz.com/a/img/v1/384x216/i1/c779661/india-win-the-2025-womens-world-cup.jpg', 'https://static.cricbuzz.com/a/img/v1/384x216/i1/c779523/india-vs-south-africa-2025-womens-world-cup-final.jpg', 'https://static.cricbuzz.com/a/img/v1/384x216/i1/c790124/india-vs-south-africa-2025-1st-odi-ranchi.jpg', 'https://www.cricbuzz.com/cricbuzz/apple-icon.png?6db7e6007fdcb302'}","पूर्वावलोकन



इटली प॑ इंग्लैंड केरऽ जीत स॑ ग्रुप सी केरऽ दूनू टीम के रूप म॑ वेस्टइंडीज म॑ शामिल होय क॑ सुपर आठ म॑ जगह बनाबै के सुनिश्चित करलऽ गेलै, जेकरा स॑ स्कॉटलैंड आरू नेपाल के बीच ई मुकाबला क॑ टूर्नामेंट केरऽ पहलऽ मृत रबर म॑ बदली देलऽ गेलै । दुनू टीम पहिने सं बाहर भ गेल अछि, मुदा जीत सं कम सं कम व्हाट-इफ सं भरल अभियान के बाद किछ सांत्वना मिलत.



नेपाल न॑ उत्साहपूर्ण पीछा करतें हुअ॑ इंग्लैंड केरऽ १८४ रन स॑ महज चार रन कम करी क॑ अपनऽ अभियान के शुरुआत करलकै । एकरऽ बाद इटली आरू वेस्टइंडीज स॑ दू कुचल हार छेलै, जेकरा म॑ बार-बार बल्लेबाजी म॑ विफलता के वजह स॑ गेंदबाजऽ क॑ बहुत कुछ करै के मौका मिललै । नेपाल केरऽ संघर्ष के मूल में ओकरऽ गलत फायरिंग स्टार रहलऽ छै जेकरा म॑ कुशल भूर्टेल न॑ बल्ले आरू गेंद दूनू के साथ संघर्ष करी रहलऽ छै जबकि संदीप लामिछान्ने इंग्लैंड केरऽ खेल के बाद स॑ विकेटलेस होय गेलऽ छै । ई बात कि हुनी वू दू गेम भर मँ महज एक विकेट उठाबै मँ सफल रहलै, ई भी हुनकौ गेंदबाजी के भीतर गहरा चिंता के उजागर करै छै ।



स्कॉटलैंड केरऽ ई अभियान टूर्नामेंट म॑ अप्रत्याशित रूप स॑ प्रवेश स॑ ही रोलर-कोस्टर रहलऽ छै । वेस्टइंडीज स॑ हार के बाद इटली प॑ कमांडिंग जीत मिललै, जेकरा बाद ओकरा पड़ोसी देश इंग्लैंड न॑ एक तरफ करी देलकै । तइयो ओ सब एहि बात पर विचार करैत उत्साहित रहताह जे ओ अपन सीमित तैयारी के बावजूद कतेक नीक सं एडजस्ट केने छथि. हुनकऽ स्पिनर न॑ बेहतरीन प्रदर्शन करलकै, जेकरा म॑ २४.६३ के अंतर स॑ ११ विकेट के दावा करलऽ गेलऽ छै, जे भारत म॑ अपनऽ सब मैच खेलै वाला टीमऽ म॑ सबस॑ अधिक छै ।



नेपाल अपनऽ सब खेल वानखेडे म॑ खेलै के दुर्लभ विलासिता के आनंद लेल॑ छै, जेकरा म॑ परिस्थिति स॑ परिचितता आरू स्टेडियम म॑ भीड़ लगै वाला प्रशंसकऽ के मजबूत समर्थन दूनू मिललऽ छै । मुदा, फायदा एखनो स्कॉटिश लोकनिक संग भ सकैत अछि. ई टूर्नामेंट में ई आयोजन स्थल सांख्यिकीय रूप स॑ स्पिनरऽ के पक्ष म॑ रहलऽ छै, आरू नेपाल केरऽ बल्लेबाजी क॑ आत्मविश्वासी स्पिन हमला के खिलाफ कड़ा परीक्षा के सामना करना पड़तै ।



कखन : स्कॉटलैण्ड बनाम नेपाल, १७ फरवरी २०२६ साँझ ७ बजे IST



कहाँ : वानखेड़े स्टेडियम, मुंबई



की आशा करलऽ जाय : वानखेडे स्टेडियम म॑ औसतन २.२ डिग्री के मोड़ मिललऽ छै - जे ई विश्व कप म॑ अब तलक के सब स्थलऽ म॑ सबसें जादा छै । पहिल तीन मैच पहिने बल्लेबाजी करय वाला टीम जीतल छल जखन कि अंतिम दू मैच पीछा करय वाला टीम जीतने छल, हालांकि एकर बहुत हद तक कारण छल नेपाल के ओहि दुनू खेल मे बराबर सं नीचा के कुल पोस्ट करय के.



टीम समाचार



स्कॉटलैंड



स्कॉटलैंड केरऽ पिछला खेल स॑ पहल॑ सफियन शरीफ क॑ हुनकऽ दाहिना ग्रोइन म॑ चोट लगलै आरू ओकरऽ बाद हुनकऽ जगह जैक जार्विस क॑ आबी गेलऽ छै । हालांकि ओकरा पास अपनऽ एकादश म॑ बदलाव करै के कोय जरुरी कारण नै छै, लेकिन तभियो भी वू ई मौका के इस्तेमाल करी क॑ अपनऽ बेंच खिलाड़ी क॑ विश्व कप केरऽ फिक्सर म॑ एक रन द॑ सकै छै ।



संभावित ग्यारह - जॉर्ज मुनसे, माइकल जोन्स, ब्रैंडन मैकमुलेन, रिची बेरिंगटन (ग), टॉम ब्रूस, माइकल लीस्क, मैथ्यू क्रॉस (डब्ल्यू), मार्क वाट, ओलिवर डेविडसन, ब्रैड करी / जैनुल्लाह इहसान, ब्रैड व्हील / क्रिस ग्रीव्स |



नेपाल



स्कॉटलैंड के तरह नेपाल भी अपनऽ बेंच के खिलाड़ी सिनी क॑ विश्व कप केरऽ खेल म॑ शामिल होय के मौका सौंप॑ सकै छै ।



संभावित ग्यारह - कुशल भुर्टेल, आसिफ शेख (व), रोहित पौडेल (ग), दीपेन्द्र सिंह ऐरी, आरिफ शेख/बसीर अहमद, लोकेश बम/सुन्दीप जोरा, गुलसन झा, सोम्पल कामी, करण केसी, नंदन यादव, संदीप लामिछाने



ओ सभ की कहलनि-



""बाहर के हल्ला सुनैत रहब त अगिला मैच में सब खिलाड़ी के प्रदर्शन करब कठिन होयत। ताहि लेल हम सब एकरा बाहर राखि रहल छी आ जखन टीम हार रहल अछि त सब के बहुत सकारात्मक राखब बहुत जरूरी अछि आ हम सब ओहि काज के लेल प्रयासरत छी"" - नेपाल के कप्तान रोहित पौडेल।



""हँ, देखू, इंग्लैंड के खिलाफ पिछला खेल में हम सब 50 हजार के सामने खेलने रही। आ ओ सब हमरा सब के संग द रहल छल। तें हमरा लगैत अछि जे आब हम सब शायद कम भीड़, बेसी हल्ला के उम्मीद क सकैत छी, मुदा नेपाल के समर्थन करब। तें हमरा लगैत अछि जे लड़का सब के ई अनुभव करब दुनू दुनिया के सबस नीक अछि"" - स्कॉटलैंड के टॉम ब्रूस।"
