title,description,published date,url,publisher.href,publisher.title,full_article,images,translated
British climber and Nepali guide feared dead after climbing Everest - BBC.com,British climber and Nepali guide feared dead after climbing Everest  BBC.com,2024-05-24 13:14:37,https://news.google.com/rss/articles/CBMiMmh0dHBzOi8vd3d3LmJiYy5jb20vbmV3cy91ay1lbmdsYW5kLWxlZWRzLTY5MDU0ODMx0gE2aHR0cHM6Ly93d3cuYmJjLmNvbS9uZXdzL3VrLWVuZ2xhbmQtbGVlZHMtNjkwNTQ4MzEuYW1w?oc=5&hl=en-US&gl=US&ceid=US:en,https://www.bbc.com,BBC.com,"British climber and Nepali guide feared dead after climbing Everest

2 days ago Share

Instagram/@danpatwcf Gym owner Daniel Paterson had been documenting his journey on social media

A British climber and his Nepali guide are feared dead after being hit by falling ice as they descended from Everest's summit.

Daniel Paterson, 39, from Wakefield, and guide Pastenji Sherpa, 23, reached the top of the 29,032ft (8,849m) peak on Tuesday as part of a group.

They have not been heard from since.

Adventure company 8K Expeditions said rescuers were unable to find the pair and the chances of finding them alive ""was not possible"".

The company, which organised the expedition, said the collapse happened on Hilary Step, a vertical rock face near the summit and that the men ""fell down towards the Tibet side through a very vertical steep"".

Instagram/@danpatwcf An experienced climber, Mr Paterson said climbing Everest had been a goal for most of his life

The company said retrieving their bodies was difficult because rescuers could not access that side of the mountain and helicopters could not be flown there.

The area is understood to be within the so-called 'death zone' - the section of the mountain above 8,000m where oxygen levels and air pressure are not sufficient to sustain human life for an extended time.

Mr Paterson, co-owner of Wakefield Crossfit, had been documenting his journey to climb Everest since arriving in the Himalayas in Nepal last month.

His challenge was to help raise money for the family of a gym member, who had recently died from cancer.

An experienced climber, Mr Paterson had previously climbed Ama Dablam, also in the Himalayan range, which stands at 22,525ft (6812m).

Instagram/@danpatwcf He posted this picture during his journey with the caption ""happiest in the mountains""

In one of his final social media posts on16 May, Mr Paterson said climbing Everest had been his goal ""for most of his life"".

He said he had spent the last 18 months preparing for the challenge to summit the mountain.

He added: ""One thing I can guarantee is that I won't be quitting. I don't get scared much in life but the thing that scares me the most is not achieving this.""

How deadly is Mount Everest?

Deadly Everest season puts focus on record permits

A spokesperson for the Foreign, Commonwealth and Development Office said: ""We are supporting the family of a British man who is missing in Nepal and are in touch with local authorities.""

Earlier, a Kenyan mountaineer who went missing near the summit of Everest was found dead .

A Romanian climber and a British climber and his Nepalese guide were also found dead on Tuesday, the Himalayan Times reported.

Follow BBC Yorkshire on Facebook , X (formerly Twitter) and Instagram . Send your story ideas to yorkslincs.news@bbc.co.uk .

Retired American doctor dies during Everest climb","{'https://ichef.bbci.co.uk/news/480/cpsprodpb/11678/production/_105988217_line976.jpg.webp', 'https://ichef.bbci.co.uk/news/480/cpsprodpb/11295/production/_133339207_5d186895-8171-464f-b0b6-7b6d4cc8dfd5.jpg.webp', 'https://ichef.bbci.co.uk/news/480/cpsprodpb/139A5/production/_133339208_a59f759d-78e6-4306-a25c-54597f059da0.jpg.webp', 'https://ichef.bbci.co.uk/news/1024/branded_news/9D65/production/_133339204_danpic.jpg', 'https://ichef.bbci.co.uk/news/480/cpsprodpb/EB85/production/_133339206_a74cdfab-9872-473e-a825-c21c29df70c6.jpg.webp', 'https://news.google.com/bbcx/grey-placeholder.png'}","ब्रिटिश पर्वतारोही आ नेपाली गाइड एवरेस्ट पर चढ़ला के बाद मृतक के आशंका 2 दिन पहिने शेयर इंस्टाग्राम/@danpatwcf जिम के मालिक डेनियल पैटरसन सोशल मीडिया पर अपन यात्रा के दस्तावेजीकरण क रहल छलाह एकटा ब्रिटिश पर्वतारोही आ हुनकर नेपाली गाइड के आशंका के बाद मृतक के कारण खसला के बाद हुनका सब के मृतक के आशंका अछि. एवरेस्ट के शिखर सम्मेलन।वेकफील्ड केरऽ 39 वर्षीय डेनियल पैटरसन आरू गाइड पेस्टेंजी शेरा (23) मंगलवार क॑ 29,032फीट (8,849 मीटर) केरऽ चोटी के शीर्ष पर पहुँची गेलै ।तहियासँ हुनका लोकनिक सुनल नहि गेल अछि ।एडवेंचर कंपनी 8K अभियान न॑ कहलकै कि बचावकर्ता ई जोड़ी क॑ खोजै म॑ असमर्थ छै आरू ओकरा जीवित होय के संभावना क॑ “संभव नै छै” ।अभियान के आयोजन करै वाला कंपनी न॑ कहलकै कि ई पतन हिलेरी स्टेप प॑ घटलै, जे शिखर के पास एगो ऊर्ध्वाधर चट्टानी चेहरा छै आरू पुरुष &quot;बहुत ऊर्ध्वाधर खड़ा के माध्यम स॑ तिब्बत के तरफ नीचें गिरी गेलै&quot; ।इंस्टाग्राम/@danpatwcf एक अनुभवी पर्वतारोही, श्री पैटरसन न॑ कहलकै कि एवरेस्ट पर्वतारोहण हुनकऽ जीवन के अधिकांश समय लेली एगो लक्ष्य छेकै जेकरा कंपनी न॑ कहलकै कि अपनऽ शव क॑ पूरा करना मुश्किल छै, कैन्हेंकि बचावकर्ता न॑ पहाड़ केरऽ वू तरफ पहुँच नै सकलऽ छै आरू हेलीकॉप्टर क॑ वहाँ नै उड़ान भरलऽ जाब॑ सकै छै ।ई क्षेत्र तथाकथित ‘मृत्यु क्षेत्र’ के भीतर समझलऽ जाय छै - ८,००० मीटर स॑ ऊपर के पहाड़ केरऽ खंड जहाँ ऑक्सीजन केरऽ स्तर आरू वायु के दबाव मानव जीवन क॑ विस्तारित समय लेली कायम रखै लेली पर्याप्त नै छै ।वेकफील्ड क्रॉसफिट केरऽ सह-मालिक श्री पैटरसन न॑ पिछला महीना नेपाल केरऽ हिमालय पहुँचला के बाद स॑ एवरेस्ट प॑ चढ़ै के यात्रा के दस्तावेजीकरण करी रहलऽ छेलै ।हुनकऽ चुनौती छेलै कि जिम केरऽ एगो सदस्य केरऽ परिवार लेली पैसा जुटाबै म॑ मदद करलऽ जाय, जेकरऽ हाल ही म॑ कैंसर स॑ मौत होय गेलऽ छेलै ।एक अनुभवी पर्वतारोही, मिस्टर पैटरसन पहिने अमा डबलम पर चढ़ने छलाह, जे हिमालयन रेंज मे सेहो छल, जे 22,525फीट (6812m) पर ठाढ़ अछि ।Instagram/@danpatwcf अपनऽ यात्रा के दौरान हुनी ई तस्वीर क॑ अपनऽ अंतिम सोशल मीडिया पोस्ट म॑ स॑ एक म॑ &quot;पहाड़ऽ म॑ खुश&quot; के साथ पोस्ट करलकै, श्री पैटरसन न॑ कहलकै कि एवरेस्ट पर चढ़ना हुनकऽ लक्ष्य &quot;अपनऽ जीवन के अधिकांश समय छेलै&quot; ।ओ कहलनि जे, ओ पिछला 18 महीना पहाड़ के शिखर पर बैसय के चुनौती के तैयारी मे बिता देने छथिन्ह.ओ आगू कहलनि: &quot;एकटा बात हम गारंटी द&#39; सकैत छी जे हम नहि छोड़ब. हमरा जीवन मे बेसी डर नहि होइत अछि मुदा हमरा सबसँ बेसी डराबय बला बात ई नहि अछि.&quot;माउंट एवरेस्ट कतेक घातक अछि ?घातक एवरेस्ट सीजन रिकार्ड परमिट पर ध्यान केंद्रित करै छै जे विदेशी, राष्ट्रमंडल आरू विकास कार्यालय के प्रवक्ता न॑ कहलकै, “हम॑ एगो ब्रिटिश आदमी के परिवार क॑ सहयोग करी रहलऽ छियै जे नेपाल म॑ लापता छै आरू स्थानीय अधिकारियऽ स॑ संपर्क म॑ छै ।एहि सं पहिने एवरेस्टक शिखरक समीप लापता भेल केन्याई पर्वतारोही मृत भेटल .हिमालयन टाइम्स केरऽ रिपोर्ट के अनुसार मंगलवार क॑ रोमानिया केरऽ एगो पर्वतारोही आरू एगो ब्रिटिश पर्वतारोही आरू ओकरऽ नेपाली गाइड मृत मिललै ।बीबीसी यॉर्कशायर के फेसबुक , एक्स (पहिने ट्विटर) आ इंस्टाग्राम पर फॉलो करू .अपन कथाक विचार yorkslincs.news@bbc.co.uk पर पठाउ .एवरेस्ट चढ़ाई के दौरान रिटायर्ड अमेरिकी डॉक्टर के मृत्यु"
