title,description,published date,url,publisher.href,publisher.title,full_article,images,translated
"India A Vs Nepal LIVE Score, Women’s Asia Cup Rising Stars 2026: Mani Outsmarts Rawal, NEP Lose Early Wicket - Outlook India","India A Vs Nepal LIVE Score, Women’s Asia Cup Rising Stars 2026: Mani Outsmarts Rawal, NEP Lose Early Wicket  Outlook India",2026-02-17 03:31:43,https://news.google.com/rss/articles/CBMi2AFBVV95cUxNYm5LdHVSZ2w5YjlxQkV1aENhSk45X2JYYW11OEJSV1hROUtGVXVwRm5JT2xHV2p2UlVrSW5mWV93Wk1KWmJKMzFoRGdrX1ZPNjJHdnpjenRzeUNLRkd2UXFDZUZmNURwcDJWdzZfSDh4WGw0UEx3YVZibmk1LXBhMVBrQ0hVY3FwRFViX1VmZTNPMkpGc1dOVnhGMkY1TW4xdVcwNk4zNkVGLUE2bDFYRG5rNU55MUkxRHN5YVk0Qk5PMG44dF9DMGZqSTR4SzQ2SGhYU2JDNGLSAeYBQVVfeXFMUDNOdDVRZkhZZVdsMVVZX2lHTWxqdjg2NHMzcEdOSlZocF9sVHduamo4S3NLWDAtd3d5czZuSFpTVTBUVVBxVUtNRmdZaWczMF9mbjIwNzBNRGtTT2VWSTRXUHlZZXRDZVk0UFBXeHAtOWZvWWRmbm44b1FPY19OX2g0Rl83VGRuX2JGOGhKdllCVGwweGNQbTJoNVU4bXRQTTVXSzExZERCZmFGUVY2bTV6QTktQkxudkZlNHpTeFhTWHRaQk9nZGhGdF9yZVp5WXkwLUJnY1pVcVpLTHZudmlwYnhLR1E?oc=5&hl=en-US&gl=US&ceid=US:en,https://www.outlookindia.com,Outlook India,"Minnu Mani strikes again, and Nepal are in deeper trouble. Roma Thapa nicks one through to Mamatha Madiwala and has to walk back for just 1 off 3. Kabita Joshi, the right-hander, comes in under pressure, but Mani keeps it tight with back-to-back dots. India A are firmly in control, not giving an inch.","{'https://img-2.outlookindia.com/outlookindia/2024-02/ef4d7043-6a14-4dc6-994b-7ea428e7f467/whatsapp_share.svg', 'https://img-2.outlookindia.com/outlookindia/2024-05/8876996e-84ff-4031-b346-0f25d1f485b3/follow_whatsapp.png', 'https://img-2.outlookindia.com/outlookindia/2024-02/4f8abcc1-6b27-46df-b3aa-a77f73795851/4.png', 'https://media.assettype.com/outlookindia/2026-02-16/38rpi6sw/Afghanistan-vs-United-Arab-Emirates-T20-World-Cup-Cricket-18-Azmatullah-Omarzai.jpg?w=200&auto=format%2Ccompress&fit=max', 'https://www.facebook.com/tr?id=203471368975912&ev=PageView&noscript=1', 'https://img-2.outlookindia.com/outlookindia/2024-02/a8ad731c-a142-4df5-90b9-fdbd2fc5201b/1.png', 'https://media.assettype.com/outlookindia/2026-01-24/zsxqhqx4/kashmir-houseboat.jpg?w=200&auto=format%2Ccompress&fit=max', 'https://media.assettype.com/outlookindia/2026-02-12/uq9ncc6h/YouTube-Thumbnail-15.png?w=200&auto=format%2Ccompress&fit=max', 'https://img-2.outlookindia.com/outlookindia/2024-02/64aa57c6-bb41-4c59-8b28-7596d8f77839/linkedin_share.svg', 'https://mediaassets.outlookindia.com/outlookindia/2024-07/ffa0d395-95a9-40d3-b716-3317e36e83e3/WhatsApp_Image_2024_07_09_at_11_16_10_AM.jpeg?auto=format%2Ccompress&format=webp&w=50&dpr=1.0', 'https://media.assettype.com/outlookindia/2026-02-14/6e2hpbnu/AP26045780566494.jpg?w=200&auto=format%2Ccompress&fit=max', 'https://img-2.outlookindia.com/outlookindia/2024-05/46bafa8f-966a-4102-befc-3e8a5e84da76/new_follow_google_news.png', 'https://media.assettype.com/outlookindia/2026-02-14/l9rvkui9/UGC-Thumbnail.png?w=200&auto=format%2Ccompress&fit=max', 'https://img-2.outlookindia.com/outlookindia/2024-02/5f44985f-65c6-468a-85fa-d49a17baa510/twitter_share.svg', 'https://media.assettype.com/outlookindia/2024-10-27/kulib1l3/radha-yadav-india-women-vs-new-zealand-women-2nd-odi?w=1200&ar=40%3A21&auto=format%2Ccompress&ogImage=true&mode=crop&enlarge=true&overlay=false&overlay_position=bottom&overlay_width=100', 'https://media.assettype.com/outlookindia/2024-10-27/kulib1l3/radha-yadav-india-women-vs-new-zealand-women-2nd-odi??w=1080&auto=format%2Ccompress&fit=max', 'https://media.assettype.com/outlookindia/2026-02-14/d0hbfsyp/WhatsApp-Image-2026-02-14-at-9.42.47-PM.jpeg?w=200&auto=format%2Ccompress&fit=max', 'https://media.assettype.com/outlookindia/2026-02-16/z35taxod/EnglandvsItaly120260216.jpg?w=200&auto=format%2Ccompress&fit=max', 'https://media.assettype.com/outlookindia/2026-02-16/e9airqza/WIvsSL1520260216.jpg?w=200&auto=format%2Ccompress&fit=max', 'https://media.assettype.com/outlookindia/2026-01-16/1ehqut2j/dhurandhar-vs-ikkis.png?w=200&auto=format%2Ccompress&fit=max', 'https://media.assettype.com/outlookindia/2026-02-16/g0nv74f3/Milan-Cortina-Winter-Olympics-Day-9-photo-highlights-1.jpg?w=200&auto=format%2Ccompress&fit=max', 'https://media.assettype.com/outlookindia/2026-02-15/had2pycq/WhatsApp-Image-2026-02-15-at-9.57.30-PM.jpeg?w=200&auto=format%2Ccompress&fit=max', 'https://sb.scorecardresearch.com/p?c1=2&c2=22214668&cv=3.9.1&cj=1', 'https://img-2.outlookindia.com/outlookindia/2024-01/5d397126-4ebc-462d-bb27-d81559ae4a40/Outlook_Placeholder_image.png', 'https://img-2.outlookindia.com/outlookindia/2024-02/ee9a4c3f-5841-497f-8ac2-ab0d4689dd02/3.png', 'https://media.assettype.com/outlookindia/2026-02-14/r1nhyqdd/AP26045693844250.jpg?w=200&auto=format%2Ccompress&fit=max', 'https://img-2.outlookindia.com/outlookindia/2024-02/7cb9b5c4-e134-41f8-b5f3-7cc5634a4e19/facebook_share.svg', 'https://img-2.outlookindia.com/outlookindia/2024-02/80df6341-8c8b-49a0-94cb-ca9687bd2a18/2.png'}","मिन्नू मणि फेर प्रहार करैत अछि, आ नेपाल गहींर परेशानी मे अछि। रोमा थापा न॑ ममता मदीवाला क॑ एक थ्रू निक करलकै आरू ओकरा ३ ऑफ ३ म॑ महज १ रन बनाबै के साथ वापसी करै ल॑ पड़ै छै ।राइट हैंडर्स कबिता जोशी दबाव म॑ आबी जाय छै, लेकिन मणि ओकरा बैक-टू-बैक डॉट स॑ टाइट रखै छै । भारत ए मजबूती स नियंत्रण मे अछि, एक इंच नहि द रहल अछि।"
Nepal players need to be put under pressure for performance: Coach Nick - Daily Pioneer,Nepal players need to be put under pressure for performance: Coach Nick  Daily Pioneer,2026-02-17 03:46:30,https://news.google.com/rss/articles/CBMiogFBVV95cUxOTXpocTVuUkVFWi1CbGtrTjRHb0tMQ1pHb3MzY2ZJMkQ4d25OclRUXzVteWoxRTBzMlFiaC0tYVdNYkQ2ZnlWR0t0U3A3UG1HWllmYkltLTZHVko0TEwtZmFMeTRJenhkbVZNZGdrS0RVR2l2a2IxWnFRWEE5S00xSUJ6RXA3cWVGUzN1WVRDZndTZ2dBQkpSdklyTjVuZnZUdHc?oc=5&hl=en-US&gl=US&ceid=US:en,https://dailypioneer.com,Daily Pioneer,"Nepal coach Nick Pothas believes the country’s players need to be put under more pressure going forward for tangible improvements and urged them to avoid repeating mistakes from the last two matches when they play their final T20 World Cup game against Scotland in Mumbai on Tuesday. Nepal made a sparkling start to their T20 World Cup campaign with a last-ball finish in a narrow loss to England, but their performances have nosedived since, losing heavily to Italy and the West Indies by 10 and nine wickets respectively.

“If we’re going to improve Nepal cricket, we need to have an infrastructure below. Teams only get better when there’s pressure on players to perform. I’m not sure what there exists in Nepal, but players need to feel like they’re under pressure to perform in order for your cricket to improve,” Pothas told reporters ahead of the Group C match. Pothas said there is lot of skill in the dressing room but the pace of learning is not as fast it should be.

“Unfortunately, what we aren’t doing is we’re not learning fast enough as a group. Leading into the Scotland game, all we want to see guys do is compete, but not make the same errors we’re making repeatedly. That’s the important part. “We’re a very energetic side, a very passionate side with a great following that have come to watch us play so we’d like to give that following something to remember this World Cup by,” Pothas added.

The former South African wicketkeeper-batter said exposure to conditions and situations outside their comfort zone has also affected Nepal’s performances. “We’re expecting the players to learn quicker, (but) now what makes that a little bit more difficult is exposure to various conditions and exposure to high-level cricket,” he said.

“For these players, a lot of their cricket is played in Nepal where the wickets suit their style of play and you can get away with not executing quite as much because of the standard of the cricket. When you come to a World Cup, you don’t get away with that kind of thing.” Pothas admitted Nepal will need a more robust structure in domestic cricket in order to make the national side stronger.

“That’s a conversation to be had with (Cricket Association of Nepal’s secretary) Paras (Khadka) as to how we structure the side,” he said. “One thing I will say is that I’ve been on three different assignments with Nepal and in every one of those assignments, we’ve had two managers in the change room and they’ve been different managers.”","{'https://dailypioneer.com/uploads/2026/story/images/medium/R300_will-make-nation-proud--super-8s-or-not--rashid-2026-02-17.jpg', 'https://dailypioneer.com/uploads/2026/story/images/medium/R300_delhi-plans-single-transport-authority-2026-02-07.jpg', 'https://dailypioneer.com/uploads/2026/story/images/medium/R300_australia-add-steve-smith-as-replacement-of-josh-hazlewood-2026-02-17.jpg', 'https://dailypioneer.com/uploads/2026/story/images/medium/R300_sheikh-hasina-condemns-upcoming-bangladesh-elections--calls-interim-government-illegitimate-2026-02-12.jpg', 'https://dailypioneer.com/uploads/2026/story/images/medium/R300_no-authorised-copies-exist--naravane-endorses-publisher-2026-02-11.jpg', 'https://dailypioneer.com/uploads/2026/story/images/medium/R300_loss-against-sa-won-t-have-any-bearing--glenn-phillips-2026-02-17.jpg', 'https://dailypioneer.com/uploads/2026/story/images/medium/R300_omarzai---s-all-round-heroics-seal-win-for-afghanistan-over-uae-2026-02-17.jpg', 'https://dailypioneer.com/uploads/2026/story/images/medium/R300_babar-faces-heat--livid-ex-pak-players-demand-his-axing-after-india-debacle-2026-02-17.jpg', 'https://dailypioneer.com/uploads/2026/story/images/medium/R300_bangladesh-india-ties-to-rest-on-respect--rahman-2026-02-15.jpg', 'https://dailypioneer.com/logo.png', 'https://dailypioneer.com/uploads/2026/story/images/medium/R300_nz-eye-super-8-berth--end-to-powerplay-woes-2026-02-17.jpg', 'https://dailypioneer.com/uploads/2026/story/images/medium/R300_zimbabwe-look-to-beat-ireland-with-maiden-super-8s-berth-in-sight-2026-02-17.jpg', 'https://dailypioneer.com/uploads/2026/story/images/medium/R300_uae-eye-middle-order-fix-against-wounded-afghanistan-2026-02-16.jpg', 'https://dailypioneer.com/uploads/2026/story/images/medium/R300_i-am-just-trying-to-be-little-bit-more-unpredictable--says-jason-holder-2026-02-16.jpg', 'https://dailypioneer.com/uploads/2026/story/images/medium/R300_record-breaking-sooryavanshi-destroys-england-at-u-19-wc-2026-02-07.jpg', 'https://dailypioneer.com/uploads/2026/story/images/medium/R300_central-bank-holds-repo-rate-at-5-25--2026-02-07.jpg', 'https://dailypioneer.com/uploads/2026/story/images/medium/R300_scotland-eye-nepal-scalp-2026-02-17.jpg', 'https://dailypioneer.com/uploads/2026/story/images/big/nepal-players-need-to-be-put-under-pressure-for-performance--coach-nick-2026-02-17.jpg', 'https://dailypioneer.com/uploads/2026/story/images/medium/R300_fearless-kishan-took-the-game-away-from-us--says-pakistan-coach-hesson-2026-02-17.jpg', 'https://dailypioneer.com/uploads/2026/story/images/medium/R300_mental-resilience-visible-after-sa-heartbreak--afghanistan-coach-2026-02-17.jpg'}","नेपाल केरऽ कोच निक पोथास के मानना ​​छै कि मूर्त सुधार लेली आगू जाय क॑ देश केरऽ खिलाड़ी प॑ आरू दबाव डालै के जरूरत छै आरू मंगलवार क॑ मुंबई म॑ स्कॉटलैंड के खिलाफ अपनऽ आखिरी टी-२० विश्व कप मैच खेलला प॑ पिछला दू मैचऽ स॑ गलती दोहराबै स॑ बचै के आग्रह करलकै । नेपाल न॑ अपनऽ टी-२० विश्व कप अभियान केरऽ चमचमात शुरुआत करलकै आरू इंग्लैंड स॑ संकीर्ण हार म॑ आखिरी गेंद प॑ खतम होय गेलै, लेकिन ओकरा बाद स॑ ओकरऽ प्रदर्शन नाक म॑ डुबकी लगाय क॑ इटली आरू वेस्टइंडीज स॑ क्रमशः १० आरू नौ विकेट स॑ भारी हारलऽ छै ।

पोथास न॑ ग्रुप सी केरऽ मैच स॑ पहल॑ पत्रकारऽ स॑ कहलकै कि अगर हम्में नेपाल क्रिकेट क॑ बेहतर बनाबै के छै त॑ हमरा सब क॑ नीचें एगो बुनियादी ढाँचा के जरूरत छै ।टीम तखनी बेहतर होय छै जब॑ खिलाड़ी प॑ प्रदर्शन करै के दबाव होय छै ।हमरा यकीन नै छै कि नेपाल म॑ की छै, लेकिन खिलाड़ी क॑ ऐसनऽ महसूस करै के जरूरत छै कि ओकरा प॑ प्रदर्शन करै के दबाव छै ताकि आपने के क्रिकेट म॑ सुधार होय सक॑ । पोथास कहलनि जे, ड्रेसिंग रूम मे बहुत स्किल अछि मुदा सीखबाक गति ओतेक तेज नहि अछि जे हेबाक चाही।

“दुर्भाग्यवश, हम जे नै करी रहलऽ छियै, वू ई छै कि हम्में एगो समूह के रूप म॑ पर्याप्त तेजी स॑ नै सीखी रहलऽ छियै । स्कॉटलैंड केरऽ खेल म॑ अग्रणी होय क॑ हम्में बस लड़का सिनी क॑ प्रतिस्पर्धा करतें देखना चाहै छियै, लेकिन वू गलती नै करै छै जेकरा हम्में बार-बार करी रहलऽ छियै । यही महत्वपूर्ण हिस्सा छै कप बाइ।'' पोथास आगू कहलनि।

दक्षिण अफ्रीका केरऽ पूर्व विकेटकीपर बल्लेबाज न॑ कहलकै कि अपनऽ आराम क्षेत्र स॑ बाहर के परिस्थिति आरू परिस्थिति के संपर्क म॑ ऐला स॑ नेपाल केरऽ प्रदर्शन प॑ भी असर पड़लऽ छै । हुनी कहलकै, “हमरा सब क उम्मीद छै कि खिलाड़ी जल्दी सीखतै, (लेकिन) अब॑ जेकरा स॑ ई बात कनी मुश्किल होय जाय छै, वू छै विभिन्न परिस्थिति के सामना करना आरू उच्च स्तरीय क्रिकेट के संपर्क म॑ ऐना ।

“ई खिलाड़ी सब लेल हुनकर बहुत रास क्रिकेट नेपाल मे खेलल जाइत अछि जतय विकेट हुनकर खेल के शैली के अनुकूल होइत अछि आ क्रिकेट के स्तर के कारण ओतेक निष्पादन नहि करबा स’ अहाँ बचि सकैत छी. जखन अहाँ कोनो विश्व कप मे अबैत छी त’ अहाँ ओहि तरहक बात स’ नहि बचि सकैत छी.” पोथास स्वीकार केलकै कि नेपाल क॑ राष्ट्रीय टीम क॑ मजबूत करै लेली घरेलू क्रिकेट म॑ आरू मजबूत संरचना के जरूरत पड़तै ।

ओ कहलनि जे, ई (क्रिकेट एसोसिएशन ऑफ नेपाल के सचिव) पारस (खडका) सं बातचीत करय के अछि जे हम सब पक्ष के कोना संरचित करैत छी। “एकटा बात हम कहब जे नेपालक संग तीन अलग-अलग असाइनमेंट पर रहलहुँ अछि आ ओहि मे सँ प्रत्येक असाइनमेंट मे हमरा सभक चेंज रूम मे दू टा मैनेजर रहल अछि आ ओ सब अलग-अलग मैनेजर रहल अछि।”"
