title,description,published date,url,publisher.href,publisher.title,full_article,images,translated
Nepali PM's Brief House Return Sparks Controversy - Devdiscourse,Nepali PM's Brief House Return Sparks Controversy  Devdiscourse,2026-07-14 15:54:13,https://news.google.com/rss/articles/CBMiqwFBVV95cUxOQy1uWjhNRGhoeF9FaktwQktVMklMbGRYVVVnQWVXZUZiTUZKaWhDUVJCbktSYmFiXzk3cnpxT2piSk5oNUtOLUZSUHE0SnpVVXRCcmZIVjFKM3NFcWxacEVuZVJHTlVXM1lSRGFVelluRDN6dEFkR3U2RXNvZTRPSjlVMkloZWVWNUJCbHM4cldnZ2hxMDd0elU3eENfaGRSOVZZR2NrOGFnZzTSAbABQVVfeXFMUGNwVlhMOV9ObHRFbXNLZml6aFprUVhPSWVOd2xidnFxa19aUGRLODdyN1oxRGVtTThJWjFteXFqWUVSTHlONWV0bl9hRUpiLU1jMkxSQlZ1RFZ6QkRiLW5XS0czZjRncTNyalRkdVFteWc0M2RCUFd3OU9QenVEd2RyTE81YmpnRllPdFJzWTh4SHpCd3I1cnN6aWtUUzNHUkRCWlFNcnZmYlZVWmVnMHk?oc=5&hl=en-US&gl=US&ceid=US:en,https://www.devdiscourse.com,Devdiscourse,"Nepali Prime Minister Balendra Shah's return to the House of Representatives, albeit for less than 20 minutes, has added fuel to the ongoing political discord. Arriving after a 43-day hiatus with Rastriya Swatantra Party Chairman Rabi Lamichhane, both leaders faced backlash from opposition members.

The entrance of Shah and Lamichhane during a speech by opposition lawmaker Khushbu Oli sparked a swift response, with Ain Bahadur Mahar, Chief Whip of the CPN-UML, highlighting a breach of the protocol that prohibits such interferences.

Critics have also targeted Shah's failure to address pressing national issues, notably the controversial border statement with India. Lawmakers demand answers, yet Shah's reluctance to engage deeply in parliamentary debate remains a point of discontent. (ANI)

(With inputs from agencies.)","{'https://www.devdiscourse.com/AdminFiles/Logo/devdiscourse_logo.svg', 'https://www.devdiscourse.com/img?imageUrl=https://devdiscourse.blob.core.windows.net/devnews/14_07_2026_21_24_07_6200464.jpg&width=920&format=jpeg', 'https://www.devdiscourse.com/AdminFiles/Ads/devdiscourse_app_300x300.jpg', 'https://www.devdiscourse.com/Content/transparent.png?width=80&height=80&format=jpg&mode=crop', 'https://www.devdiscourse.com/images/icons/menu-button.png', 'https://www.devdiscourse.com/images/icons/comment_bubble.svg', 'https://c.statcounter.com/12798725/0/2855a7d8/1/', 'https://devdiscourse.blob.core.windows.net/devnews/14_07_2026_21_24_07_6200464.jpg'}","नेपाली प्रधानमन्त्री बलेन्द्र शाहके २० मिनेटसँ कम समयमे रहितो प्रतिनिधिसभामे वापसीसँ चलि रहल राजनीतिक विवादमे ईंधन बढि गेल अछि । राष्ट्रीय स्वतंत्र पार्टी के अध्यक्ष रबी लामिछाने के संग 43 दिन के अंतराल के बाद पहुंचला पर दुनु नेता के विपक्षी सदस्य के प्रतिक्रिया के सामना करय पड़ल.

विपक्षी विधायक खुशबू ओली केरऽ भाषण के दौरान शाह आरू लामिछाने के प्रवेश स॑ तेजी स॑ प्रतिक्रिया मिललै, जेकरा म॑ नेकपा एमाले केरऽ मुख्य सचेतक ऐन बहादुर महर न॑ ऐसनऽ हस्तक्षेप प॑ रोक लगाबै वाला प्रोटोकॉल के उल्लंघन प॑ प्रकाश डाललकै ।

आलोचक न॑ शाह केरऽ जरुरी राष्ट्रीय मुद्दा, खास करी क॑ भारत के साथ विवादित सीमा बयान क॑ संबोधित करै म॑ विफलता प॑ भी निशाना बनैल॑ छै । विधायक सब जवाब के मांग करैत छथि, तइयो शाह के संसदीय बहस मे गहींरता सं जुड़य सं अनिच्छा असंतोष के बिंदु बनल अछि. (एएनआई) २.

(एजेंसियों के इनपुट के साथ।)"
Foreign Minister Khanal urges British government to swiftly address demands of Gurkha veterans - Nepalnews.com,Foreign Minister Khanal urges British government to swiftly address demands of Gurkha veterans  Nepalnews.com,2026-07-14 16:41:15,https://news.google.com/rss/articles/CBMi0wFBVV95cUxPODJjc2ZlMVRPVnNwMWJqV1Z1UFFMRkZtb3VQLUdaYWdYUTZsalBmTkxnNXpaUFZLZjlRYlAxT0dVT1VOdWg1bWpobXVNX1AtNEhjT0VVWF9pajFsM2VPanVKY2ZWdVlVOG92bW81a1lTVUt3TlVBVnVINkI2MzZMWFYtREtUN2NwbkFSN0lSVHJxQWxCUTdHTkJpS1V4WnY0ZFR2MGFtMXFoaTdXTUxkZTdDTml2b2RlM01kOG1CVXJxeWxqaEdPQWlUeGtkTkl1MDVN?oc=5&hl=en-US&gl=US&ceid=US:en,https://english.nepalnews.com,Nepalnews.com,,,
