title,description,published date,url,publisher.href,publisher.title,full_article,images,translated
"UN cultural agency decides against placing Lumbini, Buddha's birthplace in Nepal, on endangered list - The Associated Press","UN cultural agency decides against placing Lumbini, Buddha's birthplace in Nepal, on endangered list  The Associated Press",2024-07-25 11:43:00,https://news.google.com/rss/articles/CBMic2h0dHBzOi8vYXBuZXdzLmNvbS9hcnRpY2xlL3VuZXNjby1uZXBhbC1idWRkaGEtYmlydGhwbGFjZS1oZXJpdGFnZS1jdWx0dXJlLWx1bWJpbmktMWIyNzEzODU3ZGEwNjMxN2FlNmYwOWRlMWFiODMyYTDSAQA?oc=5&hl=en-US&gl=US&ceid=US:en,https://apnews.com,The Associated Press,,{'https://lh3.googleusercontent.com/J6_coFbogxhRI9iM864NL_liGXvsQp2AupsKei7z0cNNfDvGUmWUy20nuUhkREQyrpY4bEeIBuc=s0-w300'},
"Black Box Of Aircraft Crashed In Nepal Found, Handed Over To Probe Team - NDTV","Black Box Of Aircraft Crashed In Nepal Found, Handed Over To Probe Team  NDTV",2024-07-25 12:07:27,https://news.google.com/rss/articles/CBMibmh0dHBzOi8vd3d3Lm5kdHYuY29tL3dvcmxkLW5ld3MvYmxhY2stYm94LW9mLWFpcmNyYWZ0LWNyYXNoZWQtaW4tbmVwYWwtZm91bmQtaGFuZGVkLW92ZXItdG8tcHJvYmUtdGVhbS02MTg2NjEz0gF0aHR0cHM6Ly93d3cubmR0di5jb20vd29ybGQtbmV3cy9ibGFjay1ib3gtb2YtYWlyY3JhZnQtY3Jhc2hlZC1pbi1uZXBhbC1mb3VuZC1oYW5kZWQtb3Zlci10by1wcm9iZS10ZWFtLTYxODY2MTMvYW1wLzE?oc=5&hl=en-US&gl=US&ceid=US:en,https://www.ndtv.com,NDTV,,{'https://lh3.googleusercontent.com/J6_coFbogxhRI9iM864NL_liGXvsQp2AupsKei7z0cNNfDvGUmWUy20nuUhkREQyrpY4bEeIBuc=s0-w300'},
Who is Captain Manish Ratna Shakya? The sole survivor of Nepal plane crash - The Times of India,Who is Captain Manish Ratna Shakya? The sole survivor of Nepal plane crash  The Times of India,2024-07-25 12:57:00,https://news.google.com/rss/articles/CBMimAFodHRwczovL3RpbWVzb2ZpbmRpYS5pbmRpYXRpbWVzLmNvbS93b3JsZC9zb3V0aC1hc2lhL3doby1pcy1jYXB0YWluLW1hbmlzaC1yYXRuYS1zaGFreWEtdGhlLXNvbGUtc3Vydml2b3Itb2YtbmVwYWwtcGxhbmUtY3Jhc2gvYXJ0aWNsZXNob3cvMTEyMDE4NjUxLmNtc9IBnAFodHRwczovL3RpbWVzb2ZpbmRpYS5pbmRpYXRpbWVzLmNvbS93b3JsZC9zb3V0aC1hc2lhL3doby1pcy1jYXB0YWluLW1hbmlzaC1yYXRuYS1zaGFreWEtdGhlLXNvbGUtc3Vydml2b3Itb2YtbmVwYWwtcGxhbmUtY3Jhc2gvYW1wX2FydGljbGVzaG93LzExMjAxODY1MS5jbXM?oc=5&hl=en-US&gl=US&ceid=US:en,https://timesofindia.indiatimes.com,The Times of India,,{'https://lh3.googleusercontent.com/J6_coFbogxhRI9iM864NL_liGXvsQp2AupsKei7z0cNNfDvGUmWUy20nuUhkREQyrpY4bEeIBuc=s0-w300'},
Nepal plane crash pilot survived wreck that killed 18 after cockpit split from aircraft - New York Post,Nepal plane crash pilot survived wreck that killed 18 after cockpit split from aircraft  New York Post ,2024-07-25 14:13:00,https://news.google.com/rss/articles/CBMidWh0dHBzOi8vbnlwb3N0LmNvbS8yMDI0LzA3LzI1L3dvcmxkLW5ld3MvbmVwYWwtcGxhbmUtY3Jhc2gtcGlsb3Qtd2FzLXNvbGUtc3Vydml2b3ItYWZ0ZXItY29ja3BpdC1zcGxpdC1mcm9tLWFpcmNyYWZ0L9IBAA?oc=5&hl=en-US&gl=US&ceid=US:en,https://nypost.com,New York Post,,{'https://lh3.googleusercontent.com/J6_coFbogxhRI9iM864NL_liGXvsQp2AupsKei7z0cNNfDvGUmWUy20nuUhkREQyrpY4bEeIBuc=s0-w300'},
The Overlooked Reason That Planes Crash So Often in Nepal - The New York Times,"The Overlooked Reason That Planes Crash So Often in Nepal  The New York TimesPlane crash at Nepal's Kathmandu airport kills 18; captain survives  Reuters.comPlane explosion in Nepal captured on shocking video leaves 18 dead, 1 survivor  Fox Business",2024-07-25 18:19:18,https://news.google.com/rss/articles/CBMiRGh0dHBzOi8vd3d3Lm55dGltZXMuY29tLzIwMjQvMDcvMjUvd29ybGQvYXNpYS9uZXBhbC1wbGFuZS1jcmFzaC5odG1s0gEA?oc=5&hl=en-US&gl=US&ceid=US:en,https://www.nytimes.com,The New York Times,,{'https://lh3.googleusercontent.com/J6_coFbogxhRI9iM864NL_liGXvsQp2AupsKei7z0cNNfDvGUmWUy20nuUhkREQyrpY4bEeIBuc=s0-w300'},
"Nepal has low air traffic but high fatalities, ranking 11th globally in aviation deaths. - The Hindu","Nepal has low air traffic but high fatalities, ranking 11th globally in aviation deaths.  The Hindu",2024-07-26 02:30:00,https://news.google.com/rss/articles/CBMiWmh0dHBzOi8vd3d3LnRoZWhpbmR1LmNvbS9kYXRhL25lcGFscy10cmVhY2hlcm91cy1za2llcy1hbmQtYWlyLWNyYXNoZXMvYXJ0aWNsZTY4NDQ2Mzc2LmVjZdIBX2h0dHBzOi8vd3d3LnRoZWhpbmR1LmNvbS9kYXRhL25lcGFscy10cmVhY2hlcm91cy1za2llcy1hbmQtYWlyLWNyYXNoZXMvYXJ0aWNsZTY4NDQ2Mzc2LmVjZS9hbXAv?oc=5&hl=en-US&gl=US&ceid=US:en,https://www.thehindu.com,The Hindu,,{'https://lh3.googleusercontent.com/J6_coFbogxhRI9iM864NL_liGXvsQp2AupsKei7z0cNNfDvGUmWUy20nuUhkREQyrpY4bEeIBuc=s0-w300'},
New footage reveals moment of deadly Nepal plane crash - India Today - India Today,New footage reveals moment of deadly Nepal plane crash - India Today  India Today,2024-07-26 08:16:49,https://news.google.com/rss/articles/CBMiWmh0dHBzOi8vd3d3LmluZGlhdG9kYXkuaW4vd29ybGQvdmlkZW8vbmVwYWwtcGxhbmUtY3Jhc2gtc2F1cnlhLWFpcmxpbmVzLTI1NzIxNjktMjAyNC0wNy0yNtIBXmh0dHBzOi8vd3d3LmluZGlhdG9kYXkuaW4vYW1wL3dvcmxkL3ZpZGVvL25lcGFsLXBsYW5lLWNyYXNoLXNhdXJ5YS1haXJsaW5lcy0yNTcyMTY5LTIwMjQtMDctMjY?oc=5&hl=en-US&gl=US&ceid=US:en,https://www.indiatoday.in,India Today,,{'https://lh3.googleusercontent.com/J6_coFbogxhRI9iM864NL_liGXvsQp2AupsKei7z0cNNfDvGUmWUy20nuUhkREQyrpY4bEeIBuc=s0-w300'},
28 bonded Nepali labourers rescued from India: Nepal govt - The Indian Express,28 bonded Nepali labourers rescued from India: Nepal govt  The Indian Express,2024-07-26 15:04:43,https://news.google.com/rss/articles/CBMiaWh0dHBzOi8vaW5kaWFuZXhwcmVzcy5jb20vYXJ0aWNsZS93b3JsZC8yOC1ib25kZWQtbmVwYWxpLWxhYm91cmVycy1yZXNjdWVkLWZyb20taW5kaWEtbmVwYWwtZ292dC05NDc3NzkzL9IBbmh0dHBzOi8vaW5kaWFuZXhwcmVzcy5jb20vYXJ0aWNsZS93b3JsZC8yOC1ib25kZWQtbmVwYWxpLWxhYm91cmVycy1yZXNjdWVkLWZyb20taW5kaWEtbmVwYWwtZ292dC05NDc3NzkzL2xpdGUv?oc=5&hl=en-US&gl=US&ceid=US:en,https://indianexpress.com,The Indian Express,,{'https://lh3.googleusercontent.com/J6_coFbogxhRI9iM864NL_liGXvsQp2AupsKei7z0cNNfDvGUmWUy20nuUhkREQyrpY4bEeIBuc=s0-w300'},
Latest news: Crescent adds in PHX; new Houston Bunkhouse; Hilton debuts in Nepal - Hotel Investment Today,Latest news: Crescent adds in PHX; new Houston Bunkhouse; Hilton debuts in Nepal  Hotel Investment Today,2024-07-26 15:06:34,https://news.google.com/rss/articles/CBMihgFodHRwczovL3d3dy5ob3RlbGludmVzdG1lbnR0b2RheS5jb20vRGVhbHMvTWFuYWdlbWVudC9MYXRlc3QtbmV3cy1DcmVzY2VudC1hZGRzLWluLVBIWC1uZXctQnVua2hvdXNlLWluLUhvdXN0b24tSGlsdG9uLWRlYnV0cy1pbi1OZXBhbNIBAA?oc=5&hl=en-US&gl=US&ceid=US:en,https://www.hotelinvestmenttoday.com,Hotel Investment Today,,{'https://lh3.googleusercontent.com/J6_coFbogxhRI9iM864NL_liGXvsQp2AupsKei7z0cNNfDvGUmWUy20nuUhkREQyrpY4bEeIBuc=s0-w300'},
Nepal plane crash: Kin of five victims receive bodies - The Indian Express,Nepal plane crash: Kin of five victims receive bodies  The Indian Express,2024-07-26 15:20:00,https://news.google.com/rss/articles/CBMiZWh0dHBzOi8vaW5kaWFuZXhwcmVzcy5jb20vYXJ0aWNsZS93b3JsZC9uZXBhbC1wbGFuZS1jcmFzaC1raW4tb2YtZml2ZS12aWN0aW1zLXJlY2VpdmUtYm9kaWVzLTk0Nzc4Mjcv0gFqaHR0cHM6Ly9pbmRpYW5leHByZXNzLmNvbS9hcnRpY2xlL3dvcmxkL25lcGFsLXBsYW5lLWNyYXNoLWtpbi1vZi1maXZlLXZpY3RpbXMtcmVjZWl2ZS1ib2RpZXMtOTQ3NzgyNy9saXRlLw?oc=5&hl=en-US&gl=US&ceid=US:en,https://indianexpress.com,The Indian Express,,{'https://lh3.googleusercontent.com/J6_coFbogxhRI9iM864NL_liGXvsQp2AupsKei7z0cNNfDvGUmWUy20nuUhkREQyrpY4bEeIBuc=s0-w300'},
Nearly 30 Nepalese men rescued from forced labor in India: Nepal government - WION,Nearly 30 Nepalese men rescued from forced labor in India: Nepal government  WION,2024-07-26 18:56:50,https://news.google.com/rss/articles/CBMiZ2h0dHBzOi8vd3d3Lndpb25ld3MuY29tL2luZGlhLW5ld3MvMjgtbmVwYWxlc2UtbWVuLXJlc2N1ZWQtZnJvbS1mb3JjZWQtbGFib3ItaW4taW5kaWEtbmVwYWwtZ292dC03NDQ1MDbSAWtodHRwczovL3d3dy53aW9uZXdzLmNvbS9pbmRpYS1uZXdzLzI4LW5lcGFsZXNlLW1lbi1yZXNjdWVkLWZyb20tZm9yY2VkLWxhYm9yLWluLWluZGlhLW5lcGFsLWdvdnQtNzQ0NTA2L2FtcA?oc=5&hl=en-US&gl=US&ceid=US:en,https://www.wionews.com,WION,,{'https://lh3.googleusercontent.com/J6_coFbogxhRI9iM864NL_liGXvsQp2AupsKei7z0cNNfDvGUmWUy20nuUhkREQyrpY4bEeIBuc=s0-w300'},
"Rebuild Nepal completes another educational mission trip | The Hawk Eye - Burlington, Iowa - Mississippi Valley Publishing","Rebuild Nepal completes another educational mission trip | The Hawk Eye - Burlington, Iowa  Mississippi Valley Publishing",2024-07-27 05:30:00,https://news.google.com/rss/articles/CBMiowFodHRwczovL3d3dy5taXNzaXNzaXBwaXZhbGxleXB1Ymxpc2hpbmcuY29tL3RoZV9oYXdrX2V5ZS9yZWJ1aWxkLW5lcGFsLWNvbXBsZXRlcy1hbm90aGVyLWVkdWNhdGlvbmFsLW1pc3Npb24tdHJpcC9hcnRpY2xlX2NiOWRmYWYyLTQ3N2YtMTFlZi1hMDBlLTg3YzMyNWU1NWYyMC5odG1s0gEA?oc=5&hl=en-US&gl=US&ceid=US:en,https://www.mississippivalleypublishing.com,Mississippi Valley Publishing,,{'https://lh3.googleusercontent.com/J6_coFbogxhRI9iM864NL_liGXvsQp2AupsKei7z0cNNfDvGUmWUy20nuUhkREQyrpY4bEeIBuc=s0-w300'},
Hilton expands presence with new flagship property in Nepal - BW Hotelier,Hilton expands presence with new flagship property in Nepal  BW Hotelier,2024-07-27 06:38:05,https://news.google.com/rss/articles/CBMiYWh0dHBzOi8vYndob3RlbGllci5jb20vYXJ0aWNsZS9oaWx0b24tZXhwYW5kcy1wcmVzZW5jZS13aXRoLW5ldy1mbGFnc2hpcC1wcm9wZXJ0eS1pbi1uZXBhbC01Mjc0MzXSAQA?oc=5&hl=en-US&gl=US&ceid=US:en,https://bwhotelier.com,BW Hotelier,,{'https://lh3.googleusercontent.com/J6_coFbogxhRI9iM864NL_liGXvsQp2AupsKei7z0cNNfDvGUmWUy20nuUhkREQyrpY4bEeIBuc=s0-w300'},
Badminton: 'King' Viktor Axelsen of Denmark lords over Nepal's Prince Dahal to open Paris 2024 campaign - Olympics,Badminton: 'King' Viktor Axelsen of Denmark lords over Nepal's Prince Dahal to open Paris 2024 campaign  Olympics,2024-07-27 20:45:00,https://news.google.com/rss/articles/CBMiRWh0dHBzOi8vb2x5bXBpY3MuY29tL2VuL25ld3MvYmFkbWludG9uLXBhcmlzLTIwMjQtb2x5bXBpY3Mtd3JhcC1kYXktMdIBAA?oc=5&hl=en-US&gl=US&ceid=US:en,https://olympics.com,Olympics,,{'https://lh3.googleusercontent.com/J6_coFbogxhRI9iM864NL_liGXvsQp2AupsKei7z0cNNfDvGUmWUy20nuUhkREQyrpY4bEeIBuc=s0-w300'},
"Top events today: PM Modi’s ‘Mann Ki Baat’; Nepal to sign tripartite power trading deal, and more | Today News - Mint","Top events today: PM Modi’s ‘Mann Ki Baat’; Nepal to sign tripartite power trading deal, and more | Today News  Mint",2024-07-28 01:14:20,https://news.google.com/rss/articles/CBMinQFodHRwczovL3d3dy5saXZlbWludC5jb20vbmV3cy9pbmRpYS90b3AtZXZlbnRzLXRvZGF5LWp1bHktMjgtcG0tbW9kaS1tYW5uLWtpLWJhYXQtbmVwYWwtdHJpcGFydGl0ZS1wb3dlci10cmFkaW5nLWRlYWwtYmFuZ2xhZGVzaC1jb25ncmVzcy0xMTcyMjEyODQxMzU3My5odG1s0gGhAWh0dHBzOi8vd3d3LmxpdmVtaW50LmNvbS9uZXdzL2luZGlhL3RvcC1ldmVudHMtdG9kYXktanVseS0yOC1wbS1tb2RpLW1hbm4ta2ktYmFhdC1uZXBhbC10cmlwYXJ0aXRlLXBvd2VyLXRyYWRpbmctZGVhbC1iYW5nbGFkZXNoLWNvbmdyZXNzL2FtcC0xMTcyMjEyODQxMzU3My5odG1s?oc=5&hl=en-US&gl=US&ceid=US:en,https://www.livemint.com,Mint,,{'https://lh3.googleusercontent.com/J6_coFbogxhRI9iM864NL_liGXvsQp2AupsKei7z0cNNfDvGUmWUy20nuUhkREQyrpY4bEeIBuc=s0-w300'},
The ugly Indian in Nepal - The Week,The ugly Indian in Nepal  The Week,2024-07-28 02:49:00,https://news.google.com/rss/articles/CBMiWmh0dHBzOi8vd3d3LnRoZXdlZWsuaW4vY29sdW1ucy9NYW5pLVNoYW5rYXItQWl5YXIvMjAyNC8wNy8yNy90aGUtdWdseS1pbmRpYW4taW4tbmVwYWwuaHRtbNIBXmh0dHBzOi8vd3d3LnRoZXdlZWsuaW4vY29sdW1ucy9NYW5pLVNoYW5rYXItQWl5YXIvMjAyNC8wNy8yNy90aGUtdWdseS1pbmRpYW4taW4tbmVwYWwuYW1wLmh0bWw?oc=5&hl=en-US&gl=US&ceid=US:en,https://www.theweek.in,The Week,,{'https://lh3.googleusercontent.com/J6_coFbogxhRI9iM864NL_liGXvsQp2AupsKei7z0cNNfDvGUmWUy20nuUhkREQyrpY4bEeIBuc=s0-w300'},
India’s decision to reduce import duty on gold likely to increase gold smuggling into Nepal - Myrepublica,India’s decision to reduce import duty on gold likely to increase gold smuggling into Nepal  Myrepublica,2024-07-28 03:11:15,https://news.google.com/rss/articles/CBMinAFodHRwczovL215cmVwdWJsaWNhLm5hZ2FyaWtuZXR3b3JrLmNvbS9uZXdzL2luZGlhbi1nb3Z0LXJlZHVjaW5nLWltcG9ydC1kdXR5LW9uLWdvbGQtd2lkZW5zLXRoZS1wcmljZS1nYXAtc3VzcGVjdGVkLXRvLXRyaWdnZXItbW9yZS1nb2xkLXNtdWdnbGluZy10by1uZXBhbC_SAZoBaHR0cDovL215cmVwdWJsaWNhLm5hZ2FyaWtuZXR3b3JrLmNvbS9hbXAvaW5kaWFuLWdvdnQtcmVkdWNpbmctaW1wb3J0LWR1dHktb24tZ29sZC13aWRlbnMtdGhlLXByaWNlLWdhcC1zdXNwZWN0ZWQtdG8tdHJpZ2dlci1tb3JlLWdvbGQtc211Z2dsaW5nLXRvLW5lcGFsLw?oc=5&hl=en-US&gl=US&ceid=US:en,https://myrepublica.nagariknetwork.com,Myrepublica,,{'https://lh3.googleusercontent.com/J6_coFbogxhRI9iM864NL_liGXvsQp2AupsKei7z0cNNfDvGUmWUy20nuUhkREQyrpY4bEeIBuc=s0-w300'},
"In Nepal, When Yaks Go, so Does Culture - The Good Men Project","In Nepal, When Yaks Go, so Does Culture  The Good Men Project",2024-07-28 03:45:57,https://news.google.com/rss/articles/CBMiUmh0dHBzOi8vZ29vZG1lbnByb2plY3QuY29tL2ZlYXR1cmVkLWNvbnRlbnQvaW4tbmVwYWwtd2hlbi15YWtzLWdvLXNvLWRvZXMtY3VsdHVyZS_SAQA?oc=5&hl=en-US&gl=US&ceid=US:en,https://goodmenproject.com,The Good Men Project,,{'https://lh3.googleusercontent.com/J6_coFbogxhRI9iM864NL_liGXvsQp2AupsKei7z0cNNfDvGUmWUy20nuUhkREQyrpY4bEeIBuc=s0-w300'},
Indian team that arrived in Nepal to help trace missing buses in Trishuli River returning home today - Myrepublica,Indian team that arrived in Nepal to help trace missing buses in Trishuli River returning home today  Myrepublica,2024-07-28 04:45:35,https://news.google.com/rss/articles/CBMimAFodHRwczovL215cmVwdWJsaWNhLm5hZ2FyaWtuZXR3b3JrLmNvbS9uZXdzL2luZGlhbi10ZWFtLXRoYXQtY2FtZS1mb3Itc2VhcmNoLWVmZm9ydHMtZm9yLW1pc3NpbmctYnVzc2VzLWFuZC1wYXNzZW5nZXJzLWluLXRyaXNodWxpLXRvLXJldHVybi1ob21lLXRvZGF5L9IBlgFodHRwOi8vbXlyZXB1YmxpY2EubmFnYXJpa25ldHdvcmsuY29tL2FtcC9pbmRpYW4tdGVhbS10aGF0LWNhbWUtZm9yLXNlYXJjaC1lZmZvcnRzLWZvci1taXNzaW5nLWJ1c3Nlcy1hbmQtcGFzc2VuZ2Vycy1pbi10cmlzaHVsaS10by1yZXR1cm4taG9tZS10b2RheS8?oc=5&hl=en-US&gl=US&ceid=US:en,https://myrepublica.nagariknetwork.com,Myrepublica,,{'https://lh3.googleusercontent.com/J6_coFbogxhRI9iM864NL_liGXvsQp2AupsKei7z0cNNfDvGUmWUy20nuUhkREQyrpY4bEeIBuc=s0-w300'},
Nepali ambassador optimistic about increasing cooperation with China - CGTN,Nepali ambassador optimistic about increasing cooperation with China  CGTN,2024-07-28 05:49:00,https://news.google.com/rss/articles/CBMifWh0dHBzOi8vbmV3cy5jZ3RuLmNvbS9uZXdzLzIwMjQtMDctMjgvTmVwYWxpLWFtYmFzc2Fkb3Itb3B0aW1pc3RpYy1hYm91dC1pbmNyZWFzaW5nLWNvb3BlcmF0aW9uLXdpdGgtQ2hpbmEtMXZCbnF4blJpcDIvcC5odG1s0gEA?oc=5&hl=en-US&gl=US&ceid=US:en,https://news.cgtn.com,CGTN,,{'https://lh3.googleusercontent.com/J6_coFbogxhRI9iM864NL_liGXvsQp2AupsKei7z0cNNfDvGUmWUy20nuUhkREQyrpY4bEeIBuc=s0-w300'},
