title,description,published date,url,publisher.href,publisher.title,full_article,images,translated
Border issue with India to be resolved through political consensus: Nepal FM - Millennium Post,Border issue with India to be resolved through political consensus: Nepal FM  Millennium Post,2024-01-29 18:56:47,https://news.google.com/rss/articles/CBMid2h0dHBzOi8vd3d3Lm1pbGxlbm5pdW1wb3N0LmluL25hdGlvbi9ib3JkZXItaXNzdWUtd2l0aC1pbmRpYS10by1iZS1yZXNvbHZlZC10aHJvdWdoLXBvbGl0aWNhbC1jb25zZW5zdXMtbmVwYWwtZm0tNTUwMDQw0gF7aHR0cHM6Ly93d3cubWlsbGVubml1bXBvc3QuaW4vYW1wL25hdGlvbi9ib3JkZXItaXNzdWUtd2l0aC1pbmRpYS10by1iZS1yZXNvbHZlZC10aHJvdWdoLXBvbGl0aWNhbC1jb25zZW5zdXMtbmVwYWwtZm0tNTUwMDQw?oc=5&hl=en-US&gl=US&ceid=US:en,https://www.millenniumpost.in,Millennium Post,"KATHMANDU: Foreign Minister N P Saud on Monday said that the border issue between Nepal and India should be resolved on the basis of political consensus.

The technical mechanisms created to resolve the border problem should find a solution acceptable to both the countries after completing necessary technical works, Saud said while speaking at a programme organised on the occasion of India’s 75th Republic Day here.

“We also have a joint technical committee in this regard. That mechanism should be activated after which the leadership of both countries should resolve this problem diplomatically based on the facts. We are already working towards that direction,” the minister said at the programme organised by the Nepal-India Human Development and Friendship Association.

Foreign Minister Saud said that during the recent visit of India’s External Affairs Minister S Jaishankar to Nepal, the representatives of both countries had reached an understanding to resolve the border issue through dialogue and discussions.

Earlier on Saturday, Saud, while attending another Republic Day-related event, had said the border dispute between Nepal and India can be sorted out in a “cordial manner through dialogue” instead of making it “a big political issue” between the two countries which share history and geography and are bound together by a common culture.

“Susta and Kalapani-Lipulekh are the only two border points, which need to be resolved,” he said then.

Nepal is considered an important country for New Delhi as it shares a border of over 1,850 km with five Indian states Sikkim, West Bengal, Bihar, Uttar Pradesh and

Uttarakhand.","{'https://news.google.com/images/mail_icon.png', 'https://news.google.com/images/logo.png?v=2', 'https://news.google.com/images/search.png', 'https://news.google.com/images/home_white_bg.png', 'https://news.google.com/images/social/facebook_icon.png', 'https://news.google.com/images/sidekick-open.png', 'https://news.google.com/images/social/twitter_icon.png?v=2', 'https://news.google.com/images/whatsapp.png', 'https://news.google.com/images/social/telegram_icon.png', 'https://news.google.com/images/home.png', 'https://news.google.com/images/authorplaceholder.jpg', 'https://news.google.com/images/social/print_icon.png', 'https://news.google.com/images/share_icon.png', 'https://www.millenniumpost.in/images/logo.png', 'https://news.google.com/images/social/linkedin_icon.png'}","काठमांडू : विदेश मंत्री एनपी सौद सोमदिन कहलनि जे, नेपाल आ भारतक बीच सीमाक मुद्दा के राजनीतिक सहमति के आधार पर हल करबाक चाही।सीमा समस्या के समाधान लेली बनलऽ तकनीकी तंत्र क॑ आवश्यक तकनीकी कार्य पूरा करला के बाद दोनों देशऽ क॑ स्वीकार्य खोजना चाहियऽ, सौद न॑ कहलकै कि भारत केरऽ 75वां गणतंत्र दिवस के अवसर प॑ आयोजित एगो कार्यक्रम म॑ बोलतें हुअ॑ ।ओ कहला जे एहि मामला मे हमरा सब लग संयुक्त तकनीकी समिति सेहो अछि।ओ तंत्र सक्रिय करबाक चाही जकर बाद दुनू देशक नेतृत्व केँ तथ्यक आधार पर कूटनीतिक रूप सँ एहि समस्याक समाधान करबाक चाही ।हम सब पहिने स ओहि दिशा क दिशा मे काज क रहल छी।Ó मंत्री नेपाल-भारत मानव विकास आ दोस्ती एसोसिएशन द्वारा आयोजित कार्यक्रम मे कहला।विदेश मंत्री सौद न॑ कहलकै कि हाल म॑ भारत केरऽ विदेश मंत्री एस जयशंकर केरऽ नेपाल केरऽ दौरा के दौरान दोनों देशऽ के प्रतिनिधि सिनी न॑ संवाद आरू चर्चा के माध्यम स॑ सीमा के मुद्दा के समाधान लेली समझ म॑ ऐलऽ छै ।एहि सं पहिने साउद गणतंत्रक दिन सं संबंधित एकटा आओर आयोजन मे भाग लैत काल कहलक छल जे नेपाल आ भारतक बीच सीमा विवाद कें “गति-विषय के माध्यम सं कॉर्डियल तरीका” सं सॉर्ट आउट कएल जा सकैत अछि, एकर बदला मे एकरा “बड़का राजनीतिक मुद्दा” बनेबाक बदला जे इतिहास आ भूगोल के साझा करैत अछि आ एकटा साझा संस्कृति द्वारा एक संग बान्हल जाइत अछि |तखन ओ कहलनि जे, सस्ता आ कलापानी-पुलेख मात्र दू टा सीमावर्ती बिंदु अछि, जकर समाधान करबाक आवश्यकता अछि।नेपाल क॑ नई दिल्ली लेली एगो महत्वपूर्ण देश मानलऽ जाय छै, कैन्हेंकि ई १,८५० किलोमीटर स॑ अधिक के सीमा साझा करै छै आरू पांच भारतीय राज्य सिक्किम, पश्चिम बंगाल, बिहार, उत्तर प्रदेश आरू उत्तराखंड के साथ छै ।"
Pastor in Nepal Issues Urgent Plea as He Faces a Year in Jail For Sharing His Christian Faith: 'I Find Solace in God' - Faithwire,Pastor in Nepal Issues Urgent Plea as He Faces a Year in Jail For Sharing His Christian Faith: 'I Find Solace in God'  Faithwire,2024-01-29 19:20:13,https://news.google.com/rss/articles/CBMimAFodHRwczovL3d3dy5mYWl0aHdpcmUuY29tLzIwMjQvMDEvMjkvcGFzdG9yLWluLW5lcGFsLWlzc3Vlcy11cmdlbnQtcGxlYS1hcy1oZS1mYWNlcy1hLXllYXItaW4tamFpbC1mb3Itc2hhcmluZy1oaXMtY2hyaXN0aWFuLWZhaXRoLWktZmluZC1zb2xhY2UtaW4tZ29kL9IBAA?oc=5&hl=en-US&gl=US&ceid=US:en,https://www.faithwire.com,Faithwire,"A pastor in Nepal will potentially face jail time for praying after his country’s Supreme Court rejected his appeal.

Pastor Keshab Raj Acharya was sentenced to one year in prison over his religious activity and must now face that sentence unless the high court accepts his appeal to have the penalty converted into a fine.

Listen to them on the latest episode of “Quick Start” 

Despite Acharya’s plight — which is being seen as a step backward for religious liberty in Nepal — the preacher said he remains steadfast in his faith.

“While facing more jail time is distressing, I find solace in God, believing that anything is possible through Him,” Acharya said in a statement released by ADF International.

He also urged other countries to place pressure on Nepal to secure his release and defend basic human rights to religious freedom and expression.

“I urge the international community to engage with the Nepali government to safeguard religious freedom in order to pave the way for true religious freedom for everyone in Nepal,” Acharya continued. “I thank everyone for their continued support and prayers for me and my family.”

The pastor previously said the nearly three months he spent in jail before his sentencing was “very difficult” and that he often thought about his young kids and wife and would “cry out to the Lord in prayer.”

As CBN News previously reported, problems began for the pastor in March 2020, when a man purportedly called him to ask for prayer for his wife. The preacher invited the man to his home to perform the invocation, but cops reportedly arrived instead.

“Later, four police officers arrested him,” ADF International said in a statement. “He was released on 8 April 2020, only to be re-arrested a day later on charges of ‘outraging religious feelings’ and ‘proselytizing’ for distributing religious leaflets.”

There were also reports of a video uploaded to YouTube showing Acharya stating COVID-19 could be healed through prayer, though he denied uploading the clip.

Acharya was charged under Nepal’s penal code, which cracks down on sharing faith or attempts to convert others to Christianity. An anti-conversion law was put into place in 2018.

In 2021, he was sentenced to two years of prison and fined 20,000 Nepali rupees, with a subsequent court reducing the punishment to one year. Tragically, he was convicted based on one person’s claims, as corroboration was reportedly not given by others.

After Acharya was freed on bail, the Supreme Court declined to take up the case and essentially upheld the previous conviction. Now, Acharya hopes the prison sentence can be converted into a fine.

As the United States Commission on International Religious Freedom (USCIRF) states, Nepal’s 2007 constitution officially delineated the nation as a secular state, ending the centuries of Hindu monarchy rule. This brought some protections for religious minorities while also sparking some new struggles.

Hinduism is still favored, with the USCIRF noting that “Nepal’s National Penal (Code) Act criminalizes proselytism, blasphemy, and cow slaughter, disproportionally impacting the country’s Buddhist, Christian, and Muslim populations.” In particular, it is illegal to convert someone from one faith to another.

Nepal was ranked #48 on Open Doors’ World Watch List in 2022 and has since dropped out of the top 50 nations where Christian persecution is at its worst. In a 2023 explanation, Open Doors said its removal was due to a rise in persecution in other nations and not because “persecution has decreased there.”

Continue to pray for Acharya as he faces his ongoing legal battle.

***As the number of voices facing big-tech censorship continues to grow, please sign up for Faithwire’s daily newsletter and download the CBN News app, materialized by our parent company, to stay up-to-date with the latest news from a distinctly Christian perspective.***","{'https://www.faithwire.com/wp-content/uploads/2024/01/Screenshot-2024-01-29-at-2.08.35-PM-1024x686.jpg', 'https://www.faithwire.com/wp-content/themes/faithwire/build/img/FW_Mobile_Logo_2x.png', 'https://news.google.com/wp-content/themes/faithwire/build/img/logo-small.svg', 'https://www.faithwire.com/wp-content/themes/faithwire/build/img/fw_logo_full.png', 'https://images.squarespace-cdn.com/content/v1/584ab84e03596eedb2f04970/1528752870561-ZYWN0VZ8XZVZGQ43UKB0/image-asset.jpeg?format=1500w', 'https://www.facebook.com/tr?id=870635136374758&ev=PageView&noscript=1'}","नेपाल केरऽ एगो पादरी संभावित रूप स॑ अपनऽ देश केरऽ सुप्रीम कोर्ट न॑ हुनकऽ अपील क॑ खारिज करी देलकै, जेकरा बाद प्रार्थना करै के जेल के समय के सामना करना पड़तै ।पास्टर केशैब राज आचार्य क॑ हुनकऽ धार्मिक गतिविधि के चलतें एक साल के जेल के सजा सुनवाय देलऽ गेलै आरू ओकरा अब॑ वू सजा के सामना करना चाहियऽ जब॑ तलक उच्च न्यायालय न॑ अपनऽ अपील क॑ स्वीकार नै करी लै छै कि वू जुर्माना म॑ बदली जाय ।आचार्य के दुर्दशा के बावजूद “क्विक स्टार्ट” के नवीनतम एपिसोड पर हुनका सब के सुनु — जेकरा नेपाल में धार्मिक स्वतंत्रता के लेल एक डेग पाछू के रूप में देखल जा रहल अछि — प्रचारक कहलनि जे ओ अपन आस्था में अडिग रहैत छथि |एडीएफ इंटरनेशनल द्वारा जारी बयान मँ आचार्य नँ कहलकै, “जबकि जेल के समय के सामना करना पड़ै छै, वहीं हमरा भगवान के सांत्वना मिलै छै, ई मानतें हुअय कि हुनका माध्यम स॑ कुछ भी संभव छै ।हुनी अन्य देशऽ स॑ भी आग्रह करलकै कि वू नेपाल प॑ अपनऽ रिहाई क॑ सुरक्षित करी क॑ धार्मिक स्वतंत्रता आरू अभिव्यक्ति केरऽ मूलभूत मानव अधिकारऽ के रक्षा करै ।आचार्य न॑ आगू कहलकै, “हम॑ अंतरराष्ट्रीय समुदाय स॑ आग्रह करै छियै कि नेपाल म॑ सब के लेलऽ सच्चा धार्मिक स्वतंत्रता के रास्ता प्रशस्त करै लेली धार्मिक स्वतंत्रता के सुरक्षा लेली नेपाली सरकार स॑ जुड़ै ।“हम सब गोटे के धन्यवाद दैत छी जे हुनकर निरंतर सहयोग आ हमर परिवार के लेल प्रार्थना कयल जाय।”पादरी पहिने कहने छलाह जे हुनकर सजाय स पहिने जेल मे जे लगभग तीन मास बिताओल गेल छल ओ “बहुत कठिन” छल आ ओ अक्सर अपन छोट बच्चा आ पत्नी क बारे मे सोचैत छलाह आ “ प्रार्थना मे प्रभु स बाहर निकलताह।”जेना कि सीबीएन न्यूज न॑ पहल॑ खबर देल॑ छेलै, मार्च २०२० म॑ पादरी लेली समस्या शुरू होय गेलै, जब॑ एगो आदमी न॑ कथित तौर प॑ ओकरा अपनऽ पत्नी केरऽ प्रार्थना माँगै लेली बोलैलकै ।प्रचारक ओहि आदमी के अपन घर मे आह्वान करय लेल आमंत्रित केलक, मुदा एकर बदला मे पुलिसकर्मी पहुंचल छल.एडीएफ इंटरनेशनल एकटा बयान मे कहलनि जे, बाद मे चारिटा पुलिस अधिकारी हुनका गिरफ्तार केलक।“हुनका 8 अप्रैल 2020 क॑ रिहा करलऽ गेलै, केवल एक दिन बाद एक दिन बाद ‘धर्मी भावना क॑ अपमानजनक’ आरू धार्मिक पर्चा क॑ वितरित करै लेली ‘विशेषज्ञता’ के आरोप म॑ पुनः गिरफ्तार करलऽ गेलै।”यूट्यूब प॑ अपलोड करलऽ गेलऽ एगो वीडियो के बारे म॑ भी खबर छेलै कि आचार्य न॑ कहल॑ छै कि कोविड-१९ क॑ प्रार्थना के माध्यम स॑ ठीक करलऽ जाब॑ सकै छै, हालांकि हुनी क्लिप अपलोड करै स॑ इनकार करलकै ।आचार्य पर नेपाल केरऽ दंड संहिता के तहत आरोप लगैलऽ गेलऽ छेलै, जेकरा म॑ विश्वास साझा करै या दोसरऽ क॑ ईसाई धर्म म॑ बदलै के कोशिश प॑ दरार पड़ै छै ।2018 म॑ एगो रूपांतरण विरोधी कानून क॑ लागू करलऽ गेलै ।2021 म॑ हुनका दू साल के जेल के सजा सुनवाय देलऽ गेलै आरू 20,000 नेपाली रुपया के जुर्माना लगाय देलऽ गेलै, जेकरा बाद के कोर्ट म॑ सजा क॑ एक साल तलक कम करी देलऽ गेलै ।दुखद बात ई छै कि एक व्यक्ति के दावा के आधार पर हुनका दोषी ठहरालऽ गेलै, कैन्हेंकि कथित तौर प॑ आनऽ द्वारा पुष्टि नै देलऽ गेलऽ छेलै ।आचार्य के जमानत पर मुक्त भेला के बाद सुप्रीम कोर्ट एहि मामला के लेबय सं मना क देलक आ अनिवार्य रूप सं पहिने के सजा के सही ठहरौलक.आब आचार्य के उम्मीद अछि जे जेल के सजा के जुर्माना मे बदलल जा सकैत अछि.जेना कि संयुक्त राज्य अमेरिका केरऽ अंतर्राष्ट्रीय धार्मिक स्वतंत्रता आयोग (यूएससीआईआरएफ) न॑ कहल॑ छै कि नेपाल केरऽ २००७ केरऽ संविधान न॑ आधिकारिक तौर प॑ राष्ट्र क॑ धर्मनिरपेक्ष राज्य के रूप म॑ परिभाषित करलकै, जेकरा स॑ हिन्दू राजतंत्र शासन केरऽ सदियो स॑ समाप्त होय गेलै ।एहि सँ धार्मिक अल्पसंख्यक लेल किछु सुरक्षा भेटल आ संगहि किछु नव संघर्ष सेहो भड़का देलक ।हिन्दू धर्म केरऽ अखनी भी अनुकूल छै, जेकरा म॑ यूएससीआईआरएफ न॑ ई नोट करलकै कि “नेपाल केरऽ राष्ट्रीय दंड (कोड) अधिनियम धर्म परिवर्तन, निन्दा, आरू गाय वध क॑ अपराधी बनाबै छै, जेकरा स॑ देश केरऽ बौद्ध, ईसाई आरू मुस्लिम आबादी प॑ असमान रूप स॑ प्रभाव पड़ै छै।”विशेष रूप स ककरो एक आस्था स दोसर आस्था मे बदलब गैरकानूनी अछि।नेपाल क॑ २०२२ म॑ ओपन डोर्स केरऽ वर्ल्ड वॉच लिस्ट म॑ #४८ स्थान प॑ रहलऽ छै आरू ओकरा बाद स॑ शीर्ष ५० राष्ट्रऽ स॑ बाहर होय गेलऽ छै, जहां क्रिश्चियन केरऽ उत्पीड़न अपनऽ सबसें खराब स्थिति म॑ छै ।2023 केरऽ एगो स्पष्टीकरण म॑ खुला दरवाजा न॑ कहलकै कि एकरऽ हटाबै के कारण अन्य राष्ट्रऽ म॑ उत्पीड़न के बढ़ोत्तरी होय के कारण नै छै आरू नै कि “ओत॑ नियुक्ति म॑ कमी ​​आबी गेलऽ छै ।”आचार्य के लेलऽ प्रार्थना जारी रखै छै, कैन्हेंकि ओकरा अपनऽ जारी कानूनी लड़ाई के सामना करना पड़ै छै ।***जैना-जैना कि बिग-टेक सेंसरशिप के सामना करै वाला आवाज के संख्या बढ़तें जाय रहलऽ छै, कृपया फेथवायर केरऽ दैनिक न्यूजलेटर लेली साइन अप करी क॑ सीबीएन न्यूज ऐप डाउनलोड करी क॑ हमरऽ मूल कंपनी द्वारा मूर्त रूप लेन॑ वाला, एक स॑ ताजा खबरऽ स॑ अपडेट रहै लेली । स्पष्ट ईसाई परिप्रेक्ष्य।***"
