title,description,published date,url,publisher.href,publisher.title,full_article,images,translated
Reflecting on Two Decades of Democracy in Nepal - Ratopati,Reflecting on Two Decades of Democracy in Nepal  Ratopati,2026-04-24 06:03:00,https://news.google.com/rss/articles/CBMirAFBVV95cUxQR1lzTTNTdnZwY1pYMklUYjg5TVA2X0ZCZWJrV3BhR0FibjNnOTg5dFFCT0Zvc0ltX3JZVlB3TFhpaUlkXzk3MG9mTE1GRmJkellCZ2FXTkU3VXhCOUtJamdnUUFZV0oyN3k1OWdMcnExaDBzdjJPNW9aWE5BZmhMS253M1dRNDFrS1FKMnJ1dXdZUkFkS3JzYXFzWG5XeGx5MXpxdFVSR21OTDk0?oc=5&hl=en-US&gl=US&ceid=US:en,https://english.ratopati.com,Ratopati,"Let us recall the scenes of that day. Red flags were waving on the streets. Ordinary people were celebrating victory, smeared in vermilion. There was joy on their faces. Bidding farewell to the harsh, cruel, and terrifying days, they were welcoming the democracy that had dawned on the horizon. Even the injured, struggling in hospitals with bullets in their chests, were smiling. Families of martyrs were wiping away their tears.

This is a remembrance of Baisakh 11, the golden day when the traditional autocratic Shah dynasty rule ended following the 2062/063 movement. On that day, the monarchy knelt.

It was the historic day when the 19-day People's Movement, jointly called by the then seven political parties and the rebel CPN (Maoist), succeeded. It paved the way to draft a golden blueprint for a new Nepal. The People's Movement, which followed the 12-point agreement between the then armed CPN (Maoist) and the seven political parties engaged in peaceful street protests, brought upheaval and transformed the country from bloodshed to peace.

It has been 20 years since the establishment of democracy. What did the citizens expect from democracy? Have all those expectations been met over these years? Let us discuss this a little.

Did nothing happen after the establishment of democracy? Much has happened. The monarchy ended, and a federal democratic republic was established. The constitution was drafted, and the republic was established. The 2072 constitution was promulgated. A federal structure was implemented. Strong local governments were formed. Periodic elections were held at the federal, provincial, and local levels. Human rights, freedom of expression, and press freedom were ensured. Media developed and expanded. Advanced communication technology gained momentum.

There is no alternative to democracy other than an advanced democracy. And for that, citizen vigilance and active participation are always mandatory. We have no choice but to further strengthen democracy by fulfilling tasks such as addressing citizens' expectations, law enforcement, transparency and accountability, electoral system reform, and strengthening internal democracy within parties.

Inclusivity and representation were ensured in various bodies and places. Political awareness and participation increased among women, Dalits, Janajatis, Madhesis, and others. The ten-year armed conflict ended. Along with roads, education, and health, local development and infrastructure expanded. Citizen awareness and participation increased. Judicial and constitutional bodies were formed. These and similar indicators of change and development confirm significant progress.

However, the expectations and aspirations of the citizens were that changes should be reflected in their daily lives. Political stability and good governance, the end of corruption, economic prosperity and employment, opportunities within the country, and an accountable and transparent government were its dimensions.

When politics could not clearly intervene in these and similar issues, voices of dissatisfaction began to rise. In fact, democracy opened the golden door of change, but it became clear that much work remains to be done to strengthen democracy by fulfilling the aspirations of the citizens.

Every year on Democracy Day, formal programs like morning processions, lectures, offering garlands, lighting lamps, and cleaning campaigns are performed just to fulfill formalities. It should be something else. Responsible parties should become serious about completing the remaining tasks and work to strengthen democracy.

Is there an alternative to democracy?

Times and circumstances have changed. The then major parties that fought a long battle for democracy, such as the Nepali Congress, CPN (UML), and the then CPN (Maoist), now the CPN, have shrunk to unexpectedly small sizes. The newly emerged Rastriya Swatantra Party (RSP) has achieved an extraordinary victory in the election held after the Gen-Z movement.

Voices seeking an alternative to democracy are raised from time to time. The entire system often bears the brunt of this. That is, voices to reverse the achievements gained after the 2062/063 People's Movement are also being raised here and there.

However, in today's world order or among the various forms of governance practiced around the world, democracy is the system that has plenty of room to be made more and more prosperous. History has taught us that rather than any system brought in place of democracy, democracy itself can be nurtured to become a tool for fulfilling the highest aspirations of citizens.

Therefore, there is no alternative to the judiciary, parliament, independent press, democratic institutions, and citizens themselves becoming active.

Because there is no alternative to democracy other than an advanced democracy. And for that, citizen vigilance and active participation are always mandatory. We have no choice but to further strengthen democracy by fulfilling tasks such as addressing citizens' expectations, law enforcement, transparency and accountability, electoral system reform, and strengthening internal democracy within parties.

The main thing is that for the dignity, trust, and faith of democracy to be maintained, cooperation and dialogue between the parties that fought to bring democracy and the current elected government are mandatory. Those currently in power and those in opposition are the protectors of this system. Therefore, they have no choice but to be firm in the defense of democracy.

The ruling party RSP should also responsibly utilize the mandate received from the people and work towards strengthening democracy, which is the current public mandate. No one has the right to betray the mandate given by the citizens.

No one has the right to deviate from the democratic path. Because the alternative to democracy can never be regression.","{'https://rpcdn.ratopati.com/media/albums/amnesty_uQvdWdBBsR.PNG', 'https://npcdn.ratopati.com/media/news/dipak-dnawali_aV2RcJN3GV.jpg', 'https://npcdn.ratopati.com/media/news/untitled-1_O7MWRMABpf.jpg', 'https://npcdn.ratopati.com/media/news/indra-adhikari_XFizaEWWST.jpg', 'https://npcdn.ratopati.com/media/news/edu_CViYZ8ot7U.jpg', 'https://npcdn.ratopati.com/media/news/morang-police_nNFATzfaK7.jpg', 'https://rpcdn.ratopati.com/media/rato_logo.jpg', 'https://npcdn.ratopati.com/media/news/fake-news_nyeVnQIiKf.jpg', 'https://npcdn.ratopati.com/media/news/ganesh-joshi-_CWFiSsmWka.jpg', 'https://npcdn.ratopati.com/media/news/female-arrest_B1AZkALupK.jpg', 'https://npcdn.ratopati.com/media/news/julius-cesar_rfjuo7qEAv.jpg', 'https://english.ratopati.com/build/img/logo-rp.png', 'https://npcdn.ratopati.com/media/news/upendra-yadav_ik2wjpPbN8.jpg', 'https://npcdn.ratopati.com/media/news/n_3AVK7br8cV.jpg', 'https://npcdn.ratopati.com/media/news/prachanda_JBY5H3SMbN.jpg', 'https://npcdn.ratopati.com/media/news/sukumbasi-birodh-gen-z_npl-(4)_zlshpc4cxV.jpg', 'https://npcdn.ratopati.com/media/news/kisan-andolan_T7AHyfNgq9.jpg'}","ओहि दिनक दृश्य स्मरण करी। सड़क पर लाल झंडा लहरा रहल छल। साधारण लोक सिंदूर मे लिपटल विजयक उत्सव मना रहल छल । हुनका लोकनिक चेहरा पर खुशी छलनि। कठोर, क्रूर, आ भयावह दिन के विदाई दैत ओ सब क्षितिज पर भोर भ गेल लोकतंत्र के स्वागत क रहल छलाह. छाती मे गोली ल' क' अस्पताल मे छटपटाइत घायल लोकनि सेहो मुस्कुरा रहल छलाह. शहीदक परिवार अपन नोर पोछि रहल छल ।

ई बैसाख ११ के स्मरण छै, जे स्वर्णिम दिन छेलै जब॑ २०६२/०६३ के आन्दोलन के बाद पारंपरिक निरंकुश शाह राजवंश के शासन समाप्त होय गेलऽ छेलै । ओहि दिन राजतंत्र ठेहुन टेकलक।

ई ऐतिहासिक दिन छल जखन तत्कालीन सात राजनीतिक दल आ विद्रोही नेकपा (माओवादी) द्वारा संयुक्त रूप सँ बजाओल गेल १९ दिवसीय जन आन्दोलन सफल भेल । एकटा नव नेपाल लेल स्वर्णिम खाका बनेबाक बाट प्रशस्त केलक। तत्कालीन सशस्त्र नेकपा (माओवादी) आ शान्तिपूर्ण सड़क विरोध मे लागल सात राजनीतिक दल के बीच 12 सूत्री समझौता के बाद भेल जन आन्दोलन उथल-पुथल ल क देश के खून-खराबा स शांति मे बदलि देलक।

लोकतंत्र के स्थापना के 20 साल भ गेल। नागरिक लोकतंत्र स की उम्मीद करैत छल? की एहि साल मे ओ सबटा उम्मीद पूरा भ गेल अछि? एहि पर कनेक चर्चा करी।

लोकतंत्रक स्थापनाक बाद किछु नहि भेल? बहुत किछु भेल अछि। राजतंत्र समाप्त भेल, आ संघीय लोकतांत्रिक गणराज्यक स्थापना भेल । संविधान बनल, आ गणतंत्रक स्थापना भेल। २०७२ के संविधान जारी भेल । संघीय संरचना लागू भेल। मजबूत स्थानीय सरकार बनल। संघीय, प्रांतीय, आ स्थानीय स्तर पर समय-समय पर चुनाव होइत छल । मानव अधिकार, अभिव्यक्तिक स्वतंत्रता, आ प्रेस स्वतंत्रता सुनिश्चित भेल । मीडियाक विकास आ विस्तार भेल। उन्नत संचार प्रौद्योगिकी गति प्राप्त केलक।

उन्नत लोकतंत्र के अलावा लोकतंत्र के कोनो विकल्प नै छै। आरू ओकरा लेली नागरिक सतर्कता आरू सक्रिय भागीदारी हमेशा अनिवार्य छै । हमरा सब लग नागरिक के अपेक्षा के संबोधित करब, कानून प्रवर्तन, पारदर्शिता आ जवाबदेही, चुनावी व्यवस्था सुधार, आ दल के भीतर आंतरिक लोकतंत्र के मजबूत करब जेहन काज पूरा क लोकतंत्र के आओर मजबूत करय के अलावा कोनो चारा नहि अछि.

विभिन्न निकाय आ स्थान पर समावेशी आ प्रतिनिधित्व सुनिश्चित कयल गेल । महिला, दलित, जनजाती, मधेशी, आ अन्य मे राजनीतिक जागरूकता आ सहभागिता बढल । दस सालक सशस्त्र संघर्ष समाप्त भ गेल। सड़क, शिक्षा, आ स्वास्थ्य के संग संग स्थानीय विकास आ बुनियादी ढांचा के विस्तार भेल. नागरिक जागरूकता आ सहभागिता बढ़ल। न्यायिक आ संवैधानिक निकाय के गठन भेल। परिवर्तन आरू विकास केरऽ ई आरू ऐन्हऽ ही सूचक महत्वपूर्ण प्रगति के पुष्टि करै छै ।

ओना नागरिकक अपेक्षा आ आकांक्षा छल जे परिवर्तन हुनकर दैनिक जीवन मे परिलक्षित होबाक चाही । राजनीतिक स्थिरता आ सुशासन, भ्रष्टाचार के अंत, आर्थिक समृद्धि आ रोजगार, देश के भीतर अवसर, आ जवाबदेह आ पारदर्शी सरकार एकर आयाम छल |

जखन राजनीति एहि आ एहने मुद्दा मे स्पष्ट रूप स हस्तक्षेप नहि क सकल त असंतोष क आवाज उठय लागल। वास्तव में लोकतंत्र परिवर्तन के स्वर्णिम दरवाजा खोललकै, लेकिन ई बात साफ होय गेलै कि नागरिक के आकांक्षा के पूरा करी क॑ लोकतंत्र क॑ मजबूत करै लेली बहुत काम बाकी छै ।

हर साल लोकतंत्र दिवस पर सिर्फ औपचारिकता पूरा करय लेल भोरका जुलूस, व्याख्यान, माला चढ़ाबय, दीप जराबय, सफाई अभियान जेहन औपचारिक कार्यक्रम कयल जाइत अछि. किछु आओर हेबाक चाही। जिम्मेदार दल सब के शेष काज पूरा करय के लेल गंभीर होबय के चाही आ लोकतंत्र के मजबूत करय के काज करबाक चाही.

लोकतंत्रक कोनो विकल्प अछि की?

समय आ परिस्थिति बदलि गेल अछि। लोकतंत्र के लेल लंबा लड़ाई लड़य वाला तत्कालीन प्रमुख दल जेना नेपाली कांग्रेस, नेकपा (एमाले), आ तत्कालीन नेकपा (माओवादी), आब नेकपा, अप्रत्याशित रूप सं छोट आकार मे सिकुड़ि गेल अछि. जेन-जेड आन्दोलन के बाद भेल चुनाव मे नव उभरल राष्ट्रीय स्वतंत्र पार्टी (आरएसपी) के असाधारण जीत हासिल कएल गेल अछि.

लोकतंत्र के विकल्प के तलाश में समय-समय पर आवाज उठैत अछि. एकर बोझ प्रायः पूरा व्यवस्था उठबैत अछि । अर्थात 2062/063 के जन आन्दोलन के बाद प्राप्त उपलब्धि के उलटय के आवाज सेहो एम्हर-ओम्हर उठि रहल अछि.

लेकिन आजुक विश्व व्यवस्था में या दुनिया भर में प्रचलित शासन के विभिन्न रूप में लोकतंत्र ओ व्यवस्था अछि जेकरा बेसी स बेसी समृद्ध बनेबाक भरपूर गुंजाइश अछि | इतिहास हमरा सब क॑ सिखाबै छै कि लोकतंत्र के जगह प॑ लानलऽ गेलऽ कोनो भी व्यवस्था स॑ बेसी लोकतंत्र क॑ ही पोषित करी क॑ नागरिक केरऽ उच्चतम आकांक्षा क॑ पूरा करै के औजार बनी सकै छै ।

तें न्यायपालिका, संसद, स्वतंत्र प्रेस, लोकतांत्रिक संस्था, आ नागरिक स्वयं सक्रिय हेबाक कोनो विकल्प नहिं.

कारण उन्नत लोकतंत्र के अलावा लोकतंत्र के कोनो विकल्प नै छै। आरू ओकरा लेली नागरिक सतर्कता आरू सक्रिय भागीदारी हमेशा अनिवार्य छै । हमरा सब लग नागरिक के अपेक्षा के संबोधित करब, कानून प्रवर्तन, पारदर्शिता आ जवाबदेही, चुनावी व्यवस्था सुधार, आ दल के भीतर आंतरिक लोकतंत्र के मजबूत करब जेहन काज पूरा क लोकतंत्र के आओर मजबूत करय के अलावा कोनो चारा नहि अछि.

मुख्य बात ई छै कि लोकतंत्र केरऽ गरिमा, विश्वास, आरू विश्वास कायम रखै लेली लोकतंत्र लानै लेली लड़ै वाला दल आरू वर्तमान निर्वाचित सरकार के बीच सहयोग आरू संवाद अनिवार्य छै । जे एखन सत्ता मे छथि आ जे विपक्ष मे छथि ओ एहि व्यवस्थाक रक्षक छथि । अतः लोकतंत्र के रक्षा में दृढ़ता के अलावा हुनका सब के पास कोनो चारा नै छै।

सत्ताधारी दल आरएसपी क॑ भी जनता स॑ मिललऽ जनादेश के जिम्मेदारी स॑ उपयोग करना चाहियऽ आरू लोकतंत्र क॑ मजबूत करै के दिशा म॑ काम करना चाहियऽ, जे वर्तमान सार्वजनिक जनादेश छै । नागरिक द्वारा देल गेल जनादेश के संग विश्वासघात करबाक अधिकार ककरो नहि अछि ।

लोकतांत्रिक मार्ग स हटबाक अधिकार ककरो नहि अछि। कारण लोकतंत्रक विकल्प कहियो प्रतिगमन नहि भ' सकैत अछि ।"
