title,description,published date,url,publisher.href,publisher.title,full_article,images,translated
India-Nepal Draft Roadmap for Flood Control and Irrigation Cooperation - Daily Pioneer,India-Nepal Draft Roadmap for Flood Control and Irrigation Cooperation  Daily Pioneer,2026-05-03 09:45:23,https://news.google.com/rss/articles/CBMipAFBVV95cUxQMmlXMmRqTHk1UXVybWVOVFBXMThQYWxCU2p1aTRnWVFXQzQxRlZQNEM0T09JREpWVWJHenRVeDVRV205MndNenhVWWc0bUl0VW56WnI2cE10VVV3d2UzbVZPck55T2dIaXRNQ1U5UDZqVGZxMnBSM2wzTXl5ZUp6dWZIYlZEUXB4QUJiZXl3MmtjU3VuQ25qVzlwcDVmZjhNUFNnMw?oc=5&hl=en-US&gl=US&ceid=US:en,https://dailypioneer.com,Daily Pioneer,"India and Nepal have drafted a roadmap for collaboration in areas of flood control and irrigation, as senior officials of the two sides met and comprehensively reviewed bilateral water-sector cooperation.

The discussion took place at the two-day 11th meeting of the India-Nepal Joint Committee on Kosi and Gandak Projects, which concluded in Kathmandu. The Indian delegation was led by Santosh Kumar Mall, Principal Secretary, Water Resources Department, Government of Bihar, and the Nepalese delegation was led by Mitra Baral, Director General, Department of Irrigation, according to a press release issued by the Indian Embassy. The meeting comprehensively reviewed “India-Nepal cooperation in the Kosi and Gandak projects and drafted a future roadmap for further cooperation, including in the areas of flood control and irrigation,” said the Indian Embassy.

During the meeting, the Nepalese delegation agreed to remove encroachments from key Kosi and Gandak project areas, including canals, barrage zones and embankments to ensure smooth operation and maintenance.

The Indian side agreed to inspect and address drainage and waterlogging issues in the canal command areas of Western Kosi Main Canal and Valmikinagar Gandak Canal on the Nepalese side.","{'https://dailypioneer.com/uploads/2026/story/images/medium/R300_women-s-quota-move-fails-lok-parliament-test-2026-04-17.jpg', 'https://dailypioneer.com/uploads/2026/story/images/big/india--nepal-draft-a-roadmap-for-flood-control-and-irrigation-cooperation-2026-05-03.jpg', 'https://dailypioneer.com/uploads/2026/story/images/medium/R300_dhc-judge-justice-swarana-kanta-sharma-to-hear-delhi-liquor-case-2026-04-20.jpg', 'https://dailypioneer.com/uploads/2026/story/images/medium/R300_2-us-service-members-missing-after-military-exercise-in-morocco-2026-05-03.jpg', 'https://dailypioneer.com/uploads/2026/story/images/medium/R300_passenger-detained-after-opening-emergency-exit-on-taxiing-flight-at-chennai-airport-2026-05-03.jpg', 'https://dailypioneer.com/uploads/2026/story/images/medium/R300_india---s-new-envoy-to-china-arrives-in-shanghai-2026-05-03.jpg', 'https://dailypioneer.com/uploads/2026/story/images/medium/R300_aamir-khan-confirms-3-idiots-2-with-10-year-leap--returns-as-phunsukh-wangdu-2026-04-28.jpg', 'https://dailypioneer.com/uploads/2026/story/images/medium/R300_pakistan-court-to-hear-ex-pm-imran-khan--wife-in-graft-case-2026-05-01.jpg', 'https://dailypioneer.com/logo.png', 'https://dailypioneer.com/uploads/2026/story/images/medium/R300_17-killed-as-jeep-plunges-into-gorge-in-nepal-2026-05-01.jpg', 'https://dailypioneer.com/uploads/2026/story/images/medium/R300_nepal-razes-2-000-illegal-buildings-in-massive-kathmandu-drive-2026-05-03.jpg', 'https://dailypioneer.com/uploads/2026/story/images/medium/R300_riteish-deshmukh---s-raja-shivaji-collects-rs-23-90-crore-in-two-days-2026-05-03.jpg', 'https://dailypioneer.com/uploads/2026/story/images/medium/R300_israeli-strikes-kill-7-in-lebanon-amid-ceasefire-2026-05-03.jpg', 'https://dailypioneer.com/uploads/2026/story/images/medium/R300_zubeen---s-death--legal-experts-debate-vessel-operator-liability-2026-05-03.jpg', 'https://dailypioneer.com/uploads/2026/story/images/medium/R300_media-groups-call-on-israel-to-allow-foreign-reporters-access-to-gaza-2026-05-01.jpg', 'https://dailypioneer.com/uploads/2026/story/images/medium/R300_taiwan---s-president-lands-in-eswatini-despite-curbs-2026-05-03.jpg', 'https://dailypioneer.com/uploads/2026/story/images/medium/R300_war-drums-beat-again-across-the-middle-east-2026-04-21.jpg', 'https://dailypioneer.com/uploads/2026/story/images/medium/R300_sri-lanka---s-official-suspended-over-cyber-fraud-is-found-dead-2026-05-01.jpg', 'https://dailypioneer.com/uploads/2026/story/images/medium/R300_pakistan-police-arrest-21-terrorists-in-punjab-province-2026-05-03.jpg', 'https://dailypioneer.com/uploads/2026/story/images/medium/R300_bangladesh-pm-paves-way-for-flood-protection-infra-in-sylhet-2026-05-03.jpg'}","भारत आरू नेपाल बाढ़ नियंत्रण आरू सिंचाई के क्षेत्र मँ सहयोग लेली रोडमैप के मसौदा तैयार करलकै, कैन्हेंकि दोनों पक्ष के वरिष्ठ अधिकारी सिनी के बैठक आरू द्विपक्षीय जल-क्षेत्र सहयोग के व्यापक समीक्षा करलौ गेलौ छै ।

काठमांडू मे समाप्त भेल कोसी आ गंडक परियोजना पर भारत-नेपाल संयुक्त समितिक दू दिवसीय ११म बैसार मे चर्चा भेल । भारतीय प्रतिनिधिमंडल के नेतृत्व बिहार सरकार के जल संसाधन विभाग के प्रमुख सचिव संतोष कुमार मॉल केने छलाह आ नेपाली प्रतिनिधिमंडल के नेतृत्व सिंचाई विभाग के महानिदेशक मित्र बराल केने छलाह, भारतीय दूतावास द्वारा जारी प्रेस विज्ञप्ति के अनुसार। बैसार मे “कोसी आ गंडक परियोजना मे भारत-नेपाल सहयोगक व्यापक समीक्षा आ बाढ़ नियंत्रण आ सिंचाईक क्षेत्र सहित आगूक सहयोग लेल भविष्यक रोडमैप तैयार कएल गेल” भारतीय दूतावास जनौलक अछि ।

बैठक के दौरान नेपाली प्रतिनिधिमंडल नहर, बैराज जोन आ तटबंध सहित प्रमुख कोसी आ गंडक परियोजना क्षेत्र स अतिक्रमण कए दूर करबा पर सहमत भेल ताकि सुचारू संचालन आ रखरखाव सुनिश्चित कैल जा सकए।

भारतीय पक्ष नेपाली पक्षक पश्चिम कोसी मुख्य नहर आ वाल्मीनगर गंडक नहर के नहर कमांड क्षेत्र मे जल निकासी आ जलप्रलय के मुद्दा के निरीक्षण आ समाधान पर सहमत भेल अछि ।"
RSP to introduce ‘training and testing’ system for local election candidates - Nepalnews.com,RSP to introduce ‘training and testing’ system for local election candidates  Nepalnews.com,2026-05-03 09:57:44,https://news.google.com/rss/articles/CBMitwFBVV95cUxNeDgxMUU3ZFg0enBXLVlndXJCX0hyZll6cER3LTFJV1F6R2sxSENWSTRzYWVLTEI5dGVVTU9NR0gtUHRHODZ5aVNWT3U5YkYxanBMUGtobVpfVUVYaGVhaGhmcUtGU1RjdlVOdVFPMmZPVHUzVFJDWlFhVEpuYU1KdDJKWjVtZEVWMHlEcDY3T1pIS244UUxKeklJdjFUNXhpUWxiazlaaExUcjludkdJaUE5N0RuM3c?oc=5&hl=en-US&gl=US&ceid=US:en,https://english.nepalnews.com,Nepalnews.com,,,
RSP chair Lamichhane urges business community not to fear ‘government reforms’ - Nepalnews.com,RSP chair Lamichhane urges business community not to fear ‘government reforms’  Nepalnews.com,2026-05-03 10:12:51,https://news.google.com/rss/articles/CBMiugFBVV95cUxQMGJLSGtMVm1yYW1ScHVmMUpPYzEybU55YUUtZnB3TE1XZ1pUdFc5R1BDR2tGMFk1dFdvZ2t6NlNBN19lRHRubXNiUjZJdzcyUWlfWkNGaXVlbVpWT2dRZ2h1UEd3M2RrcG1rTUpMUDJWcFdFNkJGVktJUjZIZzNQaFNHTlpxVEhuYmF6c09uTVFmUHFRZE1kZzVBR2wzZWctaGJRWnNmai1nLXIwOEpWRDRUYm4tVFJReUE?oc=5&hl=en-US&gl=US&ceid=US:en,https://english.nepalnews.com,Nepalnews.com,,,
"Kenya floods kill at least 10, destroy bridges and disrupt transport - Nepalnews.com","Kenya floods kill at least 10, destroy bridges and disrupt transport  Nepalnews.com",2026-05-03 10:32:51,https://news.google.com/rss/articles/CBMitAFBVV95cUxQaUY4elZtNmswcjdnTUlkOWhKRGl6SnVMS0dCN2llQWpIb0FQRTdLUXZvMndRWXFRM0lSeG52TjBzYmQ2SW1ibW5pR2FHYW1ral84SmxUVmh3OEIyVmE4WFBRc21ja011M3BoR3pBUTNFYzVkVDFPMzNOSVViSFVRMDhrS29MYXB5VU5EZDBxZkl4WDdvd2Y4T0pZZzN2ZC1VS3U0WngzYnZmckMwaGVMZlIxVTQ?oc=5&hl=en-US&gl=US&ceid=US:en,https://english.nepalnews.com,Nepalnews.com,,,
Applications open for Miss Nepal 2026 - Nepalnews.com,Applications open for Miss Nepal 2026  Nepalnews.com,2026-05-03 10:42:57,https://news.google.com/rss/articles/CBMimgFBVV95cUxPbEtPb2NMemc5OG5WX3M5UWstSEM0NERGdldUZmN1S1lTUGtHdzVKNmRHZU5vTDZPc2NXLTFuUTdaTU82WThyYU8tOVZMLVRzR19XNl80MEM3R1pKNllBUlFscDcycm83d1dMeF9IWWlNdkVTSzNMZWN3eXJkYUtvWVFMSXplekRzMDZ3ZXNWcWdDMnd6bjZtdC1B?oc=5&hl=en-US&gl=US&ceid=US:en,https://english.nepalnews.com,Nepalnews.com,,,
