title,description,published date,url,publisher.href,publisher.title,full_article,images,translated
From Messi Mania to edible oil: Argentina’s surprising place in Nepal’s trade map - OnlineKhabar English News,From Messi Mania to edible oil: Argentina’s surprising place in Nepal’s trade map  OnlineKhabar English News,2026-06-26 08:17:34,https://news.google.com/rss/articles/CBMitwFBVV95cUxNNXpIM3F5S0JSb0k1a0t3U3BRM2R1V3lOekpoT0xER0NVOEpMYndrQ2JCSElzSEluMkQtM2U4S09BQUM2MWswZ3kxdXVzeGtaVzc1OFB1NjQzMk1XUWNOMHZGNHpjWEdBbUxzNHJjLVhRdHlQWWtkN2VxRDZUQXJnS0J1SjBieFRxOXJnNG9uWUpKNnMyUE56YXlEbWhPaXVoVmp6eUlWdzF1ekNQMFRvWjE2c2JuOHc?oc=5&hl=en-US&gl=US&ceid=US:en,https://english.onlinekhabar.com,OnlineKhabar English News,"With the FIFA World Cup 2026 in the air, Argentina is again on the minds of people in their homes, cafes and social media feeds across Nepal. The South American country has a strong emotional resonance for the Nepalis, as it has been providing them with memorable moments for decades in the World Cup.

Yet, Argentina’s significance for Nepal is more complex than just football. It’s a tale of a distant conflict, Nepali soldiers who served on the other side of the world and a billion-rupee trade that is almost entirely dependent on edible oil.

A war Nepal was quietly part of

Today, few Nepalis can recall a war fought in the South Atlantic in 1982 between Britain and Argentina over islands, which is known as the Falklands War. Nepal was not involved in the war, but the war has an unusual connection with Nepal: Gurkha soldiers from Nepal served in the British Army as part of their campaign to retake the islands.

The 1st Battalion, 7th Duke of Edinburgh’s Own Gurkha Rifles was attached to the British 5th Infantry Brigade and fought in the area of Mount William near Port Stanley. During the war, some Argentine troops were anxious about the reputation of the Gurkhas, and this was exacerbated by rumours and media coverage. In fact, some Argentinean voices even called them “mercenaries”, a term that was not accepted by Gurkha veterans and historians.

The Falklands War was never a war between Nepal and Argentina. But Gurkha troops from Nepal were deployed thousands of kilometres from their home country to fight against the Argentineans — a lesser-known part of the complex history between the two nations.

A surprising position in Nepal’s trade data

This historical footnote makes the current economic situation even more remarkable.

The Department of Customs in Nepal has released the statistics of foreign trade during the first 11 months of the fiscal year 2082/83 (Shrawan-Jestha), which reveals that Argentina is Nepal’s third largest import source country after India and China. In this time, Nepal imported goods worth around Rs 105.08 billion from Argentina.

To put this in perspective, India was still the leading import partner of Nepal at Rs 1092.02 billion. The second largest is China with Rs 382.25 billion. Argentina’s figure of Rs 105.08 billion placed it well ahead of the United Arab Emirates at Rs 50.99 billion and the United States at Rs 29.10 billion. The result was a remarkable one for a nation located thousands of kilometres away, with no resident embassy in Nepal and no major cultural or migration corridor comparable to Nepal’s ties with India, China or the Gulf.

What Nepal actually buys from Argentina

The trade relationship, however, is highly concentrated. The imports from Argentina to Nepal are highly skewed towards a single product group, namely crude edible oils.

The import bill for crude soybean oil was the largest at Rs 90.12 billion, while crude sunflower oil added another Rs 14.79 billion. These two commodities account for nearly 99.8 per cent of Nepal’s imports from Argentina, leaving little space for anything else.

This concentration brings the structural aspect of the relationship to light. Nepal does not source a diverse range of consumer or industrial goods from Argentina. Instead, it depends on the country as a key point in its chain of edible oils, importing raw oils for processing in the country, refining and consumption.

Three different Argentinas

And so there are not one Argentina in Nepal’s narrative but three, to all appearances quite unrelated: the Argentina of football – beloved, passionate, emblazoned in blue and white, identified by its Messis and Maradonas, decades of Cup finals – and the Argentina of the Falklands War, in whose colonial-era land in the South Atlantic an Argentine conscript fought on a British side against a Gurkha whom he may never have noticed and whom he may never meet even now; and then there is Argentina the vast agrarian economy whose products in large volumes trickle into the accounting pages of Nepal’s Directorate of Customs with the designation ‘crude edible oil.’

Most Nepalis understand very little about these three Argentinas. The football in Argentina is the noisiest. The trade with Argentina means more in cash than anything else. The war in Argentina might be the most dormant in the memory of most of this country.

Nepal’s broader trade picture

The Argentina numbers fit in a broader pattern of structural trade imbalance. Imports grew to Rs 1,894.10 billion, exports just to Rs 277.97 billion — yielding a trade deficit of Rs 1,616.13 billion just in the first 11 months of FY 2082/83. Of this trade imbalance, Argentina’s Rs 105 billion component just shows how even a remote, distinct, and seemingly disconnected nation can be catapulted to the top three spot in a country’s list of import partners by a single item.

Key figures at a glance

Indicator Value Argentina’s rank among import partners 3rd Nepal’s imports from Argentina Rs 105.08 billion — of which: crude soybean oil Rs 90.12 billion — of which: crude sunflower oil Rs 14.79 billion Share of oils in Argentina’s imports ~99.8% Nepal’s total imports Rs 1,894.10 billion Nepal’s total exports Rs 277.97 billion Trade deficit Rs 1,616.13 billion","{'https://certify.alexametrics.com/atrk.gif?account=au/Vl1a8FRh2em', 'https://english.onlinekhabar.com/wp-content/uploads/2026/06/images-150x150.jpg', 'https://english.onlinekhabar.com/wp-content/themes/onlinekhabar-english-2020/img/flag.png', 'https://english.onlinekhabar.com/wp-content/uploads/2026/06/Urea-green-plant.png', 'https://english.onlinekhabar.com/wp-content/themes/onlinekhabar-english-2020/img/site-main-logo.png', 'https://english.onlinekhabar.com/wp-content/uploads/2026/06/khem_sharma_chature-150x150.jpg', 'https://english.onlinekhabar.com/wp-content/uploads/2026/06/article_img2-1024x576.png', 'https://english.onlinekhabar.com/wp-content/uploads/2026/06/milk-dudh-kisan-3.jpg', 'https://english.onlinekhabar.com/wp-content/uploads/2018/06/MaxPixel.freegreatpicture.com-World-Cup-2018-Football-Russia-World-Championship-3373557-300x200.jpg', 'https://english.onlinekhabar.com/wp-content/uploads/2026/06/article_img2-150x150.png', 'https://english.onlinekhabar.com/wp-content/plugins/ok-user-manager/img/ajax-loader.gif', 'https://english.onlinekhabar.com/wp-content/uploads/2026/05/tribhuwan-University-TU-3-1024x609.jpg', 'https://english.onlinekhabar.com/wp-content/uploads/2026/06/article_img1-1024x576.png', 'https://english.onlinekhabar.com/wp-content/uploads/2026/06/Archetype-3-1024x847.jpg', 'https://english.onlinekhabar.com/wp-content/uploads/2026/06/RSP-Women-victory-1024x683-1-150x150.png', 'https://english.onlinekhabar.com/wp-content/uploads/2024/06/lautaro-argentina.jpg', 'https://english.onlinekhabar.com/wp-content/uploads/2026/06/Archetype-3-150x150.jpg', 'https://english.onlinekhabar.com/wp-content/uploads/2026/06/balen-shah-3-1024x500-1-150x150.jpg', 'https://english.onlinekhabar.com/wp-content/uploads/2020/04/Birds-and-monkey-12-1024x682.jpg', 'https://english.onlinekhabar.com/wp-content/themes/onlinekhabar-english-2020/img/ajax-loader.gif', 'https://english.onlinekhabar.com/wp-content/uploads/2026/06/photo-2-150x150.png', 'https://english.onlinekhabar.com/wp-content/uploads/2022/07/budhigandaki-4-150x150.jpg', 'https://english.onlinekhabar.com/wp-content/uploads/2019/10/dog-bites-150x150.jpg', 'https://english.onlinekhabar.com/wp-content/uploads/2026/06/bishnu-paudel-1024x500-1-150x150.jpg', 'https://english.onlinekhabar.com/wp-content/uploads/2023/03/Drugs-Addiction-Sketch-1024x624-1-150x150.jpg', 'https://english.onlinekhabar.com/wp-content/uploads/2024/07/Argentina.jpg', 'https://english.onlinekhabar.com/wp-content/uploads/2026/06/article_img2.png'}","फीफा विश्व कप २०२६ के हवा में उछालला के बाद अर्जेंटीना फेरू नेपाल के घर, कैफे आरू सोशल मीडिया फीड में लोगऽ के दिमाग में आबी गेलऽ छै । दक्षिण अमेरिकी देश नेपाली के लेल एकटा प्रबल भावनात्मक प्रतिध्वनि अछि, कियाकि ई विश्व कप में दशकों स यादगार क्षण उपलब्ध कराबैत आबि रहल अछि ।

तइयो नेपाल के लेल अर्जेंटीना के महत्व सिर्फ फुटबॉल सं बेसि जटिल अछि. ई दूर के द्वंद्व के कहानी छै, दुनिया के दोसरऽ तरफ सेवा करै वाला नेपाली सैनिक आरू अरबों रुपया के व्यापार जे लगभग पूरा तरह स॑ खाद्य तेल प॑ निर्भर छै ।

एकटा युद्ध नेपाल चुपचाप हिस्सा छल

आइ द्वीप पर ब्रिटेन आ अर्जेन्टीना के बीच दक्षिण अटलांटिक में 1982 में भेल युद्ध के बहुत कम नेपाली याद क सकैत छथि, जेकरा फॉकलैंड युद्ध के नाम सं जानल जाइत अछि. नेपाल युद्ध मे शामिल नहि छल, मुदा युद्धक नेपाल सँ असामान्य संबंध अछि : नेपाल सँ गोर्खा सैनिक लोकनि द्वीप सभ केँ पुनः कब्जा करबाक अभियानक हिस्साक रूप मे ब्रिटिश सेना मे सेवा देलनि ।

एडिनबर्ग केरऽ 7 बटालियन, 7 ड्यूक ऑफ एडिनबर्ग केरऽ अपनऽ गुर्खा राइफल्स ब्रिटिश 5 इन्फैंट्री ब्रिगेड स॑ जुड़लऽ छेलै आरू पोर्ट स्टेनली के पास माउंट विलियम के इलाका म॑ लड़लऽ छेलै । युद्ध के दौरान अर्जेंटीना के कुछ सैनिक गोर्खा के प्रतिष्ठा के प्रति बेचैन छेलै, आरू अफवाह आरू मीडिया कवरेज के कारण ई बात आरू बढ़ी गेलै । असल में किछु अर्जेंटीना के आवाज हुनका सब के “भाड़ा के सैनिक” तक कहैत छल, जे शब्द गोर्खा के दिग्गज आ इतिहासकार सब स्वीकार नै केने छलाह.

फॉकलैंड युद्ध नेपाल आ अर्जेन्टीना के बीच कहियो युद्ध नहि छल । लेकिन नेपाल केरऽ गोर्खा सैनिकऽ क॑ अपनऽ गृह देश स॑ हजारों किलोमीटर दूर अर्जेंटीना केरऽ लोगऽ के खिलाफ लड़ै लेली तैनात करलऽ गेलऽ छेलै — जे दोनों राष्ट्र के बीच के जटिल इतिहास केरऽ कम ज्ञात हिस्सा छेलै ।

नेपाल के व्यापारिक आंकड़ा मे आश्चर्यजनक स्थिति

ई ऐतिहासिक पादटिप्पणी वर्तमान आर्थिक स्थिति के आओर उल्लेखनीय बना दैत अछि |

नेपाल केरऽ सीमा शुल्क विभाग न॑ वित्तीय वर्ष २०८२/८३ (श्रावन-जेष्ठा) केरऽ पहलऽ ११ महीना के दौरान विदेशी व्यापार केरऽ आंकड़ा जारी करलकै, जेकरा स॑ पता चलै छै कि अर्जेन्टीना भारत आरू चीन के बाद नेपाल केरऽ तेसरऽ सबसें बड़ऽ आयात स्रोत देश छेकै । एहि समय मे नेपाल अर्जेंटीना स लगभग 105.08 अरब टका क सामान आयात केलक।

एकरा परिप्रेक्ष्य मे राखल जाय त भारत एखनो 1092.02 अरब रुपया मे नेपालक अग्रणी आयात भागीदार छल । दोसर सबस पैघ चीन अछि 382.25 अरब टका क संग। अर्जेंटीना केरऽ 105.08 अरब रुपया के आंकड़ा स॑ संयुक्त अरब अमीरात स॑ काफी आगू छै आरू ई 50.99 अरब आरू अमेरिका स॑ 29.10 अरब रुपया छै । एकरऽ परिणाम हजारों किलोमीटर दूर स्थित एगो राष्ट्र लेली उल्लेखनीय छेलै, जेकरा म॑ नेपाल म॑ कोनो निवासी दूतावास नै छेलै आरू भारत, चीन या खाड़ी के साथ नेपाल केरऽ संबंध के तुलना म॑ कोनो बड़ऽ सांस्कृतिक या प्रवासन गलियारा नै छेलै ।

नेपाल वास्तव मे अर्जेंटीना स की कीनैत अछि

व्यापारिक संबंध, तथापि, बेसी केंद्रित अछि। अर्जेंटीना स॑ नेपाल म॑ आयात एकल उत्पाद समूह, यानी कच्चा खाद्य तेल के तरफ बहुत तिरछा छै ।

कच्चा सोयाबीन तेल क आयात बिल सबस बेसी 90.12 अरब टका रहल, जखन कि कच्चा सूरजमुखी तेल मे 14.79 अरब टका आओर बढ़ल। अर्जेंटीना स॑ नेपाल केरऽ आयात केरऽ लगभग ९९.८ प्रतिशत हिस्सा ई दूनू वस्तु के छै, जेकरा स॑ दोसरऽ चीजऽ लेली जगह कम रह॑ छै ।

ई एकाग्रता संबंधक संरचनात्मक पक्ष केँ सोझाँ अनैत अछि । नेपाल अर्जेंटीना सँ उपभोक्ता वा औद्योगिक वस्तुक विविध श्रेणीक स्रोत नहि भेटैत अछि । बल्कि ई अपनऽ खाद्य तेल केरऽ श्रृंखला म॑ एगो प्रमुख बिंदु के रूप म॑ देश प॑ निर्भर छै, देश म॑ प्रसंस्करण, रिफाइनिग आरू खपत लेली कच्चा तेल के आयात करै छै ।

तीन अलग-अलग अर्जेन्टीना

आरू ई लेली नेपाल केरऽ कथ्य म॑ एक अर्जेन्टीना नै छै बल्कि तीन छै, सब तरह के रूप म॑ एकदम असंबंधित छै: फुटबॉल केरऽ अर्जेन्टीना – प्रिय, भावुक, नीले आरू सफेद रंग म॑ सजलऽ, जेकरऽ पहचान ओकरऽ मेसिस आरू मैराडोनास, दशकऽ के कप फाइनल स॑ करलऽ गेलऽ छै – आरू फॉकलैंड युद्ध केरऽ अर्जेन्टीना, जेकरऽ औपनिवेशिक युग केरऽ भूमि दक्षिण अटलांटिक म॑ एगो अर्जेन्टीनी सैनिक न॑ एक ब्रिटिश पक्ष प॑ एगो गुर्खा के खिलाफ लड़लऽ नै हुअ॑ सकै छै ध्यान देने छथि आ जिनकासँ एखनहु कहियो भेंट नहि भ' सकैत अछि; आरू फेरू अर्जेन्टीना छै विशाल कृषि अर्थव्यवस्था जेकरऽ उत्पाद बड़ऽ मात्रा म॑ नेपाल केरऽ सीमा शुल्क निदेशालय केरऽ लेखा पन्ना म॑ ‘कच्चा खाद्य तेल’ नाम स॑ टपकै छै ।

अधिकांश नेपाली एहि तीनू अर्जेन्टिनाक विषय मे बहुत कम बुझैत छथि । अर्जेंटीना के फुटबॉल सब सं बेसी शोरगुल वाला अछि. अर्जेंटीना के साथ व्यापार के मतलब सब किछु स बेसी नकद में अछि। अर्जेंटीना केरऽ युद्ध ई देश केरऽ अधिकांश भाग के याद म॑ सबसें सुप्त होय सकै छै ।

नेपालक व्यापक व्यापारिक तस्वीर

अर्जेंटीना केरऽ संख्या संरचनात्मक व्यापार असंतुलन केरऽ एगो व्यापक पैटर्न म॑ फिट बैठै छै । आयात बढ़ी क॑ 1,894.10 अरब रुपया होय गेलै, निर्यात महज 277.97 अरब रुपया होय गेलै — जेकरा स॑ वित्तीय वर्ष 2082/83 केरऽ महज पहिलऽ 11 महीना म॑ 1,616.13 अरब रुपया के व्यापार घाटा होय गेलै । ई व्यापारिक असंतुलन केरऽ अर्जेंटीना केरऽ 105 अरब रुपया केरऽ घटक बस ई दर्शाबै छै कि कोना एगो दूरस्थ, अलग, आरू विच्छेद प्रतीत होय वाला राष्ट्र क॑ भी एक ही आइटम स॑ कोनो देश केरऽ आयात भागीदारऽ के सूची म॑ शीर्ष तीन स्थान प॑ गुलेल स॑ उड़ालऽ जाब॑ सकै छै ।

एक नजर मे प्रमुख आंकड़ा

संकेतक मूल्य आयात भागीदारक मे अर्जेन्टीना केरऽ रैंक 3rd अर्जेन्टीना स॑ नेपाल केरऽ आयात १०५.०८ अरब रुपया — जेकरा म॑ स॑: कच्चा सोयाबीन तेल ९०.१२ अरब रुपया — जेकरा म॑ स॑: कच्चा सूरजमुखी तेल १४.७९ अरब रुपया अर्जेन्टीना केरऽ आयात म॑ तेल केरऽ हिस्सा ~९९.८% नेपाल केरऽ कुल आयात १,८९४.१० अरब रुपया नेपालक कुल निर्यात २७७.९७ अरब रुपैया व्यापार घाटा १,६१६.१३ अरब रुपैयाँ"
Voting underway for RSP office-bearers as race narrows down after key withdrawals - Nepalnews.com,Voting underway for RSP office-bearers as race narrows down after key withdrawals  Nepalnews.com,2026-06-26 08:27:32,https://news.google.com/rss/articles/CBMiwAFBVV95cUxPdDMxcUx1M3lHVXZnN1FhUTBZaE9GdkptdENweGZma2gxQlhBRHhBRnJzam9xQ0syRVZpMkw3WjZFbWFtclRjdEk1NWJNcXNYZGRNYmRNUWZvSmJSZFBFb01DUTU3Ymp4MWFfdUcwUjRfTUZkMjdWRUZtMmtPMGEyejNFM2JocDZFWUM3aUNlSDI1a0oycjBlMHJZS1Nld1M2S2tpaUJfWS1NZXlFQzlMOHF5WTlCZzhCSXZzOVpWZTg?oc=5&hl=en-US&gl=US&ceid=US:en,https://english.nepalnews.com,Nepalnews.com,,,
