title,description,published date,url,publisher.href,publisher.title,full_article,images,translated
Border crackdown disrupts apple re-export trade - The Rising Nepal,Border crackdown disrupts apple re-export trade  The Rising Nepal,2026-04-18 04:15:20,https://news.google.com/rss/articles/CBMiUEFVX3lxTE4tUm9pVlZWOEFDTmhLN2NkTjBCYjNNN0xvOHQyM1V3RndZSFBTNnZlQ2hnN1dJS2NIMHp2bHJmeEh2UDhWbUx5OUJFbTlxaGww?oc=5&hl=en-US&gl=US&ceid=US:en,https://risingnepaldaily.com,The Rising Nepal,"By Our Correspondent,Biratnagar, Apr. 18: Traders in eastern Nepal who had been importing apples from China and illegally re-exporting them to India have found themselves in serious difficulty after local authorities tightened controls at the border.

Previously, traders had been transporting Chinese apples into India through the open border points of Jhapa, Morang, and Sunsari. However, recent stricter enforcement by local authorities has disrupted these activities.

Although the apples were legally imported, their export had been carried out illegally. With increased border control, the impact is now visible in cold storage facilities. There are only three cold stores in Biratnagar, and imports have exceeded their storage capacity.

Traders had been importing more apples than the Nepali market could consume, relying on a syndicate system to smuggle the surplus into India. However, with tighter border regulations, traders are now struggling to manage the excess stock.

According to Suprim Regmi, operator of Shriram Cold Store in Biratnagar, there is currently a high influx of apples imported from China, as it is the peak season.

The three cold storage facilities in Biratnagar are Shriram Cold Storage, Eastern Cold Store, and Global Cold Store. Among them, Global Cold Store is operated by Bijay Jaiswal Chaudhary, who is also involved in fruit trading through his company, Bijay Fruit.

Issues related to apple smuggling from the three districts of Koshi Province have been reported in the past as well.

However, in recent times, illegal activities at the border have been significantly curtailed. Additionally, regulations requiring customs duties on goods worth more than Rs. 100 brought across the border have been strictly enforced.

Ahmad Saheb Guddu Miya, Secretary of the Biratnagar Vegetable and Fruit Wholesale Market Management Committee, stated that the market is currently flooded with apples imported from China, which is also the peak import period. According to him, syndicate groups have been involved in transporting these apples across the border into India, with traders from both Nepal and India participating.

Two years ago, 571 cartons of Chinese apples were seized by the Armed Police Force while being smuggled into India through the eastern Lodhawari checkpoint in Jhapa’s Kachankawal Rural Municipality-4.

Earlier, on June 12, 2021, 1,350 cartons of apples being transported in three trucks were intercepted at the Lahi checkpoint in Haripur, Sunsari, while being taken into India.

According to a trader in Biratnagar, the situation has now changed. Over the past 15 days, traders have been unwilling to transport apples across the border. The trader stated that Bijay Fruit and Divyani Enterprises are among the largest importers of apples in Biratnagar.

“The cold store facilities don’t even have the capacity to store ten containers, but around fifty containers have arrived,” the trader said.

“Those who used to take the risk of transporting apples into India are no longer willing to do so.”

Mukesh Chaudhary, operator of Divyani Enterprises, claimed that the apple trade is being conducted legally.

He stated that his responsibility ends after supplying imported apples to the market and that he is unaware of where the apples eventually go.

Chief District Officer of Morang, Yubaraj Kattel, informed that local authorities have been regularly monitoring the border, often on alternate days.

He added that the administration is working to involve locals in preventing illegal activities.

Bimal Dev Sah, a customs officer at the Biratnagar Customs Office, stated that there is no official record of apples imported through customs being exported. However, apples consistently rank among the top 20 imported goods in terms of value.



","{'https://risingnepaldaily.com/storage/media/885/conversions/square-thumb-thumb-thumb.jpg', 'https://risingnepaldaily.com/storage/media/100443/conversions/Untitled-1-original-thumb.jpg', 'https://risingnepaldaily.com/commons/rising-logo.png', 'https://risingnepaldaily.com/storage/media/100444/conversions/Untitled-1-square-thumb.jpg', 'https://risingnepaldaily.com/storage/media/100443/conversions/Untitled-1-square-thumb.jpg', 'https://risingnepaldaily.com/storage/media/100440/conversions/Untitled-1-original-thumb.jpg', 'https://risingnepaldaily.com/storage/media/100433/Untitled-1.jpg', 'https://risingnepaldaily.com/storage/media/100441/conversions/Untitled-1-original-thumb.jpg', 'https://risingnepaldaily.com/storage/media/100440/conversions/Untitled-1-square-thumb.jpg', 'https://risingnepaldaily.com/storage/media/100441/conversions/Untitled-1-square-thumb.jpg', 'https://risingnepaldaily.com/storage/media/100437/conversions/Untitled-1-original-thumb.jpg', 'https://risingnepaldaily.com/storage/media/100447/conversions/Untitled-1-original-thumb.jpg', 'https://risingnepaldaily.com/storage/media/100455/conversions/Screenshot-2026-04-18-122940-original-thumb.jpg', 'https://risingnepaldaily.com/storage/media/100444/conversions/Untitled-1-original-thumb.jpg', 'https://risingnepaldaily.com/storage/media/100438/conversions/Untitled-1-original-thumb.jpg', 'https://risingnepaldaily.com/storage/media/100442/conversions/Untitled-1-original-thumb.jpg'}","हमर संवाददाता,विराटनगर, 18 अप्रैल : पूर्वी नेपाल के व्यापारी जे चीन स सेब आयात क अवैध तरीका स भारत मे पुनः निर्यात करैत आबि रहल छल, स्थानीय प्राधिकरण क सीमा पर नियंत्रण कड़ा केलाक बाद गंभीर दिक्कत मे पड़ल अछि।

एहि सं पहिने व्यापारी झापा, मोरंग, आ सुनसरी के खुला सीमा बिंदु सं चीनी सेब के भारत पहुंचाबैत छलाह. मुदा हाल मे स्थानीय प्राधिकरण द्वारा कड़ा प्रवर्तन एहि गतिविधि मे बाधा पहुंचेलक अछि।

ओना त नेबो कानूनी तौर पर आयात भेल छल, मुदा ओकर निर्यात गैरकानूनी तरीका स भेल छल। सीमा नियंत्रण बढ़ला स आब कोल्ड स्टोरेज सुविधा मे एकर असर देखबा मे आबि रहल अछि। विराटनगर मे मात्र तीनटा कोल्ड स्टोर अछि, आ आयात भंडारण क्षमता स बेसी भ गेल अछि।

व्यापारी सब नेपाली बाजार के खपत स बेसी सेब के आयात करैत आबि रहल छल, जे अधिशेष के भारत में तस्करी करय लेल सिन्डिकेट प्रणाली पर निर्भर छल। मुदा सीमा पर कड़ा नियम क संग आब व्यापारी कए अतिरिक्त स्टॉक कए प्रबंधित करबा मे परेशानी भ रहल अछि।

विराटनगर के श्रीराम कोल्ड स्टोर के संचालक सुप्रिम रेग्मी के अनुसार चीन स आयातित सेब के एखन बेसी आवागमन अछि, कियाक त ई पीक सीजन अछि।

विराटनगर मे तीन कोल्ड स्टोरेज सुविधा श्रीराम कोल्ड स्टोरेज, पूर्वी कोल्ड स्टोर, आ ग्लोबल कोल्ड स्टोर अछि । एहि मे ग्लोबल कोल्ड स्टोर क संचालन विजय जायसवाल चौधरी क रहल छथि, जे अपन कंपनी विजय फल क माध्यम स फल क कारोबार मे सेहो लागल छथि।

कोशी प्रांत के तीन जिला स सेब के तस्करी स जुड़ल मुद्दा पहिने सेहो सामने आयल अछि।

लेकिन हाल के समय में सीमा पर अवैध गतिविधि में काफी कटौती करलऽ गेलऽ छै । एकर अतिरिक्त, 1000 रुपया सं बेसि कें वस्तुअक पर सीमा शुल्क कें आवश्यकता वाला नियमक. सीमा पार आनल गेल 100 के कड़ाई स लागू कायल गेल अछि।

विराटनगर सब्जी आ फल थोक बाजार प्रबंधन समिति के सचिव अहमद साहेब गुड्डू मिया अखन चीन स आयातित सेब स बाढ़ि स भरल अछि, जे आयात के चरम अवधि सेहो अछि, बतौलनि। हुनकऽ अनुसार ई सेबऽ क॑ सीमा पार स॑ भारत म॑ पहुँचै म॑ सिन्डिकेट समूह संलग्न रहलऽ छै, जेकरा म॑ नेपाल आरू भारत दूनू के व्यापारी भाग लेल॑ छै ।

दू साल पहिने झापा के कचनकवाल ग्रामीण नगरपालिका-4 के पूर्वी लोधावारी नाका के माध्यम सं भारत में तस्करी के दौरान सशस्त्र पुलिस बल के तरफ सं 571 कार्टन चीनी सेब जब्त कायल गेल छल.

एहि सं पहिने 12 जून 2021 कए सुनसरी क हरिपुर स्थित लाही नाका पर तीन ट्रक मे ल जा रहल 1350 कार्टन सेब कए भारत मे ल जेबाक दौरान रोकल गेल छल।

विराटनगर के एक व्यापारी के अनुसार आब स्थिति बदलि गेल अछि। पिछला 15 दिन स व्यापारी सीमा पार स सेब पहुंचेबा लेल तैयार नहि छथि। व्यापारी के कहनाय छनि जे विराटनगर मे सेब के सबस पैघ आयात करय वाला मे विजय फ्रूट आओर दिव्यानी इंटरप्राइजेज अछि.

व्यापारी कहलकै, “कोल्ड स्टोर के सुविधा मे दस कंटेनर रखबाक क्षमता तक नहि अछि, मुदा करीब पचास टा कंटेनर आबि गेल अछि.”

“जे पहिने भारत मे सेब पहुँचेबाक जोखिम उठबैत छलाह ओ आब एहि लेल तैयार नहि छथि।”

दिव्यानी इन्टरप्राइजेजके संचालक मुकेश चौधरी सेबके व्यापार कानूनी रुपमे सम्पन्न भऽ रहल दाबी कएलन्हि ।

ओ कहलनि जे, आयातित सेब बाजार मे आपूर्ति केलाक बाद हुनकर जिम्मेदारी समाप्त भ जाइत अछि आ अंततः सेब कतय जाइत अछि ताहि सं हुनका अनभिज्ञ अछि।

मोरंग के मुख्य जिला अधिकारी युबराज कट्टल नँ जानकारी देलकै कि स्थानीय प्राधिकरण नियमित रूप स॑ सीमा प॑ नजर रखी रहलऽ छै, जे अक्सर बारी-बारी स॑ दिनऽ प॑ होय छै ।

ओ इहो कहलनि जे, प्रशासन अवैध गतिविधि के रोकय मे स्थानीय लोक के शामिल करय के काज क रहल अछि।

विराटनगर सीमाशुल्क कार्यालयके सीमाशुल्क अधिकारी बिमल देव साह सीमाशुल्क माध्यमसँ आयातित सेबके निर्यातके आधिकारिक अभिलेख नहि रहल बतौलनि । मुदा, मूल्य के हिसाब सं सेब लगातार शीर्ष 20 आयातित सामान में शामिल अछि."
Nepal Bottled Water Association Announces Price Hike Due to Rising Production Costs - Ratopati,Nepal Bottled Water Association Announces Price Hike Due to Rising Production Costs  Ratopati,2026-04-18 04:46:39,https://news.google.com/rss/articles/CBMitgFBVV95cUxNWlFSYUhPcWw2LVlFeks5U3hvbk5tZGxJS01fbW1TRS12N2VZb2wzVjlpS0N4X3dqa2ZxclZ4SFd0YzFGeUc4aDRxWWdOR1I1dFYtOWNnRWxuYnFoRTRuSUJHbGFrU1JraWVOaTFzS1c2M1ZBZXpZU0NDRHFySDZibG9OVFd2eS0yMlQ2dE5jRVdsSXdfQ3hmLXNTTUl4MHJqSWtxT09hRFZhYlFVMkNhZGtxOG9QQQ?oc=5&hl=en-US&gl=US&ceid=US:en,https://english.ratopati.com,Ratopati,"Kathmandu. The Nepal Bottled Water Association has decided to adjust (increase) the price of processed drinking water. The association stated that it is no longer possible to operate industries at the previous prices due to a significant rise in raw material costs and increased transportation expenses.

In a press release issued today, the association reported that the prices of raw materials used in the water industry, including bottles, caps, wrapping rolls, jars, and jar caps, have increased by approximately 40 percent. Furthermore, the association noted that transportation costs have risen significantly due to the increase in petroleum prices.

The association mentioned that Nepal's water industries have been directly affected by the recent international situation, particularly the Iran-Israel tensions and Iran-US relations, which have impacted the global market and supply chain.

The statement reads, 'This is not a profit-oriented decision but a compulsory situation created by increased production costs, transportation expenses, and rising raw material prices. Adjusting prices in proportion to costs has become an inevitable necessity for the sustainability, quality maintenance, and regular supply of the industry.'

The association has urged the government to take necessary steps to facilitate industrial operations, ensure the availability of raw materials, and control transportation costs. In the statement issued by General Secretary Dhruva Prasad Adhikari, an appeal has also been made to consumers, distributors, and stakeholders to understand and cooperate with this compelling situation.","{'https://rpcdn.ratopati.com/media/albums/kanchanganga_gab5GdO5Tc.jpg', 'https://npcdn.ratopati.com/media/news/water-bottle_5cd38cc983e3b8ce28c9595b3133f63b_ToYxSmOjBx.avif', 'https://npcdn.ratopati.com/media/authors/ratopati_science_RGmmSpmAnu.jpg', 'https://npcdn.ratopati.com/media/news/danger-of-ai_a14eZKd6sa.jpg', 'https://npcdn.ratopati.com/media/news/deuba-gagan_G5WF8gLC73.jpg', 'https://npcdn.ratopati.com/media/news/UKB2PCDB6U.jpg', 'https://npcdn.ratopati.com/media/news/01-1776481757-o8lng_Y1bECmTeis.jpg', 'https://npcdn.ratopati.com/media/news/matdata-namabali-darta-(12)_reokQGrQgj.jpg', 'https://npcdn.ratopati.com/media/news/gagan-thapa_VVgrawger3.jpg', 'https://npcdn.ratopati.com/media/news/perisdanda-anasan_DTXgMNNzA6.jpg', 'https://npcdn.ratopati.com/media/news/durga_8l9uFh1qBa.png', 'https://npcdn.ratopati.com/media/news/image0_YgbX3Z9bBw.jpg', 'https://npcdn.ratopati.com/media/news/accident1_0HVVwEUEAJ.jpg', 'https://english.ratopati.com/build/img/logo-rp.png'}","काठमांडू। नेपाल बोतलबंद जल संघ प्रसंस्कृत पेयजल के दाम समायोजित (बढ़ाबय) के निर्णय लेलक अछि। एसोसिएशन के कहनाय छनि जे कच्चा माल के लागत मे काफी बढ़ोतरी आओर परिवहन खर्च मे बढ़ोतरी के कारण आब पहिने के दाम पर उद्योग के संचालन संभव नहिं अछि.

आय जारी एगो प्रेस विज्ञप्ति म॑ एसोसिएशन न॑ बतैलकै कि पानी उद्योग म॑ इस्तेमाल होय वाला कच्चा माल के दाम म॑ लगभग ४० प्रतिशत के बढ़ोत्तरी होय गेलऽ छै, जेकरा म॑ बोतल, कैप, रैपिंग रोल, जार, आरू जार कैप शामिल छै । एकरऽ अलावा एसोसिएशन न॑ नोट करलकै कि पेट्रोलियम केरऽ दाम बढ़ला के वजह स॑ परिवहन केरऽ लागत म॑ काफी बढ़ोत्तरी होय गेलऽ छै ।

संघ न॑ उल्लेख करलकै कि हाल केरऽ अंतरराष्ट्रीय स्थिति खास करी क॑ ईरान-इजरायल केरऽ तनाव आरू ईरान-अमेरिका केरऽ संबंध स॑ नेपाल केरऽ जल उद्योग प॑ सीधा असर पड़लऽ छै, जेकरा स॑ वैश्विक बाजार आरू आपूर्ति श्रृंखला प॑ असर पड़लऽ छै ।

बयान मँ कहलौ गेलौ छै, 'ई मुनाफा-उन्मुख फैसला नै बल्कि उत्पादन लागत मँ वृद्धि, परिवहन खर्च, आरू कच्चा माल केरौ बढ़तौ दाम के वजह स॑ पैदा होय वाला अनिवार्य स्थिति छै ।' लागत के अनुपात में दाम के समायोजन उद्योग के स्थायित्व, गुणवत्ता के रखरखाव, आ नियमित आपूर्ति के लेल एकटा अनिवार्य आवश्यकता बनि गेल अछि.'

एसोसिएशन सरकार स आग्रह केलक अछि जे औद्योगिक संचालन कए सुविधाजनक बनेबा, कच्चा माल क उपलब्धता सुनिश्चित करब, आ परिवहन लागत कए नियंत्रित करबा लेल आवश्यक कदम उठाउल जाए। महासचिव ध्रुव प्रसाद अधिकारी द्वारा जारी बयान में उपभोक्ता, वितरक, आरू हितधारकऽ स॑ भी अपील करलऽ गेलऽ छै कि हुनी ई मजबूर करै वाला स्थिति क॑ समझी क॑ सहयोग करी ।"
