title,description,published date,url,publisher.href,publisher.title,full_article,images,translated
"India A Vs Nepal Live Score, Women's Asia Cup Rising Stars: Follow Scorecard And Match Action From Bangkok - News18","India A Vs Nepal Live Score, Women's Asia Cup Rising Stars: Follow Scorecard And Match Action From Bangkok  News18",2026-02-17 02:32:53,https://news.google.com/rss/articles/CBMi_gFBVV95cUxQbVpLVTdlSUppcGtRRGE1d1RmYTNPTkM2NlNfd1hieHBjOXd0M3hDU3pkMEJJWlkyVzIzSF9sUy0tU051MEdPYzRUajFvX2ZoM0xzNnQwaUVmZlBReFN2RUIzOFI0WlVENEdDWmFiODl0Y3U1MWlVUVBVa0ZJQkstZWMtZFlhY0JhYnNVOEw0MjZOZndOU0g3RmVBY1IwcjBRc2pkczIxb3NveWJxN2gwVWVDMHJrVlNJVHYwSENHZnNSMmxyM1lweHdpNmdYVDlTR1FXVmxUT2k2bGtOUkFSOGhjM2NqckRjT2xEeWFXZy1PNmx1MXd6TVczRjFOd9IBgwJBVV95cUxPRFhReDhXWGo1QUM1YUdnRkRCY2FJNXEzRU5iTGo1eS1qRWxwVmRwZjVRMWFTUnZwcHZXZHE1RzA5TWNyM1QyRlZaTmpjM2FWbVdVLVVlNl9xbGQ3d21pZGFLODh1RUpsNGJCeVZNajEwcDhzcE9PODF1cWFSUEEwRG5hMTNsZlYwT1NOcERzUXdVZTVBbm9KUDhUMkZuZ0thZno4Rm5wUFBKRVZrR05aMEZ5bjBVMVRxSEtwS2JwXy15aHZyNGVMSTRqc0Y3dXpmSWVSNW9aZU1sYXAwR2ljamJIaXZyMVdhWG13TE52RjFISU9US0ZsQVJieEdTbDZXTThr?oc=5&hl=en-US&gl=US&ceid=US:en,https://www.news18.com,News18,"India A Woman Vs Nepal Women Live Score, Women’s Asia Cup Rising Stars: Tanuja Kanwer took 4/12 from four overs while Minnu Mani 3/8 as India A women skittled Nepal women for 78 in 18 overs after captain Radha Yadav won the coin toss and opted to bowl first in Bangkok.

India A bounced back after a shock defeat to UAE in their tournament opener. They crushed Pakistan A eight wickets and will eye another win today to put them in a strong position to qualify for the semifinals.

Playing XIs

India A Women: Deeya Yadav, Vrinda Dinesh, Anushka Sharma, Tejal Hasabnis, Radha Yadav (c), Mamatha Madiwala (wk), Tanuja Kanwer, Prema Rawat, Minnu Mani, Saima Thakor, Jintimani Kalita

Nepal Women: Bindu Rawal, Samjhana Khadka, Puja Mahato (c), Sita Rana Magar, Kabita Kunwar, Rubina Chhetri, Roma Thapa, Rubi Poddar (wk), Manisha Upadhayay, Anu Kadayat, Kabita Joshi","{'https://images.news18.com/dlxczavtqcctuei/news18/static/images/english/ask-search-icon.svg', 'https://images.news18.com/dlxczavtqcctuei/news18/static/images/english/cricketnext_logo_v2.svg', 'data:image/gif;base64,R0lGODlhAQABAAAAACH5BAEKAAEALAAAAAABAAEAAAICTAEAOw==', 'https://images.news18.com/ibnlive/uploads/2026/02/India-A-vs-Nepal-Live-Score-ACC-Women-Asia-Cup-Rising-Stars-2026-2026-02-20b7f363aaca70f0f256594eb228903e-16x9.jpg', 'https://images.news18.com/dlxczavtqcctuei/news18/static/images/english/ball.svg', 'https://images.news18.com/dlxczavtqcctuei/news18/static/images/english/new_whatsapp_icon.svg', 'https://images.news18.com/ibnlive/uploads/2026/02/India-A-vs-Nepal-Live-Score-ACC-Women-Asia-Cup-Rising-Stars-2026-2026-02-20b7f363aaca70f0f256594eb228903e-16x9.jpg?impolicy=website&width=640&height=360', 'https://images.news18.com/dlxczavtqcctuei/news18/static/images/english/bat.svg', 'https://images.news18.com/dlxczavtqcctuei/news18/static/images/english/zdcicon.png', 'https://images.news18.com/dlxczavtqcctuei/news18/static/images/english/new_share_icon.svg', 'https://images.news18.com/static_news18/pix/ibnhome/news18/images/default-218x145.jpg', 'https://images.news18.com/dlxczavtqcctuei/news18/static/images/english/font.svg', 'https://images.news18.com/dlxczavtqcctuei/news18/static/images/english/impact-short.svg', 'https://images.news18.com/ibnlive/uploads/2021/07/1627283897_news18_logo-1200x800.jpg?impolicy=website&width=100&height=75', 'https://images.news18.com/dlxczavtqcctuei/news18/static/images/english/rapid-read-icon-trans.png', 'https://sb.scorecardresearch.com/p?c1=2&c2=6683813&cv=3.9.1&cj=1', 'https://images.news18.com/dlxczavtqcctuei/news18/static/images/english/zoom-img.svg'}","भारत ए महिला बनाम नेपाल महिला लाइव स्कोर, महिला एशिया कप राइजिंग स्टार : तनुजा कानवेर न॑ चार ओवर स॑ ४/१२ जबकि मिन्नू मणि न॑ ३/८ के रूप म॑ भारत ए महिला न॑ नेपाल महिला क॑ १८ ओवर म॑ ७८ रन बनाबै के कामयाबी हासिल करलकै, जेकरा बाद कप्तान राधा यादव न॑ सिक्का टॉस जीती क॑ बैंकॉक म॑ पहलऽ गेंदबाजी करै के विकल्प चुनलकै ।

टूर्नामेंट केरऽ ओपनर मैच म॑ यूएई स॑ सदमा हार के बाद इंडिया ए न॑ वापसी करी लेलकै । पाकिस्तान ए क॑ आठ विकेट स॑ कुचललकै आरू आय एगो आरू जीत के नजर रखतै जेकरा स॑ ओकरा सेमीफाइनल म॑ जगह बनाबै के मजबूत स्थिति म॑ आबी जैतै ।

एकादश खेलते हुए

इंडिया ए महिला : दीया यादव, वृंदा दिनेश, अनुष्का शर्मा, तेजल हसबनीस, राधा यादव (ग), ममता मदीवाला (wk), तनुजा कानवेर, प्रेमा रावत, मिन्नू मणि, सैमा ठाकोर, जिंतिमणि कलिता

नेपाल महिला : बिन्दु रावल, सम्झाना खड्का, पूजा महतो (ग), सीता राणा मगर, कबिता कुँवर, रुबीना क्षेत्री, रोमा थापा, रूबी पोद्दार (wk), मनीषा उपाध्याय, अनु कदायत, कबिता जोशी"
Nepal seek positives in Scotland clash after Super 8 exit - kathmandupost.com,Nepal seek positives in Scotland clash after Super 8 exit  kathmandupost.com,2026-02-17 02:45:59,https://news.google.com/rss/articles/CBMiowFBVV95cUxQMzJGMjRDQ0RicXBFT05DZmlrVWxmQWJrSjQyM3RyYl8wZHE1QVBweW9LUDVXZDZCVEFLV1VVa1cwSHFEUzZsdHR2TkRnQmV4V3dxUG9hUkNRelNqVklHM3VldUV4X1A3MUZKNDdFdXQxUWNIT2dCNWpQLTBtVGlXaUZwcDlWZ0tSV25ndDFXX1c2VXpQWUJWdnEzd1VIUWVYdXh3?oc=5&hl=en-US&gl=US&ceid=US:en,https://kathmandupost.com,kathmandupost.com,"Nepal will look to salvage pride in their final group-stage fixture against Scotland after crashing out of the Super 8 race following three consecutive defeats in the ICC Men’s T20 World Cup.

The Rhinos’ elimination was confirmed after a nine-wicket defeat to the West Indies, who chased down Nepal’s 133/8 with ease. Shai Hope and Shimron Hetmyer guided the two-time champions home comfortably, exposing Nepal’s inability to defend modest totals.

Nepal’s campaign had begun with heartbreak. They pushed England to the brink before falling short by four runs in a last-over thriller—a match that showcased their ability to compete with Full Members but also highlighted finishing lapses.

Any momentum from that performance evaporated quickly when Nepal suffered their heaviest ever T20I defeat, against Italy by 10 wickets. The loss severely dented their net run rate and confidence, leaving them with no margin for error heading into the West Indies fixture.

Though, after seeing Italy put up a strong contest against England on Monday, Nepali fans would be relieved and believe that Italy were a good side. England defeated Italy by 24 runs while defending 203 runs.

Meanwhile, with three losses in a row, Nepal’s consultant coach Nic Pothas said the team’s biggest concern has been their failure to adapt quickly enough at the global level.

“There’s a lot of skill in the room, but we’re not learning fast enough as a group,” Pothas said ahead of the Scotland match. “At a World Cup, you don’t get away with not executing plans.”

“The England game was a classic example of executing plans,” Pothas added. “The Italy game…that was a classic example of not following plans.”

“So leading into the Scotland game, you know all we want to see guys do is compete but not make the same errors we are making repeatedly. That's the important part,” said Pothas.

Pothas has been with the Nepali team since Nepal toured Scotland in June last year. A former wicketkeeper-batsman, Pothas has formerly worked at different roles with the senior men’s teams of Sri Lanka, the West Indies and Bangladesh.

He pointed to exposure as a key gap, noting that many Nepali players are more accustomed to home conditions.

“For these players a lot of their cricket is played in Nepal where the wickets suit their style of play, and you can get away with not executing quite as much because of the standard of the cricket,” Pothas said. “But when you come to a World Cup, you don't get away with that kind of thing.”

Reiterating what Shai Hope said just before his pre-match press conference, Pothas stressed that Nepali players had more to learn.

“Still learnings for them…As long as we are playing cricket at this level, we gotta make sure we are learning,” Hope had said regarding Nepal after the West Indies handed them a nine-wicket defeat on Sunday.

And Pothas argued, “Even we guys as dinosaurs are learning every day. But we're expecting the players to learn quicker now. What makes that a little bit more difficult is exposure to various conditions and exposure to high level cricket.”

Against Scotland on Tuesday, the Nepali side will be looking for consolation to thousands of Nepali fans who have spent thousands of rupees to reach Mumbai and cheer for the Rhinos.

“You know we're a very energetic side, a very passionate side with a great following that have come to watch us play,” Pothas continued. “So we'd like to give that following something to remember this World Cup.”

Nepal will play Scotland at 7pm local time on Tuesday. But the Scottish side will not let Nepal get their consolation win so easily.

Speaking to journalists at the pre-match press conference on Monday, Scotland’s Tom Bruce, for whom it will be his first encounter against the Rhinos, said that he was excited to play in front of the passionate Nepali crowd.

“The support that they get, whether they're at home or away, is outstanding. So just looking forward to a really, really good contest tomorrow,” Bruce said. “Hopefully, we can put on a really good show for everyone that turns up and like I say play some exciting cricket I know both teams will want to finish on a high note for this World Cup.”

Bruce, who played for New Zealand for three years (2017-2020), added, “You see the success stories of Nepal and Italy in this tournament. You want to see more nations playing cricket and you want to see them playing against the best nations. So obviously that decision and how they go about that is far above my pay grade. But yeah, certainly when you look at the World Cup as a whole, it's exciting watching associate nations play against tier one nations, pushing them all the way.”","{'https://jcss-cdn.kathmandupost.com/assets/images/logos/thekathmandupost-logo.png', 'https://jcss-cdn.kathmandupost.com/assets/images/lazy.png', 'https://jcss-cdn.kathmandupost.com/assets/images/logo-sticky-bar-tkp-weekender-1.png', 'https://jcss-cdn.kathmandupost.com/assets/images/logos/thekathmandupost-logo-white.png', 'https://jcss-cdn.kathmandupost.com/assets/images/tkp-logo-weekender.png', 'https://assets-cdn.kathmandupost.com/uploads/source/news/2026/sports/SP-1771296089.jpg', 'https://openweathermap.org/img/w/50d.png'}","आईसीसी पुरुष टी-२० विश्व कप म॑ लगातार तीन हार के बाद सुपर ८ दौड़ स॑ बाहर होय क॑ स्कॉटलैंड के खिलाफ ग्रुप स्टेज केरऽ अंतिम मुकाबला म॑ नेपाल गौरव बचाबै के कोशिश करतै ।

नेपाल केरऽ १३३/८ के स्कोर क॑ सहजता स॑ पीछा करी क॑ वेस्टइंडीज स॑ ९ विकेट के हार के बाद गैंडा केरऽ बाहर होय के पुष्टि होय गेलै । शाई होप आरू शिमरोन हेटमायर न॑ दू बार के चैंपियन टीम क॑ आराम स॑ घर लेली मार्गदर्शन करलकै, जेकरा स॑ नेपाल केरऽ मामूली कुल के रक्षा करै म॑ असमर्थता के खुलासा करलऽ गेलै ।

नेपाल’क अभियान हृदयविदारक संग शुरू भ’ गेल छल. आखिरी ओवर केरऽ थ्रिलर म॑ चार रन स॑ कम होय स॑ पहल॑ इंग्लैंड क॑ कगार प॑ धकेल॑ देलकै-एक ऐसनऽ मैच जेकरा म॑ फुल सदस्यऽ स॑ मुकाबला करै के हुनकऽ क्षमता के प्रदर्शन करलऽ गेलै लेकिन फिनिशिंग लैप्स प॑ भी प्रकाश डाललऽ गेलै ।

ओहि प्रदर्शन स कोनो गति जल्दीए वाष्पित भ गेल जखन नेपाल कए टी-20 मे एखन धरि क सबस भारी हार भेल, इटली क खिलाफ 10 विकेट स। ई हार स॑ ओकरऽ नेट रन रेट आरू आत्मविश्वास म॑ भारी गिरावट आबी गेलै, जेकरा चलतें वेस्टइंडीज केरऽ फिक्सर म॑ जाय क॑ ओकरा गलती के कोय अंतर नै मिललै ।

हालांकि सोमदिन इटली के इंग्लैंड के खिलाफ मजबूत मुकाबला देखला के बाद नेपाली प्रशंसक के राहत मिलत आओर ओ मानत जे इटली नीक टीम अछि. इंग्लैंड इटली क॑ २४ रन स॑ हराबै के साथ-साथ २०३ रन के रक्षा करलकै ।

एम्हर, लगातार तीन हार के संग नेपाल के कंसल्टेंट कोच निक पोथास कहलनि जे टीम के सबस पैघ चिंता वैश्विक स्तर पर काफी जल्दी एडजस्टमेंट नहि करब रहल अछि।

स्कॉटलैंड केरऽ मैच स॑ पहल॑ पोथास न॑ कहलकै कि कमरा म॑ बहुत स्किल छै, लेकिन हम्मं॑ ग्रुप के रूप म॑ पर्याप्त तेजी स॑ नै सीखी रहलऽ छियै । “विश्व कप मे योजना निष्पादित नहि करबा स’ अहाँ नहि बचि जाइत छी.”

पोथास न॑ आरू कहलकै कि इंग्लैंड केरऽ खेल योजना क॑ निष्पादित करै के एगो क्लासिक उदाहरण छेलै । “इटली के खेल...ओ योजना के पालन नै करय के एकटा क्लासिक उदाहरण छल.”

पोथास कहलकै, ""त॑ स्कॉटलैंड केरऽ खेल म॑ अग्रणी होय क॑ आपने क॑ पता छै कि हम्में बस लड़का सिनी क॑ प्रतिस्पर्धा करना देखना चाहै छियै लेकिन वू गलती नै करै छै जेकरा हम्में बार-बार करी रहलऽ छियै । यही महत्वपूर्ण हिस्सा छै ।""

पिछला साल जून मे नेपाल स्कॉटलैंड के दौरा केलाक बाद सं पोथास नेपाली टीम के संग छथिन्ह. पूर्व विकेटकीपर-बल्लेबाज पोथास न॑ पहल॑ श्रीलंका, वेस्टइंडीज आरू बांग्लादेश केरऽ सीनियर पुरुष टीम के साथ अलग-अलग भूमिका प॑ काम करी चुकलऽ छै ।

ओ एक्सपोजर के एकटा प्रमुख अंतर के रूप में इशारा करैत कहलनि जे, बहुतो नेपाली खिलाड़ी के घर के हालत के बेसी आदत छनि।

पोथास कहलकै, “ई खिलाड़ी सिनी लेली हुनकऽ बहुत सारा क्रिकेट नेपाल म॑ खेललऽ जाय छै, जहां विकेट हुनकऽ खेल के शैली के अनुरूप होय छै, आरू क्रिकेट केरऽ स्तर के वजह स॑ आपने काफी निष्पादन नै करला स॑ दूर होय सकै छियै । “मुदा जखन विश्व कप मे अबैत छी त’ ओहि तरहक बात सँ नहि बचि जाइत छी।”

मैच स पहिने अपन प्रेस कॉन्फ्रेंस स ठीक पहिने शाई होप कहला कए दोहरबैत पोथास नेपाली खिलाड़ी कए आओर किछु सीखबाक अछि, एहि पर जोर देलथि।

‘हुनका सब लेल एखनो सीख अछि...जखन धरि हम सब एहि स्तर पर क्रिकेट खेलाइत छी, हमरा सब कए इ सुनिश्चित करबाक अछि जे हम सब सीख रहल छी।

आरू पोथास केरऽ तर्क छेलै, ""डायनासोर के रूप म॑ हम्में सब भी रोज सीखी रहलऽ छियै ।लेकिन हम्में ई उम्मीद करी रहलऽ छियै कि खिलाड़ी सब अब॑ जल्दी सीखतै । जेकरा स॑ ई बात कनी मुश्किल होय जाय छै, वू छै विभिन्न परिस्थिति के सामना करना आरू उच्च स्तरीय क्रिकेट के संपर्क म॑ ऐना।""

मंगलदिन स्कॉटलैंड के खिलाफ नेपाली टीम हजारों नेपाली प्रशंसक के सांत्वना ताकत जे मुंबई पहुंचय आ गैंडा के जयकार करय लेल हजारों रुपया खर्च केने छथिन्ह.

पोथास आगू कहलकै, “अहाँ क॑ पता छै कि हम्में बहुत ऊर्जावान पक्ष छियै, बहुत भावुक पक्ष छियै जेकरऽ एगो बढ़िया फॉलोइंग छै जे हमरा सब क॑ खेलतें देखै लेली ऐलऽ छै । “त’ हम चाहब जे ओहि फॉलोइंग केँ एहि विश्व कप केँ याद करबाक लेल किछु देब।”

मंगलदिन स्थानीय समय के अनुसार साँझ ७ बजे नेपाल आ स्कॉटलैंड के बीच मैच खेलत । मुदा स्कॉटिश टीम नेपाल के एतेक आसानी सं अपन सांत्वना जीत नहिं मिलय देत.

सोमदिन मैच स॑ पहल॑ आयोजित प्रेस कॉन्फ्रेंस म॑ पत्रकारऽ स॑ बात करतें हुअ॑ स्कॉटलैंड केरऽ टॉम ब्रूस, जेकरा लेली ई हुनकऽ पहिलऽ मुठभेड़ गैंडा के खिलाफ होतै, न॑ कहलकै कि हुनी भावुक नेपाली भीड़ के सामने खेलै लेली उत्साहित छै ।

ब्रूस कहलनि जे, हुनका सब के जे समर्थन भेटैत छनि, चाहे ओ घर पर होथि या बाहर, ओ बकाया अछि, ताहि लेल बस काल्हि सचमुच, सचमुच नीक मुकाबला के इंतजार अछि। “आशा छै कि हम सब के लेलऽ सचमुच अच्छा शो लगाय सकै छियै जे सामने आबै छै आरू जेना कि हम्में कहै छियै कि कुछ रोमांचक क्रिकेट खेलऽ हमरा पता छै कि ई विश्व कप लेली दोनों टीम हाई नोट प॑ खतम करना चाहतै।”

तीन साल (2017-2020) न्यूजीलैंड के लेल खेलय वाला ब्रूस आगू कहलनि जे, ""अहाँ एहि टूर्नामेंट मे नेपाल आ इटली के सफलता के कहानी देखैत छी। अहां चाहैत छी जे बेसी राष्ट्र क्रिकेट खेलैत देखय चाहैत छी आ ओकरा सर्वश्रेष्ठ राष्ट्र के खिलाफ खेलैत देखय चाहैत छी।त जाहिर अछि जे ओ निर्णय आओर ओ कोना ओहि काज मे चलैत अछि, हमर वेतन ग्रेड सं बहुत ऊपर अछि. मुदा हाँ, निश्चित रूप सं जखन अहां समग्र रूप सं विश्व कप के देखब त ई रोमांचक देखय वाला सहयोगी अछि राष्ट्र टीयर वन राष्ट्र के खिलाफ खेलै छै, ओकरा पूरा रास्ता धकेल दै छै।”"
