title,description,published date,url,publisher.href,publisher.title,full_article,images,translated
"Nepal News Evening Briefing | Thursday, June 11, 2026 - Nepalnews.com","Nepal News Evening Briefing | Thursday, June 11, 2026  Nepalnews.com",2026-06-11 13:49:45,https://news.google.com/rss/articles/CBMikAFBVV95cUxOQnZEZkluYThwb3dsUXVqZ1A2ME85bGR6ZzVkYlZteG5PdlR2ZGkwQlpaYkpfRFdETm1CSTF6eU5UZ3lWNllPS1dkTTM4RmhrRkNjUXAwcnJvUU90ZlVIUkVfM2RpQmExSk43bGNfdUtkY2dhQVh4OXlneDdtMHFrOXlhdEF2ckhaaUFVVUgtSXg?oc=5&hl=en-US&gl=US&ceid=US:en,https://english.nepalnews.com,Nepalnews.com,,,
Bhishma Raj Angdembe: The unlikely voice reviving Nepal’s opposition - Nepalnews.com,Bhishma Raj Angdembe: The unlikely voice reviving Nepal’s opposition  Nepalnews.com,2026-06-11 13:54:46,https://news.google.com/rss/articles/CBMirAFBVV95cUxONHhVQW9meWJnTFhSNFZiUmxoT0tMZk1IMy11SFM3OUUyY0RyOFdmUkNsUHlRSUZGdWNTZ0dfaGpCSlFzSk5rNGN0eVZITWZPeXFnMFZkbUUxRmhWSngzcWw5YXNMNThjZ3hLdXlFd3M2MHpwdDRFd2JVQV9oZHZLWXVib09VYXFzY01pTmoyTjBYZjktV205c3hBMV9saXhtMU1PcS02THFBT1hN?oc=5&hl=en-US&gl=US&ceid=US:en,https://english.nepalnews.com,Nepalnews.com,,,
Nepal suspends three Chinese doctors linked to illegal Baluwatar hospital - The Kathmandu Post,Nepal suspends three Chinese doctors linked to illegal Baluwatar hospital  The Kathmandu Post,2026-06-11 13:58:58,https://news.google.com/rss/articles/CBMiuAFBVV95cUxOMEhnb3FWTlJIUDh3Yk44TGVjdG9FYVFIdHZUR3ozZ251MVhaOTFQNzloQlNkOTA0RGpxSjJLdEEtVEw0VHF5UFg2SjZhNkxHZ1ZFSDR3bWlvX0s4bGV2RGxrUXloVmU5dk9ySnQ4c3dLbUN0TlhPTGhPZUhRZVdpM1FEOWJVQVVsLWFvbEpzZ09EbDNSaFdlT3dXQU1ieWljR19nVDFyRVo0RFhaSGFoMnpsQWwzOFRJ?oc=5&hl=en-US&gl=US&ceid=US:en,https://kathmandupost.com,The Kathmandu Post,"Three Chinese doctors face possible deportation from Nepal after the Nepal Medical Council (NMC) suspended their temporary registrations over their involvement in an illegally operating hospital in Kathmandu.

The council, the national regulator of medical doctors and dentists, said that it had granted temporary permission to the Chinese doctors to work in Nepal but had not authorised them to practise at the illegally operating hospital.

“We found that they were affiliated with an illegally operating hospital in Kathmandu and were practising medicine there,” said Dipendra Pandey, acting registrar of the council. “The hospital, which had been operating for over seven months, has been found luring patients through misleading information on social media and charging excessively.”

The three Chinese doctors whose temporary registrations were suspended are Dr Ou Xianlin, Dr Chen Xiaolin, and Dr Liu Jiqin.

Officials at the council said that the Chinese doctors are not on tourist visas and that they no longer have a legal basis to remain in Nepal after their temporary registrations were suspended. Foreign doctors are not allowed to examine patients in Nepal without obtaining permission from the council.

“We have also written to the Department of Health Services to coordinate with the Department of Immigration to deport the Chinese doctors, as their stay in Nepal has become illegal,” an official at the council told the Post requesting anonymity, as the issue is serious and could impact relations with the northern neighbour. “We avoid using harsh words, but the issue is serious in itself.”

A full board meeting of the council held on Wednesday also wrote to the Kathmandu Metropolitan City, recommending that it seal the Baluwatar-based Maria Hospital, which has been operating without approval from the Ministry of Health and Food Safety or any other relevant agency.

Officials say it is now up to the Kathmandu Metropolitan City and other state agencies to decide when to shut down the hospital.

Along with that, the national regulator has also written to the District Administration Office and the District Police Range, Kathmandu, urging them to investigate the hospital and its activities and take legal action.

Council members, who visited Maria Hospital, said the hospital administration had been found misusing the names and license numbers of Nepali doctors in advertisements on social media and on signboards.

“We have also sought clarification from Nepali doctors working at Maria Hospital. They have been asked to respond within three days,” said Pandey. “Further action will be taken after studying their clarifications.”

Council officials said they have been investigating several complaints involving illegally operating hospitals and health facilities across the country. They also urged the general people to inform the council about unlicenced health facilities and any wrongdoing committed by them.","{'https://assets-cdn.kathmandupost.com/uploads/source/news/2026/third-party/thumb1-1781186258.jpg', 'https://openweathermap.org/img/w/03n.png', 'https://jcss-cdn.kathmandupost.com/assets/images/tkp-logo-weekender.png', 'https://jcss-cdn.kathmandupost.com/assets/images/lazy.png', 'https://jcss-cdn.kathmandupost.com/assets/images/logos/thekathmandupost-logo-white.png', 'https://jcss-cdn.kathmandupost.com/assets/images/logos/thekathmandupost-logo.png', 'https://jcss-cdn.kathmandupost.com/assets/images/logo-sticky-bar-tkp-weekender-1.png'}","काठमांडूके अवैध रूपसँ संचालित अस्पतालमे संलग्नताके कारण नेपाल मेडिकल काउन्सिल (एनएमसी) अस्थायी पंजीकरण निलंबित केलाक बाद तीनटा चीनी चिकित्सकके नेपालसँ संभावित निर्वासनके सामना करय पड़ि रहल अछि ।

मेडिकल डाक्टर आ दंत चिकित्सकक राष्ट्रीय नियामक परिषद् चीनी चिकित्सक केँ नेपाल मे काज करबाक अस्थायी अनुमति देलक मुदा अवैध तरीका सँ संचालित अस्पताल मे प्रैक्टिस करबाक लेल अधिकृत नहि केने बतौलक अछि ।

परिषद्के कार्यवाहक रजिस्ट्रार दिपेन्द्र पाण्डेय कहलनि जे, हमरा सबके पता चलल जे ओ सब काठमांडू के अवैध तरीका स संचालित अस्पताल स जुड़ल छल आ ओतय चिकित्सा के अभ्यास क रहल छल। “सात महीना स॑ भी अधिक समय स॑ चलै वाला ई अस्पताल सोशल मीडिया प॑ भ्रामक जानकारी के माध्यम स॑ मरीजऽ क॑ लुभाबै वाला आरू बेसी शुल्क लेत॑ मिललऽ छै ।”

चीनी तीनटा डॉक्टर जिनकर अस्थायी पंजीकरण निलंबित भ गेल छल ओ छथि डॉ ओउ जियानलिन, डॉ चेन जिओलिन, आ डॉ. लियू जिकिन।

परिषद्के अधिकारीसब चीनी डाक्टरसब पर्यटक वीजामे नै रहल आ अस्थायी रजिस्ट्रेशन स्थगित भेलाक बाद नेपालमे रहबाक कानूनी आधार नै रहल बतौलनि । नेपाल मे विदेशी चिकित्सक के परिषद् स अनुमति नै लेले मरीज के जांच करय के अनुमति नहि अछि।

परिषद् केरऽ एगो अधिकारी न॑ नाम नै बताबै के आग्रह करतें हुअ॑ पोस्ट क॑ कहलकै कि चीनी चिकित्सकऽ क॑ देश निकाला करै लेली आप्रवासन विभाग के साथ समन्वय करै लेली स्वास्थ्य सेवा विभाग क॑ भी लिखलऽ छियै, कैन्हेंकि हुनकऽ नेपाल म॑ ठहरना गैरकानूनी होय गेलऽ छै । “हम कठोर शब्दक प्रयोग सँ बचैत छी, मुदा मुद्दा अपने आप मे गंभीर अछि।”

बुधदिन आयोजित परिषद्क पूर्ण बोर्ड बैसार मे सेहो काठमांडू महानगर केँ पत्र लिखि स्वास्थ्य आ खाद्य सुरक्षा मन्त्रालय वा कोनो आन संबंधित एजेंसीक अनुमोदन बिना संचालित बालुवातार स्थित मारिया अस्पताल केँ सील करबाक अनुशंसा कएल गेल अछि ।

अधिकारी सब के कहनाय छनि जे आब अस्पताल के कहिया बंद करय के फैसला काठमांडू महानगर आ राज्य के अन्य एजेंसी पर अछि.

एकरऽ साथ-साथ राष्ट्रीय नियामक न॑ जिल्ला प्रशासन कार्यालय आरू जिल्ला प्रहरी रेंज, काठमांडू क॑ भी चिट्ठी करी क॑ अस्पताल आरू ओकरऽ गतिविधि के जांच करी क॑ कानूनी कार्रवाई करै के आग्रह करल॑ छै ।

मारिया अस्पतालमे गेल परिषद् सदस्यसभ सोशल मिडिया आ साइनबोर्डमे विज्ञापनमे नेपाली चिकित्सकके नाम आ लाइसेंस नम्बरके दुरुपयोग करैत देखल गेल बतौलनि ।

‘मारिया अस्पतालमे कार्यरत नेपाली चिकित्सकसबसँ सेहो स्पष्टीकरण मँगलने छी, तीन दिनक भीतर प्रतिक्रिया देबऽ लेल कहल गेल अछि ।’ पाण्डेय कहलनि । “हुनकर स्पष्टीकरणक अध्ययनक बाद आओर कार्रवाई कएल जाएत।”

परिषद के अधिकारी के कहनाय छनि जे ओ देश भर मे अवैध तरीका सं अस्पताल आओर स्वास्थ्य सुविधा सं जुड़ल कईटा शिकायत के जांच करि रहल छथिन्ह. संगहि ओ सब आम लोक स आग्रह केलथि जे ओ सब परिषद कए बिना लाइसेंस क स्वास्थ्य सुविधा आ हुनका द्वारा कैल गेल कोनो गलत काज क जानकारी देथि।"
IMF Urges Nepal to Legalize Cryptocurrencies - ForkLog,IMF Urges Nepal to Legalize Cryptocurrencies  ForkLog,2026-06-11 14:45:57,https://news.google.com/rss/articles/CBMid0FVX3lxTE5MdkNkNWswQ196MDBqV19fNkxVclk5WUFsT3VmM3BpbGF0SUVnc1Z2ejBYYzBEcEc1Rk1nSXRkc0NvVFZ6MS1waWRKZWVjZnlfbUNYZE5yLWdaelBSVzZNVHZVUFdzTUw1SC1qcG53NnlrRU9FbE1r?oc=5&hl=en-US&gl=US&ceid=US:en,https://forklog.com,ForkLog,"AI translated #Cryptocurrencies#IMF#Nepal

IMF Urges Nepal to Legalize Cryptocurrencies

IMF noted a significant increase in cryptocurrency use in Nepal.

11.06.2026 ForkLog

The International Monetary Fund (IMF) noted a significant increase in cryptocurrency use in Nepal, despite a complete ban in the country.

According to the organization’s report, the influx of digital assets in Nepal began to rise sharply in 2019. By 2021, transaction volumes exceeded 13% of the country’s GDP, amounting to $2.6 billion. By 2024, the figure stabilized at 8%. The majority of operations involved stablecoins.

In 2021, Nepal’s central bank banned trading, mining, and any operations with digital assets. However, IMF statistics showed that the measures were ineffective. In terms of crypto flows, the country surpassed neighboring Myanmar and Bangladesh, but significantly lagged behind Vietnam.

The IMF recommended that authorities shift from bans to regulation according to international standards. According to the fund’s experts, this would help control the outflow of bank deposits and prevent circumvention of currency controls.

Experts noted that the use of digital assets for remittances and trading makes them in demand even in closed markets. Nepal’s experience with blocking social networks also demonstrated the ineffectiveness of such restrictions: residents massively switched to decentralized services.

The IMF will continue to monitor Nepal’s financial stability. The organization insists on implementing consumer protection mechanisms in the crypto industry.

In April 2026, the International Monetary Fund warned that the growth of the RWA market could increase risks to the global financial system and accelerate the spread of crises.

Follow ForkLog on social media Telegram (main channel) Facebook X

Found a mistake in the text? Select it and press CTRL+ENTER","{""data:image/svg+xml,%3Csvg%20xmlns='http://www.w3.org/2000/svg'%20viewBox='0%200%20108%2054'%3E%3C/svg%3E"", 'https://forklog.com/wp-content/themes/forklogv2/img/logo2025en.svg', 'https://forklog.com/wp-content/uploads/network-abstraction-single-interface-for-all-blockchains-cryptocurrency-network-abstraktsiya-seti-edinyi-interfei-s-dlya-vseh-blokchei-nov-kriptovalyuty-set.webp', 'https://mc.yandex.ru/watch/25974934'}","एआई अनुवाद # क्रिप्टोकरेंसी # आईएमएफ # नेपाल

आईएमएफ नेपालसँ क्रिप्टोकरेंसीकेँ वैधीकरण करबाक आग्रह

आईएमएफ नेपाल मे क्रिप्टोकरेंसी के उपयोग मे काफी बढ़ोतरी के नोट केलक अछि.

11.06.2026 फोर्कलॉग

अन्तर्राष्ट्रिय मुद्रा कोष (आईएमएफ) देशमे पूर्ण प्रतिबंधक बादो नेपालमे क्रिप्टोकरेंसीक उपयोगमे काफी वृद्धि देखलक अछि ।

संगठन के रिपोर्ट के अनुसार नेपाल में डिजिटल संपत्ति के आवागमन 2019 में भारी बढ़ोतरी होबय लागल छल.2021 तक लेनदेन के मात्रा देश के सकल घरेलू उत्पाद के 13% सं बेसी भ गेल छल, जे 2.6 अरब डॉलर भ गेल छल. 2024 तक इ आंकड़ा 8% पर स्थिर भ गेल। अधिकांश संचालन मे स्थिर सिक्का शामिल छल ।

2021 मे नेपाल के केंद्रीय बैंक डिजिटल संपत्ति के संग व्यापार, खनन, आओर कोनो तरहक परिचालन पर रोक लगा देलक. मुदा आईएमएफ के आंकड़ा बता रहल अछि जे ई उपाय बेअसर अछि. क्रिप्टो फ्लो के मामला म॑ ई देश पड़ोसी देश म्यांमार आरू बांग्लादेश क॑ पछाड़ी म॑ छोड़ी देलकै, लेकिन वियतनाम स॑ काफी पीछे छै ।

आईएमएफ न॑ सिफारिश करलकै कि अधिकारियऽ क॑ अंतरराष्ट्रीय मानक के अनुसार प्रतिबंध स॑ नियमन म॑ बदललऽ जाय । फंड के विशेषज्ञ के अनुसार एहि सं बैंक जमा के बहिर्वाह के नियंत्रित करय मे मदद मिलत आओर मुद्रा नियंत्रण के दरकिनार नहि होएत.

विशेषज्ञऽ न॑ नोट करलकै कि रेमिटैंस आरू ट्रेडिंग लेली डिजिटल संपत्ति के इस्तेमाल स॑ बंद बाजारऽ म॑ भी एकरऽ मांग होय जाय छै । सामाजिक संजाल अवरुद्ध करय के नेपाल के अनुभव सेहो एहि तरहक प्रतिबंध के अप्रभावीता के दर्शाबैत छल: निवासी भारी मात्रा मे विकेंद्रीकृत सेवा पर आबि गेलाह.

आईएमएफ नेपालक वित्तीय स्थिरता पर नजरि राखत। ई संगठन क्रिप्टो उद्योग मँ उपभोक्ता संरक्षण तंत्र लागू करै के जिद करै छै ।

अप्रैल २०२६ म॑ अंतर्राष्ट्रीय मुद्रा कोष न॑ चेतावनी देल॑ छेलै कि आरडब्ल्यूए बाजार केरऽ विकास स॑ वैश्विक वित्तीय प्रणाली प॑ जोखिम बढ़ी सकै छै आरू संकट केरऽ प्रसार म॑ तेजी आबी सकै छै ।

सोशल मीडिया टेलीग्राम (मुख्य चैनल) फेसबुक एक्स पर फोर्कलॉग के फॉलो करू

पाठ मे कोनो गलती भेटल? एकरा चुनू आ CTRL+ENTER दबाउ"
The IMF calls on Nepal to establish a cryptocurrency regulatory framework and closely monitor the flow of stablecoins - WEEX,The IMF calls on Nepal to establish a cryptocurrency regulatory framework and closely monitor the flow of stablecoins  WEEX,2026-06-11 14:46:17,https://news.google.com/rss/articles/CBMihgJBVV95cUxQeGgwRVdjbDRoT043am43QVJVQXV2dkM4X1pQWGZFdld4cm9uMC1UQkhIUTJkVGNBSTVUQlpmTDNRX0MxZHVtWXBRUHhVWlRrNUQyMlRHY3VCQnN1REF2c3VvWHJPb1Zmd1VqS2FiOFZCU19wdl9qT2t1Zl9SVWpyQU5yNXFTTkZwQ3h2cFIyaWxyRjd4TFB0c1RnYlhSdDJIR2p5eHJrc0pNVkxMYzVGUzFoSV9jLW5NVUVycXF1ZElQRGUyNXo5T201VWVkcXRobWx6R2ZIN3paUXNGcTFCcTJIY19FQXN3WDlSV3lIdGNsb0tHM0xtV3NVTE9zcVRKWjJ3V1VB?oc=5&hl=en-US&gl=US&ceid=US:en,https://www.weex.com,WEEX,"According to Decrypt, the IMF stated in its latest annual assessment of Nepal that despite Nepal's comprehensive ban on cryptocurrency trading and mining since 2021, the inflow of cryptocurrencies and stablecoins grew rapidly between 2019 and 2024, exceeding 13% of GDP at one point in 2021 and rebounding to about 8% in 2024, with cross-border flows accounting for about 5% of GDP.

The IMF recommended that Nepal establish a cryptocurrency regulatory framework in accordance with international standards, strengthen monitoring of stablecoins and unpegged crypto assets to prevent circumvention of capital controls and large-scale deposit outflows, and urged it to complete the FATF action plan and exit the gray list.","{'https://d2tfhb4luz96yb.cloudfront.net/otc/images/contract_pro_coin_img/969c66680ff512bf591e79bc69c0604c.png', 'https://www.weex.com/pages_static/_next/static/media/freeRate.07f243bf.svg', 'https://www.weex.com/pages_static/_next/static/media/icon-twitter.b53c90d8.svg', 'https://www.weex.com/pages_static/_next/static/media/stocks.988e7dbe.svg', 'https://s2.coinmarketcap.com/static/img/coins/64x64/26548.png', 'https://images-cms.weex.com/medium_24_18140364e2.png?format=avif', 'https://www.weex.com/pages_static/_next/static/media/icon-coin-market-cap.e1b45deb.svg', 'https://images-cms.weex.com/medium_38_3ccd289b45.png?format=avif', 'https://www.weex.com/pages_static/_next/static/media/h5_header_logo.2f645dc8.svg', 'https://www.weex.com/pages_static/_next/static/media/icon-cryptowisser.04a3918b.svg', 'https://images-cms.weex.com/medium_34_874859b143.png?format=avif', 'https://www.weex.com/pages_static/_next/static/media/icon-discord.152c6000.svg', 'https://images-cms.weex.com/medium_37_d544230b33.png?format=avif', 'https://images-cms.weex.com/medium_01_76947305d1.png?format=avif', 'https://images-cms.weex.com/medium_10_5acc261b9b.png?format=avif', 'https://www.weex.com/pages_static/_next/static/media/icon-linkedin.baae37df.svg', 'https://media.weex.com/img/open_graph.png', 'https://images-cms.weex.com/medium_7_ca1b7746d1.png?format=avif', 'https://images-cms.weex.com/medium_39_645e9f2336.png?format=avif', 'https://images-cms.weex.com/medium_16_c530d6305c.png?format=avif', 'https://images-cms.weex.com/medium_31_556776148b.png?format=avif', 'https://images-cms.weex.com/medium_EN_1600_900_4_2ec4d022b7.png?format=avif', 'https://www.weex.com/pages_static/_next/static/media/icon-facebook.64034ff7.svg', 'https://www.weex.com/pages_static/_next/static/media/icon-telegram.18bab0d3.svg', 'https://images-cms.weex.com/medium_19_79f5ad314d.png?format=avif', 'https://www.weex.com/pages_static/_next/static/media/logoweex_black.8cc81463.svg', 'https://images-cms.weex.com/medium_9_8dc682caea.png?format=avif', 'https://d2tfhb4luz96yb.cloudfront.net/otc/images/contract_pro_coin_img/509409ec3551dced32c59075184c6fb4.png', 'https://images-cms.weex.com/medium_33_70806c0ee0.png?format=avif'}","डिक्रिप्ट के अनुसार आईएमएफ न॑ नेपाल केरऽ अपनऽ नवीनतम वार्षिक आकलन म॑ कहलकै कि २०२१ स॑ नेपाल न॑ क्रिप्टोकरेंसी व्यापार आरू खनन प॑ व्यापक प्रतिबंध लगैला के बावजूद २०१९ आरू २०२४ के बीच क्रिप्टोकरेंसी आरू स्टेबलकोइन केरऽ आवक म॑ तेजी स॑ वृद्धि होय गेलै, जे २०२१ म॑ एक समय म॑ सकल घरेलू उत्पाद केरऽ १३% स॑ अधिक होय गेलै आरू लगभग उछली क॑ लगभग बढ़ी गेलै 2024 मे 8% छल, जखन कि सीमा पार क प्रवाह सकल घरेलू उत्पाद क लगभग 5% छल ।

आईएमएफ न॑ नेपाल क॑ अंतरराष्ट्रीय मानक के अनुसार क्रिप्टोकरेंसी नियामक ढाँचा स्थापित करै के सिफारिश करलकै, पूंजी नियंत्रण आरू बड़ऽ पैमाना प॑ जमा बहिर्वाह के दरकिनार नै करै लेली स्टेबलकोइन आरू अनपेग क्रिप्टो संपत्ति के निगरानी क॑ मजबूत करै के सिफारिश करलकै आरू एफएटीएफ केरऽ कार्य योजना पूरा करी क॑ ग्रे सूची स॑ बाहर निकलै के आग्रह करलकै ।"
