title,description,published date,url,publisher.href,publisher.title,full_article,images,translated
Green financing allows women in Nepal to shape their own futures - UNEP,Green financing allows women in Nepal to shape their own futures  UNEP,2024-01-30 04:28:58,https://news.google.com/rss/articles/CBMiZmh0dHBzOi8vd3d3LnVuZXAub3JnL25ld3MtYW5kLXN0b3JpZXMvc3RvcnkvZ3JlZW4tZmluYW5jaW5nLWFsbG93cy13b21lbi1uZXBhbC1zaGFwZS10aGVpci1vd24tZnV0dXJlc9IBAA?oc=5&hl=en-US&gl=US&ceid=US:en,https://www.unep.org,UNEP,"As a single parent in her late 30s, Ganga Didi long worried about being able to provide for her child. Barely able to survive on her wages from cleaning office buildings in Kathmandu, she started looking for better opportunities.

One option was to learn to drive a safa tempo, a small three-wheel electric bus that is a common feature of Nepal’s congested capital. In the 1990s, Kathmandu introduced around 700 of these buses as a pollution-busting measure, a move that also helped reduce greenhouse gas emissions.

To pay for driving lessons, Didi took out a small loan with help from Aloi. The start-up channels low-interest financing to entrepreneurs engaged in green ventures. Two years on, Didi is a full-time bus driver earning double what she used to make and is even saving money to buy an electric three-wheeler of her own.

“To see that transformation is really fulfilling,” says Sonika Manandhar, Aloi’s Co-founder and Chief Technology Officer. In 2019, she was named a Young Champion of the Earth, the United Nations’ most prestigious award for environmental action by young people.

Since then, Manandhar and her team at Aloi have helped 2,300 microentrepreneurs in Nepal. Thanks to their efforts, women like Ganga Didi have been able to get small loans to pay for safa tempo driving lessons, buy expensive replacement batteries for their buses and invest in climate-smart farming, while tackling air pollution and climate change at the same time.

So far, Aloi has helped to disburse US$800,000. Most recipients have been women, the majority of whom were not eligible for a bank loan.

A woman driver sits behind the wheel of an electric bus in Kathmandu, Nepal. The woman received a loan through Aloi, a startup which connects grassroots entrepreneurs to low-interest financing. Photo: Aloi

The United Nations Environment Programme (UNEP) will be inviting young changemakers aged 18-30 with outstanding ideas on how to protect and restore the environment to apply for a new round of Young Champions of the Earth awards.

The application period opens on 27 February and closes on 5 April. Seven winners selected from every region of the world will receive seed funding, intensive training and tailored mentoring to bring their ambitious environmental ideas to life.

“The recognition from UNEP really helped us to prove that we are serious and build the kind of network with banks and other partners that we have today,” Manandhar, 34, says.

She cited the example of a leading bank in Nepal, which contacted her to offer its services. It is now poised to work with Aloi to provide individual loans of between US$2,500 and US$10,000 to help women farmers to adapt to climate change.

Last mile banking for green businesses

More than three-quarters of women in Nepal work in the informal sector and cannot show lenders any credit history or proof of income. In addition, many women entrepreneurs are unable to take out a loan because they do not own any land to put down as collateral.

Manandhar used her background in computer engineering to address the problem. She and her team came up with a system where loans are provided in the form of digital tokens that can be accessed by SMS and used to pay for goods and services from verified vendors.

The technology also allows lending institutions to track where and how their funds are being spent. The data trails help borrowers like Didi to build a strong credit history that can be used to access financing to scale up their green businesses.","{'https://cdn.unenvironment.org/s3fs-public/styles/ex/public/2023-03/E-WEB-Goal-03.png?itok=3_Xn_RVp', 'https://cdn.unenvironment.org/s3fs-public/styles/ex/public/2023-03/E-WEB-Goal-09.png?itok=LI-_nIYl', 'https://cdn.unenvironment.org/s3fs-public/styles/ex/public/2023-03/E-WEB-Goal-12.png?itok=aU379Ol3', 'https://cdn.unenvironment.org/s3fs-public/styles/ex/public/2023-03/E-WEB-Goal-13.png?itok=ji0WoNpD', 'https://cdn.unenvironment.org/styles/topics_content_promo/s3/2024-01/Sonika%201.jpg?itok=B7oJUttt', 'https://cdn.unenvironment.org/s3fs-public/styles/large/public/2019-02/food%20production.png?itok=QdfET2H-', 'https://cdn.unenvironment.org/styles/article_billboard_image/s3/2024-01/Sonika%201.jpg?h=d302a1dd&amp;itok=NLWpP9zE', 'https://news.google.com/themes/custom/UNEP_3Spot/img/SDG_Wheel_Transparent_WEB.png', 'https://cdn.unenvironment.org/s3fs-public/inline-images/Garage.jpg', 'https://cdn.unenvironment.org/s3fs-public/styles/ex/public/2023-03/E-WEB-Goal-15.png?itok=CfzuvF19', 'https://cdn.unenvironment.org/s3fs-public/inline-images/Driver.jpg', 'https://cdn.unenvironment.org/s3fs-public/styles/topics_content_promo/public/2019-09/Cover%20photo%20attached.jpg?itok=xg74RqJV', 'https://cdn.unenvironment.org/s3fs-public/styles/ex/public/2023-03/E-WEB-Goal-11.png?itok=Uez9SfXr', 'https://cdn.unenvironment.org/s3fs-public/styles/ex/public/2023-03/E-WEB-Goal-01.png?itok=10WohXt9', 'https://cdn.unenvironment.org/styles/article_billboard_image/s3/2024-01/Sonika%201.jpg?h=d302a1dd&itok=NLWpP9zE', 'https://cdn.unenvironment.org/styles/topics_content_promo/s3/2023-12/53371496652_169f138cf7_k.jpg?itok=kvHuLHfB', 'https://cdn.unenvironment.org/s3fs-public/styles/ex/public/2023-03/E-WEB-Goal-14.png?itok=BugOSIyn', 'https://cdn.unenvironment.org/s3fs-public/styles/ex/public/2023-03/E-WEB-Goal-07.png?itok=SmPZWCm5', 'https://cdn.unenvironment.org/styles/topics_content_promo/s3/2023-12/SAVE_20231205_111354.jpg?itok=3viu1ZzP'}","30 के दशक के अंत में एकल माता-पिता के रूप में गंगा दीदी लंबा समय स अपन बच्चा के प्रावधान करय में सक्षम हेबाक चिंतित छलाह.काठमांडू मे ऑफिस बिल्डिंग सफाई स अपन मजदूरी पर मुश्किल स जीवित रहय मे सक्षम भ गेलीह, ओ बेहतर अवसर क तलाश करय लगलीह।एकटा विकल्प छल एकटा छोट तीन पहिया इलेक्ट्रिक बस जे नेपाल के भीड़भाड़ वाला पूंजी के एकटा आम विशेषता अछि, एकटा सफा टेम्पो के चलाबय के सीखब.1990 के दशक में काठमांडू न॑ ई बसऽ म॑ स॑ लगभग 700 बसऽ क॑ प्रदूषण-बस्टिंग उपाय के रूप म॑ पेश करलकै, जेकरा स॑ ग्रीनहाउस गैस उत्सर्जन क॑ कम करै म॑ भी मदद मिललै ।ड्राइविंग के पाठ के लेल पैसा देबय लेल दीदी अलोई के मदद सं एकटा छोट सन लोन लेलनि.स्टार्ट-अप उद्यमी कें लेल कम ब्याज वित्तपोषण कें चैनल छै जे ग्रीन वेंचर्स मे संलग्न छै.दू साल बाद दीदी पूर्णकालिक बस ड्राइवर जे पहिने जे किछु करैत छलीह, ओहि मे दुगुना कमा रहल छथि आ अपन एकटा इलेक्ट्रिक थ्री व्हीलर खरीदबा लेल पाइ बचा रहल छथि।अलोई केरऽ सह-संस्थापक आरू मुख्य प्रौद्योगिकी अधिकारी सोनिका माननांधर न॑ कहलकै कि ई देखना कि परिवर्तन वास्तव म॑ पूरा करै वाला छै ।2019 म॑ हुनका पृथ्वी केरऽ एगो युवा चैंपियन नामित करलऽ गेलै, जे संयुक्त राष्ट्र केरऽ युवा सिनी द्वारा पर्यावरणीय कार्रवाई लेली सबसें प्रतिष्ठित पुरस्कार छेकै ।तहिया स॑ मनन्धर आरू अलोई म॑ हुनकऽ टीम नेपाल म॑ २३०० माइक्रोइंसरेउर के मदद करलकै ।हुनकऽ प्रयास के बदौलत गंगा दीदी जैसनऽ महिला सिनी क॑ सफा टेम्पो ड्राइविंग सबक लेली पैसा देबै लेली छोटऽ-छोटऽ लोन मिल॑ सकलऽ छै, अपनऽ बस लेली महँग प्रतिस्थापन बैटरी खरीदै लेली आरू जलवायु-स्मार्ट खेती म॑ निवेश करै लेली, जबकि वायु प्रदूषण आरू जलवायु परिवर्तन स॑ निपटै के साथ-साथ एक ही समय के .एखन धरि अलोई 800,000 अमेरिकी डॉलर क वितरण करबा मे मदद केलक अछि।अधिकांश प्राप्तकर्ता महिला रहल छथि, जाहि मे अधिकांश बैंक ऋण क पात्र नहि छल ।नेपाल के काठमांडू में इलेक्ट्रिक बस के पहिया के पाछू एकटा महिला ड्राइवर बैसल अछि.महिला कए एलोई क माध्यम स लोन भेटल, जे एकटा स्टार्टअप अछि जे जमीनी स्तर पर उद्यमी कए कम ब्याज फाइनेंसिंग स जोड़ैत अछि।फोटो: अलोई संयुक्त राष्ट्र पर्यावरण कार्यक्रम (यूएनईपी) 18-30 साल के उम्र के युवा चेंजमेकर के आमंत्रित करतै जेकरा में उत्कृष्ट विचार छै कि पर्यावरण के सुरक्षा आरू पुनर्स्थापित करलऽ जाय छै ताकि पृथ्वी के यंग चैंपियन के एक नया दौर के लेलऽ आवेदन करलऽ जाय सक॑ ।आवेदन अवधि 27 फरवरी कए खुलत आ 5 अप्रैल कए बंद भ जाएत।दुनिया के हर क्षेत्र स॑ चुनलऽ गेलऽ सात विजेता क॑ अपनऽ महत्वाकांक्षी पर्यावरण विचारऽ क॑ जीवंत करै लेली बीज फंडिंग, गहन प्रशिक्षण आरू सिलवाया मार्गदर्शन मिलतै ।34 वर्षीय माननाड्रहर कहैत छथि जे यूएनईपी स मान्यता सचमुच हमरा सब कए इ साबित करबा मे मदद केलक जे हम सब गंभीर छी आ बैंक आ अन्य भागीदार क संग ओहि तरहक नेटवर्क क निर्माण करैत छी जे आइ हमरा सब लग अछि।ओ नेपाल मे एकटा प्रमुख बैंक क उदाहरण क हवाला देलथि, जे हुनका स संपर्क केलथि जे ओ अपन सेवा देबा लेल।आब ई अलोई के साथ मिल क॑ 2,500 स॑ 10,000 अमेरिकी डॉलर के बीच के व्यक्तिगत ऋण उपलब्ध करै लेली तैयार छै, जेकरा स॑ महिला किसानऽ क॑ जलवायु परिवर्तन के अनुकूल बनाबै म॑ मदद मिलै छै ।नेपाल मे तीन चौथाई सं बेसि महिलाक कें अनौपचारिक क्षेत्र मे काज करय छै आ ऋणदाताक कें कोनों क्रेडिट इतिहास या आय कें प्रमाण नहि देखा सकय छै.एकरऽ अलावा बहुत महिला उद्यमी ऋण नै लेबै म॑ असमर्थ छै, कैन्हेंकि ओकरा पास जमानत के रूप म॑ रखै लेली कोय जमीन नै छै ।मनन्धर समस्या के संबोधित करय लेल कंप्यूटर इंजीनियरिंग में अपन पृष्ठभूमि के उपयोग केलनि।हुनी आरू हुनकऽ टीम क॑ एगो ऐसनऽ सिस्टम मिललै, जेकरा म॑ डिजिटल टोकन के रूप म॑ ऋण उपलब्ध कराय देलऽ जाय छै जेकरा एसएमएस द्वारा एक्सेस करलऽ जाय सकै छै आरू एकरऽ उपयोग सत्यापित विक्रेता स॑ वस्तु आरू सेवा के भुगतान करै लेली करलऽ जाय छै ।ई तकनीक स॑ संस्थानऽ क॑ ई बात के पता लगाबै के सुविधा भी मिलै छै कि ओकरऽ फंड कत॑ आरू कोना खर्च करलऽ जाय रहलऽ छै ।इ डाटा ट्रेल दीदी जैना उधारकर्ताक कें एकटा मजबूत क्रेडिट इतिहास कें निर्माण मे मदद करय छै जेकर उपयोग वित्तपोषण कें उपयोग करय कें लेल कैल जा सकय छै ताकि ओकर हरित व्यवसायक कें पैमाना पर आबि सकय."
