title,description,published date,url,publisher.href,publisher.title,full_article,images,translated
Nepal PM Balendra Shah Skips Key Diplomatic Meet - WION,Nepal PM Balendra Shah Skips Key Diplomatic Meet  WION,2026-05-03 11:08:00,https://news.google.com/rss/articles/CBMimAFBVV95cUxOSEQ2eXRFMnU1aDVzYnVlSC1WRVJSRlFqTHFhTkVFT0I3Qmx1M2M2ZDdFUzlyN2s0dXRvMndGOW9FZG5qeHMyTFJ5bk9TbTdja0h3QS1aWVhwWVJZVFAtSVY1UElKTi0yZDExWXpYMmUxSnhRT19vVzNjdEpSQjdJQWJCcnZlVTBaczJJM1ZNSlQ2eEJsbEt4ZNIBngFBVV95cUxNekNmc09lWV9EMnNlYXdpU04yLV9vbktzRGltWlpoV1RER1E5SlhPNlB0eVNBS1RxMnVMTWlvUEtaSGZRM1FKUXU1LWR0eFIzeGVHT0p1NWdjY1V5U245QjBEQ09adndsYkNSbEF0U2g2MTg2T3BxQ0Zlb1NFek9lNUd6Q1ZCMjlBZklaNXc0b01IMDhpa0tiQWxPR3o4UQ?oc=5&hl=en-US&gl=US&ceid=US:en,https://www.wionews.com,WION,"Balendra Shah skips a key diplomatic meeting, sparking speculation over intent and possible political implications. The unexpected absence raises questions about strategy, alliances, and the broader diplomatic landscape.

trending videos U.S' Warning to UK, Poland, Lithuania Comes As War Drains Stock

Hezbollah's New Weapon: Fiber Optic Drones Explained

Russia-Ukraine War: Russia Strikes Kharkiv Gas Stations, Explosions Rock City

Hangeng Firm Thanks Pakistan Govt for Support; Plant Back on Track After Months of Losses

Legal Battle Over ‘Dhurandhar’ Intensifies as Filmmaker Pushes Script Theft Claim

Iran War Disruptions Leave Riyadh's Only Alcohol Store Empty

US Rejects Bailout Calls After Spirit Shutdown

Russia-Ukraine War: Ukraine Claims Strike on Russian Oil Tanker

US-Iran War: Iran Submits 14-Point Response Via Pakistan

Dubai Restaurants Hit As Iran War Disrupts Food Supplies

US-Iran War: Iran Submits Detailed 14-Point Plan via Pakistan Mediators

China Activates 2021 Blocking Rules Against US Sanctions

Trump’s Economic Fact Check: Hype vs Reality

Earth Being 'Observed' by Aliens, Claims Ex-US Admiral

Nepal PM To Skip Foreign Visits For A Year, Balen Shah Cancels India Visit

France Data Breach Shock: Teen Held Over Sale Of Stolen Data Online

#Metoo haunts Malayalam cinema: Actor Mohanlal breaks silence on sex scandal

Taiwan President Arrives in Eswatini Despite Chinese Objections

China Builds Trade Ties as US Raises Barriers

120 Bahadur, Border, Uri: The Surgical Strike: The Changing Face of Indian War Films

US-Iran War: Trump Warns Shipping Companies Against Paying Toll to Iran

Mysterious Earthquakes Near Area 51 Sparks Conspiracy Theories

US-Iran War | Trump on Seizing Iranian Oil Cargo: Its a Very Profitable Business

US-Iran War: Trump Warns Shipping Companies Against Paying Tolls to Iran

BREAKING: Khalistani Extremists Declared Security Threat by Canada

France Rave Party: Thousands Attend Unauthorised 'Free Party' |

Pulwama attack in terror financing report, FATF says Amazon & PayPal used by terrorists

US-Iran War: US Naval Blockade Restricts Iranian Crude Exports

Uttarakhand Storm: Govt Intensifies Efforts to Prepare for Extreme Weather Impact

Bitcoin April Rally Raises Fresh Caution Signs

Can Dubai Regain Its Shine as a Safe Haven?

Gaza Hunger Crisis: Sharp Drop in Aid Pushes Gaza Deeper Into Humanitarian Crisis

China: Bitchat Taken Down Over Regulatory Orders | Still Available Outside China

Bengal Elections: Repolling Takes Place Across West Bengal Districts on Saturday

US-Iran War: Has The US War Against Iran Really Been 'Terminated'?

Pak Petroleum Minister Says Pak Lacks Even a Day's Petrol Reserves

US-Iran War Impact Fuels Economic Anxiety in Iran

Oil Crisis | Report: Kuwait Did Not Export Any Crude Oil in April; Oil Export Tap Runs Dry

US-Iran War: US President to Review Iran's Latest Peace Proposal

Delhi Fire: At Least 9 Killed in Blaze; Preliminary Inquiry Launched to Determine the Exact Cause

US-Iran War: Has America Really Stopped the Iran War?","{'https://cdn1.wionews.com/prod/wion/images/2026/20260503/0305_Submits_7AM-00000002.jpg?im=FitAndFill=(700,400)', 'https://cdn1.wionews.com/prod/wion/images/2026/20260503/0305_Battle_730AM-00000002.jpg?im=FitAndFill=(700,400)', 'https://cdn1.wionews.com/prod/wion/images/2026/20260503/0305_Polls_6AM-00000002.jpg?im=FitAndFill=(700,400)', 'https://cdn1.wionews.com/prod/wion/images/2026/20260502/0205_UFO_6AM-00000002.jpg?im=FitAndFill=(700,400)', 'https://cdn1.wionews.com/prod/wion/images/2026/20260503/0305_Centcom_730AM-00000002.jpg?im=FitAndFill=(700,400)', 'https://cdn1.wionews.com/prod/wion/images/2026/20260503/0305_Submits_730AM-00000002.jpg?im=FitAndFill=(700,400)', 'https://cdn1.wionews.com/prod/wion/images/2026/20260502/0205_HEZBULLHA_8AM-00000002.jpg?im=FitAndFill=(700,400)', 'https://cdn1.wionews.comhttp://transcoding.zeenews.com/screenshot/0305_Saudi_6AM/00000002.jpg?im=FitAndFill=(700,400)', 'https://cdn1.wionews.com/prod/wion/images/2026/20260502/0205_Centcom_9PM-00000002.jpg?im=FitAndFill=(700,400)', 'https://cdn1.wionews.com/prod/wion/images/2026/20260503/0305_Breaking_11AM-00000002.jpg?im=FitAndFill=(700,400)', 'https://cdn1.wionews.comhttp://transcoding.zeenews.com/screenshot/0305_Crypto_930AM/00000002.jpg?im=FitAndFill=(700,400)', 'https://cdn1.wionews.com/prod/wion/images/2026/20260503/0305_Storm_1PM-00000002.jpg?im=FitAndFill=(700,400)', 'https://cdn1.wionews.com/prod/wion/images/2026/20260503/0305_Dubai_930AM-00000002.jpg?im=FitAndFill=(700,400)', 'https://cdn1.wionews.com/prod/wion/images/2026/20260501/0105_SUMIT_PAST_6PM-00000002.jpg?im=FitAndFill=(700,400)', 'https://cdn1.wionews.comhttp://transcoding.zeenews.com/screenshot/0305_China_2PM/00000002.jpg?im=FitAndFill=(700,400)', 'https://cdn1.wionews.com/prod/wion/images/2026/20260502/0205_Arms_3PM-00000002.jpg?im=FitAndFill=(700,400)', 'https://cdn1.wionews.comhttp://transcoding.zeenews.com/screenshot/0305_NEPAL_3PM/00000002.jpg?imwidth=1200&imheight=900', 'https://cdn1.wionews.com/prod/wion/images/2026/20260503/0305_Inflation_12PM-00000002.jpg?im=FitAndFill=(700,400)', 'https://cdn1.wionews.com/prod/wion/images/2026/20260502/0205_Chinese_8PM-00000002.jpg?im=FitAndFill=(700,400)', 'https://cdn1.wionews.com/prod/wion/images/2026/20260502/0205_DUBAI_930AM-00000002.jpg?im=FitAndFill=(700,400)', 'https://cdn1.wionews.com/prod/wion/images/2026/20260503/0305_Kuwait_2PM-00000002.jpg?im=FitAndFill=(700,400)', 'https://cdn1.wionews.com/prod/wion/images/2026/20260503/0305_Fire_1PM-00000002.jpg?im=FitAndFill=(700,400)', 'https://cdn1.wionews.com/prod/wion/images/2026/20260501/0105_SUMIT_ASIA_9PM-00000002.jpg?im=FitAndFill=(700,400)', 'https://cdn1.wionews.com/prod/wion/images/2026/20260502/0205_Pak_9PM-00000002.jpg?im=FitAndFill=(700,400)', 'https://cdn1.wionews.com/prod/wion/images/2026/20260501/0105_SUMIT_COURT_1030pm-00000002.jpg?im=FitAndFill=(700,400)', 'https://cdn1.wionews.com/prod/wion/images/2026/20260503/0305_China_730AM-00000002.jpg?im=FitAndFill=(700,400)', 'https://cdn1.wionews.com/prod/wion/images/2026/20260503/0305_France_8AM-00000002.jpg?im=FitAndFill=(700,400)', 'https://cdn1.wionews.com/prod/wion/images/2026/20260503/0305_Spirit_930AM-00000002.jpg?im=FitAndFill=(700,400)', 'https://cdn1.wionews.com/prod/wion/images/2026/20260503/0305_Trade_930AM-00000002.jpg?im=FitAndFill=(700,400)', 'https://cdn1.wionews.com/prod/wion/images/2025/20251123/EP_INDIANWARFILMS-00000002.jpg?im=FitAndFill=(700,400)', 'https://cdn1.wionews.com/prod/wion/images/2026/20260503/0305_Breaking_1PM-00000002.jpg?im=FitAndFill=(700,400)', 'https://cdn.wionews.com/sites/default/files/styles/story_page/public/2024/09/01/0109_metoo_7pm_pkwo-1725159012-00000003.jpg', 'https://cdn1.wionews.com/prod/wion/images/2026/20260407/0704_TECH_8AM-00000002.jpg?im=FitAndFill=(700,400)', 'https://cdn1.wionews.com/prod/wion/images/2026/20260503/0305_Deadlock_9AM-00000002.jpg?im=FitAndFill=(700,400)', 'https://cdn1.wionews.com/prod/wion/images/2026/20260503/0305_RUSSIA_3PM-00000002.jpg?im=FitAndFill=(700,400)', 'https://cdn1.wionews.comhttp://transcoding.zeenews.com/screenshot/0305_Fact_930AM/00000002.jpg?im=FitAndFill=(700,400)', 'https://cdn1.wionews.com/prod/wion/images/2026/20260503/0305_Hits_7AM-00000002.jpg?im=FitAndFill=(700,400)', 'https://cdn1.wionews.com/prod/author/images/video-web-desk.jpeg', 'https://cdn1.wionews.com/prod/wion/images/2026/20260501/0105_Hacker_230PM-00000002.jpg?im=FitAndFill=(700,400)', 'https://cdn1.wionews.com/prod/wion/images/2026/20260503/0305_Battle_6AM-00000002.jpg?im=FitAndFill=(700,400)', 'https://cdn1.wionews.com/prod/wion/images/2026/20260503/0305_War_930AM-00000002.jpg?im=FitAndFill=(700,400)', 'https://cdn1.wionews.com/prod/wion/images/2026/20260501/0105_SUMIT_GAZA_730PM-00000002.jpg?im=FitAndFill=(700,400)', 'https://cdn1.wionews.com/prod/wion/images/2025/20250709/0907_ARJUN_FATF_5PM-00000002.jpg?im=FitAndFill=(700,400)'}","बलेन्द्र शाह न॑ एगो प्रमुख कूटनीतिक बैठक क॑ छोड़ी दै छै, जेकरा स॑ मंशा आरू संभावित राजनीतिक निहितार्थ प॑ अटकलबाजी शुरू होय जाय छै । अप्रत्याशित अनुपस्थिति स॑ रणनीति, गठबंधन, आरू व्यापक कूटनीतिक परिदृश्य प॑ सवाल उठै छै ।

trending videos यू.एस.क चेतावनी यूके, पोलैंड, लिथुआनिया के लेल आबि रहल अछि जेना युद्ध स्टॉक के नाली

हिजबुल केरऽ नया हथियार : फाइबर ऑप्टिक ड्रोन केरऽ व्याख्या

रूस-यूक्रेन युद्ध : रूस खार्किव गैस स्टेशन पर हमला, विस्फोट रॉक सिटी

हैंगेंग फर्म समर्थन के लेल पाकिस्तान सरकार के धन्यवाद; महीना भर के नुकसान के बाद वापस पटरी पर पौधे

फिल्म निर्माता पटकथा चोरी के दावा के धक्का दैत ‘धुरंधर’ पर कानूनी लड़ाई तेज भ गेल

ईरान युद्ध में बाधा के कारण रियाद के एकमात्र शराब के भंडार खाली भ गेल

स्पिरिट शटडाउन के बाद अमेरिका बेलआउट कॉल के खारिज क देलक

रूस-यूक्रेन युद्ध : यूक्रेन न॑ रूसी तेल टैंकर प॑ हमला के दावा करलकै

अमेरिका-ईरान युद्ध : ईरान न॑ पाकिस्तान के माध्यम स॑ १४ अंकऽ के प्रतिक्रिया पेश करलकै

ईरान युद्ध के कारण खाद्य आपूर्ति में बाधा के कारण दुबई के रेस्टोरेंट में झटका

अमेरिका-ईरान युद्ध : ईरान न॑ पाकिस्तान मध्यस्थऽ के माध्यम स॑ विस्तृत १४-बिंदु योजना पेश करलकै

चीन अमेरिकी प्रतिबंध के खिलाफ 2021 के अवरोधक नियम सक्रिय केलक

ट्रम्प के आर्थिक तथ्य जांच : हाइप बनाम रियलिटी |

पृथ्वी के एलियन द्वारा 'अवलोकन' करलऽ जाय रहलऽ छै, पूर्व अमेरिकी एडमिरल के दावा छै

नेपालक पीएम एक वर्षक लेल विदेश भ्रमण छोड़ब बलेन शाह भारत भ्रमण रद्द |

फ्रांस डाटा उल्लंघन सदमे: चोरी के डाटा ऑनलाइन के बिक्री पर किशोर पकड़ल गेल

#Metoo haunts Malayalam cinema: अभिनेता मोहनलाल ने सेक्स कांड पर चुप्पी तोड़ी

चीनी आपत्ति के बावजूद ताइवान के राष्ट्रपति एस्वातिनी पहुंचल

अमेरिका केरऽ बाधा बढ़ला के साथ चीन न॑ व्यापारिक संबंध बनाबै छै

120 बहादुर, सीमा, उरी: द सर्जिकल स्ट्राइक: भारतीय युद्ध फिल्मों का बदलते चेहरा

अमेरिका-ईरान युद्ध : ट्रंप न॑ जहाजरानी कंपनी सिनी क॑ ईरान क॑ टोल दै के खिलाफ चेतावनी देलकै

क्षेत्र 51 के पास रहस्यमय भूकंप षड्यंत्र सिद्धांत के चिंगारी

अमेरिका-ईरान युद्ध | ईरानी तेल माल जब्त करय पर ट्रंप: एकर एकटा बहुत लाभदायक व्यवसाय

अमेरिका-ईरान युद्ध : ट्रंप न॑ जहाजरानी कंपनी सिनी क॑ ईरान क॑ टोल दै के खिलाफ चेतावनी देलकै

BREAKING: खालिस्तानी चरमपंथी कनाडा द्वारा सुरक्षा खतरा घोषित

फ्रांस रेव पार्टी: अनधिकृत 'फ्री पार्टी' में हजारों लोग भाग ले |

आतंकी वित्तपोषण रिपोर्ट म॑ पुलवामा हमला, एफएटीएफ के कहना छै कि आतंकी द्वारा इस्तेमाल करलऽ जाय वाला अमेजन एंड पेपैल

अमेरिका-ईरान युद्ध : अमेरिकी नौसेना नाकाबंदी के कारण ईरानी कच्चा तेल के निर्यात पर रोक

उत्तराखंड तूफान : मौसम के चरम प्रभाव के तैयारी के लेल सरकार के प्रयास तेज

बिटकॉइन अप्रैल रैली मे ताजा सावधानी के संकेत

की दुबई सुरक्षित ठिकाना के रूप में अपन चमक वापस पाबि सकैत अछि?

गाजा भूख संकट : सहायता केरऽ तेज गिरावट न॑ गाजा क॑ मानवीय संकट म॑ गहराई स॑ धकेल॑ देलकै

चीन : नियामक आदेश पर उतारल गेल Bitchat | चीन के बाहर एखनो उपलब्ध अछि

बंगाल चुनाव : पश्चिम बंगाल के जिला भर मे शनिदिन फेर सं मतदान भेल

अमेरिका-ईरान युद्ध : की सचमुच ईरान के खिलाफ अमेरिकी युद्ध ‘समाप्त’ भ गेल अछि ?

पाक पेट्रोलियम मंत्री के कहनाय छनि जे पाक मे एक दिन के पेट्रोल भंडार के सेहो कमी अछि

अमेरिका-ईरान युद्ध केरऽ प्रभाव ईरान म॑ आर्थिक चिंता क॑ बढ़ावा दै छै

तेल संकट | रिपोर्ट : अप्रैल में कुवैत में कोनो कच्चा तेल के निर्यात नै भेल छल; तेल निर्यात नल सूखल चलैत अछि

अमेरिका-ईरान युद्ध : ईरान केरऽ नवीनतम शांति प्रस्ताव के समीक्षा करै वाला अमेरिकी राष्ट्रपति

दिल्ली मे आगि : आगि मे कम स कम 9 गोटेक मौत; सटीक कारण निर्धारित करबाक लेल प्रारंभिक जांच शुरू

अमेरिका-ईरान युद्ध : की अमेरिका सचमुच ईरान युद्ध के रोकने अछि ?"
