title,description,published date,url,publisher.href,publisher.title,full_article,images,translated
FIFA’s ‘Football for Schools’ program set to launch in Nepal on July 31 - Khabarhub,FIFA’s ‘Football for Schools’ program set to launch in Nepal on July 31  Khabarhub,2025-07-26 07:18:39,https://news.google.com/rss/articles/CBMiWEFVX3lxTFBqSS02b2VNeVlBTnlQTGgzdmpMckc2Vzl3c0tFX2wtaWF3VHZLd2FiSjJtamxxdjFIMjlNRXdRaUt0RXBJRE10c3J6Um9IelFlVjA4OHpIaks?oc=5&hl=en-US&gl=US&ceid=US:en,https://english.khabarhub.com,Khabarhub,,{'https://lh3.googleusercontent.com/J6_coFbogxhRI9iM864NL_liGXvsQp2AupsKei7z0cNNfDvGUmWUy20nuUhkREQyrpY4bEeIBuc=s0-w300'},
Constitution amendment based on need: NC President Deuba - The Himalayan Times,Constitution amendment based on need: NC President Deuba  The Himalayan Times,2025-07-26 07:19:26,https://news.google.com/rss/articles/CBMilgFBVV95cUxQMVlDdzREVVhjTnlKa1UtaTEzQlZWQnU2UmJ5YnVkTXdjZk9PMm5ZWnZLQU1GWHJUU0tYeUF2QlFSSHctNmdPeXRWNFlqblVMdjJibVo3ZmpBMGI2SXZtV3pKRnJ4aHJac09sRGE4Z2R6MUJqc1NWelc2RGJFT1ktZmF6bEdlVVR4dzZpRnNyZi1ZZWNremc?oc=5&hl=en-US&gl=US&ceid=US:en,https://thehimalayantimes.com,The Himalayan Times,,{'https://lh3.googleusercontent.com/J6_coFbogxhRI9iM864NL_liGXvsQp2AupsKei7z0cNNfDvGUmWUy20nuUhkREQyrpY4bEeIBuc=s0-w300'},
Cimex launches BYD Sealion 7 electric SUV in Nepal at introductory price - The Himalayan Times,Cimex launches BYD Sealion 7 electric SUV in Nepal at introductory price  The Himalayan Times,2025-07-26 07:55:22,https://news.google.com/rss/articles/CBMisAFBVV95cUxQQkZuaVpSdXotWnIxTHVubG0yZmlVMnJveFhma0VWMzVmYm9LQXVDQklONUZ1NlpVWHd6LTRLWXFCQlMtdWhNRlJkMTNtWDc4V3FsYUJwaUNvZjB2aVVFck5RRkQ0Rk54XzlfNEExVEhzazROQjJ5OUU2dnlWU3FLcEpHV19fdWEyQm9GdnRKZEhKUEZTUzgyUjVyZGdZN20zNkdTRURYVk5VTDNZejIyLQ?oc=5&hl=en-US&gl=US&ceid=US:en,https://thehimalayantimes.com,The Himalayan Times,,{'https://lh3.googleusercontent.com/J6_coFbogxhRI9iM864NL_liGXvsQp2AupsKei7z0cNNfDvGUmWUy20nuUhkREQyrpY4bEeIBuc=s0-w300'},
US-Bangla rejects report of Nepal court's compensation order over 2018 plane crash - The Daily Star,US-Bangla rejects report of Nepal court's compensation order over 2018 plane crash  The Daily Star,2025-07-26 09:55:44,https://news.google.com/rss/articles/CBMizAFBVV95cUxNWmZQTGdnS1ozZkxPYzFKb3ZEZXhiSlZpNEVsLXhVWTkwWWdka2UxR0w0T2FKZnlzNFFGY1BPb1YyUHY3TE1Jd29LcXdhVU9HVUFEZjRqVXBxanNRenk5Y1RiM1hwTE9ISlJ2aEdCTTdOekFMSmVrUm5VMWFvdzMyc2haWE5tMHk1SjE1UjRrWkgzYVpFR3AzS0lNQzRqRnRTeXpMamhnR1ZKZWdSLTl1dDFyaTh1TVpOcFY5VmpuYmxrTlFpNlBEMXBocmQ?oc=5&hl=en-US&gl=US&ceid=US:en,https://images.thedailystar.net,The Daily Star,,{'https://lh3.googleusercontent.com/J6_coFbogxhRI9iM864NL_liGXvsQp2AupsKei7z0cNNfDvGUmWUy20nuUhkREQyrpY4bEeIBuc=s0-w300'},
Nepal court orders $2.74m over 2018 crash; US-Bangla disputes notice - Dhaka Tribune,Nepal court orders $2.74m over 2018 crash; US-Bangla disputes notice  Dhaka Tribune,2025-07-26 10:33:04,https://news.google.com/rss/articles/CBMipgFBVV95cUxPWnFIanN0ZldJd0xHSlo2dWJUYWNDSlB5SzMxalh5cHVfeHo1eFBTUnJUTlZLWVlnRGZzVzJDa0Ffako2M3lxa1lNdW85TUp3WUFuZER2M05qZGpvdTA4emo1YXJKMlh2UFM4QjQ2WnRnekk4QWhmY2ZIMWNRbnBYZU5ydTlZcWdzRUUxeGlBTHptOFUxXzFmTFh0a2dWR2VfQl91a3h30gGrAUFVX3lxTE1OZFRXaWVJdm9adkt2ZTRhSWg0dG51OFFxWU9OQTZ2UUx3MTNvX3IzYkJROTVwdWRkVkdrSHFnRmxfWElEVHRubTBoX0stQjJ4d2IzbDhiS2pmVTZiTWZydldkdXFhTU1NaTFQX0FMQXloeGNyRVJtQ3E4RzN1ZG1hUGoyTE5VWTBfTE9vMGRKMXdSUTNmOVo2UXliamRfb1BzeW5saUFycjhaNA?oc=5&hl=en-US&gl=US&ceid=US:en,https://www.dhakatribune.com,Dhaka Tribune,,{'https://lh3.googleusercontent.com/J6_coFbogxhRI9iM864NL_liGXvsQp2AupsKei7z0cNNfDvGUmWUy20nuUhkREQyrpY4bEeIBuc=s0-w300'},
US-Bangla refutes press report on Nepal court verdict over 2018 crash - Bangladesh Sangbad Sangstha (BSS),US-Bangla refutes press report on Nepal court verdict over 2018 crash  Bangladesh Sangbad Sangstha (BSS),2025-07-26 11:08:47,https://news.google.com/rss/articles/CBMiS0FVX3lxTE1zRlNWX0JBbWFLdDhMUTBDYjVpRTdCUnhaWnFnbGpjbk9ZWm9DMGNtOWcwNmtkbU1wbktGU0VOXzdPX2RNLTFqdnJTRQ?oc=5&hl=en-US&gl=US&ceid=US:en,https://www.bssnews.net,Bangladesh Sangbad Sangstha (BSS),,{'https://lh3.googleusercontent.com/J6_coFbogxhRI9iM864NL_liGXvsQp2AupsKei7z0cNNfDvGUmWUy20nuUhkREQyrpY4bEeIBuc=s0-w300'},
Open Letter To PM Oli: Nepal Needs A Stronger Stance On Israeli War Crimes In Gaza - The Friday Times,Open Letter To PM Oli: Nepal Needs A Stronger Stance On Israeli War Crimes In Gaza  The Friday Times,2025-07-26 11:57:08,https://news.google.com/rss/articles/CBMivAFBVV95cUxOcEpGbkRYTmdoT2RzQklYTHp0SHlMRWVJVEc0NjY0akZfdE9NQXN5bGdJdGNTaEtWTWFkbkMzU2ZZQVdkUzc3Vk5qZkxRVTYzbjVQbDhKbVkyUjFNNVJLUFVJdFVWWFNiOEVTRGs4dFo4eHN2QjRxQkxjakgzNnZDWElLS0MxUnV4R1ZnNG55VlRTdXVadkNfNG8tQ19lYnFFa3RCY0VsZmF1ejVvWEN4OXdzTGphYTdFNGJHcdIBzAFBVV95cUxOYzNkd1JtZE96QWdpMEQwMFdFSkZHMDQyQnM3NzFEajVCMTlMcEFSMVhERGRLUGtNN3llcHpCbmFLcTZXdHMxZ1c0NW91VWxxY2RscnRZMDFtcXM1bkhmR1lzYWNkWG42S3hDNXFzdzliVU9RWFdaOEVST0lTdkoyUEdUTm5qME5fLXRXSFB4VkNtbW9MS1dfNVU4S2JsZE83bUgtZ2haQ05WWnEydEN3VlFoQ2ZuY1d6RTA4VTY3Zl9IRFdrbFd2Sy1tdjg?oc=5&hl=en-US&gl=US&ceid=US:en,https://thefridaytimes.com,The Friday Times,,{'https://lh3.googleusercontent.com/J6_coFbogxhRI9iM864NL_liGXvsQp2AupsKei7z0cNNfDvGUmWUy20nuUhkREQyrpY4bEeIBuc=s0-w300'},
Indian Vegetable Oil Industry Urges Review of Nepal’s Packaging Rules - KNN India,Indian Vegetable Oil Industry Urges Review of Nepal’s Packaging Rules  KNN India,2025-07-26 12:11:02,https://news.google.com/rss/articles/CBMitgFBVV95cUxOTEpIaWowOWZFaVozWHZDS2VTYjRqYWp4M0ZoUUliM3ZCN2FDbkJzNFg4QXBOWkZXZWVKX2hQcVBIZEFCd0ZPRlNFMll5bExjYU1CdGRtNlloMmhxRUJoY21QbVJaSkVWV3RXOVl6V0EwLXFLU0ZmWEdvRjJyRzdXUnlOTWZmamhxQkcxQ0JYVklLY3hidXdBTno4U1FKR2w0VWkyTHRlWUFoaGNlSGxrS0NqZWNnUQ?oc=5&hl=en-US&gl=US&ceid=US:en,https://knnindia.co.in,KNN India,,{'https://lh3.googleusercontent.com/J6_coFbogxhRI9iM864NL_liGXvsQp2AupsKei7z0cNNfDvGUmWUy20nuUhkREQyrpY4bEeIBuc=s0-w300'},
"China suffers big jolt in Nepal, Donald Trump’s one decision spoils Xi Jinping’s plan as US to continue… - India.Com","China suffers big jolt in Nepal, Donald Trump’s one decision spoils Xi Jinping’s plan as US to continue…  India.Com",2025-07-26 13:45:30,https://news.google.com/rss/articles/CBMivgJBVV95cUxONFlCeGN0X2pHVVkwVFZaR1ZteURDVUJqTkstUFF4UUtham9XdVVZUzhHTXAzdmg0eGRzUlNYMjByU2lEVkYwS0IzYUR3TVdudEgtblp6UzlWN2pEVXpvcUVFNUZ0U2pUMVVtODRDbzBSenlwYW9IbFA2VFRDUXFYTUZGSGswdXoxZzhORExHd0gxSi1rY1ZOSWVVMF9ycC1yVVBvb1Z2YW1qZWl3VGxzMTNOdW1HZjUtUTBEbFR5aV93YTZfZDE2aWwtOHhmSGx0NWFjRUJHSi0tVHE5RlU0OFU1czdOQ2RWTzRhWWRWbFc3MkJqRk9NMUdlSnZjQWU4MG9hbUFTUW9JWTM1ZkV4dURtcnpXNGt1czJmaWZqQlE0ZEVvSXg2WGt2X0dmdS0temFCdmhaZFA0d09VVmfSAcMCQVVfeXFMUExka3RrdDd5MmRZWE9JM0VYeGZWN1hQNXlfUGFfczFPM0R4TjRkMHBzMnRGVndIMm44OHBVbGxleVBIYnU4VHBDTmxtVDJpRHVrcTRhM3RyczZiZkJsc2xyVmJTYW5WellKdEdYV3RSbjFnVEVvZzlZMnVkZ1dGMXMyQ1JrMXdBMnhYZk80WEMtenJQZW1Ha2JQQ1FNNU14SnI1MVUxS09sMHB1T2Y0U0ZUVXRmRG5wUGtqdHdDekJyZC1MZVUwOHhRNlZLaEFTWS11dFlDM2NrNDhJeFZBWC15THhYaTBUY0FIQ0Y0NDM4TmdZOGtiejBCWC1mM2pmeXpMbGlYSUNYajVZU1pYYi1FcWlKRkE0UF8xcUxoYVJ5WTAyMG1pX2x6MUd6NzR0TVFaTlQwZmtjd1RUXzdyR29FaUk?oc=5&hl=en-US&gl=US&ceid=US:en,https://www.india.com,India.Com,,{'https://lh3.googleusercontent.com/J6_coFbogxhRI9iM864NL_liGXvsQp2AupsKei7z0cNNfDvGUmWUy20nuUhkREQyrpY4bEeIBuc=s0-w300'},
Nepali talent Pravesh Rijal named among top 100 AI leaders in US - myRepublica,Nepali talent Pravesh Rijal named among top 100 AI leaders in US  myRepublica,2025-07-26 15:08:31,https://news.google.com/rss/articles/CBMiuwFBVV95cUxNMEtEejM3YTdoR21oTmRYbVVSNnNzX2hXN0otUlJOakV4Q1E0ZUpmYk5JaTRCa1RGeVZjS2RLQnFpTXdjZjYtYjhDS0stcTg0dXR3YThhZllTVGdHelNoV3BqZ2N5STM5OUZyV0Z3NmpSdml4cFRJcU1OLWpWWWR0NlhHLW43UTUxNDdJeEJ3b09VOXdZQTRvU1RITlhHUm9Id25oYWNXcUs0TUJkbDlQbDVXVE5jcExyc01r?oc=5&hl=en-US&gl=US&ceid=US:en,https://myrepublica.nagariknetwork.com,myRepublica,,{'https://lh3.googleusercontent.com/J6_coFbogxhRI9iM864NL_liGXvsQp2AupsKei7z0cNNfDvGUmWUy20nuUhkREQyrpY4bEeIBuc=s0-w300'},
Bangladesh likely to play series against Nepal or Netherlands in August - Bangladesh Sangbad Sangstha (BSS),Bangladesh likely to play series against Nepal or Netherlands in August  Bangladesh Sangbad Sangstha (BSS),2025-07-26 15:58:47,https://news.google.com/rss/articles/CBMiTkFVX3lxTFA0TU5FcjB1cThYX005SldCaUQ0SUNZU19hdE5yS2pTSGdUOTdnSVBNcVViY3JON3JLMDlPXzhlM1VfXy1jUlZSOV9id1BRUQ?oc=5&hl=en-US&gl=US&ceid=US:en,https://www.bssnews.net,Bangladesh Sangbad Sangstha (BSS),,{'https://lh3.googleusercontent.com/J6_coFbogxhRI9iM864NL_liGXvsQp2AupsKei7z0cNNfDvGUmWUy20nuUhkREQyrpY4bEeIBuc=s0-w300'},
FDI pledges to Nepal inch up 5 percent amid policy tweaks - MSN,FDI pledges to Nepal inch up 5 percent amid policy tweaks  MSN,2025-07-26 17:40:58,https://news.google.com/rss/articles/CBMi6wFBVV95cUxQTEdCbzZLN1NnY2ZSekloV0FlZ3B0S05GdWdhZE5FVVN5aU5pZUQxb0tPQVA0NTNfRm9yM1d2d2xncGE3TG81bUNXNWlKaVBGeFJKWG80T2hrMFlIdk1uaUxONDN1OEkzTjRYY2NwWFgzLXh3N21zbV9zMTduYmt6ZmdtWE5GZXREdWYwdENuMlJOMmcyLVZReGdhZkY0ZHlLdTFiYm40NkZmYUVXbkZCMUpLelhVRVh2QU1iR3B1eEpybDF5VjFfVnpwbVg5NEgwQ1oxR3c3bmhXTi02eGgxSmE2U0RnYTM0N2xV?oc=5&hl=en-US&gl=US&ceid=US:en,https://www.msn.com,MSN,,{'https://lh3.googleusercontent.com/J6_coFbogxhRI9iM864NL_liGXvsQp2AupsKei7z0cNNfDvGUmWUy20nuUhkREQyrpY4bEeIBuc=s0-w300'},
"Bangladesh in talks with Nepal, Netherlands for bilateral series - daily-sun.com","Bangladesh in talks with Nepal, Netherlands for bilateral series  daily-sun.com",2025-07-26 17:48:45,https://news.google.com/rss/articles/CBMiTkFVX3lxTE5GZGFDMWpkOVpMQWNHakRrVlc2b3hDeHp1NU82RG9UU0FZVXY3M19nTHRJUU5HSVNDVTUxUGFOOUYyUmNMRFIyN3ExZXZjdw?oc=5&hl=en-US&gl=US&ceid=US:en,https://www.daily-sun.com,daily-sun.com,,{'https://lh3.googleusercontent.com/J6_coFbogxhRI9iM864NL_liGXvsQp2AupsKei7z0cNNfDvGUmWUy20nuUhkREQyrpY4bEeIBuc=s0-w300'},
Nepal court reportedly gives ‘compensation order’ to US‑Bangla Airlines over Kathmandu crash - bdnews24.com,Nepal court reportedly gives ‘compensation order’ to US‑Bangla Airlines over Kathmandu crash  bdnews24.com,2025-07-26 18:32:00,https://news.google.com/rss/articles/CBMiVEFVX3lxTE5DUTJibGVOLW5kRV9FYTVtWWFTRVFoekV0X1pIVV9NdWVyMFRiQW9HLTRMc0pka2FOaUEySWVLNWtXOUNsUE5Bd3NwVG00LU5wVmpjag?oc=5&hl=en-US&gl=US&ceid=US:en,https://bdnews24.com,bdnews24.com,,{'https://lh3.googleusercontent.com/J6_coFbogxhRI9iM864NL_liGXvsQp2AupsKei7z0cNNfDvGUmWUy20nuUhkREQyrpY4bEeIBuc=s0-w300'},
"US-Bangla Airlines to Compensate Kathmandu Crash Victims, Says Nepal Court- What You Should Know Now - Travel And Tour World","US-Bangla Airlines to Compensate Kathmandu Crash Victims, Says Nepal Court- What You Should Know Now  Travel And Tour World",2025-07-26 20:47:23,https://news.google.com/rss/articles/CBMi4AFBVV95cUxNV2J2d0VyOVQ0YVhGQUdfUnJKM1NnWHpwUjh1RUdWNHRNWmVlWDNfX0xxSWVETnFEZVhGcXd0aVFIaF9WQ1ZPdm1kdVo4UjZReFZwakFhRENxSjRiYTNpaExMSnhhcFJjb2tfMk95dFpqWlM4UE1LalVBSkpzR3VtaFE3Z0V0N3AwcWU5RVpZeFVOcmEzajB3WjlFV3dpd3E2N2FIdjFwM0VpNWxyM1dTbmhuOFpyRzRYN3hTVVZrRy05NUE2Y1FsNkI0WVRweThLamZtRTlUY1dWSmtsRFEwVA?oc=5&hl=en-US&gl=US&ceid=US:en,https://www.travelandtourworld.com,Travel And Tour World,,{'https://lh3.googleusercontent.com/J6_coFbogxhRI9iM864NL_liGXvsQp2AupsKei7z0cNNfDvGUmWUy20nuUhkREQyrpY4bEeIBuc=s0-w300'},
"CIAA intensifies anti-graft drive, files high-profile cases in last FY - The Rising Nepal","CIAA intensifies anti-graft drive, files high-profile cases in last FY  The Rising Nepal",2025-07-27 00:09:03,https://news.google.com/rss/articles/CBMiUEFVX3lxTE5WZFRsdU9jSHE4bWNBM2JrTkxZUHp6ci1oNWlXWVA1Ml8yNFVsTzZjZ0Uyckt4anVza2ZGc0dYV2RWaWtyQmk3bVZmTDltaUsw?oc=5&hl=en-US&gl=US&ceid=US:en,https://risingnepaldaily.com,The Rising Nepal,,{'https://lh3.googleusercontent.com/J6_coFbogxhRI9iM864NL_liGXvsQp2AupsKei7z0cNNfDvGUmWUy20nuUhkREQyrpY4bEeIBuc=s0-w300'},
"Despite scant resources, Nepal’s para-fighters keep kicking - The Kathmandu Post","Despite scant resources, Nepal’s para-fighters keep kicking  The Kathmandu Post",2025-07-27 00:51:57,https://news.google.com/rss/articles/CBMipAFBVV95cUxNV0RIVmFhOWNuSXV5bTJNS19vdXdOYmZSVmxabWNfbnRnSFFTUXdJNU0tTXZiZ3VPMEw5RlNKUXBESlNFTjFsXy1IUlhpOFBrRFQ2bGc5cWR3SHFRWjMyV1pFSTVWYkNkck1WR25Ba1ZidVRCTlZwTEVTTEZYR3ZfS3FmQmx0dWs2ZGo0NjY5SnZOOWxSZVlTMms3Qmg5VnVRWWJzSA?oc=5&hl=en-US&gl=US&ceid=US:en,https://kathmandupost.com,The Kathmandu Post,,{'https://lh3.googleusercontent.com/J6_coFbogxhRI9iM864NL_liGXvsQp2AupsKei7z0cNNfDvGUmWUy20nuUhkREQyrpY4bEeIBuc=s0-w300'},
Responsible Tourism - The Rising Nepal,Responsible Tourism  The Rising Nepal,2025-07-27 00:54:28,https://news.google.com/rss/articles/CBMiUEFVX3lxTE85U2NObDJaaHRTbkg5TTV5Q1kyMnllZHlBdmhWOGd3NmdhTEF6VkxSODRSSmZ6RnJ4SVZYTnpmUGpjTXdIMjl3MmM5SnN6N05S?oc=5&hl=en-US&gl=US&ceid=US:en,https://risingnepaldaily.com,The Rising Nepal,,{'https://lh3.googleusercontent.com/J6_coFbogxhRI9iM864NL_liGXvsQp2AupsKei7z0cNNfDvGUmWUy20nuUhkREQyrpY4bEeIBuc=s0-w300'},
Affordable places for Nepali students in Kyoto - The Kathmandu Post,Affordable places for Nepali students in Kyoto  The Kathmandu Post,2025-07-27 01:16:59,https://news.google.com/rss/articles/CBMioAFBVV95cUxNNk05TjJFVDh3elR2MnhpYnJCZGNPdFBhQjlSV2tPVVYtbUtyenpRYVpuZmZVTkRFV3dueTBObkxJNFZuM0xDaEtIVUFuUURLc0ExVXdXTjlocTVZNWVtRWllME14SXR5aVMxRHROaG55ZmZtbFB4anFlVl9BdUQ0SzlGcUlpTElDdXRQNnNmQVlGOHlGcmhhYVdpelJkMGtv?oc=5&hl=en-US&gl=US&ceid=US:en,https://kathmandupost.com,The Kathmandu Post,,{'https://lh3.googleusercontent.com/J6_coFbogxhRI9iM864NL_liGXvsQp2AupsKei7z0cNNfDvGUmWUy20nuUhkREQyrpY4bEeIBuc=s0-w300'},
Nepal’s top revenue-generating customs offices merge - The Kathmandu Post,Nepal’s top revenue-generating customs offices merge  The Kathmandu Post,2025-07-27 01:22:01,https://news.google.com/rss/articles/CBMimwFBVV95cUxNX0tIem55SHhOR1ZmQktvcGFFc1FqN0J5cGxwZTI3TW5IaUxNNlNWc2Y3bGdzSmtRZDBFQ3pvUGMwQnVrTDBwTVd4ZWJsRGJQOVI2N3lfUklBTHpMLW1KSmZtYXN6NktGSjg4YkVERmRBQktlZm5EbVE3VV82cl9DLXpyS1p4dTZ2aW8zYXU3QkMxNGkzYXk2ZGtPOA?oc=5&hl=en-US&gl=US&ceid=US:en,https://kathmandupost.com,The Kathmandu Post,,{'https://lh3.googleusercontent.com/J6_coFbogxhRI9iM864NL_liGXvsQp2AupsKei7z0cNNfDvGUmWUy20nuUhkREQyrpY4bEeIBuc=s0-w300'},
