title,description,published date,url,publisher.href,publisher.title,full_article,images,translated
We Remain Engaged On This Development: MEA On Reports Nepal May Impose Customs Duty On Goods - ETV Bharat,We Remain Engaged On This Development: MEA On Reports Nepal May Impose Customs Duty On Goods  ETV Bharat,2026-04-24 03:53:44,https://news.google.com/rss/articles/CBMi2gFBVV95cUxNX2lmSVd5UVY4REgxczZfdm9iQnVqQTE1T05samRTdWV1VG1fZk1FOW5VSWp2Y3VZUVJRU00zY3dKMnI1eE5lR1lfVnlRdjRNeDBWdGNkLU1oM0JySm1jQVJzZ2N3TlhHN21SQ19SQ0ZzTnZDYmlHWWp2SEZHRnUyMlIyQTQ1R2hIVzAzSlk5bXdhSGNld3NpQ082dGJNbWdGRDZOckdUX0V6aTNEa2ctLVN2ZXhpWVFSZkxPbEVqNFZZdUI0V2lnVFNRd3d1dXBsZG1Hajg4TlJOUdIB3wFBVV95cUxNeUl2blVHeWRaeW94b0EyTURPMlpFdzgtQkF1Zks0Wlh0R2R3a1J3WjBpNS1NeG16WEt3cnFpTEVWTFVlMFFLcUpJLVVzeTZDb185ZVZTbExoSW5RWGUwQlhOWDhmZDRtZzRxblJSUWNXc2hyRmJEa2RjYmdoTFcweEtMVHdxUWtJbThlbTJPNjZwYzNra3I5akRqa0l1ZnpvSXVSTjVXeHQ0M2RCQzluLWRXUGtxX2luc2xxOUJnNDZoeU96M3BiNFkxZ2lkNUtVX3k5aC1qV2o5a3ItcjJj?oc=5&hl=en-US&gl=US&ceid=US:en,https://www.etvbharat.com,ETV Bharat,"New Delhi: Amid reports that Nepal may soon impose customs duty on goods carried by people travelling from India to that country, the MEA on Thursday said New Delhi remains engaged with Kathmandu on this development.

Spokesperson of the Ministry of External Affairs, Randhir Jaiswal, said this in response to a query during his weekly media briefing here. ""We've also seen some reports about enforcement by Nepalese authorities of a pre-existing provision that outlines the collection of customs duty from cross-border travellers in case they carry items which are purchased in India, of course, and which have a value of over 100 Nepali rupees,"" he said.

""We understand that the government of Nepal has taken this step primarily with the intent to curb informal trade and smuggling. We have also seen a statement by a senior Nepalese official stating that civilians carrying personal goods or household goods will not be obstructed. We remain engaged on these developments,"" Jaiswal said.

He was asked about multiple videos circulating on social media purportedly suggesting that a customs duty might be imposed soon on goods being carried by people while travelling from India to Nepal.","{'https://imgs.etvbharat.com/assets/svg-image/LANGUAGE ICON.svg', 'https://imgs.etvbharat.com/assets/google_trusted.png', 'https://imgs.etvbharat.com/etvbharat/prod-images/24-04-2026/1200-675-26543470-235-26543470-1777002796292.jpg', 'https://imgs.etvbharat.com/etvbharat/prod-images/authors/english-1716535036.jpeg', 'https://sb.scorecardresearch.com/p?c1=2&c2=20416623&cv=4.4.0&cj=1', 'https://imgs.etvbharat.com/assets/images/logo.webp'}","नई दिल्ली, मिथिला मिरर: भारत सँ ओहि देश मे आबय बला लोक द्वारा आबयवला सामान पर नेपाल जल्दिये सीमा शुल्क लगा सकैत अछि, एहि खबरि के बीच एमईए बृहस्पतिदिन कहलनि जे, नई दिल्ली एहि विकास पर काठमांडू सं जुड़ल अछि।

विदेश मंत्रालय के प्रवक्ता रणधीर जायसवाल एहि ठाम अपन साप्ताहिक मीडिया ब्रिफिंग के दौरान एकटा सवाल के जवाब मे कहलनि. हुनी कहलकै कि हम्में नेपाली अधिकारियौ द्वारा पूर्व मौजूदा प्रावधान केरौ प्रवर्तन के बारे मँ कुछ रिपोर्ट भी देखलौ छै जेकरा मँ सीमा पार स॑ जाय वाला यात्री सिनी स॑ सीमा शुल्क के वसूली के रूपरेखा देलऽ गेलऽ छै, अगर वू ऐसनऽ सामान ले जाय छै जे भारत स॑ खरीदलऽ जाय छै, निश्चित रूप स॑, आरू जेकरऽ कीमत १०० नेपाली रुपया स॑ भी अधिक छै ।

जयसवाल कहलनि जे, हम सब बुझैत छी जे नेपाल सरकार ई कदम मुख्य रूप स अनौपचारिक व्यापार आ तस्करी पर लगाम लगेबाक उद्देश्य स उठेलक अछि।हमसब नेपाली एकटा वरिष्ठ अधिकारी क बयान सेहो देखलहुं अछि जे व्यक्तिगत सामान या घरेलू सामान ल कए चलय वाला नागरिक कए कोनो बाधा नहि होएत। हम सब एहि सब घटनाक्रम पर लागल रहैत छी।

हुनका स॑ सोशल मीडिया प॑ फैललऽ कईएक वीडियो के बारे म॑ पूछलऽ गेलै जेकरा म॑ कथित तौर प॑ कहलऽ गेलऽ छै कि भारत स॑ नेपाल जाय के दौरान लोगऽ द्वारा ढोबै वाला सामान प॑ जल्दिये कस्टम ड्यूटी लगैलऽ जाय सकै छै ।"
Nepal's Shree Airlines obtains approval for int'l ops - ch-aviation,Nepal's Shree Airlines obtains approval for int'l ops  ch-aviation,2026-04-24 04:03:33,https://news.google.com/rss/articles/CBMilgFBVV95cUxOZlFDUnRQYVBSSkVYc2lGcTg1MktyY1BNbmJBUTNCbWRmNy1aVDRWRlBPdWNHU2RCd0gwUk53Mk9sR2JCZ0NHN245UjcwZmlvbWx6eDNnaHoxMXByZ0hraUdEbDhuMF9seDRweHZ2b0JyRTdmQ3B2STF5c3JiSGRTOTBQSTNsVVJVU1p4cFFUVGVUMVRVOHc?oc=5&hl=en-US&gl=US&ceid=US:en,https://www.ch-aviation.com,ch-aviation,"Our Data and News subscriptions grant you access to our extensive databases for Commercial and Business Aviation. You can read our Exclusive News Stories, look up Aircraft Operators, analyse global aircraft fleets, browse hundreds of thousands of Airline Schedules, or find email addresses of Senior Managers to contact. We've got you covered on more than 51,000 Operators, 110,000 Aircraft, and 14,000 Airports. Need Intelligence to make informed decisions? These subscriptions are for you.

What you need to know:","{'https://www.ch-aviation.com/static/img/footer-website-preview.png', 'https://www.ch-aviation.com/images/stockPhotos/9830/7ef5d53035baa53409ac03f866362c0b902e0595.jpg', 'https://www.ch-aviation.com/images/stockPhotos/2608/a28645b642e31492b151a8a9ead45cc14aded959.jpg', 'https://www.ch-aviation.com/images/stockPhotos/6564/c713dd120b68311ad7e2596c049ae91c9da269f4.jpg', 'https://www.ch-aviation.com/images/stockPhotos/8170/54fdec4d3d5c0b5516fbbe02408a6a5e850889f1.jpg', 'https://www.ch-aviation.com/static/img/icons/icon-profile-dark.svg', 'https://www.ch-aviation.com/images/stockPhotos/6933/46317a587bed31e3f7a01e4424e5fdbe373dc8c7.jpg'}","हमर डाटा आ न्यूज सदस्यता अहां कें वाणिज्यिक आ व्यवसायिक उड्डयन कें लेल हमर व्यापक डाटाबेस कें पहुंच प्रदान करयत छै. अहां हमर एक्सक्लूसिव न्यूज स्टोरी पढ़ि सकय छी, एयरक्राफ्ट ऑपरेटर देख सकय छी, वैश्विक विमान बेड़ा के विश्लेषण क सकय छी, लाखों एयरलाइन शेड्यूल ब्राउज क सकय छी, या संपर्क करय लेल वरिष्ठ प्रबंधक के ईमेल पता खोजि सकय छी. हम अहाँ के 51,000 सं बेसी ऑपरेटर, 110,000 एयरक्राफ्ट, आ 14,000 एयरपोर्ट पर कवर केने छी. सूचित निर्णय लेबय लेल बुद्धि चाही? ई सदस्यता अहाँक लेल अछि।

अहां के की जानय के जरूरत अछि:"
