title,description,published date,url,publisher.href,publisher.title,full_article,images,translated
Eight killed in Iranian missile strike on Israel’s Beit Shemesh; rescue operations underway - Nepal News | Nepal's First Online News Portal,Eight killed in Iranian missile strike on Israel’s Beit Shemesh; rescue operations underway  Nepal News | Nepal's First Online News Portal,2026-03-01 13:15:44,https://news.google.com/rss/articles/CBMi0gFBVV95cUxQeUV6MV9UT1lYcFFFMklTYmR2UHVkU1JhallxWTJVYVlpRUVVVy1mUmpnQ3JmY0FHUnlub2lYWVhoQmdPdjI4T2R6VmJkWDlWZUJtRktoak43TmwtVUN3dWo3NEt5Ni1IX3ZWeDN0RVNSU3N1dEwzRmRNY1dmU21EM19Rdy1qcDVZQnJack1tWTI1c0RSN3NaRU9xdlo0aUw2Y0tHbmwxZXBhSDlfckk5eVlVRmhVcDJnXzJ0SHpQTWJFY1hyTHFBZUhvTlhQR3k3MWc?oc=5&hl=en-US&gl=US&ceid=US:en,https://english.nepalnews.com,Nepal News | Nepal's First Online News Portal,"BEIT SHEMESH: At least eight people have been killed in Beit Shemesh following the latest missile attack launched from Iran, according to Israeli authorities.

The Israel Defense Forces (IDF) said that Home Front Command search and rescue units, medical teams, and a helicopter for casualty evacuation are currently operating at the impact site. The commander of the Home Front Command is en route to the scene to oversee operations.

In a statement, the IDF Spokesperson’s Unit said that an initial review confirmed the early warning system functioned as intended and was activated in the Beit Shemesh area prior to the impact. The circumstances surrounding the missile strike are still under investigation.

Emergency response efforts remain ongoing as authorities assess the full extent of casualties and damage.","{'https://english.nepalnews.com/wp-content/uploads/2026/03/IRANNNN.jpeg', 'https://english.nepalnews.com/wp-content/uploads/2026/03/DOHA.jpeg', 'https://english.nepalnews.com/wp-content/uploads/2026/03/iran.jpeg', 'https://english.nepalnews.com/wp-content/uploads/2026/03/CABINET.jpg', 'https://english.nepalnews.com/wp-content/uploads/2026/03/irann.jpeg', 'https://english.nepalnews.com/wp-content/uploads/2026/03/BLAST.jpeg', 'https://english.nepalnews.com/wp-content/uploads/2025/01/Nepal-news-white.png', 'https://english.nepalnews.com/wp-content/uploads/2025/01/cloudy-day.png', 'https://english.nepalnews.com/wp-content/uploads/2025/01/air-quality.png', 'https://english.nepalnews.com/wp-content/uploads/2025/01/direct-flight.png', 'https://english.nepalnews.com/wp-content/uploads/2026/02/america-1.webp', 'https://english.nepalnews.com/wp-content/uploads/2025/01/close.png', 'https://english.nepalnews.com/wp-content/uploads/2025/01/gold.png', 'https://english.nepalnews.com/wp-content/uploads/2026/03/inbound7922411986294486180.jpg', 'https://english.nepalnews.com/wp-content/uploads/2025/01/change.png', 'https://english.nepalnews.com/wp-content/uploads/2026/03/NOC-Dhangadi-oil-Depo.jpg'}","बेत शेमेश : इजरायली अधिकारियऽ के अनुसार ईरान स॑ शुरू करलऽ गेलऽ ताजा मिसाइल हमला के बाद बेत शेमेश म॑ कम स॑ कम आठ लोगऽ के मौत होय गेलऽ छै ।

इजरायल रक्षा बल (आईडीएफ) न॑ कहलकै कि होम फ्रंट कमांड केरऽ खोज आरू बचाव इकाई, मेडिकल टीम, आरू हताहतऽ क॑ खाली करै लेली एगो हेलीकॉप्टर अभी इम्पैक्ट साइट प॑ काम करी रहलऽ छै । होम फ्रंट कमांड के कमांडर ऑपरेशन के देखरेख के लेल मौका पर पहुंचय के रास्ता पर छथिन्ह.

एक बयान मँ आईडीएफ केरौ प्रवक्ता इकाई नँ कहलकै कि प्रारंभिक समीक्षा मँ ई बात के पुष्टि करलौ गेलौ छै कि पूर्व चेतावनी प्रणाली इरादा के अनुसार काम करै छै आरू प्रभाव स॑ पहल॑ बेत शेमेश क्षेत्र मँ सक्रिय होय गेलऽ छेलै । मिसाइल हमला के परिस्थिति के जांच एखन धरि चलि रहल अछि.

आपातकालीन प्रतिक्रिया के प्रयास जारी छै, कैन्हेंकि अधिकारियऽ न॑ जानमाल आरू नुकसान के पूरा विस्तार के आकलन करी रहलऽ छै ।"
"10 killed, scores injured as protests turn violent near US Consulate in Pakistan’s Karachi - Nepal News | Nepal's First Online News Portal","10 killed, scores injured as protests turn violent near US Consulate in Pakistan’s Karachi  Nepal News | Nepal's First Online News Portal",2026-03-01 13:25:44,https://news.google.com/rss/articles/CBMi0AFBVV95cUxNXy1UUGthZ2ZCOTNaUllOZTRVMTFzWm8tQVRnTFQxMTBrcmNUR0FQN19mUnJZTThGLXNLazZCamh0WWJyRENTU2tyUW5QbGxOSVZlRDI0MmN1SllqX0JYbVFld2tnTDFFNHVHZlk5YXJPNWwtZmZnWnV4SktLZzB6RTJQQjdKcWx3c3N6dW40NnNWTk9YdHhiS0ZQUnhOdFYzRW53d2drWnZBaXdaZE1DdkIwSXd1LS1HLS1OM3ExQlR3R3IyRzFBU2pKNk02VFF4?oc=5&hl=en-US&gl=US&ceid=US:en,https://english.nepalnews.com,Nepal News | Nepal's First Online News Portal,"KARACHI: At least 10 people were killed and dozens injured on Sunday after violent clashes erupted between police and protesters on MT Khan Road as crowds marched toward the US Consulate in Karachi. The protests followed the killing of Iran’s Supreme Leader Ayatollah Ali Khamenei in a joint US-Israeli air strike.

The Edhi Welfare Organisation’s information wing confirmed that nine people were initially killed and several others injured near Mai Kolachi Road amid firing and unrest. All victims were shifted to the Civil Hospital Karachi’s Trauma Centre. Hospital authorities said 32 injured individuals were brought in for treatment, while the identification of the deceased was underway. One injured person later succumbed to wounds, raising the death toll to 10.

Those killed include 23-year-old Kazim, 26-year-old Mubarak, 25-year-old Adil, 25-year-old Abbas, 20-year-old Khawar Abbas, 28-year-old Sajid Ali, and 23-year-old Muhammad Ali.

According to an official statement from the Sindh government, demonstrators breached the external security perimeter of the US Consulate, entered the premises, and caused damage.

Interior Minister Mohsin Naqvi, in a video message, said Sunday was “a day of mourning for the Muslim Ummah, as well as for the people of Iran and Pakistan.” He said every Pakistani citizen shared the grief of the Iranian people and urged protesters not to take the law into their own hands, calling for peaceful demonstrations.

The US Embassy in Islamabad said it was monitoring demonstrations at US consulates in Karachi and Lahore, as well as calls for protests in Islamabad and Peshawar. It advised US citizens in Pakistan to follow local news, remain alert, avoid large crowds, and ensure their STEP (Smart Traveller Enrollment Programme) registration was up to date.

Religious leader Allama Syed Shahenshah Hussain Naqvi also appealed for calm in a video message, saying the Muslim Ummah was mourning the assassination of Iran’s Supreme Commander. He urged the public to remain peaceful, warning that Pakistan was already facing internal and external security challenges. He described the protests outside the US Consulate in Karachi as distressing.

In response to the violence, the Sindh government formed a high-level Joint Investigation Team (JIT) to conduct an impartial inquiry into the incident. The government reiterated that while peaceful protest is a constitutional right, vandalism, violence, and taking the law into one’s own hands are unacceptable.

Sindh Home Minister Ziaul Hasan Lanjar sought immediate details from the Additional Inspector General of Karachi, ordered enhanced security at sensitive installations, and called for alternative traffic routes to be arranged. He said law enforcement agencies were fully alert and monitoring the situation closely, warning that strict action would be taken against anyone disrupting law and order.

Sindh Chief Minister Murad Ali Shah expressed sorrow over the assassination of Ayatollah Khamenei and said the people of Sindh stood in solidarity with Iran during this time of grief. Commenting on the Karachi incident, he termed the violence “extremely regrettable” and ordered impartial investigations. He stressed that at a time when the country faced a war-like situation, undermining law and order was unacceptable.

Police said tear gas was fired to disperse protesters, who responded with stone-throwing. A traffic police post in Sultanabad was set on fire, while heavy police contingents remained deployed on MT Khan Road. Traffic routes leading to Numaish Chowrangi were closed, and alternative routes were provided.

Protests were also reported in Islamabad and Lahore. In Islamabad, Tehreek-e-Jafaria Pakistan announced a protest and plans to encircle the US Embassy, prompting authorities to seal the Red Zone, deploy additional forces, and enforce Section 144, banning all gatherings. In Lahore, protesters staged a sit-in outside the Press Club after Zuhr prayers, raising anti-US slogans as security around the US Consulate was tightened.

Pakistani authorities across the country remain on high alert as tensions persist.","{'https://english.nepalnews.com/wp-content/uploads/2026/03/IRANNNN.jpeg', 'https://english.nepalnews.com/wp-content/uploads/2026/03/DOHA.jpeg', 'https://english.nepalnews.com/wp-content/uploads/2026/03/iran.jpeg', 'https://english.nepalnews.com/wp-content/uploads/2026/03/CABINET.jpg', 'https://english.nepalnews.com/wp-content/uploads/2026/03/BLAST.jpeg', 'https://english.nepalnews.com/wp-content/uploads/2026/03/irann.jpeg', 'https://english.nepalnews.com/wp-content/uploads/2025/01/Nepal-news-white.png', 'https://english.nepalnews.com/wp-content/uploads/2025/01/cloudy-day.png', 'https://english.nepalnews.com/wp-content/uploads/2025/01/air-quality.png', 'https://english.nepalnews.com/wp-content/uploads/2025/01/direct-flight.png', 'https://english.nepalnews.com/wp-content/uploads/2026/02/america-1.webp', 'https://english.nepalnews.com/wp-content/uploads/2025/01/close.png', 'https://english.nepalnews.com/wp-content/uploads/2025/01/gold.png', 'https://english.nepalnews.com/wp-content/uploads/2026/03/inbound7922411986294486180.jpg', 'https://english.nepalnews.com/wp-content/uploads/2025/01/change.png', 'https://english.nepalnews.com/wp-content/uploads/2026/03/NOC-Dhangadi-oil-Depo.jpg'}","कराची, मिथिला मिरर: कराची में अमेरिकी वाणिज्य दूतावास के तरफ भीड़ बढ़ला के बाद एमटी खान रोड पर पुलिस आ प्रदर्शनकारी के बीच हिंसक झड़प के बाद रविदिन कम सं कम 10 लोक के मौत भ गेल आ दर्जनों लोक घायल भ गेल। ई विरोध प्रदर्शन ईरान केरऽ सर्वोच्च नेता आयातल्लाह अली खामेनी केरऽ अमेरिका आरू इजरायल केरऽ संयुक्त हवाई हमला म॑ हत्या के बाद करलऽ गेलऽ छै ।

एधी कल्याण संगठन केरऽ सूचना प्रकोष्ठ न॑ ई बात के पुष्टि करलकै कि गोलीबारी आरू अशांति के बीच माई कोलाची रोड के पास शुरू म॑ नौ लोगऽ के मौत होय गेलै आरू कई लोग घायल होय गेलै । सब पीड़ित के सिविल अस्पताल कराची के ट्रॉमा सेंटर में भेज देल गेल. अस्पताल अधिकारी के कहनाय छनि जे 32 घायल व्यक्ति के इलाज के लेल आनल गेल अछि, जखन कि मृतक के पहचान जारी अछि. बाद मे एकटा घायल व्यक्ति के घायल भ गेल, जाहि सं मृतक के संख्या 10 भ गेल.

मारल गेल लोक मे 23 वर्षीय काजिम, 26 वर्षीय मुबारक, 25 वर्षीय आदिल, 25 वर्षीय अब्बास, 20 वर्षीय खवर अब्बास, 28 वर्षीय साजिद अली, आ 23 वर्षीय मुहम्मद अली शामिल छथि।

सिंध सरकार केरऽ आधिकारिक बयान के अनुसार प्रदर्शनकारी न॑ अमेरिकी वाणिज्य दूतावास केरऽ बाहरी सुरक्षा परिधि के उल्लंघन करी क॑ परिसर म॑ प्रवेश करी क॑ नुकसान पहुँचैलकै ।

गृहमंत्री मोहसिन नकवी नँ एगो वीडियो संदेश मँ कहलकै कि रविवार क “मुस्लिम उम्मा के साथ-साथ ईरान आरू पाकिस्तान के लोगौ लेली शोक के दिन छै ।” हुनी कहलकै कि हर पाकिस्तानी नागरिक ईरानी जनता के दुख के हिस्सा छै आरू प्रदर्शनकारी सिनी स॑ आग्रह करलकै कि वू कानून क॑ अपनऽ हाथ म॑ नै लेबै आरू शांतिपूर्ण प्रदर्शन करै के आह्वान करलकै ।

इस्लामाबाद मँ अमेरिकी दूतावास नँ कहलकै कि हुनी कराची आरू लाहौर मँ अमेरिकी वाणिज्य दूतावास मँ प्रदर्शन के साथ-साथ इस्लामाबाद आरू पेशावर मँ विरोध प्रदर्शन के आह्वान प नजर रखी रहलौ छै । एकरा म॑ पाकिस्तान म॑ अमेरिकी नागरिकऽ क॑ स्थानीय खबरऽ के पालन करै, सतर्क रहना, बड़ऽ भीड़ स॑ बचै आरू ई सुनिश्चित करै के सलाह देलऽ गेलऽ छै कि ओकरऽ STEP (स्मार्ट ट्रैवलर एनरोलमेंट प्रोग्राम) रजिस्ट्रेशन अपडेट छै ।

धार्मिक नेता अल्लामा सैयद शाहेनशाह हुसैन नकवी न॑ भी एगो वीडियो संदेश म॑ शांति के अपील करतें हुअ॑ कहलकै कि मुस्लिम उम्मा ईरान केरऽ सुप्रीम कमांडर केरऽ हत्या के शोक मनाबै छै । हुनी जनता स॑ शांति स॑ बनलऽ रहै के आग्रह करतें हुअ॑ चेतावनी देलकै कि पाकिस्तान क॑ पहल॑ स॑ ही आंतरिक आरू बाहरी सुरक्षा चुनौती के सामना करना पड़॑ छै । कराची म॑ अमेरिकी वाणिज्य दूतावास के बाहर विरोध प्रदर्शन क॑ परेशान करै वाला बतैलकै ।

हिंसा के जवाब में सिंध सरकार न॑ ई घटना के निष्पक्ष जांच करै लेली एगो उच्च स्तरीय संयुक्त जांच दल (जीआईटी) के गठन करलकै । सरकार न॑ दोहरैलकै कि शांतिपूर्ण विरोध संवैधानिक अधिकार छै, लेकिन तोड़फोड़, हिंसा, आरू कानून क॑ अपनऽ हाथ म॑ लेना अस्वीकार्य छै ।

सिंध केरऽ गृहमंत्री जियाउल हसन लंजर न॑ कराची केरऽ अपर महानिरीक्षक स॑ तत्काल विवरण मँगलकै, संवेदनशील इंस्टालेशनऽ प॑ सुरक्षा बढ़ाबै के आदेश देलकै आरू वैकल्पिक यातायात मार्ग के व्यवस्था करै के आह्वान करलकै । ओ कहलनि जे, कानून प्रवर्तन एजेंसी पूर्ण रूप सं सतर्क अछि आ स्थिति पर बारीकी सं नजरि राखि रहल अछि, जाहि मे कानून व्यवस्था के बाधित करय वाला के खिलाफ कड़ा कार्रवाई के चेतावनी देल गेल अछि.

सिंध केरऽ मुख्यमंत्री मुराद अली शाह न॑ आयातल्लाह खामेनी केरऽ हत्या प॑ दुख व्यक्त करतें हुअ॑ कहलकै कि ई शोक केरऽ ई समय म॑ सिंध केरऽ जनता ईरान के साथ एकजुटता के साथ खड़ा छै । कराची केरऽ घटना प॑ टिप्पणी करतें हुअ॑ हुनी हिंसा क॑ “अत्यंत अफसोसजनक” बतैलकै आरू निष्पक्ष जांच के आदेश देलकै । हुनी जोर देलकै कि जब॑ देश क॑ युद्ध जैसनऽ स्थिति के सामना करना पड़॑ छै, वू समय म॑ कानून-व्यवस्था क॑ कमजोर करना अस्वीकार्य छै ।

पुलिस के कहनाय अछि जे प्रदर्शनकारी के तितर-बितर करय लेल आंसू गैस चलाओल गेल छल, जेकर जवाब पाथर फेंकल गेल छल. सुल्तानाबाद के एकटा ट्रैफिक पुलिस चौकी मे आगि लगा देल गेल, जखन कि एमटी खान रोड पर भारी पुलिस टुकड़ी तैनात रहल। नुमैश चौरंगी जाय वाला यातायात मार्ग बंद भ गेल, आ वैकल्पिक मार्ग सेहो उपलब्ध कराओल गेल.

इस्लामाबाद आ लाहौर मे सेहो विरोध प्रदर्शन के खबर अछि. इस्लामाबाद म॑ तहरीक-ए-जफरिया पाकिस्तान न॑ विरोध प्रदर्शन के घोषणा करी क॑ अमेरिकी दूतावास क॑ घेरै के योजना बनयलकऽ छै, जेकरा स॑ अधिकारियऽ न॑ लाल क्षेत्र प॑ मुहर लगाय क॑ अतिरिक्त बल तैनात करी क॑ धारा १४४ लागू करी क॑ सब जुटान प॑ रोक लगाय देलकै । लाहौर मँ जुहर नमाज के बाद प्रेस क्लब के बाहर प्रदर्शनकारी नँ अमेरिकी वाणिज्य दूतावास के आसपास सुरक्षा कड़ा करला के बाद अमेरिका विरोधी नारा लगैलकै ।

तनाव जारी रहला के कारण देश भर के पाकिस्तानी अधिकारी हाई अलर्ट पर छै ।"
