title,description,published date,url,publisher.href,publisher.title,full_article,images,translated
Oscar applications open for Nepali films - The Rising Nepal,Oscar applications open for Nepali films  The Rising Nepal,2025-08-28 02:41:32,https://news.google.com/rss/articles/CBMiUEFVX3lxTE41ekhtMDdLWjRFZUhScGdrc1I4N0ZmZVZYbFFWalVjZXVZMGFwWjVtaEhIZXdCQzF4Mk03ZUptT2NGa0pIOEYzZmZnblk0Z2lF?oc=5&hl=en-US&gl=US&ceid=US:en,https://risingnepaldaily.com,The Rising Nepal,,{'https://lh3.googleusercontent.com/J6_coFbogxhRI9iM864NL_liGXvsQp2AupsKei7z0cNNfDvGUmWUy20nuUhkREQyrpY4bEeIBuc=s0-w300'},
Nepal lose to Bangladesh again at SAFF U17 Women’s Championship - The Kathmandu Post,Nepal lose to Bangladesh again at SAFF U17 Women’s Championship  The Kathmandu Post,2025-08-28 02:48:45,https://news.google.com/rss/articles/CBMirgFBVV95cUxOMVhpVkFUQWNSMkpEVG1lTXJFZXFMVVRBV0FRVzBDTkptN1J4SjBidWZGTWF5eGVDRkYwNU92NllRMlZaNGMwU2M2SHZGV2FITVJpc0hTNUpqdFdoT0FKVTFMRkRHRzNGamhJUnVWY19YeTZ3anFrTF9YWFRpZDRyNGN0bU1iS2JtdVhjNTNUYnY2SnZJVFQyeTZPSkJlT2pVRTJ4bUt2YlJUR0RpMUE?oc=5&hl=en-US&gl=US&ceid=US:en,https://kathmandupost.com,The Kathmandu Post,,{'https://lh3.googleusercontent.com/J6_coFbogxhRI9iM864NL_liGXvsQp2AupsKei7z0cNNfDvGUmWUy20nuUhkREQyrpY4bEeIBuc=s0-w300'},
Social media owners given 7-day ultimatum for registration - The Rising Nepal,Social media owners given 7-day ultimatum for registration  The Rising Nepal,2025-08-28 02:51:07,https://news.google.com/rss/articles/CBMiUEFVX3lxTFBjTzdsSWFzZXZ3bjlyS3ZQczlDa1JGd3hpQzBLWUozcTUyTU9DZDlrNjYxMjVqbFFSWnZ5X1Ytd3lfWG5NekZHeGZvbzRMeFU4?oc=5&hl=en-US&gl=US&ceid=US:en,https://risingnepaldaily.com,The Rising Nepal,,{'https://lh3.googleusercontent.com/J6_coFbogxhRI9iM864NL_liGXvsQp2AupsKei7z0cNNfDvGUmWUy20nuUhkREQyrpY4bEeIBuc=s0-w300'},
"Nepal’s FDI pledges soar, but actual inflows stay paltry - The Kathmandu Post","Nepal’s FDI pledges soar, but actual inflows stay paltry  The Kathmandu Post",2025-08-28 03:29:08,https://news.google.com/rss/articles/CBMinwFBVV95cUxPM01xNzNTSk45NHd0NHpJMHd1ckFLYnFpM3ozaE9WVy1VMThpSzg4c0Q0bmJfNG9RZVNvQ1JTSy1vTlczeDlTbWx1TjBmU1Z4S01OU0dqMXJjN0VJVVFQUWw4UGUxMzB3c0pabjVRY1hJYVdoclB5SFFsV2cwdVFuWVpXUDBEeUFVUHNQdk1rR0c4cWo5UVdnSXg3Z3NIZXM?oc=5&hl=en-US&gl=US&ceid=US:en,https://kathmandupost.com,The Kathmandu Post,,{'https://lh3.googleusercontent.com/J6_coFbogxhRI9iM864NL_liGXvsQp2AupsKei7z0cNNfDvGUmWUy20nuUhkREQyrpY4bEeIBuc=s0-w300'},
Local body to operate ropeway to transport vegetables - The Rising Nepal,Local body to operate ropeway to transport vegetables  The Rising Nepal,2025-08-28 03:45:27,https://news.google.com/rss/articles/CBMiUEFVX3lxTE1ZVXQ5Y2t5UG9Qbzl4UFlXZW5tNFhaWFZrR25tRWxrcTBrQlZyM0VGVk9fbllZd0hDMW13Ul9Xam1USG82dG16QXYzbnVraExE?oc=5&hl=en-US&gl=US&ceid=US:en,https://risingnepaldaily.com,The Rising Nepal,,{'https://lh3.googleusercontent.com/J6_coFbogxhRI9iM864NL_liGXvsQp2AupsKei7z0cNNfDvGUmWUy20nuUhkREQyrpY4bEeIBuc=s0-w300'},
Nepali parataekwondo practitioner Palesha Goverdhan isn’t done making history - Asia News Network,Nepali parataekwondo practitioner Palesha Goverdhan isn’t done making history  Asia News Network,2025-08-28 03:47:49,https://news.google.com/rss/articles/CBMipAFBVV95cUxQUm9YUDNQVTBDdVFrY1RLSmZjRENnN3BnVDhZMElXZ2NfTEJtWW1Bb0hHZXB1cGpJSHMwWUVGMjUtRWVUX0MxZm1CbGppem5yWUNqaE9yNXJSQmwxejZCbWFIcEtrcS1HSXVkZkVZRkk3N2ZMaGxCM3pDZHYwRXJBeUc1YjRaX3RNbGl4b2k2ZmhCaWdkbDlEWVI0RGs3MHU3VnV0WQ?oc=5&hl=en-US&gl=US&ceid=US:en,https://asianews.network,Asia News Network,,{'https://lh3.googleusercontent.com/J6_coFbogxhRI9iM864NL_liGXvsQp2AupsKei7z0cNNfDvGUmWUy20nuUhkREQyrpY4bEeIBuc=s0-w300'},
"Nepal's Yeti Airlines rebounds with demand, more ATRs - ch-aviation","Nepal's Yeti Airlines rebounds with demand, more ATRs  ch-aviation",2025-08-28 03:48:16,https://news.google.com/rss/articles/CBMilgFBVV95cUxQMU5EUk5SVjBCemV5NlB4djRBTTZfN21TNmlLZjhfNW5PanVaanZqMV94MnNFcGpMbGtYNnlnWHVCb0Q0MkJULVROclBTbUh6NTNHYVJ4QW5PUnZ5VDl6U0U1QjVjeEdxcDh6aEl5bjhuY1RTaXdSMnN2Q25VV2N1QlVkVUdfWEt4dldReUhjdHVIWmhMTlE?oc=5&hl=en-US&gl=US&ceid=US:en,https://www.ch-aviation.com,ch-aviation,,{'https://lh3.googleusercontent.com/J6_coFbogxhRI9iM864NL_liGXvsQp2AupsKei7z0cNNfDvGUmWUy20nuUhkREQyrpY4bEeIBuc=s0-w300'},
Invest In Ergonomics For Workers’ Safety - The Rising Nepal,Invest In Ergonomics For Workers’ Safety  The Rising Nepal,2025-08-28 04:07:22,https://news.google.com/rss/articles/CBMiUEFVX3lxTE85Q1V3cnctcVRHMGdoTEZjZWNybXlVM1d6aXFqVHpoSmtTakFUb1dYVnV1bTh4Z1Qya21ZeVcwbk1OZUFhLXN5enlYZG1GU3k3?oc=5&hl=en-US&gl=US&ceid=US:en,https://risingnepaldaily.com,The Rising Nepal,,{'https://lh3.googleusercontent.com/J6_coFbogxhRI9iM864NL_liGXvsQp2AupsKei7z0cNNfDvGUmWUy20nuUhkREQyrpY4bEeIBuc=s0-w300'},
Nepal fall to South Australia in last-ball thriller - Khabarhub,Nepal fall to South Australia in last-ball thriller  Khabarhub,2025-08-28 04:26:57,https://news.google.com/rss/articles/CBMiWEFVX3lxTE5ZYnZQR3pobjdtSmVvU2VQZ2ViUEVZRnNncXh1WENpNDFwLVpPMTJRbUlrSDJwU1hHRk41V3lycUYzNU0zXzRzeWNWTzFLeGVNeVpoa3RaRWQ?oc=5&hl=en-US&gl=US&ceid=US:en,https://english.khabarhub.com,Khabarhub,,{'https://lh3.googleusercontent.com/J6_coFbogxhRI9iM864NL_liGXvsQp2AupsKei7z0cNNfDvGUmWUy20nuUhkREQyrpY4bEeIBuc=s0-w300'},
"Nepal court rules Naga sadhus’ nudity is tradition, not obscenity - ucanews.com","Nepal court rules Naga sadhus’ nudity is tradition, not obscenity  ucanews.com",2025-08-28 04:40:00,https://news.google.com/rss/articles/CBMioAFBVV95cUxQa1hfYXJSZkRJWVB3LVJxM3pKSGlzYkJRMndITTZBd1VuaDU1b3VkcTYyZm9vY0FlZjRZbnhNWEZ1dGxyakUtWTRvWTFRRDVlMnNqQXZsNVljY2NvMnBlaWxsRk9Zc1ZnZ2E4UmVqbXhPVXQwMk43bDNFZ2lJUDN5RlVJODY4T25JdGNXOG9zamNsVklSallKV2R0SlVDNGhE0gGfAUFVX3lxTFBvd2JqUF91a1BxeXNseHUwMmU1WkYwTFpnVldpNEdwSTN6OXktekVwRHNhUjRvQ2t4RFdzcjNSTnhmblBvR25jTkZ0ZXhXYTJtNjZWNDRXdTVaMXVzMkQyNUt0QXc5MlpSckMtYmdXY1RVS0djRzBXVWQ2NDFoc3hJVUE5eGdtSDFqM2t0VXFJbVRKdnZWcVNGS1h0NlVBZw?oc=5&hl=en-US&gl=US&ceid=US:en,https://www.ucanews.com,ucanews.com,,{'https://lh3.googleusercontent.com/J6_coFbogxhRI9iM864NL_liGXvsQp2AupsKei7z0cNNfDvGUmWUy20nuUhkREQyrpY4bEeIBuc=s0-w300'},
"Intel warns of 3 Jaish terrorists entering Bihar via Nepal, state on high alert - India Today","Intel warns of 3 Jaish terrorists entering Bihar via Nepal, state on high alert  India Today",2025-08-28 04:43:28,https://news.google.com/rss/articles/CBMiywFBVV95cUxNaXppaVF5SkJPWTYwY1hxOWY1YVZSbElzNzlmSXZvWWZJNUlicFlsUnZucmdyOTU3VWF4UnNoUEFZYnM0LUljbjdaemVpXzVudm1BeFAyTVU0a21OTjh5VVZLdGtFeUpjMV9IbzVNdF83NHRfMzRseDJKbVZycXpNSFpkVXpZaHczUFBvUXlpS1RfdlhfVElQaFVkQlFWOEhtRmJVRS0wUzBFNEY5WEM3a0tIZFVjYWMxUGF1ZmJiU29Wc0daY09MNHJvY9IB0AFBVV95cUxNdFVleW41aDdGdUpTS3h0bmRyWVg0WFhSdjl6eC00X1lINEIteVRyOWVHS29jRUNPQWFMMHlpcXBiaFdxbkZlZUlEMU4tY0hZdXQtQ1oxcTY2TlMyWGdxVUs4UVJxckRQM0FyWXJzOGpQZmtmOGk0ZklBQnNwUkZpdzdlcHZSd1ZXbFh6dzc4QUdNaEdIdEdvUUhDX2p1Q2pXMUFaYmtzekwyQVpsWWhmbDNlT1JMMEJYX0V2anF0ejZWY2MyVnVOU2djSzZ5MWFp?oc=5&hl=en-US&gl=US&ceid=US:en,https://www.indiatoday.in,India Today,,{'https://lh3.googleusercontent.com/J6_coFbogxhRI9iM864NL_liGXvsQp2AupsKei7z0cNNfDvGUmWUy20nuUhkREQyrpY4bEeIBuc=s0-w300'},
High Alert In Bihar After Intel Warns Of 3 Pakistani Terrorists Entering State Via Nepal - ETV Bharat,High Alert In Bihar After Intel Warns Of 3 Pakistani Terrorists Entering State Via Nepal  ETV Bharat,2025-08-28 04:52:20,https://news.google.com/rss/articles/CBMi2wFBVV95cUxPM3EyNmhxSjNKRi1iUXNwOU5WNXpIRnl0QjZMRURweFVBbF9iZHBQeUJKSjJlc1RQTXFSZ2pXZDh4QUpMMTJzNVBGcUphVHc2SmoxZlN2Z0hIVXR5c0didmJuVlJIdzlGSGRGMGF4aFM2STM2OUV3cll1ZjVkeXFnd3VpcWs5MmhvbEVWV2VUSFJMVnIxMWxkemJYLUF3RU9uT1pGbXNBMHVaeU5rZlZXMG5HTktqdFhaSHZfMlhqcUYzWlRaUEwwYm9KZnJ1TVZIb1dtRjJzTU9sX0XSAeABQVVfeXFMTnhXcjJiMHEtQlMtcmd4cGdBRFQzbUlfMjRndnM2aW5WNzNuX29Ub1RBX3BONWN3VGRONi1hYkVBWEVoWmM2OHhITFJxZF9ScjI2Sl9pVnNxdHNMS3JKNnl6M3o3U2tLZVF3M1R3UUpfc2xyNGdETndSWm1URkNNWUt0UFNCOUJ4alhxS2RrSzR1c202amdUNC1YaC1aeXAtejh6WDIyc3hqRmNqX0RJakgyaTU1c3VPN1FjclBmSW1jOWk0UHBQLWctVHRvazJDM1htNHdOVDUzcnN6N2tKU2M?oc=5&hl=en-US&gl=US&ceid=US:en,https://www.etvbharat.com,ETV Bharat,,{'https://lh3.googleusercontent.com/J6_coFbogxhRI9iM864NL_liGXvsQp2AupsKei7z0cNNfDvGUmWUy20nuUhkREQyrpY4bEeIBuc=s0-w300'},
"China’s Anhui Highlights Its Rich History, Cultural Masterpieces, And Must-Visit Destinations In A Powerful Nepal Promotion - Travel And Tour World","China’s Anhui Highlights Its Rich History, Cultural Masterpieces, And Must-Visit Destinations In A Powerful Nepal Promotion  Travel And Tour World",2025-08-28 04:59:45,https://news.google.com/rss/articles/CBMi_gFBVV95cUxPU1E4TUdDY3VNTWJUcng0dTlsdmJRTHZlRzQwbTFzRmh3S1Z3R0lRRWdsS2FFcTlLR05tYWg1azdWNUhLWmd3bHo0ODZZenUydEZiSWVPeWw5Y1FacFJERVBYcGJKMl85MWNwaFc4NE42UGVzVlFpenZzN1JsX0VkbzhmM0NhVXpmNThfUFBRNFZadEhlb1lGZzV3bGtvOWpXX042WC1xWmMwQlZZU2piMllQQXFpNGNRREZjYWpMNl9LU2xKOC1RdURCbHJIQnJwQTVKS2EtQ19rM2VPa0dqQi1yNDEzTnRsSVQtcEtJcVdxUWNZUHdjS2gxY0NNUQ?oc=5&hl=en-US&gl=US&ceid=US:en,https://www.travelandtourworld.com,Travel And Tour World,,{'https://lh3.googleusercontent.com/J6_coFbogxhRI9iM864NL_liGXvsQp2AupsKei7z0cNNfDvGUmWUy20nuUhkREQyrpY4bEeIBuc=s0-w300'},
Nepal okays Indian travelers to carry USD 5000 worth of Indian currency - myRepublica,Nepal okays Indian travelers to carry USD 5000 worth of Indian currency  myRepublica,2025-08-28 05:21:32,https://news.google.com/rss/articles/CBMixAFBVV95cUxNX2JtWU5iRC02YXdpTDF2TzdkaUFjS0c1amVRT0hMN0xLZjZvQlN1ek8tX2pidlF5ZFFzRVBoVFYwMEZMSXVnS2ZyYzBSckx5VGluMTRNOFp5Qjlwa291U21ubE0wNGtUd1pMZUZUSjdwNk5neDVESGpBdFRlejNIM3hDOTg5cV9jZ3dYekFPb0oxcENEM0dIeGVVcEJ6YjJzYWc5TDJQZHZjU1NaS080aldWMmR2V01FRkt1RDgxdDRJUkRH?oc=5&hl=en-US&gl=US&ceid=US:en,https://myrepublica.nagariknetwork.com,myRepublica,,{'https://lh3.googleusercontent.com/J6_coFbogxhRI9iM864NL_liGXvsQp2AupsKei7z0cNNfDvGUmWUy20nuUhkREQyrpY4bEeIBuc=s0-w300'},
"Intel warns of 3 Jaish terrorists entering Bihar via Nepal, state on high alert - MSN","Intel warns of 3 Jaish terrorists entering Bihar via Nepal, state on high alert  MSN",2025-08-28 05:29:48,https://news.google.com/rss/articles/CBMixgFBVV95cUxOLTBwQzN1ejhlOHZoR2JXR3MyQk52bkF2dmFlbnZ4UHNYcXpheUI5VXZ2MjJ3cTNIZVUxQWl1NjFpTGkxYVB0am1pZTJ0NDRSc3J2b09tOTFzVURGLVdyN1lHX2c2dDN5NEsxS0dab0pmbUI3NUhlM25IQlljQU0zZDdsQ1gyb2FIMUFUckZyeXFVdWRjZTVMM28zMWtCSl9wbS02RXd3Q201V2FMQmJQZVFaSlhnTmRpUDctcjNrdHYzVV9DYkE?oc=5&hl=en-US&gl=US&ceid=US:en,https://www.msn.com,MSN,,{'https://lh3.googleusercontent.com/J6_coFbogxhRI9iM864NL_liGXvsQp2AupsKei7z0cNNfDvGUmWUy20nuUhkREQyrpY4bEeIBuc=s0-w300'},
"Bihar On High Alert As 3 Jaish Terrorists Enter Via Nepal, Cops Release Sketch - NDTV","Bihar On High Alert As 3 Jaish Terrorists Enter Via Nepal, Cops Release Sketch  NDTV",2025-08-28 05:29:58,https://news.google.com/rss/articles/CBMixwFBVV95cUxOVklHUkZIUTVtUUgtTGZZbS1qWTN6UmJkeGxlVk5WaVFjV0tQUmNyb2dxS0JVX0tuclBCN1JSTE1DMmpKZWJ0V3VQbG9UbWZQdkIxdExVY05QT1dTTmR6UUVicTh2MVo4N2VMVkNXQUxjZUpmcTZ2azN0d0lUSVNyb0NldHE1X29yU0pkaVQ1S2RWTTRmZk1pTWFVN0dPQ1dnMnRhRTNGXzZjTHZpU3Z4ZzAyck9zOXExZjFydTZWMVVJQzVpdUZn0gHPAUFVX3lxTE96UVliZEI0T2JCTEYxMUVGa2V6VnAtcEJYT2dKYWI3cEtVVHJweUVyZzZoTTdOaUJzOXZCcTBnNVM0SUdyVDBRWEFMNlhvTXM0Zkw5Znl1RF82UW1ER3ZxMlpsYk1ObDkzX3YyRkViSmEtOGtwQVFLbE1wSWZ3bmhwcHdNcEplSlFGYkJiSGEzSEdBY3RTNk5vUUI2MHBXUnBVeWxQeU43QzIzbHRiRlFpTFhGZ2pudm85TkNqQi1HbWV1M1d6WnNQZFIyWXFzQQ?oc=5&hl=en-US&gl=US&ceid=US:en,https://www.ndtv.com,NDTV,,{'https://lh3.googleusercontent.com/J6_coFbogxhRI9iM864NL_liGXvsQp2AupsKei7z0cNNfDvGUmWUy20nuUhkREQyrpY4bEeIBuc=s0-w300'},
Food shortage in remote Nepali villages after sole supply trail cut off by landslides - Asia News Network,Food shortage in remote Nepali villages after sole supply trail cut off by landslides  Asia News Network,2025-08-28 05:33:16,https://news.google.com/rss/articles/CBMisAFBVV95cUxNNDJXV0wwRm1VX2l1T2hiQ3pDams2SFFzR1JQeWZ5WF8zNjNveFRTX0JPWjZqRjJfS0p2RFFrQUxQMXNMM19Jby13bjJ1ckxNTUxmTE1iVHJNTHhkdGVwdVZlYm5EVWVlUkttS1pseVZ6ZWlSbjFWMm5HLUlZZHdvLXV2cFJsMDdEaEx2MllTUUV3WTZMNC0zVUEwLUlnWGxhaF9vMXNuZlZKYkpPanE4Yg?oc=5&hl=en-US&gl=US&ceid=US:en,https://asianews.network,Asia News Network,,{'https://lh3.googleusercontent.com/J6_coFbogxhRI9iM864NL_liGXvsQp2AupsKei7z0cNNfDvGUmWUy20nuUhkREQyrpY4bEeIBuc=s0-w300'},
PM Oli to attend China's WWII anniversary - The Himalayan Times,PM Oli to attend China's WWII anniversary  The Himalayan Times,2025-08-28 05:36:09,https://news.google.com/rss/articles/CBMiggFBVV95cUxNNENlSDI3eFphUlFFamRjWDZra2dQQWFCaHZWbWVqbXRndnlPUEU4Q3Y4Z0VxTFZpWmtLRFkyNEhBcF9CNGY4NDR0enNMdUUzRV9hNnNpVGlpOGhDRDRwS3hEUkVBSUdrLVRsQTBmSDdaQ196STZ1WU1kLTQ5OTNiZUVB?oc=5&hl=en-US&gl=US&ceid=US:en,https://thehimalayantimes.com,The Himalayan Times,,{'https://lh3.googleusercontent.com/J6_coFbogxhRI9iM864NL_liGXvsQp2AupsKei7z0cNNfDvGUmWUy20nuUhkREQyrpY4bEeIBuc=s0-w300'},
Bihar on high alert after 3 Jaish terrorists enter via Nepal - newsarenaindia.com,Bihar on high alert after 3 Jaish terrorists enter via Nepal  newsarenaindia.com,2025-08-28 05:42:40,https://news.google.com/rss/articles/CBMiogFBVV95cUxPYmxyMUNUTTZlS0g5bHVxQm5BdmVkMW0tUk9oZmNSeHQtZHdLZVFfb2NraFpQanR4dGJPRlVoNWRsUmpSQ2lSS2xndG52cHFIb2pGTHBTTGdsTmRVR2hVUk5DS2VlbUp5cnU1dVJscnVqX2RRaHZyalVYUWttczlaanBKaXMxNDdfUVdIM2U3dVZSOGZPbjRzQTlqV09BTzZESFE?oc=5&hl=en-US&gl=US&ceid=US:en,https://newsarenaindia.com,newsarenaindia.com,,{'https://lh3.googleusercontent.com/J6_coFbogxhRI9iM864NL_liGXvsQp2AupsKei7z0cNNfDvGUmWUy20nuUhkREQyrpY4bEeIBuc=s0-w300'},
"Bihar On High Alert As 3 Jaish Terrorists Enter Via Nepal, Cops Release Sketch - MSN","Bihar On High Alert As 3 Jaish Terrorists Enter Via Nepal, Cops Release Sketch  MSN",2025-08-28 05:54:56,https://news.google.com/rss/articles/CBMixAFBVV95cUxNVk1MeE0yaExtZ0tybDRZYUpkcl85dEMtd0sxZWxEYzY1NXBMQWlINkgydVJKbnh1SHdBcWs5Sll5OHhIOUljS0lFTTU4RW5fTVd4cmFsSjM4R2NXRVZxNUtyR1BNT2ptX3JGVlFSdW83R3BmWWhMemFuaWU1UmNtTGNpakZqSU9hZWpWcUVvQVBvRmFIMGdkeFh5X1lLbWRIMV9YdEpyQVhhMGVIZFVqUWdmVUVKQ2htUENiUS1yTlZjNlRS?oc=5&hl=en-US&gl=US&ceid=US:en,https://www.msn.com,MSN,,{'https://lh3.googleusercontent.com/J6_coFbogxhRI9iM864NL_liGXvsQp2AupsKei7z0cNNfDvGUmWUy20nuUhkREQyrpY4bEeIBuc=s0-w300'},
