title,description,published date,url,publisher.href,publisher.title,full_article,images,translated
"The World's Current Most Prolific Serial Killer Is An Elephant In Nepal Named Dhurbe, Who Has Accounted For 25 ""Death Stalks"" In 14 Years - Barstool Sports","The World's Current Most Prolific Serial Killer Is An Elephant In Nepal Named Dhurbe, Who Has Accounted For 25 ""Death Stalks"" In 14 Years  Barstool Sports",2026-07-16 18:45:42,https://news.google.com/rss/articles/CBMivAFBVV95cUxNal8tMm5PZlFnT1J3Xy00OEQwcFpJMjdsb0FqTTM3MmkxZ3Z5aFROd0VBUklRLWxLTDhxZDlCQU54ODNBaVh2eWVBMVAtMmRjdFpKUlI2ZGZSaVluQlJodERtX1dTSDVqSkE4M3g1Tk1qenZVSERXVV9hc3BmYW1kX1lzb3g2N0sxR29LcVNZalRBRnhpdlZzaWNYT1JqaHNac3RJS3plTm85UDJpOVRmNFM4Y3lTNWxHaFk1SQ?oc=5&hl=en-US&gl=US&ceid=US:en,https://www.barstoolsports.com,Barstool Sports,"Unfiltered. Unapologetic. In Your Inbox.

By submitting this form, I agree to this site's Terms of Use and Privacy Policy.","{'https://chumley.barstoolsports.com/union/2026/04/13/SBC_WBTR_896x694-1.06391697.jpg?crop=896%3A672%2Csmart&format=pjpg&width=3840&auto=webp&quality=85%2C75', 'https://chumley.barstoolsports.com/union/getty/2026/07/16/GettyImages-674272430.a992f504.webp?crop=0.46%2C0.38%2Cx0.29%2Cy0.29%2Csafe&width=560', 'https://chumley.barstoolsports.com/union/2023/11/03/download-app-store.31b8cc33.svg?width=3840&auto=webp&quality=85%2C75&format=pjpg', 'https://chumley.barstoolsports.com/content/2025/04/14/b8b0e3ca.viral-ugc-thumbnail?width=3840&auto=webp&quality=85%2C75&format=pjpg', 'https://chumley.barstoolsports.com/union/2025/03/27/stool_hosted.cbf11ad8.png', 'https://www.facebook.com/tr?id=167901609887021&ev=PageView&noscript=1', 'https://www.facebook.com/tr?id=1619539764955780&ev=PageView&noscript=1', 'https://www.facebook.com/tr?id=264308648709278&ev=PageView&noscript=1', 'https://chumley.barstoolsports.com/union/2023/11/03/logo.b8652ed3.png?width=3840&auto=webp&quality=85%2C75&format=pjpg', 'https://chumley.barstoolsports.com/union/2023/11/03/download-play-store.8e08c55c.svg?width=3840&auto=webp&quality=85%2C75&format=pjpg', 'https://chumley.barstoolsports.com/union/2024/09/05/Football.5d6b0549.jpg?crop=896%3A672%2Csmart&format=pjpg&width=3840&auto=webp&quality=85%2C75', 'https://www.facebook.com/tr?id=128242077872939&ev=PageView&noscript=1'}","बिना छानने वाला। अक्षम्य। अपने इनबॉक्स में।

ई फॉर्म जमा क' हम एहि साइट के उपयोग के शर्त आओर गोपनीयता नीति सं सहमत छी."
Devotees in Nepal celebrate a chariot festival — and other news in pictures - The Times,Devotees in Nepal celebrate a chariot festival — and other news in pictures  The Times,2026-07-16 23:01:00,https://news.google.com/rss/articles/CBMirgFBVV95cUxOZE1EemlGS2VDX2R2ZkZEY013YVM5NmRsMS1ocEFFYTJiSmFiNVpqQUNiZkJ4UG9QUmJBRDIwa3lYWUFyUk1IWkswcURJTUJzVDNGc3lRQXRtd2VuNTNPbnpOakpqbC1pQ3dMWnlqNEkwMGpUTkNIZkNpR1k3dnU2RHllckxnTUhYdENoWXBJY0FnREZkSGJVQzFkTEtYU3VzVHVWTFlrMlRVc1FLUnc?oc=5&hl=en-US&gl=US&ceid=US:en,https://www.thetimes.com,The Times,"Continue reading

Enjoy unlimited digital access.","{'https://www.thetimes.com/wp-content/plugins/tm-wp-frontend/assets/images/the-times-logo.webp', 'https://www.thetimes.com/imageserver/image/efe85f47-73af-48e9-b6d3-2748cfa073fc.jpg?strip=all&format=webp&crop=6000px%2C3375px%2C0px%2C471px&resize=1200'}","पढ़ना जारी रखें

असीमित डिजिटल पहुँच के आनंद लिय।"
"Nepal protests have a new Gen Z face, this time in anti-Balen Shah govt camp - The Indian Express","Nepal protests have a new Gen Z face, this time in anti-Balen Shah govt camp  The Indian Express",2026-07-16 23:25:21,https://news.google.com/rss/articles/CBMiwwFBVV95cUxNeFJsYzlLYmdzZ3hFdVJNZGR4UWxCUXRZZGlNYzR4Mkg2NnBTQ1ZRVzZCYXJwS1ZUakFMdlkxaWg5T0lPcmIzTUJOY2t4OEVCdlgtLTktSFU5aXhPaHd3YnVBSlVUaldRQTJxUXpHdm5VY2E5c0dqR1E5SWFFV0g5ZU93MXpCdllvTGVvbTlGMTF4Rk5HRVNKMDRSZHRTVmdTZXVZNmxJRUVmNjJQclhxOEJYV2Rfc05Fd0QweU1ic1kzTFnSAcoBQVVfeXFMTVJxQnNrSlhUdC1iVHZQTnZ5cmVNR1N4ZnlTWFplMmd6VHJ1WWl5SHZlU19nWTZ6S19JLTBUOFN1UDV0YWo4R09QbmJsc0hjdWtkckRwQzVSd0d1TDF2OVhWRW5kaGx1TnI2N0M4MG54c2FLOGFyMHBmcXpQc09kUmNGUlZoU29zZlZnUEI4VDEwZE8yblRkV1hnYWxDOGpaY0FGM05uaE1NRklqcVA4aFFJeXVjYXh4bUdXaDRNWnBZQURTQkFpTFhfdw?oc=5&hl=en-US&gl=US&ceid=US:en,https://indianexpress.com,The Indian Express,"Home Minister Sudhan Gurung’s accusations against the Opposition of politicising Ganesh’s death further fuelled the mass anger.

Also Read | Nepal's Balen government under Gen Z attack after young man sets self on fire

Realising the building tensions over the incident, the government got Ganesh admitted to a top hospital and Gurung announced he was personally monitoring his case, with arrangements made for his air-transfer to AIIMS in Delhi if needed. However, Gopal died after nearly a day of battling for his life.

On Monday, he was cremated in Kathmandu, at a funeral site overlooking the famous Pashupatinath Temple, with his old parents travelling around 700 km from Mugu, a backward region of Nepal, for the last rites. The family agreed to cremate the body after the government agreed to their demands.

The funeral was attended by several families among the over thousand displaced during a demolition drive in Kathmandu in April, which has also been seeing protests, including a bid to take a motorcycle procession into the Central Secretariat.

Story continues below this ad

Also Read | Old ties, new Kathmandu: What India now needs to negotiate with Nepal

On Wednesday, in an outreach to another group of protesters, the Principal Secretary to PM Shah, Kumar Ben, appealed to about 50,000 contract employees in the government sector to return to work, promising that their services would not be terminated.

As per the conditions agreed to with Ganesh’s family, the government has announced a five-member team led by a Deputy Inspector General of Police to investigate his death, a job for his wife Ekmaya Pariyar, 20, and funding for their two-year-old daughter’s education. Pariyar, who has done a diploma course in IT, is pregnant with the couple’s second child, and soon after Ganesh’s death, the government cleared a ‘citizenship certificate’ for her, with Gurung personally handing it over. Pariyar did not have the formal certificate, and with the document, she is now entitled to a job and other relief announced by the government.

According to sources, the government may also declare Ganesh a “martyr”, a status enjoyed by hundreds of people, mostly Maoist cadres, who died during agitations over the past 20 years of the country’s troubled history.

The family says the police action in clamping his motorcycle’s wheels distressed Ganesh as he had bought the vehicle on loan and the next instalment was coming up soon. He also had a scuffle with an official, leading to the mobile phone the latter was carrying getting damaged.

Story continues below this ad

Also Read | How New Delhi should deal with the new Kathmandu

Soon after, Ganesh took some petrol out of his locked motorcycle, poured it on himself and set himself on fire.

Ganesh’s brother Madan Nepali, who is four years older, says he is a civil engineer diploma holder but works as a labourer in Kathmandu, while their parents survive on the government’s social security dole. Their eldest brother died around 18 years ago.

“We are Dalits and our parents are marginal farmers who sent us to the city to work honestly, pursue our studies and live with dignity… Ganesh was supporting his family with his earnings,” says Madan.

The two brothers planned to visit their home in October for the festival of Dashain. Madan says they hoped to eventually go abroad, to the Gulf and finally Japan or South Korea after acquiring additional skills.","{'https://images.indianexpress.com/2026/07/p1-ganeshnepali-2cols.jpg', 'https://indianexpress.com/wp-content/themes/indianexpress/images/black-icon-reddit.svg', 'https://indianexpress.com/wp-content/themes/indianexpress/images/default-ie.jpg', 'https://indianexpress.com/wp-content/themes/indianexpress/images/opinion/images/icon-fb-share.svg', 'https://images.indianexpress.com/2026/07/p1-ganeshnepali-2cols.jpg?w=1600', 'https://indianexpress.com/wp-content/themes/indianexpress/images/IE-insta-grey.svg', 'https://indianexpress.com/wp-content/themes/indianexpress/images/print.svg', 'https://indianexpress.com/wp-content/themes/indianexpress/images/x-header.svg', 'https://indianexpress.com/wp-content/themes/indianexpress/images/opinion/images/twitter-preferred.svg', 'https://indianexpress.com/wp-content/themes/indianexpress/images/facebook-icon.svg', 'https://indianexpress.com/wp-content/themes/indianexpress/images/opinion/images/icon-wapp-share.svg', 'https://www.facebook.com/tr?id=444470064056909&ev=PageView&noscript=1', 'https://indianexpress.com/wp-content/themes/indianexpress/images/indian-express-logo-n.svg', 'https://indianexpress.com/wp-content/themes/indianexpress/images/youtube-icon.svg'}","गृहमंत्री सुधन गुरुंग केरऽ विपक्ष प॑ गणेश केरऽ मौत क॑ राजनीतिकरण करै के आरोप न॑ जन आक्रोश क॑ आरू बढ़ा देलकै ।

इहो पढ़ू | नेपालके बलेन् सरकारमे जेन जेड आक्रमणके बाद युवकके स्वयंमे आगि लगाओल गेल

एहि घटना पर भवनक तनाव कए अहसास करैत सरकार गणेश कए एकटा शीर्ष अस्पताल मे भर्ती करा देलक आ गुरुंग घोषणा केलथि जे ओ व्यक्तिगत रूप स हुनकर मामला पर नजरि राखि रहल छथि, जरूरत पड़ला पर हुनका दिल्ली क एम्स मे हवाई स्थानांतरण क व्यवस्था कैल गेल। मुदा, लगभग एक दिनक जानक लड़ाई लड़लाक बाद गोपालक मृत्यु भ गेलनि।

सोमदिन काठमांडू मे, प्रसिद्ध पशुपतिनाथ मंदिर के नजारा देखय वाला अंतिम संस्कार स्थल पर हुनकर अंतिम संस्कार भेल, जाहि मे हुनकर बूढ़ माता-पिता नेपाल के पिछड़ल क्षेत्र मुगु सं करीब 700 किलोमीटर दूर अंतिम संस्कार के लेल यात्रा केलखिन्ह. सरकार के मांग पर सहमत भेला के बाद परिवार लाश के दाह संस्कार करय लेल तैयार भ गेल।

अप्रैल म॑ काठमांडू म॑ विध्वंस अभियान के दौरान विस्थापित हजार स॑ अधिक लोगऽ के बीच कईएक परिवार न॑ अंतिम संस्कार म॑ भाग लेलकै, जेकरा म॑ भी विरोध प्रदर्शन होय ​​रहलऽ छै, जेकरा म॑ मोटरसाइकिल जुलूस क॑ केन्द्रीय सचिवालय म॑ ल॑ जाय के बोली भी शामिल छेलै ।

कथा एहि विज्ञापनक नीचाँ जारी अछि

इहो पढ़ू | पुरान संबंध, नव काठमांडू : भारत कए आब नेपाल स वार्ता करबाक की जरूरत अछि

बुधदिन प्रदर्शनकारी के एकटा आओर समूह के आउटरीच मे पीएम शाह के प्रधान सचिव कुमार बेन सरकारी क्षेत्र के करीब 50 हजार ठेका कर्मचारी सं काज पर वापस आबय के अपील केलखिन्ह आओर वादा केलनि जे हुनकर सेवा समाप्त नहि होएत.

गणेश केरऽ परिवार के साथ सहमत शर्तऽ के अनुसार सरकार न॑ हुनकऽ मौत केरऽ जांच करै लेली पुलिस उप महानिरीक्षक के नेतृत्व म॑ पांच सदस्यीय टीम के घोषणा करलकै, हुनकऽ पत्नी एकमाया परियार (20) क॑ नौकरी आरू हुनकऽ दू साल के बेटी केरऽ पढ़ाई लेली फंडिंग के घोषणा करलकै । आईटी मे डिप्लोमा कोर्स करय वाला परियार एहि जोड़ी के दोसर बच्चा सं गर्भवती छथिन्ह आओर गणेश के मौत के तुरंत बाद सरकार हुनका लेल ‘नागरिकता प्रमाणपत्र’ क्लियर क देलखिन्ह, जाहि मे गुरुंग व्यक्तिगत रूप सं एकरा सौंप देलखिन्ह. परियार के पास औपचारिक प्रमाणपत्र नै छेलै, आरू दस्तावेज के साथ अब॑ सरकार द्वारा घोषित नौकरी आरू अन्य राहत के हकदार छै ।

सूत्रऽ के अनुसार सरकार गणेश क॑ “शहीद” भी घोषित करी सकै छै, जेकरऽ दर्जा सैकड़ों लोगऽ क॑ मिललऽ छै, जेकरा म॑ अधिकतर माओवादी कार्यकर्ता छेलै, जे देश केरऽ परेशान इतिहास केरऽ पिछला २० साल म॑ आंदोलन के दौरान मरी गेलऽ छेलै ।

परिवार के कहनाय छनि जे हुनकर मोटरसाइकिल के पहिया पर क्लैंप करय मे पुलिस के कार्रवाई गणेश के परेशान क देलक किएक त ओ गाड़ी उधार पर खरीदने छल आओर अगिला किस्त जल्दिये आबि रहल छल. एकटा अधिकारी सं सेहो हुनकर झगड़ा भेल छल, जाहि सं बाद वाला मोबाइल फोन के नुकसान पहुंचल छल.

कथा एहि विज्ञापनक नीचाँ जारी अछि

इहो पढ़ू | नवका काठमांडू स नई दिल्ली कए कोना निपटबाक चाही

ओकर किछुए देर बाद गणेश अपन ताला लागल मोटरसाइकिल मे सँ किछु पेट्रोल निकालि अपना पर ढारि अपना केँ आगि लगा देलक।

गणेश के भाई मदन नेपाली जे चारि साल पैघ छथि, कहैत छथि जे ओ सिविल इंजीनियर डिप्लोमा धारक छथि मुदा काठमांडू मे मजदूर के काज करैत छथि, जखन कि हुनकर माता-पिता सरकार के सामाजिक सुरक्षा के डोल पर गुजर करैत छथि. हुनकर जेठ भाई के मृत्यु करीब 18 साल पहिने भ गेल छल।

मदन कहैत छथि जे हम सब दलित छी आ हमर माता-पिता सीमांत किसान छथि जे हमरा सब कए इमानदारी स काज करबा लेल, पढ़ाई करबा लेल आ इज्जत स जीबा लेल शहर पठेलथि... गणेश अपन कमाई स अपन परिवार क भरण-पोषण क रहल छलाह।

दुनू भाइ अक्टूबर मे दशैन पावनि मे अपन घर जेबाक योजना बनौने छलाह । मदन के कहना छै कि हुनका उम्मीद छेलै कि अंततः अतिरिक्त कौशल प्राप्त करला के बाद विदेश, खाड़ी आरू अंततः जापान या दक्षिण कोरिया जाय के मौका मिलतै ।"
Srawan Sankranti Celebrated Across Nepal - Ratopati,Srawan Sankranti Celebrated Across Nepal  Ratopati,2026-07-16 23:37:30,https://news.google.com/rss/articles/CBMigAFBVV95cUxOd0hEU3hYTDdtTDhwU2puTkRLVWN2NXRlaTlSVGpSa0JQWjdUdU1JYzE3TFlISUJhNVMxMFVzVHNPa1dDcWN5Qk4tcnRoMFRvM3BIQjQ0QzIwQ25QZTZsTkxtMnJmQ29PUFk4ZndmNGtERlNlc1ZONU40Q1I0THlCUg?oc=5&hl=en-US&gl=US&ceid=US:en,https://english.ratopati.com,Ratopati,"Kathmandu. Celebrated on the first day of Saun according to the solar calendar, Srawani (Karkat) Sankranti is being observed across the country today with bathing and charity.

Today marks the first day of the Sun's entry into the Cancer sign after completing its transit in Gemini, and it is an ancient tradition to celebrate it across the country as Srawani Sankranti. Since the Sun moves south from Saun, the southward journey begins today. The southward journey starting on Saun 1 and the northward journey starting on Magh 1 are celebrated with special significance in the Vedic Sanatan tradition.

As most Nepalis are involved in farming, they are busy with agricultural work throughout the month of Asar. According to Prof. Dr. Devmani Bhattarai, there is a tradition of shedding lice to prevent skin diseases caused by mud and dirt during this period.

According to tradition, there is a custom of worshipping a demon named Kandarak and throwing embers by keeping medicinal plants such as Kagbhalaayo, Kukurdaino, Luthe Jhar, Pani Amla, Lemon, Guava, and Naspaati. In Nepali society, there is a practice of rattling winnowing fans, blowing conch shells, ringing bells, and closing doors according to one's ancestral tradition when shedding lice.

The month of Saun is also considered a month for worshipping Lord Shiva. There is also a tradition of women wearing green bangles and green clothes, reflecting their closeness to nature. As the month of Saun is dedicated to Lord Shiva, devotees throng Pashupatinath and other Shiva temples across the country.","{'https://english.ratopati.com/build/img/logo-rp.png', 'https://npcdn.ratopati.com/media/news/swagat-nepal_leaMR8WG10.jpg', 'https://npcdn.ratopati.com/media/news/anjeer_NvZ4iTcapf.jpg', 'https://rpcdn.ratopati.com/archived-media/Bijuli.jpg', 'https://npcdn.ratopati.com/media/news/whatsapp-image-2026-07-17-at-06.41.37_joXeVtlKTU.jpg', 'https://npcdn.ratopati.com/media/news/air-india_kQnSoIMKdP.jpg', 'https://npcdn.ratopati.com/media/news/samajik-suraksha_qMvsaG1nPi.jpg', 'https://npcdn.ratopati.com/media/news/u0k4OkOLSp.jpg', 'https://npcdn.ratopati.com/media/news/ram-sahaya-yadav_uJ4tmzpkZ4.jpg', 'https://npcdn.ratopati.com/media/news/745010405_1398912845625619_4616184679202585230_n_EmUanW7UmX.jpg', 'https://npcdn.ratopati.com/media/news/churpi_8gbtRxRVcu.jpg', 'https://npcdn.ratopati.com/media/authors/ratopati_science_RGmmSpmAnu.jpg', 'https://npcdn.ratopati.com/media/news/supreme-court-(1)_cvUCBlwFTZ.jpg', 'https://npcdn.ratopati.com/media/news/saune-sombar-(1)_sJDQmZrgcB.jpg', 'https://npcdn.ratopati.com/media/news/rohit_eVeBrS9AVd.gif', 'https://npcdn.ratopati.com/media/news/heart-attack_XLogPANPMq.jpg'}","काठमांडू। सौर पंचांग के अनुसार सौन के पहिल दिन मनायल जाय वाला श्रावणी (करकट) संक्रांति आई देश भर में स्नान आ दान के संग मनाओल जा रहल अछि |

मिथुन राशि में अपनऽ पारगमन पूरा करला के बाद सूर्य केरऽ कर्क राशि में प्रवेश के पहलऽ दिन छै, आरू एकरा देश भर में श्रावणी संक्रांति के रूप में मनाबै के प्राचीन परंपरा छै । चूँकि सूर्य सौनसँ दक्षिण दिस बढ़ैत अछि तेँ दक्षिण दिसक यात्रा आइसँ शुरू होइत अछि । सौन १ सँ शुरू होमय बला दक्षिण दिसक यात्रा आ माघ १ सँ शुरू होमय बला उत्तर दिसक यात्रा वैदिक सनातन परम्परा मे विशेष महत्वक संग मनाओल जाइत अछि।

जेना कि अधिकांश नेपाली खेती-बाड़ी मे लागल रहैत छथि तेँ पूरा मास भरि खेती-बारी मे व्यस्त रहैत छथि । प्रो.डॉ.देवमणि भट्टराईके अनुसार एहि अवधिमे थाल आ गंदगीसँ उत्पन्न त्वचा रोगसँ बचाव हेबाक लेल जूँ बहाबाक परम्परा अछि ।

परम्पराक अनुसार कन्दरक नामक राक्षसक पूजा कऽ कगभलायो, ​​कुकुरदैनो, लुथे झार, पानी आम्ला, नींबू, अमरूद, आ नस्पती आदि औषधीय पौधा राखि अंगारी फेकबाक प्रथा अछि | नेपाली समाज मे जूँ बहाबैत काल पंखा खड़खड़ाहटि, शंखक गोला बजाबय, घंटी बजबैत, अपन पैतृक परम्पराक अनुसार दरबज्जा बन्न करबाक प्रथा अछि ।

सौन मास के भगवान शिव के पूजा के लेल सेहो महीना मानल जाइत अछि | महिला केरऽ हरियर चूड़ी आरू हरियर कपड़ा पहनै के परंपरा भी छै, जेकरा स॑ प्रकृति के साथ ओकरऽ निकटता के झलक मिलै छै । सौन मास भगवान शिव के समर्पित होय के कारण देश भर में पशुपतिनाथ आ अन्य शिव मंदिर में भक्त के भीड़ लागैत अछि |"
