title,description,published date,url,publisher.href,publisher.title,full_article,images,translated
"In Nepal's Chitwan, tourist pools spell possible trouble for environment & wildlife - Mongabay.com","In Nepal's Chitwan, tourist pools spell possible trouble for environment & wildlife  Mongabay.com",2024-01-30 08:20:26,https://news.google.com/rss/articles/CBMiaWh0dHBzOi8vbmV3cy5tb25nYWJheS5jb20vMjAyNC8wMS90b3VyaXN0LXBvb2xzLXNwZWxsLXBvc3NpYmxlLXRyb3VibGUtZm9yLWNoaXR3YW5zLWVudmlyb25tZW50LXdpbGRsaWZlL9IBAA?oc=5&hl=en-US&gl=US&ceid=US:en,https://news.mongabay.com,Mongabay.com,"Hoteliers say they believe there’s a growing demand for swimming pools in Nepal’s Sauraha tourist town due to a domestic tourism surge.

However, unregulated proliferation of pools raises ecological concerns for Chitwan National Park and its diverse wildlife.

Potential environmental threats include chlorine impact, disinfectant by-products and heavy metal contamination, prompting calls for sustainable tourism practices.

Chitwan, NEPAL — Rajendra Aryal (45) likes visiting the tourist town of Sauraha on the fringes of Chitwan National Park in Nepal. He enjoys the wilderness, the jungle safaris and the natural beauty of the place. These days, he also likes to take a dip in the swimming pools.

“Whenever I come to Sauraha with my wife and kids, I prefer to stay in a hotel with a swimming pool,” says Aryal, father of a 10-year-old son and 12-year-old daughter. “If we get the extra facility of a swimming pool without paying extra, then why not?” Aryal, who identifies himself as a businessman, tells Mongabay on a sunny September afternoon in Sauraha. “I bring my family over every time I have some business-related work in Chitwan,” he adds.

Like the Aryals, many Nepali tourists coming to Sauraha for their holidays these days want to stay in a hotel with swimming pools, says Rajendra Dhami, immediate past chair of Chitwan Guide Association.

Following the COVID-19 pandemic, businesses in the tourist town on the banks of the East Rapti River have realized that domestic tourists are equally important, as they are the ones who helped them keep afloat during the pandemic years when international travel was severely affected. “That’s the reason they want to attract domestic tourists,” adds Dhami.

According to estimates by local hoteliers, around 70% of the hotel room bookings in Sauraha come from domestic tourists. The estimate is also corroborated by figures from Chitwan National Park, visited by most of the tourists who go to Sauraha. Park records show that of the 190,458 tourists who visited Chitwan in the 2023-24 fiscal year, 155,671 (around 81%) were Nepalis. In 2017-18 (right before the pandemic), of the 61,624 tourists who visited the park, 33,645 (around 54%) were Nepali.

However, this has resulted in the proliferation of unregulated and unmonitored swimming pools in the ecologically sensitive area, home to different species of macroinvertebrates, fish and the iconic gharial crocodiles. According to the Chitwan Hotel Association, around 15-16 hotels out of the 140-odd hotels in Sauraha now boast a swimming pool. According to association president Ganga Giri, a swimming pool comes with a price tag of 3-150 million rupees (between $22,500 and $1.1 million).

A GIS-based investigation carried out by Mongabay in collaboration with the Center for Data Journalism Nepal (CDJN) found that at least two dozen hotels and resorts on the banks of the East Rapti and its tributaries have built swimming pools.

During our ground reporting, we found that hotel owners extract groundwater from the banks of the river, filter it and use it to fill their pools. They then use various chemicals such as chlorine to keep the pool free from microbes. “We don’t release the water into the river, as refilling the pool takes a lot of water and resources,” says Ram Kumar Aryal, former head of the National Trust for Nature Conservation’s Biodiversity Conservation Center and the owner of Rhino Lodge in Sauraha. “We have a system in place to filter the water and recirculate it in the swimming pool,” he adds.

Maintenance staff and technicians building pools in Sauraha also tell Mongabay that although the pools have outlets to drain the water, they don’t do so until it’s absolutely necessary, as refilling water is costly.

Ganga Giri, president of the hotel association of Chitwan and the owner of Park Safari Resort, which recently built a swimming pool on the banks of the Rapti, also echoes Aryal. “As we need to release the water only once every 2-3 years, it’s not going to pollute the river,” says Giri.

Hotel owners say they rarely flush out all the water from a pool and the chlorine they use doesn’t make it to the river, as it is highly reactive. But there is a possibility that chemicals used in pools do make it to the river, says Rajesh Sada, head of freshwater programs at WWF Nepal. “At an individual level, they may be right. The amount of water they release into the river is not significant enough to cause damage. But if you look at the total number of pools, which is increasing every year, as a whole and at scale, we can say that it could become a cause for concern,” he tells Mongabay.

Research shows that chlorine, used to kill microbes such as bacteria, viruses and other pathogens in pools, has lethal consequences. “Freshwater species such as fish and macroinvertebrates, especially ones that don’t migrate long distances, are likely to be impacted by chlorine contamination,” says Genuine Prajapati, a researcher working on freshwater species in Nepal.

“The macroinvertebrates are a source of food for an array of fish species found in the river system,” she says. Gharials depend on the fish for survival. If the macroinvertebrates die off or consume contaminated food, it is easily passed on to the gharials and even megafauna such as rhinos and tigers, she adds.

“The Rapti is the lifeline of Chitwan, and if anything happens to the gharials, even the rhinos and tigers won’t survive,” says conservationist and former Department of National Parks and Wildlife Conservation officer Bed Kumar Khadka.

In Nepal, local government monitoring mechanisms have been weak due to lack of institutional capacity, and businesses have often been found to skip environmental safeguard practices. “We don’t know if the hotel owners are actually doing what they are saying. They might be dumping water into the river without anyone knowing about it,” says local conservation activist Birendra Mahato.

Dil Bahadur Purja Pun, chief conservation officer at Chitwan National Park, tells Mongabay he has been unaware of the issue. “We haven’t paid attention to the issue as of now. But thank you for asking about it, we will now look into it,” he says when Mongabay contacts him.

Various studies have also shown one other problem with swimming pools: DBPs (disinfectant by-products), which are not only carcinogenic to humans, but also lethal for plants and animals of all shapes and sizes. According to the U.S. Centers for Disease Control and Prevention, DBPs are formed when disinfectants such as chlorine interact with natural organic materials in water in places such as chlorine-treated swimming pools. The organic materials can come from swimmers wearing different types of lotions or sunscreen and form DBPs such as trihalomethanes and halogenated acetic acids. These compounds have been shown to be very toxic to aquatic organisms.

But neither the local government nor the hotels have done any research on DBPs and their pervasiveness in swimming pools across Chitwan, already grappling with heavy metal contamination.

Freshwater expert Subodh Sharma from Kathmandu University says the water in the Rapti could already be contaminated with different traces of heavy metals found in pesticides and fertilizers. “Although we don’t have evidence to support this, we believe that the recent spate of deaths of rhinos in Chitwan could be due to the contamination of both river and groundwater in Sauraha,” he adds. Heavy metal contamination has also been reported in several rivers in India.

In that context, as the hotel owners are using groundwater to fill pools, questions arise about the quality of water being used, he adds. “The groundwater from the Rapti could also very well be contaminating the swimming pools,” adds Sharma, who plans to look at heavy metal contamination in the Rapti in his future research.

Some industry insiders observing the situation say they think the proliferation of swimming pools in Chitwan brings to surface a much more severe underlying problem facing the tourism business in Nepal. Tourism entrepreneur Marcus Cotton, who runs Tiger Mountain hotels and resorts in Chitwan and Pokhara says that most people in Nepal’s tourism business generally lack the insight, understanding and thoughtfulness about their industry. “I think the wider issue is [that] the failure of the industry to embrace sustainability in their own best interests shows very limited awareness, understanding and commitment.”

The proliferation of swimming pools in Sauraha is an example of the “clone mentality” prevalent among hoteliers, he tells Mongabay. Cotton says that building a pool doesn’t guarantee the hotel’s business will automatically grow. “Don’t build a pool and tell the story why with enthusiastic commitment. If taking on a hotel with a pool, opt for chlorine-free sanitization; e.g., salt, again tell the story and focus on a range of deeper, more immersive (no pun intended!) experiences instead of pools. Consider a wild swimming pool…..with free python or cobra,” he tells Mongabay in an email interview.

Even the existing pools are not being used to their optimum, hotel owners say. Giri, the president of the hotel association, says that only Indian and Nepali tourists frequent the pool, not to take a dip, but to take selfies. Western tourists are least bothered about the pool, he tells Mongabay.

That raises a question: Why waste so much water and invest resources in pools in an ecologically sensitive area when it has limited utility? asks Mahato. “The national park doesn’t allow Musahars and Tharus to fish in their own rivers, but it allows hotels to do whatever they please even if their activities put the lifeline of the park supporting endangered species at risk,” he says.

Although Nepal’s national parks have been hailed as a success story for helping recover populations of endangered species such as rhinos and tigers, the success comes at the cost of local Indigenous people’s rights to resources and traditional livelihoods, critics have been saying. “Local communities also feel that while their access to resources is limited, big businesses and hotels have the access and power to do whatever they want,” Mahato adds.

The hotels need to understand that tourists come to Sauraha to see rhinos and tigers, and that’s keeping their businesses afloat, he adds. “But if the river gets polluted, there will be no tigers and rhinos left, and no one will come to Sauraha to keep their businesses running.”

Banner image: A staffer cleans the swimming pool at a hotel in Sauraha, Chitwan. Image by Abhaya Raj Joshi/Mongabay.

This story was produced under an Earth Journalism Network (EJN) fellowship in collaboration with Centre for Data Journalism Nepal (CDJN).

Abhaya Raj Joshi is a staff writer for Nepal at Mongabay. Find him on  @arj272.

Citations:

Demeke, A., & Tassew, A. (2016). A review on water quality and its impact on Fish health. ~ 21 ~ International Journal of Fauna and Biological Studies. Retrieved from https://www.faunajournal.com/archives/2016/vol3issue1/PartA/2-6-4.pdf

Liu, J., & Zhang, X. (2014). Comparative toxicity of new halophenolic DBPs in chlorinated saline wastewater effluents against a marine alga: Halophenolic DBPs are generally more toxic than haloaliphatic ones. Water Research, 65, 64-72. doi:10.1016/j.watres.2014.07.024

Jaiswal, M., Gupta, S. K., Chabukdhara, M., Nasr, M., Nema, A. K., Hussain, J., & Malik, T. (2022). Heavy metal contamination in the complete stretch of Yamuna river: A fuzzy logic approach for comprehensive health risk assessment. PLOS ONE, 17(8), e0272562. doi:10.1371/journal.pone.0272562","{'https://imgs.mongabay.com/wp-content/uploads/sites/20/2020/08/16195114/peru-tigre_-3o17_-75o2-ad.jpg', 'https://no-cache.hubspot.com/cta/default/5981609/ffe07749-0055-4a95-85b3-bce123fc330c.png', 'https://imgs.mongabay.com/wp-content/uploads/sites/20/2017/08/03120007/logo_youtube.jpg', 'https://imgs.mongabay.com/wp-content/uploads/sites/20/2021/02/19192125/Donate-Button-156x45-1.jpg', 'https://news.mongabay.com/wp-content/themes/mongabay_v1/img/series/forest-trackers.jpg', 'https://imgs.mongabay.com/wp-content/uploads/sites/20/2024/01/29093945/kcresort.jpg', 'https://imgs.mongabay.com/wp-content/uploads/sites/20/2023/11/22053938/rubber-thailand-100x100-1.jpg', 'https://news.mongabay.com/wp-content/themes/mongabay_v1/img/series/conservation-effectiveness.jpg', 'https://imgs.mongabay.com/wp-content/uploads/sites/20/2017/09/06145007/rss_icon.jpg', 'https://imgs.mongabay.com/wp-content/uploads/sites/20/2024/01/30053217/rhino-lodge-2-2-1-100x100.jpg', 'https://news.mongabay.com/wp-content/themes/mongabay_v1/img/series/oceans.jpg', 'https://news.mongabay.com/wp-content/themes/mongabay_v1/img/series/indonesias-forest-guardians.jpg', 'https://imgs.mongabay.com/wp-content/uploads/sites/20/2022/11/18003018/mastodon-20.jpg', 'https://imgs.mongabay.com/wp-content/uploads/sites/20/2022/08/25061834/6-Male-gharial-c-Phoebe-Griffith-web-ratio.jpg', 'https://no-cache.hubspot.com/cta/default/5981609/b8716c64-b83b-438b-bd3c-029e57332ac6.png', 'https://imgs.mongabay.com/wp-content/uploads/sites/20/2017/08/03120020/logo_linkedin.jpg', 'https://news.mongabay.com/wp-content/themes/mongabay_v1/img/series/southeast-asian-infrastructure.jpg', 'https://imgs.mongabay.com/wp-content/uploads/sites/20/2020/06/25105752/youtubevideologo.jpg', 'https://imgs.mongabay.com/wp-content/uploads/sites/20/2021/07/03191112/Appicon_v6.png', 'https://imgs.mongabay.com/wp-content/uploads/sites/20/2024/01/29075924/WhatsApp-Image-2024-01-28-at-09.33.27-100x100.jpeg', 'https://news.mongabay.com/wp-content/themes/mongabay_v1/img/series/amazon-conservation.jpg', 'https://news.mongabay.com/wp-content/themes/mongabay_v1/img/series/endangered-environmentalists.jpg', 'https://imgs.mongabay.com/wp-content/uploads/sites/20/2024/01/30053217/rhino-lodge-2-2-1-768x512.jpg', 'https://mongabay-images.s3.amazonaws.com/17/repub_cc.jpg', 'https://in.getclicky.com/101413169ns.gif', 'https://imgs.mongabay.com/wp-content/uploads/sites/20/2022/04/29131311/Palau-archipelago-100x100.jpg', 'https://imgs.mongabay.com/wp-content/uploads/sites/20/2022/01/15035219/support-our-journalism.jpg', 'https://www.mongabay.com/wp-content/uploads/2019/12/android_18x20.jpg', 'https://imgs.mongabay.com/wp-content/uploads/sites/20/2024/01/29144003/9-Salmon-being-traditionally-baked-100x100.jpg', 'https://imgs.mongabay.com/wp-content/uploads/sites/20/2017/08/03115942/logo_instagram.jpg', 'https://imgs.mongabay.com/wp-content/uploads/sites/20/2017/08/29211612/newsletterform_260x38px.jpg', 'https://mongabay-images.s3.amazonaws.com/17/podcast_logo_new.jpg', 'https://news.mongabay.com/wp-content/themes/mongabay_v1/img/series/land-rights-and-extractives.jpg'}","होटल मालिकऽ के कहना छै कि हुनकऽ मानना ​​छै कि घरेलू पर्यटन केरऽ उछाल के वजह स॑ नेपाल केरऽ सौराहा पर्यटक शहर म॑ स्विमिंग पूल केरऽ मांग बढ़ी रहलऽ छै ।लेकिन, पूल केरऽ अनियंत्रित प्रसार चितवान राष्ट्रीय उद्यान आरू ओकरऽ विविध वन्यजीव लेली पारिस्थितिक चिंता पैदा करै छै ।संभावित पर्यावरणीय खतरा मे क्लोरीन प्रभाव, कीटाणुनाशक उप-उत्पाद आ हेवी मेटल दूषितता शामिल छै, जे टिकाऊ पर्यटन प्रथाक कें लेल आह्वान करय छै.चितवान, नेपाल — नेपाल केरऽ चितवान राष्ट्रीय उद्यान केरऽ किनारे पर पर्यटन शहर सौरहा केरऽ यात्रा करना पसंद करै छै ।ओ जंगल, जंगल सफारी आ एहि स्थानक प्राकृतिक सौन्दर्यक आनंद लैत छथि ।आइ-काल्हि स्विमिंग पूल मे डुबकी लगाबय के सेहो नीक लगैत छनि.10 वर्षीय बेटा आ 12 सालक बेटीक पिता, आर्यल कहैत छथि, “जखन कखनो हम अपन पत्नी आ बच्चा सभक संग सौरहा अबैत छी, तखन हम स्विमिंग पूलक संग होटल मे रहब पसिन करैत छी।”“जँ अतिरिक्त भुगतान केने बिना स्विमिंग पूलक अतिरिक्त सुविधा भेटत त’ किएक नहि?”आर्यल, जे अपना के व्यवसायी के रूप में पहचानै छै, सौराहा में सितंबर के एकटा धूप वाला दुपहर में मोंगाबे के कहै छै।ओ आगू कहैत छथि, “हम हर बेर चिटवान मे किछु व्यवसाय स संबंधित काज होइत अछि जखन हम अपन परिवार कए ओहि पार अनैत छी।चीतवान गाइड एसोसिएशन केरऽ तत्कालीन अतीत केरऽ अध्यक्ष राजेन्द्र धामी के कहना छै कि आर्यल के तरह सौरहा केरऽ छुट्टी लेली आजकल बहुत सारा नेपाली पर्यटकऽ के साथ स्विमिंग पूल वाला होटल म॑ रहना चाहै छै ।कोविड-19 महामारी के बाद ईस्ट रैति नदी के किनारे पर्यटक शहर के व्यवसायी सब के ई अहसास छै कि घरेलू पर्यटक के भी ओतने महत्वपूर्ण छै, कैन्हेंकि वू ही महामारी के सालों के दौरान तैरते रहै में मदद करलकै जबे अंतरराष्ट्रीय यात्रा पर भारी असर पड़लै ।धामि आगू कहैत छथि जे इएह कारण अछि जे ओ घरेलू पर्यटक कए आकर्षित करय चाहैत छथि।स्थानीय होटल मालिकऽ के अनुमान के अनुसार सौरहा में होटल केरऽ कमरा केरऽ लगभग 70% बुकिंग घरेलू पर्यटकऽ स॑ आबै छै ।ई अनुमान चिटवान नेशनल पार्क केरऽ आंकड़ा स॑ भी पुष्टि करलऽ गेलऽ छै, जेकरा म॑ सौरहा जाय वाला अधिकांश पर्यटकऽ के दौरा करलऽ गेलऽ छै ।पार्क केरऽ रिकॉर्ड बताबै छै कि 2023-24 केरऽ वित्तीय वर्ष म॑ चिटवान केरऽ दौरा करै वाला 190,458 पर्यटकऽ म॑ स॑ 155,671 (लगभग 81%) नेपालिस छेलै ।2017-18 मे (पक्षालय स ठीक पहिने), जे एहि पार्क मे गेल 61,624 पर्यटक मे स 33,645 (करीब 54%) नेपाली छल।लेकिन एकरऽ परिणामस्वरूप पारिस्थितिकी के दृष्टि स॑ संवेदनशील क्षेत्र म॑ अनियमित आरू अनमॉनिटर स्विमिंग पूल के प्रसार होय गेलऽ छै, जेकरा म॑ मैक्रोइनवर्टेब्रेट, मछली आरू प्रतिष्ठित मगरमच्छ के विभिन्न प्रजाति के घरऽ के घर छै ।चिटवान होटल एसोसिएशन के अनुसार सौराहा के 140-अठी होटल में स लगभग 15-16 होटल आब स्विमिंग पूल के घमंड करैत अछि।एसोसिएशन के अध्यक्ष गंगा गिरी के अनुसार एक स्विमिंग पूल के साथ 3-150 मिलियन रुपया (22,500 डॉलर आरू 11 लाख डॉलर के बीच) के कीमत के साथ आबै छै.मोंंगाबे द्वारा सेंटर फॉर डाटा जर्नलिज्म नेपाल (सीडीजेएन) के सहयोग स॑ करलऽ गेलऽ जीआईएस आधारित जांच म॑ पता चललै कि पूर्वी रैटी आरू ओकरऽ सहायक नदी के तट प॑ कम स॑ कम दू दर्जन होटल आरू रिसॉर्ट न॑ स्विमिंग पूल के निर्माण करलकै ।अपनऽ ग्राउंड रिपोर्टिंग के दौरान हमरा पता चललै कि होटल मालिक नदी केरऽ किनारे स॑ भूजल निकालै छै, ओकरा छानै छै आरू ओकरऽ उपयोग अपनऽ पूल भरै लेली करै छै ।तखन ओ सब विभिन्न रसायन जेना क्लोरीन के उपयोग करैत छथि जाहि सं पूल के सूक्ष्मजीव सं मुक्त राखल जा सकय.नेशनल ट्रस्ट फॉर नेचर कंजरवेशन केरऽ जैव विविधता संरक्षण केंद्र आरू सौराहा केरऽ राइनो लॉज केरऽ मालिक केरऽ पूर्व प्रमुख राम कुमार आर्यल न॑ कहलकै कि हम्में पानी क॑ नदी म॑ नै छोड़ै छियै, कैन्हेंकि पूल क॑ रिफिल करै म॑ बहुत पानी आरू संसाधन छै । के .ओ आगू कहैत छथि जे हमरा सब लग एकटा सिस्टम अछि जे पानि कए फिल्टर करि स्विमिंग पूल मे फेर स परिसंचरण करी।सौरहा में पूल बनाबै वाला रखरखाव के कर्मचारी आरू तकनीशियन भी मंगबे क॑ कहै छै कि हालांकि पूलऽ के पास पानी के निकासी करै लेली आउटलेट छै, लेकिन जब॑ तलक ई बिल्कुल जरूरी नै होय जाय छै, तब॑ तलक वू ऐसनऽ नै करै छै, कैन्हेंकि रिफिलिंग पानी म॑ महँग छै ।होटल एसोसिएशन ऑफ चितवान के अध्यक्ष आरू हाल ही म॑ रपट्टी के तट प॑ स्विमिंग पूल के निर्माण करै वाला पार्क सफारी रिसॉर्ट के मालिक गंगा गिरी भी आर्यल के प्रतिध्वनित करै छै ।गिरी कहै छै, “जैना कि हमरा सब क॑ हर 2-3 साल म॑ एक बार ही पानी छोड़ै के जरूरत छै, ई नदी क॑ प्रदूषित नै करै वाला छै ।होटल मालिक सब के कहनाय छनि जे ओ सब पोखरि सं सब पानि आ जे क्लोरीन के प्रयोग करैत छथि, ओ नदी तक नहिं पहुंचैत अछि, कारण ई अत्यधिक प्रतिक्रियाशील अछि.लेकिन ई संभावना छै कि पूल म॑ इस्तेमाल करलऽ जाय वाला रसायन नदी प॑ जरूर पहुँची जाय छै, ई बात क॑ डब्ल्यूडब्ल्यूएफ नेपाल केरऽ मीठा पानी के कार्यक्रम के प्रमुख राजेश सादा के कहना छै ।“व्यक्तिगत स्तर पर, ओ सही भ सकैत अछि।नदी मे जे पानि निकलैत अछि ओकर मात्रा एतेक महत्वपूर्ण नहि अछि जे क्षति पहुँचा सकैत अछि ।लेकिन अगर आपने कुल पूल के संख्या देखबै, जे हर साल बढ़ी रहलऽ छै, समग्र रूप स॑ आरू पैमाना प॑, त॑ हम्में ई कह॑ सकै छियै कि ई चिंता के कारण बनी सकै छै,’’ हुनी मोंगबे स॑ कहै छै ।शोध स॑ पता चलै छै कि पूल म॑ बैक्टीरिया, वायरस आरू अन्य रोगजनक जैसनऽ सूक्ष्मजीवऽ क॑ मारै लेली इस्तेमाल करलऽ जाय वाला क्लोरीन केरऽ परिणाम घातक होय छै ।नेपाल केरऽ मीठे पानी के प्रजाति प॑ काम करै वाला शोधकर्ता जेन्युइन प्रजापति कहै छै, “मछली आरू मैक्रोइनवर्टेब्रेट्स जैसनऽ कठोर पानी के प्रजाति, खास करी क॑ जे लंबा दूरी तलक पलायन नै करै छै, ओकरा प॑ क्लोरीन दूषितता स॑ प्रभावित होय के संभावना छै ।हुनी कहै छै, “चैक्रिनवर्टेब्रेट्स नदी प्रणाली म॑ मिलै वाला मछली प्रजाति के सरणी लेली भोजन के स्रोत छै ।खारिल जीवित रहबाक लेल माछ पर निर्भर करैत अछि ।अगर मैक्रोइनवर्टेब्रेट्स मरै छै या दूषित भोजन के सेवन करै छै, त॑ ई खारी आरू यहां तक ​​कि मेगाफौना जेना कि गैंडा आरू बाघऽ क॑ आसानी स॑ भेजलऽ जाय छै, वू आरू कहै छै ।संरक्षणवादी आरू पूर्व राष्ट्रीय पार्क आरू वन्यजीव संरक्षण अधिकारी बेड कुमार खदका के कहना छै कि रैटी चिटवान के जीवन रेखा छेकै, आरू अगर घर के साथ कुछ होय जाय छै त॑ गैंडा आरू बाघ भी नै बचतै ।नेपाल म॑ संस्थागत क्षमता के कमी के कारण स्थानीय सरकार केरऽ निगरानी तंत्र कमजोर रहलऽ छै, आरू व्यवसाय अक्सर पर्यावरण सुरक्षा केरऽ प्रथा क॑ छोड़ी दै छै ।ओ कहला जे हमरा सब कए नहि पता अछि जे होटल मालिक वास्तव मे ओ काज क रहल छथि या नहि।ओ सब बिना ककरो जानने नदी मे पानि फेंकैत भ सकैत अछि।&#39;&#39; स्थानीय संरक्षण कार्यकर्ता बिरेन्द्र महातो कहैत छथि।चितवान नेशनल पार्क केरऽ मुख्य संरक्षण अधिकारी दिल बहादुर पुरजा पुन न॑ मोंगाबे क॑ बतैलकै कि हुनी ई मुद्दा स॑ अनभिज्ञ रहलऽ छै ।ओ कहला जे एखन धरि एहि मुद्दा पर ध्यान नहि देलहुं अछि।मुदा एहि बारे मे पूछबाक लेल धन्यवाद, हम आब एहि पर नजरि राखब।&#39;विभिन्न अध्ययनऽ म॑ स्विमिंग पूल के साथ एगो आरू समस्या भी दिखालऽ गेलऽ छै: डीबीपीएस (अभेद्यता के उपोत्पाद), जे खाली मनुष्य लेली ही कैंसर पैदा करै वाला नै छै, बल्कि सब आकार आरू आकार के पौधा आरू जानवरऽ लेली घातक भी होय छै ।अमेरिकी रोग नियंत्रण आ रोकथाम केंद्रक कें अनुसार, जखन क्लोरीन सं जल मे प्राकृतिक कार्बनिक सामग्री कें साथ क्लोरीन सं उपचारित स्विमिंग पूल जैना कीटाणुनाशक जैना कीटाणुनाशक कें पानी मे परस्पर क्रिया करय छै, तखन डीबीपी कें निर्माण कैल जायत छै.कार्बनिक सामग्री विभिन्न प्रकार कें लोशन या सनस्क्रीन पहिरने तैराक सं आ सकय छै आ डीबीपी जैना ट्राइहेलोमेथेन आ हैलोजनयुक्त एसिटिक एसिड बना सकय छै.ई यौगिक जलीय जीवऽ लेली बहुत जहरीला होय के बात कहलऽ गेलऽ छै ।लेकिन न त स्थानीय सरकार न॑ डीबीपी आरू पूरा चिटवान म॑ स्विमिंग पूल म॑ ओकरऽ व्यापकता प॑ कोनो शोध करलकै, जेकरा म॑ पहल॑ स॑ हेवी मेटल दूषितता स॑ जूझै के मौका मिललै ।काठमांडू विश्वविद्यालय केरऽ मीठे पानी के विशेषज्ञ सुबोध शर्मा न॑ कहलकै कि रैटी म॑ पानी क॑ पहिने स॑ कीटनाशक आरू खाद म॑ मिलै वाला भारी धातु के अलग-अलग निशान स॑ दूषित करलऽ जाब॑ सकै छै ।हुनी आरू कहै छै, “हालांकि हमरा पास एकरऽ समर्थन करै लेली सबूत नै छै, लेकिन हमरा सब के मानना ​​छै कि चिटवन म॑ गैंडा के मौत के हाल के बाढ़ी के कारण सौराहा म॑ नदी आरू भूजल दोनों के दूषित होय के कारण होय सकै छै ।भारत केरऽ कई नदी म॑ हेवी मेटल केरऽ दूषित होय के खबर भी मिललऽ छै ।ओहि संदर्भ मे जेना होटल मालिक पूल भरबा लेल भूजल क उपयोग क रहल छथि, एहि लेल उपयोग कैल जा रहल जल क गुणवत्ता क बारे मे सवाल उठैत अछि।अपनऽ भविष्य केरऽ शोध म॑ रैपट्टी म॑ हेवी मेटल दूषितता क॑ देखै के योजना बनाबै वाला शर्मा न॑ आरू कहलकै कि रैटी केरऽ भूजल भी बहुत अच्छा तरह स॑ स्विमिंग पूल क॑ दूषित करी रहलऽ हुअ॑ सकै छै ।स्थिति के अवलोकन करै वाला कुछ उद्योग के अंदरूनी सूत्रऽ के कहना छै कि हुनका लगै छै कि चिटवान म॑ स्विमिंग पूल के प्रसार स॑ नेपाल म॑ पर्यटन व्यवसाय के सामने बहुत अधिक गंभीर अंतर्निहित समस्या के सतह प॑ सामने आबै छै ।चिटवन आरू पोखरा म॑ टाइगर माउंटेन होटल आरू रिसॉर्ट चलाबै वाला पर्यटन उद्यमी मार्कस कॉटन के कहना छै कि नेपाल केरऽ पर्यटन व्यवसाय म॑ अधिकांश लोगऽ के पास आम तौर प॑ अपनऽ उद्योग के बारे म॑ अंतर्दृष्टि, समझ आरू विचारशीलता के कमी छै ।“हमरा लगै छै कि व्यापक मुद्दा ई छै कि [जे] उद्योग केरऽ अपनऽ सर्वोत्तम हितऽ म॑ स्थायित्व क॑ अपनाबै म॑ विफलता बहुत सीमित जागरूकता, समझ आरू प्रतिबद्धता क॑ दर्शाबै छै।”सौरहा म॑ स्विमिंग पूल केरऽ प्रसार होटल मालिकऽ के बीच प्रचलित “क्लोन मानसिकता” केरऽ एगो उदाहरण छै, ई बात क॑ हुनी मोंगबे क॑ कहै छै ।कॉटन के कहनाय छनि जे पूल के निर्माण के गारंटी नहिं अछि जे होटल के कारोबार स्वतः बढ़त.“एकटा पूल नहि बनाउ आ कथा नहि बताउ जे उत्साहित प्रतिबद्धताक संग किएक।जं पूलक संग होटल सं ल कय क्लोरीन मुक्त सेनेटाइजेशनक विकल्प चुनू ;जेना, नमक, पुनः कथा सुनाउ आ पूलक बदला गहींर, बेसी विसर्जनशील (कोनो यमक इच्छित!) अनुभवक एकटा श्रृंखला पर ध्यान दियौक.जंगली स्विमिंग पूल पर विचार करू.....मुफ्त पायथन या कोबरा के संग,” ओ एकटा ईमेल साक्षात्कार में मोंगाबे के कहैत छथि.होटल मालिक सब के कहनाय छनि जे मौजूदा पूल के सेहो हुनकर इष्टतम के अभ्यस्त नहिं भ रहल अछि.होटल एसोसिएशन के अध्यक्ष गिरी के कहना छै कि केवल भारतीय आरू नेपाली पर्यटक केवल पूल में अक्सर आबै छै, डुबकी लेबै लेली, बल्कि सेल्फी लेबै लेली।पश्चिमी पर्यटक सब के पूल के बारे में कम परेशानी छै, ओ मोंगबे के कहै छै।जेकरा सं एकटा सवाल उठै छै: एतेक पानी कें बर्बाद करनाय आ पारिस्थितिकी कें दृष्टि सं संवेदनशील क्षेत्र मे पूल मे संसाधनक कें निवेश कियाक छै जखन कि ओकर उपयोगिता सीमित छै?महातोसँ पूछैत अछि।हुनी कहै छै, “राष्ट्रीय पार्क म॑ मुसाहर आरू थारस क॑ अपनऽ नदी म॑ मछली पकड़ै के अनुमति नै छै, लेकिन ई होटलऽ क॑ जे कुछ भी चाहै छै, वू करै के अनुमति दै छै भले ही ओकरऽ गतिविधि पार्क केरऽ जीवन रेखा क॑ खतरा म॑ डालै वाला खतरा म॑ डालै छै ।यद्यपि नेपाल केरऽ राष्ट्रीय उद्यानऽ क॑ गैंडा आरू बाघ जैसनऽ विलुप्त होय रहलऽ प्रजाति केरऽ आबादी क॑ वसूली म॑ मदद करै लेली सफलता के कहानी के रूप म॑ प्रशंसा करलऽ गेलऽ छै, लेकिन ई सफलता स्थानीय मूल निवासी सिनी के संसाधन आरू पारंपरिक आजीविका के अधिकार के कीमत प॑ मिलै छै, लेकिन आलोचकऽ के कहना छै ।महातो आरू कहै छै, “स्थानीय समुदायऽ क॑ ई भी लगै छै कि जब॑ कि ओकरऽ संसाधनऽ के पहुँच सीमित छै, बड़ऽ व्यवसाय आरू होटलऽ के पास पहुँच आरू शक्ति छै जे वू चाहै छै ।होटलऽ क॑ ई समझै के जरूरत छै कि पर्यटक गैंडा आरू बाघ क॑ देखै लेली सौरहा आबै छै, आरू ई बात ओकरऽ व्यवसाय क॑ तैरते रह॑ छै, हुनी आरू कहै छै ।“मुदा जँ नदी प्रदूषित भ’ जायत त’ बाघ आ गैंडा नहि बचत, आ सौरहा अपन व्यवसाय केँ चलैत रहय लेल कियो नहि आओत।”बैनर छवि : एकटा स्टाफ सौराहा, चिटवान में एकटा होटल में स्विमिंग पूल के साफ करैत अछि.छवि महाया राज जोशी/मोंगबे द्वारा।ई कहानी सेंटर फॉर डाटा जर्नलिज्म नेपाल (सीडीजेएन) के सहयोग स॑ एगो अर्थ पत्रकारिता नेटवर्क (ईजेएन) के फेलोशिप के तहत निर्मित करलऽ गेलऽ छेलै ।अभय राज जोशी मोंगबे में नेपाल के लेल स्टाफ लेखक छैथ।हुनका @arj272 पर खोजू।उद्धरण: डेमेके, ए, एवं टैस्यू, ए (2016).जल कें गुणवत्ता आ माछक कें स्वास्थ्य पर ओकर प्रभाव कें बारे मे समीक्षा.~ 21 ~ जीव-जन्तु एवं जैविक अध्ययन के अंतर्राष्ट्रीय जर्नल।https://www.faunajournal.com/archives/2016/vol3issue1/parta/2-6-4.pdf लियू, जे, एवं झांग, एक्स (2014) से प्राप्त।एकटा समुद्री शैवाल कें विरु द्ध क्लोरीनयुक्त खारा अपशिष्ट जल कें प्रवाहक मे नब हेलोफेनोलिक डीबीपी कें तुलनात्मक विषाक्तता: हैलोफेनोलिक डीबीपी आमतौर पर हैलोलीफेटिक कें अपेक्षा बेसि विषाक्त होयत छै.जल अनुसंधान, 65, 64-72।doi:10.1016/j.watres.2014.07.024 जैसवाल, एम., गुप्ता, एसके, चबुकधर, एम., नासर, एम., नेमा, एक, हुसैन, जे, एवं मलिक, टी. (2022).यमुना नदी कें पूरा खंड मे भारी धातु दूषितता: व्यापक स्वास्थ्य जोखिम आकलन कें लेल एकटा अस्पष्ट तर्क दृष्टिकोण.पीएलओएस एक, 17 (8), ई0272562।doi:10.1371/जर्नल.पोने.0272562"
