title,description,published date,url,publisher.href,publisher.title,full_article,images,translated
Indian national arrested in Nepal for possessing prescription drug in large quantity - The Hindu,Indian national arrested in Nepal for possessing prescription drug in large quantity  The Hindu,2026-04-26 19:13:51,https://news.google.com/rss/articles/CBMi4gFBVV95cUxQOFBOUDVjMk12WDVWSzlqWElpektGLUtGZnRVT1p2VFV0aXk4dUpYVXh1Vm5zUmRNYTJGbWw3RlYyVzNyQkhTdnZLcUdTVXZnZGlIaHZuNjNWMVVaYnU1ckNzRG9INEZCZWEtR3AtSkZXdUUtdjByQVBDMTNJY0JDODRIUS1qX1RzZTUySTdhcFVZNFFKUDJtazdWdXFsODgtY1BDbW5ueklMRmJEc3Y1S0tMYnRWeGRHVW9jbjJuSGRkNktpTTJmblRTeWwtcnZSeUZORUpObGJnek5aZlQ5SGdB0gHoAUFVX3lxTE1RUVI0cmFpWHVPQkJWR2lvZHpYMFliT1cxdzgxT2xqa2tNY3NudjVBYkJTeXUtQ3BCZFZ1WGdVNFl2c2I5WDF0bm00cWxsZVhSTVVXWmhBV19Yb2JISm9iVjZLZUlyNEExRHNqTjltT1luQk10M19ibXVTSU15VEE5Y1JiWVFaWGN4azU0eEUyMkR2MXhFOC1hT29wcVJGMzdWOXV1SkJUWkVnMmZkb29MNW80bndWUnRLY3V5QmxrZVU2NWJJV1hUZlhCaVVNSlJCX19fYU5XTGNxSTlZRWppLXVaQTFXVV8?oc=5&hl=en-US&gl=US&ceid=US:en,https://www.thehindu.com,The Hindu,"Comments

Comments have to be in English, and in full sentences. They cannot be abusive or personal. Please abide by our community guidelines for posting your comments.

We have migrated to a new commenting platform. If you are already a registered user of The Hindu and logged in, you may continue to engage with our articles. If you do not have an account please register and login to post comments. Users can access their older comments by logging into their accounts on Vuukle.","{'https://www.thehindu.com/theme/images/th-online/1x1_spacer.png', 'https://www.thehindu.com/theme/images/google-signin/group-12945.svg', 'https://sb.scorecardresearch.com/p?c1=2&c2=11398210&cs_ucfr=1&cv=4.4.0&cj=1', 'https://www.google-analytics.com/g/collect?v=2&tid=G-MHCVDGHV0S&cid=555&en=js_disabled', 'https://www.thehindu.com/theme/images/th-online/thehindu-logo.svg', 'https://www.thehindu.com/theme/images/th-online/close-image-icon.svg', 'https://th-i.thgim.com/public/incoming/n9jdt7/article70909768.ece/alternates/LANDSCAPE_1200/iStock-2103527306.jpg', 'https://www.thehindu.com/theme/images/google-signin/th-online-icon.svg'}","टिप्पणी

टिप्पणी अंग्रेजी मे होबाक चाही, आ पूरा वाक्य मे। ओ गारि-गरौबलि वा व्यक्तिगत नहि भ' सकैत अछि। अपन टिप्पणी पोस्ट करबाक लेल हमर सामुदायिक दिशानिर्देश के पालन करू।

हम एकटा नव कमेंटिंग प्लेटफॉर्म पर माइग्रेट भ गेलहुं अछि। यदि अहां पहिने सं The Hindu के पंजीकृत उपयोगकर्ता छी आ लॉग इन केने छी त अहां हमर लेख सं जुड़ल रहि सकय छी. अगर अहां के खाता नै अछि त कमेंट पोस्ट करय लेल रजिस्ट्रेशन आ लॉगिन करू. उपयोगकर्ता Vuukle पर अपन खाता मे लॉग इन क अपन पुरान टिप्पणी तक पहुंच सकय छै."
Kathmandu: Nepal Police shift riverbank settlers to safer locations #Gallery - Social News XYZ,Kathmandu: Nepal Police shift riverbank settlers to safer locations #Gallery  Social News XYZ,2026-04-26 20:58:11,https://news.google.com/rss/articles/CBMiswFBVV95cUxOeWh2YkZFTUVwdUwzaVVtelN6amZpLWFHWHhJcHJYdTJRZzRxQ1cxVUQyMUZfVHo1a1QxUFZaUFpUMF9kX1p5LXhCeFNvTmRKVFhEQnFhVkQ3Y2ExaUdiVGFMTWNfaC1YeHFkTnN4TzBTSUlEb2k5UC1iNGZsYzByS3lYLWw4VzhobV9pdWN5T3p0ckRYbE1OOTVDMWhqMV9xMHNwQUZFdGNrRngtdHN4Nng1b9IBswFBVV95cUxOeWh2YkZFTUVwdUwzaVVtelN6amZpLWFHWHhJcHJYdTJRZzRxQ1cxVUQyMUZfVHo1a1QxUFZaUFpUMF9kX1p5LXhCeFNvTmRKVFhEQnFhVkQ3Y2ExaUdiVGFMTWNfaC1YeHFkTnN4TzBTSUlEb2k5UC1iNGZsYzByS3lYLWw4VzhobV9pdWN5T3p0ckRYbE1OOTVDMWhqMV9xMHNwQUZFdGNrRngtdHN4Nng1bw?oc=5&hl=en-US&gl=US&ceid=US:en,https://www.socialnews.xyz,Social News XYZ,"About SocialNewsXYZ

An Indo-American News website. It covers Gossips, Politics, Movies, Technolgy, and Sports News and Photo Galleries and Live Coverage of Events via Youtube. The website is established in 2015 and is owned by AGK FIRE INC.","{'https://i0.wp.com/www.socialnews.xyz/wp-content/uploads/2021/03/03/WhatsApp-Image-2021-03-02-at-12.45.01-PM.jpeg?fit=1024%2C575&quality=80&zoom=1&ssl=1', 'https://i0.wp.com/www.socialnews.xyz/wp-content/uploads/2026/04/26/202604263765773.jpg?resize=360%2C165&quality=80&zoom=1&ssl=1', 'https://i0.wp.com/www.socialnews.xyz/wp-content/uploads/2026/04/26/20260426323f.jpg?fit=1920%2C1080&quality=80&zoom=1&ssl=1?v=1777212098', 'https://i0.wp.com/www.socialnews.xyz/wp-content/uploads/2022/08/02/social-news-xyz-header.png', 'https://secure.gravatar.com/avatar/b349f4ec18d6bf75961a97fd9e11645578819d8f9291d23d50fe98cc91f23b7b?s=100&d=mm&r=g', 'https://i0.wp.com/www.socialnews.xyz/wp-content/uploads/2026/04/26/20260426322f.jpg?fit=1264%2C843&quality=80&zoom=1&ssl=1?v=1777212102', 'https://www.facebook.com/tr?id=678233006323423&ev=PageView&noscript=1', 'https://i0.wp.com/www.socialnews.xyz/wp-content/uploads/2026/04/26/20260426402f-scaled.jpg?resize=360%2C165&quality=80&zoom=1&ssl=1?v=1777210591'}","SocialNewsXYZ के बारे में

एकटा इंडो-अमेरिकन न्यूज वेबसाइट। एहि मे गपशप, राजनीति, सिनेमा, टेक्नोलॉजी, आ खेल समाचार आ फोटो गैलरी आ Youtube के माध्यम सं आयोजन के लाइव कवरेज कवर कएल गेल अछि. ई वेबसाइट २०१५ म॑ स्थापित करलऽ गेलऽ छै आरू एकरऽ मालिकाना हक एजीके फायर इंक के छै ।"
Matatirtha Aunsi Explained: The Sacred Nepali Festival That Celebrates the Eternal Bond Between Mothers and Children – Hindu Press International - Hinduism Today,Matatirtha Aunsi Explained: The Sacred Nepali Festival That Celebrates the Eternal Bond Between Mothers and Children – Hindu Press International  Hinduism Today,2026-04-26 21:01:55,https://news.google.com/rss/articles/CBMi8wFBVV95cUxNd291M1ludTFlVjFNRW4ydElGOU9TbXlkN0ZCVi1OZjJra251SzBuMGpHbGxtbnNoeE1tM3hNbktIU25mWG1fbXJPOWpHYkt5eFNxcWh4dGpQMUFaYVExWVU1SEFTTUhSZ1pKTlltMzVKd1I5UEM5U05GOGtRNHVrYXNKc0xCZkRIS0hTaXotWUw4ZHl2NmVOU00zemhPaFoxMzZVRWxaakZMcjlsMEd0aUYyQ2QyTVUxR3BIY0hsSmczbzhLaHRGWmN2cmRXYWhPd3M2Z3Q0MHJoQWVlclY0UzFiMDhBSTB5Q3RLQlRQaWh6V3M?oc=5&hl=en-US&gl=US&ceid=US:en,https://www.hinduismtoday.com,Hinduism Today,,,
ICC Women's Challenge Trophy: Nepal loses to USA - Nepal Khabar,ICC Women's Challenge Trophy: Nepal loses to USA  Nepal Khabar,2026-04-26 22:00:00,https://news.google.com/rss/articles/CBMiWEFVX3lxTE4wZU1lZGFMOWJDcmlNNFh4Tm5yajJ2ZkxTMmlMOEJGQUk3WTdDUmlVZEtWcGd4M3M5T2doMy1rQmhUME1od2lMTnZEUlZqdFg0OVBvME5TRFM?oc=5&hl=en-US&gl=US&ceid=US:en,https://en.nepalkhabar.com,Nepal Khabar,"Nepal lost to USA by 7 wickets in the match held under the ICC Women's T20 Challenge Trophy today.

In the match held at the Gahanga Cricket Stadium in Kigali, Rwanda, USA achieved the winning target of 87 runs set by Nepal for the loss of 3 wickets in just 11.5 overs. Isani Vaghela scored 35 runs while Sainvi Kambalapally scored 21 and Pooja Ganesh contributed 20 runs.

For Nepal, Manisha Upadhyay, Pooja Mahato and Indu Verma took one wicket each.

Earlier, winning the toss and electing to bat first, Nepal scored only 86 runs for the loss of 6 wickets in the stipulated 20 overs.

Ruby Podar scored a half century (51 runs) for Nepal and was the only batswoman who reached double figures. Pooja Mahato and Kabita Kunwar added 8 runs each to the Nepali total.

For the US, Mahi Madhavan and Ritu Priya Singh took 2 wickets each.","{'https://ennepalkhabar.prixacdn.net/media/gallery_folder/pollution-ktm_EEaCWStkcb.jpg', 'https://ennepalkhabar.prixacdn.net/media/gallery_folder/dozer-at-butwal-1_5VGISZ73LZ.jpg', 'https://ennepalkhabar.prixacdn.net/media/gallery_folder/nepali-team_Zh29dcMQxI.jpg', 'https://ennepalkhabar.prixacdn.net/static/frontend/images/hk-logo.svg', 'https://ennepalkhabar.prixacdn.net/media/gallery_folder/uml_ZdNuxIyhax.jpg', 'https://nepalkhabar.prixacdn.net/static/normal/prixafooterlogo.png', 'https://ennepalkhabar.prixacdn.net/media/gallery_folder/nepal-rwanda_9Ej5lTyrW2.jpg', 'https://ennepalkhabar.prixacdn.net/media/gallery_folder/tourist-arrival-nepal_DdLF4SBNeT.jpg', 'https://nepalkhabar.prixacdn.net/media/albums/ten-years_9MQESC9uF7.png', 'https://nepalkhabar.prixacdn.net/media/albums/logo-eng-inverse_uNHkORiaOT.png', 'https://ennepalkhabar.prixacdn.net/media/gallery_folder/nepal-team_1_XFFRCP7JFE.jpg', 'https://ennepalkhabar.prixacdn.net/media/gallery_folder/uae-nepal_yEyb54en9c.jpg', 'https://ennepalkhabar.prixacdn.net/media/gallery_folder/nepal-uae_Xf4LeeM8v3.jpg', 'https://ennepalkhabar.prixacdn.net/media/gallery_folder/squatters-contact-govt_8QfaNjEmXt.jpg', 'https://ennepalkhabar.prixacdn.net/static/frontend/images/nepali-logo1.svg', 'https://ennepalkhabar.prixacdn.net/media/thumbs.jpg'}","आईसीसी महिला टी-२० चैलेंज ट्रॉफी अन्तर्गत आइ भेल खेलमे नेपाल अमेरिकासँ ७ विकेटसँ हारल अछि ।

रवांडा के किगाली स्थित गहंगा क्रिकेट स्टेडियम में आयोजित मैच में अमेरिका नेपाल द्वारा मात्र 11.5 ओवर में 3 विकेट के नुकसान के लेल 87 रन के जीत के लक्ष्य प्राप्त केलक। इसानी वाघेला न॑ ३५ रन बनैलकै जबकि सैनवी कम्बलापल्ली न॑ २१ आरू पूजा गणेश न॑ २० रन के योगदान देलकै ।

नेपालक लेल मनीषा उपाध्याय, पूजा महतो आ इन्दु वर्मा एक-एकटा विकेट लेलनि।

एहि सं पहिने टॉस जीत क पहिने बल्लेबाजी करय के फैसला करैत नेपाल निर्धारित 20 ओवर मे 6 विकेट के नुकसान मे मात्र 86 रन बनौलक.

नेपाल केरऽ तरफ सें रूबी पोदर न॑ आधा शतक (५१ रन) बनैलकै आरू एकमात्र बल्लेबाज छेलै जे दोहरी आंकड़ा तक पहुँची गेलै । पूजा महतो आ कबिता कुँवर नेपाली कुलमे ८-८ रन जोड़लनि ।

अमेरिका के लेल माही माधवन आ रितु प्रिया सिंह 2-2 विकेट लेलनि।"
