title,description,published date,url,publisher.href,publisher.title,full_article,images,translated
Nepal and India to resume talks on air entry routes after decade-long lull - The Kathmandu Post,Nepal and India to resume talks on air entry routes after decade-long lull  The Kathmandu Post,2026-07-17 01:21:00,https://news.google.com/rss/articles/CBMiuAFBVV95cUxOaExBenBGQmZheGItU01YZi1mY0prUE5td3R5aXYtM0lQcG9KemFKb2c4M1hxb1VMbGJadmg2SllsZmtIajZSeVhvaVRwUk83RlFjbjc2TXVVRHBSbllOSkFWa243RElaVUc3bG5LUUJ0NXQxN3ZFX2ltSC1uRkE5Zk8yQnZzdTl1ekhSNUlCc1hZZ3dnZkloLWhMU054SWZhMkxvaVpRSE9lUkZvUWZ3RGlMVEJvV2My?oc=5&hl=en-US&gl=US&ceid=US:en,https://kathmandupost.com,The Kathmandu Post,"Nepal and India have agreed to resume talks on additional bilateral air entry routes, reviving negotiations after nearly a decade on a long-pending issue crucial to the operation of Nepal's two new international airports in Pokhara and Bhairahawa.

The additional air entry routes have long been a key demand of Nepal, as around 90 percent of international flights currently enter the country through a single, congested entry point over Simara.

India has been reluctant to grant direct, low-altitude entry points through Nepal's western and eastern corridors, citing security concerns related to sensitive military installations, including the Gorakhpur air base, as well as air traffic management complexities.

Senior officials from the two countries are expected to meet in August to discuss and negotiate additional cross-border air entry routes. The date and venue of the meeting have yet to be finalised.

The issue was discussed during a meeting between Foreign Minister Shisir Khanal and Munu Mahawar, additional secretary at India's Ministry of External Affairs, in Kathmandu on Thursday.

Mahawar is in Nepal to attend the 13th Nepal-India Joint Steering Committee meeting at the energy secretary level that concluded in Pokhara on Wednesday.

During the meeting, Khanal urged India to convene the long-delayed technical committee meeting tasked with discussing Nepal's request for additional air routes.

""Mahawar assured us that the meeting would take place next month,"" two sources familiar with the matter told the Post. ""The technical-level mechanism will examine the bottlenecks in Nepal's request for additional air entry routes.""

Another Tourism Ministry official said Nepal had recently proposed convening the meeting.

""Now that India has agreed, the agenda for the meeting will be finalised,"" the official said.

Nepal has been pressing India for additional air entry routes since 2009, after deciding to build international airports in Pokhara and Bhairahawa.

The issue received political backing during Indian Prime Minister Narendra Modi's visit to Nepal in August 2014. A joint communiqué issued after the visit stated that cross-border direct routes would facilitate flights to the regional airports in Pokhara and Bhairahawa, reduce travel time and costs, and improve air connectivity between the two countries.

The two prime ministers subsequently directed their respective authorities to resolve the issue within six months.

Following that directive, Nepal and India agreed in 2016 to make the L626 (Kathmandu-Mahendranagar) route two-way. Later that year, India agreed in principle to provide additional cross-border entry points for international airlines.

Nepal proposed three new entry points through Janakpur, Bhairahawa and Nepalgunj.

India, however, said it needed internal consultations before making a final decision.

New Delhi had long expressed reservations about entry points through Bhairahawa and Nepalgunj because of the strategic Gorakhpur air base, where fighter jet exercises are regularly conducted.

In February 2017, the two countries agreed to form a joint technical team to examine the feasibility of opening the three routes.

Until April 2018, India had remained positive about opening western entry routes after a technical team was formed to address safety concerns.

Officials say India's position later hardened.

Nepal-India relations deteriorated after Kathmandu withdrew from a joint military exercise of the Bay of Bengal Initiative for Multi-Sectoral Technical and Economic Cooperation (BIMSTEC) countries in Pune in September 2018 after initially agreeing to participate.

India expressed dissatisfaction over Nepal's withdrawal, particularly within its defence establishment.

The same year, Nepal participated in the second Nepal-China joint military exercise, Sagarmatha Friendship-2, in China's Sichuan province, further complicating bilateral defence sensitivities.

After that, discussions on the safety assessment of the proposed air routes stalled.

Nepal has consistently argued that expanding cross-border air routes is essential because almost all inbound international traffic depends on the Simara entry point.

In contrast, aircraft departing Nepal have access to seven exit points—Bhairahawa and Mahendranagar in the west, and Simara, Biratnagar, Tumlingtar, Mechi and Janakpur in the east.

Two additional entry points over Mechi and Tumlingtar (NONIM), used by aircraft arriving from Bhutan and Lhasa respectively, exist but handle only limited traffic.

As a result, Simara remains heavily congested.

The lack of western entry routes has also undermined the commercial viability of the Gautam Buddha International Airport in Bhairahawa and Pokhara International Airport, projects on which Nepal has spent more than Rs60 billion.

Gautam Buddha International Airport was upgraded as Nepal's second international airport on May 16, 2022, while Pokhara International Airport was inaugurated on January 1, 2023. Neither airport currently has scheduled international passenger services, handling only occasional charter flights.

Air entry routes are considered critical for both airports.

A Bhairahawa-bound aircraft approaching from the west, for example, cannot enter directly over Bhairahawa, Nepalgunj or Mahendranagar. Instead, it must make a roughly 300-kilometre detour to enter Nepal through Simara in the east before flying back west.

Experts say the longer route increases fuel consumption and operating costs, making flights more expensive.

Tourism Ministry documents show that international flights to Pokhara from the west must fly an additional 185 kilometres if new cross-border air routes are not opened.

Officials at Nepal's civil aviation authority said India had agreed in principle in 2016 to allow the three proposed routes, but the decision was never implemented.

""Meetings were held in 2019 and again in 2023, but they produced no outcome,"" an official said.

Meanwhile, Thursday's meeting also reviewed broader Nepal-India cooperation.

According to Nepal's Ministry of Foreign Affairs, both sides discussed holding further meetings to strengthen close and enduring bilateral ties in areas of mutual interest.

Khanal and Mahawar also welcomed the outcome of the recently concluded Joint Steering Committee meeting in Pokhara.

The two countries agreed to increase electricity trade through the 400 kV Dhalkebar-Muzaffarpur and the planned Dhalkebar-Sitamarhi cross-border transmission lines.

Following a review of the existing 1,000 MW import-export capacity through the Dhalkebar-Muzaffarpur line and a study conducted by the Joint Technical Team, both sides agreed to raise the combined transfer capacity to 1,400 MW for imports and 1,650 MW for exports through the two transmission corridors.

Mahawar also expressed satisfaction over the progress of Indian-backed hydropower projects, including the Lower Arun project.

India's Satluj Jal Vidyut Nigam (SJVN) is developing the 900 MW Arun-3 Hydropower Project and has also secured licences for the 679 MW Lower Arun and 490 MW Arun-4 projects.

Arun-4 will be developed as a joint venture between the Nepal Electricity Authority and SJVN, with the Indian company holding the majority stake.

India's NHPC Limited is also set to develop the 750 MW West Seti and 450 MW Seti River-6 projects. NHPC and Vidyut Utpadan Company Limited have already signed a memorandum of understanding to jointly develop the 480 MW Phukot Karnali Hydropower Project.

Despite repeated efforts from the Indian side, however, Nepal's prime minister's long-awaited official visit to India has yet to materialise.","{'https://assets-cdn.kathmandupost.com/uploads/source/news/2026/third-party/thumb5-1784251058.jpg', 'https://openweathermap.org/img/w/04d.png', 'https://jcss-cdn.kathmandupost.com/assets/images/logo-sticky-bar-tkp-weekender-1.png', 'https://jcss-cdn.kathmandupost.com/assets/images/lazy.png', 'https://jcss-cdn.kathmandupost.com/assets/images/tkp-logo-weekender.png', 'https://jcss-cdn.kathmandupost.com/assets/images/logos/thekathmandupost-logo.png', 'https://jcss-cdn.kathmandupost.com/assets/images/logos/thekathmandupost-logo-white.png'}","नेपाल आरू भारत न॑ अतिरिक्त द्विपक्षीय हवाई प्रवेश मार्ग प॑ बातचीत फेरू शुरू करै प॑ सहमत होय गेलऽ छै, जेकरा स॑ पोखरा आरू भैरहवा म॑ नेपाल केरऽ दू नया अंतर्राष्ट्रीय हवाई अड्डा के संचालन लेली महत्वपूर्ण लंबा समय स॑ लंबित मुद्दा प॑ लगभग एक दशक के बाद वार्ता फेरू स॑ शुरू होय गेलऽ छै ।

अतिरिक्त हवाई प्रवेश मार्ग नेपाल केरऽ बहुत दिन स॑ एगो प्रमुख मांग रहलऽ छै, कैन्हेंकि अभी लगभग ९० प्रतिशत अंतर्राष्ट्रीय उड़ान सिमारा के ऊपर एकल, भीड़भाड़ वाला प्रवेश बिंदु के माध्यम स॑ देश म॑ प्रवेश करै छै ।

भारत गोरखपुर हवाई अड्डा सहित संवेदनशील सैन्य प्रतिष्ठान स जुड़ल सुरक्षा सरोकार क संग-संग हवाई यातायात प्रबंधन क जटिलता क हवाला दैत नेपाल क पश्चिमी आ पूर्वी गलियारा स सीधा, कम ऊंचाई वाला प्रवेश बिंदु प्रदान करबा स हिचकिचाइत रहल अछि।

उम्मीद छै कि अगस्त म॑ दूनू देशऽ के वरिष्ठ अधिकारी सिनी के बैठक होय क॑ सीमा पार स॑ अतिरिक्त हवाई प्रवेश मार्गऽ प॑ चर्चा आरू बातचीत करलऽ जैतै । बैसारक तिथि आ स्थान एखन धरि तय नहि भ सकल अछि।

बृहस्पतिदिन काठमाण्डौमे विदेशमन्त्री शिसिर खनाल आ भारतके विदेश मन्त्रालयके अपर सचिव मुनु महावरके बैसारमे चर्चा भेल अछि ।

बुधदिन पोखरामे समाप्त भेल ऊर्जा सचिव स्तरमे नेपाल-भारत संयुक्त संचालन समितिक १३म बैसारमे भाग लेबाक लेल महावर नेपालमे छथि ।

बैठक के दौरान खनाल भारत स आग्रह केलथि जे नेपाल के अतिरिक्त हवाई मार्ग के आग्रह पर चर्चा करय के जिम्मा देल गेल बहुत दिन स विलंबित तकनीकी समिति के बैसार बजाओल जाय।

एहि मामला स परिचित दूटा सूत्र पोस्ट कए कहलथि जे महावर हमरा सब कए आश्वासन देलथि जे इ बैसार अगिला मास होएत। ""तकनीकी स्तर के तंत्र नेपाल के अतिरिक्त हवाई प्रवेश मार्ग के आग्रह में अड़चन के जांच करत।""

पर्यटन मन्त्रालयके दोसर अधिकारी बतौलनि जे नेपाल हालहिमे बैसार बजाबयके प्रस्ताव रखने छल ।

अधिकारी कहलनि जे, आब जखन भारत सहमत भ गेल अछि त बैसार के एजेंडा अंतिम रूप देल जायत।

नेपाल पोखरा आ भैरहवा मे अन्तर्राष्ट्रिय विमानस्थल बनेबाक निर्णय लेलाक बाद २००९ सँ भारत पर अतिरिक्त हवाई प्रवेश मार्गक लेल दबाव बना रहल अछि ।

अगस्त २०१४ म॑ भारतीय प्रधानमंत्री नरेन्द्र मोदी केरऽ नेपाल यात्रा के दौरान ई मुद्दा क॑ राजनीतिक समर्थन मिललै ।यात्रा के बाद जारी एगो संयुक्त विज्ञप्ति म॑ कहलऽ गेलऽ छेलै कि सीमा पार स॑ सीधा मार्ग स॑ पोखरा आरू भैरहवा केरऽ क्षेत्रीय हवाई अड्डा प॑ उड़ान भरना सुविधा मिलतै, यात्रा के समय आरू लागत म॑ कमी ​​आबै वाला छै, आरू दूनू देशऽ के बीच हवाई संपर्क म॑ सुधार होतै ।

एकरऽ बाद दूनू प्रधानमंत्री न॑ अपनऽ-अपनऽ अधिकारियऽ क॑ छह महीना के भीतर ई मुद्दा के समाधान करै के निर्देश देलकै ।

ओहि निर्देशक बाद नेपाल आ भारत 2016 मे एल626 (काठमांडू-महेन्द्रनगर) मार्ग केँ द्विपक्षीय बनेबा पर सहमत भेल छल । ओहि सालक अंत मे भारत सैद्धांतिक रूप स अंतरराष्ट्रीय एयरलाइंस कए सीमा पार स अतिरिक्त प्रवेश बिंदु उपलब्ध करबा पर सहमत भ गेल ।

नेपाल जनकपुर, भैरहवा आ नेपालगंज के माध्यम स तीन नव प्रवेश बिन्दु प्रस्तावित केलक ।

हालांकि भारत के कहनाय छनि जे अंतिम फैसला लेबय सं पहिने ओकरा आंतरिक परामर्श के जरूरत अछि.

नई दिल्ली बहुत दिन स भैरहवा आ नेपालगंज के माध्यम स प्रवेश बिंदु के बारे में आशंका व्यक्त केने छल, किया कि सामरिक गोरखपुर हवाई अड्डा के कारण, जतय नियमित रूप स लड़ाकू विमान के अभ्यास होइत अछि।

फरवरी 2017 म॑ दूनू देश न॑ तीनों मार्ग खोलै के व्यवहार्यता के जांच करै लेली एगो संयुक्त तकनीकी टीम बनाबै प॑ सहमत होय गेलै ।

सुरक्षा के चिंता के समाधान लेली तकनीकी टीम के गठन के बाद अप्रैल 2018 तलक भारत पश्चिमी प्रवेश मार्ग खोलै के बारे मँ सकारात्मक रहलौ छेलै ।

अधिकारी क कहब अछि जे बाद मे भारत क स्थिति कठोर भ गेल।

काठमांडू सितम्बर २०१८ मे पुणे मे बहुक्षेत्रीय तकनीकी आ आर्थिक सहयोग लेल बंगाल खाड़ी पहल (बिम्स्टेक) देशक संयुक्त सैन्य अभ्यास सँ हटि गेलाक बाद नेपाल-भारत सम्बन्ध बिगड़ल अछि ।

भारत न॑ नेपाल केरऽ वापसी प॑ असंतोष व्यक्त करलकै, खास करी क॑ अपनऽ रक्षा प्रतिष्ठान के भीतर ।

ओही वर्ष नेपाल चीनक सिचुआन प्रांतमे नेपाल-चीन संयुक्त सैन्य अभ्यास सागरमाथा मैत्री-२ मे भाग लेलक, जाहि सँ द्विपक्षीय रक्षा संवेदनशीलता आओर जटिल भऽ गेल ।

एकर बाद प्रस्तावित हवाई मार्ग क सुरक्षा आकलन पर चर्चा ठमकि गेल।

नेपाल लगातार तर्क दैत रहल अछि जे सीमा पारक हवाई मार्गक विस्तार आवश्यक अछि, कारण लगभग सभ आबय बला अंतर्राष्ट्रीय यातायात सिमारा प्रवेश बिन्दु पर निर्भर करैत अछि ।

एकरऽ विपरीत नेपाल स॑ प्रस्थान करै वाला विमानऽ क॑ सात निकास बिंदु तलक पहुँच छै-पश्चिम म॑ भैरहवा आरू महेन्द्रनगर, आरू पूर्व म॑ सिमरा, विराटनगर, तुमलिंगतार, मेची आरू जनकपुर ।

मेची आरू तुमलिंगतार (नोनिम) के ऊपर दू अतिरिक्त प्रवेश बिंदु, जेकरऽ उपयोग क्रमशः भूटान आरू ल्हासा स॑ आबै वाला विमानऽ द्वारा करलऽ जाय छै, मौजूद छै लेकिन सीमित यातायात ही संभाल॑ छै ।

एकरऽ परिणाम ई छै कि सिमारा म॑ भारी भीड़ बनलऽ छै ।

पश्चिमी प्रवेश मार्गक अभाव मे भैरहवा स्थित गौतम बुद्ध अन्तर्राष्ट्रिय विमानस्थल आ पोखरा अन्तर्राष्ट्रिय विमानस्थलक व्यावसायिक व्यवहार्यता सेहो कमजोर भेल अछि, जाहि परियोजनामे नेपाल ६० अरब रुपैयासँ बेसी खर्च केलक अछि ।

गौतम बुद्ध अन्तर्राष्ट्रिय विमानस्थल १६ मई २०२२ क नेपालक दोसर अन्तर्राष्ट्रिय विमानस्थल क रूपमे उन्नयन कएल गेल छल, जखन कि पोखरा अन्तर्राष्ट्रिय विमानस्थल १ जनवरी २०२३ क उद्घाटन भेल छल ।

दुनू हवाई अड्डा लेल हवाई प्रवेश मार्ग महत्वपूर्ण मानल गेल अछि।

उदाहरण के लेल पश्चिम स आबि रहल भैरहवा जाय वाला विमान सीधा भैरहवा, नेपालगंज या महेन्द्रनगर के ऊपर प्रवेश नै क सकैत अछि । बल्कि पश्चिम दिस वापस उड़बा सं पहिने पूर्व मे सिमरा होइत नेपाल मे प्रवेश करबा लेल मोटा-मोटी 300 किलोमीटर के चक्कर लगाबय पड़त.

विशेषज्ञऽ के कहना छै कि लम्बा रूट स॑ ईंधन के खपत आरू परिचालन लागत बढ़ी जाय छै, जेकरा स॑ उड़ान महंगा होय जाय छै ।

पर्यटन मंत्रालय केरऽ दस्तावेजऽ स॑ पता चलै छै कि अगर सीमा पार स॑ नया हवाई मार्ग नै खुललै त॑ पश्चिम स॑ पोखरा लेली अंतरराष्ट्रीय उड़ान क॑ १८५ किलोमीटर के अतिरिक्त उड़ान भरना जरूरी छै ।

नेपालक नागरिक उड्डयन प्राधिकरणके अधिकारीसब कहलनि जे, भारत २०१६ मे एहि तीनू प्रस्तावित मार्गक अनुमति देबा लेल सिद्धांततः सहमत भेल छल, मुदा निर्णय कहियो लागू नहि भेल ।

एकटा अधिकारी कहलनि जे, 2019 मे आ फेर 2023 मे बैसार भेल, मुदा ओकर कोनो परिणाम नहि निकलल।

अहिना, बृहस्पतिदिनक बैसारमे नेपाल-भारतक व्यापक सहयोगक समीक्षा सेहो कएल गेल अछि ।

नेपालक विदेश मन्त्रालयके अनुसार आपसी हितके क्षेत्रमे घनिष्ठ आ स्थायी द्विपक्षीय सम्बन्ध सुदृढ करबाक लेल आगाँ बैसार करबाक लेल दुनु पक्ष विमर्श केलक अछि ।

खनाल आरू महावर न॑ पोखरा म॑ हाल ही म॑ सम्पन्न संयुक्त संचालन समिति केरऽ बैठक के परिणाम के भी स्वागत करलकै ।

दूनू देश 400 केवी के ढलकेबर-मुजफ्फरपुर आ योजनाबद्ध ढल्केबर-सीतामढ़ी सीमा पार संचरण लाइन के माध्यम सं बिजली के व्यापार बढ़ाबय पर सहमत भेल.

ढल्केबर-मुजफ्फरपुर लाइन के माध्यम स॑ मौजूदा १,००० मेगावाट आयात-निर्यात क्षमता के समीक्षा आरू संयुक्त तकनीकी टीम द्वारा करलऽ गेलऽ अध्ययन के बाद दोनों पक्ष न॑ दू संचरण गलियारा के माध्यम स॑ आयात लेली संयुक्त स्थानांतरण क्षमता क॑ १,४०० मेगावाट आरू निर्यात लेली १,६५० मेगावाट तलक बढ़ाबै प॑ सहमत होय गेलै ।

महावर न॑ लोअर अरुण परियोजना सहित भारत समर्थित जलविद्युत परियोजना केरऽ प्रगति प॑ भी संतोष व्यक्त करलकै ।

भारत केरऽ सतलुज जल विद्युत निगम (एसजेवीएन) ९०० मेगावाट के अरुण-३ जलविद्युत परियोजना के विकास करी रहलऽ छै आरू ६७९ मेगावाट के लोअर अरुण आरू ४९० मेगावाट के अरुण-४ परियोजना के लाइसेंस भी हासिल करी चुकलऽ छै ।

अरुण-4 नेपाल विद्युत प्राधिकरण आ एसजेवीएन के संयुक्त उद्यम के रूप में विकसित होयत, जाहि में भारतीय कंपनी के बहुमत के हिस्सेदारी होयत।

भारत क एनएचपीसी लिमिटेड सेहो 750 मेगावाट क पश्चिम सेती आ 450 मेगावाट क सेती रिवर-6 परियोजना कए विकसित करबा लेल तैयार अछि। एनएचपीसी आ विद्युत उत्पादन कंपनी लिमिटेड 480 मेगावाट क फुकोट कर्णाली जलविद्युत परियोजना कए संयुक्त रूप स विकसित करबा लेल समझौता ज्ञापन पर हस्ताक्षर करि चुकल अछि।

भारतीय पक्ष केरऽ बार-बार प्रयास के बावजूद भी, लेकिन नेपाल केरऽ प्रधानमंत्री केरऽ बहुप्रतीक्षित आधिकारिक भारत यात्रा अभी तक साकार नै होय सकलऽ छै ।"
