title,description,published date,url,publisher.href,publisher.title,full_article,images,translated
Multi-stakeholder interaction highlights urgent need to protect Nepal's biodiversity amid climate change and pollution - The Himalayan Times,Multi-stakeholder interaction highlights urgent need to protect Nepal's biodiversity amid climate change and pollution  The Himalayan Times,2026-01-23 16:14:40,https://news.google.com/rss/articles/CBMi6AFBVV95cUxQQ3BBa0xpRzZPY051d0RFOS0yNS1YSUExRm54ampMMjJPQVVaX3VCaTkxb3Z4dzhCY1A4dHEwTXptd09kUkZtUmtxRFY2U3FGNlg4NEtyWVBkWGcxc1dDVkhBdmxSUXJZc2dza0JSYnd4RGVlRzdMWlJQT3p2YnYwX0pnRXl0ZTBTOGxlczk2bFhiQmVOS0Q4eVZ0VG9mNHVub2FzZGxXZmdCRzI4NU5tbkowcTlBSnp5bDI1bGFLTjBMRTNhQ1dMZ1JNLUlwOWhJTFNiMVZnQ3gtS3VlbVBLSHJuQWc4bXYx?oc=5&hl=en-US&gl=US&ceid=US:en,https://thehimalayantimes.com,The Himalayan Times,,{'https://lh3.googleusercontent.com/J6_coFbogxhRI9iM864NL_liGXvsQp2AupsKei7z0cNNfDvGUmWUy20nuUhkREQyrpY4bEeIBuc=s0-w300'},
Nepal’s PM Sushila Karki asks security forces to ensure proper arrangements for upcoming elections - deccanherald.com,Nepal’s PM Sushila Karki asks security forces to ensure proper arrangements for upcoming elections  deccanherald.com,2026-01-23 17:38:30,https://news.google.com/rss/articles/CBMi1wFBVV95cUxOTUQyRnZzREJ5ZWhaYnN4dVJsemRkVGpLN2JFdHVWTUk5aWNzai16QjdZNDJ1NXlqVjlYaGRLRG9lTUF1eFFROTNsN0h3dmQ5a0VHakZuNkVjRkdEMm1tSURxOVdoYjY2OExKSWNaYWkzeDJHQUlGOWNpWURDNGxxY2I4YUhfdmoyQ0RIRmw3VzRzTEFqREVHbW9scXVBSGYzcWw1WEhtLVNYX1lzOWNzcDF1UV9qblJqdnNGcFRzbDU0MkpBTkhiNTYyRS1UNUp3QldzVWxXOA?oc=5&hl=en-US&gl=US&ceid=US:en,https://www.deccanherald.com,deccanherald.com,,{'https://lh3.googleusercontent.com/J6_coFbogxhRI9iM864NL_liGXvsQp2AupsKei7z0cNNfDvGUmWUy20nuUhkREQyrpY4bEeIBuc=s0-w300'},
"Role of APF Nepal remarkable to combat security challenges, PM Karki says - The Rising Nepal","Role of APF Nepal remarkable to combat security challenges, PM Karki says  The Rising Nepal",2026-01-23 18:00:05,https://news.google.com/rss/articles/CBMiUEFVX3lxTE5xcm85TXNHNU91aVR0SzNrQ2VZVG05V1YxX2dlSXUtTjZmOW44VnZnV00ybl9mNklZNFBmQ0ROU1FFT3h5TngwS0Zpb1cteUVj?oc=5&hl=en-US&gl=US&ceid=US:en,https://risingnepaldaily.com,The Rising Nepal,,{'https://lh3.googleusercontent.com/J6_coFbogxhRI9iM864NL_liGXvsQp2AupsKei7z0cNNfDvGUmWUy20nuUhkREQyrpY4bEeIBuc=s0-w300'},
SSF meets Rs. 100 billion milestone - The Rising Nepal,SSF meets Rs. 100 billion milestone  The Rising Nepal,2026-01-24 00:06:34,https://news.google.com/rss/articles/CBMiUEFVX3lxTE56dkZvNzFaU2JvNXVyU21RRThfUWpHeEg0cVN4LWo0ckc3MTQ5SE1EQ1hoRm9NWFVaazRyMkxSQldQT1FhWFU1cXJPYXlIbEFO?oc=5&hl=en-US&gl=US&ceid=US:en,https://risingnepaldaily.com,The Rising Nepal,,{'https://lh3.googleusercontent.com/J6_coFbogxhRI9iM864NL_liGXvsQp2AupsKei7z0cNNfDvGUmWUy20nuUhkREQyrpY4bEeIBuc=s0-w300'},
"Gold price crosses Rs. 300,000 per tola - The Rising Nepal","Gold price crosses Rs. 300,000 per tola  The Rising Nepal",2026-01-24 00:14:06,https://news.google.com/rss/articles/CBMiUEFVX3lxTFB4UXVXYjc3WjNIV0pEbnZDRnFsdjNST1lhcV9oWUZIMk05MjV3MFlQYlFBaDY1TFBjTnB1YUhXUVJadjhyZXYtbkVmQ0JLOG9u?oc=5&hl=en-US&gl=US&ceid=US:en,https://risingnepaldaily.com,The Rising Nepal,,{'https://lh3.googleusercontent.com/J6_coFbogxhRI9iM864NL_liGXvsQp2AupsKei7z0cNNfDvGUmWUy20nuUhkREQyrpY4bEeIBuc=s0-w300'},
Funding woes stall Newar Museum in Putalikhet - The Rising Nepal,Funding woes stall Newar Museum in Putalikhet  The Rising Nepal,2026-01-24 00:31:28,https://news.google.com/rss/articles/CBMiUEFVX3lxTE4tYnhEd3hCdHNiVTczNmZ5SE82RV84TlYyTmVFb0FPNzU3WGJHeUpnQ1JwMmZldVlXTjRrOTg0dVJHa0FxYy00VVBLTU5Jdk1a?oc=5&hl=en-US&gl=US&ceid=US:en,https://risingnepaldaily.com,The Rising Nepal,,{'https://lh3.googleusercontent.com/J6_coFbogxhRI9iM864NL_liGXvsQp2AupsKei7z0cNNfDvGUmWUy20nuUhkREQyrpY4bEeIBuc=s0-w300'},
NC picks Gagan as PM candidate - The Rising Nepal,NC picks Gagan as PM candidate  The Rising Nepal,2026-01-24 01:01:27,https://news.google.com/rss/articles/CBMiUEFVX3lxTE5ITk5ES1MxZUVOeEVYcnJvWWVfMDZETVVaRDdCdklnNEprSzNzVkhBREg0OEVObGFiZ3YxOE5mSFpmOEI1dVk3bE1xYTMzNkNS?oc=5&hl=en-US&gl=US&ceid=US:en,https://risingnepaldaily.com,The Rising Nepal,,{'https://lh3.googleusercontent.com/J6_coFbogxhRI9iM864NL_liGXvsQp2AupsKei7z0cNNfDvGUmWUy20nuUhkREQyrpY4bEeIBuc=s0-w300'},
40 days to HoR elections: Printing of 5 million ballot papers for PR system remaining - Nepalnews.com,40 days to HoR elections: Printing of 5 million ballot papers for PR system remaining  Nepalnews.com,2026-01-24 01:34:46,https://news.google.com/rss/articles/CBMixAFBVV95cUxNTy1jY0dHYnRqb0VreC1oNFNaU2pyME8wM09pdVNkcjkxdHNDcUhLZXp2ZWpJMFJucG12RndkRWFZd2FHOUFRclhVbU9GVG5YbTZ2Z09SdzF4bVg4Mmg4Y2xtOWlMQVA4MWdLMElUWDdiMmlJajY0X2xSd1BTZUg1X3FoVW16bDFjenB1b1NMTUJNcTBPMUZ2bnZjdEhLdm5ZYzRSZ0VRNHBaRWhaaVhxVXJJYkVuQmpJbDZRT2JwdVRBS2dz?oc=5&hl=en-US&gl=US&ceid=US:en,https://english.nepalnews.com,Nepalnews.com,,{'https://lh3.googleusercontent.com/J6_coFbogxhRI9iM864NL_liGXvsQp2AupsKei7z0cNNfDvGUmWUy20nuUhkREQyrpY4bEeIBuc=s0-w300'},
“China will eat them up”: Trump slams Canada for opposing Greenland ‘Golden Dome’ - Nepalnews.com,“China will eat them up”: Trump slams Canada for opposing Greenland ‘Golden Dome’  Nepalnews.com,2026-01-24 01:44:47,https://news.google.com/rss/articles/CBMiwAFBVV95cUxQMGdWN1hQLWJOMG5HdC1xNUFZTDJ0eURNTGVIc1VtS2JYb3ZmN2pCd0xhN0R2T0llbTN4VzF0aXJJc0JITTlrYkU0S0NVV25oeGxCTU1IUDl3ZFlpZ2w2R1dvcndUN2RKQXhQeHFlSzF3N1U3TVhERl8zMmVrMEFhd2dHUEdKbnljRWhQSlliTllucG9qdl9MNmYyampvcUJNVy1icXlGenA5WlNCMnVpb0FGR1pUc0Z5aGJadkdJSkg?oc=5&hl=en-US&gl=US&ceid=US:en,https://english.nepalnews.com,Nepalnews.com,,{'https://lh3.googleusercontent.com/J6_coFbogxhRI9iM864NL_liGXvsQp2AupsKei7z0cNNfDvGUmWUy20nuUhkREQyrpY4bEeIBuc=s0-w300'},
Nepal Skipper Eyes New Summit With 'Nothing To Lose' At T20 World Cup - Barron's,Nepal Skipper Eyes New Summit With 'Nothing To Lose' At T20 World Cup  Barron's,2026-01-24 01:50:00,https://news.google.com/rss/articles/CBMirgNBVV95cUxNbkZXaENqcE5qd0FBelJyQTk5VjJoY1NneTdTc2pxdHlfVkI4Yi0zNnZKNEpyUGdoMk1WWC1rVEp3TE9INkNJcXpud3pNbFlUMms0bVFWR3dSQi0wOTZ4N01UbGZraXlpSHVLSFA2WF9NXzdjeVp2cEJTMUY5MDI0SFNLY2NUOHFtbklNb2JQYjEwVkpYdjFuWm1SOGJVeVBMVkp0bTZObGM5VHNNdkdXNmk2Q1R2YUxVTkJ0MXBKMlRyanVoVm9fdXV0eWRtSmxtSW81eUQxSGFfWmdIMm93RjRLUlJocVdXelNEMWEzM0xCZXctUklVd1hUQXpFSFRDTEs5MFlfVm9vdHN6QXVUdXZnblNCeFZGbjR3dk5mX1dWMkRiUEY2RjdLeDVBcDVQUmR2MVBzcEUtVGYzakZyQUxDUm1fUkZLeHJaT2lDUXVLWHZHVUVQQjY0QUh6N3pzalhzZTJKQmNHVVJhVklPWVduaV90dTRNOE1GQlhRc0xaS0V6X2xPV2ExdExCSm1vckJRN3EtRFlOVk5qZld5VENrNnZHZVNqbng0STVn?oc=5&hl=en-US&gl=US&ceid=US:en,https://www.barrons.com,Barron's,,{'https://lh3.googleusercontent.com/J6_coFbogxhRI9iM864NL_liGXvsQp2AupsKei7z0cNNfDvGUmWUy20nuUhkREQyrpY4bEeIBuc=s0-w300'},
Nepal signs LEAF Coalition deal that could bring up to $55 million in climate finance - kathmandupost.com,Nepal signs LEAF Coalition deal that could bring up to $55 million in climate finance  kathmandupost.com,2026-01-24 01:53:33,https://news.google.com/rss/articles/CBMiygFBVV95cUxONFMtVGpKSHJOcjN4bURxVHZIa2U0MXMxWWowYzRvUk5fMk5xRkJ0WlRYTUlLQ3pwREpuNm44M2FucjNhcWhGa1ZiM2s3OUJueG10d08zaW4weXJnY0s2dHpLR2ZON0hzRnV0WVJkYnI1QUxWc0lwU2tqbWhLUWNqV0xVZ3V3UkhyR2Q4Qy1IbWh2NnFHQ3BWMmpEdE53U1ZQYXVwSi1vZjVnd3RYRFpDVURrVzlicTRjdVZnUUlaUkFqZklOVUZhR3Bn?oc=5&hl=en-US&gl=US&ceid=US:en,https://kathmandupost.com,kathmandupost.com,,{'https://lh3.googleusercontent.com/J6_coFbogxhRI9iM864NL_liGXvsQp2AupsKei7z0cNNfDvGUmWUy20nuUhkREQyrpY4bEeIBuc=s0-w300'},
Economic Digest: Nepal’s Business News in a Snap - Khabarhub,Economic Digest: Nepal’s Business News in a Snap  Khabarhub,2026-01-24 02:21:45,https://news.google.com/rss/articles/CBMiWEFVX3lxTE96Y1RTNkdOYUduQWl5N2tsUDl2MEtEY2ROb1YzSzZfN2R2am8yekpwM0JlWWk3cVpfT0hCZU8weFR2RDBFV3M3Qks0c3dWaUtiRnNTSGljRHo?oc=5&hl=en-US&gl=US&ceid=US:en,https://english.khabarhub.com,Khabarhub,,{'https://lh3.googleusercontent.com/J6_coFbogxhRI9iM864NL_liGXvsQp2AupsKei7z0cNNfDvGUmWUy20nuUhkREQyrpY4bEeIBuc=s0-w300'},
73 Koreans deported from Cambodia - The Rising Nepal,73 Koreans deported from Cambodia  The Rising Nepal,2026-01-24 02:31:57,https://news.google.com/rss/articles/CBMiUEFVX3lxTE1kUXVSUEhLVXhLUVNkd0h4OFVMc013T0xCVkRDZnQzQThRMGhheUxFdWF5WU9DSTRiUEliLUQ2bHZJQ2JrZWxLT3JicHRNM3ps?oc=5&hl=en-US&gl=US&ceid=US:en,https://risingnepaldaily.com,The Rising Nepal,,{'https://lh3.googleusercontent.com/J6_coFbogxhRI9iM864NL_liGXvsQp2AupsKei7z0cNNfDvGUmWUy20nuUhkREQyrpY4bEeIBuc=s0-w300'},
"At Taza Treats, Syrian sweets find a Nepali home - kathmandupost.com","At Taza Treats, Syrian sweets find a Nepali home  kathmandupost.com",2026-01-24 02:33:53,https://news.google.com/rss/articles/CBMinAFBVV95cUxNblZwYkZ2OE91OWV4ZkxuZ0hMVDgwZ0xzd3Z2VjhvbmZyNk1IUTNFTmFpVWR3VWxsSUdTbExOZ2w2SW5uaG5vQTNMMG0zakFlcnFLMVBzc3VqZTctTHNKUE9odEE2SU5pdERWY2JDOWFOVGdrYkhSZG55RmlWOEZNbFlMNmtLd0Fvay01ZEZvbFd6RnZqaUV3RWZ0UHQ?oc=5&hl=en-US&gl=US&ceid=US:en,https://kathmandupost.com,kathmandupost.com,,{'https://lh3.googleusercontent.com/J6_coFbogxhRI9iM864NL_liGXvsQp2AupsKei7z0cNNfDvGUmWUy20nuUhkREQyrpY4bEeIBuc=s0-w300'},
Asia Album: People celebrate Basanta Panchami festival in Nepal - Xinhua,Asia Album: People celebrate Basanta Panchami festival in Nepal  Xinhua,2026-01-24 02:39:15,https://news.google.com/rss/articles/CBMifEFVX3lxTFAwSG04OUI4SjFUbFFvNW1McDRjX0FiMFVpQ3VkSElTd0UxU05PWHZKTFlGamxXclEwandFN2tGcWR1eUNuWk1tZlp2MTFUanBCcHczMXpxOXJUMTJUb09NcWVBWDlMZjd2aFhxSWVIQTZTeE9VQUtnaHhwVHA?oc=5&hl=en-US&gl=US&ceid=US:en,https://english.news.cn,Xinhua,,{'https://lh3.googleusercontent.com/J6_coFbogxhRI9iM864NL_liGXvsQp2AupsKei7z0cNNfDvGUmWUy20nuUhkREQyrpY4bEeIBuc=s0-w300'},
IPPAN urges political parties to prioritise energy in election manifestos - The Rising Nepal,IPPAN urges political parties to prioritise energy in election manifestos  The Rising Nepal,2026-01-24 02:47:01,https://news.google.com/rss/articles/CBMiUEFVX3lxTFByNURvdzFBOE9OWDZldGxnQWdWcGJiNDBjX2V3NGlZR2x3YzJ0RFN4STZrQmN1RmJjWWRDVWppWGtQUnF5SE83YUM4VVpoOWJM?oc=5&hl=en-US&gl=US&ceid=US:en,https://risingnepaldaily.com,The Rising Nepal,,{'https://lh3.googleusercontent.com/J6_coFbogxhRI9iM864NL_liGXvsQp2AupsKei7z0cNNfDvGUmWUy20nuUhkREQyrpY4bEeIBuc=s0-w300'},
Election bells ringing in Nepal: Can ousted premier Oli return to power? - Counterview,Election bells ringing in Nepal: Can ousted premier Oli return to power?  Counterview,2026-01-24 03:22:00,https://news.google.com/rss/articles/CBMiggFBVV95cUxQSktJZkVMaVoybkZlYVN0MkNqZXZic3BKOUZQQ0dUV2x1aVZpcnRuV3FmU0Y4VHRMVUdTRmtRWl9PSW9TUExuTEd5b3dldzl4VlBlSU5nd3FxLUM2NEZlSEN1dWlGaWh1ZGE3VTNvbEs3VEg0d2tMbFJ6eWw2cGx5OG5B?oc=5&hl=en-US&gl=US&ceid=US:en,https://www.counterview.net,Counterview,,{'https://lh3.googleusercontent.com/J6_coFbogxhRI9iM864NL_liGXvsQp2AupsKei7z0cNNfDvGUmWUy20nuUhkREQyrpY4bEeIBuc=s0-w300'},
Nepal becomes first South Asian country to sign LEAF Coalition deal - The Rising Nepal,Nepal becomes first South Asian country to sign LEAF Coalition deal  The Rising Nepal,2026-01-24 04:07:19,https://news.google.com/rss/articles/CBMiUEFVX3lxTE5ySGQ3Q0dHQk55V2psdXlXdjRRQkFwc1RlS01hWHRBRjBlaGhNdTh2LXRBYkJxUDdlSGhDWktRVFFiVFQtNFdzOW9mWlluT0JZ?oc=5&hl=en-US&gl=US&ceid=US:en,https://risingnepaldaily.com,The Rising Nepal,,{'https://lh3.googleusercontent.com/J6_coFbogxhRI9iM864NL_liGXvsQp2AupsKei7z0cNNfDvGUmWUy20nuUhkREQyrpY4bEeIBuc=s0-w300'},
When a senior Indian journalist apologized to King Mahendra over the murder of Punjab chief minister - Nepalnews.com,When a senior Indian journalist apologized to King Mahendra over the murder of Punjab chief minister  Nepalnews.com,2026-01-24 06:00:37,https://news.google.com/rss/articles/CBMi2AFBVV95cUxNdmZJM3pRbGFWaU13UkNBQm5uaVBJVE5hLURkX3JVdHliR0ttdE1RWXRENHVsb21ReTQ3VGhhLWNSdkRNQU5xSHhKVnFrZjUxdWFKWVlkNElSQnVYZllQX3hHc3BncUxoVHZFSjFrVjh3R2k0R0xiNXFOVzBuSHlVM2p2T09qVDJWNU1TdjRGcnFOMHduc05SUkxrZFAwdEgyLXZ4VnFpME8xUWRxMTN3YVNLNXJEcjBqVl9mSEdQNi0xYXhSUDlWVVRHdGxlRmdsRUo4VmxjWGE?oc=5&hl=en-US&gl=US&ceid=US:en,https://english.nepalnews.com,Nepalnews.com,,{'https://lh3.googleusercontent.com/J6_coFbogxhRI9iM864NL_liGXvsQp2AupsKei7z0cNNfDvGUmWUy20nuUhkREQyrpY4bEeIBuc=s0-w300'},
Yug Pathak Joins Communist Party of Nepal - Khoj Samachar,Yug Pathak Joins Communist Party of Nepal  Khoj Samachar,2026-01-24 06:05:36,https://news.google.com/rss/articles/CBMidkFVX3lxTE55ekt0Q1BqOEJZeEdmM0JrZ1hFbHRPREVWYktFUjlsS0ExZks5ZS10QUw3cDRabDdsQUtNbFhvV0Y1U01pN1dEQkVTamhUMWxlR1BLQjJHZVZ0VWlRbUtzX2NESTB1aHVnT3ZQczdYb2tCdU9QM2c?oc=5&hl=en-US&gl=US&ceid=US:en,https://khojsamachar.com,Khoj Samachar,,{'https://lh3.googleusercontent.com/J6_coFbogxhRI9iM864NL_liGXvsQp2AupsKei7z0cNNfDvGUmWUy20nuUhkREQyrpY4bEeIBuc=s0-w300'},
