title,description,published date,url,publisher.href,publisher.title,full_article,images,translated
RPP Protest in Kathmandu Demands Restoration of Nepal’s Monarchy - munsifdaily.com,RPP Protest in Kathmandu Demands Restoration of Nepal’s Monarchy  munsifdaily.com,2025-04-08 07:57:44,https://news.google.com/rss/articles/CBMieEFVX3lxTE50Q3lRbHJmbFU2NTBzQWc2YUtrWW1jN1JRSl9zM0VHcFlFcDJwcklfd1VXX182SkxiSGQ0bFBRWkEzLWxkdk5oUXZXalNKcDNoWklRN3VSSzNDT094Y3BuZWpTM0hQMHE3Y0g1MjlZVWJzRW84WHdWUQ?oc=5&hl=en-US&gl=US&ceid=US:en,https://munsifdaily.com,munsifdaily.com,,{'https://lh3.googleusercontent.com/J6_coFbogxhRI9iM864NL_liGXvsQp2AupsKei7z0cNNfDvGUmWUy20nuUhkREQyrpY4bEeIBuc=s0-w300'},
Minister Paudel addresses 58th session of UN Health Commission - The Rising Nepal,Minister Paudel addresses 58th session of UN Health Commission  The Rising Nepal,2025-04-08 08:39:07,https://news.google.com/rss/articles/CBMiUEFVX3lxTE5DZUtYUExzSEVvbXJUT0MtcmhFa2U5NTA3WFZQZDR0UDlCS2JPRmVtWDhPaUJZcGJNd3ZVM3NqWnRBcXFnclJjV0l2R09ralU5?oc=5&hl=en-US&gl=US&ceid=US:en,https://risingnepaldaily.com,The Rising Nepal,,{'https://lh3.googleusercontent.com/J6_coFbogxhRI9iM864NL_liGXvsQp2AupsKei7z0cNNfDvGUmWUy20nuUhkREQyrpY4bEeIBuc=s0-w300'},
RPP stages protest demanding monarchy reinstatement in Nepal - nenews.in,RPP stages protest demanding monarchy reinstatement in Nepal  nenews.in,2025-04-08 10:13:16,https://news.google.com/rss/articles/CBMinAFBVV95cUxQbWNSWnFHUE4zdlFlbWdUR2ltZWFKZ0lUV010SGNwenB6U0J2MHhmMDdwVExuTFBKNGJQRGtnVmZQQlF4S1RSeUI0SWJ3X2RhWjNmZUdLeHUxdmR2SzYxSjNJLTc4M1FnZUdkODZ0bzJMNHpwRWZBYWVBVUV4WDFBOWxFRnZ1OVNnNVVIV25Mc3Bkb1lTRFNDeVJUeVM?oc=5&hl=en-US&gl=US&ceid=US:en,https://nenews.in,nenews.in,,{'https://lh3.googleusercontent.com/J6_coFbogxhRI9iM864NL_liGXvsQp2AupsKei7z0cNNfDvGUmWUy20nuUhkREQyrpY4bEeIBuc=s0-w300'},
Nepal chokes under toxic air as forest fires rage and rain stays away - The Himalayan Times,Nepal chokes under toxic air as forest fires rage and rain stays away  The Himalayan Times,2025-04-08 11:00:45,https://news.google.com/rss/articles/CBMisAFBVV95cUxNcl82bFlZaG1Bdm1ZVVYyeWJjRXNsQmpsZHo1MDRQRGlfVHpTbWNuWjJvUjFTdGxjdjE5NjJ4Nld6b0ZEc2ZIeUtlMC1ocldUNExEOHVndlh0SkhSX0Rqc01LZi1OZm1GaTdyXzBMYXJTMG8yRWZHUEpLZktjVW9xYm5sSVF1R1JoY0VtbDlmcnZWOGJ0OWxiRTV1OWRKZ0hRS2NRVkJEYW5XX0FIejRjUNIBXEFVX3lxTE9jeTBkNnpKeU5MdkxfTTNlVWVENXZiTi0zRE5iT1ZjZkp1ZTBjQkx1R1M5ZERfYzhIdlZtYXFVbWRRVjhOOTFjWWJUaFVFUXo5VG42aUYtMjNVTXRu?oc=5&hl=en-US&gl=US&ceid=US:en,https://thehimalayantimes.com,The Himalayan Times,,{'https://lh3.googleusercontent.com/J6_coFbogxhRI9iM864NL_liGXvsQp2AupsKei7z0cNNfDvGUmWUy20nuUhkREQyrpY4bEeIBuc=s0-w300'},
Predicting the unpredictable Nepal’s politics - Onlinekhabar English,Predicting the unpredictable Nepal’s politics  Onlinekhabar English,2025-04-08 11:22:12,https://news.google.com/rss/articles/CBMiigFBVV95cUxNS1kwYURmbS0zeEhkNXNwWFVPd2hEbU1TOV9idFJlNEdtYUZFNk5BMVJ5VFF5R0Z3SFNTSUlPUEFPZDJDSDBwU2VUOFNIUFNNQllLVXM4WkhoM1g5TGRiQ0o0NTg3ck1fN0o0MDVURmthNTY3WGhnY2ZRTnktd0FFVzVxRWVwY2tGTHc?oc=5&hl=en-US&gl=US&ceid=US:en,https://english.onlinekhabar.com,Onlinekhabar English,,{'https://lh3.googleusercontent.com/J6_coFbogxhRI9iM864NL_liGXvsQp2AupsKei7z0cNNfDvGUmWUy20nuUhkREQyrpY4bEeIBuc=s0-w300'},
Nepal urges global support for health sector at UN Commission on Population and Development - Khabarhub,Nepal urges global support for health sector at UN Commission on Population and Development  Khabarhub,2025-04-08 11:46:34,https://news.google.com/rss/articles/CBMiWEFVX3lxTFBtakI1VTZycWs5WDUzNk16a2tkWHZyaVJqc3h1ajY4TjRmd0xNOGUwZ2l5enZVQWFSS05QdVJudDJEbzUzalJJZlNIT241RzFvOU1NVVZoQTU?oc=5&hl=en-US&gl=US&ceid=US:en,https://english.khabarhub.com,Khabarhub,,{'https://lh3.googleusercontent.com/J6_coFbogxhRI9iM864NL_liGXvsQp2AupsKei7z0cNNfDvGUmWUy20nuUhkREQyrpY4bEeIBuc=s0-w300'},
"Union Minister Shri Shivraj Singh Chouhan to attend third BIMSTEC Ministerial meeting on Agriculture tomorrow at Kathmandu, Nepal - PIB","Union Minister Shri Shivraj Singh Chouhan to attend third BIMSTEC Ministerial meeting on Agriculture tomorrow at Kathmandu, Nepal  PIB",2025-04-08 12:00:00,https://news.google.com/rss/articles/CBMia0FVX3lxTE54WEVvMjh6RmtJZE1mdEppMnN2VThTTXJGMndQZDZQeUNMdGR5MmJGSTVya0hZWkFXaGswQ1VPZ29uTDNGZVFXd2VhSGxrcjQyQkdIVGNnc0JoLTZqRWxpTmpTdWN3S3ZoZ1VN?oc=5&hl=en-US&gl=US&ceid=US:en,https://pib.gov.in,PIB,,{'https://lh3.googleusercontent.com/J6_coFbogxhRI9iM864NL_liGXvsQp2AupsKei7z0cNNfDvGUmWUy20nuUhkREQyrpY4bEeIBuc=s0-w300'},
India recognises Nepali lab for fresh produce export testing - FreshPlaza,India recognises Nepali lab for fresh produce export testing  FreshPlaza,2025-04-08 12:12:17,https://news.google.com/rss/articles/CBMiugFBVV95cUxQQ2M5Zkl1NUhqZHplQXZ2NFI3djhZd1NwQ1dPYkhqZ3h2ajFET2VHWnpTSnJnN0FDYUlOWkd5LTZZb0hhYUptWDY0a0FjRHZTWXpFV3huQUgyQlRqR2ZKc3RiRVdINmlzOU1LcWhCUzUyRjAtY2dtaXR6ZWdLaGVqZEplV0x2Q3M5Zk1NRW9xWm14d0FCc0MtXy16N2RoanFvSWROQmJDY0pSZ213X21JZjNSX2h1Xzlhd2c?oc=5&hl=en-US&gl=US&ceid=US:en,https://www.freshplaza.com,FreshPlaza,,{'https://lh3.googleusercontent.com/J6_coFbogxhRI9iM864NL_liGXvsQp2AupsKei7z0cNNfDvGUmWUy20nuUhkREQyrpY4bEeIBuc=s0-w300'},
Nepal: New vegetable learning center established in Bhojpur - Hortidaily,Nepal: New vegetable learning center established in Bhojpur  Hortidaily,2025-04-08 12:34:00,https://news.google.com/rss/articles/CBMipAFBVV95cUxQa3NxY2xDTVh4RU9TS21xd29SS29FRHYwWXExdXgtQXotano2WDZYYzg2MWZkTTM1VDhTMFlnT3pnNXRXWVRDOGVkLTZ5NzhpanV4UndhcTFCZTJESXd4SEFRUnJESnZWNjE2RzE4UEMyRHpsTVdQYV9aZ0ZBcHltSzJQcmsyWHRyVksxUG0zT1NFRjd2Z3VHSlFLVTl2bkpkUlNMag?oc=5&hl=en-US&gl=US&ceid=US:en,https://www.hortidaily.com,Hortidaily,,{'https://lh3.googleusercontent.com/J6_coFbogxhRI9iM864NL_liGXvsQp2AupsKei7z0cNNfDvGUmWUy20nuUhkREQyrpY4bEeIBuc=s0-w300'},
"A Bhutanese refugee's questions to America, Bhutan, Nepal, and the United Nations :: Raju Adhikari - Setopati","A Bhutanese refugee's questions to America, Bhutan, Nepal, and the United Nations :: Raju Adhikari  Setopati",2025-04-08 12:36:59,https://news.google.com/rss/articles/CBMiTkFVX3lxTE8tVUJlbS1uTFN5OEtqa3NIZjNucVdGMkd3OE8wN3lRVnZ3VDUwNmloc3NWVWdoQUpmMmcxSlFOREhaWWFXeVFxelZjT2E3QQ?oc=5&hl=en-US&gl=US&ceid=US:en,https://en.setopati.com,Setopati,,{'https://lh3.googleusercontent.com/J6_coFbogxhRI9iM864NL_liGXvsQp2AupsKei7z0cNNfDvGUmWUy20nuUhkREQyrpY4bEeIBuc=s0-w300'},
"Nepalese man, two aides held for killing live-in partner, disposing of body in Palghar river - Deccan Herald","Nepalese man, two aides held for killing live-in partner, disposing of body in Palghar river  Deccan Herald",2025-04-08 14:25:43,https://news.google.com/rss/articles/CBMi3gFBVV95cUxNNl9TNUd1RnFQZkt3cmFrOTB5clN5M25kVVEwQ1ktdU1GQ0ZqN2oxc25FNHJ0UzQ2Rjh0T3VickJvQUEtMHo2UzVpNmRsZDBMR3pMS1JEUjlONENtbFpNbUVrUE9UcFk0bzJZOVdPREd5WFp0QkRUVWI1czVnZS01T0RmOXI4V0xGY3N2SHBwNjdNMEZaUjRMU2o3dzVmTU1ILWpILXlZQ0J6WUU3VXlrSU9iVFQwckltU1VRVGtjY2ExVk1KcHltczg4bWxLUzluR1ZUVjFrZGNiS2gwOUE?oc=5&hl=en-US&gl=US&ceid=US:en,https://www.deccanherald.com,Deccan Herald,,{'https://lh3.googleusercontent.com/J6_coFbogxhRI9iM864NL_liGXvsQp2AupsKei7z0cNNfDvGUmWUy20nuUhkREQyrpY4bEeIBuc=s0-w300'},
Nepal’s maternal mortality rate drops by 71% - Khabarhub,Nepal’s maternal mortality rate drops by 71%  Khabarhub,2025-04-08 14:48:08,https://news.google.com/rss/articles/CBMiWEFVX3lxTE45QzRoNEdhbkNnY19WTER5Wm5fZDJGR3YxNDZacm91bjBHaTZKU2I3Nzk5OGpSNGFpVEdvWjF6V0ZSazJ0NmYxOEM5bFFQSXJuYktjOUxzdk0?oc=5&hl=en-US&gl=US&ceid=US:en,https://english.khabarhub.com,Khabarhub,,{'https://lh3.googleusercontent.com/J6_coFbogxhRI9iM864NL_liGXvsQp2AupsKei7z0cNNfDvGUmWUy20nuUhkREQyrpY4bEeIBuc=s0-w300'},
Mishra leads in Nepal Bar Association election - The Kathmandu Post,Mishra leads in Nepal Bar Association election  The Kathmandu Post,2025-04-08 15:18:36,https://news.google.com/rss/articles/CBMilwFBVV95cUxOaFdiQmNkRG0tMTRCdzdBakcwZnNFLUsxTGIySjBIR0hrZVBRQmFXMTdYY19iRlhCVExOMVdoci0zc3RSeU8tajVDR0ZraEdQUlpoRXRTZldwcTlZZ2xZNUlSdFpGSUhYalpSS1Z1dW9ZVUpRb3Q2aW5MLUtQYTNhWWFublpENERpRDUxdjB3Slo5N1B1UGtz?oc=5&hl=en-US&gl=US&ceid=US:en,https://kathmandupost.com,The Kathmandu Post,,{'https://lh3.googleusercontent.com/J6_coFbogxhRI9iM864NL_liGXvsQp2AupsKei7z0cNNfDvGUmWUy20nuUhkREQyrpY4bEeIBuc=s0-w300'},
Nepal’s pro-monarchy party demands return of the king - Wion,Nepal’s pro-monarchy party demands return of the king  Wion,2025-04-08 15:40:13,https://news.google.com/rss/articles/CBMilgFBVV95cUxQMDlySDdKb0FvZEUzWVE2Q3hHOUlSZTdoT2lpWVVJZ09LUmRGZ1ViNUhsRS1nSUhoS2o1SWExaGZ4ZHdTdWJpZDU3MTRDMVozd3dBek1Lc0xJYnZBMXBEbWtZNjZYQW0tTG9PUGZYQmduY3BGQU9iQmtPR1c5RUtIQ1FfVTUwVjd5MEFKOW5SS200RDEySUHSAZsBQVVfeXFMT3dOVE9ScFZRTXpqZTd5Ynp2TUpvbEozMXhOeFBMT01nTFpVZHRGUklpQ3k1azJrQkRvZUgtQkhBYUdPQTN5YUk5OWloR1NBTXk1Wlh2cV9zN3doblo5ci0ycU9mVHpZdnBRN2ctX0dBbVdCb2szMjlQMUJ2MlptWmktZHoyRG1Bem1BUmVwTTRmb29Vc0I2VVR0N2c?oc=5&hl=en-US&gl=US&ceid=US:en,https://www.wionews.com,Wion,,{'https://lh3.googleusercontent.com/J6_coFbogxhRI9iM864NL_liGXvsQp2AupsKei7z0cNNfDvGUmWUy20nuUhkREQyrpY4bEeIBuc=s0-w300'},
Two Nepalese swept away by Annapurna avalanche - New Age BD,Two Nepalese swept away by Annapurna avalanche  New Age BD,2025-04-08 16:30:57,https://news.google.com/rss/articles/CBMimgFBVV95cUxQVjM5dHhta3lxc0I4blJYTkxnWWtPUTJIZkFvSzZaMHFfZ1hrdFdrM0FkRVE5U3czeGJuaDZUb0F1anlQWXZ1cmZqbXI2Yy1rOFd4X0FncUtKYTNTY1I3M2ZGcTgzMTdzTl8xVHdBWDBCcEstNzR1c2pKdl84QTFyMWhpUWZBcWV0ZkpMcUlSdGl1R0h3TUY1M0pB?oc=5&hl=en-US&gl=US&ceid=US:en,https://www.newagebd.net,New Age BD,,{'https://lh3.googleusercontent.com/J6_coFbogxhRI9iM864NL_liGXvsQp2AupsKei7z0cNNfDvGUmWUy20nuUhkREQyrpY4bEeIBuc=s0-w300'},
Solidarity to the struggle of the Nepalese Teachers’ movement - wftucentral.org,Solidarity to the struggle of the Nepalese Teachers’ movement  wftucentral.org,2025-04-08 16:36:13,https://news.google.com/rss/articles/CBMikwFBVV95cUxPdGFreFJ6RnRQanlLT2VWdHRuR0luTzVGbjhLMXVRWHVwRl9sV1JCeG5veTJyU2xIUmE0bDRTbVUyei1BWXJkTW9RSmFtRy1Uc05lSC1EMmJoNk1pVUowQnA4Sk5ET1J3Nm1oVzMwWmlUTENHc1hHUEY2a2syclNCM1lVamw0UU02eUxEYUpYNGJaTjg?oc=5&hl=en-US&gl=US&ceid=US:en,https://www.wftucentral.org,wftucentral.org,,{'https://lh3.googleusercontent.com/J6_coFbogxhRI9iM864NL_liGXvsQp2AupsKei7z0cNNfDvGUmWUy20nuUhkREQyrpY4bEeIBuc=s0-w300'},
Connecticut man sheds a light on human trafficking in Nepal in new book - The Bristol Press,Connecticut man sheds a light on human trafficking in Nepal in new book  The Bristol Press,2025-04-08 16:45:00,https://news.google.com/rss/articles/CBMi6wFBVV95cUxNdHllTzQ2TVJnU0lxQW5rRWp6ODNVLU44YjdsMjhaUENpTTJVYkJmZWVDRDg0cXZmY0EySVNBb0tXYllsNGtKMjVRUUhIOVFfTmZvbUVUd2txSEFtdE5EYTVCVzA5UE4xMThRRUJQTG5kazBWVzFobTJ6V3ROQVNROFdKbEx6ODBrYkN0NXJnV2wyMFNCMWY3aXUwODVNYnFXTHp1R0RJSFZKczRiRlFwbEF3YzdEaW85cW0zbG84Q1B0UXJCUmFjUXFfZ2stNXZzTHY4V2NESDZhQU1XeVNhZHFEczltQkhaU2Rz?oc=5&hl=en-US&gl=US&ceid=US:en,https://www.bristolpress.com,The Bristol Press,,{'https://lh3.googleusercontent.com/J6_coFbogxhRI9iM864NL_liGXvsQp2AupsKei7z0cNNfDvGUmWUy20nuUhkREQyrpY4bEeIBuc=s0-w300'},
"Thousands protest in Nepal demanding monarchy reinstatement | 'Over 2,000 police personnel have been deployed' | Inshorts - Inshorts","Thousands protest in Nepal demanding monarchy reinstatement | 'Over 2,000 police personnel have been deployed' | Inshorts  Inshorts",2025-04-08 16:51:29,https://news.google.com/rss/articles/CBMipAFBVV95cUxNLTJlRnB1NTU3dXY3YnREMjNGQTFKU0Z3OEFRNURWSjFpSHdxQzNaQ1V0dG1uOFNpd0ZHYlJkdjBOdUxlLTdNOTg3cDlNTnhRU1gtcnRfWlZ1WTFOLTVaNnQxeENCU0hMU0tZMmpVSm5PN1BLUDBkNkdYdVBjcm9IUTZMSTMzTWxJSHFpdEtSYVhfa2hDU3E4M1BtdjM3WE9GS1FwVtIBqgFBVV95cUxOcUVwZTU0akJ2TExDQmI4czl4MldsWDlNWUhSaDJtaThEaEdHRF9Ybl8wLWI0U2Q4NkFjZXRDVTVCd2lxRUVRa09fNzF2QTQyd29HOVlCcjQ4X0lCODN5NHpKalBKeVdiM0FPQUJId1lTelNaUExQOE1YUFFFdlc4N3Vqdnp1ZENkV0VIeTZaaldJeElfNUxsaDM4aGFnQ1R3RGpHMGhGNHcxUQ?oc=5&hl=en-US&gl=US&ceid=US:en,https://inshorts.com,Inshorts,,{'https://lh3.googleusercontent.com/J6_coFbogxhRI9iM864NL_liGXvsQp2AupsKei7z0cNNfDvGUmWUy20nuUhkREQyrpY4bEeIBuc=s0-w300'},
Revival of monarchy Is mere daydreaming: PM Oli - The Himalayan Times,Revival of monarchy Is mere daydreaming: PM Oli  The Himalayan Times,2025-04-08 17:26:15,https://news.google.com/rss/articles/CBMiigFBVV95cUxOeFJHQkVOaU9PMVNQZ1VlVlNEZDZBdmh3Wk1qcGVpTlFBZ3FQNzdZMmJRbzNVZFBSYXRRUDhSdV9wMHF2a0luRzNlVzJJSGdTXzcxQURvZ19ackxhcU1xNlBzUFEwcUpSbVRqTmxzTW9yMk1maWZ2c0F0VF9xVklZMkJVbkFHejNSRFHSAVxBVV95cUxQOXBTdWhWbmVLTXQyZzVZMTlYaXN5cHlNZ05sMmpCSHdna3hSdVozeko2cllObUUwOFN4SWVqNmh0bWRxdlBiUWFKOTZnRFl3OGpCOWZVaklacHNWeQ?oc=5&hl=en-US&gl=US&ceid=US:en,https://thehimalayantimes.com,The Himalayan Times,,{'https://lh3.googleusercontent.com/J6_coFbogxhRI9iM864NL_liGXvsQp2AupsKei7z0cNNfDvGUmWUy20nuUhkREQyrpY4bEeIBuc=s0-w300'},
Nepal vs Qatar - Match 1 - Hong Kong Quadrangular Men's T20 Series 2025 - cricnepal.com,Nepal vs Qatar - Match 1 - Hong Kong Quadrangular Men's T20 Series 2025  cricnepal.com,2025-04-08 17:58:43,https://news.google.com/rss/articles/CBMinwFBVV95cUxQTXB3NEtTa2ZFWW5ldF8zZ1ZQQVZmSTRCNGtxaDF6ckNVNmlkR1JFUm9BLVJ1V3k1ZGRsZms4ZEhLV05CUjRhWFltRHRKSTF0QmxveEtuNWIxaWIyWU1XOV9qVGF4SGVRcHVlTDlhOGhzT3liUlFJS2Y2ZHJubFMtV0xPRGZmZHpvRmNFai1MX2FxSEx5ekNTX2YzYXNDZUU?oc=5&hl=en-US&gl=US&ceid=US:en,https://www.cricnepal.com,cricnepal.com,,{'https://lh3.googleusercontent.com/J6_coFbogxhRI9iM864NL_liGXvsQp2AupsKei7z0cNNfDvGUmWUy20nuUhkREQyrpY4bEeIBuc=s0-w300'},
