title,description,published date,url,publisher.href,publisher.title,full_article,images,translated
Nepal Politics | Nation/World | bdtonline.com - Bluefield Daily Telegraph,Nepal Politics | Nation/World | bdtonline.com  Bluefield Daily Telegraph,2024-05-24 06:51:34,https://news.google.com/rss/articles/CBMiamh0dHBzOi8vd3d3LmJkdG9ubGluZS5jb20vbmV3cy9uYXRpb25fd29ybGQvbmVwYWwtcG9saXRpY3MvaW1hZ2VfODBkZDc1ZmUtYmYzZS01ZGJiLTgxMmMtYjNiOWM4NDEyZmRkLmh0bWzSAQA?oc=5&hl=en-US&gl=US&ceid=US:en,https://www.bdtonline.com,Bluefield Daily Telegraph,"First Amendment: Congress shall make no law respecting an establishment of religion, or prohibiting the free exercise thereof; or abridging the freedom of speech, or of the press; or the right of the people peaceably to assemble, and to petition the Government for a redress of grievances.","{'https://bloximages.chicago2.vip.townnews.com/bdtonline.com/content/tncms/custom/image/b4ace612-1770-11ef-8d30-8b6934c24b0b.jpg?resize=200%2C25', 'data:image/png;base64,iVBORw0KGgoAAAANSUhEUgAAAAEAAAABCAQAAAC1HAwCAAAAC0lEQVR42mM8Uw8AAh0BTZud3BwAAAAASUVORK5CYII=', 'https://bloximages.chicago2.vip.townnews.com/bdtonline.com/content/tncms/assets/v3/editorial/3/b1/3b1164c1-cdd8-5764-ba27-6256b50281ab/664fae0065d14.preview.jpg?resize=166%2C200', 'https://bloximages.chicago2.vip.townnews.com/bdtonline.com/content/tncms/assets/v3/editorial/8/0d/80dd75fe-bf3e-5dbb-812c-b3b9c8412fdd/665035d915aaf.image.jpg?crop=1763%2C926%2C0%2C124&resize=1200%2C630&order=crop%2Cresize', 'https://bloximages.chicago2.vip.townnews.com/bdtonline.com/content/tncms/assets/v3/editorial/c/0b/c0b26138-1f2f-11ee-b3b7-e729518fc95d/64ac188162273.image.jpg?resize=384%2C500', 'data:image/png;base64,iVBORw0KGgoAAAANSUhEUgAAABAAAAAJCAQAAACRI2S5AAAAEklEQVR42mM8U8+AFzCOKgADAHdUC60wg0dkAAAAAElFTkSuQmCC', 'https://bloximages.chicago2.vip.townnews.com/bdtonline.com/content/tncms/assets/v3/media/c/85/c85c4186-a570-11ec-924c-3fcf0a9871b3/623257c3c4a90.image.png?resize=200%2C19', 'http://static.cnhionline.com/bdtonline/images/weddings-bdt-feb2023.jpg', 'https://bloximages.chicago2.vip.townnews.com/bdtonline.com/content/tncms/assets/v3/editorial/0/66/06609390-ab1c-5837-a319-72b795648921/6650ff80ebc07.preview.jpg?resize=183%2C200'}","प्रथम संशोधन : कांग्रेस कोनो धर्मक स्थापनाक सम्मान करैत कोनो कानून नहि करत, वा ओकर स्वतंत्र प्रयोग पर रोक लगाओत;अथवा वाणीक स्वतंत्रताकेँ, वा प्रेसक समाहित करब;या जनता के शांति के साथ इकट्ठा होय के अधिकार, आरू सरकार के शिकायत के निवारण के लेलऽ याचिका करै के अधिकार ।"
Flying during the monsoon in Nepal? - Nepali times,Flying during the monsoon in Nepal?  Nepali times,2024-05-24 07:32:50,https://news.google.com/rss/articles/CBMiQ2h0dHBzOi8vbmVwYWxpdGltZXMuY29tL2J1c2luZXNzL2ZseWluZy1kdXJpbmctdGhlLW1vbnNvb24taW4tbmVwYWzSAQA?oc=5&hl=en-US&gl=US&ceid=US:en,https://nepalitimes.com,Nepali times,"Domestic air passengers in Nepal faced massive delays and cancellations during April and May because of poor visibility due to wildfire smoke, but things have improved with pre-monsoon showers clearing the air.

However, monsoon flying comes with its own challenges – especially in remote areas airfields serviced by short take-off and landing planes. The trunk routes are less susceptible to delays due to clouds, but spells of heavy rain can also limit airport operations and in some cases have even submerged air fields in the past.

Flights between Kathmandu and Pokhara’s new and old airports were cancelled for more than a week earlier this month because of thick smoke from forest fires in central Nepal. Visibility fell to below 1,000m, when the new airport needs a runway visibility range of at least 3.5km.

At Buddha Air’s Flight Operations Control in Kathmandu, Upendra Lal Shrestha is busy looking at the weather map for Nepal, and seeing if there are any critical visibility issues or cloud buildup.

“Before every flight, we at the Operation Control Centre provide flight crew with a detailed overview of enroute and destination weather. The main reason for flight delays and diversions are due to weather factors,” Shrestha explains.

When the visibility is good, domestic flights into Kathmandu usually enter the Valley through mountain passes to the east or west. However, when the visibility goes to below 3km due to smog or heavy rain, pilots have to make instrument landing from the south following strict descent profiles.

What this means in Kathmandu is that delays are inevitable as planes have to maintain at least a 1,000ft vertical and 3 nautical mile horizontal separation. This means planes, no matter if they are Airbus 330s or Twin Otters, can land only every 7 minutes.

Planes then have to circle, sometimes for hours, while waiting for their turn. If they run low on fuel, they divert to alternative airports. So far this month, more than 80% of all daytime flights were landing on standard instrument approach, which led to long delays for passengers.

The Civil Aviation Authority of Nepal (CAAN) is trying to more strictly implement flying only under Visual Flight Rules (VFR) in flights to and from airfields in the mountains without navigational aids. This simply means pilots are not allowed to fly into clouds in remote areas.

Since Kathmandu and most major airfields in the Tarai or Pokhara have navigational aids, planes can fly under Instrument Flight Rules (IFR) in poor visibility.

“No doubt, flying in Nepal is the most challenging in the world because of terrain and weather, but our pilots are trained in simulators for IFR arrivals or departures and they strictly follow rules and follow procedures,” explains Manoj KC, an instructor captain with Buddha Air.

Interestingly, pilots regard the pre-monsoon season as being more challenging to fly in because of afternoon cloud buildup, updrafts causing turbulence and wind shear. In the monsoon, the weather is more stable and less windy although visibility can sometimes be poor on runway thresholds.

“The pre-monsoon period, where the weather is windy and stormy can significantly impact flights which can get bumpy,” says Upendra Lal Shrestha. “We have to monitor the weather radat to fly around weather, and sometimes have to reroute.”

Even the slightest delay of one flight leads to a chain effect to the delay of the next flight. The schedule of one flight disruption leads to the disruption of all schedules with a domino effect.

At the same time, airports in Nepal, including runway and airport lounge facilities, were designed decades ago when air traffic was significantly lower. With the exponential increase in flight frequency, these ageing facilities struggle to accommodate the increasing demand, resulting in more and more delays.

Despite having a fleet of 17 ATR-72 and -42 aircraft, Buddha Air acknowledges that flight delays can also occur due to technical issues. The carrier provides various channels for travellers to stay informed about flight status. These include a call centre, SMS service, and a mobile app with real-time updates on flight delays and revised departure times. The best way to prepare for delays is to keep plans flexible and keep a buffer for important business.

The pre-monsoon months of May till mid-June have towering cumulus clouds fed by updrafts from the hot plains rising up the mountains. These are chracterised by strong up and downdrafts and turbulence. However, during the monsoon months of July-August-September clouds and heavy rain can reduce runway visibility as well as make them slippery or water-logged.

Buddha Air has a special briefing for all pilots before the start of the rainy season to remind them of safety measures and forecasts. Climate change is also making weather events more extreme, as was seen this week on a Singapore Airlines 777 flying from London Heathrow to Singapore which encountered severe turbulence while near Burma.

Buddha Air’s Flight Dispatch Centre at Kathmandu airport also monitors weather at and between airports around the country at all times, and provides pilots with go or no-go information.

“We have a Japanese software that helps us live track our planes, but also brief us on weather conditions,” explains Buddha Air’s flight dispatcher Umesh Khadka.","{'https://publisher-publish.s3.eu-central-1.amazonaws.com/pb-nepalitimes/swp/asv65r/media/20240524090528_263740c87ea6312d014e4ec9bc8782d152fe651a99f8a41a0009da4e3d6b01da.jpg', 'https://publisher-publish.s3.eu-central-1.amazonaws.com/pb-nepalitimes/swp/asv65r/media/20240524090520_288e83bbc8ee2e68d5bea59bcfbef960da7f21f9938ddf62fbac9e449b5feba9.jpg', 'https://news.google.com/img/logo.png'}","नेपाल म॑ घरेलू हवाई यात्री क॑ अप्रैल आरू मई के दौरान जंगली आग के धुआं के वजह स॑ खराब दृश्यता के वजह स॑ भारी देरी आरू रद्द होय के सामना करना पड़लै, लेकिन पूर्व-मानसून केरऽ बौछार हवा क॑ साफ करै के साथ हालात म॑ सुधार होय गेलऽ छै ।लेकिन, मानसून केरऽ उड़ान अपनऽ चुनौती के साथ आबै छै – खास करी क॑ दूरस्थ क्षेत्रऽ म॑ छोटऽ टेक-ऑफ आरू लैंडिंग विमान द्वारा सेवा देलऽ जाय वाला हवाई अड्डा ।ट्रंक मार्ग बादल के कारण देरी के प्रति कम संवेदनशील छै, लेकिन भारी बारिश के मंत्र हवाई अड्डा के परिचालन के भी सीमित करी सकै छै आरू कुछ मामला में अतीत में हवा के क्षेत्र तक डूबी गेलऽ छै ।काठमांडू आरू पोखरा केरऽ नया आरू पुरानऽ हवाई अड्डा के बीच उड़ान क॑ मध्य नेपाल म॑ जंगलऽ म॑ आग लगला स॑ मोटऽ धुआं के वजह स॑ एक सप्ताह स॑ भी अधिक समय तलक रद्द करी देलऽ गेलै ।दृश्यता 1,000 मीटर स॑ कम होय गेलै, जब॑ नया हवाई अड्डा क॑ कम स॑ कम 3.5 किमी के रनवे दृश्यता रेंज के जरूरत छै ।काठमांडू म॑ बुद्ध एयर केरऽ फ्लाइट ऑपरेशन कंट्रोल म॑ उपेन्द्र लाल श्रेस्थ नेपाल लेली मौसम नक्शा देखै म॑ व्यस्त छै, आरू ई देखै म॑ व्यस्त छै कि की कोनो महत्वपूर्ण दृश्यता के मुद्दा छै या क्लाउड बिल्डअप छै ।“हर उड़ान स॑ पहल॑ हम्मं॑ ऑपरेशन कंट्रोल सेंटर म॑ उड़ान भर क॑ एनरूट आरू गंतव्य मौसम केरऽ विस्तृत अवलोकन प्रदान करै छियै ।उड़ान विलंब आरू डायवर्सन के मुख्य कारण मौसम के कारक के कारण छै,’’ श्रेष्ठ बताबै छै.जखन दृश्यता नीक होइत छैक तखन काठमांडू में घरेलू उड़ान आमतौर पर पूर्वी वा पश्चिम दिस पहाड़ी दर्रा सं घाटी में प्रवेश करैत छैक.लेकिन, जब॑ स्मॉग या भारी बारिश के कारण दृश्यता 3 किलोमीटर स॑ भी कम होय जाय छै, त॑ पायलटऽ क॑ सख्त वंश प्रोफाइल के बाद दक्षिण स॑ वाद्ययंत्र लैंडिंग करना पड़ै छै ।काठमांडू में एकरऽ मतलब ई छै कि विलंब अनिवार्य छै, कैन्हेंकि विमानऽ क॑ कम स॑ कम 1,000फीट ऊर्ध्वाधर आरू 3 समुद्री मील के क्षैतिज पृथक्करण क॑ बनाए रखना छै ।मतलब विमान चाहे ओ एयरबस 330s हो या ट्विन ओटर, हर 7 मिनट पर मात्र उतरि सकैत अछि ।तखन हवाई जहाज के चक्कर लगाबै के पड़ै छै, कखनो-कखनो घंटों, अपनऽ बारी के इंतजार करतें हुअ॑ ।अगर ईंधन कम दौड़ैत छथि त वैकल्पिक हवाई अड्डा पर डायवर्ट भ जाइत छथि।ई महीना म॑ अब तलक सब दिन केरऽ ८०% स॑ अधिक उड़ान मानक उपकरण केरऽ दृष्टिकोण प॑ उतरी रहलऽ छेलै, जेकरा स॑ यात्री सिनी लेली लंबा देरी होय गेलऽ छेलै ।नेपाल (सीएएन) केरऽ नागरिक उड्डयन प्राधिकरण न॑ बिना नेविगेशनल एड्स के पहाड़ऽ के हवाई क्षेत्रऽ स॑ आबै-जाय के उड़ानऽ म॑ दृश्य उड़ान नियम (वीएफआर) के तहत केवल उड़ान भरना के तहत उड़ान भरै के कोशिश करी रहलऽ छै ।एकरऽ बस मतलब छै कि पायलटऽ क॑ दूरस्थ क्षेत्रऽ म॑ बादल म॑ उड़ै के अनुमति नै छै ।चूँकि काठमांडू आरू तराई या पोखरा केरऽ अधिकांश प्रमुख हवाई अड्डा म॑ नेविगेशनल एड्स छै, ई लेली विमान खराब दृश्यता म॑ इंस्ट्रूमेंट फ्लाइट नियम (आईएफआर) के तहत उड़ान भर॑ सकै छै ।“नेपाल म॑ उड़ान भरना इलाका आरू मौसम के वजह स॑ दुनिया म॑ सबसें चुनौतीपूर्ण छै, लेकिन हमरऽ पायलटऽ क॑ आईएफआर केरऽ आगमन या प्रस्थान लेली सिमुलेटरऽ म॑ प्रशिक्षित करलऽ जाय छै आरू वू नियमऽ के सख्ती स॑ पालन करै छै आरू प्रक्रिया के पालन करै छै,” मनोज केसी, एक प्रशिक्षक कप्तान के साथ बतै छै । बुद्ध हवा।दिलचस्प बात ई छै कि पायलट न॑ पूर्व-मोनसून सीजन क॑ दुपहर के बादल जमा होय के कारण उड़ना अधिक चुनौतीपूर्ण मान॑ छै, जेकरा म॑ अपड्राफ्ट के कारण उथल-पुथल होय छै आरू हवा के कतरनी होय छै ।मानसून में मौसम बेसी स्थिर आ हवा कम होइत छैक यद्यपि दृश्यता कखनो काल रनवे थ्रेशोल्ड पर खराब भ सकैत अछि ।उपेन्द्र लाल श्रेथ कहै छै, “मोनसून स॑ पहल॑ के दौर, जहां मौसम हवादार आरू तूफानी छै, वू उड़ान प॑ काफी प्रभाव डाल॑ सकै छै जेकरा स॑ उबड़-खाबड़ होय सकै छै ।“दे मौसमक चारू कात उड़ान भरबाक लेल मौसमक रादत पर नजरि राखय पड़ैत अछि, आ कखनो काल फेर स’ सड़क पर उतरय पड़ैत अछि।”एक उड़ान के कनिको देरी के कारण अगिला उड़ान के विलंब में चेन इफेक्ट भ जाय छै.एक उड़ान व्यवधान के कार्यक्रम के कारण डोमिनोज इफेक्ट के साथ सब शेड्यूल के व्यवधान के कारण होय छै.एकरऽ साथ ही नेपाल केरऽ हवाई अड्डा, जेकरा म॑ रनवे आरू हवाई अड्डा लाउंज सुविधा भी शामिल छेलै, क॑ दशकों पहल॑ डिजाइन करलऽ गेलऽ छेलै जब॑ हवाई यातायात काफी कम छेलै ।उड़ान के आवृत्ति म॑ घातीय वृद्धि के साथ ई बुढ़ापा के सुविधा बढ़त॑ मांग क॑ समायोजित करै लेली संघर्ष करै छै, जेकरऽ परिणामस्वरूप अधिक स॑ अधिक देरी होय जाय छै ।17 एटीआर-72 आरू -42 विमान के बेड़ा के बावजूद बुद्ध हवा स्वीकार करै छै कि तकनीकी मुद्दा के कारण उड़ानऽ म॑ देरी भी होय सकै छै ।वाहक यात्रीक कें लेल उड़ान कें स्थिति कें बारे मे सूचित रहय कें लेल विभिन्न चैनल उपलब्ध करवय छै.एहि मे कॉल सेंटर, एसएमएस सेवा, आ उड़ान विलंब आ संशोधित प्रस्थान समय पर रियल-टाइम अपडेट वाला मोबाइल ऐप शामिल अछि.देरी के तैयारी के लेल सबस नीक तरीका अछि जे योजना के लचीला बनाबी आ महत्वपूर्ण व्यवसाय के लेल बफर राखल जाय.जून के मध्य तक मई के पूर्व के महीना में पहाड़ के ऊपर उठैत गरम मैदान सं ऊपर के ऊपरी मैदान सं खिलाएल गेल उंच-उंच कमल मेघ अछि.ई सब मजबूत ऊपर आ डाउनड्राफ्ट आ उथल-पुथल स॑ चकरात होय छै ।लेकिन जुलाई-अगस्त-सितंबर के बादल आरू भारी बारिश के मानसूनी के दौरान रनवे के दृश्यता के साथ-साथ ओकरा फिसलन या पानी स॑ भरलऽ होय सकै छै ।बुद्ध एयर केरऽ बरसात केरऽ मौसम केरऽ शुरुआत स॑ पहल॑ सब पायलटऽ लेली एगो विशेष ब्रीफिंग छै जेकरा स॑ हुनका सुरक्षा केरऽ उपाय आरू पूर्वानुमान याद दिलाबै के काम करलऽ जाय सक॑ ।जलवायु परिवर्तन स॑ मौसम केरऽ घटना क॑ भी अधिक चरम बनैलऽ जाय रहलऽ छै, जेकरा ई सप्ताह सिंगापुर केरऽ एयरलाइंस ७७७ स॑ सिंगापुर तलक उड़ान भरतें हुअ॑ देखलऽ गेलऽ छेलै जेकरा म॑ बर्मा के पास रहतें हुअ॑ गंभीर अशांति के सामना करना पड़लै ।बुद्ध एयर केरऽ फ्लाइट डिस्पैच सेंटर म॑ काठमांडू हवाई अड्डा प॑ भी हर समय देश केरऽ हवाई अड्डा प॑ आरू ओकरऽ बीच मौसम केरऽ निगरानी भी छै, आरू पायलटऽ क॑ गो या नो-गो के जानकारी उपलब्ध करै छै ।बुद्ध एयर केरऽ फ्लाइट डिस्पैचर उमेश खदका बतबै छै, “हमरा पास एगो जापानी सॉफ्टवेयर छै जे हमरा सब क॑ अपनऽ विमानऽ क॑ लाइव ट्रैक करै म॑ मदद करै छै, लेकिन मौसम केरऽ स्थिति के बारे म॑ भी हमरा सब क॑ ब्रीफ करै छै ।"
