title,description,published date,url,publisher.href,publisher.title,full_article,images,translated
Nepal forms emergency relief team to chalk out strategy amid tension in West Asia - theweek.in,Nepal forms emergency relief team to chalk out strategy amid tension in West Asia  theweek.in,2026-03-01 16:04:55,https://news.google.com/rss/articles/CBMi4AFBVV95cUxQS2VyQ012ODJqR2RRUkhneVItWERqOC1QMXFjQ2I2Sm9SR0NSOGliSVNSSWRtak4wcDJjbnRKY1ZSM3JMYVpZNWZfWEFqajdMa1M0VXBoUDhWalhTT3VONHo4aHhhcVZ2bmFmQjBrLVBudURJMlEwOU9XaE81M2dhbjB0Mk1Yd2dTZnZUTTktQWMyZTNaeC0wWWlibXlCa2pZWmRuR3VfRGNUMUF3M195U0E2YWE4a3JLYmV1T1IzNkpWbzMyZzlPWkxSN3pLc3Jtb1IxQWtEV2tEWWtUaTYyUtIB5gFBVV95cUxNZEdUUHNOVldfUkZqZS1idkRHbURkSFNLV2ZQQy03clR3Z0haMWlHWnNKbElsMVU4RHJFNUVoZS1VdmRyQkYwRWlaYkFnckJYLTBTNUJ4NnBrZncxZzBvVTRySFcyUE1URlJkRjVyUWY5NFpEWUhKYnZ3bzY1NTVob1RiY1dmWEFPUjY5eEtteWdJSTBmWDNSdG1Nd3RYWU0wX01FcFdTb1hSWi1HM3RMWG5Sall5SHBGUk1hY1B3R2E3VnlPbGh3YnYtZ1NTSG9jVXo0Mm9JYWFsNy1zSkRpbHowekI0dw?oc=5&hl=en-US&gl=US&ceid=US:en,https://www.theweek.in,theweek.in,"Kathmandu, Mar 1 (PTI) Nepal on Sunday formed an emergency team and said a relief strategy will be formulated based on the war situation in West Asia even as it asserted that all its nationals in different Gulf countries are safe.

Nepal on Saturday told its citizens in West Asian countries to “stay vigilant, exercise caution and maintain regular contact with the community” as tension after joint US-Israel strikes against Iran escalated to other countries in the region.

The Ministry of Foreign Affairs said that more than 1.7 million Nepalese nationals, who are currently residing in different countries in West Asia, are safe.

On Sunday, Ram Kaji Khadka, joint secretary and chief of the foreign affairs ministry's Central Asia, West Asia and Africa Division, told media persons that the government accords top priority to the safety of its citizens in the Gulf counties.

An update on Nepali nationals in the region was presented during the press briefing, outlining their demographic profile, current conditions and ongoing efforts.

“A Whatsapp group has been formed to keep in touch with the chiefs of Nepalese missions stationed in the countries concerned. The ministry has also initiated development of an online registration platform in coordination with the consular department,” Khadka said.

The ministry also formed an emergency relief team headed by foreign secretary Amrit Bahadur Rai.

A relief strategy will be formulated based on the possible war environment, conflict period, steps to be taken by neighbouring countries and initiatives taken by the concerned countries, the ministry said.

The highest number of Nepali nationals -- around 7,00,000 -- are currently residing in the United Arab Emirates.

The remaining one million Nepalese are residing in Saudi Arab, Qatar, Kuwait, Oman, Bahrain, Iraq, Cyprus, Israel, Egypt and Lebanon, according to the Foreign Ministry.

On the occasion, joint secretary Krishna Prasad Dhakal said, all the Nepalese residing in the Gulf region are safe till now.

Spokesperson at the ministry, Lok Bahadur Paudel said that the ministry is closely watching the developments in the Gulf counties and asked all concerned to maintain patience.

Meanwhile, the government said it has, for the time being, suspended issuing labour permits for Nepali workers travelling to Gulf countries amidst growing tension in West Asia.

Chandra Bahadur Siwakoti, spokesperson at the Department of Foreign Employment, said the decision will remain effective until further notice.","{'https://img.theweek.in/etc.clientlibs/theweek/global-clientlibs/clientlibs-general/resources/images/week-default.jpg', 'https://certify.alexametrics.com/atrk.gif?account=feCLu1WyR620WR', 'https://www.theweek.in/content/dam/week/wire-updates/pti-preview-theweek.jpg'}","काठमांडू, मिथिला मिरर: नेपाल रविदिन आपातकालीन टीम बनाकय पश्चिम एशिया के युद्ध के स्थिति के आधार पर राहत रणनीति बनाबय के बात कहलक अछि, जखन कि ओ विभिन्न खाड़ी देश के अपन सब नागरिक के सुरक्षित रहला पर जोर देलक अछि।

नेपाल न॑ शनिदिन पश्चिम एशियाई देशऽ म॑ अपनऽ नागरिकऽ स॑ कहलकै कि ईरान प॑ अमेरिका-इजरायल केरऽ संयुक्त हमला के बाद ई क्षेत्र केरऽ अन्य देशऽ म॑ तनाव बढ़ी क॑ “सतर्क रहना, सावधानी बरतै आरू समुदाय के साथ नियमित संपर्क बनाबै” ।

विदेश मन्त्रालय जनौलक अछि जे सम्प्रति पश्चिम एशियाके विभिन्न देशमे रहनिहार १७ लाख सँ बेसी नेपाली नागरिक सुरक्षित अछि ।

रविदिन विदेश मंत्रालय केरऽ मध्य एशिया, पश्चिम एशिया आरू अफ्रीका प्रभाग केरऽ संयुक्त सचिव आरू प्रमुख राम काजी खड्का न॑ मीडिया व्यक्ति सिनी स॑ कहलकै कि सरकार खाड़ी केरऽ काउंटी म॑ अपनऽ नागरिकऽ के सुरक्षा क॑ सर्वोच्च प्राथमिकता दै छै ।

प्रेस ब्रिफिंग के दौरान क्षेत्र के नेपाली नागरिक के बारे में अपडेट प्रस्तुत करलऽ गेलै, जेकरा म॑ हुनकऽ जनसांख्यिकीय प्रोफाइल, वर्तमान स्थिति आरू जारी प्रयास के रूपरेखा देलऽ गेलै ।

खड्का कहलनि जे, “संबंधित देश मे तैनात नेपाली मिशन के प्रमुख के संपर्क मे रहबाक लेल व्हाट्सएप ग्रुप के गठन कायल गेल अछि। मंत्रालय वाणिज्य दूतावास विभाग के समन्वय मे ऑनलाइन पंजीकरण मंच के विकास सेहो शुरू केलक अछि।”

मंत्रालय विदेश सचिव अमृत बहादुर राय के नेतृत्व मे आपातकालीन राहत टीम के गठन सेहो केलक अछि।

मन्त्रालय जनौलक अछि जे संभावित युद्ध वातावरण, संघर्ष अवधि, पड़ोसी देश द्वारा उठाबय बला कदम आ संबंधित देश द्वारा कयल गेल पहल के आधार पर राहत रणनीति बनाओल जायत।

सबसँ बेसी नेपाली नागरिक -- लगभग ७,००,००० -- एखन संयुक्त अरब अमीरात मे निवास क रहल अछि ।

शेष दस लाख नेपाली सऊदी अरब, कतार, कुवैत, ओमान, बहरीन, इराक, साइप्रस, इजरायल, मिस्र आ लेबनान मे रहनिहार विदेश मन्त्रालय जनौलक अछि ।

एहि अवसर पर संयुक्त सचिव कृष्णप्रसाद ढकाल कहलनि जे, खाड़ी क्षेत्र मे निवास करय वाला सब नेपाली एखन धरि सुरक्षित अछि।

मंत्रालय के प्रवक्ता लोक बहादुर पौडेल खाड़ी के काउंटी के घटनाक्रम पर मंत्रालय बारीकी सं नजरि द रहल अछि आओर संबंधित सभ सं धैर्य राखय लेल कहलखिन्ह.

एम्हर सरकार कहलनि जे, पश्चिम एशिया मे बढ़ैत तनाव के बीच खाड़ी देश जाय वाला नेपाली मजदूर के श्रम परमिट जारी करब फिलहाल बंद क देलक अछि।

विदेश रोजगार विभागक प्रवक्ता चन्द्रबहादुर सिवाकोटी आगूक सूचना धरि ई निर्णय प्रभावी रहत बतौलनि ।"
