title,description,published date,url,publisher.href,publisher.title,full_article,images,translated
From TikTok to Cannes: How ‘Elephants in the Fog’ Made Nepal’s Historic Un Certain Regard Breakthrough - Variety,From TikTok to Cannes: How ‘Elephants in the Fog’ Made Nepal’s Historic Un Certain Regard Breakthrough  Variety,2026-05-18 06:29:00,https://news.google.com/rss/articles/CBMirgFBVV95cUxQcG14YmVCQkZJN0tUSnNlNzFGenZVTFpWbkZmZ2NvaE1md0ZvaHAyX1MwR0hITFFiUFpxZmNIRFhtVk1QV21nc1Y3Y0k3SV9rVkgtSk5sODFnc0Y0RVBIT2lUSDFvZ2hwcWU4cm1aR0JIOXVnWWlPRVpVUmRBNWFKajdqZWl2NGRLNzZROVlqMVlIemlNZ0ljUWVzbWdxNllBS2FOYmNwNHpCVUxHTVE?oc=5&hl=en-US&gl=US&ceid=US:en,https://variety.com,Variety,"During Nepal’s pandemic lockdowns, Abinash Bikram Shah found himself deep in a TikTok rabbit hole, watching videos posted by Kinnars – members of Nepal’s ancient third-gender community – dancing, joking, performing with unselfconscious joy. The comment sections beneath those videos were frequently vile. The Kinnars kept posting.

“That really struck me,” Shah tells Variety . “I didn’t know what made them keep on going, making these videos, even though people had such hate remarks and bad comments.”

blogherads.adq.push(function () { blogherads .defineSlot( 'medrec', 'gpt-variety-article-mid-article-uid0' ) .setTargeting( 'pos', [""mid-article1"",""mid-articleX"",""mid"",""mid-article""] ) .setTargeting( 'viewable', 'yes' ) .setSubAdUnitPath(""ros\/mid-article"") .addSize([[300,250],[2,2],[300,251],[2,4],[4,2],[320,480],[620,366]]) .setClsOptimization(""minsize"") ; });

Related Stories Inside NBCUniversal's Upfront: Vin Diesel Surprise, Tina Fey Sets Up NBC's 100th Birthday Bash and More at 'Most Glamorous Midmorning of the Year' 'Rockford Files' Reboot, Cop Drama 'Line of Fire' Picked Up to Series at NBC

That contradiction between public hostility and private resilience became the first spark of “Elephants in the Fog,” which premieres in Un Certain Regard at the Cannes Film Festival – the first Nepali film to be selected for the section.

Popular on Variety if ( !window.pmc.harmony?.isEventAdScheduledTime() ) { pmcCnx.cmd.push(function() { pmcCnx({ settings: { plugins: { pmcAtlasMG: { iabPlcmt: 2, } } }, playerId: 'fdaee7b3-292f-4a85-89bb-29a56b567de3', playlistId: '073c6e70-0010-4b87-92d0-d891f87f5cd8', }).render(""connatix_contextual_player_div""); }); } else { // This should only be get called when page cache is not cleared and it's event time. window.pmc.harmony?.switchToHarmonyPlayer(); }

The film is set in Thori, a forested village in Nepal’s southern Terai plains, far from the mountain imagery that defines the country in the international imagination. Pirati – the word means “love” in Nepali – is the matriarch of a small Kinnar household, bound by her community’s vows of celibacy even as she falls for the local drum master. When wild elephants begin their nightly raids on the village crops, the residents organize patrols. One of Pirati’s daughters disappears on her watch. The police are unmoved. She is left to look alone.

Shah describes himself as a writer first, a director only when a story is close enough to demand it. He co-wrote Min Bahadur Bham’s “Shambhala,” which competed at Berlin in 2024, and “The Black Hen,” Nepal’s Oscar submission that premiered in Venice Critics Week. His short “Lori” earned a Special Mention at Cannes in 2022, making him the first Nepali filmmaker in the festival’s official selection. This year’s Un Certain Regard invitation moves the foothold considerably further.

blogherads.adq.push(function () { blogherads .defineSlot( 'medrec', 'gpt-dsk-tab-mid-article2-uid1' ) .setTargeting( 'pos', [""mid"",""mid-article2"",""mid-articleX""] ) .setTargeting( 'viewable', 'yes' ) .setSubAdUnitPath(""ros\/mid-article2"") .addSize([[320,480],[300,250],[300,251],[2,4],[4,2],[620,366]]) .setClsOptimization(""minsize"") ; });

The honor sits uneasily alongside a sharper anxiety. “It’s between pride and pressure,” he says. “The pressure for me is more about the story – because I’m a man, I’ve done the story of a trans woman, and I really want to know, honestly from the audience, how honestly I’ve told the story.”

The weight of that responsibility shaped every stage of the production, beginning with casting. Shah had been spending time with Kinnar communities across Nepal for nearly two years before he encountered Puspa Thing Lama at a community function – before, he says, he had even finished the screenplay. Lama is a veteran LGBTQIA+ rights advocate who has worked with the Blue Diamond Society Nepal since 2006. She had never acted. Shah was not deterred.

“It was like love at first sight,” he says. “She is so charming. When she is joyful, she is so joyful. When she is silent, her presence in the silence works so well.”

The path from that instinct to the finished performance was long and complicated. Lama had spent years absorbing the heightened emotional register of Nepali and Indian television drama, and her early workshop sessions leaned in that direction. Shah spent months drawing her away from technique and toward something more exposed. The breakthrough, he says, came through trust rather than craft instruction – the moment Lama understood that what she was being asked to do was not perform a character but bring her own history into the frame.

A parable offered by one of the Kinnar women Shah interviewed during his research stayed with him throughout. She described a group of blind men trying to understand the shape of an elephant by touch: one feels the leg and calls it a pillar, another grasps the tail and imagines a rope. The outside world, she said, approaches the Kinnar community the same way – perceiving only a fragment and calling it the whole.

“Most importantly, I have to show them as a human being like anyone of us in the world,” Shah says.

The elephants that crowd the edges of the film are more than atmosphere. In the Terai region, they are a practical reality – intelligent, matriarchal animals that farmers fear and Hindu tradition venerates through the figure of Ganesha. Shah was drawn to the same logic governing both: tolerated within their designated space, threatening the moment they cross a boundary someone else has drawn. When he described the parallel to Lama, she told him she recognized it from her own life – that even now, living openly as a trans woman while working within an NGO, she sometimes feels like an elephant carrying something enormous inside a set of rules not designed for her.

blogherads.adq.push(function () { blogherads .defineSlot( 'medrec', 'gpt-variety-article-mid-articleX-uid2' ) .setTargeting( 'pos', [""btf"",""mid-articleX"",""mid""] ) .setTargeting( 'viewable', 'yes' ) .setSubAdUnitPath(""ros\/mid-articleX"") .addSize([[320,480],[300,250],[300,251],[620,366]]) .setClsOptimization(""minsize"") ; });

To contain and observe those elephants, the villagers use firecrackers, electric fences, and – in one image Shah finds particularly resonant – eyes painted onto tree trunks, a human appeal to the forest to look back and see them.

Shah worked with two editors on the film: the experienced Andrew Bird and Paris J. Ludwig, who is herself a trans woman, and whose perspective Shah considered essential to the material. Cinematographer Noé Bach took visual cues from Nan Goldin’s photography of the 1980s and ’90s, aiming for images that feel found rather than arranged. Composer Frédéric Alvarez built a score that moves between traditional Nepali sounds and something more fractured and modern, designed to track Pirati’s inner journey from quiet containment to something rawer.

The film arrives at a moment when gender non-conforming people are being openly weaponized in political discourse across multiple countries. Shah is clear-eyed about the film’s relationship to that context, and equally clear that it was not the engine of the work.

“To tell a story about the Kinnar community in a society that often prefers they remain invisible is, by its nature, a political act,” he says. “But I didn’t want Pirati to be a ‘political symbol’. I wanted her to be a woman who is tired, who is in love, and who is searching for a home. My ‘politics’ is the belief that the most radical thing an artist can do is to treat a character from the margins with the same complexity and tenderness as anyone else. For me, politics must always grow out of the human truth, not the other way around, otherwise it would be an agenda.”

“Elephants in the Fog” is an international co-production across Nepal, Germany, Brazil, France, and Norway, produced by Underground Talkies Nepal, Les Valseurs, and Die Gesellschaft DGS. International sales are handled by Best Friend Forever. French distribution will be handled by Les Valseurs Distribution and Arizona Distribution.","{'https://variety.com/wp-content/uploads/2026/05/Elephants-in-the-Fog.jpg?w=1000&h=563&crop=1', 'https://variety.com/wp-content/uploads/2026/05/Elephants-in-the-Fog.jpg?w=1000&h=667&crop=1', 'https://pixel.quantserve.com/pixel?a.1=&a.2=p-31f3D02tYU8zY', 'https://px.ads.linkedin.com/collect/?pid=1429113&fmt=gif', 'https://sb.scorecardresearch.com/p?c1=2&c2=6035310&c4=&cv=3.9&cj=1', 'https://variety.com/wp-content/themes/pmc-variety-2020/assets/public/lazyload-fallback.gif'}","नेपाल केरऽ महामारी लॉकडाउन के दौरान अबीनाश बिक्रम शाह न॑ किन्नर – नेपाल केरऽ प्राचीन तृतीय लिंग समुदाय केरऽ सदस्यऽ द्वारा पोस्ट करलऽ गेलऽ वीडियो देखतें हुअ॑ टिकटोक केरऽ खरगोश केरऽ छेद म॑ गहराई स॑ पाबी गेलै, जेकरा म॑ नचना, मजाक करना, निस्वार्थ आनन्द के साथ प्रदर्शन करना छेलै । ओहि वीडियो सबहक नीचा कमेंट सेक्शन बेर-बेर नीच होइत छल। किन्नर लोकनि पोस्ट करैत रहलाह।

शाह वैरायटी के कहैत छथि, “ई बात हमरा सचमुच आहत केलक। “हमरा नहि बुझल छल जे कोन बात हुनका सभ केँ आगू बढ़बैत रहलाह, ई वीडियो बनबैत रहलाह, भले लोक मे एहन नफरत’क टिप्पणी आ खराब टिप्पणी होइत छल.”

blogherads.adq.push(function () { blogherads .defineSlot( 'medrec', 'gpt-variety-article-mid-article-uid0' ) .setTargeting( 'pos', [""mid-article1"",""mid-articleX"",""mid"",""mid-article""] ) .setTargeting('दृश्यमान', 'हाँ' ) .setSubAdUnitPath (""ros \ / मध्य लेख"") .addSize ([[300,250], [2,2], [300,251], [2,4], [4,2], [320,480], [620,366]]) .setClsOptimization (""मिनट आकार"") ; });

एनबीसीयूनिवर्सल केरऽ अपफ्रंट के अंदर संबंधित कहानी: विन डीजल सरप्राइज, टीना फे न॑ एनबीसी केरऽ 100वां जन्मदिन केरऽ बैश आरू बहुत कुछ के सेटअप करलकै 'साल केरऽ सबसें ग्लैमरस मिडमॉर्निंग' 'रॉकफोर्ड फाइल्स' रिबूट, एनबीसी म॑ सीरियल केरऽ पोस ड्रामा 'लाइन ऑफ फायर' उठाय लेलकै

सार्वजनिक दुश्मनी आरू निजी लचीलापन के बीच के वू विरोधाभास “एलिफेंट इन द फॉग” के पहिलऽ चिंगारी बनलै, जेकरऽ प्रीमियर कान फिल्म फेस्टिवल म॑ अन सर्टेन रिगार्ड म॑ होय छै – जे ई खंड लेली चुनलऽ गेलऽ पहिलऽ नेपाली फिल्म छेकै ।

विविधता पर लोकप्रिय if ( !window.pmc.harmony?.isEventAdScheduledTime () ) { pmcCnx.cmd.push (function () { pmcCnx ({ सेटिंग्स: { प्लगइन्स: { pmcAtlasMG: { iabPlcmt: 2, } } }, खिलाड़ी आईडी: 'fdaee7b3-292f-4a85-89bb-29a56b567de3', प्लेलिस्टआईडी: '073c6e70-0010-4b87-92d0-d891f87f5cd8', }).रेंडर (""connatix_contextual_player_div""); } else { // एकरा तखने कॉल कएल जेबाक चाही जखन पृष्ठ कैश साफ नहि कएल गेल अछि आओर ई घटना समय अछि. विंडो.पीएमसी.समरसता?.सद्भाव खिलाड़ी में स्विच (); } .

फिल्म केरऽ सेट नेपाल केरऽ दक्षिणी तराई मैदान केरऽ जंगली गाँव थोरी म॑ छै, जे पहाड़ी बिम्ब स॑ दूर छै जे अंतरराष्ट्रीय कल्पना म॑ देश क॑ परिभाषित करै छै । पिराती – शब्दक अर्थ नेपाली मे “प्रेम” – एकटा छोट सन किन्नर घरक मातृसत्ता छथि, जे स्थानीय ढोलक मालिक पर पड़ैत काल सेहो अपन समुदायक ब्रह्मचर्यक व्रत सँ बान्हल छथि | जखन जंगली हाथी गामक फसल पर राति मे छापामारी शुरू करैत अछि तखन निवासी गश्त के आयोजन करैत अछि । पिराती’क एकटा बेटी ओकर घड़ी पर गायब भ’ जाइत छैक. पुलिस अविचल अछि। असगरे देखैले रहि गेल छथि।

शाह पहिने अपना केँ लेखक, निर्देशक तखनहि बतबैत छथि जखन कोनो कथा एतेक नजदीक हो जे ओकर मांग क' सकैत अछि । मिन बहादुर भाम केरऽ “शंभला” केरऽ सह-लेखन करलकै, जे २०२४ म॑ बर्लिन म॑ प्रतिस्पर्धा करलकै, आरू “द ब्लैक हेन”, नेपाल केरऽ ऑस्कर सबमिशन जेकरऽ प्रीमियर वेनिस क्रिटिक्स वीक म॑ भेलै । हुनकऽ लघु फिल्म “लोरी” क॑ २०२२ म॑ कान म॑ स्पेशल मेन्शन मिललै, जेकरा स॑ हुनका महोत्सव केरऽ आधिकारिक चयन म॑ पहलऽ नेपाली फिल्म निर्माता बनलै । एहि बेरक अन सर्टेन रिगार्ड के आमंत्रण एहि पैर के मैदान के काफी आगू बढ़ाबैत अछि.

blogherads.adq.push(function () { blogherads .defineSlot( 'medrec', 'gpt-dsk-tab-mid-article2-uid1' ) .setTargeting( 'pos', [""mid"",""mid-article2"",""mid-articleX""] ) .setTargeting( 'दृश्यमान', 'हाँ' ) .setSubAdUnitPath (""ros \ / मध्य लेख 2"") .addSize ([[320,480], [300,250], [300,251], [2,4], [4,2], [620,366]]) .setClsOptimization (""मिनसाइज"") ; });

सम्मान एकटा तीक्ष्ण चिंता के संग-संग बेचैनी स बैसल अछि। ओ कहैत छथि, “ई घमंड आ दबावक बीच अछि।” “हमरा लेल दबाव कथा पर बेसी अछि – कारण हम एकटा पुरुष छी, हम एकटा ट्रांस महिलाक कहानी केने छी, आ हम सचमुच जानय चाहैत छी, ईमानदारी स’ दर्शक स’, जे हम कथा कतेक ईमानदारी स’ कहने छी.”

ओहि जिम्मेदारी के वजन प्रोडक्शन के हर चरण के आकार देलक, जेकर शुरुआत कास्टिंग स भेल। शाह लगभग दू साल स नेपाल भरिक किन्नर समुदाय क संग समय बिता रहल छलाह, ताहि स पहिने हुनकर सामना एकटा सामुदायिक समारोह मे पुस्पा थिंग लामा स भेल छल – एहि स पहिने, हुनकर कहब अछि जे ओ पटकथा तक पूरा क लेने छलाह। लामा एलजीबीटीक्यूआईए+ अधिकार केरऽ दिग्गज छै जे २००६ स॑ ब्लू डायमंड सोसाइटी नेपाल के साथ काम करी रहलऽ छै । शाह हतोत्साहित नहि भेलाह।

ओ कहैत छथि जे पहिल नजरि मे प्रेम जेकाँ छल। ""ओ एतेक आकर्षक छथि। जखन हर्षित होइत छथि त' एतेक आनन्दित होइत छथि, जखन चुप रहैत छथि त' मौन मे हुनकर उपस्थिति एतेक नीक काज करैत अछि।""

ओहि वृत्ति सँ समाप्त प्रस्तुति धरि के बाट नम्हर आ जटिल छल । लामा नेपाली आरू भारतीय टेलीविजन नाटक केरऽ ऊंचऽ भावनात्मक रजिस्टर क॑ आत्मसात करै म॑ सालों बिताय देल॑ छेलै, आरू ओकरऽ प्रारंभिक कार्यशाला सत्र वू दिशा म॑ झुकलऽ छेलै । शाह महीनों तक हुनका तकनीक स दूर आ किछु बेसी उजागर दिस खींचैत रहलाह। हुनकऽ कहना छै कि ई सफलता शिल्प निर्देश के बजाय विश्वास के माध्यम स॑ मिललै – जब॑ लामा क॑ ई बात के समझ म॑ आबी गेलै कि ओकरा स॑ जे करलऽ जाय रहलऽ छै, वू कोनो पात्र के प्रदर्शन नै करी क॑ अपनऽ इतिहास क॑ फ्रेम म॑ लाना छै ।

शाह केरऽ शोध के दौरान साक्षात्कार लेन॑ वाला किन्नर महिला म॑ स॑ एगो द्वारा देलऽ गेलऽ दृष्टांत पूरा समय म॑ हुनका साथ रहलै । ओ हाथीक आकार केँ स्पर्श सँ बुझबाक प्रयास मे आन्हर लोकक समूहक वर्णन केलनि : एकटा टांग केँ महसूस करैत अछि आ ओकरा खंभा कहैत अछि, दोसर पूँछ पकड़ैत अछि आ रस्सीक कल्पना करैत अछि | बाहरी दुनिया, ओ बजलीह, किन्नर समुदाय के सेहो ओहिना संपर्क करैत अछि – मात्र एकटा टुकड़ा के बूझि क’ ओकरा पूरा कहैत अछि.

शाह कहैत छथि जे सबस पैघ गप इ अछि जे हमरा हुनका सब कए दुनिया क हमरा सब मे स कोनो व्यक्ति जेकां एकटा इंसान क रूप मे देखाबय पड़त।

फिल्मक किनार पर जे हाथी भीड़ लगाबैत अछि से वातावरण सँ बेसी अछि । तराई क्षेत्र में ई सब एकटा व्यावहारिक यथार्थ छै – बुद्धिमान, मातृसत्तात्मक जानवर जेकरा किसान डरै छै आरू हिन्दू परंपरा गणेश के आकृति के माध्यम स॑ पूजै छै । शाह दुनू केँ नियंत्रित करय बला तर्क दिस आकर्षित भेलाह : अपन निर्धारित स्थानक भीतर सहन कयल गेल, जखन ओ कोनो आन द्वारा खींचने सीमा पार क' क' धमकी दैत छल. जखन ओ लामा के समानांतर के वर्णन केलनि त ओ हुनका कहलखिन्ह जे ओ एकरा अपन जीवन सं चिन्हलखिन्ह – जे एखनहु कोनो एनजीओ के भीतर काज करैत खुलि क ट्रांस महिला के रूप मे जीबैत हुनका कखनो काल एहन लागैत छनि जेना कोनो हाथी कोनो विशाल नियम के सेट के भीतर ल क चलैत हो जे हुनका लेल नहिं बनाओल गेल अछि.

blogherads.adq.push(function () { blogherads .defineSlot( 'medrec', 'gpt-वैरायटी-लेख-मध्य-लेखX-uid2' ) .setTargeting( 'पोस', [""btf"",""मध्य-लेखX"",""मध्य""] ) .setTargeting( 'दृश्यमान', 'हाँ' ) .setSubAdUnitPath (""ros \ / मध्य लेखX"") .addSize ([[320,480], [300,250], [300,251], [620,366]]) .setClsOptimization (""मिनसाइज"") ; });

ओहि हाथी सब के रोकय आ देखय लेल गामक लोक पटाखा, बिजली के बाड़, आ – एकटा छवि में शाह के विशेष रूप सं गुंजायमान बुझाइत छनि – गाछ के तने पर रंगल आँखि, जंगल के प्रति मानवीय अपील जे पाछू घुमि क देखय.

शाह न॑ ई फिल्म प॑ दू संपादक के साथ काम करलकै: अनुभवी एंड्रयू बर्ड आरू पेरिस जे लुडविग, जे खुद एगो ट्रांस महिला छै, आरू जेकरऽ परिप्रेक्ष्य शाह न॑ सामग्री लेली आवश्यक मानलकै । सिनेमाटोग्राफर नोए बाख न॑ 1980 आरू ’90 के दशक केरऽ नैन गोल्डिन केरऽ फोटोग्राफी स॑ दृश्य संकेत लेलकै, जेकरऽ लक्ष्य छेलै कि ऐन्हऽ छवि के व्यवस्था करलऽ जाय के बजाय मिललऽ लगै । संगीतकार फ्रेडरिक अल्वारेज़ एकटा एहन स्कोर बनौलनि जे पारंपरिक नेपाली ध्वनि आ किछु बेसी फ्रैक्चर आ आधुनिक चीजक बीच चलैत अछि, जे पिरातीक भीतरक यात्रा केँ शांत कंटेनमेंट सँ किछु कच्चा लोक धरि ट्रैक करबाक लेल डिजाइन कएल गेल अछि |

ई फिल्म ऐन्हऽ क्षण म॑ आबी रहलऽ छै जब॑ कई देशऽ म॑ लैंगिक गैर-अनुरूप लोगऽ क॑ राजनीतिक प्रवचन म॑ खुल क॑ हथियारबंद करलऽ जाय रहलऽ छै । शाह के नजरि ओहि संदर्भ स’ फिल्म के संबंध पर स्पष्ट छनि, आ ओतबे स्पष्ट जे ई काज के इंजन नहि छल.

हुनी कहै छै, “जे समाज अक्सर ओकरा अदृश्य रहना पसंद करै छै, ओकरा म॑ किन्नर समुदाय के बारे म॑ कहानी कहना, अपनऽ स्वभाव के हिसाब स॑ एगो राजनीतिक काम छै । “मुदा हम नहि चाहैत छलहुँ जे पिराती कोनो ‘राजनीतिक प्रतीक’ हो. हम चाहैत छलहुँ जे ओ एकटा एहन महिला होथि जे थाकि गेल होथि, जे प्रेम मे छथि, आ जे घरक खोज मे छथि. हमर ‘राजनीति’ ई विश्वास अछि जे एकटा कलाकार सबसँ कट्टरपंथी काज क’ सकैत अछि जे कोनो कलाकार केँ हाशिया सँ ओहिना जटिलता आ कोमलता सँ व्यवहार करबाक चाही जतेक कियो आन. हमरा लेल राजनीति केँ सदिखन मानवीय सत्य सँ बाहर बढ़बाक चाही, एकर उल्टा नहि, अन्यथा एजेंडा होयत।”

“एलिफेंट इन द फॉग” पूरा नेपाल, जर्मनी, ब्राजील, फ्रांस, आरू नॉर्वे म॑ एगो अंतर्राष्ट्रीय सह-निर्माण छेकै, जेकरऽ निर्माण अंडरग्राउंड टॉकीज नेपाल, लेस वालसेर्स, आरू डाई गेसेलशैफ्ट डीजीएस न॑ करलकै । अंतर्राष्ट्रीय बिक्री बेस्ट फ्रेंड फॉरएवर द्वारा संभालल जाइत अछि। फ्रेंच वितरण लेस वालसेर्स वितरण आ एरिजोना वितरण द्वारा संभालल जायत।"
